,date,title,summary
114,"March 11, 2020",Oil shock threatens to take wind out of sails for renewables shift,"...lower oil prices.
While renewable energy projects typically generated lower returns than oil and gas exploration, they also offered long-term price stability that could..."
115,"March 10, 2020",Trump summons top bankers for emergency coronavirus meeting,"...the Lehman Brothers collapse, after a 30 per cent plunge in the oil price exacerbated underlying fears about a global economic slump because of coronavirus..."
116,"March 10, 2020",Saudi-Russia price war puts $110bn of US energy bonds on the brink,"...Nearly $110bn of bonds sold by energy companies in the US have fallen into distressed territory, after a plunge in the oil price left investors..."
117,"March 10, 2020",City of London grandees seek stronger coronavirus action,"...as the death toll has risen. The impact worsened this week after oil price war broke out between Saudi Arabia and Russia.
Anne Richards, who..."
118,"March 10, 2020",Why Saudi Arabia’s Opec allies will be worst hit by oil crash,"...Saudi Arabia’s aggressive oil price war ostensibly targets Russia, which baulked at the kingdom’s request that Opec members and Moscow deepen and prolong..."
119,"March 10, 2020",M&G warns on capital position as profits fall,"...challenged” by the recent market volatility caused by coronavirus fears and the oil price shock.
The group planned to launch a voluntary redundancy scheme to..."
120,"March 10, 2020",TP ICAP hits record trading volumes from market volatility,"...last week as rapidly shifting sentiment on global interest rates and the oil price crash roiled prices on its main markets. 
The UK group’s..."
121,"March 10, 2020","Financial markets ‘not broken’, says Goldman Sachs finance chief","...Goldman was being “vigilant’ around its exposure to the energy sector, after oil prices plummeted this week, and hospitality, where the coronavirus is emptying out..."
122,"March 10, 2020",Lebanon’s sovereign default leaves creditors facing big losses,...largest single holding is an Ecuadorean dollar bond that has seen its price fall by more than a third over the past week as oil...
123,"March 10, 2020",Standard Life Aberdeen suffers almost £60bn of withdrawals,"...worth in the volatile market conditions caused by the spreading coronavirus and oil price war. “Even through the turbulence, Gars has delivered absolute returns and..."
124,"March 10, 2020",Markets Now - LIVE - Tuesday 10th March 2020,"...Wuhan new coronavirus cases, or to the mixed blessing of a rising oil price. Equities are down, though today they’re up. Here’s a..."
125,"March 10, 2020",Xi Jinping visits Wuhan as Chinese coronavirus cases plummet,"...On Tuesday, food inflation hit a 12-year high, while industrial input prices slipped amid plunging global oil prices.
The official food price index rose..."
126,"March 10, 2020","Markets roiled, Italy on lockdown, US shale pain","...A crash in the price of oil rocked financial markets that were already reeling from the effects of the coronavirus. Meanwhile, Italy extended its quarantine..."
127,"March 10, 2020",Donald Trump floats tax cuts as response to coronavirus impact,"...plunge in US stocks. “ Saudi Arabia and Russia are arguing over the price and flow of oil. That, and the Fake News, is the reason..."
128,"April 9, 2020",Fed action boosts equity and credit markets,"...sized businesses”, said Seema Shah, chief strategist at Principal Global Investors.Separately, oil prices swung wildly as traders monitored developments from a meeting between Saudi..."
129,"April 8, 2020",EU carbon emissions tumble during lockdowns,"...introducing a carbon tax, for example, at a time of conveniently low oil prices. Some have even suggested that more lives may be saved by..."
130,"April 7, 2020",Equity market rally runs out of steam,"...0.05 percentage points to 0.72 per cent. Yields fall as prices rise.Oil prices slipped, following Monday’s rally on hopes that Saudi..."
131,"April 7, 2020",US to review troop presence in Iraq,"...he said was aimed at supporting Iraq, which is suffering from falling oil prices and seeks to stave off the resurgence of jihadi group Isis..."
132,"April 6, 2020",US stocks in sharp late rally on hopes virus is slowing,...lows and “keep a defensive sector allocation”.Equities reached higher even as oil prices slipped on doubts that Saudi Arabia and Russia could quickly reach...
133,"April 5, 2020",Ecuador’s virus-hit Guayaquil is grim warning for region,"...obligations. The Andean nation has been hit hard by the fall in oil prices and, as the only dollarized country in South America, is hamstrung..."
134,"April 3, 2020",Activists accuse Algeria of using Covid-19 to clamp down on protests,...as grapples with the double blow of the coronavirus outbreak and plunging oil prices.The government announced it was cutting spending by 30 per cent...
135,"April 3, 2020",Indian corporates hit by coronavirus lockdown declare force majeure ,"...have been hit by both the viral outbreak and a plunge in oil prices this year. Arun Bhaskar, executive member of the Chemicals & Petrochemicals Manufacturers..."
136,"March 31, 2020",US proposes interim government to break Venezuela deadlock,"...fresh challenge to the Maduro regime, coinciding with a crash in global oil prices which has deprived Caracas of most of its sole source of..."
137,"March 31, 2020",US stocks end the quarter down 20% in biggest drop since 2008,"...that economic activity improved modestly relative to February’s dismal showing.” Elsewhere, oil prices rose after a tumultuous start to the week in which West..."
138,"March 27, 2020",Vedanta chief executive resigns ,"...$4.5bn investment plan for Vedanta Ltd’s oil exploration arm, Cairn Oil and Gas, in spite of the crash in oil prices.A self..."
139,"March 26, 2020",Nicolai Tangen tapped to lead Norway’s $930bn oil fund,...itself has been hard hit by coronavirus and a sharp fall in oil prices. Unemployment has more than quadrupled in the past two weeks alone...
140,"March 25, 2020",Vladimir Putin postpones vote on extending his rule,...which has been battered in recent weeks by a fall in global oil prices after Moscow pulled out of the Opec+ producers deal to support...
141,"March 23, 2020",Investors braced for big dividend cuts,"...while BP and Shell are in focus, given the sharp fall in oil prices. 

As well as cutting dividends, companies could also find themselves unable..."
142,"March 22, 2020","Pimco, Amundi, Ashmore bond funds battered by turbulent markets","...triple shock from the US stock market crash, Covid-19 and falling oil prices has dislocated asset prices and impaired liquidity across all markets.”Bond..."
143,"March 19, 2020","Surging dollar, coronavirus and oil slump hit emerging economies","...the twin shocks of the coronavirus outbreak and the plunge in global oil prices.
Across the emerging world, governments are taking rapid action to support..."
144,"March 18, 2020",Fear grips markets as faith in intervention runs out,"...lives worldwide, the   S&P 500 fell about 5 per cent and oil prices hit the lowest level in nearly 17 years. Sterling tumbled almost..."
145,"March 18, 2020",US and Canada close land border to non-essential traffic,"...to help the economy as it grapples with the crisis and plunging oil prices. 
Edward Alden, a trade and immigration expert at the Council on..."
146,"March 16, 2020",Canada closes borders in attempt to arrest spread of coronavirus,"...deal with the economic fallout from the virus and the collapse in oil prices, including making available C$10bn (US$7.2bn) in credit for small and..."
147,"March 14, 2020",Economics class: Eight days that shook the oil market — and the world,"...diagram, analyse the combined effects of increasing supply and falling demand on oil prices. 
Consider the extent to which the Saudi strategy is sustainable in..."
148,"March 14, 2020",Coalition troops in Iraq come under more rocket fire,...its government revenue and is braced for the economic shock of low oil prices. Major cities are also in lockdown as Iraq tries to tackle...
149,"March 12, 2020","‘Impropriety’ in way $150bn state fund led deals, Ramaphosa says","...a tenth, fell by more than 40 per cent. The fall in oil prices has sparked worry about the group’s debts. Sasol said on..."
150,"March 11, 2020",What will the Fed do next to ease coronavirus threat?,"...more liquidity to the banking system
On Monday, after a collapse in oil prices panicked investors, the New York Fed announced it would increase the..."
151,"April 6, 2020",US shareholders brace for nine-year dividend squeeze,"...a powerful signal of financial strength.Meanwhile, the rapid drop in the price of oil this year has increased pressure on energy businesses to reduce..."
152,"April 3, 2020",Stocks end week on sour note as data reveal virus toll ,"...supported earlier on Friday by a sharp rise in the price of oil, which has rallied on hopes of a ceasefire in the price war..."
153,"April 3, 2020",Investor appetite returns for junk bonds,"...bank and government stimulus, strong appetite for new deals and the rising price of oil, which helps the energy companies that make up a big..."
154,"March 17, 2020",US companies raise $25bn as bond market thaws,...vowed to “significantly reduce spending” as the coronavirus outbreak sapped demand for oil and a  price war between Russia and Saudi Arabia knocked down the...
155,"March 13, 2020",S&P 500’s biggest one-day gain since 2008 helps trim weekly drop,"...fears around the spread of the coronavirus and a plunge in the price of crude oil.
Wall Street’s equities benchmark soared 9.5 per..."
156,"April 6, 2020","Covid-19 on emerging markets, possible oil tariffs","...their plans to continue paying dividends in submissions to regulators today, and oil producers push back against the price war between Saudi Arabia and Russia..."
157,"March 12, 2020",Will the coronavirus trigger a corporate debt crisis?,"...is coming. 
The consequences showed up most vividly this week in the oil and gas sector as a  price war between Riyadh and Moscow compounded..."
158,"March 24, 2020",Wall Street has best day in over a decade as stimulus deal nears,"...jumping 7 per cent on Monday following the Fed’s intervention.
The price of Brent crude, the international oil marker, settled 0.4 per cent..."
159,"April 6, 2020",G20 oil ministers to hold emergency meeting on Friday,"...G20 countries. Many G20 members, including Japan, South Korea produce very little oil, so may have little incentive to see prices rise as recession looms..."
160,"April 5, 2020",Oil majors raise $32bn of debt to weather crisis,...could see millions of barrels a day extra unleashed on to the oil market.The drop in Brent crude — the international oil benchmark fell last...
161,"March 31, 2020",Oil tanker owners cruise to bumper quarter as rates surge,...surpassing the widest spread reached during the last financial crisis.By buying oil cheaply now and selling at a higher price in the future market...
162,"March 28, 2020",Global petrol demand to plunge as US stops driving,"...day next month, equivalent to a 5 per cent drop in global oil demand. World oil demand is forecast to fall by an unprecedented 20m..."
163,"March 24, 2020",Markets Now - Tuesday 24th March 2020,...with pressure on every element of their businesses.● We update our oil price estimates to reflect the current macro environment: Our Brent forecast falls...
164,"March 23, 2020",Markets Now - Monday 23rd March 2020,"...rating nowhere close to cyber attacks and a likelihood slightly below energy price shocks: It’s not news that Davos generates bunk, and it’s..."
165,"March 14, 2020",Donald Trump declares US national emergency for coronavirus,"...US would also waive interest on federal student loans and purchase crude oil to boost the country’s strategic petroleum reserve.
Mr Trump spoke as..."
166,"March 10, 2020",White House pushes tax cut to aid virus-hit economy,"...official said Mr Trump was also “considering federal assistance” for the  shale oil and gas production industry, but that it would not amount to a..."
167,"March 10, 2020",Occidental Petroleum: dash for cash Premium content,...the matter. Occidental was desperate to be the dominant producer in the oil-rich Permian basin and ultimately paid $56bn to clinch the Anadarko deal...
168,"April 8, 2020","Opec has ‘disappeared’, says oil veteran Andrew Gould",...Global oil producers are scrambling to secure a supply cuts deal to counter an unprecedented drop in demand triggered by the coronavirus pandemic. But for...
169,"April 9, 2020",Markets Now - Thursday 9th April 2020,...systemic risk from safe havens and risk assets begin to more directly price growth uncertainty: (1) the UST 10-year rose for a third day...
170,"April 8, 2020",Markets Now - Wednesday 8th April 2020,"...a recovery to 4% margins by FY24, we derive a £37 target price.1H revenue growth of +21% was supported by a successful Jan/Feb..."
171,"April 3, 2020","Investors Chronicle: Glencore, Carnival, James Halstead",...6bn billion loan’s maturity to 2025. On top of the commodity price fall (which Glencore is also exposed through its oil production and refining...
172,"March 31, 2020",Bond manager seeks waiver to avoid fire sale of junk bonds,"...the downgraded companies’ debt with no guarantee it could get a good price.“Given the extraordinary volatility, we are asking for an extension of our..."
173,"March 31, 2020",Glencore defers $2.6bn dividend decision,"...the impact of the coronavirus pandemic on its business and global commodity prices.The Switzerland-based miner and commodity trader, which has been forced to..."
174,"March 31, 2020",Markets Now - Tuesday 31st March 2020,"...the COVID-19 impact, given the extreme and sudden drop in the oil price, and the potentially compounding effect of this on deal closure and..."
175,"March 30, 2020",Uranium bucks weak commodity trend,"...Neil Hume, Natural Resources EditorThe collapse in economic activity from the coronavirus pandemic has hit the price of most industrial metals and minerals, but uranium..."
176,"March 30, 2020",Kremlin in virus crackdown after Russians rush  for ‘long weekend’,...away from an oil production pact with Saudi Arabia. Riyadh triggered a price war that sent the price of crude — Russia’s key export — down...
177,"March 27, 2020",Chinese mask entrepreneur reaps $1.9bn coronavirus bonanza,"...The technical threshold and production process has been the reason why the price of melt-blown special materials has soared recently.”
With an estimated market..."
178,"March 26, 2020",Wall Street rallies for third day as stimulus cheers investors,"...04 percentage points to 0.82 per cent. Yields move inversely to price. Gold was up 0.7 per cent to trade around $1,625..."
179,"March 26, 2020",Markets Now - Thursday 26th March 2020,...a surprise given the dual impacts of the virus and the lower oil price. The scenario planning outlined implies there are further leavers to pull...
180,"March 26, 2020",From coronavirus crisis to  sovereign debt crisis,"...how fragile it is. The combination of economic downturns, capital flights, commodity price collapses, political instability resulting from the social consequences of the epidemic and..."
181,"March 24, 2020",Goldman Sachs tells clients it is time to buy gold,...in the gold market were also evident on Tuesday with the cash price of gold trading at a $23 discount to the future prices on...
182,"March 22, 2020",Costs to borrow ETFs jumps as volatility spikes,...and other institutional investors that want to protect their positions from wild price swings.ETFs regularly account for a quarter of daily trading activity on...
183,"March 20, 2020",Wall Street takes late tumble as US shutdown widens,"...and futures for indices and stocks.
US benchmark West Texas Intermediate crude oil for April delivery plunged more than $5 a barrel, or 21 per..."
184,"March 20, 2020",Markets Now - Friday 20th March 2020,"...American and Ferrexpo, because we expected the iron ore and coking coal price to collapse. They have not, but the share prices have plummeted anyway..."
185,"March 18, 2020",Markets Now - Wednesday 18th March 2020,...this unprecedented situation:1) Don’t catch a falling knife. We expect price action to remain disorderly until there is evidence the pandemic is contained...
186,"March 17, 2020",Markets Now - Tuesday 17th March 2020,"...forecast 3m GSCI -25%.Second round effects of virus now drive markets. Price wars in oil and gas, liquidity constraints in precious metals and uncertain..."
187,"March 16, 2020",European distillers turn to making sanitisers to tackle shortage,"...gels and alcohol wipes, is also in short supply in Europe, with prices for the chemical jumping sharply. 
Companies that make highly concentrated ethanol or..."
188,"March 16, 2020",Markets Now - Monday 16th March 2020,"...risen sharply over the past decade, to c.70% in 2020. The oil-price war and unilateral border closures are two illustrations of this lack..."
189,"March 13, 2020",US stocks surge 9% as global authorities ramp up virus response,"...loans.
The tech-heavy Nasdaq ended up 9.3 per cent. The price of a barrel of Brent crude oil was up 4.6 per..."
190,"March 13, 2020",Markets Now - LIVE - Friday 13th March 2020,...and we lift our rating from Underperform to Outperform. ...The collapse in oil prices has reduced the upgrade momentum for BHP. A spot price scenario...
191,"March 13, 2020",WeWork eyes further workforce cuts to curb expenses,"...to walk away from their short-term leases with little notice. 
The price of WeWork’s bonds, which had started to recover after it secured..."
192,"March 11, 2020",Markets Now - LIVE - Wednesday 11th March 2020,...A FTSE 100 rally has been running out of steam as both oil pumpers and oil burners such as easyJet trend lower.Back to Nomura...
193,"March 11, 2020",Green boost as £800m pledged for carbon capture projects,"...carbon from power stations or industrial users and store it in depleted oil and gasfields offshore. 
Although the sum is less than a previous £1bn..."
194,"March 11, 2020",BoE makes emergency rate cut to cushion economy,"...After the rate cut, UK sovereign debt with shorter maturities climbed in price while gilts at the longer end of the spectrum came under modest..."
195,"April 9, 2020",Lebanon’s creditors face 70% hit from debt restructuring  ,"...Lebanon and Argentina were already sliding towards default before coronavirus hit, prompting oil-rich Ecuador to suspend payments on its dollar debt as energy prices..."
196,"April 9, 2020","Virus will push sub-Saharan Africa into deep recession, warns World Bank","...losses this year, with decreases in foreign financing flows, remittances, tourism, commodity prices, FDI and international aid. It also forecasts a “sharp decline” in output..."
197,"April 7, 2020",Senior Africans propose ‘standstill’ on eurobond debt payments,"...welcomed the idea of bilateral and multilateral debt relief, but had not priced in any Africa-wide suspension of eurobond payments. “Great care would need..."
198,"April 6, 2020",Iran steps up support for citizens as it eases coronavirus controls,"...last year, according to the IMF, as the sanctions caused Iran’s oil exports to fall from 2.8m barrels a day in May 2018..."
199,"April 5, 2020",UAE expands stimulus as Gulf economies reel from coronavirus ,"...s newly appointed governor.The fresh financial stimulus comes as the non-oil sectors of the Gulf states’ two largest economies are decelerating rapidly, according..."
200,"April 1, 2020",Zambia’s bonds drop on expected restructuring,"...big outflows from emerging-market debt funds and a plunge in metals prices. On Tuesday, Zambia’s finance ministry contacted banks asking for advice on..."
201,"March 30, 2020",Japanese bank SMBC agrees cash infusion for Ares ,"...many businesses closed to try to slow the spread of coronavirus. US oil producers, many of which have been major borrowers from these types of..."
202,"March 29, 2020",Officials warn Africa is at ‘break the glass’ moment,"...Africa’s gross domestic product at a stroke, he said, as commodity prices sank and receipts from tourism, trade and remittances shrivelled.Moody’s on..."
203,"March 26, 2020",ABN Amro takes $200m hit from failure of a single client,"...suffered a sharp increase in bad debts among customers in the offshore oil and gas sector, even before the recent collapse in crude prices.Traders..."
204,"March 10, 2020",Coronavirus puts electric carmakers on alert over lithium supplies,"...CRU, a supply chain that has been disrupted by the virus outbreak.
Prices for lithium hydroxide rose 3.1 per cent last month, their first..."
