,date,title,summary
112,"September 1, 2017",Small-cap focus: regional businesses look beyond EU for growth,"...since the referendum result helped.
The company also began ship-to-shore oil transfer services in Brazil for the first time.
Oil and gas maintenance..."
113,"August 31, 2017","Fast Europe Open: Germany unemployment, France CPI","...a barrel as the effects of tropical storm Harvey continued to affect oil refineries in Texas.
Futures tip both the FTSE 100 and S&P..."
114,"August 31, 2017",US gasoline futures jump above $2 a gallon,...US gasoline futures leapt above $2 per gallon early Thursday as damage from hurricane Harvey curtailed supplies from oil refineries and an important pipeline...
115,"August 30, 2017",New Delhi seeks $5bn from Hutchison in long-running tax dispute,"...damaging distraction for Vodafone, which is also contending with a fierce telecom price war instigated by new entrant Reliance Jio. In March Vodafone announced a..."
116,"August 29, 2017",Mexico gives go-ahead to new stock market,"...the fact that BIVA will hold an auction to determine the closing price, rather than an average of the final minutes of trade, a method..."
117,"August 27, 2017",Airbus’s jet contract row with Austria escalates,"...their interest in bidding, the product they would offer, and a ballpark price by September 26. However, Airbus, which is the market leader in the..."
118,"August 25, 2017",Trump ramps up sanctions pressure on Venezuela,"...and shares issued by the government of Venezuela and PDVSA, its state oil company. It is also banning dealings in certain existing bonds owned by..."
119,"August 22, 2017","Fast Asia Open: Japan manufacturing PMI, Malaysia CPI","...staged a solid rebound. Industrial commodities had a positive session, with metal prices reaching fresh multi-year highs and oil recovering somewhat after Monday’s..."
120,"August 21, 2017",Imperial sighs after broker waves away vaping scepticism,"...7 per cent to £11.72. Jefferies put a £10.45 floor price on Hikma’s core business, which included nothing for a generic version..."
121,"August 21, 2017",Lithuania becomes first ex-Soviet state to buy US natural gas,...Gazprom believes that its pipeline supplies can compete with US LNG on price and Moscow has criticised the US for targeting pipeline projects with possible...
122,"August 10, 2017",Glencore sees rich benefits in battery growth as debt falls,"...2.1m and cobalt 100,000 tonnes.
“That bodes well for the prices of these commodities,” he said. 
Glencore’s results for the six months..."
123,"September 7, 2017",Chinese energy companies are turning their sights on Russia Premium content,"...A long-rumoured deal for private conglomerate CEFC China Energy to invest in Rosneft, the Russian state-controlled oil giant, is close to being agreed..."
124,"September 7, 2017",Irma tears through Caribbean islands and heads for Florida,"...does, we’re screwed.” 
Irma is expected to steer east of the oil and gas hub of the Gulf of Mexico, potentially sparing refineries, storage..."
125,"September 2, 2017",Big investors step up rebellion at company meetings,"...the world’s largest asset manager, Norges Bank, which runs Norway’s oil fund, and Calpers, the US’s largest public pension fund, cast fewer..."
126,"September 1, 2017",Chemical plant fire adds to medical risks after Harvey,"...continued, as the US government responded to a surge in retail petrol prices by more than quadrupling the amount of crude oil approved for release..."
127,"August 30, 2017","Fast Asia Open: South Korea rates decision, China PMIs","...A flotilla of European fuel tankers is preparing to sail to the US in the wake of tropical storm Harvey, as oil traders scramble to..."
128,"August 29, 2017",Insurers and energy companies count cost of tropical storm Harvey,"...3.4 per cent to $46.25 as the storm shut down oil refineries, the main consumers of crude. 
Traders said prices could gyrate further..."
129,"August 28, 2017",Chinese return from Africa as migrant population peaks,"...companies — to have returned from Africa in recent years, as lower commodity prices hit many of the continent’s economies.
Sub-Saharan Africa grew at..."
130,"August 28, 2017",Asia stocks mixed as dollar hits 15-month low,"...gas industry. The storm shut down 900,000 barrels per day of oil refining capacity on Saturday and 430,000 barrels per day of oil..."
131,"August 24, 2017",Threat of more US sanctions weighs on Venezuelan debts,"...ban on trading in certain debts from the Venezuelan government and state oil company Petróleos de Venezuela
, cutting off a lifeline to the heavily indebted..."
132,"August 23, 2017",Rebel prosecutor launches scathing attack on Maduro,"...investigations halted. 
“Those files are related to embezzlement at the state-run oil company PDVSA,” Ms Ortega said, adding that she was also investigating a..."
133,"August 23, 2017",China restrained in response to Trump sanctions over North Korea,"...leadership transition later this year. 
“I suspect that China has foreseen and priced in such secondary sanctions and will refrain from responses beyond verbal protests..."
134,"August 20, 2017",China focuses on deep-sea mining to fuel rare metals ‘gold rush’,"...supply.
Meanwhile, anticipation of rising demand for electric vehicles has  pushed up prices for metals  used in batteries such as copper, manganese, nickel and lithium..."
135,"August 20, 2017","China has most to lose in US trade showdown, says report","...US,” he said, noting that American consumers would be hit by higher prices for imported goods. “A collapse in US trade with China would have..."
136,"August 14, 2017",China growth set to slow as credit tightens,"...and tightened mortgage lending in an effort to rein in runaway house prices, especially in major cities. Housing construction in turn fuelled demand for Chinese..."
137,"August 10, 2017",European stocks dip as Korea tensions reverberate,"...and Kim Jong Un.
London is underperforming due to its heavily weighted oil, financials and mining sectors, with Anglo American the biggest faller in early..."
