,date,title,summary
112,"January 3, 2018",More than half Norway’s new car sales electric or hybrid,"...propelled the rapid growth of electric vehicles in western Europe’s biggest oil producer. 
Almost 50,000 new cars sold last year in Norway were..."
113,"December 28, 2017",London-based art fund targets $1bn lending in Asia,"...works.
“The mainland Chinese investors all of a sudden realised that Chinese prices were the same as western prices, and when that happened they really..."
114,"December 22, 2017",‘Mini-grid’ household energy sharing begins to take off,"...or interrupt its delivery to us,” he declared, referring to the Arab oil embargo earlier in the decade. 
But self-generated power has been held..."
115,"December 22, 2017",Australian miners head for best close in almost 5 years,"...Westpac said on Thursday it had raised its near-term forecasts for prices across iron ore, metallurgical and thermal coal and oil.
The bank’s..."
116,"December 15, 2017",Russia surprises with half-point interest rate cut,"...risks over a one-year horizon.
“The extension of the agreement between oil-exporting countries lowers the uncertainty of energy prices’ dynamics and related pro..."
117,"December 13, 2017",White House denies change in North Korea policy,"...pressure on China to go beyond existing UN sanctions and cut off oil exports to North Korea.

“The president would like to see China cut..."
118,"December 13, 2017","Dow, S&P set new intraday highs ahead of Fed decision",...P 500 while energy shares were weaker in tandem with Brent crude prices after Opec upped its forecast on non-Opec oil production for this...
119,"December 13, 2017",Dollar slips as investors await Fed verdict; ‘Democrat Doug’ impact eyed,"...A 25 basis points rate rise from the US central bank looks priced into the dollar, leaving attention focusing on the accompanying statement from the..."
120,"December 12, 2017",Glencore reveals plans for growth,"...Investment Authority to buy a 19.5 per cent stake in Russian oil company Rosneft, and more recently with the Ontario Teachers’ Pension Plan to..."
121,"December 12, 2017",Glencore ‘able and willing’ to grow,"...to buy a 19.5 per cent stake in Rosneft, the Russian oil company, and more recently it teamed up with Ontario Teachers’ Pension Plan..."
122,"December 11, 2017",Maduro bans opposition parties from 2018 presidential election,"...wage is now worth less than $5.
The government seems to hope oil sales will save it from impending economic doom, but although international prices..."
