,date,title,summary
112,"November 14, 2017",Christie’s $479.3m impressionist art sale strongest in a decade,"...and Edouard Vuillard, the room came alive.
Bidding on van Gogh’s oil on canvas titled “Laboureur dans un champ” (Farmer in a field) jumped..."
113,"November 14, 2017",Anglo blocked hiring by Deripaska’s En+ ahead of IPO,...a $14-$17 range. On Monday they were trading below the flotation price at $12.80. En+ raised $1bn through its float to pay down...
114,"November 10, 2017",Anglo American’s biggest shareholder says miner should not be broken up,...such a move would drive a re-rating of Anglo’s share price. Investors are increasingly wary of investing in companies with big South African...
115,"November 10, 2017",Norway sovereign wealth fund wants forex traders to restore trust,"...the very last moment, even after a client has agreed to the price, should problems arise with credit checks or market prices move dramatically.
In..."
116,"December 8, 2017",China’s commodity demand picks up in November,"...satisfy its copper units,” said analysts at ANZ, adding that China’s oil imports should also allay concerns about weak demand.
Iron ore prices recently..."
117,"November 30, 2017","Dow opens above 24,000 ahead of tax vote","...eyeing news out of Vienna, where ministers from the world’s biggest oil producers are expected to be close to extending a deal to curb..."
118,"November 29, 2017",Co-op bags Costcutter supply contract after P&H failure,...largest grocer and largest wholesaler and put pressure on rivals to cut prices. Competition authorities have said they are likely to approve it. Wm Morrison...
119,"November 27, 2017",Mexico finance minister quits to run for president,"...to the job after almost two years putting the cash-strapped state oil company Pemex back on an even keel. 
The ministerial musical chairs appears..."
120,"November 15, 2017",Russia and Venezuela agree $3bn debt restructuring,"...through sovereign debt purchases and cash advances to PDVSA, the state-owned oil company, from the Kremlin-controlled Rosneft.

Russia said on Wednesday it had..."
121,"November 10, 2017",Anil Agarwal backs current structure of Anglo American,"...Rio Tinto, who stepped down in August.
“I am very excited about oil and gas. I produce 30 per cent of India’s oil and..."
