,date,title,summary
0,"April 8, 2020",Iraq warns over threat to public sector pay from oil price collapse,"...had budgeted for Iraq’s oil to be sold at an average price of $56 per barrel, but the average price for March was about..."
1,"April 6, 2020",Oil price falls on doubts over Saudi-Russia supply deal,"...deepened over the weekend, with both accusing each other of sparking the price war to hurt the US oil sector. Brent prices still remain down..."
2,"April 3, 2020",Ryanair hit by wrong way bet on fuel,"...However, it has been caught out by the recent plunge in the oil market as it still has to pay the higher hedge price. Ryanair..."
3,"April 3, 2020","Oil price war, vaccines, banks on stimulus",...Oil soared nearly 50 per cent at one point on Thursday in its biggest ever one-day rally after US president Donald Trump stoked hopes...
4,"April 2, 2020",Global stocks end higher on hopes of oil price war truce,"...Global stocks closed mostly higher on Thursday, buoyed by hopes the oil price war between Russia and Saudi Arabia could soon ease, but investors remained..."
5,"April 2, 2020",Natural gas drillers get share price boost as oil price falls,"...While rock-bottom oil prices wreak havoc across the US energy sector, there are some drillers for whom the historic bust has proven a share..."
6,"April 1, 2020",BP slashes spending to counter oil price collapse,...bolster its finances and maintain shareholder payouts in the face of the oil price collapse triggered by the coronavirus outbreak.The UK energy group said...
7,"March 30, 2020",US stocks close up 3.4% in positive start to week,"...that the pandemic will cause a collapse in global energy demand.Oil prices have now fallen by about two-thirds this year, with a price..."
8,"March 30, 2020",US crude oil price falls below $20,"...America have slashed oil demand.While demand has collapsed, the supply of oil has also increased rapidly because of the price war between Saudi Arabia..."
9,"March 25, 2020",US puts pressure on Saudi Arabia to end oil price war,"...in poorer oil-dependent countries such as Iraq, Oman and Nigeria.The price war has helped to cut oil prices in half this month to..."
10,"March 25, 2020",US shale bust wrecks hopes for energy independence,"...of steam, as drillers slash spending and production in response to the price war and coronavirus-led collapse of crude demand.
US oil output, now..."
11,"March 20, 2020",Saudi Arabia to double debt in virus and low oil price fight,"...by the plunge in crude prices, which has been exacerbated by an oil price war between Saudi Arabia and Russia. 
The dispute erupted after Moscow..."
12,"March 18, 2020",Oil prices hit lowest level in 17 years as demand plunges,"...out over Riyadh’s calls for greater production cuts to boost the price. 
Russia admitted on Wednesday it would like higher oil prices as it..."
13,"March 17, 2020",Apollo and Elliott abandon US energy group rescue,...and Elliott Management plans to abandon a transaction to refinance the US oil and gas driller EP Energy in the wake of the commodity price...
14,"March 16, 2020",Oil price collapse threatens ‘vulnerable’ producers,...The International Energy Agency has warned that the  collapse in oil prices threatens to cut the revenues of “vulnerable” producing countries by up to 85...
15,"March 15, 2020",Saudi Aramco slashes spending as oil price war rages,"...spending by as much as 23 per cent in response to falling oil prices. 
Yet, as part of the oil price war, Saudi Aramco has..."
16,"March 14, 2020",Energy  and alternative funds lead year’s worst performers ,"...Arabia said this month it would discount the price of its crude oil and raise production, in a move that sent oil prices crashing by..."
17,"March 13, 2020",Canada moves to shore up economy with emergency rate cut,"...economy grapple with a double hit from the coronavirus outbreak and plunging oil prices.
The move was part of a series of dramatic steps taken..."
18,"March 12, 2020",Premier Oil creditor calls for company to abandon North Sea acquisitions,...A Hong Kong-based hedge fund battling Premier Oil over its $2.9bn refinancing is calling for the UK company to abandon $871m of North...
19,"March 11, 2020",Mexico eyes production cut at Pemex as oil price crashes,"...has made boosting the company’s declining output a core objective. 
“The price of the Mexican [oil export] mix is determined by international oil prices..."
20,"March 10, 2020",Occidental Petroleum slashes dividend as oil price rout bites,"...swiftly to cut their spending plans in the face of the plunging oil price. Artem Abramov, head of shale research at Rystad Energy, said at..."
21,"March 10, 2020","Oil price war will hit coronavirus fight, says energy chief","...Russia and Saudi Arabia risk hurting efforts to stop the spread of coronavirus if they insist on continuing an oil price war, the head of..."
22,"March 10, 2020",Saudi Arabia pumps up volume in escalating oil price war,"...market does not need that much crude oil. They are dumping the oil from storage.”
The start of an oil price war at a time..."
23,"March 10, 2020",Why there are no winners from the oil price plunge this time,"...benefit . . . but nothing is positive at the moment for anybody.” 
The main oil-producing nations will feel the worst of the pain. An oil price..."
24,"March 18, 2020","Global stocks, oil prices and government bonds tumble ","...Global stocks, oil prices and government bonds fell sharply on Wednesday, indicating forced selling across financial markets and raising doubts about governments’ ability to contain..."
25,"April 9, 2020",Fed enters new territory with support for risky debt,"...deteriorating economic conditions stemming from the viral outbreak and the collapse in oil prices.In response to the Fed’s move on Thursday, the biggest..."
26,"April 9, 2020",US executives rush in record numbers to ‘buy the dip’,"...listing in 2011. The company faces the twin challenges of a weaker oil price and big hits to economic activity from coronavirus.Brett Icahn, son..."
27,"April 8, 2020",Russia rejects US suggestion on oil cuts,...that a natural reduction of unprofitable shale production because of the lower oil price could account for the country’s share of cuts.“These are...
28,"April 8, 2020",US regulators praise market ‘resilience’ after March stress test,"...to meet their liabilities. As Saudi Arabia’s decision to provoke an oil price war sent crude and stock prices tumbling on March 8, clearing..."
29,"April 5, 2020",14 Latin American nations seek IMF help to combat big recession,"...before they were hit with multiple shocks from weaker commodity values, the oil price crash and capital flight.“You never had severe recessions in all..."
30,"April 4, 2020",US and Canada discuss putting tariffs on Saudi and Russian oil,"...the Opec+ group do not quickly reach a deal to end their price war.Jason Kenney, the premier of Alberta — Canada’s biggest oil-producing..."
31,"April 3, 2020",Putin says oil supply cuts possible if all major producers take part,...Saudi Arabia “to get rid of competitors who extract so-called shale oil”. The drop in oil prices to $25 a barrel — levels not seen...
32,"April 3, 2020",Russia’s central bank says no further intervention to support rouble,"...for lower oil revenues. To put it differently, Russia can pretend that oil prices are at the cut-off oil prices of about $42 for..."
33,"April 3, 2020",US shale producers launch anti-Saudi lobbying push,"...against Saudi Arabia and Russia, urging the White House to compel the oil producing nations to cut output in order to prop up crude prices..."
34,"April 3, 2020",Global lay-offs surge as 6.6m Americans file jobless claims ,...Thursday despite the negative numbers as investors were buoyed by hopes the oil price war between Russia and Saudi Arabia. The S&P 500 closed...
35,"April 2, 2020",Qatar lines up bond deal as virus and oil crash hit economy,"...the secondary market, to complete it.Moody’s has warned that with oil prices below the price needed to balance the budgets of all Gulf..."
36,"April 2, 2020",Oil surges as Trump spurs hopes for Russia-Saudi pact,"...in demand meant that cuts to supply would not necessarily prevent further oil price falls.Complicating potential talks brokered by Mr Trump, Russia’s decision..."
37,"April 2, 2020",Markets Now - Thursday 2nd April 2020,"...estimates and a Q1 preview): 1) In major oil price corrections, Big Oil shares tend to fall in line with the oil price for the..."
38,"April 2, 2020",Investors braced for credit crisis in emerging markets,"...Ecuador also asked to restructure its debts, after the collapse in the oil price shredded its finances. The woes of the two countries reflect broad..."
39,"April 2, 2020",Coronavirus leaves wealthy Norway facing tough spending choices,"...for Norway were worse than other nations as its biggest revenue generator, oil and gas, was suffering a parallel collapse in demand and prices that..."
40,"April 1, 2020",Shale group Whiting files for Chapter 11,...downturn driven by the pandemic and the duration of the Saudi-Russia oil price war had made filing for Chapter 11 inevitable. “Through the terms...
41,"March 31, 2020",Germany braced for jobless surge as companies rush for state funds,"...Energy prices fell 4.3 per cent, reflecting the dramatic drop in oil prices after Saudi Arabia started a price war with Russia. But unprocessed..."
42,"March 31, 2020",Shell secures $12bn credit facility to safeguard dividend,"...in London.“We have seen and expect significant uncertainty . . . with regards to prices and demand for oil, gas and related products,” Shell said, citing the..."
43,"March 30, 2020",European economic sentiment tumbles in early March,...data published on Monday showed that German inflation sank in March as oil prices fell sharply and economic activity slowed. Harmonised consumer price inflation in...
44,"March 30, 2020",Wall Street calls time on the shale revolution,"...arrived to cripple global oil demand at the same time.
The latest price shock, which has more than halved the cost of oil since the..."
45,"March 29, 2020",Migrant workers count the cost of coronavirus,"...region is enduring a double blow from the virus and plummeting crude prices, exacerbated by an oil price war between Saudi Arabia and Russia. That..."
46,"March 28, 2020",Oil bust and pandemic strike double blow for Texas ,"...demand has halved the value of Texas crude amid an all-out price war between Saudi Arabia and Russia, threatening tax revenue, oil output and..."
47,"March 27, 2020","Investors Chronicle: Biffa, Ted Baker, Royal Dutch Shell",...company said it would be “actively managing all . . . operational and financial levers”. Oil industry analysts have flagged storage limitations forcing prices down further and necessitating...
48,"March 26, 2020",Russia to tax bank deposits to fund coronavirus package ,...country’s economy. The country is already facing a damaging slump in oil prices to an 18-year low that has been exacerbated by its...
49,"March 26, 2020","Stimulus haggle, James Kynge on China, US oil talks",...the US has raised the pressure on Saudi Arabia to end its oil price war with Russia as the shale industry faces a collapse.  For...
50,"March 26, 2020",India’s Vedanta presses on with plan to double oil production,"...private sector; we’re very excited.”
The spread of coronavirus and a price war between Saudi Arabia and Russia have sent oil prices tumbling. Brent..."
51,"March 25, 2020",Faltering ethanol refiners switch to hand sanitiser,"...24.4 cents a gallon in Chicago this week, according to the Oil Price Information Service, while ethanol was 86.5 cents a gallon. 
The..."
52,"March 25, 2020",UK inflation pace slows as motor fuel prices fall,"...as a result of the coronavirus crisis, pushed by a fall in oil prices and weaker economic activity.
Howard Archer, chief economic adviser at EY..."
53,"March 24, 2020",Chevron announces spending cuts and halts buyback programme,"...works as a contractor in the zone for Saudi Arabia.
Like other oil producers, Chevron has been battered by a halving of the oil price..."
54,"March 24, 2020",Ecuadorean bonds drop as government calls for time,"...scrambles for cash amid the Covid-19 outbreak and the crash in oil prices.
In an online press conference on Monday night, finance minister Richard..."
55,"March 23, 2020",Wall Street closes lower in spite of Fed ‘bazookas’,"...The yield on the benchmark 10-year note, which moves inversely to price, was roughly 0.08 percentage points lower at 0.77 per cent..."
56,"March 23, 2020",Mexican vote against US brewery deals blow to business confidence,"...economic risk that we are facing because of financial market instability, the oil price and the international convulsion caused by the Covid-19 pandemic,” CCE..."
57,"March 23, 2020",Shell and Total slash costs and suspend buybacks,"...coronavirus pandemic that has hit the global economy has curtailed demand for oil, while a price war led by Saudi Arabia has depressed prices further..."
58,"March 23, 2020",US subprime mortgage specialist seeks buyers for $1bn of assets,...US junk bond market was in the throes of a rout as oil prices crashed and the fund held a large proportion of very low...
59,"March 22, 2020",Occidental boss set to survive as group finalises deal with Icahn,"...person added. 
The collapse in oil prices, now less than half their price in early January, has affected the entire US oil sector — but hit..."
60,"March 22, 2020",A tenth of oil production may become uneconomic,"...on Friday. 
Heavier oil production in Venezuela and Mexico, which requires crude prices above $55 a barrel, is most vulnerable. 
Canadian oil sands projects require..."
61,"March 21, 2020",Corporate borrowing costs soar amid default fears,"...average of 4 per cent.
“I think the pandemic coupled with the oil price crash and the asset price declines are creating a severe and..."
62,"March 20, 2020",Opec discusses output cuts with US producers,"...of ministers.
The kingdom is  preparing for an extended period of low oil prices as it persists with the price war that took Brent crude..."
63,"March 20, 2020","Investors Chronicle: Gamesys, Associated British Foods, Aston Martin","...the extent it otherwise would. One of the channels whereby a lower oil price raises activity is thus blocked.Third, the lower oil price creates..."
64,"March 20, 2020",Soured oil bets turn Lasry’s Avenue fund into a dead-end,"...wiped out following the spread of coronavirus and a severe rout in oil prices.
The fund has lost roughly 10 per cent year to date..."
65,"March 20, 2020",It’s time for a major issuance of the IMF’s Special Drawing Rights,"...is likely to lead to a global recession. In conjunction with the oil price war, the heightened uncertainty has led to a stock market sell..."
66,"March 20, 2020",Russia holds rates to protect rouble despite virus slowdown,"...between the two major oil producers to cap production and sparked a price war that saw oil prices crash 30 per cent, pulling the rouble..."
67,"March 20, 2020",Brent rises above $30 a barrel,"...state Mike Pompeo have been lobbied by oil executives and congressmen from oil-producing states to ask Saudi Arabia to end the price war, said..."
68,"March 20, 2020",Coronavirus: Retail investors attempt to navigate crisis,"...Interactive also reported a big uptick in trading activity. This week, as oil prices plunged to their lowest level in 17 years, the most popular..."
69,"March 19, 2020",Copper hits four-year low as investors dash for cash,"...818, up 1.5 per cent on the day. On Wednesday, the price had fallen 8 per cent, its biggest one-day percentage fall in..."
70,"March 19, 2020",Norway considers action to break ‘extraordinary’ krone slide,"...for Norway on two fronts: the 
coronavirus outbreak
 and a plunge in oil prices. The unemployment rate more than doubled in the week to Tuesday..."
71,"March 19, 2020",Trio of hedge funds makes big gains from oil rout,"...is chalking up big gains after betting on a plunge in the oil price, which has been hammered by the Saudi-Russia price war just..."
72,"March 19, 2020",US oil companies race to restructure debt,...plans as the industry comes to terms with an unprecedented collapse in oil demand due to the coronavirus pandemic and a price war between Saudi...
73,"March 19, 2020",EnQuest to abandon production at two North Sea fields,"...have fretted over their still high debt burdens. EnQuest, Tullow and Premier Oil are all still suffering a debt hangover from the last oil price..."
74,"March 19, 2020",North Sea warns oil and virus crises threaten survival,"...oil and gas supply chain still struggling to recover from the last oil price crash of 2014, were once again facing “severe pressures”, OGUK said..."
75,"March 18, 2020",Oil Search slashes spending 40% in ‘struggle for survival’,"...extended period of lower oil prices and business uncertainty,” said Keiran Wulff, Oil Search managing director. 
A dramatic fall in oil prices to below $30..."
76,"March 18, 2020",Oil storage to max out in months as coronavirus crushes demand,"...crushes demand for fuel at the same time as the Saudi-Russia price war boosts supplies.
Traders are predicting oil demand could fall at the..."
77,"March 18, 2020",Emerging markets hedge funds stung in Covid-19 sell-off,"...caused by the Covid-19 outbreak, at the same time as an oil price war between Saudi Arabia and Russia clobbered several big developing, oil..."
78,"March 17, 2020",Global funding squeeze forces dollar higher,"...of March.
But the firestorm last week — with a crash in the oil price, some of the biggest declines in stocks for decades, and alarming..."
79,"March 17, 2020",Apollo/Elliott: backstop full-stop,...Would you invest in the equity of an American oil and gas company off this price deck if you could buy in at an immediate...
80,"March 17, 2020",Sasol plans South Africa’s biggest rights issue in decades,...Sasol plans to launch South Africa’s biggest rights issue in decades as the petrochemicals group seeks to cut its debt after the oil price...
81,"March 17, 2020",Centrica replaces chief executive and chairman,"...Shea would be made permanent chief executive “in due course”. 
“The current oil price shock coupled with the fall-out of the economic slowdown on..."
82,"March 17, 2020",Saudi oil war: ‘The beauty is you can blame it on the Russians’,"...to Texas. 

A decade ago, US would have clearly benefited from lower oil prices, but its rapid emergence as the world’s top oil producer..."
83,"March 17, 2020",New accounting rules pose threat to banks amid coronavirus crisis,"...in the energy sector, which is reeling from a slump in the oil price that could result in a spate of loan losses, said Megan..."
84,"March 17, 2020",Chesapeake hires restructuring advisers to look at $9bn debt pile,...advisers as the company has been crippled by persistently weak natural gas prices coupled with the recent collapse of oil prices and the repercussions of...
85,"March 16, 2020",Virus and oil shocks risk tipping Latin America into recession,...Latin America was the world’s slowest-growing region even before the coronavirus and the oil price crash created a perfect storm which risks plunging...
86,"March 16, 2020",Saudi Aramco doubles down on output hike as price war intensifies,...company at $1.7tn. Saudi Aramco’s stock price has fallen below its flotation price of SR32 to SR28.70 amid the oil market turmoil....
87,"March 15, 2020",UK-listed oil groups hit hard as investors dump shares,"...as high as £17bn just eight years ago but have struggled since oil slumped from more than $100 a barrel in 2014.
The price crash..."
88,"March 15, 2020",Crude price crash hits oil-linked exchange traded products ,"...Saudi Arabia’s decision to launch an oil price war caused carnage last week for highly leveraged exchange traded products run by WisdomTree, UBS, Société..."
89,"March 13, 2020",Hotels and tour operators face ‘total meltdown’,"...Few businesses have been able to take advantage of drops in the oil price as most fuel costs are hedged.
The World Travel and Tourism..."
90,"March 13, 2020",Active funds have the edge on passives in week of turmoil,"...trackers were hard hit in the past week because of exposure to oil and gas, which have tumbled as a result of the oil price..."
91,"March 13, 2020",Buffett tells investors to avoid annual meeting amid virus fears,"...for Berkshire.
Mr Buffett, who this week described the coronavirus and recent oil price war as “a big one-two punch”, did not respond to..."
92,"March 13, 2020",Occidental moves to thwart activist Carl Icahn,"...The company is terribly run. They had to cut the dividend. The oil price is again the match that ignited it,” Mr Icahn told CNBC..."
93,"March 13, 2020",European regulators intervene in bid to stabilise stock and bond markets,"...as investors struggled to gauge the economic impact of coronavirus and the oil price war.
However, there was a dramatic bounce in stocks on Friday..."
94,"March 13, 2020","Investors Chronicle: Tesco, John Menzies, Clarkson","...the influence of quants, digitalised stop-losses and revised assumptions on the oil price. The details have been repeated ad infinitum.One hopes that retail..."
95,"March 13, 2020",Cost of US corporate default protection soars,"...eight years.
With credit markets reeling from the widening outbreak and an oil price war that has raised questions over the health of  energy companies..."
96,"March 12, 2020",S&P 500 suffers its quickest fall into bear market on record,"...16 sessions as a combination of fears stemming from the coronavirus pandemic, oil price plunge and a global recession killed off an 11-year bull..."
97,"March 12, 2020",Icahn urges ousting of Occidental chief,"...merger would have brought efficiencies and a prime position in US shale oil acreage, but this week’s drop in oil prices to almost $30..."
98,"March 12, 2020",‘Turbulence’ persuades Russia’s Putin to back move to extend his rule,"...week after Russia ripped up a deal with Saudi Arabia to keep oil prices high, prompting the price of Brent crude’s biggest fall since..."
99,"March 12, 2020",US producer prices fall by most in 5 years,"...oil prices. The data precede the impact of the Saudi Arabia-led price war. 
So-called core US producer prices, which strip out volatile components..."
100,"March 12, 2020",S&P warns it will not hesitate to dock ratings for oil groups,"...action as it takes stock of the damage of coronavirus and the oil-price war between Saudi Arabia and Russia.
The New York-based rating..."
101,"March 12, 2020",Markets Now - LIVE - Thursday 12th March 2020,"...bottom up, which is why strategy notes come relatively shortly after big price falls and long before the corporate analyst downgrades. Here’s Citigroup’s..."
102,"March 12, 2020",Tullow Oil warns of ‘perfect storm’ as crude price crashes,"...head of exploration. Saudi Arabia’s decision this week to start a price war sent oil prices tumbling by a quarter, compounding the company’s..."
103,"March 12, 2020",Danone dips into sour debt markets with new deal,"...fears over the spread of coronavirus and a sharp drop in the oil price.
Danone is “the kind of name you’d expect to reopen..."
104,"March 12, 2020",Oil crash hits South Korea market for exotic investment products,"...Song’s nightmare scenario materialised this week when Saudi Arabia  launched an oil price war, prompting the price of crude oil to crash by 30..."
105,"March 12, 2020",Coronavirus poses threat to China’s electric vehicle goals,"...the future for many of them even more uncertain, especially as  plummeting oil prices make the switch to electric vehicles less appealing to price-sensitive..."
106,"March 11, 2020",Oil tanker rates surge after Saudi Arabia turns on the taps,"...to back proposed Opec production cuts on Friday, Saudi Aramco launched an oil price war, announcing plans to offer its crude at deep discounts to..."
107,"March 11, 2020",‘Staggering’ collapse in inflation expectations may force Fed’s hand,"...noted that inflation expectations tended to be particularly sensitive to changes in oil prices, which had plummeted in the wake of the price war between..."
108,"March 11, 2020",Hedge fund Solus to close flagship investment vehicle,"...investors towards fossil fuels and, more recently, a sharp fall in the oil price.
Many other distressed specialists are smarting from bets on energy-related..."
109,"March 11, 2020",Goldman Sachs warns US markets will face further sharp falls,"...of the novel coronavirus and the 43 per cent collapse in crude oil prices.” 
Global financial markets have been shaken in recent weeks as investors..."
110,"March 11, 2020",PepsiCo to buy energy drink maker Rockstar for $3.85bn,"...to grapple with volatility amid the coronavirus outbreak and following Monday’s oil price plunge.
PepsiCo has distributed Rockstar in North America since 2009. Its..."
111,"March 11, 2020",Market turmoil complicates Argentina foreign debt restructuring,"...most investors believe is not realistic.
Now the collapse in the global oil price and heavy falls in equity markets have created new uncertainty. Argentina..."
112,"March 11, 2020",Saudi Arabia plans oil capacity boost in latest price war move,...Saudi Arabia sought to put fresh pressure on the oil price by instructing state oil company Saudi Aramco to increase its maximum production capacity to...
113,"March 11, 2020","Airlines in crisis, Biden builds lead, UK budget","...to stop the spread of coronavirus if they insist on continuing an oil price war. Then, the FT’s Chris Giles explains how the UK..."
