,date,title,summary
204,"November 12, 2019 08:45 am ET",Pro Bankruptcy Briefing: Feds Probe McKinsey’s Bankruptcy Work | California Governor Slams $11 Billion PG&E Deal | Mall of America Wants Sears Space Back    ,"Good day. Federal authorities have launched a criminal probe into McKinsey & Co.’s restructuring business following a Wall Street Journal investigation into the firm’s financial interests in companies it advised. An $11 billion settlement proposal in PG&E Corp.’s bankruptcy is under fire from California Gov. Gavin Newsom. And Mall of America wants to recapture a former Sears anchor space from the retailer’s former owner, Eddie Lampert.  "
205,"November 12, 2019 08:41 am ET","Clarida, Rosengren Warn That Central Banks Will Have Limited Scope to Cut Rates in Next Downturn    ","Good day. Fed Vice Chairman Richard Clarida highlighted how the success of the Fed and other central banks in reducing inflation reduces their ability to cut rates to boost growth in a future downturn. Boston Fed leader Eric Rosengren struck a similar note, issuing a warning about the limited firepower of central banks to react the next time the economy turns south.  "
206,"November 12, 2019 08:00 am ET",A User’s Guide to Confusion Over Sustainable Investing ,"It’s hard to move in the world of investment without being bombarded by sales pitches for running money based on “ESG,” or environmental, social and governance criteria. Here’s how to make sense of them. "
207,"November 12, 2019 06:40 am ET","Newsletter: Paying for Tariffs, Waiting on Oil Prices",Your daily economics newsletter from The Wall Street Journal.
208,"November 12, 2019 06:02 am ET","WSJ Wealth Adviser Briefing: Unloved Assets, CLO Selloff, Florida Billionaires","Investors are piling into beaten-up assets; a selloff in collateralized loan obligations is flashing warning signs to the junk bond market, and Florida's sunshine and tax benefits beckon billionaires."
209,"November 12, 2019 03:39 am ET","ADM Energy Raised GBP128,548 in Next Stage of Fundraising",
210,"November 12, 2019 03:28 am ET",The Daily Shot: Odds of a Sanders or Warren Nomination Starting to Impact Health Care Stocks,
211,"November 11, 2019 04:29 pm ET","Sustainable Funds Enjoy Record Inflows, Still Back Big Oil and Gas","Some of the biggest U.S. sustainable funds are invested in oil-and-gas companies, whose practices often have been attacked by environmental activists. "
212,"November 11, 2019 03:08 pm ET",Selloff in Complex Investments Flashes Warning for Junk Bonds,"Some securities in the $680 billion market for collateralized loan obligations, or CLOs, lost about 5% in October, reflecting worries about rising risk in the complex investment vehicles."
213,"November 11, 2019 12:37 pm ET","ICE, Oil Traders Team Up on New Mideast Crude Futures ",Energy-markets giant Intercontinental Exchange will team up with Abu Dhabi’s state oil producer and some of the world’s biggest oil companies to launch a new futures exchange in the emirate. 
214,"November 11, 2019 11:42 am ET",PE Daily: BP Raises Second Fund | Owl Rock Sells GP Stake | Blackstone Buys Bumble    ,Good day! It’s Veterans Day here in the U.S. Thank you to those of you out there who have served in our armed forces and to all of your families.  
215,"November 11, 2019 11:17 am ET",Amazon’s Heavy Recruitment of Chinese Sellers Puts Consumers at Risk,"The giant retail platform has included listings for banned, unsafe, counterfeit, mislabeled products. One reason: It aggressively wooed China’s manufacturers to cut out the middleman and sell directly to Americans."
216,"November 11, 2019 10:49 am ET","Daly Says Fed Can’t Ignore Climate Change, as Brainard Says Issue May Have Implications for Neutral Rate    ","Good day. San Francisco Fed President Mary Daly and Fed governor Lael Brainard stressed the need for the U.S. central bank to consider climate change when evaluating the economic outlook, as Ms. Daly’s bank hosted a conference on the issue Friday. Also last week, Atlanta Fed chief Raphael Bostic discussed how his district is on the front lines of dealing with climate change.  "
217,"November 11, 2019 10:01 am ET",Depressed Oil Prices Create Tough Environment for Aramco IPO—Energy Journal,
218,"November 11, 2019 08:22 am ET","Frackers Prepare to Pump Less, Curbing U.S. Oil Growth","After pushing U.S. oil and natural-gas production to record levels, some shale companies are doing the unthinkable: They are planning to pump less."
219,"November 11, 2019 07:00 am ET",BP Energy Raises About $350 Million for Second Fund,BP Energy Partners recently closed on almost $350 million to pursue its strategy of investing in businesses that help industries gain access to natural gas. 
220,"November 10, 2019 12:43 pm ET",Louisiana: The Trial-Lawyer State,John Bel Edwards has encouraged lawsuits that have cost jobs.
221,"November 10, 2019 12:00 pm ET",Aramco’s Big Profit Slide Shows Scale of Risk Ahead of IPO,"Saudi Aramco revealed a steep drop in profit related to attacks on its facilities in September that briefly halved its oil output, highlighting the risks to investors ahead of what could be the world’s largest IPO."
222,"November 10, 2019 07:11 am ET",Top Female Deal Makers Shaping Private Equity’s Present & Future,"Each year, Private Equity Analyst honors a group of women who have risen through the ranks at their respective firms to help reshape the face of industry itself. This year’s Women to Watch honorees showcase the depth of experience and talent as well as the range of backgrounds and skills women bring to the negotiating table."
223,"November 10, 2019 07:00 am ET",U.S. Oil’s Growth Challenges Investors ,The U.S. has become the world’s leading oil producer. That isn’t making it any easier on the companies doing the producing. 
224,"November 10, 2019 05:00 am ET",Unloved Assets Join Market Rally in Latest Sign of Optimism ,"Investors are piling into global stocks, emerging markets and commodities, as a more-optimistic outlook on trade and growth fuels a renewed appetite for comparatively risky assets. "
