,date,title,summary
108,"August 2, 2017 07:19 am ET",OPEC Considers How To Unwind Output Cut Deal—Energy Journal,OPEC Considers How To Unwind Output Cut Deal
109,"August 2, 2017 06:47 am ET",Today’s Top Supply Chain and Logistics News From WSJ,"Delivering up-to-the minute news, analysis, interviews and explanatory journalism on logistics, supply-chain management, e-commerce and more"
110,"August 2, 2017 05:37 am ET",Rio Tinto Can’t Just Mine The Current Rich Vein Forever ,"Rio Tinto’s results were impressive, but the current favorable environment won’t last forever. "
111,"August 2, 2017 05:30 am ET",OPEC’s ‘Catch-22’: How to Unwind Its Deal to Cut Oil Output ,OPEC and other big oil producers are facing a new high-wire act: how to keep the oil market calm if they decide to lift their output curbs and ramp production back up.
112,"August 2, 2017 05:26 am ET",Rio Tinto in Giving Mood After Strong First Half of Year,The mining company plans to return a total $3 billion to shareholders in 2017 after profit jumped and debt fell over the first half of the year. 
113,"August 2, 2017 03:55 am ET","WSJ City: Rio Tinto’s $1 Billion Buyback, SocGen Profit Slides, BOE Rate Rise Seen in Q1",
114,"August 2, 2017 01:26 am ET",WSJ’s Daily Shot: America’s Infrastructure Neglect Worsens,
115,"August 2, 2017 12:01 am ET",What’s News: Business & Finance,What’s News: Business & Finance
116,"August 2, 2017 12:01 am ET",What’s News: Business & Finance,What’s News: Business & Finance
117,"August 1, 2017 11:49 pm ET",What’s News: Business & Finance,What’s News: Business & Finance
118,"August 1, 2017 09:28 pm ET",Oil Prices Extend Decline Ahead of U.S. Data,"Crude futures extended overnight declines in Asia on Wednesday, partially undoing more than a week straight of gains as reality regarding supplies comes back into view. "
119,"August 1, 2017 06:51 pm ET",Quantum-Backed Company Buys $525 Million in Assets From Samson Resources,"Buyer Rockcliff Energy is currently active in the ArkLaTex region, the San Andres horizontal play and the Delaware Basin."
120,"August 1, 2017 05:07 pm ET",Oil Futures Flash a Buy Signal,Patience is paying off for investors who stuck with bullish oil bets this year. Near-term oil prices are close to rising above longer term prices—a long anticipated shift that signals the global glut in crude may be easing. 
121,"August 1, 2017 05:00 pm ET",Oil Prices Fall as OPEC Doubts Emerge,Oil prices fell from a two-month high as investors once again began to doubt OPEC’s ability to curtail production and make a dent in the global supply glut.
122,"August 1, 2017 02:28 pm ET","Eurozone Economy Speeds Up, Boosting Case for ECB Taper","Eurozone economic growth gathered pace in the three months to June, making it more likely the European Central Bank will remove some of its stimulus measures this year. "
123,"August 1, 2017 01:02 pm ET",Vendors Keep the Spirit of Brooklyn Street Alive ,"Downtown Brooklyn’s legendary Fulton Mall has made the tragic transition from beloved mom-and-pop strip to chain-store shopping spot. But unlike other local streets undergoing similar changes, the stretch somehow feels as lively and colorful as ever. "
124,"August 1, 2017 12:25 pm ET","Europe’s Largest Oil Refinery Disabled by Fire, Raising Fuel Prices Globally ","The largest crude-oil refinery in Europe may not reopen until later this month after being knocked offline by a fire over the weekend, causing gasoline and other fuel prices to rise globally, says Shell, the facility’s operator. "
125,"August 1, 2017 12:22 pm ET","WSJ City PM: Deutsche Bank Makes London Commitment, Trading Slump Rattles Goldman Executives, Oil Prices Signal Shift",
126,"August 1, 2017 11:37 am ET",U.S. Factory Activity Continued to Expand in July,"U.S. factory activity expanded for the 11th consecutive month in July, highlighting steady economic growth heading into the second half of the year."
127,"August 1, 2017 09:43 am ET",U.S. Fundraising Climbs Back to the Boom Era With $180.82 Billion Haul ,"Total capital raised by the industry in the first half of this year hit its highest level since the second half of 2007, but year-over-year increases in capital raised for strategies such as restructuring, distressed debt and real assets suggest more investors are hedging their bets. "
128,"August 1, 2017 09:37 am ET",Roundups,A collection of private-equity fundraising stories from WSJ Pro Private Equity and WSJ Pro Venture Capital
129,"August 1, 2017 09:29 am ET",BP Says It Can Now Profit at Oil Below $50,"British oil giant BP reported modest profit for this year’s second quarter and said it can now break even when oil is at $47 a barrel, but its performance continued to be held back by the 2010 Gulf of Mexico oil spill."
130,"August 1, 2017 09:26 am ET",LBO Profile: O’Brien-Staley Seeks to Buy Loans From Institutions Under Pressure,O’Brien-Staley Partners is on the lookout for unloved loans. Commercial and industrial loans it can buy at discounted prices. Assets that trade down because of the ripple effects from distressed markets. 
131,"August 1, 2017 09:17 am ET",Private Equity Analyst’s Annual Summer Reading List,"Each summer for the past nine years, we have asked private-equity and venture professionals to share their recommended summer reads. Below is a sampling of this year’s picks. "
132,"August 1, 2017 08:28 am ET",Noreika Punts on Delay of CFPB Rule | Can ‘the Mooch’ Return to Wall Street? | Goldman in Unusual Place—Last | Verlaine’s Take: Saving EU Consumers Money on Banking Fees,"The Wall Street Journal’s financial regulation newsletter for Tuesday, Aug. 1, 2017."
133,"August 1, 2017 08:08 am ET",The Morning Download: Vanguard’s New CEO Passed Through CIO’s Office on Way to Top,"Typically, the only CIO who makes it to the top of a financial services company is a chief investment officer. In the case of Vanguard Group, the new CEO actually served as both chief investment officer and chief information officer during a unique and circuitous route to the apex of the company."
134,"August 1, 2017 07:48 am ET",Big Oil Bites the Low-Price Bullet,Investors need to make sure companies can keep paying their generous dividends.
135,"August 1, 2017 07:17 am ET",BP Is Back In The Black—Energy Journal,BP Returns to Profit in Q2
136,"August 1, 2017 06:59 am ET","The 10-Point: Gerard Baker on Scaramucci’s Ouster, a Comfort-Food TV Deal, Memoirs at the Movies and More","A personal, guided tour to the best scoops and stories every day in The Wall Street Journal, from Editor in Chief Gerard Baker."
137,"August 1, 2017 05:20 am ET",Here’s How U.S. Companies Have Been Earning Money: By Spending More,
138,"August 1, 2017 03:46 am ET","WSJ City: Brexit to Raise Bank Costs, BP Returns to Profit",
139,"August 1, 2017 02:17 am ET",WSJ’s Daily Shot: U. S. Households’ Exposure to Stocks Highest Since the Dot-Com Bubble,
140,"July 31, 2017 11:59 pm ET",Venezuela Bonds Fall After U.S. Announces Sanctions,Venezuelan bonds slipped Monday after the U.S. announced additional sanctions on the country but stopped short of targeting its oil sector.
141,"July 31, 2017 11:44 pm ET",What’s News: Business & Finance,What’s News: Business & Finance
142,"July 31, 2017 09:49 pm ET",Crude Prices Continue to Climb,"Oil futures pushed to session highs by midday Tuesday in Asia, adding to more than a week straight of gains which have allowed the U.S. benchmark to move back above $50 a barrel for the first time in two months."
143,"July 31, 2017 06:18 pm ET",Natural Gas Posts Worst Day Since February,Natural-gas prices on Monday had their worst day since February as traders began to bet that summer is going to go out with a whimper.
144,"July 31, 2017 05:57 pm ET",U.S. Freezes Assets of Venezuela’s President,"The U.S. has frozen the assets of Venezuelan President Nicolás Maduro, citing human rights abuses and calling a Sunday vote to give his administration the powers to redraft the constitution an illegitimate action. "
145,"July 31, 2017 04:37 pm ET",Oil Prices Settle Above $50,Oil prices turned higher late Monday afternoon to settle above $50 a barrel for the first time in more than two months.
146,"July 31, 2017 12:57 pm ET",Venezuela’s Leader Doubles Down on Disputed Election ,"President Nicolás Maduro on Monday threatened to imprison his adversaries, as opposition leaders said an election a day earlier to give his administration the powers to redraft the constitution was fraudulent."
147,"July 31, 2017 08:56 am ET","Morning Must-Reads: Trump Fallout, OPEC Headaches, Supermarket Surplus","The Must Reads are part of the Journal’s Morning MoneyBeat newsletter. To receive the newsletter via email, see http://on.wsj.com/MoneyBeatUSSignup"
148,"July 31, 2017 08:55 am ET",Corporate America Is Doing Surprisingly Well,"With 57% of S&P companies having reported earnings, some 73% have reported sales above analysts' expectations, a record should it hold through the remainder of earnings season, according to FactSet. The proportion of companies beating sales estimates is running well above the five-year average of 53%."
149,"July 31, 2017 08:16 am ET",The Morning Download: Manufacturers’ Digital Business Begins with ‘Bimodal’ Model,"A new survey reveals that manufacturing leads other sectors in adopting for planning to adopt a bimodal IT strategy. By industry, 82% of manufacturers said they were hiring to meet demand for bimodal IT, while energy, oil, gas utilities, and retailers followed, at 57%. Health-care firms were the least likely to seek bimodal IT workers, at 23%."
150,"July 31, 2017 07:51 am ET",OPEC Can’t Stop Pumping Crude—Energy Journal,Major Oil Producers Are Struggling to Keep Their Promise to Rein in Production
151,"July 31, 2017 07:14 am ET",The Morning Ledger: Fiscal Discipline At Commodity Companies Drives Credit Upgrades,Corporate credit upgrades reach a record; U.S. corporate profit growth nears six-year high; Charter spurns Spring merger.
152,"July 31, 2017 07:04 am ET",Today’s Top Supply Chain and Logistics News From WSJ,"Delivering up-to-the minute news, analysis, interviews and explanatory journalism on logistics, supply-chain management, e-commerce and more"
153,"July 31, 2017 06:47 am ET","The 10-Point: Gerard Baker on Charter Rebuffing Sprint, Widening GOP Rifts Over Trump and More","A personal, guided tour to the best scoops and stories every day in The Wall Street Journal, from Editor in Chief Gerard Baker."
154,"July 31, 2017 05:00 am ET",Corporate Discipline at Commodity Firms Fuel Debt Upgrades,"Cheniere Energy Partners L.P., Brazilian iron ore miner Vale S.A. and oil refiner Tesoro Corp. are among companies to score investment-grade credit ratings."
155,"July 31, 2017 03:11 am ET","WSJ City: HSBC Plans Share Buyback, Europe’s Banks Show Green Shoots",
156,"July 31, 2017 12:01 am ET",What’s News: Business & Finance,What’s News: Business & Finance
157,"July 30, 2017 10:00 pm ET",Oil Futures Advance on Signs of a Tighter Market,"Oil prices added to last week’s big gains, hitting fresh two-month highs amid further signs that U.S. oil production is slowing down. "
158,"July 30, 2017 07:21 pm ET",Protests Turn Deadly as Venezuela Holds Vote,"Deadly protests flared across Venezuela as President Nicolás Maduro’s supporters voted Sunday for a new assembly to redraft the constitution, a pivotal move that has been sharply criticized by countries from Argentina to the U.S."
159,"July 30, 2017 06:26 pm ET",Shell Shuts Down Europe’s Largest Refinery After Fire,"A fire at a high-voltage electricity switch station prompted the shutdown of the refinery in Rotterdam, the Netherlands, which had the capacity to refine 400,000 barrels of crude oil a day."
160,"July 30, 2017 03:41 pm ET",OPEC Has a Crippling Problem: Its Members Can’t Stop Pumping,"Eight months after a landmark deal to cut oil output to force prices up, big budget obligations are driving members to keep producing."
161,"July 30, 2017 02:57 pm ET",U.S. Weighs Sanctions Against Venezuela’s Oil Industry,"U.S. government officials are considering stepping up sanctions against Venezuela by targeting its vital oil industry, although an embargo against Venezuelan crude oil imports into the U.S. is off the table for now, people familiar with the deliberations say."
162,"July 30, 2017 07:00 am ET",Investors Eager to Hear Shale Companies’ Plans for Rest of 2017 ,"Some American oil producers may be pumping the brakes on new drilling, but as the leading shale players get set to report earnings this week, investors will be watching closely to see how much the industry is really slowing its ambitious plans for growth. "
163,"July 29, 2017 10:27 am ET","This Week on the Frontiers, July 29th 2017",
164,"July 29, 2017 07:00 am ET",Canada’s Loonie Takes Flight ,"The Canadian dollar—known as the loonie for the bird on its single-dollar coin—is on a tear, and traders and investors are betting it will remain strong. "
165,"July 28, 2017 09:02 pm ET","S&P 500, Nasdaq Fall for the Week on Pressure From Tech Sector","The Dow Jones Industrial Average posted a gain for the day and the week, while a fall in technology shares contributed to declines in the S&P 500 and Nasdaq Composite."
166,"July 28, 2017 04:58 pm ET","U.S. Economy Glides Back to Steady, Modest Growth Path",The U.S. entered the ninth year of economic expansion in steady but unspectacular fashion that shows little sign of abating.
167,"July 28, 2017 03:43 pm ET","Oil Gains on OPEC Cuts, Rising Demand","Oil prices rose every day this week, their best since December, as renewed optimism about falling supply and rising demand refuel a rally. "
168,"July 28, 2017 02:38 pm ET",Five Point Targets $650 Million for Midstream Fund,"The Houston private-equity firm is seeking a larger amount than it collected for its previous pool of capital, which wrapped up with more than $450 million."
169,"July 28, 2017 01:54 pm ET",Big Oil Posts Healthy Profits,"The largest U.S. energy companies reported robust profits on Friday, continuing a quarter in which the world’s big oil firms reported their strongest gains since a pronounced price crash began in 2014."
170,"July 28, 2017 01:51 pm ET",U.S. Oil Rig Count Rises by Two,"The number of rigs drilling for oil in the U.S. rose by two in the past week to 766, according to oil-field services company Baker Hughes, now a unit of General Electric Co. "
171,"July 28, 2017 01:39 pm ET","Merck Says Cyberattack Hit Production, Will Hurt Profit ",Merck said its second-quarter earnings rose as the drugmaker recorded blockbuster growth for its cancer drug Keytruda.
172,"July 28, 2017 12:17 pm ET",Arle Capital Sold to Adviser in Latest Twist in Candover Tale ,Newgate Private Equity will buy Arle and oversee its final investment.
173,"July 28, 2017 11:33 am ET",America Has a Bacon Problem: Our Pigs Aren’t Fat Enough ,A hankering for lardier pork chops and greasier sausages has butchers scrambling to acquire the porky breeds of yore.
174,"July 28, 2017 09:35 am ET","Chevron Swings to Profit, Buoyed by Cost Cuts",Chevron swung to a profit in the second quarter as it benefited from higher crude oil and natural gas prices and efforts to cut costs throughout its operations. 
175,"July 28, 2017 09:11 am ET",Is $51K Too Much to Pay for an Acre in the Permian Basin?,How much is too much to pay for drilling land in the Permian Basin?
176,"July 28, 2017 08:21 am ET",These States Couldn’t Dig the Mining Industry More Right Now,"Mining was the driving force behind growth in Texas, West Virginia and New Mexico, which grew 3.9%, 3% and 2.8% respectively -- the fastest rates of any states -- in the first quarter."
177,"July 28, 2017 07:47 am ET",Meet Trump’s Pick to Shake Up the Fed | U.S. Targets Bitcoin Exchange | SEC May Dial Back on Private Equity | Tracy’s Take: Unanswered Question About MetLife v. FSOC,"The Wall Street Journal’s financial regulation newsletter for Friday, July 28, 2017."
178,"July 28, 2017 07:31 am ET","The Morning Ledger: GOP Lawmakers, White House Outline Tax Plan",Top Republicans said the border-adjusted tax is dead. Jeff Bezos briefly becomes the richest person in the world and Uber is considering GE CEO Jeffrey Immelt as a candidate for its top post.
179,"July 28, 2017 07:22 am ET",Glencore Scrutinized Over Congo Deal—Energy Journal,Glencore Is Under Investigation for Payments in Congo Deal
180,"July 28, 2017 06:37 am ET","The 10-Point: Gerard Baker on the Failed ‘Skinny’ Obamacare Repeal, Strong Corporate Earnings, Semiconductor Nationalism and More","A personal, guided tour to the best scoops and stories every day in The Wall Street Journal, from Editor in Chief Gerard Baker."
181,"July 28, 2017 06:36 am ET",Today’s Top Supply Chain and Logistics News From WSJ,"Delivering up-to-the minute news, analysis, interviews and explanatory journalism on logistics, supply-chain management, e-commerce and more"
182,"July 28, 2017 01:25 am ET",WSJ’s Daily Shot: U.S. Rental Vacancies Rise,
183,"July 28, 2017 12:01 am ET",Venezuela’s Government Sees Conspiracies in Medical Aid,The socialist government says its foes are exaggerating the country’s health crisis to provide a pretext for meddling or even invasion.
184,"July 28, 2017 12:01 am ET",What’s News: Business & Finance,What’s News: Business & Finance
185,"July 27, 2017 11:53 pm ET",What’s News: Business & Finance,What’s News: Business & Finance
186,"July 27, 2017 09:58 pm ET",Oil Prices Pull Back After Hitting Two-Month High ,Oil futures eased in Asia on Friday as investors widely moved to the sidelines in commodities and equities after this week’s strength.  
187,"July 27, 2017 06:39 pm ET","Procter & Gamble, Activist Spar Over Latest Results","Procter & Gamble Co. sparred with activist investor Nelson Peltz on Thursday, with the two sides debating whether the company’s latest results prove a turnaround is taking hold."
188,"July 27, 2017 03:51 pm ET",Oil Prices Rise on Building Momentum ,Oil prices rose to fresh two-month highs Thursday on building momentum from recent inventory declines. 
189,"July 27, 2017 03:25 pm ET",Putin Condemns U.S. ‘Impudence’ as Congress Pushes New Sanctions,"Russian President Vladimir Putin stepped up his rhetoric against the U.S., saying the Kremlin would no longer tolerate American “impudence” in advancing tough new sanctions on Moscow. "
190,"July 27, 2017 01:34 pm ET",Shell Prepares for ‘Lower Forever’ Oil Prices,"Royal Dutch Shell laid out a pessimistic vision for the future of oil, even as the company reported success in generating cash during a prolonged downturn."
191,"July 27, 2017 11:11 am ET",China’s Next Target: U.S. Microchip Hegemony,"The semiconductor industry, a stalwart of the global economy, is succumbing to fierce nationalistic competition, as China aims to dominate the market as it did with steel and solar panels. Washington, in an unusual show of bipartisanship, is fighting back."
192,"July 27, 2017 08:48 am ET","Morning Must-Reads: Latest on Health Care, Fed Recap, the End of Libor","The Must Reads are part of the Journal’s Morning MoneyBeat newsletter. To receive the newsletter via email, see http://on.wsj.com/MoneyBeatUSSignup"
193,"July 27, 2017 07:59 am ET",R.I.P. Libor | Fed Pick: Bank Rules Need ‘Refinements’ | Brokerages Push Loans Against Stock | Deng’s Take: China’s Clampdown Shuts Out Investors,"The Wall Street Journal’s financial regulation newsletter for Thursday, July 27, 2017."
194,"July 27, 2017 07:31 am ET","Fed Likely to Act Soon on Portfolio Cuts | Quarles: Bank Rules Need ‘Refinements’ |  Nowotny: ECB Should Signal on Easing of Stimulus | Brazil Cuts Key Rate |  Harrison’s Take: A Rather Placid Statement Shows Fed Cruising, At Least For Now","The Wall Street Journal’s central banking newsletter for Thursday, July 27, 2017"
195,"July 27, 2017 07:26 am ET","The Morning Ledger: U.K. to Phase Out Libor, Following U.S.","The U.K. follows the U.S. in replacing the London Interbank Offered Rate, Foxconn builds a plant in Wisconsin and Deutsche Bank reports higher profit, but lower revenue."
196,"July 27, 2017 07:11 am ET",Shell On Oil Prices:’Lower Forever’—Energy Journal,Shell Chief Executive Coined a New Phrase for the Direction of Slumping Oil Prices:'Lower forever'
197,"July 27, 2017 03:58 am ET","WSJ City: Deutsche Bank Profit Jumps, Lloyds Pinched by PPI",
198,"July 27, 2017 01:30 am ET",WSJ’s Daily Shot: The Strait of Hormuz Remains a Key Choke Point for Oil Markets,
199,"July 27, 2017 01:08 am ET",Noble’s Shriveled Asian Roots Won’t Catch Much Rain,Noble’s share price fell nearly 50% after it warned of another big loss and said it planned to sell of most of its global oil-and-gas assets. What’s left may have trouble surviving on its own.
200,"July 27, 2017 12:01 am ET",What’s News: Business & Finance,What’s News: Business & Finance
201,"July 26, 2017 09:12 pm ET",Oil Prices Pause in Asian Trading,Oil futures edged lower in Asian trading Thursday after fresh gains in the U.S. amid bullish weekly data on both supplies and production. 
202,"July 26, 2017 06:13 pm ET",Brazil’s Central Bank Cuts Selic Rate Another Percentage Point,"Brazil’s central bank reduced its overnight lending rate Wednesday for the seventh time since August, bringing the country’s notoriously high interest rates into the single digits for the first time in nearly four years."
203,"July 26, 2017 03:45 pm ET",Oil Gains After Stockpiles Show Larger-Than-Expected Drop ,Oil prices rose after U.S. data showing a larger-than-anticipated drop in the amount of crude in storage bolstered confidence that the oil market is tightening.
204,"July 26, 2017 03:12 pm ET",EU Cautions U.S. on Russia Sanctions Bill ,"The European Union stands ready to act “within days” if its concerns about the U.S. bill to impose new sanctions on Russia aren’t addressed, European Commission President Jean-Claude Juncker said. "
205,"July 26, 2017 12:49 pm ET",Banks Throw Seadrill a Lifeline,Offshore drilling contractor Seadrill said its banks have agreed to push back a deadline on talks over a debt restructuring plan that will likely require filing for chapter 11 bankruptcy. 
206,"July 26, 2017 12:32 pm ET","WSJ City PM: FCA Widens Scope for Accountability, Investors Keep Watch on Big Oil Costs, UK Growth Subdued",
207,"July 26, 2017 11:47 am ET","U.K. to Ban Sale of Diesel, Gasoline Vehicles by 2040","The U.K. said it would ban the sale of cars powered by traditional internal-combustion engines by 2040, joining other European regulators in a bold push toward electric cars that remain unpopular in the mass market."
208,"July 26, 2017 07:38 am ET",Trump: Cohn and Yellen Contenders to Lead Fed| What to Watch in Fed Statement | The Speech That Transformed European Markets | Australia’s Central Bank Won’t Follow Pack | Derby’s Take: Kashkari’s Dissents Grow More Important,"The Wall Street Journal’s central banking newsletter for Wednesday, July 26, 2017"
209,"July 26, 2017 07:28 am ET",Investors To Big Oil Firms: No Big Spending—Energy Journal,Investors To Big Oil Firms: No Big Spending
210,"July 26, 2017 07:13 am ET",Trump: Cohn and Yellen Contenders to Lead Fed| What to Watch in Fed Statement | The Speech That Transformed European Markets | Australia’s Central Bank Won’t Follow Pack | Derby’s Take: Kashkari’s Dissents Grow More Important,"The Wall Street Journal’s central banking newsletter for Wednesday, July 26, 2017"
211,"July 26, 2017 07:00 am ET",Investors to Big Oil: Restrain Yourselves,"Three years into an oil-price slump, investors want the world’s biggest oil companies to do something they have historically struggled with: Maintain some financial discipline."
212,"July 26, 2017 06:41 am ET",U.S. Shale Threatens Chemical Element of Aramco’s IPO,An expected surge in U.S. petrochemicals output challenges one of the main pillars of the energy giant’s plans to list.
213,"July 26, 2017 05:19 am ET",Stocks Rise Ahead of Fed Statement ,Stocks in Europe and Asia moved higher ahead of a closely watched announcement from the Federal Reserve. 
214,"July 26, 2017 03:10 am ET",Bank of Japan’s Latest Weak-Inflation Explanation: Labor Saving,Deputy Gov. Hiroshi Nakaso became the latest Bank of Japan official to flag improved productivity as an explanation for sluggish price growth—a view that has yet to gain much traction outside the central bank.
215,"July 26, 2017 01:35 am ET",WSJ’s Daily Shot: Could GOP’s Tax Reform Weaken Home Prices in High-Tax Areas?,
216,"July 25, 2017 11:50 pm ET",Oil Extends Rally Ahead of Official US Oil Data,"Oil built on Tuesday’s sharp gain in Asian trading Wednesday, supported by views that U.S. inventories may have fallen sharply last week"
217,"July 25, 2017 09:27 pm ET","Japan, Australia Stocks Start Strongly ","Amid an uptick in risk-on sentiment as the U.S. Senate will in fact debate a possible health-care overhaul, Japanese and Australian stocks opened strongly higher."
218,"July 25, 2017 07:49 pm ET","Caterpillar Boosts Outlook, Signaling Cautious Optimism",Caterpillar signaled cautious optimism about the global economy as it offered fresh evidence that it was recovering in many of its markets from a yearslong sales slump.
219,"July 25, 2017 07:13 pm ET",Strong Earnings Lift U.S. Stocks,"The Dow Jones Industrial Average climbed, bolstered by a flurry of upbeat corporate earnings. The blue-chip index added 0.5%."
220,"July 25, 2017 07:10 pm ET",Copper Prices Jump on IMF Growth Forecasts,"Copper prices rose to their highest level in more than two years Tuesday, on optimism that accelerating growth in Asia and Europe will stoke demand for the industrial metal."
