,date,title,summary
101,"July 25, 2019 07:12 pm ET","Pro Bankruptcy Briefing: Yielding to Protests, Puerto Rico Gov. Resigns | PG&E Gets Repreive From Creditor Challenge | Philly Refinery’s Ex-CEO Wants To Buy It    ","Good day. Ricardo Rosselló became Puerto Rico’s first governor to resign from office, touching off a new period of uncertainty for the bankrupt U.S. territory. PG&E Corp. stayed in exclusive control of its bankruptcy proceedings for at least two more weeks while it develops a process for avoiding a free-for-all among creditors. And the former CEO of Philadelphia Energy Solutions wants to buy the refinery business out of bankruptcy, he told WSJ Pro Bankruptcy.  "
102,"July 25, 2019 07:02 pm ET",PE Daily: Genstar’s David Golde’s Early Deal Roots | SoftBank Preps Second Vision Fund | Tile Raises $45 Million    ,"Good day! Many private-equity professionals get their first taste of dealmaking just after college, or in some cases even after graduate school. But as Laura Cooper writes, Genstar Capital’s David Golde learned the art of negotiation at a much younger age, while working for this father’s business.  "
103,"July 25, 2019 04:08 pm ET",Reversal in Oil Stockpiles Helps Support Crude Prices,"A slide in U.S. crude-oil stockpiles is adding to evidence that domestic supply growth could slow moving forward, an encouraging sign for bullish investors with prices still stuck in a tight range."
104,"July 25, 2019 03:41 am ET",The Daily Shot: How All the Fiscal ‘Juice’ Is Impacting the GDP Growth,
105,"July 24, 2019 07:07 pm ET","SoftBank Looks to Goldman, Apple for Sequel to $100 Billion Vision Fund",SoftBank is expected to invest $40 billion into its new technology megafund after securing backing.
106,"July 24, 2019 06:27 pm ET","China Sales, Higher Costs Weigh on Caterpillar ","Caterpillar trimmed back its profit forecast, amid lower sales in China and higher tariff and labor costs, as the machinery giant steers through a tricky moment in the global economy."
107,"July 24, 2019 06:08 pm ET",Helicopter Owner CHC Pressured Amid Prolonged Offshore Drilling Slump ,"The Irving, Texas-based company, which emerged from chapter 11 in 2017, told investors this week that it remains unprofitable amid weak revenue growth and rising costs. "
108,"July 24, 2019 05:38 pm ET",Silver Finally Gets Investor Love,"Investors are taking a shine to silver, as a soaring rally in gold puts the spotlight on the less expensive precious metal. Silver is on track for its best monthly performance since December. "
109,"July 24, 2019 05:01 pm ET",Silver Finally Gets Investor Love,"Investors are taking a shine to silver, as a soaring rally in gold puts the spotlight on the less expensive precious metal. Prices have risen 8.5% in July. "
110,"July 24, 2019 06:57 am ET",Equinor Net Profit Seen Slipping Lower -- Earnings Preview,
111,"July 24, 2019 04:38 am ET",The Daily Shot: Mortgage-Financed Home Purchases Recover; Cash Buyers Exit,
112,"July 23, 2019 05:35 pm ET",Shareholders Question ‘Precipitous’ Collapse of Oilfield-Services Company Weatherford,Weatherford International shareholders are battling to form an official committee to help them investigate the bankrupt oilfield-servics company’s “precipitous destruction of equity value.”
113,"July 23, 2019 08:45 am ET",PE Daily: Silver Lake Backs EverCommerce at Nearly $2 Billion Valuation | Blackstone Adds Fresh $1.1 Billion to European Property Haul    ,"Good day! I’m back from my week in the New Hampshire woods and find myself facing a different kind of mountain, one made of unopened emails.  "
114,"July 23, 2019 04:41 am ET",The Daily Shot: Consumers Expect Lower Rates Ahead,
115,"July 22, 2019 08:53 pm ET",Trump Touts Tech Industry Support for Huawei Exemptions,"President Trump agreed to grant timely licensing decisions to U.S. technology companies that want to continue lucrative sales to Huawei Technologies, as the administration seeks to restart trade talks with China. "
116,"July 22, 2019 06:39 pm ET",Iran Says It Has Arrested Alleged U.S. Spies; Washington Denies Claims ,"Iran said it has arrested 17 Iranian citizens on charges of spying for the U.S., a claim that President Trump dismissed as “totally false,” amid fears that growing tensions between Iran and Western countries could spiral out of control."
117,"July 22, 2019 05:13 pm ET",U.S. Imposes New Sanctions on Chinese Company for Transporting Iranian Crude Oil,"The U.S. is imposing new sanctions against a Chinese company for transporting Iranian crude, a move that widens the U.S. campaign of pressure on the Islamic republic. "
118,"July 22, 2019 04:38 pm ET",Stocks Inch Higher at Start of Busy Week,"U.S. stocks inched higher Monday, as investors prepared for a week filled with fresh economic data and more corporate earnings reports."
119,"July 22, 2019 03:19 pm ET",Oil Posts Modest Gain on Iran Tensions,"Though tanker rates have surged, crude prices are not reflecting geopolitical drama that is playing out, analysts say."
120,"July 22, 2019 02:28 pm ET",Occidental Pushes Back on Icahn’s Board Plan,Leaders of Occidental Petroleum are pushing their shareholders to reject billionaire investor Carl Icahn’s bid to replace four directors at the company.
121,"July 22, 2019 01:57 pm ET","SNC-Lavalin to Restructure, Focus on Core Engineering Services ",The struggling engineering-and-construction company said it will exit the fixed-price construction business and explore the sale of its oil-and-gas operations as part of a reorganization.
122,"July 22, 2019 01:16 pm ET",Oil Service Stocks May Have Dug Enough ,Shale drillers’ pullback is forcing the companies that service their businesses to have better focus themselves. 
123,"July 22, 2019 12:51 pm ET",Hardy Oil & Gas Revises Sale Price of Subsidiary for $8.8 Mln,
124,"July 22, 2019 12:48 pm ET","As Drillers Struggle, Shale Investors Seek Safety in Mineral Rights","Investors who want a piece of the U.S. oil boom but are wary of struggling shale companies are turning to another option: They are gobbling up mineral rights typically held by individual landowners, hoping to benefit from production growth. "
125,"July 22, 2019 10:28 am ET",BP Boosts Its Biofuels Business with Brazilian Joint Venture ,"Energy giant BP is doubling down on biofuels with a joint venture with agricultural trader Bunge in Brazil, betting that the global movement to reduce carbon emissions will boost demand for low-carbon fuels. "
126,"July 22, 2019 09:15 am ET","Stocks to Watch: Charles Schwab, Halliburton, Equifax and More","Shares of Charles Schwab, Freeport-McMoRan, and Symantec are expected to trade actively in Monday’s session. "
127,"July 22, 2019 09:02 am ET",U.S. Shale Benefits As Gulf Tensions Rise—Energy Journal,
128,"July 22, 2019 07:02 am ET",U.S. Shale Producers Benefit as Oil Disruptions Plague Middle East,"Oil supply disruptions in hot spots around the world are putting pressure on the cost of buying and shipping crude. But the turmoil is benefiting U.S. shale producers, whose oil fields and tankers are partly filling the void."
129,"July 21, 2019 07:15 pm ET","Tlaib Has Fans, and Some Voters to Win Over, at Home ","Rep. Rashida Tlaib, who has taken on a national profile as a target of President Trump, has ardent backers in her Michigan district but also voters who are taking a wait-and-see approach about their new congresswoman."
130,"July 21, 2019 03:38 pm ET",Consumer Giants Turn From Diapers to Eye Rollers and Jelly Masks,"Facing stagnant sales of household mainstays from diapers to detergent, the world’s biggest consumer-products companies are trying to crack the lucrative market for influencer-pitched, millennial-approved skin-care products."
131,"July 21, 2019 02:11 pm ET",Iran Pairs Diplomacy With Military Pushback as Gulf Tensions Soar ,"Ships plying the Strait of Hormuz are getting caught in the middle as Iran pushes back against U.S. sanctions and maneuvers around a more muscular American regional presence, raising the risk of direct military confrontation. "
132,"July 20, 2019 03:04 pm ET",Iran’s Tanker Seizure Presents U.K. With Policy Dilemma,"Britain’s decision to seize an Iranian tanker off the coast of its overseas territory of Gibraltar earlier this month is fast snowballing, dragging the country deeper into an escalating crisis between Iran and the West."
133,"July 20, 2019 12:11 pm ET","WSJ Emerging and Growth Markets, July 20th 2019",A weekly roundup of key news affecting emerging and growth markets from the Wall Street Journal and beyond.
134,"July 19, 2019 08:32 pm ET",Corrections & Amplifications,"Corrections & Amplifications for the edition of July 20-21, 2019 "
135,"July 19, 2019 08:24 pm ET",Iran Seizes British-Flagged Oil Tanker ,"Iranian forces seized a British-flagged oil tanker in the Strait of Hormuz, as mounting tensions between Tehran and the West risked further disruption of commercial shipping in the strategically vital waterway."
136,"July 19, 2019 07:02 pm ET",Schlumberger Names New CEO as Shale Woes Persist,"Schlumberger named Olivier Le Peuch as its next chief executive, while the Houston oil-field-services company continues to suffer from a slowdown in spending by U.S. shale drillers. "
137,"July 19, 2019 06:33 pm ET",Stocks End Week Lower as Fed Signals Small Rate Cut,"U.S. stocks wavered in the past week, torn between mixed corporate earnings reports and shifting expectations of Federal Reserve intervention later this month."
138,"July 19, 2019 03:47 pm ET",Oil Posts Worst Week Since May     ,"Oil prices edged higher Friday but still logged their worst week since May, the latest turn lower for crude in 2019 as fears of excess supply buffet prices."
139,"July 19, 2019 02:23 pm ET",Persian Puzzle for Oil Prices,"On the one hand, the White House has to be pleased about the oil market’s mild reaction to a series of incidents this week involving Iran. On a deeper level, though, it should be concerned. "
140,"July 19, 2019 10:17 am ET",Today’s Logistics Report: Raising Railroad Efficiency; Bulking Up Rates; Amazon’s Merchant Deal,Today’s Top Supply Chain and Logistics News from WSJ.
141,"July 19, 2019 06:40 am ET","Real Time Economics: The Fed’s Next Cut, Lagarde’s Tall Task and Energy’s Step Back",
142,"July 18, 2019 07:27 pm ET",Trump Says U.S. Ship Downed Iranian Drone,"President Trump said the U.S. Navy destroyed a drone that was flying too close to a U.S. warship in the Strait of Hormuz, hours after Iranian forces said they had seized a foreign tanker, the latest in a series of incidents that have ratcheted up tensions in a vital oil shipping route.   "
143,"July 18, 2019 03:54 pm ET",Oil Drops to One-Month Low,Oil prices fell to a one-month low as concerns about demand outweighed potential supply risks.  
144,"July 18, 2019 02:12 pm ET",Nickel Prices Reach One-Year Highs,"Nickel prices rose to a one-year high, boosted by constricting supply and bullish speculators."
145,"July 18, 2019 09:14 am ET",Pro Bankruptcy Briefing: Madoff Feeders to Return $860 Million | Aegerion Owner Beats Back Chapter 11 Challenge | Exco in Texas Showdown With Williams    ,"Good day. An offshore fund manager that channeled cash to Bernie Madoff will return $860 million after making a deal with the liquidators of his defunct investment firm. The parent company of bankrupt cholesterol drugmaker Aegerion Pharmaceuticals Inc. beat back a challenge to a chapter 11 proposal. And Exco Resources Inc., which recently emerged from bankruptcy, is in a Texas standoff with a pipeline operator over its plan to flare its excess natural gas.  "
146,"July 18, 2019 05:01 am ET",The Daily Shot: Percentage of Americans Working for State and Local Governments Lowest in Decades,
147,"July 17, 2019 07:07 pm ET",Santos Narrows 2019 Production Guidance After Record 1H Output,
148,"July 17, 2019 06:57 pm ET",Why We Need Someone Like Ike,"War is likelier in a world without inhibition, and the cyber era has elevated undisciplined leaders. "
149,"July 17, 2019 04:59 pm ET",Stocks Lower as Earnings Season Starts With Growth Concerns,"U.S. stocks fell as the start of earnings season exposed some weakness in companies, potentially damping investors’ outlook for economic growth."
150,"July 17, 2019 04:37 pm ET",Shale Output Shows Signs of Slowing ,"Oil prices are back on the rise, but shale drillers still have little incentive to ramp up activity. "
151,"July 17, 2019 09:51 am ET",Hurricane Energy Falls after Investor Sells GBP51.2 Mln Stake,
152,"July 17, 2019 09:51 am ET",Canada Inflation Rate Rises,"Canada’s annual inflation rate rose at a slower pace in June, roughly matching market expectations, as consumer gas prices fell."
153,"July 17, 2019 08:44 am ET","Stocks to Watch: Bank of America, PNC, United Airlines and More","Bank of America, PNC Financial, United Airlines, CSX, and Cintas are among Wednesday’s stocks to watch. "
154,"July 17, 2019 07:00 am ET",Texas Showdown Flares Up Over Natural-Gas Waste,"A pipeline company is challenging Texas’ practice of allowing drillers to set unwanted natural gas on fire, in a case that could test state limits for how much of the fuel can legally go to waste."
155,"July 17, 2019 04:18 am ET",The Daily Shot: Congress Has to Raise the Debt Ceiling by Early September,
156,"July 17, 2019 04:15 am ET",Anglo African Raises Money for Congo Republic Drilling,
157,"July 16, 2019 05:08 pm ET",Pemex Seeks to Reverse 15-Year Decline in Oil Output ,Mexican state oil company Petróleos Mexicanos plans to ramp up investment with tax breaks and government support over the next three years to raise oil production that has been declining for the past 15 years.
158,"July 16, 2019 04:33 pm ET",Stocks Are Dragged Lower by Energy Shares,"U.S. stocks retreated from records on Tuesday, dragged down by shares of energy companies. "
159,"July 16, 2019 03:41 pm ET",Natural-Gas Traders Bet Heat Wave Will Fizzle ,"Natural-gas prices declined for the second straight day on signs that producers will continue to push output to new highs, while forecasts that the current heat wave will dissipate threatened demand. "
160,"July 16, 2019 08:54 am ET",PE Daily: BlackRock Raises $2.5B | Actis Nets Abraaj Funds | Blackstone’s $750M Vungle Deal    ,"Good morning to all from steamy New York, where I am sitting in for WSJ Pro Private Equity’s Laura Kreutzer this week. The heat is definitely on these days, and not just in Times Square. From fundraising to dealmaking, the summer doldrums have yet to set in. For instance, BlackRock is well on its way to raising a reported target of $3.5 billion for its latest infrastructure fund, based on regulatory filings posted late Monday. And fundraising efforts by Argonaut and WILsquare have progressed as well.  "
161,"July 16, 2019 05:51 am ET",Gabon's Palm Oil Output Rises 62.6%,
162,"July 16, 2019 03:38 am ET",The Daily Shot: New York Regional Factory Employment Deteriorates Sharply,
163,"July 15, 2019 07:09 pm ET",Trump’s Foes Are Crazier Than He Is,"Both parties have lost their heads, but radical left-wing policies are worse than intemperate tweets."
164,"July 15, 2019 06:01 pm ET",Callon Petroleum to Buy Carrizo Oil in All-Stock Deal ,Callon Petroleum shares fell sharply Monday after the oil producer said it had struck an all-stock deal to acquire Carrizo Oil & Gas.
165,"July 15, 2019 05:05 pm ET",Investors Aren’t Buying This Oil Rebound,"U.S. oil prices have risen by about a third this year, but shares of energy producers are being left behind the rally."
166,"July 15, 2019 04:55 pm ET",Fracking Sand Supplier Shale Support Files for Bankruptcy ,"A reorganization plan for the Lafayette, La.-based company will include reducing some of the debt on its balance sheet by converting it into equity, a court filing said. "
167,"July 15, 2019 04:29 pm ET",‘David Park: A Retrospective’ Review: Subtle Humanism in Thick Paint,"The underrated Bay Area School artist—who, early on, turned from abstract painting to thoroughly modern figuration—receives his first major museum exhibition in over three decades."
168,"July 15, 2019 04:20 pm ET",U.S. Stocks Edge Higher,"U.S. stocks edged higher, ending at fresh records after flitting between small advances and losses for much of the trading day.  "
169,"July 15, 2019 12:34 pm ET","This Week on the Frontiers, July 13th 2019",A weekly roundup of key news affecting frontier markets from the Wall Street Journal and beyond.
170,"July 15, 2019 08:53 am ET",NYC Blackout Highlights Grid Frailty—Energy Journal,
171,"July 14, 2019 06:11 pm ET",Mexico’s Economy Falters as U.S. Chugs Along,"Mexico is slipping toward a recession even as the U.S. economy continues to grow, the first time in 25 years that the neighbors’ economic cycles have fallen sharply out of sync. "
172,"July 14, 2019 12:26 pm ET","The Agony of Hope Postponed, by a Value Investor ","Value investors are known for being a hardy bunch, willing to buy into beaten-down stocks that everyone else thinks are a disaster. But cheap stocks have underperformed horribly over the past 12 years and even some who specialize in buying them wonder in private if the technique no longer works. "
173,"July 12, 2019 06:23 pm ET",It’s Not Too Late for New York to Start Fracking,Cuomo deprives his state of its economic benefits because of imaginary environmental risks.
174,"July 12, 2019 04:39 pm ET",U.S. Stocks Close Out Week With More Gains ,"Stocks climbed to records and oil prices surged this week, as investors bet the Federal Reserve will be able to forestall a downturn. "
175,"July 12, 2019 10:36 am ET","Red Wing, Iconic U.S. Shoe Maker, Labors Mightily to Bring Production Home ",The Minnesota company had to rebuild vanishing skills and overcome high wages to introduce a new work boot.
176,"July 12, 2019 09:11 am ET","Powell Says Libra Raises Serious Concerns; Williams, Brainard See Case for Easing; Fed Seen as Independent Despite Trump Attacks    ","Good day. Federal Reserve Chairman Jerome Powell again signaled an interest-rate cut could come later this month, while Fed governor Lael Brainard and New York Fed chief John Williams also indicated they see a case for easier monetary policy. Mr. Powell, during his second day of congressional testimony this week, also expressed concerns about Facebook’s plans to launch its Libra cryptocurrency, citing issues such as privacy, consumer protection and financial stability.  "
177,"July 12, 2019 08:00 am ET","As Recession Fears Rise, Skittish Investors Sell Riskiest Junk Bonds ","As anxiety over an economic downturn creeps higher, investors have been avoiding one of the riskiest markets for corporate debt."
178,"July 12, 2019 04:19 am ET",The Daily Shot: Inflation in Prescription Drugs Hits a Record Low,
179,"July 12, 2019 12:01 am ET",Tropical Storm Barry Helps Spark Fuel-Price Rebound,"The U.S. crude oil benchmark rose for the sixth time in seven sessions, while Brent crude oil advanced 0.3% as traders focused on the impact of Tropical Storm Barry on Louisiana refineries."
180,"July 11, 2019 04:46 pm ET",Investors Finding Dividends in an Unlikely Place: Energy ,This energy ETF’s dividend yield is beating utilities for just the second time in a decade 
181,"July 11, 2019 03:42 pm ET",Oil’s Rebound Above $60 Increases Focus on Technicals    ,"A recent rebound in U.S. crude-oil prices back above the closely watched psychological level of $60 is increasing focus on gauges of market momentum, the latest swing in a topsy-turvy 2019 for energy markets."
182,"July 11, 2019 07:11 am ET",OPEC Maintains World Oil Demand Forecast as Supply Concerns Continue,"OPEC cut its 2019 oil production growth forecast for its non-cartel peers, a week after the bloc and its allies extended their continuing output cut for another nine months."
183,"July 11, 2019 04:43 am ET",The Daily Shot: The Most Dovish FOMC Minutes in Years,
184,"July 11, 2019 04:40 am ET",Caspian Sunrise's MJF License to Sell Oil at International Prices,
185,"July 10, 2019 07:00 pm ET",‘The Truffle Underground’ Review: Malice and Mushrooms,"The truffle industry is rife with crime and corruption, ranging from false marketing to the kidnapping of truffle-hunting dogs."
186,"July 10, 2019 06:39 pm ET",Videogames and Two-Day Delivery Powered the S&P’s Rise to 3000 ,"Tech stocks including Amazon.com and Netflix led the pack during the S&P 500’s half-decade march from 2000 to 3000, while oil companies were among the laggards. "
187,"July 10, 2019 04:40 pm ET",Stocks Leap to Records Following Powell’s Comments,U.S. stocks leapt to records after Federal Reserve Chairman Jerome Powell set the stage for the central bank to cut interest rates to bolster flagging growth. 
188,"July 10, 2019 03:25 pm ET",Oil Hits Seven-Week High on Falling Supplies     ,Oil prices climbed on a combination of falling U.S. inventories and risks to supply in the U.S. and Middle East.  
189,"July 10, 2019 01:47 pm ET","Canada Central Bank, Holding Steady, Flags Trade Concerns ",The Bank of Canada kept its key interest rate unchanged at 1.75% and warned that global trade tensions could threaten Canada’s economic outlook following a recent pickup in domestic growth. 
190,"July 10, 2019 10:06 am ET","Cabot Energy Raises $500,000 in Share Subscription",
191,"July 10, 2019 06:02 am ET","WSJ Wealth Adviser Briefing: Bond ETFs, Wellness Entrepreneur, Home Run Crisis","What investors need to know about bond exchange traded funds; the trick art of being a wellness entrepreneur, and Major League Baseball faces a home run crisis."
192,"July 10, 2019 04:47 am ET",The Daily Shot: Record High Manufacturing Job Openings but Slower Hiring,
