,date,title,summary
210,"April 12, 2019 03:15 pm ET",Oil Prices Rise Alongside U.S. Stock Markets,Crude prices were gaining traction as global stock markets rose and U.S. stocks opened higher on better-than-expected bank earnings and stronger data on Chinese trade and lending. 
211,"April 12, 2019 01:38 pm ET",Sliding Freight Rates Send More Big Bulk Ships to Scrapyards,"A sharp decline in dry cargo ship freight rates in the first quarter sent more giant ships to scrapyards in Southeast Asia in the first three months of the year, but analysts recycling to slow later this year. "
212,"April 12, 2019 11:32 am ET",Chevron Shareholders Wanted a Different Kind of Green,"The oil company’s deal for Texas-based Anadarko looks like one shareholders should like, if only they can be convinced about spending money on deals. "
213,"April 12, 2019 11:18 am ET","The Making of Saudi Arabia’s Energetic, Ruthless Crown Prince",An inside look at the early years of Mohammed bin Salman and how he became the kingdom’s de facto ruler.
214,"April 12, 2019 10:00 am ET",Today’s Logistics Report: Sold on Tankers; Amazon’s Third-Party Gains; Robots Getting Stuck ,Today’s Top Supply Chain and Logistics News From WSJ.
215,"April 12, 2019 08:29 am ET",Rip-Roaring Chinese Exports Less Than They Appear,"March trade and lending data sent some clear signs that China’s economy is starting to thaw. Investors who were spooked by terrible data in February are at risk of overinterpreting the improvement now, however."
216,"April 12, 2019 07:00 am ET",How Trump’s Pressure Puts the Fed in a Policy Pickle,President Trump says he would like not only to see rate cuts but also a resumption of the Fed’s bond-buying program. This jawboning runs the risk of putting the central bank in a position where it may seem as though it’s implementing policy based on political pressure.
217,"April 12, 2019 04:18 am ET",The Daily Shot: Nursing Home PPI Is Ripping Higher,
218,"April 11, 2019 06:51 pm ET",Downfall of a Dictator,Sudan’s Omar al-Bashir will go down as one of Africa’s worst.
219,"April 11, 2019 03:14 pm ET",Oil Falls on Demand Concerns,Oil prices declined after the International Energy Agency noted worries about global demand in a monthly report.
220,"April 11, 2019 08:00 am ET",U.S. Natural-Gas Market Is Taking Cues From China ,The rise of the U.S. as a major exporter of liquefied natural gas has linked the price of gas in Louisiana to the weather in China—adding pressure on already low U.S. prices. 
221,"April 11, 2019 07:17 am ET",Fed Minutes Suggest High Bar to Rate Move; Trump Defends Cain; ECB Willing to Bolster Economy    ,The Wall Street Journal’s Central Banking newsletter for Thursday April 11 2019 
222,"April 11, 2019 07:10 am ET",Real Time Economics: The Middle Class Is Shrinking,
223,"April 11, 2019 03:55 am ET",The Daily Shot: U.S. Shipment Activity Slows,
224,"April 10, 2019 11:37 pm ET",Chinese Inflation Picks Up ,"Consumer and producer prices were lifted by costlier pork and oil prices, another sign that growth in the world’s second largest economy may be stabilizing. "
225,"April 10, 2019 04:33 pm ET",U.S. Inflation Stayed Tame in March,"U.S. consumer prices rose in March, driven by a rise in volatile oil prices that masked moderate underlying price pressures.`"
226,"April 10, 2019 04:29 pm ET",Alta Mesa Resources Hires Financial Adviser Perella Weinberg to Explore Options,The oil-and-gas company said Monday that it wants to improve its liquidity to give it more financial flexibility in what it says is a challenging environment.  
227,"April 10, 2019 04:24 pm ET","U.S. Treasury Yields Under Pressure Following CPI, Fed Minutes ",U.S. government bond yields fell following an underwhelming report on consumer prices and cautious remarks from central bank officials.
228,"April 10, 2019 03:58 pm ET",Puerto Rico Utility Nears Deal on $9 Billion Restructuring ,"Puerto Rico’s bankrupt power authority moved closer to a creditor settlement that would ease its potential privatization, agreeing to restructuring terms with a bond guarantor and seeking to postpone further litigation. "
229,"April 10, 2019 03:29 pm ET",Oil Edges Higher as Venezuela Output Collapses,Oil prices were slightly higher Wednesday as investors weighed significant production declines last month from Venezuela and Saudi Arabia against data showing a large increase in U.S. crude-oil inventories.
230,"April 10, 2019 01:10 pm ET",Brazil to Pay Petrobras $9 Billion in Contract Resolution,State-controlled oil company Petróleo Brasileiro will receive $9.06 billion from the Brazilian government as part of a deal that would allow the government to raise billions more from the sale of oil production rights in the country’s pre-salt offshore fields.
231,"April 10, 2019 09:32 am ET",Petrocurrencies Fall Back in Love with Oil    ,Petrocurrencies are once again moving in lockstep with oil. This may be a sign that commodity traders are shifting their focus from supply shocks back to macroeconomic conditions.  
232,"April 10, 2019 09:00 am ET",Metals Trading Firm Arion Adds Energy Veteran to Board,"George “Beau” Taylor, an ex-Credit Suisse trader, will advise London-based Arion Investment Management as it further expands into other commodities."
233,"April 10, 2019 03:55 am ET",The Daily Shot: Labor’s Share of Income Is Well Below Historical Average,
