,date,title,summary
0,"February 10, 2021 06:17 pm ET",George Shultz Had a Wise and Discerning Heart,"He was a Marine, an economist, a diplomat, a patriot and a statesman. He was also my friend."
1,"February 10, 2021 08:34 am ET",Chinese Liquor Giant Moutai Hits Heady $500 Billion Valuation,"Kweichow Moutai is now roughly as important to the Chinese market as Apple is in the U.S., accounting for 7.3% of the Shanghai Composite Index."
2,"February 10, 2021 08:00 am ET",Americans Heating Outdoor Spaces Have Fired Up Propane Prices ,"Propane prices have risen more than 70% this winter thanks to an explosion in patio heating and booming exports to Asia. Prices are up more than fourfold from the March bottom, when cold-weather outdoor dining hadn’t been contemplated."
3,"February 10, 2021 12:36 am ET",China Consumer Prices Fall Ahead of Lunar New Year Holiday,"China’s consumer prices slipped into deflationary territory last month in year-over-year terms, while the country’s factory-gate prices began to reflate after 11 straight months of decline."
4,"February 9, 2021 06:58 pm ET",The Costs of Killing Keystone XL,Even allies are asking Biden to reconsider his executive order.
5,"February 9, 2021 06:19 pm ET",Biden’s Commitment to Yemen,"Eight years ago, he stood with us. Times are harder, and we still need the U.S."
6,"February 9, 2021 06:18 pm ET",EVs Are the Lowest Climate Priority,"No matter how you slice the data, the car in your driveway is an emissions asterisk."
7,"February 9, 2021 05:22 pm ET","S&P 500, Dow Close Lower After Records","U.S. stocks finished mixed on Tuesday, with investors taking a breather after a brief record run. "
8,"February 9, 2021 01:00 pm ET",Airlines Aim to Reduce Carbon Footprint With Greener Fuels,"In the coming decade, more sustainable jet fuels could help make flying greener."
9,"February 9, 2021 11:01 am ET",How to Transform Garbage Into Greener Fuels,"A handful of companies are working to turn household trash into low-emissions fuels for planes, trains and trucks."
10,"February 9, 2021 10:09 am ET",Oil Giant With a Head Start in the Energy Transition,"The oil industry isn’t for the faint of heart as the world transitions to cleaner energy, but Total seems well set up for a range of scenarios, and weathered a traumatic year better than peers Shell and BP."
11,"February 8, 2021 06:38 pm ET",Trucking Failures Surged Last Year Under Pandemic ,U.S. trucking company failures nearly tripled in 2020 from the previous year as fallout from the pandemic deepened pressure on smaller operators while well-capitalized bigger truckers held on and found stronger financial footing as the economy reopened.
12,"February 8, 2021 06:25 pm ET",The Antidote to Trump Isn’t Obama Redux,"U.S. allies worry that Biden may turn out to be all posturing and talk, no action."
13,"February 8, 2021 05:24 pm ET",U.S. Stocks Close at Records,Stocks rose as investors wagered that a new round of stimulus spending would bolster the economy.
14,"February 8, 2021 04:38 pm ET",Yield on 30-year Treasury Hits 2% for First Time Since Pandemic ,The move comes amid a recent surge in yields of longer-term government bonds compared with short-term debt as traders bet that government stimulus will accelerate a rebound in economic growth. 
15,"February 8, 2021 01:00 pm ET",Green Hydrogen Plant in Saudi Desert Aims to Reshape Energy Grid,Developers behind the world’s largest planned green hydrogen project hope a growing global thirst for emission-free fuels will pay dividends.
16,"February 8, 2021 09:11 am ET","Tesla, Bitcoin, Palantir, GameStop: What to Watch When the Stock Market Opens Today",Recent strong earnings reports and hopes for new stimulus are lifting investors' spirits.
17,"February 8, 2021 07:00 am ET",Exxon’s Well-Timed Hop Onto Carbon-Capture Bandwagon ,U.S. energy companies are getting into carbon capture in time to help their reputations and their bottom lines. 
18,"February 8, 2021 04:03 am ET","Nigeria's 12-Month Crude Oil, Gas Exports Worth $2.89 Bln",
19,"February 8, 2021 12:01 am ET",What’s News: Business & Finance,What’s News: Business & Finance
20,"February 7, 2021 04:58 pm ET","Emerging and Growth Markets, January 30th 2021",A weekly roundup of key news affecting emerging and growth markets from the Wall Street Journal and beyond.
21,"February 7, 2021 04:28 pm ET",Tightening Oil Supplies Inject New Momentum Into Price Rally ,"A booming rally in oil markets has pushed crude prices to their highest levels since near the start of the pandemic, powered by production curbs and recovering demand."
22,"February 7, 2021 02:19 pm ET","Covid-19’s Hit to State, Local Revenues Smaller Than Many Feared ","The coronavirus pandemic hasn’t decimated state and local government revenues, as many feared early last year. But costs are rising, opening budget holes that must be filled. "
23,"February 6, 2021 10:01 am ET",Floating Wind Turbines Buoy Hopes of Expanding Renewable Energy,Offshore wind farms that don’t need to be embedded in the seafloor could open up new areas to clean-power generation.
24,"February 5, 2021 07:37 pm ET","Amazon.com, Chevron, Peloton: Stocks That Defined the Week",Here are seven major companies whose stocks moved on the news.
25,"February 5, 2021 05:25 pm ET",LVMH Tells Tiffany Staff to Return to Office Two Days a Week,The luxury giant wants New York City employees in the office as of March 1 as LVMH starts to integrate the U.S. jeweler following its acquisition. 
26,"February 5, 2021 05:07 pm ET",S&P 500 Closes Best Week Since Early November,"U.S. stocks edged higher, giving the S&P 500 a 4.6% rise for the week as investors anticipated fresh stimulus spending and the labor market’s recovery."
27,"February 5, 2021 01:59 pm ET",The Battery Is Ready to Power the World,"After a decade of rapidly falling costs, the rechargeable lithium-ion battery is poised to overhaul the car industry, disrupt the power grid and challenge the dominance of oil and gas."
28,"February 5, 2021 12:28 pm ET",Teens Are Gambling Their Savings on GameStop Stock. Their Parents Are Worried.,The day-trading frenzy firing up stocks like GameStop benefits from capital provided by a growing number of teen investors. “You have to be willing to lose it all.”
29,"February 5, 2021 10:45 am ET",PE Daily: NY Attorney General Charges GPB | Edison Partners Seeks $425 Million | Andrea Kramer Talks PE Fundraising    ,"The week is ending on a dramatic note with a series of state and federal charges against a firm that many of you may not have heard of before. GPB Capital Holdings and three men associated with it face criminal fraud and conspiracy charges that they deceived thousands of investors in what is described as a $1.7 billion Ponzi-like arrangement, as Ted Bunker reports for us. Those of you who have been reading this newsletter over the past year will likely have read some of Ted’s past coverage of previous travails of GPB Capital, which faced fraud claims in Massachusetts last year. Also this morning, our own Laura Cooper and Preeti Singh report that Edison Partners is back in the market with a new fund, and Hamilton Lane’s Andrea Kramer shares some limited partner perspectives on the joys and challenges of private-equity fundraising.  "
30,"February 5, 2021 09:12 am ET","Pinterest, Activision Blizzard, Peloton: What to Watch When the Stock Market Opens Today",Jobs data are expected to show the unemployment rate held steady in January.
31,"February 4, 2021 04:48 pm ET",Stocks Rise to Records as Jobless Claims Fall,"The S&P 500 and Nasdaq rose to new highs after filings for U.S. unemployment benefits showed a decline from the previous week, with investors watching for signs that the economic recovery remains under way."
32,"February 4, 2021 04:06 pm ET",Which Cooking Oil Should I Use?,"Depends on how you use it. For frying, sautéing, dressings and more, these bottles are beauties."
33,"February 4, 2021 02:13 pm ET",Vale Agrees to $7 Billion Settlement for Brumadinho Dam Collapse ,"The miner will compensate the state of Minas Gerais, where the disaster two years ago killed 270 people and left widespread environmental damage, in the largest settlement in Brazilian history."
34,"February 4, 2021 09:37 am ET",PE Daily: AGR Pairs Wineries With a SPAC | Lime Rock Nets Over $100 Million    ,"The pick up in the IPO market in recent months has been driven by the surge in SPACs, those blank-check companies that raise capital and then go shopping for a company to take public. It’s tempting to conclude that in today’s financial world, you’re nobody if you don’t have a SPAC. But that would be going too far.  "
35,"February 4, 2021 08:30 am ET",The Light-Filled “Dream Studio” of Kenyan-American Artist Wangechi Mutu,"Artist Wangechi Mutu created an airy, light-filled studio in Nairobi, where work for a major new exhibition—a surprising interventionist installation—has taken shape."
36,"February 4, 2021 07:29 am ET",Shell Posts Loss but Eyes Recovery This Year ,"The oil giant reported a fourth-quarter loss as it continued to grapple with the fallout of the pandemic but said it would raise its dividend, forecasting a recovery in demand later this year. "
37,"February 3, 2021 04:41 pm ET","Stocks Edge Up as Investors Eye Earnings, Stimulus   ",The S&P 500 climbed for the third straight session as investors continued to turn their attention back to an improving economic outlook and past the recent drama involving GameStop and a handful of other stocks.
38,"February 3, 2021 03:31 pm ET",How to Choose the Best Kitchen-Counter Material for You,"We consulted interior designers to match countertop substances with personality types. Find yourself, and your next kitchen here. "
39,"February 3, 2021 09:09 am ET",PE Daily: Deal Makers Circle G4S | Mass PRIM Loses Private-Equity Head | Firms Back AgTech Company’s Berry Bet | BP Energy Company Expands    ,"If the pace of deal making seemed to accelerate dramatically in the last three months of 2020, it was no illusion. Ernst & Young LLP’s latest survey of the private-equity industry highlights a strong rebound in deal activity as the year drew to a close and sees signs deal makers are poised to accelerate as the coronavirus pandemic begins to be contained by mass vaccinations.  "
40,"February 3, 2021 08:49 am ET",Pro Bankruptcy Briefing: AMC Rescue Lender Rakes In Profits; Cineworld Pays Its Lenders; Purdue Pharma Chases Insurers    ,"Hedge fund Mudrick Capital Management rescued battered movie-theater chain AMC Entertainment Holdings in December, and scored big when the shares rallied. Regal Entertainment’s owner made a disputed interest payment after a wrangle over terms. OxyContin-maker Purdue Pharma asked a bankruptcy judge for some rulings on what it believes are insurance policies worth $3.3 billion.  "
41,"February 3, 2021 08:45 am ET","Draghi Could Be Italy’s Next Prime Minister; Officials Mull Link Between Fed Policy, Market Volatility; Biden’s $15 Minimum Wage Plan    ","Mario Draghi has been called in to meet Italian President Sergio Mattarella, a move seen as the first step to asking the former head of the European Central Bank to form a new government for Italy. Meanwhile, Fed officials are mulling the relationship between monetary policy and volatility in financial markets. U.S. regulators are set to meet to discuss the recent frenzied trading in shares of Gamestop and other companies. And we take a look at what President Biden’s plan for a $15-an-hour minimum wage would mean for the U.S. economy.  "
42,"February 2, 2021 06:36 pm ET",Alexei Navalny’s Cause,Can the Biden Administration marshal a unified Western response to the Russian opposition leader’s prison sentence?
43,"February 2, 2021 04:44 pm ET",USDA Nominee Vilsack Casts Farmers as Leaders in Climate Fight ,"Incentives can help agriculture curb emissions, Tom Vilsack said. But some Republican lawmakers warned against overreach. "
44,"February 2, 2021 04:10 pm ET","Ackman Raises Bet on Housing in Texas, Hawaii, Las Vegas ","Billionaire hedge-fund manager William Ackman is raising his bet that the migration of Americans to warmer, lower-tax cities is here to stay. "
45,"February 2, 2021 02:13 pm ET",New Oil Lease Ban Makes Good Market Sense,The sky is not falling for the oil and gas industry and there is neither a shortage of federal oil and gas leases nor a need for expanding production.
46,"February 2, 2021 01:18 pm ET",Wood-Pulp Prices Surge as Speculators Pounce in China,"Demand is rising for premium napkins and toilet paper, with more people staying home during the Covid-19 pandemic."
47,"February 2, 2021 12:30 pm ET","Russian Covid-19 Vaccine Was Highly Effective in Trial, Boosting Moscow’s Rollout Ambitions","The homegrown Sputnik V shot was 91.6% effective in a large-scale trial, handing Moscow a geopolitical coup and a possible slice of the lucrative global vaccine market."
48,"February 2, 2021 10:04 am ET","Oil Companies Endure Brutal 2020, Warn of Slow Recovery","Exxon, BP and other major international oil companies notched one of their worst annual performances as the pandemic crushed demand for fossil fuels."
49,"February 2, 2021 08:52 am ET",Pro Bankruptcy Briefing: Hedge Fund Greylock Files for Bankruptcy; Knotel Lender Eyes Startup’s Assets; NRA Creditor Thinks Bankruptcy Will Be Dismissed    ,"Hedge fund Greylock Capital filed for bankruptcy after clients withdrew money after years of losses. Knotel, a flex office-space provider that raised tens of millions of dollars before the pandemic, now might be taken over in bankruptcy by a lender. And a major unsecured creditor of the National Rifle Association believes the gun rights group’s bankruptcy will be tossed out of court on the grounds it was filed in bad faith.  "
50,"February 2, 2021 08:39 am ET",Russian Arctic Oil Taints BP’s Green Shift,An almost 20% stake in Rosneft is likely to hamper the U.K. company’s efforts to appeal to environmental investors.
51,"February 1, 2021 04:36 pm ET",Stocks End Higher and Online Traders Send Silver Soaring    ,The S&P 500 rallied and silver prices jumped as Reddit users discussed executing a “short squeeze” similar to the one that propelled GameStop shares higher.  
52,"February 1, 2021 02:28 pm ET",Exxon-Chevron Tie-Up Not as Crazy as It Sounds ,Today’s tech stock exuberance is a flashback to the 1990s. Now oil investors are experiencing their own déjà vu. 
53,"February 1, 2021 09:51 am ET",PE Daily: Seaside Closes Debut Fund | Sun Capital Makes a Run Into Tech Investing    ,"The furor of last week’s Reddit-versus-hedge-funds saga seems to have temporarily drowned out other financial news. But the private-equity world doesn’t sleep, even when all eyes are on the GameStop stock ticker.  "
54,"February 1, 2021 09:03 am ET","AMC, First Majestic Silver, Viela Bio: What to Watch When the Stock Market Opens Today",Reddit users were driving the price of silver higher.
55,"February 1, 2021 08:12 am ET",Reddit’s Silver Rush Is Another Symptom of Market Madness,The price of silver futures jumped about 11% to around $30 an ounce—its biggest one-day move since 2009—after becoming the latest target of the retail investors who spent last week foiling Wall Street’s short bets
56,"February 1, 2021 12:01 am ET",What’s News: Business & Finance,What’s News: Business & Finance
57,"January 31, 2021 05:22 pm ET",How AMLO Is Like Venezuela’s Chávez,The spirit of the Mexican president’s government is about centralizing power.
58,"January 29, 2021 05:00 pm ET",Chevron Posts Quarterly Loss to Cap Worst Year Since 2016,"The company posted $665 million in losses, as the pandemic sapped global demand for fossil fuels."
59,"January 29, 2021 02:30 pm ET",PE Daily: U.K. Judge Clears Naqvi Extradition | OnyxPoint Buys Back Sable | Macquarie Unit Banks $1.13 Billion    ,"Shares of GameStop and AMC Entertainment bounced in off-hours trading after Robinhood Markets said it would reinstate some trading in shares and options that it—along with several other online brokerages—had curbed. The restrictions sapped some of the market euphoria, and left more than a few irate individual investors out there. I will be curious to see how this one plays out. You can follow the Journal’s live updates here.  "
60,"January 29, 2021 10:32 am ET",Caterpillar Flags Signs of Recovery Amid Slack Demand ,Revenue fell 15% in the fourth quarter due to lower volumes and less demand from customers and dealers.  
61,"January 29, 2021 09:15 am ET",Oil Rallies On Saudi Arabia's Expected Production Cuts -- Market Talk,
62,"January 29, 2021 07:00 am ET",OnyxPoint Global Buys Back Into Sable Permian Resources,"OnyxPoint Global Management is paying $46.8 million to remain a minority owner of Sable Permian Resources after the energy company exits from bankruptcy,"
63,"January 28, 2021 11:25 am ET",Ship Operators Seek Calmer U.S. Trade Waters Under Biden ,"Carrier executives say sanctions, trade turmoil under Trump undercut planning and fueled uncertainty in maritime operations. "
64,"January 28, 2021 10:58 am ET",Smoking’s Long Decline Is Over,The slide in cigarette sales stopped last year amid Covid-19 lockdowns and health concerns about e-cigarettes.
65,"January 28, 2021 08:01 am ET",Biden’s Climate Goals Will Boost Ethanol for Now ,Oil refiners won some surprising victories over ethanol producers during the Trump administration. Their fortunes are about to flip under President Joe Biden’s climate-driven administration.
66,"January 28, 2021 05:30 am ET",Emerging-Market Borrowing Boom Sparks Concerns Over Debt Loads,"Developing economies borrowed at a blistering pace at the start of the year after a record 2020, prompting investors to question whether they are building up debt problems for the future."
67,"January 27, 2021 01:15 pm ET",Biden’s Energy Orders: Peril and Profit    ,"A flurry of executive orders from the Biden administration has resulted in a wider selloff in the energy industry. If anything, now is the time to pick carefully.  "
68,"January 27, 2021 12:00 pm ET",Exxon Plans Board Changes Amid Activist Pressure,The oil giant is discussing adding one or more new directors to the board and stepping up sustainability investments.
69,"January 26, 2021 06:27 pm ET",Biden to Suspend New Federal Oil and Gas Leasing,"President Biden is planning on Wednesday to halt new oil and gas leasing on federal territory, setting up a confrontation with the oil industry. "
70,"January 26, 2021 04:18 pm ET",Biden to Launch Health-Care Agenda ,The president is expected to lift some curbs on abortion funding and reopen ACA enrollment. 
71,"January 26, 2021 12:50 pm ET",Private Equity Daily: Apollo’s Black to Step Back | GA Bets on Equality Health | Intersect Raises Over $600 Million | Sunstone Reinvents ServiceNow Bet    ,"The week is starting out to be a busy one, with a slew of SPAC news that came out yesterday, primarily involving reverse mergers with private-equity-backed companies. Perhaps the biggest story of the day, however, was news that Apollo Global Management Chief Executive Leon Black would step back from his role later this year, following an independent inquiry conducted by Dechert LLP into Mr. Black’s relationship with disgraced financier Jeffrey Epstein. The investigation deemed that the fees were justified and found no links to any of the criminal activities of the late Epstein, as Miriam Gottfried writes for The Wall Street Journal. Also in this morning’s newsletter, we have deal news from firms including General Atlantic, Trilantic North America and Sunstone Partners.  "
72,"January 26, 2021 08:53 am ET","General Electric, 3M, Etsy: What to Watch When the Stock Market Opens Today",This week marks the height of corporate earnings season.
73,"January 26, 2021 08:20 am ET",Russia Protests Threaten to Snowball as Grievances Grow,"Demonstrations over the jailing of opposition leader Alexei Navalny are threatening to escalate into a larger movement against the Kremlin, driven by frustration over living standards and shrinking political freedoms."
74,"January 25, 2021 07:20 pm ET",Kimmeridge Energy to Launch Proxy Fight at Ovintiv ,"The investment firm plans to launch a proxy fight at the oil-and-gas producer, and will nominate three directors—including Kimmeridge founder Ben Dell—to the company. "
75,"January 25, 2021 01:40 pm ET",The Center Emerges as Early Biden Testing Ground ,"A giant question hanging over President Biden has been whether he can hold the political center, or whether he will be pulled toward the left. In his first week, the evidence is mixed. "
76,"January 25, 2021 08:56 am ET",Pro Bankruptcy Briefing: Investors Keep AMC Afloat; Boy Scouts Insurers Blast ’Claim-Mining;’ Diamond Offshore Strikes Restructuring-Plan Agreement    ,"Investors continue giving votes of confidence to theater owner AMC Entertainmnt Holdings, even as the vaccine rollout stumbles and theaters stay dark. Insurance companies with huge stakes in the Boy Scouts of America’s bankruptcy blasted plaintiffs’ attorneys, saying they gamed the system for submitted claims of sexual abuse. And Diamond Offshore Drilling entered a support agreement for a restructuring plan, a move that would cut more than $2.1 billion in debt.  "
77,"January 25, 2021 08:47 am ET",Powell Passes Stability Baton Back to Yellen; Quiet Fed Meeting Expected; ECB Considers Ending Private Calls After Policy Meetings    ,"Janet Yellen, who is poised to become President Biden’s Treasury secretary this week, hopes to oversee a government spending wave aimed at making sure joblessness falls much lower and preventing further widening in inequality. Jerome Powell has handed the stimulus baton to her by pledging to keep rates very low until that happens. Elsewhere, the European Central Bank is considering terminating an unusual communications policy whereby its chief economist placed private calls to banks and investors shortly after policy meetings. Looking to the week ahead, the Fed is expected to leave policy unchanged at its policy meeting, while U.S. GDP figures will show how the economy performed at the end of 2020.  "
78,"January 25, 2021 07:09 am ET",Diamond Offshore Strikes Restructuring-Plan Agreement ,The restructuring plan would cut more than $2.1 billion of the contract driller’s debt. 
79,"January 25, 2021 03:54 am ET",China’s Love of TikTok-Style Apps Powers $5 Billion IPO,"Kuaishou Technology has its eyes on the world’s biggest initial public offering in more than a year, seeking to raise about $5 billion from a Hong Kong share sale.  "
80,"January 25, 2021 03:00 am ET",European Banks Quit Ecuador’s Amazonian Oil Trade ,"Some of Europe’s largest banks are phasing out trading services for the export of oil from the Ecuadorean Amazon, a move that reflects the growing focus of global banks on climate change and their shift away from increasingly risky fossil fuels. "
81,"January 24, 2021 09:00 am ET",She Traded In Her Oil Industry Job to Design Cowboy Boots for the Office,"When the price of oil plummeted, Lizzy Chesnut Bentley knew it was time to go all-in on another Texas tradition."
82,"January 24, 2021 08:00 am ET",Covid-19’s Financial Toll Mounts as Homeowners Delay Payments,"Some 2.7 million homeowners are still pausing their monthly mortgage bills, and more might need help in the coming months. "
83,"January 22, 2021 05:25 pm ET",Dow Drops but Notches Weekly Gain,"Investors have been cheered in recent days by a solid start to earnings season, though some are concerned that high valuations in corners of the market will leave stocks vulnerable in the coming months."
84,"January 22, 2021 05:18 pm ET",Demand Worries Drag on Oil Prices ,"U.S. crude prices fell Friday, dragged lower by growing worries that the global pandemic will spur greater restrictions on travel and economic activity. "
85,"January 22, 2021 02:50 pm ET",Keystone Pipeline Cancellation Raises Pressure on Canadian Producers    ,President Biden’s revocation of a permit for the Keystone XL pipeline is spurring Canada’s energy industry to seek new markets for its top export.
86,"January 22, 2021 01:55 pm ET",American Women in Florence,Collector Christian Levett has filled his Italian palazzo with a world-class assembly of works by female Abstract Expressionists.
87,"January 22, 2021 12:33 pm ET","For Oil Servicers, Adversity Spells Opportunity ",Oil-field services companies are showing strong signs of improvement. The sentiment-driven selloff this week could be an opportunity to pick up their shares on the cheap. 
88,"January 22, 2021 09:15 am ET",PE Daily: Firms Add a Touch of Show Biz | Excelsior Recasts an Oil Strategy | Mytheresa IPO Pops for Ares    ,"Learning the details of the movie-theater industry’s devastation by the coronavirus pandemic can seem like witnessing a cinematic tragedy in real life. But the way Hollywood is being reshaped can also be fascinating, and the Journal’s R.T. Watson lays out the details.  "
89,"January 22, 2021 09:05 am ET",Pro Bankruptcy Briefing: NRA Can’t Duck New York Threat; Theater-Ad Firm Preps For Debt Talks; Speedcast Plan Confirmed    ,"A New York judge rejected the National Rifle Association’s efforts to dodge litigation seeking to put the organization out of business as its bankruptcy in Texas gets underway. National CineMedia, which runs advertisements on movie-theater screens, hired counsel to handle negotiations with lenders. And Speedcast International is on its way out of chapter 11, but not before a bankruptcy judge had some choice words for its ex-CEO.  "
