,date,title,summary
336,"July 16, 2017 09:00 am ET",From $2 Billion to Zero: A Fund Goes Bust in the Oil Patch    ,A $2 billion private-equity fund that borrowed heavily to buy oil and gas wells before energy prices plunged is now worth essentially nothing.
337,"July 14, 2017 07:11 pm ET","Dow, S&P 500 Climb to Record Close","The Dow Jones Industrial Average and the S&P 500 closed at records Friday, as investors anticipated low interest rates for the foreseeable future."
338,"July 14, 2017 04:13 pm ET",Oil Prices Notch Fifth Day of Gains    ,"Oil prices rose for a fifth straight day Friday, as the U.S. dollar weakened and investors focused on signs of an easing supply overhang."
339,"July 14, 2017 03:08 pm ET",Optimism in Financial Markets Fails to Show in Real Economy,"Though stocks have been hitting records and big U.S. banks reported stronger-than-expected quarterly earnings, consumers reduced their spending at midyear and became less optimistic about the future."
340,"July 14, 2017 01:46 pm ET",Transcript: Q&A With Janet Yellen at Senate Banking Committee ,"Federal Reserve Chairwoman Janet Yellen testified before the Senate Banking Committee on Thursday. After reading her prepared remarks, she took lawmakers’ questions on interest rates, inflation, economic growth and financial regulation. Here is a transcript of the question-and-answer portion of her testimony."
341,"July 14, 2017 01:34 pm ET",U.S. Oil Rig Count Rises by Two,The number of rigs drilling for oil in the U.S. rose by two in the past week to 765. The nation’s gas-rig count fell by two to 187 in the same period.
342,"July 14, 2017 11:07 am ET",U.S. Industrial Production Rises,"U.S. industrial output rose steadily in June, as a rebound in oil exploration and coal mining boosted economic growth."
343,"July 14, 2017 09:46 am ET",U.S. Retail Sales Fell 0.2% in June,Spending at U.S. retailers declined in June for the second straight month. It was the first back-to-back sales drop since July and August 2016.
344,"July 14, 2017 09:14 am ET",Google Pays Professors to Boost Washington Influence,"Google operates a little-known program to harness the brain power of university researchers to help sway opinion and public policy, cultivating financial relationships with professors nationwide."
345,"July 14, 2017 07:38 am ET","Yellen: Tougher Capital Rule Might Not Happen by 2018 | Cordray, Noreika Tussle Over Arbitration Rule | U.K. Regulator Weighs Change as Saudi Listing Looms | Verlaine’s Take: The EU’s Intractable Bad-Loan Problem","The Wall Street Journal’s financial regulation newsletter for Friday, July 14, 2017."
346,"July 14, 2017 06:57 am ET","The Morning Ledger: CBO Challenges White House on Deficit, Growth Projections","President Donald Trump’s budget plan will not eliminate federal deficits, the CBO says. Vanguard and Tiffany appoint new CEOs and SAP is investigating alleged kickback payments in South Africa."
347,"July 14, 2017 06:47 am ET","J.P. Morgan, Wells Fargo and Citi Report 2Q Earnings — Live Analysis","Once again, bank earnings season is here. J.P. Morgan Chase & Co., Wells Fargo & Co., Citigroup Inc. and PNC Financial Services Inc. are scheduled to report Friday morning."
348,"July 14, 2017 06:47 am ET","Yellen: Tougher Capital Rule Might Not Happen by 2018 | Cordray, Noreika Tussle Over Arbitration Rule | U.K. Regulator Weighs Change as Saudi Listing Looms | Verlaine’s Take: The EU’s Intractable Bad-Loan Problem","The Wall Street Journal’s financial regulation newsletter for Friday, July 14, 2017."
349,"July 14, 2017 06:36 am ET","Trump Touts Gas Exports to Europe, But U.S. Still Lags Russia–Energy Journal","The International Energy Agency said that global oil demand had “dramatically accelerated” in the second quarter of 2017 to 98 million barrels a day. The trend was driven by higher consumption in big Western economies like the U.S. and Germany, and it came at a time of depressed oil prices."
350,"July 14, 2017 06:25 am ET",Today’s Top Supply Chain and Logistics News From WSJ,"Delivering up-to-the minute news, analysis, interviews and explanatory journalism on logistics, supply-chain management, e-commerce and more"
351,"July 14, 2017 01:39 am ET",WSJ’s Daily Shot: How Many Hours of Work Does It Take to Buy One Unit of S&P 500?,
352,"July 13, 2017 09:35 pm ET",Oil Prices Pause After Recent Gains,"Crude futures edged lower in Asia on Friday, but the market mood remained generally upbeat after the International Energy Agency a day earlier boosted its 2017 demand-growth forecast. "
353,"July 13, 2017 07:27 pm ET",California’s Cap-and-Trade Problem,Jerry Brown seeks GOP votes as Democrats balk at an extension.
354,"July 13, 2017 07:04 pm ET",Governors and Mayors Should Be Begging for Trump’s Tax Cut,Expanding the economy means more revenue for states and cities—just as it did in Reagan’s day.
355,"July 13, 2017 06:53 pm ET",U.S. Boost to Oil Drilling Will Barely Dent Russia’s Energy Monolith,"President Donald Trump is touting policies to boost U.S. energy production and exports as a bulwark against Russia, but experts say they would have limited impact on Russia as a major energy provider."
356,"July 13, 2017 06:41 pm ET",Trump Reiterates Plans for Steel-Import Curbs ,"President Donald Trump reiterated that he is planning to impose fresh curbs on steel imports, though he didn’t elaborate on when he would move forward with the delayed action. "
357,"July 13, 2017 05:07 pm ET",Oil Prices Rise on Better Demand ,Oil prices rose Thursday with growing momentum behind the International Energy Agency’s prediction of higher global demand. 
358,"July 13, 2017 02:35 pm ET",CGG Creditors to Vote on $2 Billion Restructuring,Three-quarters of the oil services company’s senior lenders and bondholders have signaled their support.
359,"July 13, 2017 02:13 pm ET",Tidewater Restructuring Plan Clears Bankruptcy Court ,"Tidewater won confirmation of a chapter 11 turnaround plan, streamlining its balance sheet as it strives to preserve its fleet of offshore oil-and-gas-drilling service vessels.  "
360,"July 13, 2017 10:13 am ET","As Aramco Listing Looms, U.K. Regulator Mulls Rule Change","The U.K. securities regulator is considering making it easier for state-owned companies to list on the London Stock Exchange, potentially giving it an edge in its battle with the New York Stock Exchange to woo Saudi Aramco."
361,"July 13, 2017 07:30 am ET",Yellen: ‘Gradual’ Rate Increases Needed | George: Balance-Sheet Reduction Should Start in ‘Near Future’ | How Trump Could Reshape the Fed | BOC Raises Policy Rate | Harrison’s Take: Don’t Be Too Quick To Write Off Another Rate Increase,"The Wall Street Journal’s central banking newsletter for Thursday, July 13, 2017"
362,"July 13, 2017 07:17 am ET",The Morning Risk Report: Volatile Geopolitics Puts Onus on Businesses’ Cyber Preparedness,"It's more important than ever for companies with a global footprint to pay attention to and plan for risks arising from a volatile geopolitical landscape, states a report."
363,"July 13, 2017 07:12 am ET",The Morning Ledger: SEC Chairman Seeks to Ease Disclosure Burden for Public Firms,The SEC seeks to simplify disclosures drafted by public companies for investors. Uber partners with Russia's Yandex.Taxi and the Fed's Yellen signals she is open to changing some banking rules.
364,"July 13, 2017 06:47 am ET",Data Dumps Tease the Oil Market–Energy Journal,"It has been a dizzying few days of data for the oil market after the release of  IEA, EIA and OPEC reports, and investors are still taking stock."
365,"July 13, 2017 06:32 am ET","Oil Demand Is Accelerating, IEA Says ","Global oil demand is forecast to 98 million barrels a day this year, driven in part by rising consumption in Germany and the U.S. during the second quarter, the International Energy Agency said. "
366,"July 13, 2017 06:13 am ET",Yellen: ‘Gradual’ Rate Increases Needed | George: Balance-Sheet Reduction Should Start in ‘Near Future’ | How Trump Could Reshape the Fed | BOC Raises Policy Rate | Harrison’s Take: Don’t Be Too Quick To Write Off Another Rate Increase,"The Wall Street Journal’s central banking newsletter for Thursday, July 13, 2017"
367,"July 13, 2017 01:20 am ET",WSJ’s Daily Shot: Will a Tight Job Market Force Productivity Gains?,
368,"July 13, 2017 12:03 am ET",What’s News: Business & Finance,What’s News: Business & Finance
369,"July 13, 2017 12:01 am ET",What’s News: Business & Finance,What’s News: Business & Finance
370,"July 12, 2017 09:34 pm ET",Mexico Awards 21 Oil and Gas Blocks in Two Auctions,The Mexican government on Wednesday awarded 21 oil and gas blocks across the country in two auctions which put private-sector interest in developing gas in Mexico to the test.
371,"July 12, 2017 09:27 pm ET",Oil Prices Steady After Latest Move Higher ,"Crude futures were little changed in Asia on Thursday, pausing after the market’s latest gains. "
372,"July 12, 2017 07:03 pm ET",Former Brazilian President Convicted of Corruption,"Former President Luiz Inácio Lula da Silva, the front-runner for next year’s presidential election, was sentenced to almost a decade in prison for corruption, dealing a heavy blow to his leftist Workers’ Party. "
373,"July 12, 2017 04:59 pm ET",Investors Find Major Oil Deposit in Gulf of Mexico ,One of Mexico’s earliest private-sector energy investors says that it has struck it big with a significant oil discovery in Mexican waters. 
374,"July 12, 2017 04:43 pm ET",Dow Industrials Climb to Record Close,"Stocks and government bonds rallied and the dollar fell, after Federal Reserve Chairwoman Janet Yellen addressed a slowdown in inflation."
375,"July 12, 2017 03:44 pm ET","Canada No Longer Needs Strong Stimulus, Central Bank Says","In the surest signal yet that the Canadian economy has turned a corner after the oil-price shock, the Bank of Canada raised its policy rate by a quarter percentage point, to 0.75%, its first increase in seven years."
376,"July 12, 2017 03:27 pm ET",Oil Climbs as U.S. Stockpiles Shrink,Oil prices made small gains in topsy-turvy trading tied to falling U.S. inventories.
377,"July 12, 2017 02:13 pm ET",Canadian Dollar Rallies on Rate Rise    ,"After the Canadian dollar rallied to a 12-month high against the U.S. dollar Wednesday on the back of a rate increase by the Bank of Canada, analysts expect the currency to remain strong for the rest of the year.  "
378,"July 12, 2017 12:33 pm ET",OPEC Output Rose in June Despite Planned Cuts,The Organization of the Petroleum Exporting Countries produced more crude oil in June despite efforts to cut output and alleviate the global oil glut.
379,"July 12, 2017 11:50 am ET",Big Oil Stays Wary on Iran,Iran’s ambitious agenda for its oil-and-gas industry is running up against the caution of big energy companies.
380,"July 12, 2017 11:24 am ET",Electric Cars Are the Future? Not So Fast ,"Skepticism of electric cars melts a bit more with each new announcement from auto makers. But if they are ever to displace gasoline engines, they must not only keep innovating but outrun fossil fuels."
381,"July 12, 2017 07:48 am ET",The Demise of the American Driver Has Been Exaggerated,"U.S. drivers largely stayed off the road in early 2017, worrying economists and energy investors. Those anxieties were probably overdone."
382,"July 12, 2017 07:33 am ET",Opponents Eye Ways to Stop Arbitration Rule | Visa Takes War on Cash to Restaurants | Why Higher Bank Deposit Rates Are Unlikely | Witkowski’s Take: Fintech Charter Still on the Horizon,"The Wall Street Journal’s financial regulation newsletter for Wednesday, July 12, 2017."
383,"July 12, 2017 07:29 am ET",The Morning Download: Beijing Tech Startup Raises $410 million as Facial Recognition Sweeps Across China,"Facial recognition software, powered by the latest in artificial intelligence, is transforming law enforcement and surveillance in China. The applications will extend around the world and throughout industry, as ATM machines and other devices incorporate the technology"
384,"July 12, 2017 07:22 am ET",The Morning Ledger: Companies Could Use Repatriated Cash to Pay Down Debt,U.S. firms plan to pay down debt should tax code changes make it more attractive for them to bring home overseas cash. Germany discusses new veto powers against foreign takeovers and Shells sells a gas field to a Canadian pension fund.
385,"July 12, 2017 07:17 am ET",The Morning Risk Report: Sharing Intel on Financial Crime Pays,"The National Crime Agency said it's made 63 arrests of individuals suspected of money laundering, identified more than 2,000 accounts, closed more than 450 suspect bank accounts and restrained £7 million of suspect criminal funds from May 2016 through March 2017 thanks to the collaborative work of the task force."
386,"July 12, 2017 06:49 am ET",Shell Sells Irish Gas Field Stake for $1.2 Billion to Canada Pension Fund,Royal Dutch Shell sold its stake in a controversial Irish gas field for up to $1.23 billion to one of Canada’s biggest pension funds in a deal that will result in accounting losses of as much as $750 million for the Anglo-Dutch energy company.
387,"July 12, 2017 06:38 am ET",Saudi Arabia Pumps Above Oil Deal Limit—Energy Journal,Saudi Arabia June Oil Output Exceeds Production-Cut Limit
388,"July 12, 2017 05:40 am ET","Middle-Market Private Companies Notch Revenue, Profit Gains","Revenues and earnings at private middle-market companies rose in the second quarter of 2017 from the same period a year earlier, according to a report by Golub Capital, a lender to these companies."
389,"July 12, 2017 05:17 am ET",Oil Prices to Remain Choppy in 2H ,"Although speculative net-long positions have gained momentum for 2 weeks, oil prices will still remain highly susceptible to a downtrend as major suppliers are showing some resistance to the ongoing supply cut plans, said OCBC."
390,"July 12, 2017 01:09 am ET",WSJ’s Daily Shot: Is the Health-Care Legislation Uncertainty Starting to Impact Hiring?,
391,"July 11, 2017 07:26 pm ET",Market Talk: Daily Analysis Roundup,"Read our compilation of concise, timely analysis by Wall Street Journal reporters. Malaysia Regulators Working to Manage Cyber Security Risks; Gathering Assets a Challenge for Asset Managers; Govt: China SEOs’ Debt Levels Have Stabilized; Banking Shares Fuel Biggest H-Share Gain in Hong Kong in 4 Months "
392,"July 11, 2017 05:34 pm ET",EnCap Flatrock Investing $300 Million in New Midstream Company,Greenfield Midstream seeks to develop midstream infrastructure throughout North America. 
393,"July 11, 2017 04:56 pm ET",Oil Rises Ahead of U.S. Stockpile Data   ,Oil prices turned higher Tuesday as traders and investors anticipated that U.S. data will show that a glut of oil is continuing to shrink.   
394,"July 11, 2017 04:26 pm ET",Dow Industrials Rebound After Midday Dip,The Dow Jones Industrial Average eked out a slight gain after a brief bout of selling sent it down more than 100 points.
395,"July 11, 2017 03:44 pm ET",Nuverra Environmental Grapples with Bondholder Unrest,A bondholder says the oil services company’s plan improperly picks and chooses among creditors in the same class.
396,"July 11, 2017 03:22 pm ET",The Add-On Deal Roundup: July 11,"Bruin E&P Partners LLC, an oil exploration and production company backed by ArcLight Capital, agreed to acquire oil-and-gas properties operated by publicly traded Halcón Resources Corp. in the Williston Basin for $1.4 billion. "
397,"July 11, 2017 02:42 pm ET",Saudi Arabia June Oil Output Exceeds Production-Cut Limit for First Time,"Saudi Arabia has told OPEC it was out of compliance with a production-cut deal in June, a person familiar with the matter said."
398,"July 11, 2017 12:00 pm ET",Canada Braces for Its First Rate Increase in Seven Years,"The Bank of Canada is widely expected to raise its benchmark policy rate for the first time in seven years, signaling the Canadian economy is on the path to recovery after years of tepid growth following the global slump in commodities."
399,"July 11, 2017 09:59 am ET","Morning Must-Reads: Trump’s Bank Regulator, Buffett’s Shift, $3 Toothpaste Club","The Must Reads are part of the Journal’s Morning MoneyBeat newsletter. To receive the newsletter via email, see http://on.wsj.com/MoneyBeatUSSignup."
400,"July 11, 2017 08:21 am ET",The Morning Download: Microsoft Brings the Cloud to the Customer,"Microsoft on Monday said it will allow customers to run its Azure cloud technology directly on their own infrastructure, building upon a hybrid approach that combines the shared resources of the cloud with the private data center."
401,"July 11, 2017 07:40 am ET",Quarles Is Fed Regulatory Pick | CFPB’s Arbitration Move Sets Off GOP Showdown | Trump Regulation ‘Czar’ Cleared by Senate | CFTC to Rewrite Rules for Swaps Reporting | Ackerman’s Take: CFPB Rule Has Short Life Expectancy,"The Wall Street Journal’s financial regulation newsletter for Tuesday, July 11, 2017."
402,"July 11, 2017 07:31 am ET",Australia’s Gas Exports Are Causing a Domestic Power Shortage—Energy Journal,Australia's Gas Exports Are Causing a Domestic Power Shortage
403,"July 11, 2017 07:29 am ET",Trump to Appoint Quarles as Fed Bank Regulator | Williams: Cut Government Debt | 5 Things to Watch in Mortgage Bonds | BOC Expected To Raise Rates | Blackstone’s Take: Strong Euro Good News for Swiss,"The Wall Street Journal’s central banking newsletter for Tuesday, July 11, 2017"
404,"July 11, 2017 06:48 am ET",Today’s Top Supply Chain and Logistics News From WSJ,"Delivering up-to-the minute news, analysis, interviews and explanatory journalism on logistics, supply-chain management, e-commerce and more"
405,"July 11, 2017 06:40 am ET",Quarles Is Fed Regulatory Pick | CFPB’s Arbitration Move Sets Off GOP Showdown | Trump Regulation ‘Czar’ Cleared by Senate | CFTC to Rewrite Rules for Swaps Reporting | Ackerman’s Take: CFPB Rule Has Short Life Expectancy,"The Wall Street Journal’s financial regulation newsletter for Tuesday, July 11, 2017."
406,"July 11, 2017 06:31 am ET","The 10-Point: Gerard Baker on North Korea sanctions, Trump’s Fed pick and the big winner in Mosul","A personal, guided tour to the best scoops and stories every day in The Wall Street Journal, from Editor in Chief Gerard Baker."
407,"July 11, 2017 06:08 am ET",Blackstone’s Take: Strong Euro Good News for Swiss Even if Dollar Isn’t Following Suit,"For a central bank whose foreign reserves now equal the size of its entire gross domestic product, the SNB will take comfort from the euro’s rise even if the dollar isn’t following suit."
408,"July 11, 2017 06:02 am ET",Trump to Appoint Quarles as Fed Bank Regulator | Williams: Cut Government Debt | 5 Things to Watch in Mortgage Bonds | BOC Expected To Raise Rates | Blackstone’s Take: Strong Euro Good News for Swiss,"The Wall Street Journal’s central banking newsletter for Tuesday, July 11, 2017"
409,"July 11, 2017 05:40 am ET","WSJ Wealth Adviser Briefing: Fiduciary Rule, ETFs, Downturn Investing","WSJ Wealth Adviser highlights some of the top news and analysis for wealth advisers and their clients, with pieces today including: the fiduciary rule's fate under Trump, strategies investors should keep in mind when using ETFs and how to spot funds amid a downturn."
410,"July 11, 2017 03:13 am ET","Oil Rebounds Some, But Move May Not Last","Oil futures were higher in Asia as talks swirl that Nigeria and Libya might face production caps, fueling optimism that global supply growth could slow if the two African producers are restrained. "
411,"July 11, 2017 03:00 am ET",U.S. Shale Drives Recovery in Global Oil Investment ,"Investments in oil and gas fields are likely to rebound modestly this year thanks to a sharp uptick in spending by U.S. shale producers, the International Energy Agency said. "
412,"July 11, 2017 01:21 am ET",WSJ’s Daily Shot: A New Record High for U.S. Consumer Debt,
413,"July 11, 2017 12:01 am ET",Saudi Aramco Chief Predicts Oil Shortage ,"The world is heading for an oil-supply shortage that booming U.S. shale production can’t prevent, said Amin Nasser, chief executive of Saudi Arabia’s state oil company."
414,"July 10, 2017 11:48 pm ET",What’s News: Business & Finance,What’s News: Business & Finance
415,"July 10, 2017 04:58 pm ET",Oil Prices Edge Higher       ,Oil prices inched up with talk of production curbs in Libya and Nigeria and a sign of shrinking U.S. stockpiles leading to a small rebound from a recent slide.
416,"July 10, 2017 04:32 pm ET",Oil Up? Oil Down? Blame the Algorithms ,"As oil market moves confound analysts and longtime investors, many are pointing fingers at the rise of automated trading and algorithms, which they say are distorting the market. "
417,"July 10, 2017 04:14 pm ET",EnCap Commits $500 Million to Form Oil-and-Gas Exploration Company," 35,000 net acres of land and other energy assets in the Delaware Basin for $855 million."
418,"July 10, 2017 03:34 pm ET",High Expectations for Tech Earnings on Wall Street,"The S&P 500's technology sector just posted its first month in the red this year, but analysts still have high expectations for the group heading into the second-quarter earnings season."
419,"July 10, 2017 01:30 pm ET","U.A.E.’s Oil Company Eyes Partnerships, Listing Some Businesses ",Abu Dhabi’s state oil company said it was looking to publicly list parts of its businesses on the United Arab Emirates’ equity markets and would seek international partners as part of its drive to grow and expand operations. 
420,"July 10, 2017 12:11 pm ET","WSJ City PM: OECD’s Economic Reality Check, Algos Blamed for Oil’s Ups and Downs, How Fixing Italy’s Banks Is Good for Europe",
421,"July 10, 2017 12:04 pm ET","Libya, Nigeria Invited to Meeting of Oil Producers ","Libya and Nigeria have been invited to a meeting of big oil producers in St. Petersburg, Russia, this month to discuss their surging petroleum output, Kuwait’s oil minister said. "
422,"July 10, 2017 08:22 am ET",The Morning Download: Tesla Registrations in Hong Kong Slam to Halt as Government Tax Policy Tightens,Tesla CEO Elon Musk said in May that the idea that the company’s survival is tied to government subsidies “drives me crazy” and that incentives still benefit combustion-engine vehicles. Yet the Journal reports that there are other markets in which electric vehicle markets have weakened as incentives have declined.
423,"July 10, 2017 08:03 am ET","Nuclear, Missile Scares Fail to Shake Investors out of South Korea ","For world leaders, the accelerating nuclear threat from North Korea is near the top of the worry list. But investors keep pouring money into neighboring South Korea, making its stock, bond and currency markets stellar performers."
424,"July 10, 2017 07:08 am ET",The Morning Risk Report: Index Finds Global Extractive Governance Lacking,"Only 19% of the 81 countries studied recently by the nonprofit Natural Resources Governance Institute satisfactorily govern their oil, gas and mining sectors. The Resources Governance Index found Norway governs its resources best while Eritrea was worst."
425,"July 10, 2017 07:00 am ET",NGP Seeks $5.3 Billion for New Pursuits in Energy Patch ,How smoothly fundraising goes will be a test of investor confidence in the new generation of executives now at firm’s helm. 
426,"July 10, 2017 06:43 am ET",Wall Street Props Up Oil Production Amid Falling Prices—Energy Journal,Investors Prop Up U.S. Oil Production Even as Prices Tumble
427,"July 10, 2017 03:19 am ET","WSJ City: Low Inflation Vexes Central Banks, Stick With European Stocks as Bonds Wobble",
428,"July 10, 2017 12:01 am ET",What’s News: Business & Finance,What’s News: Business & Finance
