,date,title,summary
83,"September 21, 2020 05:00 pm ET",Stocks Decline Sharply; Dow Drops More Than 500 Points,"The Dow industrials dropped 1.8%, falling in tandem with oil and gold prices. Investors see dwindling prospects for a new stimulus package amid the campaign season."
84,"September 21, 2020 03:28 pm ET","Commodity Prices Retreat, Hurt by Dollar’s Advance","Oil prices dropped on fears that some of Libya’s long-blockaded crude would return to the market, adding to the global glut. The losses spilled from industrial commodities into precious metals."
85,"September 21, 2020 09:05 am ET",Pro Bankruptcy Briefing: Garrett Motion Eyes $2.1 Billion Bankruptcy Sale; Retail Gift-Card Holders Fight Back; Teamsters Union Fights Private Equity Over Pensions    ,"Automotive supplier Garrett Motion Inc. filed for bankruptcy, proposing a $2.1 billion sale to private-equity firm KPS Capital Partners. The filing, which sets up a conflict with former parent company Honeywell International over asbestos liabilities, confirmed Friday’s exclusive reporting in WSJ Pro Bankruptcy.  "
86,"September 20, 2020 10:00 am ET",The S&P 500’s Hottest Sector: Materials ,"Shares of the companies that mine or make raw materials are lately trading like once-hot technology stocks. The S&P 500’s materials sector is up around 5.4% this month, even as the broader index has fallen more than 4%."
87,"September 19, 2020 11:28 am ET",Trump’s Targeted Moves Seek to Shore Up Support for GOP Senators ,"With elections closing in, the White House is stepping up its efforts through policy changes and direct spending to support Republican candidates in competitive races. Democrats call the moves superficial fixes."
88,"September 19, 2020 09:49 am ET","Emerging and Growth Markets, September 19th 2020",A weekly roundup of key news affecting emerging and growth markets from the Wall Street Journal and beyond.
89,"September 18, 2020 06:09 pm ET",‘Sustainable’ Investing Is a Self-Defeating Strategy,"If, say, oil stocks sell at low prices relative to earnings and prospects, those who buy them stand to gain."
90,"September 18, 2020 03:44 pm ET",CFTC Commitments: NYMEX Crude Oil Futures/Options - Sep 18,
91,"September 18, 2020 03:24 pm ET",Wheat Futures Stretch Gains as Russian Prices Rise,
92,"September 18, 2020 02:35 pm ET",Cocoa Price Hits 1 Million Naira in Nigeria Due to Currency Depreciation -- Traders,
93,"September 18, 2020 12:32 pm ET",Saudi Royal Family Divides Over Potential Embrace of Israel    ,King Salman and Crown Prince Mohammed bin Salman have been at odds over whether to ease relations with the Jewish state. Israel’s deal with the U.A.E. stunned the 84-year-old monarch. Normalizing relations between Saudi Arabia and Israel before any deal for Palestinian statehood would be a seismic shift in the Middle East.
94,"September 18, 2020 09:41 am ET",Today’s Logistics Report: Planning Vaccine Delivery; Germany’s Export Cloud; Assembling Ford Trucks ,Today’s Top Supply Chain & Logistics News from WSJ.
95,"September 18, 2020 06:02 am ET","WSJ Wealth Adviser Briefing: Bond Investors, Airline Pleas, Gardening Woes","Bond investors regained their appetite for emerging markets; major airline executives made a final plea for government aid to avoid job losses, and defeated quarantine gardeners have thrown in the trowel."
96,"September 17, 2020 12:01 pm ET","In Boston, a Developer Is Turning His Childhood Home Into $1 Million Condos","Frank Williams watched the city’s South End neighborhood change before his eyes. Now, he’s one of the few lifelong residents reaping the benefits of the area’s real-estate boom."
97,"September 17, 2020 09:49 am ET",Can’t Travel to Paris? Bistro Chairs Bring Cafe Culture to Your Kitchen,"An erstwhile visitor rues not buying a set of the city’s distinctive bistro chairs last time she was there, so she takes to the internet."
98,"September 17, 2020 05:30 am ET",Bond Investors Regain Appetite for Emerging Markets ,"The collapse of bond yields in the developed world is driving investors back into battered emerging markets, fueling gains despite a series of high-profile defaults and concerns about the pandemic’s blow to fragile economies. "
99,"September 16, 2020 02:57 pm ET",Oil Rallies on Surprise Supply Drop ,"Oil prices climbed, after unexpectedly upbeat U.S. inventory numbers extended a rally that began Tuesday."
100,"September 16, 2020 08:41 am ET",PE Daily: Warburg Backs Tech Outfit With $1 Billion | An Oil Patch Growth Story | Calpers Resets on Private Equity    ,"Today we offer an exclusive from our Laura Cooper on a new technology investment group backed by nearly $1 billion from Warburg Pincus. And Luis Garcia has an unusual story from the oil patch about a company that’s growing despite the sector’s woes, while Preeti Singh has a look at how Calpers is trying to get its private-equity strategy back on track.  "
101,"September 16, 2020 08:32 am ET","Facebook, FedEx and Nikola: What to Watch When the Stock Market Opens",Facebook shares are ticking down. The FTC is gearing up to file a possible antitrust lawsuit against the social-media company.
102,"September 16, 2020 08:30 am ET",Pro Bankruptcy Briefing: Ligado in Talks to Restructure About $8 Billion in Debt | Flywheel Sports to Close | Vivus Fails to Win OK of Icahn-Backed Chapter 11 Plan    ,"Ligado Networks LLC, the wireless venture formerly known as LightSquared, is in talks to restructure close to $8 billion of debt and equity as it waits to get its 5G project off the ground, write WSJ’s Alex Gladstone and Andrew Scurria. Flywheel Sports Inc., spin boutique operator that recently settled a bruising patent fight with Peloton Interactive, is shutting down. And Vivus Inc., a drugmaker focused on obesity treatment, will go back to the drawing board after a bankruptcy judge rejected the company’s plan to sell its business to Carl Icahn’s investment firm.  "
103,"September 16, 2020 06:21 am ET",U.S. Gas Exporters Eye Europe’s Surging Prices,"Natural-gas prices have surged in Europe, offering good news for exporters that invested in infrastructure for shipping it over the past decade, only to contend with a collapse in sales when the pandemic struck. "
104,"September 16, 2020 06:00 am ET",Top Tier Capital Partners Doubles Down on GoExpedi ,"Expedi, a provider of e-commerce services to the energy industry under the GoExpedi brand, raised $25 million through an investment that values the growth-stage company at about $225 million."
105,"September 16, 2020 01:21 am ET",Business Shifts From Resistance to Action on Climate,"In a sign of how much corporate attitudes have changed, the Business Roundtable, one of the country’s most prominent business groups, is throwing its support behind broad-based measures to slash greenhouse gas emissions."
106,"September 15, 2020 07:08 pm ET",Pipeline Politics Tests Merkel’s Mettle,"Alexei Navalny succeeds where Trump fell short, in undermining the case for Nord Stream 2."
107,"September 15, 2020 03:16 pm ET",Wheat Drops on Larger World Supplies,
108,"September 15, 2020 02:59 pm ET",Oil Rises as Hurricane Season Disrupts U.S. Supply,"Oil prices rose, clawing back some of their losses from recent weeks, with hurricane season limiting supply from the Gulf of Mexico. "
109,"September 15, 2020 10:32 am ET",Industrial Production Points to Slowing Manufacturing Recovery,U.S. industrial production rose for the fourth consecutive month in August but at a much lower rate than earlier in the summer.
110,"September 15, 2020 09:23 am ET","Apple, Tesla, NextEra Gain: What to Watch When the Stock Market Opens","Apple shares are ticking up ahead of its much-hyped annual product reveal event, though investors won't get a peek at the newest smartphone."
111,"September 15, 2020 08:20 am ET",Fed Meeting Starts; Powell Adviser Named Monetary Affairs Chief; Man Behind ‘Evans Rule’ Sees New Rate Guidance Challenges    ,"Fed officials are about to start their two-day meeting, where they are expected to wrestle with how to put meat on the bones of their new average inflation framework. The central bank yesterday named Trevor Reeve as director of its monetary affairs division. Mr. Reeve was involved in key decisions while serving as the division’s deputy director since 2017. And Chicago Fed leader Charles Evans, who helped shape the Fed’s financial crisis-era interest-rate guidance, reckons that any new effort on this front will be trickier to pull off.  "
112,"September 15, 2020 06:48 am ET",Lonestar Resources Reaches Deal to Restructure Under Chapter 11 ,Lonestar Resources US said it plans to file for chapter 11 bankruptcy after reaching a restructuring support agreement that will eliminate roughly $390 million in debt obligations and preferred equity interests.. 
113,"September 15, 2020 04:50 am ET",German Stocks Show Strength in Europe’s Battered Market,"German stocks have outpaced European rivals since the coronavirus-driven market selloff bottomed out in March, reflecting the advantages of strong balance sheets and exports to China."
114,"September 14, 2020 07:07 pm ET",The Long Road to Israel’s Very Good Month,The Jewish state has become too valuable to the Arab world to be treated as a pariah.
115,"September 14, 2020 04:08 pm ET",Trump Administration Denies Retroactive Biofuel Exemptions in Boost for Iowa,Republicans warned that approving oil refiners’ biofuel waiver requests could hurt the re-election campaigns of President Trump and Iowa Sen. Joni Ernst.
116,"September 14, 2020 03:03 pm ET",OPEC Extends Forecast for Decline in Global Oil Demand ,"The economic hit from the coronavirus pandemic will hurt global energy demand harder and for longer than previously feared, the Organization of the Petroleum Exporting Countries said."
117,"September 14, 2020 02:11 pm ET","After Navalny Poisoning, Putin’s Loyalists Win Big in Russian Elections ","Forces allied with Russian dissident Alexei Navalny scored a few symbolic victories, but candidates loyal to President Vladimir Putin broadly dominated."
118,"September 14, 2020 12:45 pm ET",An Investor Bought a Coral Gables Home for $27.8 Million Last Year. Now He’s Relisting It for $49.9 Million.,"Steven Lempera purchased the 14,000-square-foot estate in an online auction for far less than its original $68 million asking price."
119,"September 13, 2020 08:00 pm ET",These Funds Let Investors Profit from Companies Hurt by the Pandemic,ETFs and other financial products that invest in or acquire distressed businesses are gaining interest.
120,"September 13, 2020 06:50 pm ET","Exxon’s Bet on Oil, Gas Drags Down U.S. Titan",The oil giant doubled down on oil and gas at what now looks to be the worst possible time. Investors are fleeing and workers are grumbling about the direction of a company some see as out of touch.
121,"September 12, 2020 10:30 am ET","Emerging and Growth Markets, September 12th 2020",A weekly roundup of key news affecting emerging and growth markets from the Wall Street Journal and beyond.
122,"September 11, 2020 04:50 pm ET",U.S. Prosecutors Step Up Pressure on North Korea,U.S. prosecutors asked a federal judge to order the forfeiture of funds associated with a former North Korea employee and related front company of Chinese telecom ZTE.
123,"September 11, 2020 12:14 pm ET",USDA Report: World Agricultural Supply and Demand Estimates,
124,"September 11, 2020 11:02 am ET",The New Geopolitics of Energy,Power is shifting from longtime oil giants like Russia and Saudi Arabia to innovators like China—and maybe the U.S. 
125,"September 11, 2020 11:01 am ET",‘Those Who Forget’ Review: Accounting for Evil,Confronting a hard truth about the Holocaust: the collaboration of ordinary Germans.
126,"September 11, 2020 08:38 am ET",Pro Bankruptcy Briefing: Discount Retailer Century 21 Is Shutting Down | Judge Rejects Latam Airlines DIP Loan | Creditors Blast Tuesday Morning Executives Over Sale Process    ,"Century 21, which for years offered New Yorkers big discounts on designer goods in the shadow of the Twin Towers, is shutting down after failing to wring Covid-19 concessions from its insurers. A bankruptcy judge rejected a $2.45 billion bankruptcy loan for Latam Airlines Group SA, which creditors had criticized as a sweetheart deal for some big shareholders. And Tuesday Morning executives are making a “desperate” attempt to try to save their jobs at the bankrupt home-goods discount chain by ignoring potential buyers, a group of creditors says.  "
127,"September 10, 2020 07:40 pm ET",Stocks Close Lower After Early Gains,"The Dow and S&P 500 lost momentum through the day as weekly jobless claims held steady, pausing Wednesday’s rebound after a recent technology-led selloff."
128,"September 10, 2020 05:08 pm ET",Jane Fraser to Succeed Michael Corbat as Citi CEO,"Jane Fraser will become the first woman to run a major Wall Street bank, succeeding Michael Corbat as Citigroup chief executive when he retires in February."
129,"September 10, 2020 08:58 am ET",Nasdaq and Tesla Up: What to Watch When the Stock Market Opens Today,"Stock market futures are trending up into Thursday's market open, with jobless claims coming in slightly higher than expected."
130,"September 10, 2020 08:48 am ET",PE Daily: Mass PRIM Predicts PE Rebound | Energy Alloys Files for Bankruptcy | A Railroad Rejection    ,"Public stocks aren’t the only assets that seem to be on the rebound. As our own Preeti Singh reports, Massachusetts’ state pension manager is seeing signs of a rebound in its private-equity portfolio, with valuations and deal flow picking up in some sectors.  "
131,"September 10, 2020 08:30 am ET",Pro Bankruptcy Briefing: Mall Owners Rescue J.C. Penney | Canada-based Women’s Clothing Retailer Seeks Protection From Creditors | Blackstone’s Energy Alloys Files for Chapter 11    ,"J.C. Penney will survive after mall owners Simon Property Group Inc. and Brookfield Property Partners LP agreed to pay $300 million in cash and forgive $500 million in debt as part of a deal that values the post-bankruptcy department store chain at $1.75 billion. Montreal-based Groupe Dynamite Inc., which owns more than 300 Garage and Dynamite women’s clothing stores in the U.S. and Canada, sought protection from creditors in both countries after landlords balked at its “Covid-19-adjusted rental model.” And Blackstone’s Energy Alloys, a specialty metals supplier to the oil-and-gas industry, filed for bankruptcy.  "
132,"September 10, 2020 08:22 am ET",Fed Officials Debate Implementation of New Framework; Bank of Canada Keeps Key Rate Unchanged    ,"Ahead of their September meeting, Fed officials are debating how exactly to implement their new framework governing how they will conduct policy over the long run. Elsewhere, the Bank of Canada kept its benchmark interest rate unchanged, saying it expects a faster third-quarter recovery than it had previously anticipated. On the agenda today we have a policy statement from the European Central Bank.  "
133,"September 10, 2020 05:32 am ET",Oil Traders Gird for More Price Swings ,"Traders are betting on fresh upheaval in the oil market, in an abrupt turnaround from the calm of recent months."
