,date,title,summary
185,"April 23, 2020 06:55 pm ET",The Coronavirus Could Imperil Putin’s Presidency,"Russia entered the crisis with a stagnant economy, and its oil-price war with the Saudis isn’t helping."
186,"April 23, 2020 05:53 pm ET",Australia’s Speedcast International Files for Bankruptcy ,"The company, which connects cruise ships and oil rigs to internet and phone services, filed for bankruptcy protection as the energy downturn and the coronavirus pandemic have wiped out much of its business."
187,"April 23, 2020 04:41 pm ET",Stocks Give Up Gains in Another Wild Session,"U.S. stocks swung sharply, with the Dow Jones Industrial Average giving up most of a 400-point rally on reports that a potential treatment for Covid-19 disappointed in a clinical trial."
188,"April 23, 2020 03:29 pm ET",Oil Prices Climb as Traders Prepare for Wild Ride to Continue,"Crude-oil prices jumped, extending a string of sharp moves that are ricocheting across financial markets and roiling the global energy industry. "
189,"April 23, 2020 02:08 pm ET",Norway’s Oil Fund Revises First-Quarter Loss to $126 Billion From $112 Billion,"Norway’s sovereign-wealth fund, the world’s largest, said it booked a loss of 1.35 trillion Norwegian kroner in the first quarter of 2020 as it updated preliminary figures released earlier this month."
190,"April 23, 2020 01:39 pm ET",Railroads Prepare for Quick Turnaround,Freight railroads are keeping their workers and locomotives on standby to quickly help get things moving again when large-scale business activity resumes.
191,"April 23, 2020 12:17 pm ET",Blackstone Battered by Selloff; Gray Sees ‘Elongated Recovery’ ,"Blackstone Group’s first-quarter results were hit hard by the coronavirus-led market selloff, and the firm’s president, Jonathan Gray, said he sees the economic recovery taking some time to gain steam. "
192,"April 23, 2020 11:56 am ET",Mexican Inflation Eases in April on Coronavirus Effects ,Mexico’s inflation moved below the central bank’s target in the first half of April as effects of the coronavirus crisis lowered the cost of gasoline and travel. 
193,"April 23, 2020 10:14 am ET",Asia’s Oil-Consuming Nations Add to Stockpiles Thanks to Bargain Prices ,"China, India, South Korea and Australia are taking steps to boost their national stockpiles of oil used to safeguard domestic industries during times of crisis, after oil prices fell to historically low levels. "
194,"April 23, 2020 09:53 am ET",Europe’s Banks Cannot Afford to Be Optimistic    ,"European banks were too optimistic during the last crisis, setting investors up for years of pain. Judging by Credit Suisse’s first-quarter results, there is a risk that they will also prove too optimistic in the current one."
195,"April 23, 2020 09:51 am ET","Fed Focuses on Lending Programs, But Monetary Policy Deliberations Loom ","Fed leaders have suggested they are comfortable with their current policy stance, but big questions will dominate deliberations at their two-day policy meeting next week, including how to manage bond-buying efforts and how long to extend those easy-money policies."
196,"April 23, 2020 08:51 am ET",Pro Bankruptcy Briefing: Stimulus Money Not Reaching Rural Hospitals | McConnell Endorses Bankruptcy for States | PG&E CEO Steps Down After Year of Upheaval    ,"The U.S. government’s premier remedy for small businesses trying to stay on their feet isn’t available to many of the nation’s small hospitals, largely because of measures they took to stay alive in the pre-pandemic days, WSJ Pro Bankruptcy’s Peg Brickley reports. As state governments face massive revenue shortfalls, Senate Majority Leader Mitch McConnell said he would rather see them go bankrupt than give them bailouts. And the CEO of bankrupt PG&E Corp. is stepping down after just more than a year at the helm.  "
197,"April 23, 2020 08:44 am ET",Limits to the Fed’s Largesse; Millions More Jobless Claims Expected; ECB to Accept Some Junk-Rated Bonds as Collateral    ,"The latest jobless figures are expected to show that millions more Americans filed for unemployment benefits last week. Meanwhile, we look at the ramifications of the Fed’s decision to exclude certain securities from its stimulus package. Outside the U.S., the ECB’s latest move aimed at helping eurozone banks through the coronavirus pandemic means banks could use Italian or Spanish government bonds as collateral for ECB loans even if those countries’ debt is downgraded. Turkey’s central bank cut rates, and the Hong Kong Monetary Authority said it would let banks tap the Fed’s new facility for global central banks.  "
198,"April 23, 2020 08:00 am ET",Soybeans Climb Second Session in Row -- Technical Analysis,
199,"April 23, 2020 07:50 am ET",Coal Suffers as Coronavirus Saps Power Demand,"As Americans consume less electricity during the coronavirus pandemic, many utilities are cutting back on coal power first, boding poorly for the future of coal power in the U.S."
200,"April 23, 2020 07:48 am ET","When Oil Prices Went Negative, Investors in China Took a Hit ","Oil derivatives sold to Main Street investors, including some that could be bought with a few clicks on a bank app, have produced hundreds of millions of dollars of losses in South Korea and China."
201,"April 23, 2020 06:48 am ET",Newsletter: Historic Collapse in Economic Activity,Your daily economics newsletter from The Wall Street Journal.
202,"April 23, 2020 06:08 am ET",The Daily Shot: The Expected Spike in Savings Rate Will Hinder Recovery,
203,"April 23, 2020 06:02 am ET","WSJ Wealth Adviser Briefing: High-Speed Trading, Gulf Oil Wells, Remote-Home Owners","High speed trader GTS said it planned to create an online market for pre-IPO shares; drillers in the Gulf of Mexico shut wells as oil prices plunged, and remote-home owners have figured out social distancing."
204,"April 22, 2020 08:37 pm ET",First Virus Deaths in U.S. Came Earlier Than Authorities Thought,"Newly reported deaths in California have challenged the timeline of the coronavirus pandemic, raising questions about when and how the virus first arrived in the U.S. and the costs of the nation’s lack of preparation earlier in the winter."
205,"April 22, 2020 07:26 pm ET",Coronavirus Poses Hurdle for Goodwill Impairment Tests ,The unknown depth and duration of the coronavirus pandemic have complicated CFOs’ efforts to conduct impairment tests for goodwill. 
206,"April 22, 2020 06:08 pm ET",U.S. Inflation-Protected Bonds Rally After Oil Prices Crash ,Demand is surging for U.S. government bonds with returns adjusted for the rate of inflation as investors brace for a sharp economic downturn as the coronavirus pandemic chokes consumer spending and shuts factories. 
207,"April 22, 2020 05:42 pm ET","‘We Pulled the Plug’: As Oil Prices Plunge, Drillers in the Gulf of Mexico Shut Off Wells ",The crash in oil prices is forcing drillers in the U.S. Gulf of Mexico to shut off wells. Some producers are worried offshore output may take years to recover. 
208,"April 22, 2020 04:48 pm ET","U.S. Stocks Finish Higher, Clawing Back Some of Week’s Losses",Shares rallied as oil markets calmed and investors looked to corporate earnings reports to gauge the health of U.S. businesses during the coronavirus pandemic.
209,"April 22, 2020 04:38 pm ET",Airlines Have Secured Cash but Not Their Future ,"Carriers are successfully building up cash buffers and face lower fuel costs, but none of this will make up for years of depressed travel demand. "
210,"April 22, 2020 03:48 pm ET",Corn Futures Rise After Prices Find Bottom,
211,"April 22, 2020 03:31 pm ET",Oil Rebounds After Trump Signals Fresh Iran Tensions,"Crude prices rose Wednesday, pausing a weekslong crash after President Trump warned Iran that he has instructed the U.S. Navy to destroy Iranian gunboats if they continue to harass American ships in the Persian Gulf. "
212,"April 22, 2020 03:03 pm ET","How Oil Markets Work, And Why Prices Fell Below Zero",The price of the world’s most important commodity this week fell below zero for the first time. Here are answers to all your questions on how that could happen.  
213,"April 22, 2020 02:50 pm ET","Migrant Workers Set to Send Less Money Home, World Bank Says","The money—a critical source of support for the developing world—is projected to fall by about 20% this year as the coronavirus crisis hits global economies, the World Bank says. "
214,"April 22, 2020 12:12 pm ET",Oil Price Manipulation and Slippery Results,"While President Eisenhower may have acted decisively in 1957, his policies directly contributed to the so-called “oil crises” of the 1970s."
215,"April 22, 2020 11:05 am ET",Negative Oil Prices Pose Headache for Futures Giant CME ,"Negative oil prices threaten to tarnish the image of West Texas Intermediate, the U.S. crude benchmark, and hurt the company that has long relied on it as a key source of revenue: exchange giant CME Group."
216,"April 22, 2020 10:13 am ET","Baker Hughes Cutting Jobs, Spending After Oil Prices Plunge ",The No. 3 oil-field services company is cutting jobs and reducing capital spending by 20% as it tries to save cash and ride out one of the worst energy downturns in decades. 
217,"April 22, 2020 10:07 am ET",Canada CPI Slows to Under 1% on Coronavirus-Fueled Energy Hit ,Canada’s annual inflation rate slowed markedly in March—the biggest deceleration in nearly 14 years—as the impact of the pandemic weighed on energy prices and other items. 
218,"April 22, 2020 09:26 am ET","PE Daily: Pandemic Spurs LPA Changes | Apollo, Silver Lake Eye Expedia Deal | Pension Liquidity Concerns in Pa.    ","The wild ride in oil markets and the resulting shudders through equities and other risk assets show how far we are from a return to pre-coronavirus days. The turmoil also demonstrates an underlying reason for general partners to seek changes in investment agreements with limited partners, a recent trend, according to a report from our Preeti Singh.  "
219,"April 22, 2020 09:07 am ET",Oil Rout to Hit U.S. Regional Economies; Senate Approves More Small-Business Aid; Bank of Mexico Cuts Rates    ,"Turmoil in the oil market will hit U.S. regions far from Texas, the heart of the country’s energy boom, a Journal analysis found. In Washington, legislation that would send $484 billion to small businesses and hospitals in yet another move to shore up business activity took a major step forward. And the board of governors of Mexico’s central bank voted unanimously to cut rates in a second consecutive unscheduled meeting.  "
220,"April 22, 2020 08:58 am ET",Pro Bankruptcy Briefing: Oil-Price Collapse Deepens | Shale Driller Unit Prepares to File for Bankruptcy | Billionaire Richard Branson Fights to Save Empire    ,"Oil prices plunged again as questions about bankruptcies and job losses are reverberating beyond the oil patch, where the carnage continues. Shale driller Unit Corp. is planning to file for bankruptcy after hiring Opportune LLP and Vinson & Elkins LLP, writes WSJ Pro’s Alex Gladstone and Soma Biswas. Texas regulators declined to force a cut in production in response to the oil glut and slumping demand, but some shale drillers are dialing back anyway. And billionaire Richard Branson is trying to save his Virgin empire after Virgin’s Australia airline filed for bankruptcy.  "
221,"April 22, 2020 08:50 am ET",Oil Market’s Crisis Spreads to Individual Investors ,"The collapse in crude prices is creating mounting losses for ordinary investors, a sign that the energy crisis is starting to ripple beyond the oil patch. "
222,"April 22, 2020 07:00 am ET",Facebook Adds India’s Richest Man as a Friend,The social-media giant is paying $5.7 billion for better connections in its most promising growth market. 
223,"April 22, 2020 06:40 am ET",Newsletter: Oil Price at Two-Decade Low,Your daily economics newsletter from The Wall Street Journal.
224,"April 22, 2020 06:02 am ET","WSJ Wealth Adviser Briefing: China Investors, Real-Estate Play, Movie Escape",China investors stashed more cash in money-market funds during the pandemic; cash pours into distressed real-estate funds and several directors suggested the movies that take them away.
225,"April 22, 2020 06:00 am ET",Oil Crash Comes Without Silver Lining ,"This time around, the sharp fall in oil prices is an unmitigated negative for the American economy. "
226,"April 22, 2020 05:38 am ET","The Daily Shot: Jet Fuel, Heating Oil at Levels Not Seen Since After 9/11",
227,"April 22, 2020 05:19 am ET",The Truck Industry Bets On the Other Electric Vehicle       ,"The truck industry is starting to take the other kind of electric vehicle more seriously. Daimler and Volvo, the world’s two largest makers of heavy trucks by revenues, said they would team up to develop fuel cells.   "
228,"April 22, 2020 12:01 am ET",What’s News: Business & Finance,What’s News: Business & Finance
229,"April 21, 2020 09:33 pm ET","Some States Look to Reopen, but Others Want More Testing First","U.S. governors are pursuing different routes to restart local economies hit by the coronavirus pandemic. Some are moving to reopen businesses, while others want more testing in place first. "
230,"April 21, 2020 07:19 pm ET",Trump Administration Weighs Aid for Oil Companies,One option under consideration involves exchanging stimulus funds for ownership stakes in the embattled producers or in their oil reserves. Democrats in Congress are likely to oppose the idea.
231,"April 21, 2020 06:27 pm ET",Oil Price Rout to Hit U.S. Regional Economies,"Tumbling oil prices will have broad regional impacts on the U.S. economy, hitting states far afield from Texas, which was the engine of a national energy boom during the past decade."
232,"April 21, 2020 05:52 pm ET",Treasurys Rally as Oil Price Drop Leaves Investors Jittery ,Investors flocked to U.S. government bonds as a seizure in oil markets sparked fresh jitters and a drive into safe-haven assets.
233,"April 21, 2020 05:29 pm ET","Oil-Price Crash Deepens, Weighs on Global Markets","Global oil prices continued to plunge, while the pain spread to currencies of major exporters and shares in energy producers. The most actively traded U.S. crude benchmark plummeted by over a third."
234,"April 21, 2020 04:59 pm ET",Bank of Mexico Cuts Interest Rates at Unscheduled Meeting,The central bank’s board of governors voted 5-0 to lower the overnight funding rate target to 6% from 6.5%.
235,"April 21, 2020 04:47 pm ET",Oil Traders Are Scrambling to Book Tankers for Storage ,"The growing surplus of oil on world markets has traders racing to find supertankers to use for storage, pushing rates for the mammoth vessels sharply higher even as prices for crude continue to dive."
236,"April 21, 2020 04:28 pm ET",U.S. Stocks Drop as Oil Market Shudders,"Stocks fell as crude oil continued its precipitous decline, in the latest bout of market turbulence sparked by the coronavirus pandemic."
237,"April 21, 2020 04:12 pm ET",Corn Futures Slide as Oil Prices Collapse,
238,"April 21, 2020 03:39 pm ET",Shale Driller Unit Corp. Prepares for Bankruptcy Filing ,"The company is planning to file for bankruptcy in the wake of collapsing crude prices, working with restructuring advisers from Opportune and Vinson & Elkins to prepare the chapter 11 filing."
239,"April 21, 2020 03:03 pm ET",Shell Delays $1 Billion North Sea Development ,"Royal Dutch Shell has postponed its Jackdaw natural-gas field development in the North Sea, as energy companies slash spending in response to plummeting prices. "
240,"April 21, 2020 01:20 pm ET",The Fund That Ate the Oil Market ,The travails of the United States Oil Fund in some ways mirror the collapse of inverse volatility note XIV two years ago.
241,"April 21, 2020 11:42 am ET",Saudi Oil Stranded in Supertankers as Backlog Piles Up,"Saudi Arabia’s oil-price war with Russia flooded the market with crude. Now, with demand having dried up and buyers hard to find, the kingdom is resorting to storing much of it at sea."
242,"April 21, 2020 11:33 am ET",Singapore Probes Energy Trader ,"Singapore police are investigating Hin Leong Trading, a major energy trader, after revelations that it may have suffered hidden futures losses of about $800 million over several years."
243,"April 21, 2020 09:29 am ET",PE Daily: Bain’s $50 Million Fleet Bet | Centric Brands in Restructuring Talks | Tapstone’s Done Deal    ,"There’s trouble in the fields—the oil fields, that is. Yesterday U.S. oil futures plunged into negative territory for the first time ever, as the country runs out of storage space for oil that would have been used if much of the world weren’t staying at home. What exactly this means for private-equity-backed energy companies may depend on a variety of factors, including how long the shutdowns last. We’ll have more on that for you in the coming days. However, even in the carnage, the WSJ Pro Bankruptcy team has news of one shale driller, Tapstone Energy, that still managed to complete its financial restructuring deal.  "
244,"April 21, 2020 09:13 am ET","Pro Bankruptcy Briefing: Neiman Prepares for Bankruptcy | Envision Healthcare, Lenders Face Off Over Debt Swap | Centric Brands Hires Restructuring Advisers    ","Neiman Marcus Group Inc. is preparing to file for bankruptcy as soon as Wednesday and lenders are considering several options including selling the business outright or closing some of Neiman’s 43 department stores. Lenders to KKR-backed Envision Healthcare Corp. are balking at a debt swap designed to put the private equity-backed staffing company on firmer financial footing, writes WSJ Pro’s Andrew Scurria. And Centric Brands Inc., which makes clothing for Calvin Klein, Tommy Hilfiger and other brands has hired restructuring advisers to help revamp its balance sheet, write WSJ Pro’s Alexander Gladstone and Soma Biswas.  "
245,"April 21, 2020 09:00 am ET",How Jobless Claims Vary Between States; Regulator Mulls Easing Strains on Mortgage Companies; PBOC Trials Digital Currency    ," Today we take a look at how the impact of the coronavirus pandemic on the labor market is varying between different U.S. states. Meanwhile, the Journal reports that a top U.S. regulator is considering taking steps to ease strains on mortgage companies facing a cash crunch as millions of Americans suspend their monthly payments. Outside the U.S., China continues to forge ahead with plans to introduce a digital currency, which is being tested in four large cities around the country.  "
246,"April 21, 2020 07:56 am ET",More Bad News for Oil from China ,The oil market is in disarray. Hopes that China can soak up excess supply as its economy recovers may be misplaced. 
247,"April 21, 2020 06:40 am ET",Newsletter: States Burn Through Unemployment Funds,Your daily economics newsletter from The Wall Street Journal.
248,"April 21, 2020 05:53 am ET",Coronavirus Can’t Stop America’s Best Stocks ,"To get a sense of how much better U.S. blue chips have done than the rest of the world as the global economy is ravaged by coronavirus, consider this: Nasdaq-listed stocks were briefly worth more than the main index of developed markets outside the U.S. last week, having been worth only half as much five years ago."
249,"April 21, 2020 05:30 am ET",Coronavirus Sends One-Fifth of Workers to Unemployment Line in Some States ,"The coronavirus pandemic is hitting state labor markets to very different degrees, with some seeing as many as one in five workers file for unemployment benefits and others far less. "
250,"April 21, 2020 04:57 am ET",RBA Governor Expects Biggest Economic Downturn Since Depression,"Australia’s economy has been broadsided by the coronavirus pandemic, which has dealt the biggest hit to national output since the Great Depression, Reserve Bank of Australia Gov. Philip Lowe said."
251,"April 21, 2020 04:36 am ET",The Daily Shot: Extreme Demand for Floating Storage as Crude Oil Prices Turn Negative,
252,"April 21, 2020 04:22 am ET",Trump to Temporarily Halt Immigration Into the U.S.,"President Trump plans to sign an executive order temporarily suspending immigration into the U.S., saying he was doing so to protect jobs as the coronavirus has taken a sharp toll on the economy."
253,"April 21, 2020 12:49 am ET",Oil Costs Less Than Zero but More Than $30 This Fall ,Many traders are betting that the coronavirus pandemic will run its course and that later this year demand for oil will jump. 
254,"April 20, 2020 09:40 pm ET","Some Governors Move to Reopen as U.S. Coronavirus Cases Top 784,000","U.S. governors took steps to start reopening their economies and focused on accelerating testing capacity for the new coronavirus, as infection rates slowed in hard-hit areas like New York and reported cases globally rose above 2.47 million."
255,"April 20, 2020 07:17 pm ET",Care to Store Some Oil?,The real price of West Texas crude hasn’t fallen below $0. 
256,"April 20, 2020 06:07 pm ET",Transcript: John Williams Speaking on the U.S. Economy to the Economic Club of New York ,Federal Reserve Bank of New York President John Williams spoke to the Economic Club of New York and offered his take on where the U.S. economy is amid the coronavirus crisis. 
257,"April 20, 2020 05:03 pm ET",Less Than Zero: What Oil’s Crazy Day Means ,The U.S. benchmark oil-futures contract settled at a negative price for the first time ever in a chilling development for U.S. producers and traders. 
258,"April 20, 2020 04:57 pm ET",Saudis Consider Cutting Oil Output Ahead of Schedule as Price Crashes ,"Saudi Arabia and other OPEC members are considering cutting their oil output as soon as possible, rather than waiting until next month when the group’s recent production agreement with the U.S. and Russia is set to begin, people familiar with the matter said."
259,"April 20, 2020 04:52 pm ET",U.S. Stocks Drop Along With Oil Prices,U.S. stocks slid to start another potentially volatile week as investors continued to try to gauge the extent of the economic damage from the coronavirus pandemic. 
260,"April 20, 2020 03:58 pm ET","Oil Prices Skid, With May Contract in Negative Territory",Crude prices plunge as storage space runs low for the glut of oil no longer needed by economies hard hit by the coronavirus pandemic. 
261,"April 20, 2020 03:56 pm ET",Wheat Futures Rise on Export Hopes,
262,"April 20, 2020 02:24 pm ET",Tapstone Finishes Debt Restructuring Despite Plunging Oil Prices ,"Shale driller Tapstone Energy has completed a financial restructuring, despite a historic plunge in U.S. oil prices, trimming about $450 million in debt from its balance sheet."
263,"April 20, 2020 01:44 pm ET",Saudi Residents Push Back Against Crown Prince's Megacity Plan ,"Saudi Arabia’s government is facing rare resistance to one of Crown Prince Mohammed Bin Salman’s signature projects, a new megacity in the kingdom’s northwest."
264,"April 20, 2020 01:08 pm ET",AGS WEEK AHEAD: Black Sea Weather Concerns; Cocoa Grinding Data; Covid-19 Logistical Issues,
265,"April 20, 2020 11:05 am ET","Halliburton Cutting Costs, Bracing for Drop in Oil-Field Activity ",The largest supplier of oil equipment to U.S. drillers is cutting $1 billion in costs and reducing its debt to gird itself against a stunning drop in investment throughout the American oil patch. 
266,"April 20, 2020 09:14 am ET",America’s Oil Patch Is Having a Heart Attack,"President Trump helped engineer a historic deal to curb global output, but it isn’t enough to forestall unprecedented pain for the domestic industry, as U.S. oil prices collapsed over the weekend."
267,"April 20, 2020 08:32 am ET",Fed’s Williams Expects Slow Recovery; China Cuts Rates; Officials Mull Moral Hazard Risk    , New York Fed President John Williams said Friday it’s unlikely that even a swift resolution to the coronavirus pandemic would trigger a fast recovery for the U.S. economy. China’s central bank cut its benchmark rates. And Michael S. Derby looks at how Fed officials are discussing the risk that the central bank’s intervention could create moral hazard.  
268,"April 20, 2020 08:24 am ET","Pro Bankruptcy Briefing: Landlords, Commercial Tenants Negotiate Rent Breaks | AMC Entertainment Seeks Rescue Loan | FEMA Awards Mask Contract to Company Whose Parent Is Bankrupt    ","Some landlords are agreeing to give commercial tenants a break on paying rent by delaying or even forgiving payments. With its theaters shut because of the coronavirus, AMC Entertainment Holdings Inc. is looking for $500 million in rescue financing.  And FEMA awarded a $55 million contract for N95 masks this month to Panthera Worldwide LLC, a “tactical training company,” whose parent company Panthera Enterprises LLC filed for bankruptcy last year.  "
269,"April 20, 2020 07:00 am ET",Kimmeridge Seeks Up to $1 Billion to Buy Publicly Traded Securities ,"Private-equity firm Kimmeridge Energy Management aims to raise $500 million to $1 billion for a new fund to buy publicly traded shares of oil-and-gas companies as it looks to expand its activist-investing push in the industry, people familiar with the matter said."
270,"April 20, 2020 05:30 am ET",Coronavirus Contract Disputes Start Hitting the Courts,Companies are suspending or terminating business agreements by relying on a common but rarely invoked escape hatch in many commercial contracts. 
271,"April 20, 2020 05:22 am ET",Repairing Planes Used to Be a Nice Business. Now They’re Grounded.    ,"The Covid-19 crisis is a severe blow for companies like Boeing that build planes, but it is an even harder one for those that repair them.  "
272,"April 20, 2020 04:58 am ET",The Daily Shot: Is U.S. Consumer Sentiment Bottoming?,
