,date,title,summary
212,"November 17, 2017 04:41 am ET",Oil Rally To Boost U.S. Drillers,"The rally in oil prices in recent months lays the foundations for a rebound in U.S. oil drilling activity, said Stephen Brennock at PVM brokerage."
213,"November 17, 2017 12:11 am ET",The Daily Shot: Prices on Imported Cars Are Declining Again,
214,"November 16, 2017 05:58 pm ET",Investors Holding Venezuela Default Protection Get $1 Billion Payday,"Investors who hold insurance-like derivatives against a Venezuelan default will receive a payout of more than $1 billion following a financial industry panel ruling, the latest sign that Wall Street is bracing for a messy debt restructuring. "
215,"November 16, 2017 05:39 pm ET",Emerson Electric Boosts Takeover Offer for Rockwell Automation,"Emerson Electric Co. boosted its takeover offer for Rockwell Automation Inc., ratcheting up an effort to bring its reluctant rival to the negotiating table and forge a new giant in industrial automation."
216,"November 16, 2017 05:17 pm ET",Mexico Secures Even Lower Prices for Clean Energy in Auction      ,"Mexico expects investment of around $2.4 billion in the next three years in new electricity generation projects as a result of its third long-term power auction, which saw prices for clean energy fall.  "
217,"November 16, 2017 05:02 pm ET",Stocks Regain Ground After Losing Streak,Soaring Wal-Mart shares and the passage of a tax-overhaul bill in the House helped U.S. stock indexes log their biggest gains since September.
218,"November 16, 2017 03:28 pm ET",Rising U.S. Oil Stocks Weigh on Prices ,Oil prices extended their losing streak as rising U.S. petroleum inventories and wavering demand forecasts continued to weigh on the market.
219,"November 16, 2017 02:54 pm ET",Germany’s Siemens to Slash Jobs Amid Shift to Renewable Energy,"Germany’s Siemens AG said it would cut 6,900 jobs as it wrestles with a sharp slowdown in demand for turbines used in fossil-fueled power plants, the latest restructuring move by a global industrial giant."
220,"November 16, 2017 02:29 pm ET",Quick Hits: Bank of Canada Estimates Neutral Rate at 1%,"The Bank of Canada now estimates that the real neutral rate of interest in the country is 1%, inequality was a main topic of discussion at a Dallas Fed event, and expectations of a Bank of Korea rate increase have boosted the won. "
221,"November 16, 2017 01:43 pm ET",Santos Rejected $7.2 Billion Bid From Harbour Energy in August,Harbour was formed by EIG Global Energy Partners to buy controlling or near-controlling stakes in energy assets globally.
222,"November 16, 2017 01:41 pm ET",Moody’s Cuts GE’s Credit Rating By One Notch,"Moody’s Investors Service on Thursday cut GE's long-term credit rating, the first action by a major bond-rating firm since the industrial conglomerate sketched out its plans to revamp operations and cut its dividend by half. S&P and Fitch Ratings both assign  AA- ratings, two notches above Moody's new assessment."
223,"November 16, 2017 11:53 am ET",Norway Considers Pulling Its $1 Trillion Wealth Fund Out of Oil Stocks,"Norway’s sovereign wealth fund said it may stop buying oil and gas stocks, a move that would deprive the energy sector of investment from a $1 trillion asset manager. "
224,"November 16, 2017 11:10 am ET",U.S. Industrial Production Increased Strongly in October,"U.S. manufacturing made a strong post-hurricane recovery in October, making up almost all output lost from hurricanes Harvey and Irma and boosting overall industrial production."
225,"November 16, 2017 08:49 am ET",What to Give: Books on Art,Peter Plagens recommends the best books to give to the art lover in your life.
226,"November 16, 2017 06:45 am ET","Rosengren: Data Favors a December Rate Increase | Brainard: Disparities Remain Despite Improvements | Treasury’s New Approach to Debt | BOE: Brexit May Not Bring Lower Rates | Buell’s Take: Friends, Follow Me to the World of Supervision","The Wall Street Journal’s central banking newsletter for Thursday, November 16, 2017"
227,"November 16, 2017 06:44 am ET",Big Firms Are Taking on Climate Change—Energy Journal,Some of the World’s Biggest Firms are Moving Ahead With Plans to Tackle Climate Change
228,"November 16, 2017 03:42 am ET","WSJ City: Trump Tax Plan Under Threat, Catalans Disappoint Brexiteers, What’s Behind the Market Wobble?",
229,"November 16, 2017 03:17 am ET",Philippine Central Bank Plays Down Strength of Economy,"The Philippine economy showed surprising strength in the third quarter, outpacing growth in China and prompting the central bank to reaffirm its current policy stance amid speculation it might become the first in Southeast Asia to raise interest rates."
230,"November 16, 2017 12:12 am ET",The Daily Shot: Auto Repair Costs Are Rising at the Fastest Rate since 2009,
231,"November 15, 2017 08:40 pm ET",Oil Futures Steady  ,Oil futures were little changed in Asian trading after Wednesday’s declines put prices at two-week lows. 
232,"November 15, 2017 07:27 pm ET",Venezuela Goes Bust,Another lesson in the price of lending to a socialist regime. 
233,"November 15, 2017 06:42 pm ET","Stocks, Commodities Fall Further as Investors Dial Back on Risk",Stocks and commodities extended declines as investors dialed back on riskier assets.
234,"November 15, 2017 06:15 pm ET",Aiding Oil’s Rebound: American Wildcatters Show Restraint ,Oil traders and analysts have traced the market’s recovery to signs of tighter supply and a return of geopolitical tensions. But many are also pointing to rising confidence that U.S. shale producers won’t endlessly ramp up production. 
235,"November 15, 2017 04:41 pm ET",S&P 500 Breaks Longest Stretch of Calm in Half a Century,The stock market just ended a stretch of calm that by one measure was last seen more than 50 years ago.
236,"November 15, 2017 04:26 pm ET",Mexico’s Pemex to Revamp Gas Stations as Competition Steps Up ,Mexico’s state oil company Petróleos Mexicanos is revamping its network of franchised service stations and will use its advantages to offer competitive prices. 
237,"November 15, 2017 03:42 pm ET",Oil Drops as U.S. Inventories Build Up    ,"Oil prices fell on Wednesday, as inventory data showed an increase in crude stockpiles and growing U.S. production."
238,"November 15, 2017 01:52 pm ET",Is the U.S. On Track for Energy Independence?,"Until the oil-price collapse that began in 2014, the U.S. was on a trajectory to achieve zero net imports by 2019, says WSJ Energy Expert Robert Rapier."
239,"November 15, 2017 01:28 pm ET",How Venezuela’s Debt Crisis Could Impact Oil,Add one more unknown to the pile of questions around Venezuela's debt crisis: how a default would affect the oil market.
240,"November 15, 2017 01:10 pm ET",Lower Oil Prices Add to High-Yield Bond Woes,Energy bonds had been a bright spot in the junk-bond world. They're not anymore.
241,"November 15, 2017 01:07 pm ET","As Headwinds Ease, Mideast Airlines Go Shopping",Deals secured at the Dubai Airshow reflect an upswing in sentiment among executives at airlines in the Middle East whose earnings have been dented over the past 18 months.
242,"November 15, 2017 12:35 pm ET","WSJ City PM: The EU’s Contest for Brexit Spoils, UK Cyber Agency Details Extent of Attacks, What Is Uber Really Worth?",
243,"November 15, 2017 08:45 am ET",You Better Buy That Dip Quick,Investors who like to wait for a dip in stock prices before they buy are having to work faster than ever.
244,"November 15, 2017 07:54 am ET",SandRidge Energy Confirms $746 Million Deal to Buy Bonanza Creek,SandRidge Energy said Wednesday it has reached a deal to buy Bonanza Creek Energy for $746 million in cash and stock.
245,"November 15, 2017 07:38 am ET",Oil Is Down Ahead of OPEC Meeting—Energy Journal,Oil Prices Are Down on Bearish data Showing a Rise in U.S. Crude Supplies
246,"November 15, 2017 07:28 am ET",Copper Continues Fall on Industrial Slowdown in China,Copper prices continued to fall on the back of weak Chinese industrial data.
247,"November 15, 2017 06:38 am ET",Bank Switches Regulators in Middle of Probe | SEC Rejects CAT Delay | House Votes to Overhaul Flood Insurance | Ackerman’s Take: In Fed Congress Trusts,"The Wall Street Journal’s financial regulation newsletter for Wednesday, November 15, 2017."
248,"November 15, 2017 03:52 am ET","WSJ City: U.K.’s May Passes First Brexit Bill Hurdles, Airbus Inks Huge Jet Deal, Zimbabwe Army Seizes Capital",
249,"November 15, 2017 03:20 am ET",Carlyle Eyes Varo Energy IPO Valuing It at Around $2 Billion,"Varo Energy’s owners, including U.S. private equity giant Carlyle Group and commodities trader Vitol Group, are eyeing an initial public offering next year that could value the European oil refiner around $2 billion."
250,"November 15, 2017 12:53 am ET",The Daily Shot: Fund Managers Taking Excessive Risks,
251,"November 15, 2017 12:00 am ET",What’s News: Business & Finance,What’s News: Business & Finance
252,"November 14, 2017 11:11 pm ET",SandRidge Energy Nears Deal to Buy Bonanza Creek Energy ,"SandRidge Energy Inc. is nearing an agreement to buy Bonanza Creek Energy Inc. for about $750 million, according to people familiar with the matter."
253,"November 14, 2017 09:28 pm ET",Oil Futures Slide Further in Asia on Bearish API Inventory Estimate,"Oil futures are down by another 1% in Asian trade on Wednesday, extending their overnight losses as the American Petroleum Institute’s reading of weekly U.S. inventories showed a surprising build in both crude oil and gasoline."
254,"November 14, 2017 06:21 pm ET",The Democrats’ Kansas Distraction,"They’re trying to make my state’s 2012 tax cuts into a cautionary tale, but there’s no comparison."
255,"November 14, 2017 06:08 pm ET",Pacific Drilling Tees Off Chapter 11 Case,"Representatives for offshore driller Pacific Drilling made their first bankruptcy court appearance since the company, weighed down by about $3 billion in debt, filed for chapter 11 protection."
256,"November 14, 2017 05:44 pm ET",Dollar Drops to Three-Week Low,"The dollar fell to its lowest level in nearly three weeks, weighed down by a stronger euro and diminishing expectations that Republicans will be able to push through a tax overhaul this year. "
257,"November 14, 2017 05:40 pm ET",Venezuelan Bonds Fall After Default Determination,"Venezuelan bonds, already trading at distressed levels, fell on Tuesday after a credit-rating firm a day earlier declared the nation in default on missed interest payments."
258,"November 14, 2017 05:26 pm ET",Oil Prices Drop on Lower Demand Forecast ,"Oil futures tumbled Tuesday as the International Energy Agency lowered its forecast for demand, calling into question a key element of oil’s recent rally."
259,"November 14, 2017 05:25 pm ET",Stocks Decline as Commodities Slump ,"Shares of oil-and-gas firms, chemicals companies and miners dragged down major stock indexes. "
260,"November 14, 2017 05:16 pm ET",Louvre Abu Dhabi Melds East and West,"The new art museum aims to narrate the history and accomplishments of all civilizations, presented as a continuous flow. "
261,"November 14, 2017 02:52 pm ET",Transcript: Central-Bank Chiefs’ Discussion in Frankfurt,"Federal Reserve Chairwoman Janet Yellen, European Central Bank President Mario Draghi, Bank of Japan Gov. Haruhiko Kuroda and Bank of England Gov. Mark Carney discussed central bank communications and other issues on a panel at an ECB policy conference in Frankfurt on Tuesday. Here is a transcript of the exchange."
262,"November 14, 2017 01:32 pm ET","CFTC Fines Norway’s Statoil, Citing Market Manipulation",The U.S. Commodity Futures Trading Commission said Tuesday that it fined Norway’s Statoil ASA $4 million for attempting to manipulate energy markets in 2011.
263,"November 14, 2017 01:15 pm ET",U.S. Producer Prices Rose in October,"Prices businesses pay for goods are picking up, a potential precursor to more consumer-price inflation."
264,"November 14, 2017 12:46 pm ET","The Class of 1994, Venezuela’s Golden Generation, Is Fleeing the Country","Raised during a time of prosperity to become doctors and lawyers and engineers, alumni from an elite Caracas high school are abandoning their homeland. They are among the two million who have left after the Hugo Chávez revolution ushered in economic collapse and a crackdown on democracy."
265,"November 14, 2017 12:13 pm ET","WSJ City PM: The Return of Irrational Exuberance, UK Inflation Holds at Five-Year High, May Faces Brexit Scrutiny",
266,"November 14, 2017 10:59 am ET","As Seadrill Foundered, Lawyers, Executives Profited ","Battered offshore oil-and-gas contractor Seadrill paid bankruptcy professionals well over $100 million before it stepped through the door of a Texas court in September, seeking chapter 11 protection from creditors."
267,"November 14, 2017 10:57 am ET",The Market Selloff in 6 Charts,Stocks sold off Tuesday as investors digested mixed prospects for a tax-code overhaul in Congress and weakening oil prices.
268,"November 14, 2017 09:09 am ET",One Sector Is Dragging Down the Junk-Bond Market,Communications companies are taking the junk bond market for a ride.
269,"November 14, 2017 08:28 am ET",The Morning Download: Missouri AG Investigates Google as Global Tech Backlash Grows,"The relationship between the tech sector and the global public sector is being redefined, with a rising level of regulation on ever-more powerful companies asserting itself against the traditional free-market ethos of Silicon Valley."
270,"November 14, 2017 07:23 am ET",Oil Falls on Lower Demand Projection—Energy Journal,Oil Futures Edged Down as the International Energy Agency Cut Its Crude Demand Growth Outlook
271,"November 14, 2017 07:18 am ET",The Morning Ledger: Mnuchin Says Trump Won’t Bend on Corporate Tax Rate of 20%,Treasury Secretary Steven Mnuchin said the Trump administration wouldn’t support tax legislation with a corporate tax rate of more than 20% as part of any future compromise between the House and the Senate.
272,"November 14, 2017 06:39 am ET",Today’s Top Supply Chain and Logistics News From WSJ,"Delivering up-to-the minute news, analysis, interviews and explanatory journalism on logistics, supply-chain management, e-commerce and more"
273,"November 14, 2017 04:00 am ET","Oil-Price Recovery Threatened by Weak Demand, Says IEA ","The International Energy Agency has lowered its global oil demand forecasts for this year and next, in contrast to OPEC, which has just raised them. "
274,"November 14, 2017 12:26 am ET","Asian Buyers Boost Christie’s Sale, Led by $81.3 Million van Gogh","Christie’s got New York’s fall auctions off to a roaring start Monday with a $479.3 million sale of impressionist and modern art, led by a van Gogh field scene that sold to a Chinese telephone bidder for $81.3 million."
275,"November 14, 2017 12:20 am ET",The Daily Shot: Beijing Flushing Out Leverage as Bond Yields Jump,
276,"November 13, 2017 10:04 pm ET",Should the U.S. Limit Exports of Natural Gas?,Supporters of limits say higher LNG exports will lead to higher natural-gas prices in the U.S. Opponents of limits say higher exports will have broad benefits for the economy.
277,"November 13, 2017 10:00 pm ET",Why the U.S. Shouldn’t Sell Off the Strategic Petroleum Reserve,"Although the global oil market has changed since the Strategic Petroleum Reserve was created, it's still needed according to WSJ Energy Expert Jason Bordoff."
278,"November 13, 2017 08:26 pm ET",Venezuelan Officials Offer Few Details During Debt Restructuring Talks,Venezuelan officials provided few details about how they would move forward with a planned debt restructuring during a brief meeting with bondholders at the presidential palace Monday afternoon.
279,"November 13, 2017 06:14 pm ET","GE Cuts Dividend, Slashes Profit Goals Amid Restructuring","GE slashed its 2018 profit forecast and said it was cutting its dividend by half, as the 125-year-old industrial conglomerate seeks to preserve cash for a restructuring under new Chief Executive John Flannery that will focus on three core units."
280,"November 13, 2017 05:34 pm ET",Brazil’s Petrobras Posts Profit ,"Brazilian state-run oil company Petróleo Brasileiro SA, or Petrobras, eked out a slim profit in the third quarter amid higher oil prices, though high interest expenses weighed on its bottom line. "
281,"November 13, 2017 04:39 pm ET",Pacific Drilling Files for Chapter 11 Bankruptcy Protection   ,"Pacific Drilling, an international offshore oil and gas drilling business, filed for bankruptcy Sunday in a bid to restructure about $3 billion in debt.  "
282,"November 13, 2017 03:41 pm ET",Oil Futures Mixed After OPEC Report,Oil futures were mixed Monday after major oil producers said their output fell last month.
283,"November 13, 2017 01:57 pm ET",Energy Sector’s Goodwill Impairments Slump as Oil Prices Rebound,"The amount and number of goodwill impairments recorded by the energy sector declined dramatically in 2016 as crude oil prices recovered from 12-year lows, according to a study by the Financial Executives Research Foundation and valuation firm Duff & Phelps LLC."
284,"November 13, 2017 11:19 am ET",The Light Bulb Finally Goes On at GE ,"New CEO John Flannery is sounding the right notes, but the turnaround effort at GE will be a major challenge."
285,"November 13, 2017 10:04 am ET",OPEC Defends Policy Ahead of Crucial Meeting ,"OPEC delivered a defense of its oil-production policies, signaling its members are prepared to continue trying to support crude prices by withholding supplies through next year."
286,"November 13, 2017 08:24 am ET","Harker: December Rise ‘Lightly Penciled In’ | Constâncio: ECB Will Maintain Accommodative Policy | Global Trade Booms, but Headwinds Blow | Derby’s Take: Fed Chairs Are Made By Events, Not Personal Ideology","The Wall Street Journal’s central banking newsletter for Monday, November 13, 2017"
287,"November 13, 2017 07:54 am ET",OPEC Says Output Fell in October—Energy Journal,Oil Prices Are Mixed As OPEC Says Output Fell in October
288,"November 13, 2017 06:37 am ET",The 10-Point: Gerard Baker on GE’s road ahead and more,"A personal, guided tour to the best scoops and stories every day in The Wall Street Journal, from Editor in Chief Gerard Baker."
289,"November 13, 2017 05:57 am ET",SoftBank’s Uber Deal Shows Doubts About Ride-Hailing,The Japanese company’s $10 billion investment effectively lowers Uber’s value. It may still be overpaying.
290,"November 13, 2017 05:30 am ET",Brazil Faces Offshore Oil Dilemma ,"Brazil’s federal government will soon start receiving crude oil from a huge offshore field known as Libra. But the government has no tanker ships to move the oil, no terminals to store it, and no refineries to process it."
291,"November 12, 2017 11:40 pm ET",The Daily Shot: Stocks Decouple from Credit as Investors Ignore the High-Yield Selloff,
292,"November 12, 2017 09:23 pm ET",Oil Futures Largely Flat in Asian Trade,"Oil futures held largely flat in Asian trading on Monday, holding steady after declines in the U.S. session on Friday. "
293,"November 12, 2017 09:58 am ET",Emirates Airline Orders $15.1 Billion in  Boeing 787 Dreamliners,"Emirates Airline on Sunday renewed its aircraft buying spree, committing to buy $15.1 billion worth of Boeing Co. 787 Dreamliners. Boeing bested Airbus in the competition to sell Emirates Airline, the world’s largest carrier by international traffic, new long-haul planes."
294,"November 12, 2017 08:48 am ET","Weekly Bond Price Indications - Week Ended November 9, 2017","The following chart has prices for junk-rated bonds, including weekly price changes and when those bonds mature."
295,"November 11, 2017 10:56 am ET","This Week on the Frontiers, November 11th 2017",A weekly roundup of key news affecting frontier markets from the Wall Street Journal and beyond.
296,"November 10, 2017 04:43 pm ET",Dow Snaps Eight-Week Winning Streak ,"The Dow Jones Industrial Average slipped, notching its first weekly decline since September, as concerns over the prospects of a U.S. tax-overhaul plan interrupted a remarkable stretch of gains for stocks."
297,"November 10, 2017 03:59 pm ET",Oil Falls as Geopolitical Concerns Ease,"Oil prices slid as fears of a major disruption in the Middle East eased, after prices soared over the past week as top exporter Saudi Arabia detained hundreds of individuals in a corruption investigation."
298,"November 10, 2017 02:34 pm ET",Quick Hits: Norway’s Inflation Outlook Could Put Rate Rises a Long Way Off,"Subdued inflation could keep Norway’s central bank on hold for some time, another extension of the ECB’s asset-purchase program late next year is seen as a possibility, and Morgan Stanley is bearish on the U.S. dollar versus emerging-market currencies."
299,"November 10, 2017 01:31 pm ET",U.S. Oil-Rig Count Rises by Nine in Latest Week ,"The number of rigs drilling for oil in the U.S. rose by nine this week to 738, Baker Hughes, a GE company, reported. "
300,"November 10, 2017 07:00 am ET",GE Dividend in Focus as Investors Await New Strategy,"Investors and analysts are bracing themselves for a broad rethinking of how GE operates, including shedding business units, a dividend cut, and layoffs among GE’s nearly 300,000-person workforce."
301,"November 10, 2017 06:48 am ET","In Growing Saudi Business, McKinsey Hired Officials’ Relatives—Energy Journal","In Growing Saudi Business, McKinsey Hired Officials' Relatives"
302,"November 10, 2017 05:30 am ET",Turkey Is the Canary in the Global Risk Coal Mine    ,"For investors everywhere, Turkey looks like an important country to watch for signs that the calm in global markets could be upended.   "
303,"November 10, 2017 03:40 am ET","WSJ City: May Warns Brexit Rebels; U.S. House, Senate Republicans Split on Taxes",
304,"November 10, 2017 12:47 am ET",The Daily Shot: Land Prices Are Surging Again,
