,date,title,summary
213,"October 21, 2017 07:00 am ET",Big Oil Set for Bumper Profits Despite Cheap Crude,"When some of the world’s largest energy companies report earnings next week, it will provide a glimpse into whether they are improving profitability as oil prices continue to hover around $50 a barrel."
214,"October 20, 2017 04:18 pm ET",General Electric’s Kitchen Sink May Still Have Holes    ,General Electric left its investors unhappy once again. At least management seems to be getting the message this time.  
215,"October 20, 2017 04:12 pm ET",Oil Edges Higher on Geopolitical Tensions ,"Oil prices rose Friday, boosted by disruptions to production in Iraq amid geopolitical conflict."
216,"October 20, 2017 03:47 pm ET",Trash Talk: Price of Recyclables Sinks After China Bans U.S. Scrap,Some U.S. manufacturers are turning trash into treasure after a Chinese ban on imported waste flooded American scrapyards with paper and plastic. 
217,"October 20, 2017 01:39 pm ET",U.S. Oil-Rig Count Fell by Seven in Latest Week,"The number of rigs drilling for oil in the U.S. fell by seven in the past week to 736, according to oil-field services company Baker Hughes."
218,"October 20, 2017 09:26 am ET",Canada CPI Grinds Higher in September,"Canada’s annual inflation rate accelerated higher in September for a third straight month, as gasoline prices surged due to the impact of Hurricane Harvey in oil-rich Texas. "
219,"October 20, 2017 07:21 am ET",Chevron Temporarily Suspending Operations in Iraqi Kurdistan—Energy Journal,Chevron Temporarily Suspending Operations in Iraqi Kurdistan
220,"October 20, 2017 02:27 am ET",The Daily Shot: You Have to Stay Awake to See Volatility in U.S. Markets,
221,"October 19, 2017 04:08 pm ET",Oil Settles Down    ,"Oil prices pulled back on Thursday, as geopolitical concerns eased and some investors cashed in on the week’s price rise. "
222,"October 19, 2017 01:24 pm ET","Chevy Bolt: Meet the First Practical, Mass-Market Electric Vehicle","With range anxiety in the rearview, General Motors’ under-$30,000 electric family car charges into the future. Dan Neil takes it for a looong spin."
223,"October 19, 2017 12:07 pm ET",BP Chairman to Retire ,"BP said the company’s longstanding chairman Carl-Henric Svanberg is set to retire, launching a search for his replacement. "
224,"October 19, 2017 07:52 am ET",Activist Investor Elliott Zeros In on BHP CEO ,"The chief executive of the world’s most valuable mining company, BHP Billiton, faces a vexing test: an activist investor that appears to be agitating for his ouster. "
225,"October 19, 2017 07:20 am ET",OPEC Defends Production Cuts—Energy Journal,Oil Company Executives Say fossil Fuels Will Remain the Central Part of Their Business for Decades
226,"October 19, 2017 03:19 am ET","The Daily Shot: Larger Homes, Smaller Lots",
227,"October 18, 2017 06:46 pm ET",Judge Approves Castex Emergency Bankruptcy Loan ,"Castex Energy Partners, a Houston-based oil and natural gas driller, won court approval Wednesday to begin drawing down a $15 million bankruptcy financing package."
228,"October 18, 2017 05:37 pm ET",Three Hedge Funds Call on Ocean Rig to Explore Deals    ,"Three hedge-fund owners of recently restructured offshore-drilling company Ocean Rig UDW Inc. are calling on it to hire a financial adviser to explore options, including a sale.  "
229,"October 18, 2017 03:46 pm ET",Oil Prices Rise on Stockpile Drawdown,Oil prices rose for a fourth straight session to hit three-week highs Wednesday after government data showed a larger-than-expected draw from U.S. crude stockpiles. 
230,"October 18, 2017 02:51 pm ET",Lender to Rooster Energy Proposes Its Own Reorganization Plan     ,A lender that has been at odds with Rooster Energy LLC since the outset of its bankruptcy filing has proposed a reorganization plan for the Texas oil-and-gas company.  
231,"October 18, 2017 12:41 pm ET",Big Oil Touts Its Core Business: Fossil Fuels ,"Big oil company executives asserted that fossil fuels would remain the central part of their business for decades, despite recent investments in renewables and other energy sources made in response to efforts to curb carbon emissions. "
232,"October 18, 2017 10:10 am ET",Vivo Energy Bets on Africa With $3 Billion IPO,"Vivo Energy Investments, a major Shell licensee in Africa, is eyeing an initial public offering over the coming months that could value the petrol company at more than $3 billion. "
233,"October 18, 2017 07:35 am ET",Trump Narrows Fed Search | Kaplan: Maintaining ‘Open Mind’ | Carney Issues Warning on Brexit | German Court Throws Out ECB Challenge | Douglas’s Take: BOE’s First Rate Rise May Be the Easy One,"The Wall Street Journal’s central banking newsletter for Wednesday,  October 18, 2017"
234,"October 18, 2017 07:35 am ET",Energy Producer Founded by Aubrey McClendon Aims for IPO,"Ascent Resources, the Appalachian oil-and-gas explorer founded by late oilman Aubrey McClendon and two big energy-investment firms, is preparing for an initial public offering or a sale."
235,"October 18, 2017 07:14 am ET",SEC Sues Rio Tinto Over Claims It Kept Investors in the Dark—Energy Journal,U.S. regulators sued Rio Tinto  over claims it misled investors about the value of Mozambique coal assets
236,"October 18, 2017 06:35 am ET",Algeria Adds Voice to Calls for OPEC to Continue Oil Cuts ,"Algeria wants OPEC to continue with production cuts, the country’s state oil-company chief said, adding to expectations the cartel will keep withholding supplies from the market. "
237,"October 18, 2017 06:06 am ET",Most U.S. States Aren’t Prepared For the Next Recession,"Just 16 states have adequate backup money on hand, according to a new Moody’s Analytics analysis."
238,"October 18, 2017 02:30 am ET","The Daily Shot: Health-Insurance Investors Cheer the Alexander-Murray Proposal, But Will It Stick?",
239,"October 17, 2017 07:01 pm ET",Oil Companies Defend Big Bets on Gas ,"The world’s biggest oil companies have defended their giant bets on natural gas at a major energy conference, saying demand will soon emerge for the huge supplies of fuel they are bringing to the market. "
240,"October 17, 2017 04:52 pm ET",Castex Energy Partners Files for Bankruptcy With Lender Takeover Plan    ,"Oil and natural gas driller Castex Energy Partners L.P., which owns about 375 wells throughout Louisiana and the Gulf of Mexico, has filed for bankruptcy protection amid the slump in energy prices."
241,"October 17, 2017 04:49 pm ET",Oil Prices Swing With Geopolitical Risks Still in Focus,"Oil prices fell Tuesday, paring earlier gains, with some of the geopolitical concerns that have recently supported prices easing."
242,"October 17, 2017 04:46 pm ET",An Old Fracking Hot Spot Makes a Comeback,"A giant natural-gas field in Louisiana that was one of the early centers of American shale drilling is roaring back to life, boosted by a building boom of petrochemical plants, fertilizer factories and gas-export terminals along the Gulf Coast."
243,"October 17, 2017 07:30 am ET",Kreutzer’s Take: Getting Creative in Private Infrastructure,"An abundance of capital available for private infrastructure deals in North America, combined with a limited supply of traditional infrastructure assets up for sale, is pushing some investors toward off-the-beaten-path deals. "
244,"October 17, 2017 07:30 am ET",Kreutzer’s Take: Getting Creative in Private Infrastructure,"An abundance of capital available for private infrastructure deals in North America, combined with a limited supply of traditional infrastructure assets up for sale, is pushing some investors toward off-the-beaten-path deals. "
245,"October 17, 2017 07:28 am ET",Trump to Meet With Yellen | UK Inflation Raises Prospects of Rate Rise | Constancio Warns of Correction | The BOJ’s Stealth Taper Is Back | Harrison’s Take: Doves Raising Rates,"The Wall Street Journal’s central banking newsletter for Tuesday, October 17, 2017"
246,"October 17, 2017 07:23 am ET",The Morning Ledger: China’s Pro-Market Talk Fades as Priorities Turn Inward,"Good morning. As China’s President Xi Jinping enters his second term, his promise to give markets “more room” has shifted to a renewed emphasis on central control and state intervention, writes WSJ’s Lingling Wei."
247,"October 17, 2017 07:16 am ET",Oil Experts Converge on London—Energy Journal,Oil Prices Made Gains Boosted by Rising Political Tensions in Iraq
248,"October 17, 2017 06:34 am ET",Trump to Meet With Yellen | UK Inflation Raises Prospects of Rate Rise | Constancio Warns of Correction | The BOJ’s Stealth Taper Is Back | Harrison’s Take: Doves Raising Rates,"The Wall Street Journal’s central banking newsletter for Tuesday, October 17, 2017"
249,"October 17, 2017 05:48 am ET",Today’s Top Supply Chain and Logistics News From WSJ,"Delivering up-to-the minute news, analysis, interviews and explanatory journalism on logistics, supply-chain management, e-commerce and more"
250,"October 17, 2017 03:41 am ET","WSJ City: Brexit Talks Should ‘Accelerate,’ U.K. to Strengthen Takeover Rules",
251,"October 16, 2017 07:28 pm ET",Oil Rises as Geopolitical Risks Return,Oil prices rise to an almost three-week high on escalating tensions in the Mideast and shifting U.S. policy that could interrupt the flow of crude.
252,"October 16, 2017 04:57 pm ET",Financial Stocks Push U.S. Indexes Higher,Rising financial shares pushed U.S. stock indexes higher. All three major U.S. stock indexes notched fresh records.
253,"October 16, 2017 03:34 pm ET",Bank of Canada Survey Points to Healthy Business Sentiment,"Canadian firms’ outlook for sales growth remains healthy, while investment and hiring intentions have cooled from the previous quarter, the Bank of Canada said."
254,"October 16, 2017 02:36 pm ET","As Islamic State Recedes, Iraqi Forces and Kurds Turn on Each Other ","Elite Iraqi forces took control of the local government building in Kirkuk, pushing out Kurdish fighters and effectively retaking the city after skirmishes that have raised fears of a wider conflict between two of the closest U.S. allies in the war against Islamic State."
255,"October 16, 2017 02:26 pm ET",Copper Hits Three-Year High on Bullish Chinese Economic Data,"Copper prices rose to their highest level since August 2014 Monday, propelled by the latest sign of strength from the Chinese economy."
256,"October 16, 2017 02:23 pm ET",Investors Are Warming Up to This ‘Epic’ Stock Rally,"Investors have started to get more optimistic about the staying power of the S&P 500's rally, reversing what's largely been a negative view of the market since the financial crisis."
257,"October 16, 2017 01:15 pm ET",Why Can’t We Have a Decent Stock Bubble?,"After an eight-year bull market and the cheapest borrowing costs in history, the big surprise is that the stock market isn’t higher. The simple answer is that the public is wary after the dot-com bubble of 2000 and the housing bubble of 2007."
258,"October 16, 2017 12:22 pm ET",No Aramco IPO May Mean No More Oil Rally,The oil rally could have the legs kicked out from under it if Saudi Aramco opts to forgo a public listing of its shares.
259,"October 16, 2017 12:13 pm ET",Enjoy That Cup of Coffee! Your Total Comes to $55,"To justify eye-popping prices, high-end java spots use rare beans, fancy machines, elaborate preparations and heaps of hyperbole. ‘The face of God in a cup.’"
260,"October 16, 2017 07:47 am ET",Yellen:Gradual Rate Increases Should Help Growth | Fischer: Trump Should Reappoint Yellen |  Rosengren Warns Against Rules | ECB Faces Bottleneck | Hannon’s Take: ECB Faces Tough Decision,"The Wall Street Journal’s central banking newsletter for Monday, October 16, 2017"
261,"October 16, 2017 07:34 am ET",Global Gas Producers Try to Drum Up Sales—Energy Journal,Global Natural-Gas Companies Face a New challenge: Creating More Demand
262,"October 16, 2017 07:21 am ET",The Morning Ledger: U.S. Firms Tap Canadian Bond Market,U.S. companies issue a record amount of Canadian-dollar-denominated debt. Glencore and Bunge strike a standstill agreement and Carrefour appoints a new CFO.
263,"October 16, 2017 06:32 am ET",Today’s Top Supply Chain and Logistics News From WSJ,"Delivering up-to-the minute news, analysis, interviews and explanatory journalism on logistics, supply-chain management, e-commerce and more"
264,"October 16, 2017 06:31 am ET","The 10-Point: Gerard Baker on Congress vs. Trump over health care, the Iraqi-Kurdish standoff, battery-operated homes and more","A personal, guided tour to the best scoops and stories every day in The Wall Street Journal, from Editor in Chief Gerard Baker."
265,"October 16, 2017 06:30 am ET",Drugstore Favorites May Be Catching the Common Consumer Cold       ,Customers may be starting to shop for over-the-counter drugs in the same way they shop for groceries—with a keener eye for cost and content—and this could be painful for consumer-health companies. 
266,"October 16, 2017 01:58 am ET",The Daily Shot: Still Waiting for Those Wage Pressures to Materialize,
267,"October 15, 2017 11:46 pm ET",What’s News: Business & Finance,What’s News: Business & Finance
268,"October 15, 2017 09:36 pm ET",Oil Futures Gain in Asia on Mideast Tensions ,"Oil futures climbed in Asian trading on Monday following fresh tensions in the Middle East, building on gains in the U.S. at the end of last week."
269,"October 15, 2017 01:32 pm ET",Bundesbank Chief: More German Government Spending Could Overheat Economy,"German central-bank President Jens Weidmann pushed back against international demands that Berlin loosen its purse strings to help reduce the nation’s current-account surplus, arguing higher government spending would risk overheating the nation’s economy."
270,"October 15, 2017 08:00 am ET",Global Gas Producers Turn to Next Challenge: Finding Buyers ,"After spending hundreds of billions of dollars to transform themselves into global natural-gas giants, big energy companies face a new challenge: generating more demand as supplies threaten to balloon and prices languish."
271,"October 14, 2017 10:22 am ET","This Week on the Frontiers, October 14th 2017",A weekly roundup of key news affecting frontier markets from the Wall Street Journal and beyond.
272,"October 13, 2017 05:00 pm ET",Strong Chinese Crude Imports Boost Oil Prices        ,"Oil prices jumped on a mix of factors, including bullish Chinese data and geopolitical risks from oil-rich regions in the Middle East.  "
273,"October 13, 2017 04:27 pm ET",Venezuelan Bonds Retreat After Government Misses Debt Payments ,"Venezuelan bonds sold off again this week, after the government fell behind on debt payments for at least the third time over the past year. "
274,"October 13, 2017 01:48 pm ET",New U.S. Stance on Iran Raises Alarm for Big Firms,"Western firms have piled into Iran since world powers agreed to lift sanctions. Now, as Donald Trump deals a blow to that deal, executives must decide whether to stay course."
275,"October 13, 2017 01:24 pm ET",U.S. Oil-Rig Count Fell by Five in Latest Week,"The number of rigs drilling for oil in the U.S. fell by five in the past week to 743, according to oil-field services company Baker Hughes. The nation’s gas-rig count fell by two. "
276,"October 13, 2017 12:30 pm ET",Montco Offshore Asks Judge to Continue Ban on Competing Plans,"As Montco Offshore prepares to combine operations with a competitor, its lawyers are trying to ensure that the Louisiana drilling services firm’s plan doesn’t get derailed."
277,"October 13, 2017 12:29 pm ET",U.S. Consumer Prices Rose in September,"Consumer prices jumped in September due to a hurricane-caused increase in gasoline prices, but underlying inflation appeared tame, potentially raising questions for Federal Reserve policy makers."
278,"October 13, 2017 11:52 am ET",Glencore Must Bide Its Time in Overtures to Bunge,"Glencore has a standstill agreement that temporarily prevents it from making a hostile bid for Bunge, according to people familiar with the matter, raising the possibility Glencore will renew its effort to acquire the grain trader. "
279,"October 13, 2017 08:25 am ET",What a Shocker: General Electric Is Becoming Attractive ,Investor expectations for General Electric are low. GE should consider lowering them further as an ugly year gets worse. 
280,"October 13, 2017 08:06 am ET",CMO Today: Facebook’s Sandberg on Russia; Advertisers Assess Amazon NFL Streaming; Vox’s Explainer Ads,"Here's your morning roundup of the biggest marketing, advertising and media industry news and happenings."
281,"October 13, 2017 08:05 am ET",How Donald Trump’s Health-Care Order Aims to Lower Costs,News and analysis from the WSJ's Washington bureau
282,"October 13, 2017 07:49 am ET",CFTC’s Quintenz on Automated Trading | Trump Interviews John Taylor for Fed | Deng’s Take: New Risks in Chinese Insurance,"The Wall Street Journal’s financial regulation newsletter for Friday, October 13, 2017."
283,"October 13, 2017 07:38 am ET",Trump Expected Not To Certify Iran Compliance With Nuclear Deal—Energy Journal,President Donald Trump is set to refuse to certify that Iran is in compliance with the 2015 international nuclear agreement
284,"October 13, 2017 02:51 am ET",The Daily Shot: U.S. Oil Imports From Saudi Arabia Hit a 30-Year Low,
285,"October 12, 2017 10:07 pm ET",Oil Futures Builds on Early Rebound in Asian Trade,"Oil futures recovered in Asian trade Friday, after an overnight pullback that ignored a larger-than-expected fall in U.S. oil inventories. "
286,"October 12, 2017 10:00 pm ET",Chevron Loses Taste for Oil in Great Australian Bight,"The U.S. company has abandoned plans for deep-water exploration wells in the 1,000-mile stretch of ocean off southern Australia, citing low oil prices. "
287,"October 12, 2017 06:07 pm ET",Market Talk: Daily Analysis Roundup,"Read our compilation of concise, timely analysis by Wall Street Journal reporters. Wells Fargo Names New Compliance Chief From Barclays; Initial Coin Offerings Need Gatekeepers Says SEC; J.P. Morgan: No Financial Impact from Equifax Data Breach"
288,"October 12, 2017 05:54 pm ET",Breitburn Energy Releases Plan to Get Out of Chapter 11    ,"Breitburn Energy Partners LP has released a plan to get out of chapter 11, where the oil and gas driller has been sitting for more than a year, that would hand control of the company to creditors in exchange for debt relief and raise $775 million in new money through a rights offering to bondholders.  "
289,"October 12, 2017 05:02 pm ET",U.S. Stocks Decline as Banks Kick Off Earnings,Declines in bank shares pulled U.S. stock indexes away from records. The S&P 500 dropped 0.2%.
290,"October 12, 2017 04:58 pm ET","Transcript: Discussion With Bernanke, Draghi, Brainard, Hildebrand and Posen",Current and former central bankers discussed monetary policy at a Peterson Institute for International Economics conference in Washington.
291,"October 12, 2017 03:42 pm ET","Say Goodbye to $30 Oil as Supply Glut Is Mostly Gone, Says Platts","OPEC might be closer to working off a supply glut than it thinks, says Gary Ross, head of global oil analytics at S&P Global Platts."
292,"October 12, 2017 03:12 pm ET",Mazda’s MX-5 Miata RF: A Peter-Pan Car Grows Up,"Why the new grown-up Miata belongs in the car Hall of Fame—no if, ands, or buttresses."
293,"October 12, 2017 03:10 pm ET",Oil Prices Fall on Rising U.S. Production Concerns,Oil prices fell as concerns that rising U.S. production will offset efforts to rebalance the market resurfaced.
294,"October 12, 2017 12:07 pm ET","WSJ City PM: What HSBC Gets With New CEO Flint, Pound Slides on ‘Disturbing’ Deadlock, US Banks Kick Off Q3 Earnings Season",
295,"October 12, 2017 07:28 am ET",Fed on Track to Raise Rates | Warsh Seen as Most Likely Pick | Bostic: Fed Balance Sheet Drawdown Going Well | ECB Praet: Insufficient Progress Toward Inflation Goal | Torry’s Take: Fed Divisions Raising Suspense In The Low Inflation Mystery,"The Wall Street Journal’s central banking newsletter for Thursday, October 12, 2017"
296,"October 12, 2017 07:17 am ET",French Bank BNP Paribas Says ‘Non’ to Financing Shale Oil—Energy Journal,The French Bank BNP Paribas Says It Will No Longer Finance Shale and Oil Sands Projects
297,"October 12, 2017 04:00 am ET","Global Oil Supply Lifted by Steady U.S. Production, IEA Says","The world’s oil supply expanded in September on the back of steady U.S. production growth, even as the global market continued to show signs of rebalancing, the International Energy Agency said."
298,"October 12, 2017 02:35 am ET","The Daily Shot: Want a job? Openings at Hotels, Restaurants, and Construction Firms in the Midwest Spike",
299,"October 12, 2017 02:06 am ET","BNP Paribas to Stop Financing Shale, Oil Sands Projects","French lender BNP Paribas said it will no longer finance shale and oil sands projects, in one of the clearest signs the banking industry is re-evaluating its relationship with the oil sector amid mounting pressure from investors."
300,"October 11, 2017 04:52 pm ET",Oil Prices Rise for Third Straight Day,Oil prices rose for a third straight day as forecasts of higher demand and tensions in the Middle East outweighed rising OPEC output.
301,"October 11, 2017 01:35 pm ET",Transcript: Q&A With Dallas Fed’s Robert Kaplan at Stanford University,"Dallas Fed President Robert Kaplan discusses productivity growth challenges, how the U.S. central bank conducts monetary policy meetings, the energy industry and the economy in Texas."
302,"October 11, 2017 12:47 pm ET",We Need Tax Reform That Promotes Growth,The British have shown that reducing our corporate tax rate will more than pay for itself.
303,"October 11, 2017 09:15 am ET",OPEC Production Jumps Despite Deal to Limit Output,"OPEC crude-oil production jumped in September by nearly 90,000 barrels a day, complicating the cartel’s efforts to limit output, curb the global supply glut and raise oil prices."
304,"October 11, 2017 07:36 am ET",Power Companies Stick to Plans Despite Emissions Repeal—Energy Journal,Power Companies Stick to Plans Despite Emissions Repeal
305,"October 11, 2017 07:10 am ET",GE’s Baker Hughes Recently Held Takeover Talks With Subsea 7 SA ,"General Electric’s Baker Hughes recently held takeover talks with energy-services company Subsea 7, but the negotiations recently broke down over price. "
306,"October 11, 2017 06:20 am ET",Today’s Top Supply Chain and Logistics News From WSJ,"Delivering up-to-the minute news, analysis, interviews and explanatory journalism on logistics, supply-chain management, e-commerce and more"
307,"October 11, 2017 05:33 am ET",China’s Next Five Years—Squeezing the People to Feed the State,"China’s twice-a-decade Communist Party reshuffle this month will hand even more power to President Xi Jinping, whose emerging grand strategy for managing the economy—and avoiding a debt crisis—will shape global asset markets for years to come."
308,"October 11, 2017 02:34 am ET",The Daily Shot: U.S. Prime-age Population Has Not Increased in a Decade,
309,"October 10, 2017 09:14 pm ET",Oil Futures Recover From Early Weakness in Asian Trade ,"Oil futures reverse early weakness in Asian trade Wednesday, extending an overnight rebound following Saudi Arabia’s plans to cut crude exports next month."
310,"October 10, 2017 08:16 pm ET",The Reason Investors Love Spinoffs: Juicier Returns,"Pfizer and Honeywell announced plans to hive off major business units, a reminder that spinoffs remain popular with executives as well as investors, who appreciate their long history of outperforming the broader market."
311,"October 10, 2017 04:54 pm ET",CGG Bankruptcy Plan Wins U.S. Court Approval    ,"A New York judge Tuesday approved a bankruptcy-exit plan proposed by CGG Group, a French oil-services company, and also required the company to improve the transparency of its executive compensation.  "
312,"October 10, 2017 04:34 pm ET",Da Vinci Goes on the Block for $100 Million,"Christie’s will put “Salvator Mundi”—one of fewer than 20 surviving Da Vinci paintings—on the block next month with an asking price of $100 million, a record for an Old Master but less than the owner paid a few years ago."
313,"October 10, 2017 03:38 pm ET",Seadrill Shareholder to Object to Restructuring in Court ,A Seadrill shareholder will appear in court next month to ask that an official committee be appointed to look out for common shareholders in the company’s bankruptcy restructuring.
314,"October 10, 2017 03:24 pm ET",Oil Climbs After Saudi Arabia Plans Export Cuts,Oil prices rose after Saudi Arabia’s plans to cut monthly exports in November renewed faith in the major oil producer’s efforts to drain global stocks.
315,"October 10, 2017 11:58 am ET","Breitburn Closes In on $775 Million Rights Offering, Chapter 11 Plan","Breitburn Energy Partners LP says it is close to filing a chapter 11 plan of reorganization that includes a $775 million rights offering back-stopped by creditors of the oil and gas company, which has been in bankruptcy for more than a year."
316,"October 10, 2017 09:04 am ET",Cheap Borrowing Costs Could Keep Lifting Stocks,The bond market is still playing a central role in the stock market's rise.
317,"October 10, 2017 08:11 am ET",EIG Seeks Up to $7 Billion for New Energy Wagers,"EIG Global Energy Partners is seeking as much as $7 billion for its newest flagship fund, said people familiar with the matter, as the private-equity firm’s previous flagship pool shows signs of recovering from the effects of the oil-price slump."
318,"October 10, 2017 06:25 am ET",Today’s Top Supply Chain and Logistics News From WSJ,"Delivering up-to-the minute news, analysis, interviews and explanatory journalism on logistics, supply-chain management, e-commerce and more"
