,date,title,summary
250,"December 17, 2018 01:59 pm ET",Germany’s BASF Plans More Price Increases to Offset Higher Raw Material Costs,"The German chemical maker has raised prices by 5% to 6% across its product range since the beginning of 2018, but this isn’t sufficient to offset the temporary run-up in oil-and-gas prices that is affecting its downstream business, Chief Financial Officer Hans-Ulrich Engel said in an interview with CFO Journal. "
251,"December 17, 2018 10:15 am ET",ICE Canola Stabilizes in Morning Trade,
252,"December 17, 2018 10:15 am ET","AGS WEEK AHEAD: Traders Eye Geopolitics as Global Trade Relations Warm, Brexit Sends U.K. Politics into Disarray",
253,"December 17, 2018 07:59 am ET",Gulf IPO Plans Shelved Amid Oil Price Volatility—Energy Journal,"Following Saudi Aramco’s postponement of plans for an initial public offering, at least eight state-owned energy companies in the Persian Gulf have also shelved privatization efforts"
254,"December 17, 2018 06:02 am ET",Saudi Arabia Denounces Senate Resolution on Khashoggi Murder ,"The kingdom delivered a rebuke to the U.S. Senate for passing a resolution that blamed the Saudi Arabia’s crown prince for the killing of journalist Jamal Khashoggi, a rare criticism by Riyadh of its most important ally. "
255,"December 17, 2018 02:43 am ET",The Daily Shot: U.S. Recession Fears Are Overblown,
256,"December 16, 2018 03:53 pm ET",Let the Good Times…Stay a Little Longer?,"The year 2018 will go down as one of the best in a nine-year U.S. economic expansion but trouble could lie ahead, as real-estate and financial markets flash warning signs and U.S.-China trade tensions simmer. "
257,"December 16, 2018 03:21 pm ET",The Yellow Jackets Are Right About Green Policies,They have distinguished company in questioning the science behind climate-change dogma.
258,"December 16, 2018 03:00 pm ET","Global Week Ahead: U.S. Trade Data, Home Sales, Federal Reserve Meeting ","The Fed holds its December meeting this week; new data on U.S. trade and sales of previously owned homes is expected, too. "
259,"December 16, 2018 01:23 pm ET",The Rocky Stock Market Still Pays Dividends to Investors,"Dividends have been a silver lining for the stock market this year, but investors are grappling with whether they can keep up such a rapid pace of growth."
260,"December 16, 2018 08:00 am ET",Hopes Dashed For a Middle East Markets Bonanza,Nine state-owned energy giants including Saudi Arabia’s Aramco have shelved or delayed plans to sell shares to the public amid volatile crude-oil prices of the past three years. 
261,"December 15, 2018 10:37 pm ET",Mexico’s Budget Plan Proposes Moderate Spending Increase,Mexico’s new President Andrés Manuel López Obrador unveiled a budget proposal for 2019 that calls for a moderate increase in spending without raising taxes or the country’s debt.
262,"December 15, 2018 10:47 am ET","This Week on the Frontiers, December 15th 2018",A weekly roundup of key news affecting frontier markets from the Wall Street Journal and beyond.
263,"December 15, 2018 09:00 am ET",Russian Lawyers Find Lucrative Niche Counseling Clients Hit by Sanctions     ,Russian lawyers are racking up billable hours and profits helping companies hit by sanctions navigate treacherous legal terrain—and preparing others in case they are targeted next. It’s a niche big international firms can’t touch.  
264,"December 15, 2018 07:00 am ET",Investors Turn Focus to Fed’s 2019 Rate Path ,"Volatile markets, mixed inflation signals and recent remarks by Fed Chairman Jerome Powell have deepened investors’ doubts about how many times the Fed can raise rates next year."
265,"December 14, 2018 06:56 pm ET",How America Broke OPEC,Lessons from the U.S. rise to be the world’s largest oil producer.
266,"December 14, 2018 05:08 pm ET",Sharp Decline Puts Dow in Correction Territory,"All three major U.S. stock indexes are in correction territory for the first time since March 2016, with disappointing economic data from China and the eurozone sparking Friday’s nearly 500-point fall in the Dow."
267,"December 14, 2018 03:50 pm ET",Oil Prices Follow Equities Lower as Dollar Climbs,"Oil prices weakened, hit by global growth concerns and a stronger U.S. dollar. U.S. crude dropped 2.6%, while Brent crude lost 1.9% a day after the International Energy Agency said commercial oil stocks rose."
268,"December 14, 2018 03:44 pm ET","Brazil Charges Former Trafigura, Petrobras Executives With Corruption ","Brazilian prosecutors charged ex-executives of commodities trader Trafigura Group and oil company Petróleo Brasileiro SA, or Petrobras, with corruption and money laundering in relation to a series of oil-trading contracts. "
269,"December 14, 2018 02:57 pm ET",ICE Canada Review: Canola Playing 'Follow the Leader' With Soy,
270,"December 14, 2018 01:49 pm ET",Holiday Season Retail Sales Heat Up,"Americans stepped up their spending at the start of the holiday season, suggesting the economy’s key engine is humming."
271,"December 14, 2018 12:39 pm ET",Cross U.S. Consumers Off the Worry List,"While American consumers are spending, they appear to be doing so in a way that reflects greater reluctance to spend beyond their means—making them better positioned to weather any near-term rough patches next year."
272,"December 14, 2018 12:34 pm ET",Pay Rises in Tight Labor Market ,"A tighter labor market appears to be forcing employers to step up base pay, rather than just offer better perks, according to Labor Department data."
273,"December 14, 2018 12:12 pm ET","ICE Canola Weakens, Realigning With Soy",
274,"December 14, 2018 11:52 am ET",Pet Retailer Finds New PE Owner; Regent Picks Up La Senza Lingerie,A daily private-equity news digest from WSJ Pro.
275,"December 14, 2018 10:30 am ET",Cold Weather Drove Industrial Production Growth in November,"U.S. industrial output rose starkly in November, driven largely by cold weather-induced utility usage."
276,"December 14, 2018 09:37 am ET",Russian Central Bank Raises Interest Rates,Russia’s central bank raised its key interest rate for the second time in four months in a surprise decision that aims to underpin the ruble ahead of further moves by the U.S. Federal Reserve and potential new Western sanctions. 
277,"December 14, 2018 09:00 am ET",GE Powered the American Century—Then It Burned Out,"The company that was once America’s biggest and most admired, the maker of power turbines, the seller of insurance, the broadcaster of “Seinfeld,” has become a shadow of its former self. This is the story of how generations of managers, who thought they could fix any company in any industry, finally ran into a problem they couldn’t solve."
278,"December 14, 2018 08:16 am ET",The Saudis Spend to Prop Up Their Stock Market—Energy Journal,
279,"December 14, 2018 04:12 am ET",The Daily Shot: Report Points to Further Deterioration in China’s Economy,
280,"December 14, 2018 03:22 am ET",European Commodities -- Technical Analysis,
281,"December 13, 2018 05:25 pm ET",Growth Fears Pinch Commodities Prices,A trade standoff between the U.S. and China and a persistently strong dollar are driving investors out of raw materials.
282,"December 13, 2018 03:06 pm ET",Oil Rises After U.S. Inventories Decline,Oil prices rose as traders weighed declining U.S. stockpiles against higher production around the world.
283,"December 13, 2018 02:51 pm ET",ICE Canada Review: Canola Drops With Soy,
284,"December 13, 2018 02:02 pm ET",Saudi Arabia Pumps Up Stock Market After Bad News,"The government of Saudi Crown Prince Mohammed bin Salman has spent billions to counter selloffs in recent months following the killing of a dissident journalist, a corruption crackdown and a showdown with Qatar. "
285,"December 13, 2018 01:15 pm ET",Trive Sells Shares of Diversified Gas & Oil Shareholder at 114 Pence Each,"Following the sale, the private-equity firm owns 7.4 million shares in the company, which are subject to a lockup agreement. "
286,"December 13, 2018 01:09 pm ET",WOW Air Lays off Staff Amid Restructuring,WOW Air recently said it has an agreement in principle with Indigo Partners which will involve the private-equity firm investing in the airline.
287,"December 13, 2018 11:00 am ET",What Could Go Wrong With Climate-Change Investing     ,The consensus that climate change will do obvious damage to long-run stock returns is wrong on a crucial point: that society is sure to act to stop global warming.  
288,"December 13, 2018 09:14 am ET",U.S. Jobless Claims Post Largest Weekly Drop Since 2015,The number of Americans filing applications for new unemployment benefits fell last week by the most in three and a half years.
289,"December 13, 2018 08:14 am ET",No Quick End to the Brexit Saga,Chances of the Brexit saga coming to an early end are fading fast. Investors should resign themselves to the prospect of an unpredictable last-minute showdown.
290,"December 13, 2018 07:58 am ET",OPEC Takes More Oil to Market Ahead of a Supply Cut—Energy Journal,
291,"December 13, 2018 07:49 am ET","Consumer Prices Flat in November, Posing Dilemma for Fed | Banking Regulators Adopt a Softer Tone","The Wall Street Journal’s central banking newsletter for Thursday, December 13, 2018."
292,"December 13, 2018 05:32 am ET",Indian Stocks Surge as Investors Bet Central-Bank Independence Is Overrated,"India lost its top central banker this week. That has fed a stock-market rally, despite fears about the independence of monetary policy.  "
293,"December 13, 2018 05:12 am ET",Norway Central Bank Signals Rate Rise in March 2019 ,The Norges Bank left its key rate unchanged but said the economic outlook points to a “gradual interest rate increase in the years ahead.” 
294,"December 13, 2018 04:54 am ET","OPEC Boosts Output Before Deal Kicks In, IEA Says","OPEC oil production climbed in November, driven by record output from Saudi Arabia, even as the group’s plan to impose fresh production curbs next month has helped to put a floor under crude prices, the IEA said. "
295,"December 13, 2018 04:47 am ET",Diversified Gas & Oil Shareholder Sells Shares at 114P,
296,"December 13, 2018 04:01 am ET",Swiss National Bank Leaves Rates Unchanged,The central bank left the door open to further reductions to its key interest rate as it confronts superlow inflation and a strong currency. 
297,"December 13, 2018 03:33 am ET",Philippine Central Bank Keeps Overnight Rates Unchanged ,"The central bank of the Philippines left interest rates unchanged, as expected, as consumer prices eased from a nine-year high last month."
298,"December 13, 2018 02:42 am ET",The Daily Shot: The Percentage of Small Businesses Boosting Prices Hit the Highest Level in a Decade,
299,"December 13, 2018 01:52 am ET",European Commodities -- Technical Analysis,
300,"December 12, 2018 05:38 pm ET",Trade-Talk Progress Lifts U.S. Stocks ,"U.S. stocks rebounded Wednesday, extending a recent stretch of volatility as signs of easing trade tensions boosted the outlook for global economic growth."
301,"December 12, 2018 05:19 pm ET",Parker Drilling Files for Bankruptcy With Bondholder Deal in Place,"Parker Drilling Co., which provides drilling rigs and equipment to oil and gas drilling companies, filed for bankruptcy protection Wednesday after striking an agreement with senior bondholders on a deal to raise money and reduce its debt."
302,"December 12, 2018 05:03 pm ET",U.S. Soybean Farmers Work to Loosen China’s Grip,"As trade tensions cut deeply into exports, U.S. soybean farmers, industry groups and government officials are seeking a stronger foothold in international markets beyond China, including Europe and Southeast Asia."
303,"December 12, 2018 04:40 pm ET",P&G Buys Walker to Expand Offerings to African-Americans,Procter & Gamble agreed to acquire Walker & Co. as the consumer-products giant looks to serve more African-Americans with health and beauty products.
304,"December 12, 2018 04:15 pm ET","Brazil’s Central Bank Leaves Rates Unchanged, With Inflation Under Control",Brazil’s central bank left its benchmark interest rate unchanged as inflation remains under control and markets wait to see the extent of fiscal overhauls the incoming government will be able to get through Congress.
305,"December 12, 2018 03:57 pm ET",Treasury Yields Rise on Signs of Easing Trade Tensions ,U.S. government bond prices fell Wednesday as signs of progress on trade talks between Washington and Beijing spurred fresh risk-appetite across markets.
306,"December 12, 2018 03:46 pm ET",Oil Falls as OPEC Doubts Rise,"Oil prices declined on Wednesday, reversing losses after reports that the Iranian oil minister noted discord among OPEC members at its meeting last week."
307,"December 12, 2018 03:00 pm ET",ICE Canada Review: Canola Struggling to Find Strength,
308,"December 12, 2018 02:00 pm ET","U.S. Consumer Prices Flat in November, Posing Dilemma for Fed",Inflation remains muted even though unemployment has fallen to a near 50-year low and economic growth in 2018 was among the fastest in this expansion. 
309,"December 12, 2018 11:43 am ET",ICE Canola Contracts Mixed at Midday,
310,"December 12, 2018 11:33 am ET",Get Ready to Worry About Inflation Again ,"Investors haven’t had to worry too much about inflation lately. In the coming year, that might no longer be the case. "
311,"December 12, 2018 10:43 am ET",U.K. Retail Woes Weigh on Electra; Europe’s Jr. Pros Land Pay Bumps,A daily private-equity news digest from WSJ Pro.
312,"December 12, 2018 10:25 am ET",Bankers Hired for Citgo Auction After Scrapped Deal With Venezuela,"One of Venezuela’s creditors has rescinded a settlement agreement with President Nicolás Maduro’s government and hired bankers to force a sale of the country’s prized U.S. crude refiner, Citgo Petroleum Corp."
313,"December 12, 2018 09:16 am ET",Venezuela’s Creditors Come for Its U.S. Oil Assets—Energy Journal,
314,"December 12, 2018 07:39 am ET",OPEC Oil Production Dips Despite Surge in Saudi Arabia’s Output,"OPEC said its total crude-oil production came down slightly in November but output from Saudi Arabia—the cartel’s largest member—surged to a record high, just as producers are gearing up to cut output next year. "
315,"December 12, 2018 06:39 am ET","Brexit or Not, Britain’s Oil and Gas Business Is Booming","Britain’s once-stagnant oil industry has proved itself resilient to Brexit risk as companies like BP, Total and Shell have announced plans to develop new projects in the U.K."
316,"December 12, 2018 04:16 am ET",The Great Cheapening: Global Stock Valuations Now at Five-Year Lows,"The stumble in global equity markets this year has outrun a moderation in expectations for earnings growth, leaving stock valuations at their lowest in about a half-decade by some measures."
317,"December 12, 2018 04:05 am ET",The Daily Shot: Commercial Construction Prices Climb at the Fastest Rate Since 2009,
318,"December 11, 2018 06:37 pm ET",Garcia’s Take: Oil-Price Volatility Dampens Investor Appetite for Energy Funds ,"Private-equity investors are less inclined to back energy funds in the year ahead, according to a recent survey from placement agent Probitas Partners. However, their hesitation didn’t reverse capital flows into such funds this year. "
319,"December 11, 2018 05:13 pm ET",ICE Canadian Canola Board Margin Index Close - Dec 11,
320,"December 11, 2018 04:53 pm ET",Oil Rebounds on Libyan Supply Outage,"Oil prices ticked up, despite uncertainty over whether an OPEC-led production cut would be enough to mop up a crude supply glut and rebalance the market."
321,"December 11, 2018 03:07 pm ET",ICE Canola Review: Canola Drops Down,
322,"December 11, 2018 11:56 am ET",Oil Market Will Help OPEC Do Its Job ,The recent collapse in crude-oil prices will cost OPEC and Russia a lot of money but will help them bring the market into equilibrium. 
323,"December 11, 2018 11:31 am ET",ICE Canola Contracts Falling,
324,"December 11, 2018 08:35 am ET",Investors Fret Over Oil Supply Cuts—Energy Journal,
325,"December 11, 2018 07:00 am ET","Banks, a Food Wholesaler—Even a Condom Factory: Brazil’s Government Is Big Business    ","President-elect Jair Bolsonaro vows to make cuts to Brazil’s bloated, indebted state—and the fate of an array of government-owned companies hangs in the balance."
326,"December 11, 2018 05:05 am ET",Rupee Tumbles After India’s Central Bank Chief Quits       ,"India’s currency, stocks and bonds swung after the governor of the central bank resigned, casting doubt on the independence of monetary policy in the world’s largest democracy.  "
327,"December 11, 2018 03:50 am ET","The Daily Shot: Factories, Hotels and Restaurants Posting Record Job Openings",
328,"December 11, 2018 02:56 am ET",European Commodities -- Technical Analysis,
329,"December 10, 2018 06:10 pm ET",Macquarie Reaches Deal to Buy Waypoint Helicopter-Leasing Business,"Waypoint Leasing Holdings, a helicopter-leasing business focused on serving offshore oil drillers, reached a deal to sell its assets to a unit of investment bank Macquarie Group for $650 million."
330,"December 10, 2018 05:59 pm ET","Stocks Finish Higher, Erasing Earlier Losses",Advances among technology companies helped the Dow Jones Industrial Average recoup much of an earlier 500-point loss that would have pulled it into correction territory.
331,"December 10, 2018 05:13 pm ET",ICE Canadian Canola Board Margin Index Close - Dec 10,
332,"December 10, 2018 04:36 pm ET",Oil’s Sharp Swings Are a Symptom of a Changing Market,"Computerized trading is playing an ever-greater role in the oil market, helping to amplify the volatility that has accompanied crude’s recent downward lurch. "
333,"December 10, 2018 03:48 pm ET",U.S. Judge Approves Protections for Brazil’s Constellation Group,Brazilian oil-and-gas driller Serviços de Petróleo Constellation won a U.S. court order protecting it from creditors while it works to restructure nearly $1.5 billion in debt. 
334,"December 10, 2018 03:40 pm ET",Oil Slumps Following OPEC Production Cut Deal,Oil prices fell as the market consolidated sharp gains from Friday on the back of an OPEC-led decision to again rein in production.
335,"December 10, 2018 02:49 pm ET",Copper Falls on Lingering Trade Fears,"Copper prices fell to start the week, hurt by anxiety over a weakening Chinese economy and a stronger dollar."
336,"December 10, 2018 12:07 pm ET",Rice Brothers Frustrated With EQT’s Operations,"Two of the brothers who sold Rice Energy to EQT last year say the $4.7 billion oil-and-gas company is mismanaging its assets, and they want to take over running the company. "
337,"December 10, 2018 10:58 am ET",AGS WEEK AHEAD: U.S.-China Trade Headlines Drive Soy Prices; Sugar Traders Track OPEC+,
338,"December 10, 2018 07:35 am ET","OPEC, Russia Agree to Reduce Crude Output—Energy Journal",OPEC and a coalition of producers led by Russia reached a deal late Friday to cut crude output by a collective 1.2 million barrels a day.
339,"December 10, 2018 07:10 am ET",Real Time Economics: U.S. Keeps a Hard Line In China Trade Talks,
340,"December 10, 2018 07:00 am ET",Cheaper Oil Ripples Through the Global Economy ,Analysts are weighing which energy firms are best equipped to cope with lower oil prices should the rout persist.
341,"December 10, 2018 05:20 am ET",November Trade Winds Blow China Off Course ,China managed to shrug off slowing global growth for months. No longer—November trade data was unambiguously bad.   
342,"December 10, 2018 03:46 am ET",The Daily Shot: Wage Growth for Non-Supervisory Workers Highest Since 2009,
343,"December 10, 2018 03:07 am ET",Turkish Economic Growth Stutters as Inflation Hits Confidence ,"The Turkish economy expanded at its slowest pace in two years in the third quarter, weighed down by a bruised currency and double-digit inflation, heightening investor concerns that the once-booming emerging market was headed into recession. "
344,"December 10, 2018 02:31 am ET",European Commodities -- Technical Analysis,
