,date,title,summary
0,"March 10, 2017 04:21 pm ET",Stocks Rise Following Jobs Report,"The S&P 500 rose Friday after the February jobs report showed robust hiring, but the index notched its first weekly decline since January."
1,"March 10, 2017 03:35 pm ET",Nigeria’s President Returns Home,Muhammadu Buhari’s absence for unspecified medical treatment in the U.K. has caused widespread unease as Nigeria battles its first recession in more than a decade and combats insurgencies. 
2,"March 10, 2017 03:32 pm ET",Oil Extends Slide After Sharp Selloff       ,Oil prices continued to slide Friday on fears that coordinated production cuts won’t be enough to eliminate a glut of oil that has weighed on the market.
3,"March 10, 2017 03:17 pm ET",Global Weakest Links Decline for Fourth Straight Month,"The number of companies with very low ratings fell to 238 last month, marking the fourth consecutive month of declines, according to S&P Global Ratings."
4,"March 10, 2017 02:56 pm ET",Shareholders Seek Representation in Paragon Bankruptcy    ,"Paragon Offshore PLC shareholders have asked a bankruptcy judge for a formal seat at the bargaining table, as the oil and gas driller tries again to exit chapter 11.   "
5,"March 10, 2017 01:25 pm ET",U.S. Oil-Rig Count Climbs by Eight ,"The number of rigs drilling for oil in the U.S. rose by eight in the past week to 617, according to oil-field services company Baker Hughes."
6,"March 10, 2017 12:04 pm ET",Bonanza Creek Bankruptcy Plan Hearing Delayed to April,"A bankruptcy judge on Friday postponed a key hearing on Bonanza Creek Energy Inc.’s turnaround plan until the start of April, as the company fends off shareholder challenges to its restructuring strategy."
7,"March 10, 2017 09:32 am ET","As ECB Tweaks Tone, Markets Should Listen ","The ECB takes a baby step, but not a giant leap. Still, the tide is starting to turn on monetary policy. "
8,"March 10, 2017 08:59 am ET",The Morning Download: Google Has New Entry for Chat Market,"Alphabet Inc.'s Google is splitting its Hangout app in two, with one app focusing on video and another on chat, a market that upstart Slack Technologies Inc. has taken to business users with success."
9,"March 10, 2017 08:25 am ET","Capital Journal Daybreak: GOP Health Plan Advances, More",
10,"March 10, 2017 08:13 am ET",The Market Has Made Up Its Mind on the Fed,The market has made up its mind about what the Federal Reserve will do next week. Friday's jobs report most likely isn't going to change that.
11,"March 10, 2017 07:17 am ET","The 10-Point: Gerard Baker on GOP Infighting, Oil’s Slide, a Change at the Top at AIG and More","A personal, guided tour to the best scoops and stories every day in The Wall Street Journal, from Editor in Chief Gerard Baker."
12,"March 10, 2017 07:09 am ET",Oil Glut Worries Market—Energy Journal,Investors Worry that Oil's Volatility Could Spill Over Into Stocks and Bonds
13,"March 10, 2017 06:40 am ET",Today’s Top Supply Chain and Logistics News From WSJ,"Delivering up-to-the minute news, analysis, interviews and explanatory journalism on logistics, supply-chain management, e-commerce and more"
14,"March 10, 2017 05:32 am ET",WSJ Wealth Adviser Briefing: Merrill May Still Offer Commission IRAs,"WSJ Wealth Adviser highlights some of the top news and analysis for wealth advisers and their clients, with pieces today on how Merrill Lynch may not do away with commission-based retirement accounts after all and the great dilemma facing investors."
15,"March 10, 2017 03:55 am ET",Oil’s Slide Should Grease Stock Picking,Japan is a massive oil importer. Don’t assume that means cheaper oil will give growth or equities a big boost.
16,"March 10, 2017 03:25 am ET","WSJ City: Pay Cut for UBS Chief, BT and Openreach to Separate, What to Watch on US Jobs",
17,"March 10, 2017 01:40 am ET",WSJ’s Daily Shot: What Happens If Unemployment Decline Overshoots?,
18,"March 10, 2017 12:28 am ET","Oil Glut Worries Resurface, Triggering Market Tumble","Global markets are once again fixating on the price of oil after U.S. crude fell below $50 a barrel for the first time this year, in the biggest two-day selloff since June."
19,"March 10, 2017 12:01 am ET",What’s News: Business & Finance,What’s News: Business & Finance
20,"March 9, 2017 11:36 pm ET",What’s News: Business & Finance,What’s News: Business & Finance
21,"March 9, 2017 10:54 pm ET",Justin Trudeau Emphasizes Canada’s Role as Energy Supplier to U.S. ,The Canadian prime minister used an energy-industry conference as a platform to argue against President Donald Trump’s pledge to create trade barriers. 
22,"March 9, 2017 08:39 pm ET",Stocks Flat on 8th Anniversary of Crisis Low,The S&P 500 was basically flat Thursday. But it’s up 250% from its lowest close during the financial crisis eight years ago. 
23,"March 9, 2017 08:15 pm ET",Oil Stabilizes After Falling Below Key Support Level ,"Oil prices stabilized in Asian trade on Friday, after falling below a key support level overnight as rising U.S. crude oil inventories kept prices under pressure. "
24,"March 9, 2017 06:38 pm ET","Pine Brook, Riverstone Invest $600 Million in New Oil Company","Admiral Permian Resources will focus on the on the acquisition and development of oil fields in the Permian Basin. Companies backed by private-equity firms in recent months sold billions of dollars in Permian assets to public energy companies. Now, those same private-equity firms are announcing a series of new investments in the energy industry. "
25,"March 9, 2017 05:53 pm ET","Natural Gas Gains on Stronger Demand, Weaker Supply","Natural gas prices settled higher, helped by cooling weather, stable production and a larger-than-expected draw from storage last week.  "
26,"March 9, 2017 05:40 pm ET",Repsol Discovers Major Oil Field in Alaska’s North Slope ,"Repsol SA said on Thursday that it had discovered a giant oil field in Alaska, a potential find big enough to help stem production declines in the state."
27,"March 9, 2017 05:02 pm ET",Euro Rises Against Dollar,"The euro edged higher against the dollar Thursday, buoyed by hawkish comments from European Central Bank President Mario Draghi."
28,"March 9, 2017 03:47 pm ET",Lawsuit Says Dune Energy Executives Underestimated Oil Spill Costs       ,"Executives who ran Houston oil driller Dune Energy Inc. are being accused in a lawsuit of underestimating the cost of a “mystery oil spill” discovered after Hurricane Katrina, an error that led to the company’s 2015 collapse into bankruptcy.  "
29,"March 9, 2017 03:23 pm ET",Shell to Sell Canada Oil-Sands Businesses for $7.25 Billion ,"Shell is selling nearly all of its Canadian oil-sands developments in deals worth $7.25 billion, largely abandoning a region that symbolizes the risks in high-cost, carbon-intensive sources of oil."
30,"March 9, 2017 03:10 pm ET",Scottish Independence Is Still a Bad Idea After Brexit,Voters shouldn’t assume they’d be able to stay in the European Union—or afford their own state.
31,"March 9, 2017 02:51 pm ET",We Thought We Would Hit Your Sweet Spot,George Shultz and James Baker take issue with the Journal’s Feb. 25 editorial “The Carbon Tax Chimera.”
32,"March 9, 2017 12:59 pm ET","WSJ City’s Briefing: ECB Shows No ‘Urgency’ to Change, Think Tank Expects Longer UK Austerity",
33,"March 9, 2017 12:52 pm ET","The New Exxon: Fewer Risks, Lower Returns ",Exxon’s Gulf Coast investment says more about the changed company than it does about new U.S. spending. 
34,"March 9, 2017 12:20 pm ET",Bonanza Creek Shareholders Unveil Rival Restructuring Strategy,"Shareholders seek the ability to put their plan, including a $350 million rights offering, before creditors. "
35,"March 9, 2017 12:19 pm ET",Trumpcare Won’t Make Health Insurers Sick,Heard on the Street podcast: Where the real risk lies in the new health plan and why sand is the hottest commodity
36,"March 9, 2017 11:54 am ET",Shell’s Oil-Sands Exit Puts It on Solid Ground,Shell’s $7.25 billion sale of oil-sands assets helps it shed debt and reduce exposure to one of the costliest forms of oil production
37,"March 9, 2017 11:00 am ET",OPEC Faces Quandary as U.S. Oil Inventories Swell ,Brimming U.S. crude inventories that sent oil prices tumbling this week are expected to put pressure on OPEC and other producers. 
38,"March 9, 2017 10:39 am ET",Chevron Says Climate Actions Pose Minimal Risk to Operations,"Chevron said in a new report that a global transition to lower-carbon energy sources poses a minimal risk to its operations, a response that follows growing shareholder demand for more disclosure on climate risks. "
39,"March 9, 2017 10:08 am ET",Oil Is a Market Driver Once Again,"The oil market is reminding investors just how much market stability depends on stable crude prices. On Thursday, U.S. crude dropped 2.5% on the New York Mercantile Exchange, sending the benchmark below $50 for the first time in 2017."
40,"March 9, 2017 09:24 am ET",This Bull Is 127 Years Old (In Human Years),"Stock investors who stuck to their guns benefited from the central bank's easy-money policies that nearly wiped out the income available through relatively safe government bonds or savings accounts. Instead, ultra-low rates pushed investors to take risk and seek returns in the stock market."
41,"March 9, 2017 08:36 am ET",The Morning Download: Tech Firms Race to Assess Damage of CIA Leak,"Tech firms are scrambling to understand just what the WikiLeaks publication of CIA hacking-tool documents means for the security of their ecosystems, with the understanding that more documents could come to light, compounding the risks."
42,"March 9, 2017 07:22 am ET","The Morning Ledger: Don’t Loosen Sarbanes-Oxley Act, Former HealthSouth CFOs Say",Two former finance chiefs warn against loosening the Sarbanes-Oxley Act. Shell is selling its oil sands interests in Canada in a deal worth $7.25 billion and Samsung's heir apparent on the first day of his trial denies all charges.
43,"March 9, 2017 07:04 am ET",Oil Sinks To New Low—Energy Journal,Oil Prices Hit a Three-month Low After Data Showed a Record Buildup in U.S. crude Inventories
44,"March 9, 2017 06:39 am ET","The 10-Point: Gerard Baker on Health-Bill opposition, Tough Times for Savers, Low-Key Business Class and More","A personal, guided tour to the best scoops and stories every day in The Wall Street Journal, from Editor in Chief Gerard Baker."
45,"March 9, 2017 06:39 am ET",Today’s Top Supply Chain and Logistics News From WSJ,"Delivering up-to-the minute news, analysis, interviews and explanatory journalism on logistics, supply-chain management, e-commerce and more"
46,"March 9, 2017 06:12 am ET",What to Watch at Thursday’s ECB Meeting,"The European Central Bank only recently expanded its quantitative easing program by a half-trillion euros, and economists say it’s probably too soon to change course."
47,"March 9, 2017 05:25 am ET",China Inflation Heads Off in Two Directions,"China’s consumer-price index in February was up just 0.8% from a year earlier, slowing from January’s 2.5% pace, while the producer-price index was up 7.8%, its biggest jump since September 2008. "
48,"March 9, 2017 04:29 am ET",Commodity Rally Stumbles Back Into Reality,"Last year’s rally had strong fundamental underpinning, but investors have been ignoring growing warning signs from Chinese demand and U.S. supply."
49,"March 9, 2017 03:28 am ET","WSJ City: Old Mutual Slashes London Headcount, Shell Sells Assets, Rio Tinto Chairman Heads to BT",
50,"March 9, 2017 12:01 am ET",What’s News: Business & Finance,What’s News: Business & Finance
51,"March 8, 2017 11:57 pm ET",China’s Consumer Inflation Hits a Low Point,"Prices in China rose less than expected in February as demand for food eased after the Lunar New Year holiday, the third piece of Chinese data that raised eyebrows this week."
52,"March 8, 2017 11:41 pm ET",WSJ’s Daily Shot: The Oil Markets’ Perfect Storm,
53,"March 8, 2017 09:45 pm ET",Oil Prices Edge up in Asia After Tumbling Overnight,Oil prices edged up in Asia Thursday after slipping overnight on weekly data which showed a higher than expected build up in U.S. inventories.
54,"March 8, 2017 08:06 pm ET",Stocks Slip as Oil’s Decline Weighs on Energy Shares,"U.S. stocks slipped as a decline in oil prices hit energy companies. Still, overall stock moves were muted, as they have been in recent days after major indexes climbed to records last week. "
55,"March 8, 2017 06:35 pm ET",Oil Posts Biggest One-Day Decline in 13 Months,Oil prices had their worst day in more than a year after federal data showed that the U.S. crude surplus hit a fresh record last week.
56,"March 8, 2017 05:12 pm ET",Dollar Rallies After Strong Hiring Data    ,The dollar closed at its highest level in nearly two months Wednesday after a strong hiring report added to optimism about the U.S. economy.
57,"March 8, 2017 03:15 pm ET",Oil Companies Take to Thrifty Bets ,"Oil prices have made a modest comeback from the lows hit a little over a year ago, but big oil companies such as Exxon Mobil and BP aren’t yet pursuing the extravagant bets they made at $100 a barrel."
58,"March 8, 2017 03:09 pm ET",Bonanza Creek and Creditors Fight Call for New Leadership    ,Bonanza Creek Energy and some of its creditors are fighting back against a request for new leadership at the company during the bankruptcy process.  
59,"March 8, 2017 01:02 pm ET",Oil Companies Target Excess Debt ,"U.S. energy producers are moving aggressively to pay down debt, heeding a newly cautious stance on Wall Street toward leverage. "
60,"March 8, 2017 09:23 am ET",Is Trump Trade Still Driving Stocks?,"The Trump trade may be on the top of investors' minds, but that doesn't mean it's driving stock prices. Instead, idiosyncratic risks having to do with individual companies, rather than sweeping policies out of Washington, explained more than 63% of market uncertainty on a given day in February."
61,"March 8, 2017 08:37 am ET",Japan’s Economy Grows at Faster Pace in 4th Quarter,"Japan’s economy grew at a faster pace than initially estimated in the October-December quarter, with firms ramping up investment amid an initial surge of market optimism over the possible policies of a Donald Trump-led U.S. administration."
62,"March 8, 2017 08:02 am ET",Atlanta Fed Considering Bostic | Fed’s Rate Moves Could Cause More Flattening of Yield Curve | Why Central Banks Are Stockpiling  Reserves | BOE’s Hogg Failed to Reveal Conflict of Interest | Fairless’s Take: ECB Could Ease Up on the Easing,"The Wall Street Journal’s central banking newsletter for Wednesday, March 8, 2017"
63,"March 8, 2017 07:13 am ET",Saudi Minister: OPEC Will Remain Stabilizing Force—Energy Journal,Saudi Energy Minister: OPEC Will Remain A Stabilizing Force in the Oil Market
64,"March 8, 2017 07:00 am ET",Giant Bribery Case Widens Across Latin America,"Investigations into embattled Brazilian construction giant Odebrecht are exposing a larger network of graft in Latin America than what was already revealed in a massive anticorruption settlement, prosecutors in several countries say. "
65,"March 8, 2017 06:44 am ET",Today’s Top Supply Chain and Logistics News From WSJ,"Delivering up-to-the minute news, analysis, interviews and explanatory journalism on logistics, supply-chain management, e-commerce and more"
66,"March 8, 2017 06:00 am ET",China’s Three-Year Run of Trade Surpluses Hits Surprising Wall,"China recorded a surprise $9.15 billion trade deficit in February, its first since 2014, following a surge in imports after the Lunar New Year holiday and an unexpected drop in exports. "
67,"March 7, 2017 11:20 pm ET",WSJ’s Daily Shot: The Wait for Stimulus Legislation to Test Stock Market’s Patience,
68,"March 7, 2017 08:51 pm ET",Central Banks Ratchet Up Foreign-Currency Reserves,"Central banks around the world are loading up on foreign-currency reserves, highlighting the fragile underpinnings of the global economic recovery despite a bullish mood in financial markets. "
69,"March 7, 2017 08:49 pm ET",Energy Ministers Stress Commitment to Curb Production,"Energy ministers from several major oil-pumping countries, including Russia, Iraq and Saudi Arabia, defended their commitment to curb production and boost prices, despite signs that a lack of compliance by some nations is causing friction. "
70,"March 7, 2017 08:23 pm ET","Meet the Trader Amassing 3,000 Swimming Pools of Sugar","Wilmar International, partly owned by Archer Daniels Midland, is buying unprecedented amounts of sugar on the futures exchange, creating confusion in the volatile commodity market."
71,"March 7, 2017 08:17 pm ET",Oil Prices Fall as Higher U.S. Inventories Loom Amid Tepid China Demand,Crude oil prices declined Wednesday as investors braced for a further rise in U.S. oil inventories as well as a tapering of China’s demand.
72,"March 7, 2017 06:11 pm ET",OPEC and Shale Learning to Coexist ,"U.S. shale producers won’t quit pumping oil, and OPEC is learning to deal with that. That’s the message emerging from this year’s CERAWeek energy conference, where the mood is markedly different from a year ago."
73,"March 7, 2017 05:17 pm ET","OPEC, Shale Producers Bond Over Dinner ","On the night before the oil industry’s most important annual conference, CERAWeek, American oil executives sat down Sunday for a more intimate gathering with Mohammad Barkindo, the secretary-general of OPEC. "
74,"March 7, 2017 04:17 pm ET",Oil Retreats Ahead of Inventory Data,Oil prices edged lower Tuesday as investors awaited inventory data expected to show an increase in crude-oil stockpiles.
75,"March 7, 2017 03:15 pm ET","Shale Helped Offset Global Declines in Oil Production, OPEC Leader Says","Without the U.S. shale revolution, the global economy probably would have been mired in deep crisis, said Mohammad Barkindo, secretary-general of OPEC."
76,"March 7, 2017 03:12 pm ET",U.S. Posts Biggest Monthly Trade Deficit in Nearly Five Years,"The U.S. posted its biggest monthly trade deficit in nearly five years in January, a potential short-term drag on growth that highlights broader economic forces working against the Trump administration’s plans to reshape the country’s international economic agenda."
77,"March 7, 2017 01:53 pm ET",Quick Hits: Bets on Higher U.S. Rates Rise; BOJ Not Seen Tightening Despite Inflation,"Hedge funds and money managers have piled into bets that short-term U.S. interest rates will rise, reserves data point to People’s Bank of China foreign-exchange purchases in February, and a return of inflation is seen as unlikely to lead to imminent monetary-policy tightening by the Bank of Japan."
78,"March 7, 2017 01:52 pm ET",Colombia’s Oil Sector Faces ‘Post-Conflict’ Security Problems    ,"Colombia’s oil industry continues to face bombings and other security challenges even after last year’s peace deal that ended a long-running guerrilla conflict, a top Colombian oil official said Tuesday.  "
79,"March 7, 2017 12:29 pm ET",Saudi Energy Minister Says OPEC Will Remain Stabilizing Force for Oil Prices,"Saudi Arabia’s energy minister said that OPEC will continue to be the world’s “only catalyst” for stabilizing oil prices, but he warned that the group won’t take steps to bail out the market."
80,"March 7, 2017 10:52 am ET",Exxon’s $20 Billion Spending Plan Points to U.S. Energy Surge ,"Exxon Mobil plans to spend about $20 billion on refineries, petrochemical plants and other projects in and around the Gulf of Mexico, underscoring how the giants of the global energy industry are turning to America. "
81,"March 7, 2017 10:18 am ET",Brazil’s Economy Shrinks for Second Straight Year,"Brazil’s worst recession on record extended for a second- consecutive year, dealing a blow to living standards and raising doubts about the pace of recovery for the once-dynamic emerging economy."
82,"March 7, 2017 09:42 am ET",Canada Records Third-Straight Monthly Trade Surplus,"Canada posted its third-straight monthly trade surplus in January, marking the best performance on the trade front since mid-2014 when commodity prices went into a tailspin."
83,"March 7, 2017 09:12 am ET",A New Worry: Everybody is Now Long Stocks,The postelection rally’s relentless march higher has left investors in a precarious position.
84,"March 7, 2017 08:06 am ET",Fedspeak Cheat Sheet | Fed May Press Charges Against ‘London Whale’ | Divisions Within ECB Reemerge | China Reserves Vault Back Above $3 Trillion | Buell’s Take: Will We Soon Meet Jean-Claude Draghi?,"The Wall Street Journal’s central banking newsletter for Tuesday, March 7, 2017"
85,"March 7, 2017 07:10 am ET","The Morning Ledger: Amid Rule Changes, Companies Struggle to Find Accountants","Companies grapple with an accountant shortage as regulations change, UPS has won a European court challenge and Ford said tariff-free trade was ""really important"" following Brexit."
86,"March 7, 2017 07:04 am ET",Today’s Top Supply Chain and Logistics News From WSJ,"Delivering up-to-the minute news, analysis, interviews and explanatory journalism on logistics, supply-chain management, e-commerce and more"
87,"March 7, 2017 06:37 am ET",OPEC Meets With Oil Traders—Energy Journal,OPEC Is Meeting With Oil Traders and Investors
88,"March 7, 2017 05:00 am ET","OECD Warns of ‘Disconnect’ Between Markets, Growth Outlook","Recent rises have pushed prices of U.S. stocks and other assets out of line with expected rates of economic growth, threatening a modest recovery the Organization for Economic Growth and Development said."
89,"March 7, 2017 03:24 am ET","WSJ City: U.K. Retail Sales Fall, London Whale Speaks Out, Rethinking Inflation",
90,"March 6, 2017 11:28 pm ET","WSJ’s Daily Shot: Imagining a Fed Led By John Taylor, Not Janet Yellen",* Trump trades fading.
91,"March 6, 2017 08:21 pm ET",Oil Prices Extend Falls ,Oil prices extended their declines on Tuesday over concerns about rising U.S. oil supplies and pessimism over China’s economic growth outlook for this year. 
92,"March 6, 2017 07:27 pm ET",Stocks Retreat as Financials Slump,"Stocks fell, with financial shares helping to lead a retreat from last week’s highs."
93,"March 6, 2017 07:16 pm ET",Argentina to Allow First Budget Airline to Begin Flying in Country ,"Argentina’s government plans to allow the first budget airline to begin flying in the country, opening up one of the biggest untapped domestic airline markets to increased competition. "
94,"March 6, 2017 07:11 pm ET",Everything the Market Thinks About Inflation Might Be Wrong,No number is more important for investors right now than inflation. The belief that it will continue to rise underpins the recent rally in financial stocks and the slump in government bonds. Yet investors are in a quandary: Theories used to forecast it just don’t seem to work.
95,"March 6, 2017 07:11 pm ET",Weatherford Names Mark McCollum as New CEO ,"Weatherford International named Mark McCollum, a former executive with rival Halliburton Co., as its new chairman and chief executive. "
96,"March 6, 2017 04:50 pm ET",Russia Committed to Oil Production Cut ,Russia’s energy minister said Monday the nation is gradually reducing its oil production in line with an agreement reached with OPEC late last year and should be fully compliant by the end of April. 
97,"March 6, 2017 04:06 pm ET",Oil Prices Decline ,"Oil prices edged lower Monday, as investors continued to weigh OPEC’s production cuts against rising production in the U.S."
98,"March 6, 2017 03:01 pm ET",Norway’s Statoil to Increase Bet on Renewables ,"Norway’s Statoil aims to increase its investment in renewables to between 15% and 20% of total spending by 2030, up from 5% today. "
99,"March 6, 2017 02:32 pm ET",Ultra Says Bondholders Not Entitled to Penalty Payment       ,Ultra Petroleum Corp. says a creditor group holding unsecured bond debt isn’t entitled to a $201 million penalty from the oil and gas driller’s bankruptcy filing.  
100,"March 6, 2017 02:28 pm ET",IEA Sees No Peak Oil Demand ‘Any Time Soon’ ,"Global oil consumption will keep growing for the foreseeable future despite tougher legislation to control vehicle emissions, the International Energy Agency said."
101,"March 6, 2017 01:34 pm ET",Massive ETF Flows Tend to Bode Ill in the Short Run,"Short-term fund flows can be noisy, but an $8.2 billion influx into the market's oldest and biggest ETF on Wednesday has few precedents. Market returns in the months following comparable events have tended to be lackluster."
102,"March 6, 2017 12:57 pm ET","WSJ City’s Briefing: A Fund Manager Marriage for Troubled Times, the Cost of Deutsche’s Missteps",
103,"March 6, 2017 12:22 pm ET",Commodities Are Coming Back as a Diversity Play,The ties between commodities and other assets are coming loose and reinvigorating the long-beleaguered commodity market this year.
104,"March 6, 2017 12:13 pm ET",The Cheap Resource That Worries Oil Shale Drillers ,The rising cost of fracking sand shows how drillers of oil and gas are facing rising costs and capacity constraints. 
105,"March 6, 2017 11:04 am ET",OPEC Woos Old Nemesis—Wall Street ,"OPEC is on an unusual listening tour, in which it exchanges views with hedge funds, investment banks and other big financial players while trying to figure out how the market reacts to its moves."
106,"March 6, 2017 09:26 am ET",Energy Is Less of a Drain,The tumult in energy prices that weighed heavily on financial markets is finally drifting into the past. One place that's most notable is earnings.
