,date,title,summary
111,"April 26, 2019 12:47 pm ET",Big Oil Wields a Blunt Texas Drill ,"Exxon Mobil and Chevron are increasing their spending in the heart of America’s oil patch, in a split from smaller peers. Their size means they will have an easier time masking weakening returns."
112,"April 26, 2019 12:46 pm ET",Crude Prices Drop 3.6% After Trump Remarks On OPEC,"Crude oil declined, after President Trump said he called on the global oil group to lower fuel prices."
113,"April 26, 2019 08:42 am ET",PE Daily: Hastings Reaps Eightfold Return on Cactus | Penn SERS Pledges $1 Billion | TPG Targets McGlashan Pay    ,"Good Day! The popular Permian Basin has been a consistent bright spot in an otherwise fluctuating oil-and-gas investment landscape, a trend that Hastings Equity Partners was able to play to its advantage, as Luis Garcia reports. The Houston-based firm has returned more than eight-times its investment in Cactus Fuels Inc.  "
114,"April 26, 2019 08:26 am ET",Pro Bankruptcy Briefing: Pier 1 Taps Restructuring Help | FDIC Preps Stand-By Teams | New England Motor Freight To Sell Fleet    ,"Good Day. Pier 1 Imports is prepping for a possible bankruptcy within weeks or months as a ratings firm cut the retailer’s credit deeper into junk territory. Although no U.S. bank has failed since 2017, the Federal Deposit Insurance Corp. has interviewed dozens of bankers to serve at banks that may be seized in the future. And New England Motor Freightsecured a $15 million offer for its fleet of semi-tractors and other equipment ahead of a planned bankruptcy auction.  "
115,"April 26, 2019 08:18 am ET",Fed Shift Affects Speculative Debt; Turkey Holds Steady; Bank of Japan Takes a Hawkish Turn    ,"Good Day. Another consequence of the Federal Reserve’s pause from raising interest rates is how yields on both speculative-grade corporate bonds and similarly rated loans are down despite a rally in riskier assets. These assets are less attractive now that the Fed isn’t raising rates. Meanwhile, Turkey’s central bank held its policy rate of 24% as it battles runaway inflation and tries to support a battered currency. And Switzerland’s top central banker offered a defense of negative rates.  "
116,"April 26, 2019 04:13 am ET",The Daily Shot: Household Formation Remains Near Multi-Year Highs,
117,"April 25, 2019 05:50 pm ET",Occidental Digs Deep in Anadarko Counterbid,Occidental Petroleum’s $76-a-share bid for rival oil driller is superior to Chevron’s offer earlier this month in both price and construction. If only Anadarko hadn’t agreed to a breakup fee. 
118,"April 25, 2019 03:21 pm ET",Oil Prices Fall on U.S. Inventories,Oil prices fell for a second day as more aggressive sanctions on Iran were offset by data showing a surge in U.S. crude inventories.
119,"April 25, 2019 08:39 am ET",Pro Bankruptcy Briefing: PG&E Wins OK for Bonuses | George Lucas Wants Ebony Archives | Venezuela Opposition Mulls $71 Million Payment to Bondholders    ,"Good Day. A bankruptcy judge in San Francisco signed off on PG&E Corp.’s request to pay up to $350 million in bonuses this year, overruling objections from victims of wildfires linked to California’s largest utility. “Star Wars” filmmaker George Lucas and his wife want to take control of Ebony and Jet magazines’ archives, a collection of thousands of pictures and recordings chronicling about 70 years of African-American life and culture. And Venezuela’s U.S.-backed opposition government is taking steps to seek the Trump administration’s help in making a scheduled bond payment that would protect the country’s prized oil refiner Citgo Petroleum Corp. from creditors.  "
120,"April 25, 2019 08:30 am ET",Hastings Earns Eight Times Its Investment With Sale of Cactus Fuel ,"The firm’s sale of the fuel supplier to Pilot Thomas Logistics LLC generated an 8.4 multiple on invested capital and a 120% internal rate of return for the Houston energy services-focused firm, a person familiar with the matter said. Hastings disclosed the deal in early April without stating the price. "
121,"April 25, 2019 08:30 am ET",Moore Hopeful of Fed Post; Canada Pauses on Rates; Japan Stresses Commitment to Easy Policy    ,"Good day. In an interview, conservative commentator Stephen Moore said he doesn’t want to hurt the White House or Senate Republicans but was “really excited” at the prospect of joining the Federal Reserve. Outside the U.S., a chorus of central banks voiced caution on policy. Among them were the Bank of Canada, which kept rates on hold and pressed pause on further increases, and the Bank of Japan, which pledged to keep rates extremely low at least into next spring. And South Korea’s economy had an unexpectedly bad first quarter.  "
122,"April 25, 2019 07:33 am ET",Real Time Economics: Getting Ready for First-Quarter GDP,
123,"April 25, 2019 04:21 am ET",The Daily Shot: A Stronger Dollar Could Hinder the Market Rally,
124,"April 25, 2019 03:52 am ET",Bank Indonesia Keeps Benchmark Repo Rate Unchanged at 6.0%,"Bank Indonesia on Thursday left interest rate unchanged for the fifth time in a row, as it continues to focus on reining in the country’s current-account deficit. "
125,"April 24, 2019 04:15 pm ET",U.S. Oil Falls as Inventories Hit 18-Month High,U.S. oil prices dropped as domestic crude-oil inventories rose to an 18-month high and the International Energy Agency issued assurances that global oil markets are “adequately supplied.”
126,"April 24, 2019 09:23 am ET","Anglo-Eastern Plantations 2018 Pretax Profit, Revenue Fell",
127,"April 24, 2019 09:12 am ET",Will China and Iran Ignite Oil Prices? ,Chinese growth is heating up. Iranian oil exports are about to get squashed. Surely this is a recipe for a monster oil-price spike? Probably not. 
128,"April 24, 2019 07:00 am ET",Garcia’s Take: Private Equity Goes Back to Basics in Oil and Gas ,A changed energy market is sending private-equity firms back to the basics of drilling wells for oil and gas.
129,"April 24, 2019 03:24 am ET",The Daily Shot: Share of Middle-Income Households in the U.S. Lags Other Advanced Economies,
130,"April 24, 2019 02:56 am ET","Ascent Resources Raises GBP750,000 to Fund Petisovci, New Opportunities",
131,"April 23, 2019 08:18 pm ET",S&P 500 and Nasdaq Hit Closing Records,"The S&P 500 and Nasdaq Composite had their highest closings on record Tuesday, marking a resurgence for the stock market after a rout last year hampered its climb."
132,"April 23, 2019 07:36 pm ET",Trading Lull Paved Way for Stock Record,One factor that helped set up U.S. share benchmarks’ record close Tuesday: an unusual period of calm that had blanketed both the stock and commodities markets.
133,"April 23, 2019 06:51 pm ET",Anadarko Boosted CEO’s Payout Just Before $33 Billion Chevron Merger ,"Anadarko Petroleum, a day before announcing its sale for $33 billion, sweetened the payout its top executives can reap in the event of a deal by millions of dollars, according to a compensation firm’s analysis."
134,"April 23, 2019 04:50 pm ET",Oil Climbs After Monday Surge,West Texas oil-futures prices edged above $66 a barrel as the recent rally in crude prices continued.
135,"April 23, 2019 04:26 pm ET",U.S. Government Bonds Rise as Higher Yields Attract Buyers,Government-bond prices increased as investors bought the securities at yields near their highest levels in about a month.
136,"April 23, 2019 10:02 am ET",Bank of Canada Expected to Leave Key Rate on Hold ,The Bank of Canada is widely expected to leave its main interest rate on hold this week and through the remainder of this year in the face of ongoing trade tensions and a weaker outlook for domestic growth. 
137,"April 23, 2019 08:18 am ET",Cain Withdraws From Fed Consideration; Falling Survey-Response Rates Present Data Challenges; Evans Transcript    ,"Good day. Herman Cain withdrew from consideration for a central bank role, days after saying he was committed to staying in contention for the job. President Trump’s pick to fill a Federal Reserve governor’s seat faced Senate opposition, but the former pizza-chain executive said his main reason for withdrawing was the pay. Meanwhile, a growing reluctance among Americans to answer government surveys is making it harder to measure unemployment, inflation or other trends that can drive policy.  "
138,"April 23, 2019 07:28 am ET",Real Time Economics: The Resilient American Economy,
139,"April 23, 2019 07:00 am ET",Syrian Fuel Shortage Squeezes Assad’s Loyalists,"Syria is experiencing a worsening fuel shortage as a result of Western sanctions, bringing some major cities to a near standstill and causing some of the war’s worst economic circumstances for President Bashar al-Assad’s loyalists."
140,"April 23, 2019 06:46 am ET","Real Time Economics: Housing Sputters, Social Security to Tap Trust Fund, Oil Prices Surge",
141,"April 23, 2019 06:02 am ET","WSJ Wealth Adviser Briefing: Merrill Team Focus, FANG Stocks Rebound, Retirement Mistakes","Merrill Lynch focuses on teams of advisers rather than those working solo; big money managers are buying FANG stocks again, and the biggest financial mistakes retirees make."
142,"April 23, 2019 03:12 am ET",The Daily Shot: The Housing Market Weakness Persists,
143,"April 23, 2019 12:01 am ET",What’s News: Business & Finance,What’s News: Business & Finance
144,"April 22, 2019 07:31 pm ET",Oil Prices Surge as Trump Ends Waivers for Iran’s Crude,"Oil prices surged to a nearly six-month high after the Trump administration said it would end waivers that allow countries to import Iranian oil, part of a U.S. campaign to deprive Iran of a major source of revenue. "
145,"April 22, 2019 06:41 pm ET",A Goal for Iran’s Oil Exports: Zero,American frackers can reduce the impact of higher crude prices.
146,"April 22, 2019 05:20 pm ET",Currencies of Oil-Producing Countries Rise Against Dollar,"The currencies of oil-producing countries rose against the dollar Monday, boosted by higher crude prices. "
147,"April 22, 2019 04:51 pm ET",Stocks Waver as Busy Earnings Week Kicks Off ,"The S&P 500 eked out a small gain, extending a listless streak of trading at the start of a busy week for corporate earnings. "
148,"April 22, 2019 04:43 pm ET",International Guesswork Follows Ukraine Election,"The election of comedian Volodymyr Zelensky as Ukrainian president, upending the country’s political establishment, has jolted Russia and the West—who have competed for influence in Ukraine and now must determine how to deal with a political newcomer."
149,"April 22, 2019 03:47 pm ET",Treasury Yields Rise With Oil Prices ,U.S. government-bond yields ticked higher along with oil prices after the U.S. said it was ending waivers for countries to import Iranian oil. 
150,"April 22, 2019 03:34 pm ET",Oil Prices Soar as U.S. Moves to End Iran Waivers    ,"Oil prices hit a near six-month high as the U.S. government moved to halt all Iranian oil exports, eliminating a key revenue source for the Islamic Republic. "
151,"April 22, 2019 02:02 pm ET",Tightened U.S. Ban on Iran Rattles Oil World,"The Trump administration’s tightened ban on Iranian oil shook leading oil-producing nations as well as the biggest buyers of crude, many of whom had been expecting a renewal of U.S. exemptions to the ban."
152,"April 22, 2019 01:41 pm ET",Trump Is Placing Too Much Faith in the Shale Patch ,President Trump’s decision to end all waivers on sanctions of Iranian oil means other large producers have to fill the gap. It adds fresh urgency to U.S. energy independence. 
153,"April 22, 2019 04:54 am ET",Gabon's Palm Oil Harvest Soared in 2018,
154,"April 22, 2019 04:42 am ET",U.S. to End Iran’s Oil Waivers in Drive to Push Tehran’s Exports to Zero,"The State Department is expected to announce Monday the end of waivers for countries to import Iranian oil, part of the Trump administration’s effort to drive Iran’s exports to zero, people familiar with the decision said."
155,"April 22, 2019 03:56 am ET",The Daily Shot: Midwest Construction Activity Hammered by Flooding,
156,"April 21, 2019 01:12 pm ET",Libya Says Trump’s Talk With Militia Leader Could Drive Up Oil ,"President Trump’s outreach to a rogue Libyan general could push oil prices higher, the head of the country’s United Nations-backed government said. "
157,"April 21, 2019 10:00 am ET",Airline Stocks at Crossroads Ahead of Earnings ,"Airline shares are set to face their next major test in the coming days. Southwest Airlines Co., Alaska Air Group Inc. and American Airlines Group Inc. are all scheduled to report quarterly results. "
158,"April 20, 2019 12:02 pm ET",Egyptians Cast Ballots on Whether to Keep President Sisi in Power ,"Egyptians began casting ballots Saturday on constitutional amendments that would keep President Abdel Fattah Al-Sisi in power until 2030, a critical test of popularity for a leader who has crushed political dissent and sought to steer the nation out of economic peril."
159,"April 20, 2019 11:59 am ET","This Week on the Frontiers, April 20th 2019",A weekly roundup of key news affecting frontier markets from the Wall Street Journal and beyond.
160,"April 19, 2019 12:22 pm ET",Ben Dell: A Rare Private-Equity Activist in the Oil-and-Gas Industry,Benjamin Dell is trying hard to transform the U.S. shale oil-and-gas industry and to profit in the process. 
161,"April 19, 2019 07:24 am ET",Japan’s JXTG Looks to Sell Project as Rising Copper Prices Drive Deal Making ,"JXTG is exploring the sale of its majority-owned Caserones copper project in Chile in a deal that could fetch about $1 billion, in the latest sign that rising prices for the industrial metal are driving deal making in the mining sector. "
162,"April 19, 2019 06:02 am ET","WSJ Wealth Adviser Briefing: Not-So Good Friday, Bad Loans, Expensive Renovation","Good Friday sometimes brings bad company news; Cerberus raises $5.1 billion to buy bad loans, and a $40 million renovation of a 240-year-old building."
163,"April 18, 2019 03:32 pm ET",Oil Prices Rise on Lower U.S. Stockpiles,Oil prices were moderately higher on expectations U.S. crude oil inventories could decline further as the summer-driving season approaches and refineries start boosting both their intake and output.
164,"April 18, 2019 08:00 am ET",OPEC vs. Shale: the Battle for Oil Price Supremacy,Oil prices are in a tug of war between the huge increase in production in the U.S. shale patch and attempts by OPEC to slash its own output.  
165,"April 18, 2019 06:02 am ET","WSJ Wealth Adviser Briefing: Skittish Investors, Risky Oil Bet, Zurich Vacations","Nervous investors are hedging their bets and buying funds that protect against market volatility; a new fund seeks to benefit from crude oil recovery, and a Zurich vacation for value-conscious travelers."
166,"April 18, 2019 04:40 am ET",The Daily Shot: Low Jobless Claims Overstate the Labor Market’s Strength,
167,"April 17, 2019 05:19 pm ET",Aramco Pursues Stake in Indian Oil Refiner,"Saudi Arabia’s state oil company is in early stage talks to take a stake in the Indian operator of the world’s largest crude refining facility, a deal that would help fulfill its goal of matching the kingdom’s production with refining outlets."
168,"April 17, 2019 04:29 pm ET",Changing Role of Corporate Compliance Calls for Communication ,"Compliance departments are taking on new responsibilities or working more closely with other departments to determine how to monitor and mitigate emerging risks, compliance officers said at a WSJ event in Houston. "
169,"April 17, 2019 04:15 pm ET",Oil Prices End Lower Despite U.S. Inventory Decline,"Oil prices ended slightly lower despite a decline in U.S. oil inventories, as investors exercised caution ahead of a Trump administration decision regarding a waivers program on Iranian oil sanctions"
170,"April 17, 2019 03:22 pm ET",Philadelphia Shipyard Fights Again for Its Life ,"The Philly Shipyard, a remnant of America’s former shipbuilding might, is once again on hollow ground with two-thirds of its staff gone, a blank order book and tens of millions of dollars in fresh losses. "
171,"April 17, 2019 02:59 pm ET","Libya Fighting Hits Plan to Revive Oil, Gas Industry","A fight for control of Libya’s capital is disrupting plans to revive Libyan oil and gas production, the country’s oil chief said, raising the risk of a global increase in crude prices."
172,"April 17, 2019 02:58 pm ET",Bristow Group Puts Bankruptcy on the Table ,Aviation services business Bristow Group Inc. said bankruptcy is an option as it tries to restructure its debt in the face of dwindling liquidity.
173,"April 17, 2019 12:05 pm ET",A Highflying Growth Strategy Is Paying Off for United ,"Airlines cannot easily add scores of seats and still charge more for them, yet United seems to be doing just that. "
174,"April 17, 2019 10:43 am ET",Hedge Fund Slammed by Oil Looks to Take Riskier Bets ,"Pierre Andurand, a prominent oil hedge-fund manager who lost big during last year’s price slump, is launching a new fund that takes on more risk as a way to benefit from crude’s recovery. "
175,"April 17, 2019 07:33 am ET",Citgo Hanging in the Balance | NanoMech Files for Chapter 11 | CFA Protests Higher Bankruptcy Fees    ,"Venezuela’s creditors could threaten to seize not just Citgo Petroleum Corp. but other state-owned assets in an effort to collect on debts incurred under the ruling leftist regime, a lawyer for the country’s national oil company told a federal appellate court in Philadelphia.   "
176,"April 17, 2019 03:53 am ET",The Daily Shot: China’s Industrial Production Soars,
177,"April 16, 2019 08:27 pm ET",Standard Oil: A History in Photos,How Standard Oil grew from a small business in Cleveland to the ancestor of today’s oil majors
178,"April 16, 2019 05:35 pm ET","Too Soon? DOJ Seeks to End 1911 Standard Oil Breakup, Horseshoe Regulation ","The Justice Department dug deep into its antitrust files for decrees that just may not be pertinent today, like the one resulting from Theodore Roosevelt’s suit against the Rockefellers and the case against price-fixing in ice-cream cones. "
179,"April 16, 2019 03:12 pm ET",Oil Climbs Alongside Stocks on Demand Hopes,"Oil prices rose, climbing alongside stocks and other risk assets on optimism about improving economic growth and commodity demand."
180,"April 16, 2019 03:02 pm ET",Gold Falls Out of Favor as Risk Rally Extends to Spring,"Gold prices have declined since hitting a 10-month high in February, wiping out all of their gains for 2019. The drop signals rising optimism in the world economy as investors inch away from the safe-haven metal."
181,"April 16, 2019 02:47 pm ET",Three Hedge Funds Win Big in PG&E’s Complex Restructuring ,A sharp rebound in shares of PG&E has left three hedge funds that own 10% of the stock sitting on a roughly $700 million gain. 
182,"April 16, 2019 10:54 am ET",Anadarko Is Ripe for an Activist,"Oil and gas driller Anadarko Petroleum agreed to be acquired by Chevron for  a nearly 40% premium. That sounds like a great deal, but the company’s stock price was higher as recently as October."
183,"April 16, 2019 08:58 am ET","Stocks to Watch: J.B. Hunt, ServisFirst, Schlumberger, Nektar, Activision ","J.B. Hunt, ServisFirst, Schlumberger, Nektar Therapeutics, and Activision Blizzard are among Tuesday’s stocks to watch."
184,"April 16, 2019 08:36 am ET",PG&E Shares Still Surging | Jones Energy Files Prepack | Pharma Co. Achaogen Enters Chapter 11    ,PG&E Corp.’s shares continued to climb Monday following California Gov. Gavin Newsom’s unveiling of a plan to help ease the burden on California’s largest utility.  
185,"April 16, 2019 08:27 am ET",Evans Says Rate Rises Possible; Rosengren Open to More Flexible Inflation Policy    ,"Good day. Chicago Fed President Charles Evans said his outlook includes a rate increase next year and in 2021, but added a rate cut isn’t out of the question if inflation falls short.   "
186,"April 16, 2019 07:00 am ET",China Dispute Strikes Canada’s Canola Farmers,"China’s ban last month of Canadian imports of canola following the arrest of a Huawei executive could hurt the country’s production of the seed by about 10% this year, reversing a decade of booming growth."
187,"April 16, 2019 03:59 am ET","UK Oil & Gas Increases Stake in PEDL143 License for GBP412,500",
188,"April 15, 2019 06:18 pm ET",Jones Energy Cleared for Fast Chapter 11    ,"A judge has granted Jones Energy Inc. permission to fast-track a $1 billion debt-cutting plan, positioning the oil-and-gas company for a quick trip through chapter 11.  "
189,"April 15, 2019 03:41 pm ET",Oil Prices Fall on Concern That U.S. and Russia Could Increase Output ,Oil prices fell Monday on the possibility the U.S. and Russia—two of the world’s top oil producers—will increase output and beef up recently tight global supplies.
190,"April 15, 2019 12:11 pm ET","Canadian Business Sentiment Softens, Says Bank of Canada ","Canadian companies are expressing less optimism in the face of global trade tensions and weakness in the country’s housing and energy sectors, according to a Bank of Canada survey published Monday. "
191,"April 15, 2019 11:08 am ET",Homegrown Energy Can’t Tame U.S. Pump Prices,A sharp increase in prices in California has revived the debate about ethanol requirements in gasoline. U.S. energy dominance doesn’t mean cheaper fuel.
192,"April 15, 2019 11:05 am ET",OPEC Has a New Best Friend: Russia,"Vladimir Putin has helped resolve conflicts within the oil cartel by wielding Russia’s power as a major oil producer. That has given the country considerable influence over the direction of the world’s $1.7 trillion crude-oil market, and more power in the Middle East."
193,"April 15, 2019 09:43 am ET",Trump’s Fed Attacks Cast a Chill; A Glimpse of Fed’s Inner Workings; Deutsche Bank’s ’Badwill’    ,"Former central bankers worried about the erosion of the Federal Reserve’s nonpolitical stance, even as analysts opine that President Trump’s new nominees aren’t likely to change the central bank’s policy decisions.  "
194,"April 15, 2019 09:16 am ET",AGS WEEK AHEAD: Coffee Prices Remain Subdued; Wait for U.S-China Trade Deal Continues,
195,"April 15, 2019 07:35 am ET",Investors Handed an Oilman a ‘Blank Check’ Company. Here’s How It Turned Out.,"Two years ago, investors handed veteran oilman Jim Hackett a $1 billion check and sent him to seek riches in shale drilling. Today, the company he founded with their money is teetering on financial ruin."
196,"April 15, 2019 07:32 am ET",Waste Management to Buy Advanced Disposal Services for $2.9 Billion ,"Waste Management is buying competitor Advanced Disposal Services for around $2.9 billion, the biggest acquisition in its history and a deal that would bring together the No. 1 and No. 4 companies in the sector."
197,"April 15, 2019 03:59 am ET",MX Oil: Nigeria OML 113 License Continues to Produce at Stable Rate,
198,"April 15, 2019 03:37 am ET",The Daily Shot: China’s Credit Expansion Accelerates,
199,"April 15, 2019 02:52 am ET","MX Oil Raises GBP680,000 in Fundraising, Strategic Investor Takes 30% Stake",
200,"April 14, 2019 09:30 pm ET",Waste Management Nears $2.9 Billion Deal for Advanced Disposal,"Waste Management is nearing a roughly $2.9 billion deal to buy its smaller rival Advanced Disposal Services, according to people familiar with the matter, in what would be the biggest acquisition in its history. "
201,"April 14, 2019 02:26 pm ET","This Week on the Frontiers, April 13th 2019",A weekly roundup of key news affecting frontier markets from the Wall Street Journal and beyond.
202,"April 13, 2019 07:03 pm ET",Bank of Canada Governor Stresses the Limitations of Rate Estimates,"Estimates of Canada’s neutral interest rate are meant to provide a sense of where monetary policy could end up and shouldn’t be seen as a near-term target, Bank of Canada Governor Stephen Poloz said Saturday. "
203,"April 13, 2019 07:00 am ET",Beware the Bold Claims of Tax-Loss Harvesting ,"The exchange-traded fund industry has claimed credit for democratizing strategies once available only to the rich, such as trading oil futures or using leverage to amplify returns. The latest target: your tax bill. "
204,"April 12, 2019 07:18 pm ET",Petrobras Shares Hit on Signs Government Interfered With Fuel Pricing,Petrobras shares retreated on concern that the Bolsonaro administration changed course and interfered in the Brazilian oil company’s pricing policy.
205,"April 12, 2019 06:49 pm ET",Sudan’s Military Leader Steps Down Amid Turmoil,"The leader of the defense forces that ousted Sudan’s longtime dictator Omar al-Bashir stepped down on Friday, in a sign of discord among military factions as thousands stayed on the streets calling for a civilian-led transition."
206,"April 12, 2019 06:26 pm ET",Stocks Get Lift from Bank Earnings ,The S&P 500 climbed Friday to notch a third consecutive week of gains after two of the nation’s biggest banks reported earnings that beat expectations.
207,"April 12, 2019 05:46 pm ET",Chevron-Anadarko Deal Powers Shale Stocks,Shares in some of the biggest shale companies soared on hopes that Chevron $33 billion deal to acquire Anadarko Petroleum could start a wave of consolidation in the U.S. oil patch.
208,"April 12, 2019 05:45 pm ET",Chevron to Buy Anadarko Petroleum in $33 Billion Deal,"Chevron is acquiring independent exploration company Anadarko in a $33 billion deal, as it looks to strengthen its position in large shale projects, as well as deep-water and natural gas resource basins."
209,"April 12, 2019 05:30 pm ET",The Score: The Business Week in 7 Stocks,The Journal's weekly guide to the ups and downs of the business world.
