,date,title,summary
0,"August 10, 2019 12:01 am ET",SoftBank’s Bid to Build a Solar-Power Empire Founders,"Investor Masayoshi Son sought deals of immense scale in Saudi Arabia, India and beyond to tackle one of the world’s toughest energy challenges. So far, his firm has done a fraction of what it promised."
1,"August 9, 2019 05:36 pm ET",Trade Tension Sends Markets on Wild Week,The stock market ended this week slightly below where it started. But a lot happened from Monday through Friday.
2,"August 9, 2019 05:27 pm ET",U.S.-China Trade Battle Is Crimping Global Oil Demand,"Worries about the health of the world’s economy and increasingly uncertain trade relations between the U.S. and China will put further pressure on global oil demand in 2019, the International Energy Agency said."
3,"August 9, 2019 01:19 pm ET",Saudi Plans for Biggest-Ever IPO Are Back On,Saudi Arabia’s state oil company is revving up plans for an IPO and accelerating the timeline for what would be the world’s biggest listing to as soon as early 2020. The offering by Saudi Aramco was all but shelved last year.
4,"August 9, 2019 12:14 pm ET","Saudi Aramco Take Two: Better Odds, Nagging Questions ","Some things have changed since Saudi Aramco’s failed prior attempt that could help a listing, but a deal can only happen if expectations are reset. "
5,"August 9, 2019 09:12 am ET",PE Daily: Actis Pitches $600 Million Asian Property Fund | Uber Posts Its Largest Quarterly Loss    ,"Happy Friday! The stock markets have regained some lost ground after a dizzying plunge early in the week. As The Wall Street Journal reported, China’s central bank decided to fix the midpoint for onshore yuan trading at a less aggressive level than analysts had been expecting, which many took as a sign China wants to avoid adding to already high trade tensions with the U.S.  "
6,"August 9, 2019 09:08 am ET",Economists See September Rate Cut and U.S.-China Now in a Trade War; Charles Evans Transcript    ,"Good day. The U.S. is now in a trade war with China, say 87% of economists surveyed by The Wall Street Journal, which helps explain why they see a 64% probability for a Federal Reserve rate cut in September. A year ago, just half of the economists surveyed thought the U.S. and China were in a trade war, while the others viewed the situation as more like a skirmish. Meanwhile, statements from Fed officials this week illustrate how trade uncertainty is complicating the central bank’s underlying policy strategy, writes WSJ’s Nick Timiraos.  "
7,"August 9, 2019 06:02 am ET","WSJ Wealth Adviser Briefing: Emerging Markets, Odd Debt Deals, Economics Museum","Investors flee emerging-market stocks and currencies amid trade conflict; private-equity firms turn to a complex type of debt to dress up their companies, and a chic economics museum opens in Paris."
8,"August 8, 2019 05:27 pm ET",Stocks Climb as China Signals a More Stable Yuan,The Dow Jones Industrial Average climbed and investors sold safe-haven assets after China’s latest currency move eased concerns that the trade spat between the two countries was about to move into an all-out currency war.
9,"August 8, 2019 03:07 pm ET",Oil Rebounds From Near 2019 Lows,Crude prices rallied from near their lows for the year as investors’ anxiety about global growth prospects showed signs of easing.
10,"August 8, 2019 01:47 pm ET",It Is Tricky Finding Safety From a Market Storm ,"The bond market is holding up a giant sign in capital letters warning of trouble ahead. The next big market scare might not be far away, but is hard to prepare for. "
11,"August 8, 2019 12:06 pm ET",The Leaks That Threaten the Clean Image of Natural Gas ,U.S. energy companies are scrambling to reduce methane emissions in gas and oil production—both unintended and deliberate—that equate to the exhaust from 69 million cars a year and contribute to global warming.
12,"August 8, 2019 11:00 am ET",This Tuscan Villa Comes With 40 Rooms and a $60 Million Price Tag,"The sprawling 21,000-square-foot home, which has ties to the Machiavelli family, is a relic of Florence’s Golden Age."
13,"August 8, 2019 09:40 am ET","Stocks to Watch: Kraft Heinz, Viacom, Fox, Lyft, AIG and More","Kraft Heinz, Viacom, CBS, Fox, Lyft, AIG and Marathon Oil are among Thursday’s stocks to watch."
14,"August 8, 2019 09:07 am ET",Pro Bankruptcy Briefing: Auto Hauler Jack Cooper Files for Bankruptcy | Puerto Rico Swears In New Governor | Barneys New DIP,"Good day. Jack Cooper Ventures Inc., one of North America’s biggest auto haulers, filed for bankruptcy and has cut a deal with hedge fund Solus Alternative Asset Management LP. Puerto Rico Justice Secretary Wanda Vázquez was sworn in as governor after the island’s Supreme Court ruled unanimously that Pedro Pierluisi’s swearing-in last week was unconstitutional. And we take a look at Barneys New York Inc.’s new bankruptcy loan.  "
15,"August 8, 2019 06:30 am ET",Emerging-Market Stocks Correct Sharply as Trade Battle Flares ,"Investors are fleeing emerging-market stocks and currencies, fearful that an escalating trade war between the U.S. and China will weigh on global growth. "
16,"August 8, 2019 04:52 am ET",The Daily Shot: Global Central Banks Continue to Cut Rates,
17,"August 8, 2019 12:01 am ET",Transcript: Chicago Fed President Charles Evans Meets With Reporters,"Chicago Fed President Charles Evans discusses the outlook for the economy and interest rates, inflation weakness, trade uncertainty, Fed independence, and developments at central banks around the world."
18,"August 7, 2019 07:05 pm ET","Bond Yields Fall, Sparking Volatility in Stocks","A flight to safety that drove down bond yields globally sparked renewed volatility in the stock market Wednesday, highlighting uncertainty about how the trade and currency battle between the U.S. and China will play out."
19,"August 7, 2019 03:12 pm ET",Oil’s Slide Deepens on Mounting Demand Worries,"A rout in oil prices deepened after government data showed an unexpected increase in stockpiles, triggering fresh worries that demand for fuel is weakening alongside the U.S. economy."
20,"August 7, 2019 02:42 pm ET",Drilling Company Halcón Returns to Bankruptcy With Bondholder Deal in Hand,Halcón Resources returned to chapter 11 bankruptcy protection to take another fast whack at the debt load weighing on its oil-and-gas business.
21,"August 7, 2019 11:00 am ET","EC Launches Investigation Into Proposed Grupa Lotos, PKN Orlen Merger",
22,"August 7, 2019 04:53 am ET",The Daily Shot: State and Local Government Job Openings at All-Time High,
23,"August 7, 2019 12:01 am ET","U.S. Stocks Regain Ground, Yuan Stabilizes",U.S. stocks recouped some of their losses Tuesday after China backed off from a further escalation in the country’s trade and currency dispute with Washington.
24,"August 6, 2019 07:56 pm ET",Global Oil Prices Slide Into Bear Market ,Brent crude has fallen more than 20% from an April high amid fresh concerns that the U.S.-China trade war will hurt the global economy and curb fuel consumption.
25,"August 6, 2019 06:01 pm ET","More Stock-Market Volatility Expected as U.S., China Dig In Heels Over Trade","The threat of fresh tariffs has pushed major U.S. indexes lower, and Wall Street analysts are urging investors to brace for further turbulence."
26,"August 6, 2019 09:10 am ET",Trump May Get an Earful From the Heartland ,"Industrial, agricultural, energy and transportation companies are all suffering as a result of the China trade dispute, which hits President Trump’s important base of voters. "
27,"August 6, 2019 06:02 am ET","WSJ Wealth Adviser Briefing: Low-Volatility Funds, Persian Gulf Debt, Grandparent Payments","Low-volatility funds are proving popular with cautious investors; U.S. banks are cashing in on Persian Gulf debt, and the three ways grandparents can help pay for college."
28,"August 5, 2019 06:28 pm ET","China’s Yuan Breaches 7-to-the-Dollar Level, Prompting Trump Critique","China’s currency broke through the psychologically important level of 7 yuan to the dollar, prompting President Trump to accuse Beijing of manipulating its currency in a way that would backfire. "
29,"August 5, 2019 05:29 pm ET","Tyson Foods, Gold Miners and Gun Makers Defy Market Downturn ","What do chicken breasts, gold, plywood and guns have in common? Companies that produce them gained on Monday, even as the broader stock market had its worst day of the year."
30,"August 5, 2019 05:14 pm ET","Vol. 32, No. 7: Vulgarities, Again",
31,"August 5, 2019 04:31 pm ET",Trade Tensions Whipsaw Hog Prices ,"Global trade tensions weighed on trader expectations that China will continue to rely on U.S. pork exports, leading to a volatile session in hog futures. "
32,"August 5, 2019 09:16 am ET",PE Daily: Endeavor Postpones IPO | Private Equity’s Summer Reading List    ,"Good day! The march of private-equity and venture-backed companies to the public markets has been fairly steady this year. However, late last week, one private-equity-backed company put its IPO plans on pause. As The Wall Street Journal reported Friday, Silver Lake-backed talent management and entertainment company Endeavor Group Holdings Inc. has postponed its IPO until September at the earliest, to allow time for it to close the acquisition of On Location Experiences, another private-equity-backed hospitality and live-events company.  "
33,"August 5, 2019 09:05 am ET",Lower Crude and Gas Prices Take Toll on Big Oil Profits—Energy Journal,
34,"August 5, 2019 09:01 am ET",Powell’s Off-the-Cuff Approach Leaves Investors on Edge; Yuan Declines as Trade Fight Hits Markets    ,"Good day. The confusion sparked by Jerome Powell’s comments last week highlights the challenge facing the Fed chairman as he aims for a plain-spoken approach to communications at a time of heightened economic uncertainty. That uncertainty was underscored on Monday as markets fell after the latest escalation of the U.S.-China trade spat. The Chinese yuan hit a record low, with China’s central bank suggesting the depreciation was in response to President Trump’s decision to extend punitive tariffs to almost all Chinese goods.  "
35,"August 5, 2019 05:45 am ET",Australia Looks to Siphon U.S. Oil Stockpile to Avoid Running Out of Gas,"The U.S. is considering opening its emergency oil reserves to Australia, as concerns grow about shipping security and this Washington ally’s ability to withstand a global oil-supply shock."
36,"August 5, 2019 05:30 am ET",U.S. Banks Are Cashing In on Persian Gulf Debt,"U.S. banks are cashing in on a public-debt boom among oil-rich Persian Gulf nations, muscling into lending territory long dominated by rivals."
37,"August 5, 2019 02:26 am ET",Iran Seizes Vessel in Persian Gulf Accused of Smuggling Fuel ,"The Islamic Revolutionary Guard Corps has seized a vessel accused of smuggling fuel and detained its crew, Iranian state television said, the latest incident of Tehran interdicting ships in the volatile Persian Gulf."
38,"August 4, 2019 10:07 am ET",Huawei’s Phone Sales in China Get Patriotic Boost,"Huawei’s domestic smartphone sales have surged because of a buying spree by its outraged Chinese fan base, while the U.S. ban on tech sales to the company has crippled its overseas sales."
39,"August 4, 2019 10:00 am ET",The Problem With Inflation: It Often Doesn’t Exist,"For more than a decade, the world’s central banks have scrambled to bring inflation up to their targets—usually 2%. The problem is that inflation is often a meaningless concept."
40,"August 4, 2019 08:00 am ET",Mining CEO Digs Into His Biggest Challenge at Age 72,"Freeport-McMoRan CEO Richard Adkerson was expected to retire by some; instead, the 72-year-old’s legacy and the company’s future will depend on his ability to execute the company’s largest-ever mining project."
41,"August 4, 2019 05:30 am ET",Russians Flock to Easy Loans as Income Dips    ,"More ordinary Russians have come to depend on easy loans to buy goods, maintain a certain lifestyle or simply to survive. As some of them spend nearly 40% of their wages on loan repayments, top officials worry the borrowing bubble might blow up in 2021, sparking economic recession."
42,"August 3, 2019 11:23 pm ET","Emerging and Growth Markets, August 3rd 2019",A weekly roundup of key news affecting emerging and growth markets from the Wall Street Journal and beyond.
43,"August 3, 2019 12:01 am ET",What’s News: Business & Finance,What’s News: Business & Finance
44,"August 2, 2019 04:37 pm ET",Stocks Suffer Worst Week in Months on Trade Threats,Stocks capped a down week with another decline as investors overlooked a jobs report in line with expectations and focused on threats by President Trump to extend tariffs to essentially all Chinese imports.
45,"August 2, 2019 03:52 pm ET","Zoltan Merszei, an Immigrant, Won and Soon Lost Top Job at Dow Chemical","Zoltan Merszei fled Hungary after World War II and led a highly profitable expansion of Dow Chemical in Europe. After returning to the U.S. as chief executive, he clashed with American colleagues. He moved on to work for Armand Hammer and Alan Bond. "
46,"August 2, 2019 03:13 pm ET",Growth Fears Send Copper to Two-Year Low ,"Copper fell 3.9% this week, as renewed trade hostilities between the U.S. and China reinforced fears about the world economy. "
47,"August 2, 2019 02:01 pm ET",Size and Scope Aren’t Helping Big Oil    ,"Now is the time in the energy cycle to capitalize on being big, but many businesses are struggling simultaneously, pinching Exxon Mobil and Chevron.  "
48,"August 2, 2019 11:53 am ET",Real Time Economics Special Edition: More Jobs But at a Slower Pace,
49,"August 2, 2019 11:52 am ET",Are Activist Investors Sexist?,"Female CEOs are far more likely to face an activist challenge, new research shows."
50,"August 2, 2019 11:50 am ET",Gas Glut Weighs on Oil Giants,"Profit fell at Exxon, mirroring results from European counterparts, including Shell. Chevron net income rose 26%, helped by a breakup fee from a scuttled deal to buy Anadarko, but the natural-gas prices it fetches have plunged."
51,"August 2, 2019 10:30 am ET",Marvin Gearhart Applied Digital Technology to Oil Drilling,"Marvin Gearhart, a born tinkerer, pioneered digital tools used to probe the contents of oil wells. His Gearhart Industries boomed in the 1970s and early 1980s. Then crashing oil prices forced him to sell his firm."
52,"August 2, 2019 10:24 am ET",Today’s Logistics Report: Raising Tariff Threats; Trucking’s Last Mile; Financing a Turnaround,Today’s Top Supply Chain and Logistics News from WSJ.
53,"August 2, 2019 09:20 am ET","Canada Exports, Imports Dropped in June ","Canadian exports and imports fell by the most in two years in June, as activity in crude-oil markets weighed on both sales abroad and foreign purchases. Still, the country recorded a trade surplus for a second straight month. "
54,"August 2, 2019 08:41 am ET",Pro Bankruptcy Briefing: Soft Energy Prices Hit Upstream Sector | Puerto Rico Power Struggle Drags On | Boy Scouts In Crisis    ,"Good day. As oil prices were cratering Thursday, investors were selling off upstream energy companies including Whiting Petroleum Corp. and Concho Resources Inc. In Puerto Rico, a succession crisis worsened as lawmakers put off the confirmation of Gov. Ricardo Rosselló’s handpicked replacement until after his planned departure. And the Boy Scouts of America, facing potential bankruptcy, is debating how to stay relevant.  "
55,"August 2, 2019 04:55 am ET",The Daily Shot: Another Fed Rate Cut in September?,
56,"August 2, 2019 04:41 am ET","Trump, China and the Fed",President Trump’s latest round of tariffs is unlikely to egg China into major concessions—but it could have big implications for interest rates and currency markets. 
57,"August 2, 2019 03:21 am ET","Northbridge Industrial Services Sees 1H Recovery in Revenue, Ebitda",
58,"August 2, 2019 12:01 am ET",What’s News: Business & Finance,What’s News: Business & Finance
59,"August 1, 2019 09:35 pm ET",Petrobras Profit Jumps on Sale of Gas Pipeline Operator ,"Petróleo Brasileiro, or Petrobras, said profit jumped in the second quarter after the oil company sold assets including a gas distribution unit."
60,"August 1, 2019 09:32 pm ET",Expected Surge in Oil Supply and Tariffs Add to Glut Concern,"Growth in oil supply is expected to accelerate next year as production increases. The U.S. benchmark for crude fell the most in four years as President Trump threatened new tariffs, before partly recovering. "
61,"August 1, 2019 07:55 pm ET",Soft Energy Prices Drag Down Upstream Producers ,Investors fled upstream energy companies after Whiting Petroleum Corp. and Concho Resources Inc. cut budgets and delivered earnings that fell short of expectations. 
62,"August 1, 2019 07:25 pm ET","Stocks, Bond Yields, Oil Fall on New China Tariffs",The Dow Jones Industrial Average erased a more-than-300-point rebound and oil posted its worst day since 2015 after President Trump said the U.S. will impose additional tariffs on China next month.
63,"August 1, 2019 07:24 pm ET",Trump Threatens New Chinese Tariffs,"President Trump moved to extend tariffs to essentially all Chinese imports, escalating a trade conflict that is now poised to hit U.S. consumers in the pocketbook."
64,"August 1, 2019 07:17 pm ET",The Left vs. the Crazy Left,"If you’re looking for a moderate president, you won’t find one in the Democratic field."
65,"August 1, 2019 06:33 pm ET",Shell and European Rivals Hit by Lower Oil Prices,"Royal Dutch Shell’s results came in well below expectations, marking a poor quarter for energy majors and suggesting that their efforts to diversify their portfolios haven’t fully cushioned them from swings in oil and gas prices.  "
66,"August 1, 2019 06:33 pm ET","Weatherford Shareholders Settle, Agree to Support Chapter 11 Plan ","The proposed deal, announced during a brief hearing Thursday at the U.S. Bankruptcy Court in Houston, improves recoveries for shareholders and clears a hurdle that could have complicated Weatherford’s path toward reorganization. "
67,"August 1, 2019 05:12 pm ET",Treasury Yield Hits Lowest Level Since 2016 Vote,The yield on the 10-year U.S. Treasury note recorded its largest one-day decline in more than a year after President Trump announced new tariffs on Chinese imports.
68,"August 1, 2019 04:29 pm ET",Shares in Top Shale Driller Fall After it Discloses Well Problems ,"Concho Resources Inc. disclosed disappointing output from wells drilled close together, an emerging problem in the shale drilling industry, and its shares fell 23% on Thursday. "
69,"August 1, 2019 03:09 pm ET",Trump Tweets Crush Oil Market as Prices Fall Nearly 8% ,"Oil prices sank almost 8%, their biggest drop since February 2015, after President Trump announced new tariffs on Chinese imports. "
70,"August 1, 2019 01:18 pm ET","Oil Has a Shale Problem, Not an Oil Problem ","The earnings erosion at Concho Resources underscores investors’ concerns are with spending on shale, not spending in general. "
71,"August 1, 2019 11:20 am ET",Meatless Burgers Stoke Sales and Questions About Nutrition ,Plant-based burger makers say their products are better for the planet than beef. Whether they’re better for consumers’ health is a different question. 
72,"August 1, 2019 09:28 am ET",PE Daily: Cofense Talks Falter | Leon Black Addresses Epstein Ties | PE Falls Short for Many CFOs    ,"Good day! It’s the first day of August and the month is kicking off with a fresh wrinkle in the unfolding saga over cybersecurity company Cofense Inc. As Dawn Lim and Will Louch report, the on-again, off-again talks between BlackRock Inc and Pamplona Capital to acquire the latter’s stake in Cofense appear to be off again. Talks faltered within the past couple of days, Dawn and Will write, although it’s possible they could restart.  "
73,"August 1, 2019 04:55 am ET",The Daily Shot: Markets Worry About “Two and Done”,
74,"July 31, 2019 06:56 pm ET",Democrats’ ‘Big Ideas’ May Re-Elect Trump,"From Medicare for All to the Green New Deal, candidates work hard to repel swing voters."
75,"July 31, 2019 06:46 pm ET",Natural-Gas Prices Rise as Investors Lock in Profits,"Natural-gas prices shot higher Wednesday, as some investors locked in profits on bearish bets a day ahead of weekly inventory data."
76,"July 31, 2019 05:43 pm ET",Compromise Can Promote Green Policy Goals,"Our energy future will look different than its past. That transition is under way, but it doesn’t have to be a binary choice between 100% renewables or unmitigated carbon emissions from fossil fuels."
77,"July 31, 2019 04:02 pm ET",‘Last Man Standing’: An American  Investor in Russia Takes a Fall,Michael Calvey remained a Kremlin cheerleader long after other fund managers left. Now he is facing prison. 
78,"July 31, 2019 04:24 am ET",The Daily Shot: Small Business Hiring Continues to Slow,
79,"July 31, 2019 04:22 am ET","Oilex to Raise GBP340,000 in Share Placing",
80,"July 30, 2019 04:41 pm ET",Stocks Fall on Trade Concerns,U.S. stocks slipped after President Trump warned of difficulties in trade talks with China.
81,"July 30, 2019 03:46 pm ET","Iran, U.A.E. Discuss Maritime Security Amid Heightened Tensions in Gulf ","United Arab Emirates officials arrived in Iran on Tuesday to discuss maritime security in the Persian Gulf, amid efforts to address threats to commercial ships passing through the important oil supply route that have heightened regional tensions. "
82,"July 30, 2019 03:31 pm ET",Copper Slides as Trade Hopes Recede ,"Copper prices slid again Tuesday after President Trump increased pressure on China in a series of tweets, a potential setback for investors hoping that the world’s two largest economies can quickly reach a trade agreement."
83,"July 30, 2019 11:36 am ET","McDermott Bonds, Shares Plunge on Guidance Cut ",The Houston-based engineering and construction company Monday reported a surprise guidance cut for 2019.
84,"July 30, 2019 06:52 am ET","Real Time Economics: U.S. Racking Up Debt, Homeowners Get Their Rate Cut Early, British Pound Tumbles",
85,"July 30, 2019 06:30 am ET",Natural Gas Is Stuck in a Vicious Cycle,Prices have fallen more than 25% this year and may remain weak for several years despite booming demand. 
86,"July 29, 2019 06:59 pm ET",Rig Owners Forecast Further Drilling Decline,Drilling rig owners and others who lease equipment to U.S. energy producers are forecasting a slowdown in activity during the second half of the year.
87,"July 29, 2019 06:57 pm ET",Why Russia and China Are Joining Forces,The past few years have witnessed a marked increase in American power.
88,"July 29, 2019 08:41 am ET",Pro Bankruptcy Briefing: Puerto Rico’s Top Prosecutor Rejects Governor’s Job | Hahnemann Operator Must Keep Philly In Loop | Oil Producer Hits Ch. 11 After Spills    ,"Good day. The Puerto Rico official who is next in line to replace outgoing Gov. Ricardo Rosselló said she doesn’t want the job, deepening the bankrupt U.S. territory’s political tumult. The company behind Hahnemann University Hospital’s bankruptcy can’t shut Philadelphia health officials out of the process. And oil producer HVI Cat Canyon Inc. filed for bankruptcy while it battles federal and state claims over oil spills.  "
89,"July 29, 2019 08:05 am ET",Energy Journal: Crude Wavers as Oil Majors Set to Report Earnings,
90,"July 29, 2019 04:55 am ET",The Daily Shot: Business Investment Was a Drag on Growth for the First Time in Three Years,
91,"July 29, 2019 04:37 am ET",Mustang Energy Shares Rise on IPO,
92,"July 29, 2019 04:05 am ET",Victoria Oil & Gas's Gaz du Cameroun Agrees Gas-Supply Deal with Aksa Enerji,
93,"July 28, 2019 07:33 pm ET","With Stocks at Fresh Highs, Investors’ Portfolios Look Alike",A rally in stocks has triggered unusual circumstances for some of Wall Street’s biggest investors—they are holding many of the same companies.
94,"July 28, 2019 02:02 pm ET",Berkeley’s Gas Ban Should Only Be a Start,Where will the electricity come from if everyone is forced to use electricity for everything at home? The current electricity providers are at capacity.
95,"July 28, 2019 09:00 am ET",A Key Reason the Fed Struggles to Hit 2% Inflation: Uncooperative Prices ,"Recent studies show that a large segment of the economy, from healthcare to durable goods, appears insensitive to the rising or falling demand. "
96,"July 27, 2019 03:01 pm ET","Emerging and Growth Markets, July 27th 2019",A weekly roundup of key news affecting emerging and growth markets from the Wall Street Journal and beyond.
97,"July 26, 2019 04:37 pm ET",The Natural Gas Market Is in a Summer Meltdown ,Natural-gas futures for August delivery traded down 3.3% to $2.169 per million British thermal units. That is a fresh three-year low and the lowest July price since 1999.
98,"July 26, 2019 07:56 am ET",Icahn Looks to Occidental’s Ex-CEO for Help in Fight With Company,"Occidental Petroleum CEO Vicki Hollub is eager to move forward following her $38 billion deal to buy Anadarko Petroleum. But first she has to deal with Carl Icahn, who is trying to bring her predecessor back into the boardroom."
99,"July 26, 2019 06:40 am ET",Real Time Economics: The Outlook is Getting ‘Worse and Worse’,
100,"July 26, 2019 05:30 am ET","In a Life-or-Death Crisis, Humility Is Everything ",Airline pilot Alfred Haynes and other leaders who’ve saved lives show that modest people can achieve miracles under pressure.
