,date,title,summary
0,"February 10, 2020 06:56 pm ET",The Cold War Over Venezuela,"Moscow has a stake in Maduro’s regime, but its value to Putin depends on oil."
1,"February 10, 2020 06:07 pm ET",Australian Dollar Sinks as Investors Brace for Coronavirus Slowdown in China,"Australia’s currency fell to its weakest level in more than a decade, reflecting growing concerns about the damage the new coronavirus will do to China’s economy and its appetite for Australian exports."
2,"February 10, 2020 04:54 pm ET","Beach Energy Pares Production Outlook, Steps Up Spending",
3,"February 10, 2020 08:44 am ET",PE Daily: Mass PRIM Mulls $2.3 Billion PE Pace | David Capobianco’s Big Water Bet | Goldman Sachs Faces PE Exits    ,"This weekend the student-run private-equity and venture-capital club at Harvard Business School held its annual conference in Cambridge, Mass.  "
4,"February 10, 2020 08:41 am ET",Pro Bankruptcy Briefing: PES Creditors Object to Refinery Sale | Melinta Judge OK’s Deerfield Stalking Horse Bid | Coronavirus Bruising America’s Oil Patch    ,"Philadelphia Energy Solutions’ creditors want a judge to reject the bankrupt refinery operator’s sale of its 1,300-acre city property to Hilco Redevelopment Partners.  "
5,"February 10, 2020 08:39 am ET",Energy Journal—Viral Fears Weigh on Energy Prices,
6,"February 10, 2020 04:59 am ET",The Daily Shot: Women Powering U.S. Prime-Age Labor Force Participation,
7,"February 10, 2020 03:04 am ET","Caspian Sunrise: A5 Well Daily Output Can Reach 1,500 Barrels",
8,"February 9, 2020 10:09 pm ET",The Case for Energy Stocks,"The “Dogs of the Dow” rule holds that the worst stocks usually turn around. If that applies to sectors, and the funds that track them, then energy shares will benefit."
9,"February 9, 2020 07:25 pm ET","Need for Face Masks in China Pushes Auto, Energy Firms to Make Them","China’s auto makers, the world’s biggest iPhone assembler and even state-owned energy companies are using assembly lines to pump out more face masks and other medical supplies as the country responds to a coronavirus outbreak that has spread around the world."
10,"February 9, 2020 04:37 pm ET",The Agony of the Tesla Bears: $8.4 Billion of Losses in Five Weeks,"Short sellers feel the pain of their gamble that the electric-car maker’s share price is inflated as the stock soared to heights few had predicted. “Oh damn, I got my butt kicked.”"
11,"February 8, 2020 06:33 pm ET","Emerging and Growth Markets, February 8th 2020",A weekly roundup of key news affecting emerging and growth markets from the Wall Street Journal and beyond.
12,"February 7, 2020 07:52 pm ET",Creditor Committee Protests Philadelphia Energy Bankruptcy Plan ,"Creditors of Philadelphia Energy Solutions are finding shortcomings with the winning bid for the bankrupt refinery operator’s 1,300-acre property, saying the proposed buyer has too much leeway to drop its price or kill the deal and reclaim its deposit."
13,"February 7, 2020 03:42 pm ET",Oil Falls for Fifth Week as Investors Weigh Coronavirus Fallout       ,Oil prices fell for the fifth week in a row as investors tried to gauge the fallout from a coronavirus that has sickened thousands in China and tamped down demand in the world’s largest importer of oil.  
14,"February 7, 2020 02:56 pm ET","Saudi Arabia, Kuwait Set to Restart Oil Output in Neutral Zone","The oil fields can produce as much as 500,000 barrels of crude a day."
15,"February 7, 2020 10:09 am ET","Canada Added Jobs in January, Wages Accelerate","Employment in Canada rose in January at a solid pace and the jobless rate ticked down, offering some evidence the labor market is showing signs of a rebound after a slowdown late last year."
16,"February 7, 2020 08:47 am ET",Pro Bankruptcy Briefing: CBD Producer GenCanna Files for Bankruptcy | Lynn Tilton Loses Round in Legal Fight With Investors | Lolli & Pops’ New Owner Plans to Keep Some Stores Open    ,"GenCanna Global USA Inc., a prominent producer of cannabidiol, or CBD, oil filed for chapter 11. A bankruptcy judge dealt Lynn Tilton a loss in her long-running legal fight with investors in her Zohar funds.  "
17,"February 7, 2020 08:43 am ET",Quarles Calls Interest-Rate Stance Appropriate; Fed Stress Tests; Australia at a Turning Point    ,The Federal Reserve’s Randal Quarles said the current setting of monetary policy should support economic growth and help move inflation up to target.  
18,"February 7, 2020 08:00 am ET","Disney Impresses, Oil Falls and Stocks Return to Record Territory","The Disney+ streaming service is getting a boost from ‘The Mandalorian’ series and Baby Yoda, while the coronavirus continues to push crude lower. "
19,"February 7, 2020 07:21 am ET","Coronavirus Cuts Chinese Tourism, and Luxury Retailers Suffer","Chinese tourists are disappearing from major shopping capitals across the U.S. and Europe due to the new coronavirus, exposing how dependent high-end retailers in places such as New York, Paris and Milan have become on visitors from China."
20,"February 7, 2020 06:40 am ET",Newsletter: Which Way for the Labor Market?,Your daily economics newsletter from The Wall Street Journal.
21,"February 7, 2020 05:30 am ET",Coronavirus Is Bruising America’s Oil Patch,Some already struggling energy companies may not be able to weather the drop in oil and gas demand.
22,"February 7, 2020 05:03 am ET",The Daily Shot: Peak Coronavirus or Is Another Wave Coming?,
23,"February 7, 2020 03:16 am ET",REA Holdings 2H Estate Operating Costs Rose From 1H; To Resume Cash Dividends,
24,"February 6, 2020 05:49 pm ET",Tesla’s Stock Boom: It’s OK to Miss Out,There are several good reasons to think Tesla should be more valuable today than it was six months ago. But there aren’t any that justify its shares more than tripling in price since then.
25,"February 6, 2020 05:48 pm ET",CBD Producer GenCanna Files for Bankruptcy ,"GenCanna Global USA Inc., a large Kentucky producer of cannabidiol, or CBD, oil and other hemp products, has filed for bankruptcy following cost overruns and construction delays at a new processing center and a fire last year at its existing facility."
26,"February 6, 2020 04:56 pm ET",Kimmeridge Energy Hires Veteran Wellington Management Analyst Mark Viviano ,The hiring is a sign of the pressure traditional money managers are under to become more active. 
27,"February 6, 2020 03:34 pm ET","Shale Gas Swamps Asia, Pushing LNG Prices to Record Lows ","Liquefied natural gas is fetching the lowest price on record in Asia, a troubling sign for U.S. energy producers who have relied on overseas shipments of shale gas to buoy the sagging domestic market. "
28,"February 6, 2020 03:31 pm ET",Russia Blocks OPEC Response to Coronavirus,"Russia has rejected a Saudi-led effort to deepen OPEC’s oil production cuts in response to the deadly coronavirus in China, cartel delegates said."
29,"February 6, 2020 03:10 pm ET",Juul Raises $700 Million From Investors,"Juul Labs has raised more than $700 million in convertible debt to fund its operations, as the e-cigarette maker confronts increasing financial and regulatory pressures. "
30,"February 6, 2020 09:52 am ET",Ask a Doctor (of Economics) About Coronavirus,"Figuring out what the economic impact of the coronavirus outbreak will be is both a necessary and, at the moment, potentially futile exercise."
31,"February 6, 2020 08:58 am ET","Fed Nominee Faces Questions Over Views; China Cuts Tariffs; Daly Sees Economic Optimism; Rate Cuts in Brazil, Philippines    ",Federal Reserve Board nominee Judy Shelton’s views on issues such as the gold standard and central-bank independence could come under a microscope as she faces a nomination hearing next week.  
32,"February 6, 2020 07:03 am ET",India’s Central Bank Keeps Key Lending Rate Unchanged ,The Reserve Bank of India is making it easier for banks to offer auto and housing loans as it looked for ways to jumpstart growth without exacerbating inflation. 
33,"February 6, 2020 05:04 am ET",The Daily Shot: Mortgage Refinance Activity Highest Since 2013,
34,"February 5, 2020 04:59 pm ET",Coronavirus Threatens a Popular Crude Trade,The fall and winter of 2019-20 looked like easy money for investors in the oil market. Then the coronavirus hit. 
35,"February 5, 2020 04:58 pm ET","S&P 500, Nasdaq Climb to Records as Virus Concerns Ease","The S&P 500 closed at a record, erasing the losses sparked by reaction to China’s coronavirus outbreak, while oil prices posted their biggest gain in more than a month."
36,"February 5, 2020 03:14 pm ET",Oil Rebounds After Taking Brunt of Coronavirus Hit ,"Oil and copper prices rose, a turnaround that some traders attributed to unconfirmed media reports that a Chinese university found a treatment for the fast-spreading coronavirus."
37,"February 5, 2020 03:02 pm ET",Quick Hits: Bank of Spain Governor Sees Growing U.S. Trade Ties,"Here is a roundup of what analysts and central bank officials had to say about the economy, monetary policy and other issues Wednesday."
38,"February 5, 2020 09:32 am ET",Trump Wants a Referendum on the Economy—and Sanders May Oblige,"Sen. Bernie Sanders promises Medicare for All, student-debt cancellation and a fracking ban, which could make President Trump a moderate on economic issues. "
39,"February 5, 2020 08:37 am ET","Fed Bars Goldman Executive From Banking; Yellen Says Tariffs Haven’t Helped, Sees Risks From Low Rates    ","The Federal Reserve barred a Goldman Sachs executive from the banking industry for his role in the 1MDB scandal, former Fed leader Janet Yellen said tariffs haven’t helped U.S. workers and warned that low-interest-rate policy settings come with risks, and the Senate Banking Committee will hold a confirmation hearing for President Trump’s two Fed board nominations Feb. 13.  "
40,"February 5, 2020 07:03 am ET","As Coronavirus Spreads, China Chokes on Oil ",Reports of Chinese oil demand dropping off a cliff as quarantine measures bite have spooked markets. Much depends on how fast factories get back to work. 
41,"February 5, 2020 06:41 am ET",Newsletter: State of the Economy,
42,"February 5, 2020 04:01 am ET",The Daily Shot: Hedge Funds’ Stock Picks Are Outperforming Again,
43,"February 4, 2020 10:28 pm ET",Full Text of President Trump’s 2020 State of the Union Speech ,President Trump delivered his third State of the Union Address in a joint session of Congress on Tuesday evening. Here is the prepared text of the speech. 
44,"February 4, 2020 10:24 pm ET",Trump Impeachment Agonistes,He addresses Congress on the eve of acquittal as his approval rating rises.
45,"February 4, 2020 04:59 pm ET",Bond Investors Eye Iowa Caucuses ,"The yield on the benchmark 10-year Treasury posted its largest one-day gain in nearly two months, lifted by economic stimulus in China, signs of recovery in manufacturing and the stalled release of results from the Iowa Democratic caucuses."
46,"February 4, 2020 04:14 pm ET",Gold Slides as Fears Tied to Virus Abate       ,"Prices of the metal fell sharply, with traders expecting the Chinese central bank’s moves to inject liquidity into the country’s banking system will help the economy stabilize following the coronavirus outbreak. "
47,"February 4, 2020 04:04 pm ET",MDC Energy Shakes Up Governance in Lender Pact,"MDC Energy agreed to a corporate governance overhaul to settle a management dispute with lenders, keeping the bankrupt oil-and-gas company’s chief executive in place while adding two independent directors and a chief restructuring officer."
48,"February 4, 2020 01:54 pm ET","OPEC, Allies Weigh Deeper Oil Production Cuts to Counter Coronavirus’s Impact","OPEC and its allies are debating more aggressive oil output cuts than previously considered after reviewing new data that showed the coronavirus’s deepening impact on global oil demand, officials at the cartel said."
49,"February 4, 2020 09:48 am ET","BP Raises Dividend, Boosts Divestment Targets","BP raised its dividend at the same time as reporting a small loss and extending its planned asset sales by $5 billion, joining other oil giants in shedding assets to help maintain shareholder returns."
50,"February 4, 2020 09:02 am ET",Australia Keeps Rates on Hold; The Yield-Curve Debate; Factory Revival in Doubt as Coronavirus Spreads    ,"The Reserve Bank of Australia kept rates on hold, pointing to evidence that last year’s reductions are supporting inflation and job growth, but warned that bushfires and the coronavirus will likely hit the economy in the short term.   "
51,"February 4, 2020 06:00 am ET","Natural Gas Won’t Decarbonize Shipping, But the Fuel Is Here to Stay","Shipping is going through its biggest change since switching from coal to heavy oil more than a century ago, as it looks for new fuels that will cut the industry’s carbon footprint. A move toward liquefied natural gas isn’t clearing away concerns about meeting a carbon-cutting deadline."
52,"February 4, 2020 04:58 am ET",The Daily Shot: U.S. Job Market Increasingly Dominated by Large Firms,
53,"February 4, 2020 04:34 am ET","Andalas Energy Rises on Management Overhaul, Premium Share Placing",
54,"February 4, 2020 12:52 am ET",What’s News: Business & Finance,What’s News: Business & Finance
55,"February 4, 2020 12:01 am ET","Tesla’s Epic Rally Echoes Past Oil, Bitcoin Bubbles ","The car maker’s outsize stock gains don’t match its fundamentals, but they do share troubling similarities with past episodes of inflated prices that ended in tears. "
56,"February 3, 2020 07:18 pm ET",China’s Economic Contagion,The world will pay a growth price for the Wuhan coronavirus.
57,"February 3, 2020 05:59 pm ET",Oil Prices Slide Into Bear Market on Coronavirus Concern  ,.
58,"February 3, 2020 05:01 pm ET",The New Threat to Energy-Company Bonds: Virus Fears ,"Investors have lost their recent appetite for energy companies’ debt as the coronavirus has spread, creating challenges for companies still needing financing. "
59,"February 3, 2020 04:46 pm ET","Oil Skids Into Bear Market, While Stocks Rebound",U.S. stocks rebounded after last week’s sharp decline. But oil prices dropped more than 2% on worries that the coronavirus outbreak would reduce Chinese energy consumption.
60,"February 3, 2020 09:33 am ET",Clarida Says Fed Is Monitoring Virus; PBOC Injects Liquidity; Sterling Rise Before BOE Decision Probed    ,"The effect of the coronavirus outbreak on the global growth outlook remains uncertain, said Federal Reserve Vice Chairman Richard Clarida, but he expressed optimism about the U.S. economy and said he wasn’t worried about the recent inversion in the Treasury market’s yield curve.  "
61,"February 3, 2020 08:29 am ET",Energy Journal: EXCLUSIVE—Saudis Push for Large OPEC Cuts in Response to Coronavirus,"Saudi Arabia is pushing OPEC to make a major, short-term oil production cut of some 500,000 barrels per day as it seeks to respond to the impact of China’s deadly coronavirus on crude demand, report Benoit Faucon and Summer Said this morning."
62,"February 3, 2020 07:39 am ET","Coronavirus Closes China to the World, Straining Global Economy    ","Rarely has an integral part the global economy faced such an abrupt and open-ended freeze out, as multinational businesses make hard decisions with limited information."
63,"February 3, 2020 06:40 am ET",Newsletter: Coronavirus Closes China,Your daily economics newsletter from The Wall Street Journal.
64,"February 3, 2020 06:02 am ET","WSJ Wealth Adviser Briefing: Energy Stocks Drained, Manufacturing Catches Cold, Off-Limits Travel","Energy stocks have been the worst performing sector for the past two years; the effects of  coronavirus could dog global industrial supply chains for years, and travel spots around the world where picture taking is banned."
65,"February 3, 2020 05:02 am ET",The Daily Shot: China’s Central Bank Conducts a Massive Liquidity Injection to Cushion the Coronavirus Impact,
66,"February 3, 2020 04:43 am ET",President Energy 2019 Profit Falls on Weaker Oil Prices; Offtake to Double in 2020,
67,"February 2, 2020 03:01 pm ET",Venezuela Puts the Crypt in Cryptocurrency,"The PetroApp, half a petro bonus, and other tales of Maduro regime funny money."
68,"February 2, 2020 02:06 pm ET",Joe Biden Does Not Support a Fracking Ban,Rep. Conor Lamb and Harold Hamm on the politics of oil and natural gas drilling.
69,"February 2, 2020 11:10 am ET","Emerging and Growth Markets, February 1st 2020",A weekly roundup of key news affecting emerging and growth markets from the Wall Street Journal and beyond.
70,"February 2, 2020 08:00 am ET",What the Stock Market May Be Missing About the Coronavirus ,"So far the impact on U.S. assets has been muted, but there are reasons to fear that investors are being complacent. "
71,"February 1, 2020 09:00 am ET",Does Your Razor Need a Gender? ,More consumer goods makers are eliminating gender traits from their marketing as shoppers question their value.
72,"January 31, 2020 07:18 pm ET",Elizabeth Warren’s Gas Royalties,She talks as if oil stains everything it touches. What about her family’s Oklahoma gas rights?
73,"January 31, 2020 05:39 pm ET",Dow Drops 600 Points on Global Growth Concerns  ,"Fresh economic data and the viral outbreak in China fanned worries about global economic growth, weighing on stocks around the world to end the week."
74,"January 31, 2020 05:36 pm ET","Energy Stocks Are Black Eye on the S&P 500, Again ","Energy was the S&P 500’s worst-performing sector each of the past two years—and so far, 2020 isn’t looking any better. "
75,"January 31, 2020 05:20 pm ET",Exxon’s Growth Gambit Failing to Yield Higher Profits,"The energy giant is still struggling to bolster its bottom line, nearly two years into a plan to substantially boost oil and gas production by spending more than rivals."
76,"January 31, 2020 02:01 pm ET",Reviving Syria’s Economy Is an Uphill Battle for Assad After Years of War ,"A plunging currency has sent inflation soaring and has kindled rare and risky demonstrations against the regime, with Syrians protesting sharp increases in the cost of food, medicine and transportation."
77,"January 31, 2020 08:42 am ET",Fed Framework Review Clouds Rate Outlook; More Yield-Curve Signals; BOE Holds Steady on Eve of Brexit    ,The Federal Reserve’s review of its monetary policy framework could lead to a shift in officials’ interest-rate stance this year even if the economic outlook doesn’t change.  
78,"January 31, 2020 05:24 am ET",The Daily Shot: U.S. Buying Climate Index Hits Record High,
79,"January 30, 2020 06:20 pm ET",Maduro Gives Economy a Freer Hand to Keep His Grip on Venezuela,"Venezuela’s staunchly socialist leaders, battling to stave off economic collapse and hold on to power, are looking for a little help from an unlikely source: the free market."
80,"January 30, 2020 04:13 pm ET",Commodities Slump on Fears Coronavirus Will Dent Chinese Demand,"Commodities including crude oil and copper fell Thursday, extending their recent slide on concerns that the worsening coronavirus outbreak would pare Chinese demand for raw materials. "
81,"January 30, 2020 03:41 pm ET",Commodities Traders Face Limits on Speculative Positions Under U.S. Proposal ,"Federal regulators proposed position limits in markets for commodities such as gold, sugar and crude oil while leaving exchanges with considerable leeway in deciding how to contain speculative bets. "
82,"January 30, 2020 12:25 pm ET",Shell Eyes More Asset Sales as Profit Falls Sharply,Royal Dutch Shell said it could ratchet up divestments as it reported a sharp drop in profit for 2019.
83,"January 30, 2020 09:29 am ET","Fed Holds Benchmark Rate Steady, Tweaks IOER; Jerome Powell Transcript; Coronavirus Spreads, May Pose Global Growth Risks    ",The Federal Reserve didn’t deliver any surprises yesterday as it kept its benchmark interest rate steady while tweaking two other key rates to help maintain control over short-term rates.  
84,"January 30, 2020 08:00 am ET",Coronavirus Hits Emerging Markets,Investors are pulling back from bets on commodities and emerging markets dependent on Chinese consumption as the coronavirus outbreak spurs fresh concerns about global growth.
85,"January 30, 2020 06:40 am ET","Newsletter: Coronavirus Spreads, Fed Holds Steady",Your daily economics newsletter from The Wall Street Journal.
86,"January 30, 2020 04:57 am ET",The Daily Shot: The Yield Curve Is About to Invert Again,
87,"January 30, 2020 03:52 am ET","Prospex Oil & Gas to Raise GBP720,000 for Spanish Acquisition",
88,"January 29, 2020 08:11 am ET","No, Banks Don’t Hold the Key to Climate Change ","Environmentally conscientious bankers and investors are rushing to get on the right side of history by shunning coal, Canadian oil sands and arctic drilling. But for all its attractive symbolism, divestment isn’t going to shrink the fossil-fuel industry. "
89,"January 29, 2020 06:06 am ET",Oilex Shares in London Rise After Sale of Cooper-Eromanga Interests,
90,"January 29, 2020 02:21 am ET",Zenith Energy Raised NOK11.1 Mln in Private Placement in Norway,
91,"January 29, 2020 12:01 am ET",Oil Swings as Investors Grapple With Coronavirus Uncertainty    ,U.S. crude futures slipped amid worry that the virus would dent demand from China and the report of a larger-than-expected build in domestic stockpiles.  
92,"January 28, 2020 06:44 pm ET",‘The Bridge’ Review: A Pipeline Joining East and West,"How ingenuity, determination and the logic of commerce overcame geopolitics in the Russia-Europe natural-gas trade."
93,"January 28, 2020 04:02 pm ET",Corn Futures Rebound on New Signs of Demand,
94,"January 28, 2020 03:07 pm ET",Gold Stays Steady as Coronavirus Fears Linger ,"Gold prices hovered near their highest level since April 2013, preserving a monthslong rally that has seen investors flock to the safe-haven metal with uncertainty about geopolitics and now the coronavirus swinging markets. "
95,"January 28, 2020 08:33 am ET",Reasons Abound for Markets to Worry About the Election     ,"The world’s business elite are convinced that Donald Trump will win a second term in the White House in November, and investors seem to believe that there’s little risk that they end up as victims of the U.S. election.  "
96,"January 28, 2020 07:57 am ET",Africa Debt Boom May Store Up Trouble for the Future ,"African countries have loaded up on dollar debt, fueling fears that a tightening of global financial conditions could trigger borrowing problems in coming years. "
97,"January 28, 2020 04:55 am ET",SDX Finds Recoverable Gas Reserves in Morocco,
98,"January 28, 2020 04:22 am ET",The Daily Shot: Fund Managers Stung by Commodities,
99,"January 27, 2020 09:44 pm ET",Stocks Drop on Coronavirus Fears ,"The Dow industrials fell more than 450 points and crude oil slumped as the coronavirus spread from China to other countries, intensifying concerns it would deliver a fresh setback to the outlook for world economic growth."
100,"January 27, 2020 07:03 pm ET",Market Decline Threatens Predictions for Calm Earnings Season,"Fears about the coronavirus broke the sleepy stretch in markets, catching many investors off-guard, especially before a busy week of corporate earnings."
101,"January 27, 2020 04:24 pm ET",Energy Company Southland Royalty Files For Bankruptcy ,"Southland Royalty Co., an oil-and-gas company that has received more than $1 billion in capital commitments from private-equity firm EnCap Investments, is preparing to file for bankruptcy protection, said people familiar with the matter. "
102,"January 27, 2020 03:13 pm ET","Oil, Copper Drop on Coronavirus Fears","The prices of crude oil and copper slumped amid heightened fears that the spread of the coronavirus could erode demand in China, the world’s largest consumer of industrial commodities."
103,"January 27, 2020 01:47 pm ET",Stocks Are on Course for Biggest Move Since October,The rapid spread of the coronavirus over the past week has shattered the stock market’s calm.
104,"January 27, 2020 01:40 pm ET",SARS Provides a Faulty Road Map for Oil Prices ,"The impact of the Wuhan coronavirus on oil prices may be sharper than that of the SARS outbreak, even if the epidemic is milder. "
105,"January 27, 2020 12:57 pm ET",Sanchez Energy Creditors Seek to Sue For Hundreds of Millions ,"The group of unsecured, junior creditors is seeking standing to prosecute claims surrounding four oil-and-gas leases owned by Sanchez, according to papers filed in the U.S. Bankruptcy Court in Houston. The leases are claimed by the Royal Bank of Canada, the collateral trustee for Sanchez’s senior secured bondholders. "
106,"January 27, 2020 12:46 pm ET",Iran’s Leaders Work to Heal Rifts Opened Amid Protests,"After another flare-up of public protests, the Iranian establishment is working to mend internal rifts that have broken into the open as it faces greater pressure than at any point since the 1979 Islamic Revolution."
107,"January 27, 2020 11:30 am ET",AGS WEEK AHEAD: Coronavirus Hits Grain and Sugar Prices; Forecasts of Large Brazilian Crop Cool Coffee; Cocoa Outperforms Amid Dry Weather in West Africa,
108,"January 27, 2020 09:25 am ET","PE Daily: Francisco, Hg Join Tech-Fund Capital Hunt | EnCap Portfolio Company Nears Bankruptcy | Tiger Global Bags $3.75 Billion    ","Limited partners have showered tech-focused private-equity funds with capital despite rising valuations in the sector, particularly for enterprise software companies.  "
109,"January 27, 2020 08:46 am ET",Energy Journal—U.S. Shale’s Age of Austerity,
110,"January 27, 2020 06:40 am ET",Newsletter: Coronavirus vs. the Economy,Your daily economics newsletter from The Wall Street Journal.
