,date,title,summary
107,"March 6, 2017 08:49 am ET",The Morning Download: CIOs Say AI Is Changing More Elements of Business ,"Artificial intelligence is a growing part of the every-day IT infrastructure of the corporate world for a variety of situations, including supply chain, policing, and security, CIOs at the annual WSJ CIO Network conference said last week."
108,"March 6, 2017 08:01 am ET",Fed Officials Indicate Rate Increase Likely | Bullard: Little Justification for March Increase |  Evans: Weak Inflation Can Hurt Credibility | What China’s Premier Left Unsaid | Torry’s Take: A Week is a Long Time in Monetary Politics,"The Wall Street Journal’s central banking newsletter for Monday, March 6, 2017"
109,"March 6, 2017 07:58 am ET","Capital Journal Daybreak: Trump’s Wiretap Claim, More",
110,"March 6, 2017 07:30 am ET",Quantum Targets More Than $4 Billion for Energy-Patch Plays ,The oil-and-gas investor aims for an April first close for its new fund.
111,"March 6, 2017 07:11 am ET",The Morning Ledger: European Exit costs General Motors at least $4 Billion,General Motors has agreed to sell its European car brands Opel and Vauxhall to France’s Peugeot. Deutsche Bank is seeking to raise $8.5 billion through a share sale and Aberdeen Asset Management and Standard Life said they have agreed to the terms of an all-share merger.
112,"March 6, 2017 07:07 am ET",Oil Lifts Mood At Energy Meeting—Energy Journal,"Oil-industry Power Players Begin Gathering For CERAWeek, the Most Influential American Energy Conference."
113,"March 6, 2017 06:15 am ET",Fed Officials Indicate Rate Increase Likely | Bullard: Little Justification for March Increase |  Evans: Weak Inflation Can Hurt Credibility | What China’s Premier Left Unsaid | Torry’s Take: A Week is a Long Time in Monetary Politics,"The Wall Street Journal’s central banking newsletter for Monday, March 6, 2017"
114,"March 6, 2017 05:30 am ET","Kenyan Tea, a Reliable Export, Brews a Market at Home","Kenya exports more tea than any other nation, but for years Kenyans weren’t able to enjoy a cup of premium tea cultivated in their own country. One company is leading a movement to change that."
115,"March 6, 2017 02:57 am ET",Oil Seen Stuck in Mid-$50s Range ,"Analysts forecast that crude will remain stuck in its current tight-trading range in the mid-$50s a barrel until at least the spring, as the market continues to be pulled in opposite directions by OPEC output cuts and rising U.S. shale production. "
116,"March 5, 2017 09:37 pm ET",WSJ’s Daily Shot: The Scariest Chart About America’s Financial Future,
117,"March 5, 2017 08:35 pm ET","Oil Prices Fall on Concerns About U.S. Stockpiles, Output ","Oil prices are trading lower on Monday, pulled down by higher U.S. oil rig count and the likelihood of a U.S. interest rate increase later this month. "
118,"March 5, 2017 01:38 pm ET","Brought Down by Long Bust, Texas Oilmen Pray for Another Boom","A two-year oil slump has been hard on an American archetype—the Texas wildcatter. The Schillers of Houston have put their mansion on the market, sold some horses and are plotting a comeback; ‘What other choice is there?’"
119,"March 5, 2017 09:45 am ET",Bullish Commodity Bets Hit Record Highs,"Commodity prices are enjoying their best run in years, fresh evidence that investors are betting on a pickup in the global economy after years of sluggish growth and scant inflation. "
120,"March 5, 2017 07:00 am ET",Malaysia Airlines Is Back From the Brink ,"Malaysia Airlines, whose name became associated with two of aviation’s worst disasters in recent history, is winning back passengers. "
121,"March 4, 2017 11:59 pm ET",Oil-Price Rise Brightens Mood for Big CERAWeek Energy Conference,"The world’s energy leaders will descend on Houston next week for the most influential energy conference in the U.S., a gathering reshaped this year by the election of Donald Trump and a partial rebound in oil prices. "
122,"March 4, 2017 11:28 pm ET","Inflation Is Back, But Where It Goes From Here Depends on the Region","Inflation is back around the globe—even in Japan, long beset by falling prices. The question now is whether it will stick around."
123,"March 3, 2017 04:29 pm ET",Key Excerpts From Janet Yellen’s Speech,"Federal Reserve Chairwoman Janet Yellen signaled the central bank is likely to raise short-term interest rates at its March meeting, and suggested more increases are likely this year if the economy performs as expected. Here are key passages from a speech she delivered in Chicago."
124,"March 3, 2017 03:42 pm ET","As the Commodities Rally Slows, Currency Investors Get Creative","Investors have piled into currencies of commodities exporters as prices rose for everything from copper to wheat, but many of those rallies are slowing or reversing on renewed signs of U.S. dollar strength."
125,"March 3, 2017 03:35 pm ET",Oil’s Friday Rebound Can’t Cancel Out Weekly Loss ,Crude oil prices ended the week back in the middle of the range they have been mired in for two months as a rebound Friday couldn’t overcome big losses from the day before.
126,"March 3, 2017 02:22 pm ET",Caterpillar Raid Is a Wake Up Call    ,An escalating legal situation has emerged as a fresh risk for Caterpillar shareholders. That should be an occasion to reconsider some more routine business worries.     
127,"March 3, 2017 01:37 pm ET",U.S. Oil-Rig Count Climbs,"The number of rigs drilling for oil in the U.S. rose by seven in the past week to 609 rigs, according to oil-field services company Baker Hughes Inc."
128,"March 3, 2017 08:05 am ET",What to Watch in Fed Speeches | Powell: Case for March Increase ‘Has Come Together’ | Derby’s Analysis: Yellen Speech Could Explain Officials’ Shift | BOJ More Confident On | Hannon’s Take: A Jobs Mandate for the ECB,"The Wall Street Journal’s central banking newsletter for Friday, March 3, 2017"
129,"March 3, 2017 08:04 am ET",SEC’s Piwowar Blasts Fiduciary Rule | Fed Approves Morgan Stanley’s Revised Capital Plan | CFPB Raps Credit-Reporting Firms | Texas AG Scores Win Against SEC | Rubin’s Take: Hurdle to Deregulation—Banks Are Doing Well,"The Wall Street Journal’s financial regulation newsletter for Friday, March 3, 2017.​"
130,"March 3, 2017 07:57 am ET",The Morning Ledger: Foreign Investors Spurn China’s Markets,"Good morning. China is opening its financial markets more than ever to global investors, hoping the charm offensive will attract more money in a time of heavy capital outflows. But the anticipated flood of funds hasn’t materialized,"
131,"March 3, 2017 07:05 am ET","The 10-Point: Gerard Baker on Jeff Sessions’s Recusal, Snap’s IPO, New Home-Security Trends and More","A personal, guided tour to the best scoops and stories every day in The Wall Street Journal, from Editor in Chief Gerard Baker."
132,"March 3, 2017 06:53 am ET",SEC’s Piwowar Blasts Fiduciary Rule | Fed Approves Morgan Stanley’s Revised Capital Plan | CFPB Raps Credit-Reporting Firms | Texas AG Scores Win Against SEC | Rubin’s Take: Hurdle to Deregulation—Banks Are Doing Well,"The Wall Street Journal’s financial regulation newsletter for Friday, March 3, 2017.​"
133,"March 3, 2017 06:49 am ET",EPA Cuts Obama-Era Methane Disclosure Call—Energy Journal,"EPA Cuts Obama-Era Methane Disclosure Call. 
Methane Has Been Linked To Global Warming."
134,"March 3, 2017 06:16 am ET",What to Watch in Fed Speeches | Powell: Case for March Increase ‘Has Come Together’ | Derby’s Analysis: Yellen Speech Could Explain Officials’ Shift | BOJ More Confident On | Hannon’s Take: A Jobs Mandate for the ECB,"The Wall Street Journal’s central banking newsletter for Friday, March 3, 2017"
135,"March 3, 2017 06:14 am ET",Today’s Top Supply Chain and Logistics News From WSJ,"Delivering up-to-the minute news, analysis, interviews and explanatory journalism on logistics, supply-chain management, e-commerce and more"
136,"March 3, 2017 12:58 am ET",WSJ’s Daily Shot: Are the Frothy Markets Making the Rate Hike More Urgent?,
137,"March 3, 2017 12:09 am ET",Bank of Japan More Confident That Inflation Will Top 1%,"Japan’s central bankers feel more confident that consumer prices will rise faster as the economy rides the tailwinds of stronger U.S. growth and a weaker yen, people close to the bank tell The Wall Street Journal."
138,"March 2, 2017 09:05 pm ET",Saudi Aramco Cuts Most Crude Prices,Saudi Arabian Oil Co. has lowered prices for almost all of its crude grades for April delivery.
139,"March 2, 2017 08:47 pm ET","Oil Prices Recover, Oversupply Pressure Remains ","Crude oil prices rebounded in Asia Friday morning after slumping to a three-week low overnight, but pressure from increasing U.S. production is expected to keep a tight lid on prices. "
140,"March 2, 2017 08:25 pm ET",Inflation Returns to Japan,Japan’s consumer prices rise for the first time in more than a year in January as higher global oil prices give Prime Minister Shinzo Abe and the Bank of Japan a helping hand in their campaign to overcome deflation.
141,"March 2, 2017 06:27 pm ET",South Korea’s February Consumer Price Index Rises 1.9% on Year,South Korea’s headline Consumer Price Index rose 1.9% from a year earlier in February. 
142,"March 2, 2017 03:59 pm ET",Oil Hits Three-Week Low on Record-High Inventories,"Oil prices extended losses, with bearish sentiment fueled by the latest increase in U.S. crude stockpiles and production."
143,"March 2, 2017 03:34 pm ET","Was Aubrey McClendon a Billionaire, or Broke? ","A year after oil magnate Aubrey McClendon died in an auto crash, lawyers in Oklahoma City are sifting through the tangle of obligations and assets he left behind, trying to determine if he died a wealthy man—or swamped by debt. "
144,"March 2, 2017 11:29 am ET",Who’s Right: Warren Buffett or Larry Fink? ,Are shortsighted managers underinvesting in the American economy because they want to line the pockets of investors through share buybacks? 
145,"March 2, 2017 11:26 am ET",Canada GDP Growth Surprises With 2.6% Fourth-Quarter Gain,"Canada’s economy grew in the fourth quarter and exceeded expectations by a healthy margin, on the strength of consumer demand for automobiles and financial-services products, and a rebound in real-estate investment."
146,"March 2, 2017 10:33 am ET",Brigham Resources Closes $2.55 Billion Permian Asset Sale to Diamondback,"The oil and gas company is backed by Pine Brook Partners, Warburg Pincus and Yorktown Partners. The three private-equity firms invested $650 million in the company in 2013, when land prices in the southern Delaware Basin were much lower than they are today. "
147,"March 2, 2017 10:11 am ET","In Fight to Defend Currency, Nigeria Turns to Forex Police ","In a two-year battle to defend the value of its currency, Nigeria is resorting to a new weapon: armed foreign-exchange police."
148,"March 2, 2017 09:20 am ET",Eurozone Inflation Rises Above ECB’s Target,"The annual rate of inflation in the eurozone rose above the European Central Bank’s target for the first time in four years during February, driven higher by another rise in energy prices."
149,"March 2, 2017 09:15 am ET",Eurozone Inflation’s Hidden Resilience ,The common wisdom is that eurozone core inflation is weak. Another take is that it has proved resilient. 
150,"March 2, 2017 08:19 am ET",Brainard: Economy Supports Raising Rates Soon | Kaplan: Fed Should Start Increasing Rates | Key Inflation Close to Fed’s Target | Eurozone Inflation Above ECB’s Target | Torry’s Take: Prepare the Ides of March,"The Wall Street Journal’s central banking newsletter for Thursday, March 2, 2017"
151,"March 2, 2017 07:13 am ET",The Morning Ledger: Snap IPO Makes Investors Take a Leap of Faith on Financial Controls,"Shares of Snap will start trading today, the world’s largest brewer is eyeing further cost savings and Henkel has made a binding, $1.05 billion-bid for Darex Packaging Technologies."
152,"March 2, 2017 07:08 am ET",Exxon Looks To Shale Oil For Growth—Energy Journal,Exxon Plans To Expand Its Shale Oil Portfolio
153,"March 2, 2017 02:20 am ET",Malaysia Central Bank Keeps Benchmark Steady at 3%,"Malaysia’s central bank left interest rates unchanged, which was expected given recent signs of improvement in the economy, strengthening inflation and the likelihood of further policy tightening by the Fed. "
154,"March 1, 2017 11:01 pm ET",Exxon Mobil Turns to U.S. Shale Basins for Growth,"Exxon Mobil outlined an ambitious plan to turn to prolific U.S. shale basins for growth, showcasing how the oil giant now sees American production as a key to its future.  "
155,"March 1, 2017 08:13 pm ET",Oil Prices Decline on Record High Build in U.S. Crude Stocks ,"Oil prices fell further in Asian trade Thursday, depressed by the latest pick up in U.S. crude stockpiles and production. "
156,"March 1, 2017 05:34 pm ET",Why Energy Stock and Oil Investors Disagree,Energy shares and oil prices have fallen out of step.
157,"March 1, 2017 05:07 pm ET",EMAS Chiyoda Subsea Cleared to Spend Bankruptcy Loan       ,"Lawyers for bankrupt EMAS Chiyoda Subsea Ltd., whose ships construct offshore drilling projects, can begin spending a $90 million loan while the company comes up with a plan to outlast the energy downturn.  "
158,"March 1, 2017 04:08 pm ET","Fewer People at Risk for Man-Made Earthquakes, USGS Says","Fewer people in the central and eastern U.S. are now at risk from man-made earthquakes compared to a year ago, according to new maps identifying potential hazards by the U.S. Geological Survey. "
159,"March 1, 2017 03:47 pm ET",Stocks Surge as Global Outlook Brightens,"The Dow industrials surged more than 300 points to their first-ever close above 21000, underpinned by the Federal Reserve’s growing confidence in the U.S. economic outlook and by investor hopes that President Donald Trump will deliver policies that boost growth."
160,"March 1, 2017 03:39 pm ET",Big Game Hunt: Large Funds Drive U.S. Fundraising to $312.16 Billion,"Large funds helped drive overall U.S. private-equity fundraising in 2016 to $312.16 billion, with private funds posting their largest fundraising totals since 2008 and secondary funds generating a record fundraising amount. "
161,"March 1, 2017 03:39 pm ET",Oil Closes Lower        ,Oil prices closed lower as investors digested inventory data that did little to ease concerns over building supply in the U.S.
162,"March 1, 2017 03:07 pm ET",Avianca Shareholder Sues United Airlines Over Planned Partnership ,"A large shareholder of Avianca Holdings, one of the biggest airlines in Latin America, has filed a lawsuit in New York in a bid to prevent the Colombian carrier from completing a strategic partnership with United Airlines. "
163,"March 1, 2017 02:23 pm ET",EU Nears Final Talks on Emissions Trading ,"European Union officials are gearing for definitive negotiations on the future shape of the bloc’s emissions-trading system, a cornerstone of the EU’s efforts to curb global warming. "
164,"March 1, 2017 02:06 pm ET",A Surprising Clue About Oil Prices Today ,"Surging U.S. crude oil exports don’t mean that OPEC is winning, but a shift in customers would. "
165,"March 1, 2017 01:35 pm ET","Shipping Rivals Frontline, DHT to Talk Over Hostile Bid","Norwegian shipping companies Frontline and DHT will meet this month in a last-ditch attempt to find common ground over a takeover bid by Frontline, which so far has been rejected. "
166,"March 1, 2017 01:13 pm ET",Eni Returns to Profit Amid Corruption Probe,Eni returned to profit in the fourth quarter and promised to continue asset sales and cost cuts as Chief Executive Claudio Descalzi made his case for getting a new three-year term at the helm of the Italian oil and gas company.
167,"March 1, 2017 12:21 pm ET",U.S. Factory Activity Rose Briskly in February,"Sales at U.S. factories rose at the fastest rate in three years in February, another clue the economy is revving toward faster growth this year."
168,"March 1, 2017 10:44 am ET",No Policy Details? No Matter,"There was nothing new in the president's speech for investors who have bid up the price of everything from stocks to corporate bonds in hopes that less regulation, tax cuts and spending on infrastructure will boost the U.S. economy and corporate profits. It doesn't seem to matter."
169,"March 1, 2017 09:14 am ET",Canada Current-Account Deficit Narrows ,"Canada’s current-account deficit narrowed in the fourth quarter, as higher exports of energy products helped the goods balance to post its first surplus in more than two years. "
170,"March 1, 2017 08:04 am ET",Wessel: Economy Is Least of Yellen’s Challenges | Fed Officials: March Rate Increase ‘On The Table’ | Bullard: No Need to Raise Rates Very High | ECB to Stress-Test for Higher Rates | Douglas’s Take: BOE On Watch Over Borrowing,"The Wall Street Journal’s central banking newsletter for Wednesday, March 1, 2017"
171,"March 1, 2017 07:27 am ET",The Morning Ledger: President’s Speech Leaves Executives Wanting More Details,"Despite a continued lack of details, business leaders reacted positively to President Donald Trump’s speech on Tuesday. Snap will today price its IPO and the world's most indebted developer keeps piling it on."
172,"March 1, 2017 07:08 am ET",BP Aims to Become a 35 Bucks a Barrel Firm—Energy journal,BP Aims to Become a 35 Bucks a Barrel Company by 2021
173,"February 28, 2017 11:22 pm ET",WSJ’s Daily Shot: The Fed Is Saying It Loudly Now: March!,* US homebuyers left behind by rising prices. *Germany issues bonds at record low (negative) yields. * Russin stocks tumble on Trump-trade unwind.  * Saudi credit crunch? * SoftBank saves the day. * Oil vol hitting new lows.
174,"February 28, 2017 11:07 pm ET",Commodities Bump Helps Australia Keep Its 25-Year Streak ,"The longest ongoing streak without recession in the developed world just leapt over a big hurdle, though the Australian economy is by no means in the clear. "
175,"February 28, 2017 10:35 pm ET",What’s News: Business & Finance,What’s News: Business & Finance
176,"February 28, 2017 10:18 pm ET",BOJ Sato Urges Flexible Adjustments to 10-Year Yield Target,"The Bank of Japan should change its long-term interest rate target “flexibly” and let its government bond purchases shrink if the economy shows signs of strengthening, a board member said Wednesday. "
177,"February 28, 2017 09:15 pm ET",Oil Prices Caught Between U.S. Inventories Growth and OPEC Cut ,Oil prices saw meager gains in Asia trade Wednesday as the growth in U.S. crude inventories offset the hope that the market is tightening as a result of production cuts in the Middle East and Russia.  
178,"February 28, 2017 06:58 pm ET",S&P 500 Advanced 3.7% in February,The S&P 500 slipped Tuesday but notched its best month since March. Major U.S. stock indexes have risen for four consecutive months.
179,"February 28, 2017 06:29 pm ET",Post Oak Energy Invests $100 Million in Oil and Gas Company Saxet II Minerals,Saxet II is the second iteration of a business the private-equity firm first backed in 2014. The new iteration should face more challenges finding investments opportunities in the Permian Basin amid high exploration activity and intense competition for deals in the area.
180,"February 28, 2017 04:54 pm ET",Oil Prices End Lower on Creeping Production       ,Oil prices ended lower after failing to break out of the recent trading corridor amid creeping U.S. production growth and falling prices for gasoline and diesel.
181,"February 28, 2017 01:46 pm ET",BP Sets Break-Even Target at $35 a Barrel ,"BP laid out plans to drive its break-even oil price down to $35 to $40 a barrel by 2021, asserting that it can grow again and keep a lid on spending despite a massive bill from its Gulf of Mexico disaster six years ago. "
182,"February 28, 2017 01:42 pm ET",Offshore Venture EMAS Chiyoda Enters Chapter 11      ,Deep-water construction venture EMAS Chiyoda Subsea filed for chapter 11 bankruptcy in Houston after bank lenders froze its access to credit.   
183,"February 28, 2017 01:16 pm ET",Bank of Canada Expected to Keep Interest Rate Unchanged,"The Bank of Canada is expected to keep its key interest rate unchanged on Wednesday, as potential changes to U.S. trade policy overshadow a string of positive economic readings."
184,"February 28, 2017 01:13 pm ET","WSJ City’s Briefing: Trumpflation vs. Negative Rates, Philip Green Pays Up",
185,"February 28, 2017 12:26 pm ET",Will Big Wins Equal Big Payoff at Workday?    ,"Workday has shown it can land big clients—the key for investors is, at what cost."
186,"February 28, 2017 12:22 pm ET",Fish Importer Casts Worry Over Border Tax ,"Opposition to a border-adjustment provision in House Republicans’ tax plan can be heard loud and clear from companies like Fortune Fish & Gourmet, an importer of foods from overseas that says it would be hard-hit."
187,"February 28, 2017 10:13 am ET",A New Way to Look at Crazy Stock Valuations,James Mackintosh writes in the Journal that oil prices could be making stock valuations appear unusually high.
188,"February 28, 2017 10:04 am ET",Number of Distressed U.S. Retailers Rises,Moody’s says 14% of its retail names are sitting at the lowest level of the credit-rating spectrum
189,"February 28, 2017 09:40 am ET",Canadian Capital Spending to Rebound in 2017,"Capital expenditures in Canada are expected to edge upward in 2017 after two years of declines, Statistics Canada said Tuesday, as the energy sector rebounds from the swift fall in commodity prices."
190,"February 28, 2017 09:17 am ET",Norway’s Sovereign Wealth Fund Boosted by Strong Equity Investments ,"Norway’s sovereign wealth fund, the world’s biggest, returned 6.9% on its investments in 2016, boosted by a strong performance in its equity investments while management costs were kept at low levels despite expanding into new markets, it said. "
191,"February 28, 2017 08:27 am ET",Kaplan Says Rates Should Rise ‘Slowly and Patiently’ | BOJ Reveals Schedule for Bond Buying | BOE’s Hogg Faces Potential Conflict | China Allows Foreign Investors To Hedge | Blackstone’s Take: Swiss Franc Offers Insight on Political Risks,"The Wall Street Journal’s central banking newsletter for Tuesday, February 28, 2017"
192,"February 28, 2017 07:50 am ET",Commercial Real-Estate Prices Climb in France Ahead of Election ,Yield-hungry investors are driving commercial real-estate prices higher in France despite the possibility that the country’s next president could pull the country out of the eurozone. 
193,"February 28, 2017 07:24 am ET","The Morning Ledger: As White House Signals Rollback, SEC Advances Regulation Effort","The SEC continues its enforcement efforts, even though the new administration has indicated a rollback of existing regulation. Samsung's corruption worries continue and stock markets will digest President Donald Trump's address to Congress later today."
194,"February 28, 2017 07:06 am ET",Saudi Arabia Turns to Growing Asian Business—Energy Journal,Saudi Arabia's King Salman Is Touring Asia in a Bid to Strengthen Ties With the Region Ahead of a Planned IPO of the Kingdom's State-run Oil Company
195,"February 28, 2017 06:37 am ET",Today’s Top Supply Chain and Logistics News From WSJ,"Delivering up-to-the minute news, analysis, interviews and explanatory journalism on logistics, supply-chain management, e-commerce and more"
196,"February 28, 2017 06:23 am ET",Kaplan Says Rates Should Rise ‘Slowly and Patiently’ | BOJ Reveals Schedule for Bond Buying | BOE’s Hogg Faces Potential Conflict | China Allows Foreign Investors To Hedge | Blackstone’s Take: Swiss Franc Offers Insight on Political Risks,"The Wall Street Journal’s central banking newsletter for Tuesday, February 28, 2017"
197,"February 28, 2017 05:32 am ET",WSJ Wealth Adviser Briefing: Morgan Stanley’s Tax Flub,"WSJ Wealth Adviser highlights some of the top news and analysis for wealth advisers and their clients, with pieces today including Morgan Stanley's acknowledgment of mistakes that led a ""significant number” of wealth-management clients to underpay their taxes, the latest Watching Your Wealth podcast, and the latest Adviser Voice."
198,"February 28, 2017 12:01 am ET",J.P. Morgan Executives: Let the Good Times Roll ,"Executives at J.P. Morgan Chase & Co. struck an upbeat tone during the firm’s annual investor day, painting a picture of bank businesses mostly poised for growth. "
199,"February 27, 2017 10:46 pm ET",A New Way to Look at Crazy Stock Valuations ,The swinging price of oil has played havoc with forecasts for the economy and inflation over the past two years. Now it may also be messing with the heads of investors by pushing the most popular tool for U.S. stock-market valuation to the highest in more than a decade. 
200,"February 27, 2017 08:34 pm ET",Oil Trends Higher But Pressure Remains ,Oil prices crept higher in Asia Tuesday in thin volume as market players held back their bets ahead of more data points to trade on. 
201,"February 27, 2017 07:29 pm ET","GE Chief: Globalization Isn’t Over, It Is the End of the ‘Global Elite’",GE CEO Jeff Immelt said the conglomerate’s transformation over the past decade has enabled it to profit from increasingly important markets for its jet engines and power turbines.
202,"February 27, 2017 07:11 pm ET",Warren Buffett’s Berkshire Hathaway More Than Doubles Stake in Apple,"Warren Buffett said his Berkshire Hathaway more than doubled its stake in Apple since the start of the new year, making the Silicon Valley giant one of Berkshire’s biggest equity holdings."
203,"February 27, 2017 06:43 pm ET","Energy, Financial Sectors Lift Stocks","U.S. stocks rose, boosted by gains in energy and financial shares. Overall moves were relatively muted, with stocks starting the session lower then drifting higher."
