,date,title,summary
96,"April 30, 2020 11:44 am ET",Carlyle Posts First-Quarter Loss,"Carlyle Group Inc. reported a first-quarter loss, as the coronavirus pandemic hurt the value of its investments. However, the firm’s private-equity portfolio proved more resilient than the broader market."
97,"April 30, 2020 11:40 am ET","Chevron, BP, Shell Told to Cut Oil Output After Global Pact",The world’s largest energy companies are negotiating production cuts with oil-rich nations ahead of Friday’s deadline for OPEC and the Group of 20 countries to sharply reduce output—reductions that will limit these firms’ options for coping with the crude-price rout.
98,"April 30, 2020 11:18 am ET","Older Vapers Are Turning Back to Cigarettes, Marlboro Maker Says",Altria Group said it has paused the rollout of its new heated tobacco product because of the coronavirus pandemic and expects cigarette smokers to trade down to cheaper brands as an economic downturn takes hold.
99,"April 30, 2020 10:10 am ET",Mexico’s Economy Shrinks as Coronavirus Takes Toll,"Mexico’s economy posted a sharp contraction in the first quarter, with industrial output and services falling from the previous quarter as the country felt the first economic effects of the coronavirus pandemic."
100,"April 30, 2020 09:47 am ET",Shell’s Dividend Cut Is Harsh but Fair    ,The oil major’s decision to reduce its dividend for the first time since World War II is a sensible long-term move in a crisis of uncertainty for the industry.
101,"April 30, 2020 08:53 am ET",Small Oil Drillers Are Turning Off Taps More Quickly Than Anticipated,"From Texas and Wyoming to North Dakota, small U.S. oil companies are shutting off wells faster than expected, as prices fall below what it costs them to pump crude out of the ground."
102,"April 30, 2020 08:38 am ET",Shell Cuts Dividend for First Time Since World War II ,"Royal Dutch Shell cut its dividend for the first time since World War II, as a steep drop in oil demand upends what has long been a fundamental bargain between oil majors and their investors"
103,"April 30, 2020 08:29 am ET","Pro Bankruptcy Briefing: Lawsuits Mount Against SBA | Hertz Misses Lease Payment, Preps for Bankruptcy | AMC Blasts Universal Plan to Release New Films Digitally    ","At least a dozen lawsuits have been filed in courts across the U.S. that seek access to Paycheck Protection Program loans for businesses restructuring in chapter 11. Rental car company Hertz Global Holdings Inc. is preparing for a possible bankruptcy filing after failing to make lease payments, writes WSJ Pro’s Alex Gladstone and colleague Cara Lombardo. And AMC Entertainment Holdings Inc., already reeling from closing its theaters because of the coronavirus pandemic, blasted Universal Pictures’ plan to experiment with releasing new movies on digital platforms.  "
104,"April 30, 2020 08:23 am ET",Powell Says Congress Will Need to Spend More; Fed Braces for Slow Recovery; Mnuchin: U.S. Aims to Recover Funds From Fed Programs    ,"As official data showed the U.S. economy contracted at an annual rate of 4.8% in the first quarter, Fed Chairman Jerome Powell delivered an uncharacteristically blunt call for more spending to prevent deeper damage from the coronavirus pandemic. His comments underscored the Fed’s cautious view about the likely pace of the recovery. Meanwhile Treasury Secretary Steven Mnuchin said the government’s base case scenario is that it will recover the money it committed to the Fed’s lending programs. Today, attention turns to the European Central Bank’s policy statement and the latest U.S. unemployment numbers.  "
105,"April 30, 2020 08:19 am ET",Stock Market Surge Isn’t as Crazy as It Seems ,The disconnect between the stock market message of glad tidings to capitalists and the economy’s slump into the worst performance since the Great Depression is unmissable. Are investors making a horrible mistake?
106,"April 30, 2020 07:19 am ET",Trump’s Trade Deal With China Is Another Coronavirus Victim,The coronavirus is exposing the perils of trade deals based on numerical targets rather than tariff reductions or concessions on economic policy.
107,"April 30, 2020 07:00 am ET","Tesla: Too Fast, Too Furious ",Wall Street keeps betting that Tesla and Elon Musk can keep defying financial gravity. Its latest results will stoke that confidence for now. 
108,"April 30, 2020 06:02 am ET","WSJ Wealth Adviser Briefing: Aviation Crisis, Insurance Fight, Luxury Property","The downsizing of the aviation industry could be a permanent response to what may be years of depressed demand; the legal fight between insurers and businesses has expanded, and the virus hasn't stopped wealthy homeowners from listing their luxury properties."
109,"April 30, 2020 06:00 am ET",Saudi Arabia Set Its Sights on English Soccer. The Premier League Wasn’t Prepared.,"Newcastle United, a hard-luck English club, didn’t fit the typical profile for Saudi investment. But with the takeover, it’s set to inherit all of the kingdom’s controversies."
110,"April 30, 2020 05:59 am ET",The Daily Shot: How Will Small Businesses Use Their PPP Funds?,
111,"April 29, 2020 08:45 pm ET",Trump Administration Remains Hopeful on China Trade Pact as Doubts Grow,"A senior U.S. trade official expressed confidence that Beijing will meet its obligations under the trade deal with Washington, despite fallout from the coronavirus and doubts by experts about China’s ability to meet purchase targets."
112,"April 29, 2020 08:20 pm ET",Fed’s Powell Says More Spending Will Be Needed From Congress,Fed Chairman Jerome Powell said the U.S. economy would need additional spending from Congress and the White House to ensure that a robust recovery could take hold following a broad and deep deterioration from the coronavirus pandemic.
113,"April 29, 2020 05:39 pm ET",U.S. Economy Shrank at 4.8% Pace in First Quarter,"The U.S. economy shrank at a 4.8% pace in the first quarter as the coronavirus spread, the steepest contraction since the last recession."
114,"April 29, 2020 05:18 pm ET",Stocks Rise on Hopes for Coronavirus Treatment,The S&P 500 and Dow industrials rallied on hopes of progress for a coronavirus treatment and as Federal Reserve Chairman Jerome Powell said the central bank is in no hurry to end its economic stimulus. 
115,"April 29, 2020 05:06 pm ET","Coronavirus Turmoil, Free Trades Draw Newbies Into Stock Market ",Enticed by an industrywide move last year to zero-commission trading—and with more time on their hands as many work from home—individual investors have flocked to platforms such as TD Ameritrade and E*Trade.
116,"April 29, 2020 05:03 pm ET",Transcript: Fed Chairman Jerome Powell’s Postmeeting Press Conference,"Federal Reserve Chairman Jerome Powell discussed the coronavirus pandemic, its effect on the economy and the central bank’s response to the crisis during an online press conference following the Fed’s policy meeting."
117,"April 29, 2020 05:01 pm ET","Inventory Buildup Helps, Hurts Paints and Coatings Maker PPG","Managing inventory levels during the coronavirus pandemic has been a priority for finance executives across industries. At PPG Industries, a buildup in inventory is helping and hurting."
118,"April 29, 2020 03:14 pm ET",Oil Prices Climb After Inventories Rise Less Than Expected,Crude-oil prices climbed after data suggested the U.S. may not run out of space to store its glut of crude as quickly as previously feared. 
119,"April 29, 2020 11:50 am ET",Democrats Should Support America’s Oil Industry,The alternative is giving more power to Putin and a deeper U.S. entanglement in the Middle East.
120,"April 29, 2020 11:20 am ET",Newsletter Special Edition: The Expansion Is Over,Your daily economics newsletter from The Wall Street Journal.
121,"April 29, 2020 11:14 am ET",Russia’s Aging Infrastructure Threatens Oil Output Pact ,Russia’s adherence to a hard-fought oil production deal with Saudi Arabia and the U.S. could be imperiled by its aging industrial infrastructure and the unique challenges of winding down a network of wells across its vast landmass.
122,"April 29, 2020 10:10 am ET",Coronavirus Isn’t Stopping Some Wealthy Homeowners From Listing Their Luxury Properties,"Some are selling out of necessity, while others see an opportunity to list their homes in an otherwise crowded spring real-estate market."
123,"April 29, 2020 09:55 am ET",Investors Pin Hopes on ECB Buying Junk Bonds,"Investors await indications from the European Central Bank on Thursday that it could include sovereign and corporate bonds that have recently been downgraded to junk status within its bond-purchase programs, preventing another wave of selling. "
124,"April 29, 2020 09:28 am ET",PE Daily: Post Oak Energy Eyes Oil Deals | BlackRock Bolsters Cofense | Orion’s Virtual Deal-Making Works    ,"With federal money flying in all directions to ward off the calamitous effects of the coronavirus pandemic, we might have expected politicians from the left to wade in and try to further limit the workings of markets. Two champions of such campaigns, Massachusetts Sen. Elizabeth Warren and New York Rep. Alexandria Ocasio-Cortez, obliged on Tuesday. The Democrats called on lawmakers to ban most mergers and acquisitions until the Federal Trade Commission says it’s OK to resume. Ostensibly, it’s about the pandemic. But for Sen. Warren at least, it provided another chance to brand private equity as vulture capitalism.  "
125,"April 29, 2020 07:27 am ET",Developing Countries Draw Down Reserves to Shield Currencies,"Emerging-market countries last month depleted their foreign-exchange reserves at the fastest pace since the global financial crisis to contain a plunge in their currencies, leaving some nations vulnerable to further shocks."
126,"April 29, 2020 07:00 am ET",Post Oak Energy Ready to Shop for Oil Fields Again Amid Depressed Market,"“This is a very significant opportunity for energy private-equity funds that have a fair amount of dry powder,” said Frost Cochran, a Post Oak managing director and its founding partner. "
127,"April 29, 2020 06:02 am ET","WSJ Wealth Adviser Briefing: Junk Bonds, Dividend Suspensions, Roomy Airplanes","Bargain hunters picked up deb of riskier companies, firms have suspended their dividends at the fastest pace in years, and the huge decline in air travel made for plenty of room on flights."
128,"April 29, 2020 12:01 am ET",What’s News: Business & Finance,What’s News: Business & Finance
129,"April 28, 2020 06:32 pm ET",‘Bluffing Texas Style’ Review: Forgeries and Fires,Johnny Jenkins was that irresistible type—a Wild West con man you couldn’t help but like and almost admire while he was cheating you.
130,"April 28, 2020 05:02 pm ET","Junk Bonds Bounce Back, Raising Hopes—and Concerns",A rally in corporate debt is enabling riskier companies to raise much-needed cash while fueling debate over whether investors have grown overly optimistic about the economy.
131,"April 28, 2020 04:42 pm ET",U.S. Stocks Tick Modestly Lower,"Equities edged lower Tuesday as more states prepared to relax coronavirus-containment measures, though a resurgence of economically sensitive shares suggested growing optimism among investors about the path forward."
132,"April 28, 2020 04:41 pm ET",API Data Seen Showing Rise in Oil Supplies -- Market Talk,
133,"April 28, 2020 03:34 pm ET",Oil Prices Fall After Swinging Wildly,"Dysfunction in the crude-oil market intensified, sending the most popularly traded U.S. oil contract to a fresh low before it recovered somewhat."
134,"April 28, 2020 12:19 pm ET",HSBC’s Loan Losses Hint at Tougher Times for Banks,HSBC’s Asian focus gives it a slight lead over its European and U.S. peers in understanding the impact of coronavirus shutdowns. Its first-quarter numbers stand as a warning.
135,"April 28, 2020 09:33 am ET",BP Racks Up $6 Billion in New Debt in Three Months Amid Pandemic ,"BP said debt rose sharply and warned of falling production and a worsening outlook for refining margins, offering a first look at how the new coronavirus pandemic is straining the balance sheets of the world’s largest oil companies."
136,"April 28, 2020 09:16 am ET",PE Daily: KKR Invests $100 Million in Supply-Chain Software | Constitution Closes $1 Billion Ironsides V    ,"Although some states are taking steps to ease lockdown restrictions, here in Massachusetts most of us are hunkered down as cases continue to surge. Exactly how many people will feel comfortable venturing back into the world even after restrictions loosen remains to be seen. Certainly, the economic fallout from the pandemic and uncertainty surrounding its spread has kept private-equity deal making muted at best.  "
137,"April 28, 2020 08:51 am ET",The Fed Is Reshaping Central Banking; More U.S. Local Governments Eligible for Lending Program    ,"As Federal Reserve officials begin their two-day policy meeting, the Journal’s Nick Timiraos and Jon Hilsenrath look at how the Fed, whose portfolio of bonds, loans and new programs will swell to between $8 trillion and $11 trillion from less than $4 trillion last year, is stretching the boundaries of central banking. Meanwhile, the Fed said it would broaden the number of local governments from which it will buy debt through a forthcoming lending program to help them address the coronavirus pandemic, and some states began taking steps to reopen their economies.  "
138,"April 28, 2020 07:40 am ET",UBS Profit Jumps Despite Coronavirus Disruption  ,Swiss lender UBS said profit rose sharply in the first quarter as its focus on lending to the world’s wealthy and Swiss customers cushioned it from the blow felt by other global lenders from the coronavirus. 
139,"April 28, 2020 06:46 am ET","Newsletter: Incentives, the Fed and Oil",Your daily economics newsletter from The Wall Street Journal.
140,"April 28, 2020 06:02 am ET","WSJ Wealth Adviser Briefing: Reaching for Yield, Deutsche Bank’s Journey, Online Night Spots","Investors snapped up asset-backed securities despite recession concern and falling consumer spending; Deutsche Bank warned that its capital buffers will be slimmer than hoped this year, and some nightlife venues continued to operate online."
141,"April 28, 2020 05:58 am ET",The Daily Shot: Crude Oil Under Pressure Again as Global Inventories Approach Physical Storage Capacity,
142,"April 27, 2020 08:13 pm ET",Venezuela Appoints Alleged Drug Trafficker as Oil Minister ,Venezuela President Nicolás Maduro on Monday appointed a close ally who is accused by the U.S. of drug trafficking to lead the nation’s decaying oil industry. 
143,"April 27, 2020 06:05 pm ET",Diamond Offshore Bondholders Eager to Swap Debt for Equity,"Bondholders are eager to back Diamond Offshore Drilling’s turnaround, in which they would take over the rig operator that filed for chapter 11 protection Sunday. "
144,"April 27, 2020 04:18 pm ET",U.S. Stocks Climb as Countries Begin to Reopen Economies,"The Dow and S&P 500 rose, with investors betting that stimulus measures and the easing of coronavirus-lockdown measures around the world could help kick-start economic activity. "
145,"April 27, 2020 03:46 pm ET",Diamond Offshore Files for Chapter 11 Bankruptcy ,"The Loews-owned contract driller, which recently skipped a payment to bondholders, says the oil-price war and coronavirus pandemic forced it to seek protection from creditors. "
146,"April 27, 2020 03:07 pm ET",Corn Drops on Lingering Energy Pressure,
147,"April 27, 2020 03:03 pm ET",Oil Slides With Rising Glut Spooking Investors,"Crude-oil prices fell as producers scrambled to shut down wells before the world’s crude storage capacity reached its limit, with WTI futures down more than 20%. "
148,"April 27, 2020 02:11 pm ET",Ship Orders Crash as Coronavirus Takes a Toll on Seaborne Trade,"The economic fallout from coronavirus restrictions helped cut investment in shipbuilding to its lowest level in 11 years in the first quarter, with work at Asian shipyards nearly halted and owners holding back on orders as global demand for goods nosedived."
149,"April 27, 2020 01:57 pm ET",‘Frac Holiday’ Means Prolonged Pain for Oil Industry,Last week energy speculators got roasted by the plunge in U.S. oil futures prices to negative $40 a barrel as they were forced to take a loss rather than accept physical delivery. Those in the industry already were aware that a crunch was coming.
150,"April 27, 2020 11:19 am ET","Oil Slump, Coronavirus Create a Perfect Storm for Nigeria’s Economy",The crash in oil prices and the economic fallout from the coronavirus pose what could be an existential threat for Africa’s largest economy and biggest crude producer.  
151,"April 27, 2020 11:06 am ET",The Federal Reserve Is Changing What It Means to Be a Central Bank,"By lending widely to businesses, states and cities, the Fed is breaking taboos about who gets money to prop up a frozen U.S. economy, risking a political backlash down the line."
152,"April 27, 2020 10:30 am ET",The Diverging Fortunes of France’s State-Backed Car Makers    ,"Investors are relieved that Renault will take up a guaranteed loan from the French government, but doubts may follow. It is revealing that France’s other car maker, Peugeot, turned down a similar offer."
153,"April 27, 2020 08:39 am ET",Pro Bankruptcy Briefing: SBA Bars Bankrupt Companies From Stimulus | J.C. Penney’s Long March Toward Bankruptcy | Rental Car Co. Hertz Hires Restructuring Advisers    ,"The Trump administration is blocking bankrupt companies from tapping small business stimulus funds under the Paycheck Protection Program, writes WSJ Pro’s Jonathan Randles.  J.C. Penney & Co. has been battered by e-commerce and the slow death of the nation’s malls, but the coronavirus may land the knockout blow on the department store chain, according to WSJ Pro’s Andrew Scurria. And Hertz Global Holdings Inc. has hired advisers for talks with lenders on restructuring the company’s $17 billion of debt.  "
154,"April 27, 2020 08:32 am ET",Return of TALF Could Stir Debate; How the Fed Saved a Cruise Line; BOJ to Boost Corporate-Debt Purchases    ,"As we look ahead to the Fed’s policy meeting and this week’s U.S. GDP figures, investors are also eyeing the return of a Fed program that produced big profits during the last financial crisis—and could spark debate over how much Wall Street benefits from Washington’s emergency lending efforts. The Journal takes an in-depth look at how the Fed’s interventions threw a lifeline to one company reeling from the impact of the coronavirus pandemic: cruise operator Carnival Corp. Outside the U.S., the Bank of Japan said it would nearly triple its purchases of corporate debt.  "
155,"April 27, 2020 08:00 am ET",Soybeans Press Lower as Bears Dominate -- Technical Analysis,
156,"April 27, 2020 07:00 am ET",BlackGold Capital Seeks $500 Million to Buy Energy Bonds ,"BlackGold Capital Management plans to raise $500 million to buy energy bonds, joining other investment firms that see a chance to profit from depressed publicly traded energy securities."
157,"April 27, 2020 07:00 am ET",GE’s Turnaround Hinges on Aviation Industry Hobbled by Coronavirus ,The pandemic’s crippling of the airline industry is delaying General Electric’s efforts to turn around operations and pay down debts.
158,"April 27, 2020 06:42 am ET","WSJ Wealth Adviser Briefing: Developing Country Debt, Credit Card Troubles, Las Vegas Return","Investors have been buying up debt from stronger developing countries; credit-card customers and lenders braced for the impact of defaults, and Las Vegas struggled with how to reopen."
159,"April 27, 2020 06:09 am ET","The Daily Shot: So Far, About 5% of Small Businesses Received Their PPP Funds",
160,"April 27, 2020 05:30 am ET",The Reach for Yield Is Alive and Well,Investors are snapping up complex asset-backed securities tied to markets considered most vulnerable to the coronavirus-driven economic slump.
161,"April 27, 2020 04:24 am ET",Green Energy Won’t Slip on Cheap Oil    ,"As oil prices spiked in the late 1970s, then U.S. president installed solar panels on the roof of the White House. Historically, expensive crude spurred experiments to develop alternative energy sources and falling prices reversed the trend. But times have changed.  "
162,"April 26, 2020 03:49 pm ET",What Shape Will the Rebound Take?,"Don’t count on a V-shaped recovery. Up, down, up and then flat is more likely, alas."
163,"April 26, 2020 10:00 am ET",First-Quarter GDP Will Be Bad—With Worse to Come,"The U.S. is expected to report on Wednesday the country just saw the biggest quarterly economic contraction since early 2009, and forecasters warn the GDP figures will likely provide a preview of worse to come."
164,"April 26, 2020 08:00 am ET","In Another Hit for Farmers, Coronavirus Crashes Ethanol Market ","The rate of ethanol output in the U.S. has dropped to a record low, hurting farmers who are still reeling from last year’s unrelenting rains. "
165,"April 26, 2020 05:30 am ET",Stocks and Oil Send Conflicting Signals,"The S&P 500 continues to rise despite an unprecedented freeze in global economic activity and an oil-price crash, a divergence that makes some investors skeptical the gains can continue."
166,"April 25, 2020 10:18 am ET","Emerging and Growth Markets, April 25th 2020",A weekly roundup of key news affecting emerging and growth markets from the Wall Street Journal and beyond.
167,"April 25, 2020 08:03 am ET",What Negative Prices Tell Us About the Future ,"Negative oil prices are merely the weirdest illustration of the destruction of demand in the economy—and fit with two longstanding negative prices in Europe, for money and for electricity."
168,"April 24, 2020 07:23 pm ET","Noble Energy, Shake Shack, J.C. Penney: Stocks That Defined the Week",Here are seven major companies whose stocks moved on the week’s news.
169,"April 24, 2020 06:23 pm ET",A New Problem Is Brewing in the Beer Industry: One Million Kegs Are Going Stale,"The coronavirus pandemic stranded unused beer in stadiums, concert halls, restaurants and bars. Now brewers and distributors facing sizable losses have to figure out what to do with it all."
170,"April 24, 2020 04:25 pm ET",Stocks Suffer Modest Weekly Losses,U.S. stocks climbed at the end of a week when shares were battered by a collapse in oil prices and fresh signs of a severe economic downturn.
171,"April 24, 2020 03:31 pm ET",Panera’s Grocery Aisle? Electric Vans for Amazon? Diversification Is Making a Comeback.,Business leaders are employing a retro survival technique during the pandemic.
172,"April 24, 2020 03:16 pm ET",Behind Oil-Market Gyrations: Few Places Left to Store Unwanted Crude    ,"As coronavirus saps demand, tankers stack up off California coast, near Malta and in Caribbean. Overwhelmed storage facilities help explain negative crude prices."
173,"April 24, 2020 10:49 am ET",Today’s Logistics Report: Building Bigger Ships; Falling Freight Rail; Amazon Eyes on Sellers,Today’s Top Supply Chain & Logistics News from WSJ.
174,"April 24, 2020 09:08 am ET",Russia Cuts Interest Rate to Shore Up Faltering Economy,Russia’s central bank cut its benchmark interest rate in a move to shore up the country’s economy as it lurches toward a deep recession due to depressed oil prices and shutdowns over the spread of the coronavirus. 
175,"April 24, 2020 08:46 am ET",Reading Up for the Fed Meeting; Fed to Disclose Details of Lending Programs    ,"Today we look at some of the questions facing the Fed ahead of its policy meeting next week. Meanwhile, the central bank said it would start disclosing the borrowers, loan amounts and interest rates on funding from several new lending programs. And as the Fed’s balance sheet swells, Michael S. Derby writes that officials don’t seem concerned about inflation. Outside the U.S., Japan’s central bank has its own policy meeting Monday. Increased purchases of corporate bonds could be on the agenda, the Journal reports.  "
176,"April 24, 2020 08:00 am ET",Soybeans Climb in Corrective Bounce -- Technical Analysis,
177,"April 24, 2020 07:00 am ET",Stock-Market Rally Fizzles in Week When All Eyes Focused on Oil,"This week brought a halt, at least temporarily, to the stock market’s rebound, and equities are back to their erratic selves. Here are the week’s winners and losers."
178,"April 24, 2020 05:50 am ET","The Daily Shot: As the Economy ‘Reopens,’ Getting Employees to Return to Work Will Be a Challenge",
179,"April 24, 2020 05:44 am ET",Yemen’s Houthis Reject Peace Talks as Saudi-Led Truce Ends ,"The rebels demanded more concessions from Saudi Arabia before they would resume United Nations-backed peace talks, raising the risk of a new flare-up of violence as a two-week cease-fire ended."
180,"April 24, 2020 05:30 am ET",Some Oil Producers Have Secret Weapon ,A handful of companies and national producers around the world bought insurance—in the form of hedging strategies—for a collapse in oil prices.
181,"April 24, 2020 05:30 am ET",Derby’s Take: Balance-Sheet Growth Isn’t Raising Inflation Worries at Fed,Federal Reserve officials are unworried that the historic support they are offering to the economy and financial system is providing the kindling for an eventual inflation fire.
182,"April 24, 2020 12:01 am ET",What’s News: Business & Finance,What’s News: Business & Finance
183,"April 23, 2020 09:00 pm ET",J.C. Penney in Advanced Talks for Bankruptcy Financing ,"J.C. Penney is in advanced talks for bankruptcy funding with a group of lenders, a sign the troubled retailer is about to succumb to the economic collapse caused by the pandemic. "
184,"April 23, 2020 07:06 pm ET",Watch Out in the South China Sea,"As U.S.-China tensions increase, the chance of a miscalculation grows."
