,date,title,summary
129,"February 24, 2019 01:32 pm ET",BlackRock’s Bid to Become a Private-Equity Giant Is Behind Schedule ,BlackRock last year set a goal of raising at least $12 billion to buy and hold long-term stakes in companies. The world’s biggest money manager is still waiting for its first check. 
130,"February 24, 2019 07:00 am ET",Frackers Face Harsh Reality as Wall Street Backs Away,The once-powerful partnership between fracking companies and Wall Street is fraying as the industry struggles to attract investors after nearly a decade of losing money.
131,"February 22, 2019 04:56 pm ET",U.S. Stocks Climb on Trade Optimism,U.S. stocks advanced Friday as major benchmarks closed out the week with gains amid continuing hopes for a trade deal between the U.S. and China. 
132,"February 22, 2019 04:24 pm ET",Parker Drilling Bondholder Barings Calls for Examiner ,"Barings, which owns about $35 million in Parker Drilling senior notes, claims investment managers Brigade Capital Management LP, Highbridge Capital Management, Värde Partners and Whitebox Advisors LLC struck a deal that will give them an outsize stake in the reorganized company at the expense of similarly situated creditors, according to papers Barings filed Wednesday in the U.S. Bankruptcy Court in Houston. "
133,"February 22, 2019 03:44 pm ET",Oil Hits Three-Month High as U.S. Stock Markets Advance,"Oil prices rose to a fresh three-month high Friday on the back of rising U.S. stock markets, a decline in drilling activity and hopes for a U.S.-China trade deal."
134,"February 22, 2019 10:14 am ET",Today’s Logistics Report: Freight’s Bigger Value; Choppy Container Waters; Tracking Food Supplies,Today’s Top Supply Chain and Logistics News From WSJ.
135,"February 22, 2019 09:36 am ET",Saudi Arabia Secures Big Deals With China—Energy Journal,
136,"February 22, 2019 09:00 am ET","Calm Blankets Markets From Stocks to Bonds, Even as Risks Remain",Volatility measures in markets from stocks to currencies have retreated this year—a sign that investors are shedding caution even as uncertainties linger in the global economy. 
137,"February 22, 2019 07:25 am ET",ECB Officials Worried About Depth of Eurozone Slowdown; Gaming Out the End of Fed Portfolio Runoff,"The Wall Street Journal’s central banking newsletter for Friday, February 22, 2019."
138,"February 22, 2019 04:08 am ET",The Daily Shot: Are Home Builders too Optimistic?,
139,"February 21, 2019 07:25 pm ET",U.S. Bets on China’s Special Envoy ,"As U.S.-China trade talks reach a pivotal point, the Trump administration is counting on the Chinese leader’s special envoy, Liu He, to get Beijing to accept tough new strictures that are increasingly controversial in Beijing. "
140,"February 21, 2019 06:45 pm ET",U.S. Dollar Rises as China Trade Deadline Nears    ,The U.S. dollar rose amid concerns about global growth from investors as trade talks between the U.S. and China are nearing a deadline when the U.S. could impose higher tariffs.  
141,"February 21, 2019 05:45 pm ET",Bank of Canada Says Timing of Rate Rises Uncertain ,"Bank of Canada governor Stephen Poloz said Thursday that interest rates will need to move higher to keep inflation in check, but the timing of future increases remains unclear. "
142,"February 21, 2019 05:07 pm ET",Venezuelan Oil Supplies Hit Five-Year High as Buyers Become Elusive ,"Venezuela’s oil inventories have climbed to their highest levels in five years, according to satellite data, a sign that U.S. sanctions are stifling sales and could continue to drive up global prices. "
143,"February 21, 2019 04:33 pm ET",On the Ballot in Nigeria: How to Manage Oil Money ,"When Nigerians vote for their next president on Saturday, they face a choice between two candidates with different visions of how to overhaul the oil sector, which accounts for more than half of the government’s revenue. "
144,"February 21, 2019 03:31 pm ET",Treasury Inflation Bond Auction Sees Strong Demand ,"The Treasury’s auction of $8 billion in 30-year inflation-protected bonds met with strong demand, a sign that some investors see potential for consumer prices to rise. "
145,"February 21, 2019 03:18 pm ET",Oil Prices Decline as U.S. Crude Production Hits Record,U.S. oil prices ticked lower Thursday as domestic production hit a record high and oil inventories climbed to their highest level since November 2017.
146,"February 21, 2019 12:45 pm ET",Venezuela’s Oil Stocks Hit Multiyear High—Energy Journal,
147,"February 21, 2019 12:14 pm ET","IMF, Development Banks Agree to $10.2 Billion Bailout for Ecuador ",The IMF and other development banks will bail out Ecuador as the South American nation struggles with weak economic growth and deficits.
148,"February 21, 2019 11:54 am ET",Nigeria to Vote After Delay Brings New Conflict ,"A delay in Nigeria’s presidential election, now set for Saturday, has further complicated a fractious contest, bringing new fraud accusations and disruptions that have cost Africa’s largest economy an estimated $2 billion. "
149,"February 21, 2019 11:11 am ET",Business Investment Falters Amid Growing Global Economic Uncertainty,"Demand for long-lasting goods produced by U.S. factories increased for the second month in a row in December, driven by orders for transportation equipment."
150,"February 21, 2019 10:45 am ET",Land O’Lakes Looks Beyond Plain Butter,"As consumer tastes change, the company is expanding its product line. Among the offerings: butter with canola oil, calcium and vitamin D."
151,"February 21, 2019 03:36 am ET",The Daily Shot: Share Buybacks Are off to a Strong Start,
152,"February 20, 2019 10:59 pm ET",China Starts the Year With a Corporate Bond Boom,"Companies have rushed to sell new bonds in China this year, as Beijing loosens financial conditions to shore up businesses in a weakening economy."
153,"February 20, 2019 05:33 pm ET",Fed Prepares to End Balance-Sheet Runoff Later This Year ,Most Federal Reserve officials last month indicated they were ready to stop shrinking the central bank’s $4 trillion asset portfolio this year and believed an action plan should be released soon.
154,"February 20, 2019 05:08 pm ET","Glencore, the King of Coal, Bows to Investor Pressure Over Climate","Commodity trader Glencore said it plans to cap its coal output in line with a global transition away from high-carbon-emitting fuels, a sharp shift for a company that for years has been bullish about the commodity. "
155,"February 20, 2019 05:08 pm ET",Oil Prices Reach Three-Month Highs on OPEC Cuts,Oil prices climbed to a three-month high on declining supply from OPEC and as investors awaited news on the U.S.-China trade negotiations.
156,"February 20, 2019 03:11 pm ET",Copper Hits Highest Level Since July,"Copper prices rose to their highest level since July, boosted by optimism on trade talks between the U.S. and China and a rally in oil."
157,"February 20, 2019 07:03 am ET",Novatek FY 2018 Pretax Profit Rose 14%; Natural Gas Sales Volumes Increased 11%,
158,"February 20, 2019 07:00 am ET",Compass Sells Hemp-Food Company to Canada’s Tilray in $320 Million Deal ,Compass Diversified Holdings has agreed to sell Manitoba Harvest Hemp Foods to Canadian cannabis company Tilray for up to 419 million Canadian dollars ($316.6 million) in cash and stock. 
159,"February 20, 2019 03:27 am ET",San Leon Rises on Proposed $30 Mln Share Buyback,
160,"February 20, 2019 03:04 am ET",The Daily Shot: The National Debt Is Back in Focus,
161,"February 20, 2019 12:01 am ET",What’s News: Business & Finance,What’s News: Business & Finance
162,"February 19, 2019 03:21 pm ET","Oil Hits Three-Month High on Saudi Cuts, U.S.-China Talks","U.S. oil prices rose to a three-month high Tuesday, fueled by production cuts from Saudi Arabia and other producers and continued optimism over U.S.-China trade negotiations. "
163,"February 19, 2019 12:49 pm ET","BHP Posts Big Profit Jump, Expresses U.S.-China Concern","BHP Group’s 87% rise in first-half net profit sets the stage for what should be another solid earnings season for global miners, but the company  sounded a warning over the U.S.-China trade conflict."
164,"February 19, 2019 09:16 am ET",PE Daily: Russia Detains Baring Vostok Founder; Adam Waterous’s Oil Bet; Great Hill in Talks to Buy Gizmodo,A private-equity news digest from WSJ Pro.
165,"February 19, 2019 02:43 am ET",The Daily Shot: Weak Industrial Production Dampens First-Quarter Growth Expectations,
166,"February 18, 2019 02:53 pm ET","Europe’s Challenge Is Decline, Not Trump",Even George Soros warns that the EU may ‘go the way of the Soviet Union in 1991.’
167,"February 18, 2019 12:25 pm ET",Global Stocks Edge Higher as U.S.-China Trade Talks Progress,Global stocks edged up as renewed hopes for a trade deal between the U.S. and China helped boost sentiment.
168,"February 18, 2019 08:41 am ET",Prices for Electric-Car Metals Lose Power—Energy Journal,
169,"February 18, 2019 06:23 am ET",Oil Prices Extend Climb on Falling Supply,Oil prices hold on to near three-month highs reached at the end of last week amid signs of shrinking global crude supply and a weaker dollar.
170,"February 17, 2019 06:35 pm ET","This Week on the Frontiers, February 16th 2019",A weekly roundup of key news affecting frontier markets from the Wall Street Journal and beyond.
171,"February 17, 2019 05:41 pm ET",Ansell Lifts First-Half Dividend,
172,"February 17, 2019 07:00 am ET",Investors Get Burned After Betting on Electric-Car Metals ,Those who bet on metals used in electric cars and smartphones are feeling the pain as cobalt and lithium prices keep dropping.
173,"February 16, 2019 11:52 am ET",Russia Formally Arrests American Businessman ,The American founder of a private-equity firm detained this week in Moscow on fraud charges was formally arrested and is set to remain in custody for at least about two months. 
174,"February 15, 2019 06:13 pm ET",Gas Shortages Give New York an Early Taste of the Green New Deal,The state is dependent on imports even though it sits atop the abundant Marcellus Shale.
175,"February 15, 2019 05:43 pm ET",Adam Waterous Seeks to Profit From Disruption in Oil-and-Gas Market ,Adam Waterous is a man on a mission: to prove he can be as successful as a private-equity investor as he was as a banker. Key to his success is what he calls a once-in-a-lifetime disruption in energy deals. 
176,"February 15, 2019 04:47 pm ET",Transcript: WSJ Interview With San Francisco Fed President Mary Daly,"San Francisco Fed leader Mary Daly discusses her outlook for interest rates and the economy, the winding down of the Fed’s bond portfolio, and reasons why a tight labor market hasn’t fueled stronger wage growth and higher inflation."
177,"February 15, 2019 04:09 pm ET",Oil Climbs as OPEC Supply Drops,"Oil prices neared a three-month high, building on robust weekly gains driven by signs of shrinking global supply. "
178,"February 15, 2019 03:29 pm ET","Russia Detains American Founder of  Private-Equity Firm, Straining U.S. Ties Further ","Russian authorities detained the American founder of a private equity group on suspicion of fraud, an incident that could rattle potential foreign investors and add to already strained ties between the U.S. and Russia."
179,"February 15, 2019 01:02 pm ET",Mexico Unveils Plan to Support State Oil Company Pemex,"Mexican President Andrés Manuel López Obrador unveiled a $5.2 billion rescue package for Petróleos Mexicanos, which the new government hopes would help stem the state oil company’s bleeding and reverse falling output."
180,"February 15, 2019 11:07 am ET",Today’s Logistics Report: XPO’s Acquisition Shift; Amazon Drops Big Apple; Aviation’s Jumbo Reversal,Today’s Top Supply Chain and Logistics News From WSJ
181,"February 15, 2019 10:55 am ET","Oil Will Still Matter in the Future Says, BP—Energy Journal",
182,"February 15, 2019 10:35 am ET",Vladimir Putin’s Bold Push Into the Middle East,"Free of Soviet-era baggage, Russia is busy cultivating ties across the region, including key U.S. allies Israel and Saudi Arabia."
183,"February 15, 2019 04:07 am ET",The Daily Shot: Analysts Question the Veracity of the Retail Sales Report,
184,"February 14, 2019 05:15 pm ET",Will Republicans Start Winning on Health Care?,Medical inflation is low and Democratic ideas are scaring voters.
185,"February 14, 2019 04:25 pm ET",Oil Prices Rise Amid Confidence in OPEC Production Cut,The rally continued Thursday for a third straight session amid increasing evidence that Saudi Arabia and other major oil producers are making good on their pledge to reduce production.
186,"February 14, 2019 04:04 pm ET",Dow Closes Lower After Disappointing Retail Sales,U.S. stocks dropped as disappointing retail sales in the crucial holiday period and mixed corporate earnings results revived concerns over a slowdown in global growth. 
187,"February 14, 2019 03:35 pm ET",ICE Canola Futures Down in Early Wednesday Trading,
188,"February 14, 2019 10:13 am ET",Oil High Grips the Market—Energy Journal,
189,"February 14, 2019 08:24 am ET",PE Daily: Energy Spectrum Backs Laser Midstream; Aberdeen Standard Collects $228 Million for GP Stakes,A private-equity news digest from WSJ Pro.
190,"February 14, 2019 07:00 am ET",Canadian Oil Producers Miss U.S. Opportunity ,"U.S. sanctions on Venezuela have Gulf Coast refiners scrambling to find new sources for the dense crude oil they need to make fuel, but Canadian producers are finding the opportunity too expensive to exploit."
191,"February 14, 2019 04:15 am ET",The Daily Shot: A Sharp Decline in Hospital Care CPI,
192,"February 13, 2019 05:25 pm ET",U.S.-China Trade Optimism Drives Stocks Higher    ,"U.S. stocks climbed, buoyed by optimism about U.S.-China trade negotiations and reports that President Trump is likely to sign a border-security deal that would keep the government open past Friday."
193,"February 13, 2019 03:16 pm ET",Oil Climbs Despite Rising U.S. Crude Inventories,Oil prices rose Wednesday as investors shrugged off a report showing U.S. crude-oil inventories are at a 15-month high and focused more on rising U.S. stocks and optimism over U.S.-China trade talks. 
194,"February 13, 2019 01:42 pm ET",Energy Prices Hold Down Overall U.S. Inflation,"Volatile energy prices are holding down overall inflation in the U.S. economy, but underlying price growth remains steady. "
195,"February 13, 2019 01:18 pm ET","Ecuador, IMF Launch Formal Talks on Possible Bailout Package ","Ecuador and the IMF have launched formal talks about a potential financial bailout for the South American country, which needs funds to cover a budget deficit and pay debt holders. "
196,"February 13, 2019 09:48 am ET",Oil Is Riding High on U.S.-China Trade Hopes—Energy Journal,
197,"February 13, 2019 09:33 am ET",Just How Green Are U.S. Airlines?,"Carriers want fliers to see them as eco-friendly. But while their planes are more efficient, their greenhouse-gas emissions are rising overall."
198,"February 13, 2019 04:29 am ET",The Daily Shot: Small Business Sentiment Sours,
199,"February 13, 2019 03:15 am ET",Anglo African Oil & Gas Shares Rise on Republic of Congo Oil-Well Production Plans,
200,"February 13, 2019 02:43 am ET",Tullow Oil Swung to Net Profit in 2018,
201,"February 12, 2019 09:41 pm ET",What El Chapo’s Trial Revealed: The Inner Workings of a $14 Billion Drug Empire,"Trial testimony laid bare how cocaine and marijuana rumbled across the U.S. border in the walls of freight trains, how in-house tech experts built encrypted communications networks and how the cartel moved money around using debit cards, suitcases of cash and private planes."
202,"February 12, 2019 06:24 pm ET",Amazon Slashed Prices at Whole Foods; Now They’re Going Up,"Whole Foods is raising prices again. Amazon cut prices after acquiring the grocer in 2017, but pressure from consumer-product makers has led Whole Foods to raise prices on hundreds of products."
203,"February 12, 2019 05:36 pm ET",Stocks Surge on U.S.-China Trade Hopes,The Dow Jones Industrial Average climbed more than 370 points as optimism that U.S. and Chinese negotiators were making progress toward a broad outline of a trade agreement eased some of investors’ trepidations.
204,"February 12, 2019 04:47 pm ET","Oil Ticks Higher on Easing Demand Fears, Falling OPEC Output","Oil prices rose alongside stocks and other commodities Tuesday, boosted by improved appetite for risk assets."
205,"February 12, 2019 03:30 pm ET",The Weak Spot in the Oil Market That Traders Are Missing,"According to Standard Chartered analysts, traders focused on China’s crude demand may be overlooking a less conspicuous problem in Germany, where demand has fallen for nine straight months."
206,"February 12, 2019 11:01 am ET",One Potential Beneficiary of U.S. Sanctions on Venezuela: Iran ,"The Trump administration’s sanctions on Venezuelan crude complicate its effort to bring Iran’s oil exports to zero. To avoid a price spike, Washington will likely be forced to allow some buyers to continue purchasing oil from Tehran."
207,"February 12, 2019 09:00 am ET",Property Prices Tumble in Dubai,Dubai real estate has long been famous for its artificial islands and off-the-charts luxury. Now it’s known for bargains in the world’s tallest building.
208,"February 12, 2019 08:37 am ET",OPEC Tightened the Spigots Last Month—Energy Journal,
209,"February 12, 2019 07:44 am ET",PE Daily: Constitution Forms Real Estate Unit; Carlyle Poaches Och-Ziff Exec,A private-equity news digest from WSJ Pro.
210,"February 12, 2019 07:25 am ET",OPEC Production Falls Significantly on Saudi Output Cuts,"OPEC significantly reduced its crude-oil production in January, making good on its latest deal to curb output and rebalance an oversupplied market, the oil cartel said."
211,"February 12, 2019 06:02 am ET","WSJ Wealth Adviser Briefing: Being More Tax Savvy, Reinventing 401Ks, Donating Art","Smart ways to be a tax-savvy investor; how to reinvent retirement plans, and turning to colleges and universities for art donations."
212,"February 12, 2019 02:41 am ET","The Daily Shot: Tentative Deal on Border Security Boosts Stocks, Bond Yields",
213,"February 11, 2019 08:50 pm ET",Mexico Seeks to Revise Private Pipeline Contracts,President Andrés Manuel López Obrador said the Mexican government wants to revise natural-gas pipeline contracts with private companies under which the state-owned electric utility is paying even when it hasn’t received fuel.
214,"February 11, 2019 07:25 pm ET",Vote on the Green New Deal,Every Member of Congress should step up and be counted. 
215,"February 11, 2019 06:44 pm ET",Where Is Crown Prince Mohammed?,"Out of public view, he attempts to control Saudi society with a combination of dread and circuses."
216,"February 11, 2019 03:35 pm ET",Oil Falls to Two-Week Low on Stronger Dollar,Oil prices fell to a two-week low Monday due to a stronger dollar and simmering concerns that unresolved U.S.-China trade negotiations could hurt the global economy and reduce oil demand.
217,"February 11, 2019 03:26 pm ET",U.S. Steel to Expand Under Tariffs,U.S. Steel said it plans to add 1.6 million tons of steelmaking capacity next year by resuming the construction of a new furnace in Alabama as tariffs on foreign metal raise profits on domestic steel.
218,"February 11, 2019 12:37 pm ET","‘Who, Us, a Cartel?’ Says Head of Oil Cartel ",OPEC is getting more sensitive to the notion that it tries to control oil prices. 
219,"February 11, 2019 09:45 am ET",Today’s Logistics Report: Rising Port Waters; Suppliers Raise Prices; Tesla’s Slow-Moving Parts,Today’s Top Supply Chain and Logistics News From WSJ.
220,"February 11, 2019 09:18 am ET",Stylish Valentine’s Day Gifts,All you need is love. And some pavé-set pink sapphires. Or rubies. WSJ. Magazine’s round-up of 20 stylish Valentine’s gifts for the most meaningful man or woman in your life—even (especially?) if that someone is you.
221,"February 11, 2019 08:47 am ET",Ports Plan for Rising Tides—Energy Journal,
222,"February 11, 2019 03:50 am ET","Amid Gloomy Data, a Hopeful Sign for Chinese Stocks ","Chinese stocks are off to a solid start this year, with one gauge suggesting more money is coursing through the financial system, a development that could also boost shares. "
223,"February 11, 2019 02:44 am ET",The Daily Shot: Is the Fed’s Next Move a Rate Cut?,
224,"February 10, 2019 03:02 pm ET",Power and Money in Venezuela,Some opponents of Nicolás Maduro remain supporters of socialism.
225,"February 10, 2019 08:30 am ET",Economic Woes Cloud Iran’s Pitch for Unity on Revolution Anniversary,"Iran’s leaders are struggling under sanctions to fulfill the country’s economic potential and build unity, 40 years after Iranians overthrew the U.S.-backed shah."
226,"February 10, 2019 07:30 am ET",Market Indicators Turn Bullish After Flashing Red,"A number of technical signals used by analysts to gauge the health of the stock market have flipped to positive from negative, a shift that is buttressing some investors’ faith in the 2019 rebound despite last week’s volatility."
