,date,title,summary
109,"August 30, 2017 08:00 am ET",Buzz Kill for Pot Farmers: Lower Prices ,"After decades of dodging law enforcement and fighting for legalization, U.S. marijuana growers face a new challenge as their market expands: falling prices."
110,"August 30, 2017 07:31 am ET",The Morning Ledger: Republican Tax Plan Poses Risk to U.S. Bond Market,Tax plan would cut interest rate deductions; Harvey tests limits of insurance; Expedia's shot at a CFO to CEO transition.
111,"August 30, 2017 07:20 am ET",U.S. Firm Stops Trading Venezuelan Bonds—Energy Journal,U.S. Firm Stops Trading Venezuelan Debt
112,"August 30, 2017 07:00 am ET",Fallout From Harvey to Disrupt Energy Markets Around the World ,Tropical Storm Harvey is upending the flow of oil and petroleum all around the world—a consequence of the growing influence of the U.S. in the global energy industry.
113,"August 30, 2017 04:15 am ET",Emerging Markets Pick Up the Slack as Bigger Players’ Demand for LNG Eases,"Emerging nations in Asia are turning to imports of liquefied natural gas to offset dwindling domestic supplies, bolstering LNG trade in the region as demand from bigger markets eases."
114,"August 30, 2017 12:52 am ET",WSJ’s Daily Shot: Harvey Could Raise U.S. Airline Ticket Prices,
115,"August 30, 2017 12:01 am ET",What’s News: Business & Finance,What’s News: Business & Finance
116,"August 29, 2017 06:38 pm ET",East Coast May Face Fuel Shortages After Storm Disrupts Major Pipeline,"Flooding in Texas has disrupted the flow of fuel on a major pipeline that moves gasoline, diesel and jet fuel to the East Coast. "
117,"August 29, 2017 06:23 pm ET",Harvey Forces U.S.’s Largest Refinery to Cut Output to 40% Capacity    ,"The nation’s largest refinery in Port Arthur, Texas, said late Tuesday it has reduced its production rate to 40% capacity, as refineries up and down the Texas coast battle the effects of Tropical Storm Harvey, which first hit the state Friday as a hurricane. "
118,"August 29, 2017 06:10 pm ET",Peabody Wants to Be Dropped From Climate Change Lawsuits ,Coal producer Peabody Energy Corp. says its recent emergence from bankruptcy shields it from lawsuits brought by three coastal California communities against fossil fuel companies over rising sea levels.
119,"August 29, 2017 05:47 pm ET",Harvey’s Widespread Destruction Tests U.S. Shale,"Tropical Storm Harvey has shut a significant portion of the state’s shale production, cutting off as much as 15% of U.S. oil supplies. Now, the big question is how quickly the sector can make a comeback."
120,"August 29, 2017 05:11 pm ET",Cantor Fitzgerald Stops Trading Venezuelan Bonds ,"Cantor Fitzgerald LP stopped trading Venezuelan debt Tuesday, days after the Treasury Department slapped financial sanctions on the country for undermining democracy. "
121,"August 29, 2017 04:57 pm ET",Oil Prices Continue Slide as Tropical Storm Harvey Continues,Oil prices continued to slide Tuesday as Tropical Storm Harvey continued to bear down on the Texas Gulf Coast and looked set to threaten more refineries.
122,"August 29, 2017 12:43 pm ET","Montco Offshore Says Merger, Not Sale, Is Best Survival Strategy",", the company’s best hope for survival is to team up with Seacor Liftboat."
123,"August 29, 2017 12:15 pm ET",Transcript: Interview With South African Reserve Bank Gov. Lesetja Kganyago ,"Lesetja Kganyago, governor of the South African Reserve Bank talked with The Wall Street Journal about the outlook for interest rates, the forces affecting inflation in South Africa and the role of Fed communications in global policy making."
124,"August 29, 2017 09:58 am ET",Harvey Funding Challenges | Auto Lending Scrutiny | Deng’s Take: Chinese Bank Gambles,"The Wall Street Journal’s financial regulation newsletter for Tuesday, August 29, 2017."
125,"August 29, 2017 07:16 am ET",Storm Tests U.S. Shale Production—Energy Journal,A storm Has Cut Off As Much as 15% of U.S. Oil Supplies
126,"August 29, 2017 07:04 am ET","Oil Prices Rise as Dollar Falls After North Korean Missile Launch
		
			","The price of U.S. crude oil gained some support from a weaker dollar in early European trade, a day after being pummeled by Tropical Storm Harvey."
127,"August 29, 2017 06:37 am ET",Today’s Top Supply Chain and Logistics News From WSJ,"Delivering up-to-the minute news, analysis, interviews and explanatory journalism on logistics, supply-chain management, e-commerce and more"
128,"August 29, 2017 03:29 am ET","WSJ City: North Korea Missile Rattles Markets, No Brexit Breakthrough, Service Sector Sees Profit Squeeze",
129,"August 29, 2017 12:28 am ET",WSJ’s Daily Shot: North Korea Brings ‘Fire and Fury’ Back to the Markets,
130,"August 29, 2017 12:01 am ET",What’s News: Business & Finance,What’s News: Business & Finance
131,"August 28, 2017 11:35 pm ET",What’s News: Business & Finance,What’s News: Business & Finance
132,"August 28, 2017 09:39 pm ET",Oil Futures Rebound Some in Asian Trade,"Oil futures rose in Asian trading on Tuesday, regaining some ground after fresh selling overnight especially in the U.S. WTI, following the disruption caused by tropical storm Harvey. "
133,"August 28, 2017 07:02 pm ET","Harvey Hammers Energy, Insurer Stocks","The Dow Jones Industrial Average inched lower Monday, weighed down by declines in shares of energy and insurance companies. "
134,"August 28, 2017 06:07 pm ET",Market Talk: Daily Analysis Roundup,"Read our compilation of concise, timely analysis by Wall Street Journal reporters. Trading Spikes in Gasoline ETF; Firms Estimate Hurricane Harvey’s Economic Impact, Damage, Insurance Claims; Wells Fargo Donates $1M to Support Harvey Relief; CEO of Santander Holdings Takes Over Auto-Loan Unit"
135,"August 28, 2017 06:00 pm ET",Tropical Storm Harvey Will Cost Tens of Billions of Dollars,"Tropical Storm Harvey will take a financial toll on the nation’s economy, but how much of one depends on the extent of flooding in the coming days."
136,"August 28, 2017 05:36 pm ET",Refiner Stocks Rise as Harvey Disrupts Fuel Production,"Shares of companies that churn crude into fuel rallied, as Tropical Storm Harvey inundated Texas with punishing rains and raised investors’ concerns about tight fuel supplies."
137,"August 28, 2017 04:42 pm ET",Gasoline Up as Harvey Hits Refiners,Gasoline prices surged on concerns over a shortage in supply after Tropical Storm Harvey knocked out refining operations and traders tried to assess damage in the Houston area.
138,"August 28, 2017 03:06 pm ET",Harvey’s Lessons for U.S. Energy,"The hurricane’s hitting the Gulf Coast of Texas highlights how the U.S. now relies on fewer refineries, run closer to their limits, to turn crude into fuel and get it to consumers."
139,"August 28, 2017 01:06 pm ET","Saudis, Russia Push to Extend Their Oil Output Cuts     ","Saudi Arabia and Russia are pushing to extend their deal to limit crude oil production for another three months, which would leave the output deal between OPEC and non-OPEC producers in place through the end of June, people familiar with the matter said.  "
140,"August 28, 2017 09:55 am ET",Mexico Registers $1.52 Billion Trade Deficit in July ,"Mexico recorded a $1.52 billion trade deficit in July, a shift from the surplus seen the previous month, as growth in exports outpaced the increase in imports. "
141,"August 28, 2017 08:35 am ET",The Morning Download: New Uber CEO Steeped in Business Value of Tech,"Dara Khosrowshahi wasn’t as well-known as some of the other candidates for the top job at Uber. Yet he has led Expedia, a company with a digital DNA, since 2005. And he has run it profitably."
142,"August 28, 2017 07:16 am ET",The Morning Risk Report: New York’s New Cyber Rules Take Effect,"Financial services companies will have to have hired a chief information security officer and to have in place more stringent policies and procedures to fight hackers, detect intrusions and secure customer information."
143,"August 28, 2017 07:14 am ET",Storm Knocks Out Some U.S. Refineries—Energy Journal,U.S. gasoline Futures Surged  After Hurricane Harvey Knocked Out Some Refineries
144,"August 28, 2017 01:50 am ET",WSJ’s Daily Shot: Are Americans Waiting for Lower Mortgage Rates Before Buying a Home?,
145,"August 28, 2017 12:57 am ET",Most Global Markets Start the Week Lower,"Asia-Pacific equity markets struggled for direction after U.S. and European central bankers didn’t provide fresh policy guidance, though China-related stocks outperformed. "
146,"August 27, 2017 10:59 pm ET",U.S. Gasoline Futures Surge in Asia in Wake of Storm Harvey,"U.S. gasoline futures surged in Asian trading on Monday, as now-Tropical Storm Harvey knocked out almost 15% of the nation’s refinery capacity with further disruptions likely to come. "
147,"August 27, 2017 10:04 pm ET",Energy Firms Brace for Harvey Fallout,"Energy markets could be in for a bumpy ride when they open Monday as investors try to gauge the impact of the storm, which knocked almost 15% of U.S. refinery capacity out of commission."
148,"August 27, 2017 08:22 pm ET",Energy Markets Brace for Volatility as Harvey’s Impact Is Determined,Energy markets are due for considerable volatility this week as investors try to gauge the extent of disruption to fuel production and distribution from the torrential rains and catastrophic flooding in Texas.
149,"August 27, 2017 11:00 am ET",Energy Shares Set for Worst Month Since 2015 ,"Shares of energy companies are on track for their biggest monthly decline since the end of 2015, showing that stabilizing earnings aren’t enough to attract investors. "
150,"August 26, 2017 03:02 pm ET",Hurricane Forces Refineries to Shut Down,"Hurricane Harvey forced refineries that make up nearly 5% of U.S. fuel-making capacity to shut down, and more facilities remained under threat as the storm moved through the heart of the nation’s oil and gas infrastructure. "
151,"August 26, 2017 08:35 am ET","This Week on the Frontiers, August 26th 2017",
152,"August 25, 2017 10:49 pm ET",Plains All American Pipeline to Cut $1.4 Billion in Debt,"Oil- and gas-pipeline operator Plains All American Pipeline LP plans to cut some $1.4 billion in debt, sell assets and reduce payments to its general partner in a bid to turnaround the business. "
153,"August 25, 2017 05:18 pm ET",The Coming Global Car Wreck,Dieselgate is not the fruit of an industry cartel but of politicians ignoring cost and benefit.
154,"August 25, 2017 04:59 pm ET",U.S. Toughens Venezuela Penalties by Curbing Bond-Market Access,"The U.S. restricted the ability of Venezuela to tap American debt markets, marking a significant escalation in Washington’s economic crackdown against Nicolás Maduro’s cash-government."
155,"August 25, 2017 04:26 pm ET",Oil Ticks Up as Hurricane Approaches Texas,Oil prices advanced Friday as investors tried to gauge the impact of a hurricane hurtling toward Texas. The worry now seems to be more about refineries than about crude production.
156,"August 25, 2017 03:37 pm ET",Venezuelan Bonds Up After New U.S. Sanctions Spare Debt Trading ,Bond investors expressed relief on Friday after new U.S. sanctions against Venezuela didn’t ban trading of the country’s existing bonds.
157,"August 25, 2017 02:42 pm ET",Hurricane Harvey Snarls Key Trade Link For Energy and Cargo,"Seaports along the Texas coast shut down Friday as they prepared for heavy rains and winds from Hurricane Harvey, disrupting shipments of energy products and consumer goods along one of the nation’s busiest shipping corridors."
158,"August 25, 2017 01:27 pm ET",U.S. Oil-Rig Count Falls for Second Straight Week,"The number of rigs drilling for oil in the U.S. fell by four in the past week to 759, according to oil-field services company Baker Hughes Inc., a unit of General Electric Co."
159,"August 25, 2017 07:37 am ET","Jackson Hole Cheat Sheet | Fed’s George Says More Rate Rises Needed | It’s Listed and It’s Surging: Switzerland’s Central Bank | Buell’s Take: Weidmann Steals the Show, Which May Later Be His","The Wall Street Journal’s central banking newsletter for Friday, August 25, 2017"
160,"August 25, 2017 06:51 am ET",U.S. Oil Industry Braces for Hurricane—Energy Journal,"The U.S. oil and gas industry is bracing for its first major hurricane in nearly a decade, amid a transformed energy landscape."
161,"August 25, 2017 06:43 am ET",Oil Price Pass-through Into Core Inflation,"Oil prices changes pass through to core inflation with a small but long-lasting effect, Federal Reserve Board research finds."
162,"August 25, 2017 06:32 am ET","Jackson Hole Cheat Sheet | Fed’s George Says More Rate Rises Needed | It’s Listed and It’s Surging: Switzerland’s Central Bank | Buell’s Take: Weidmann Steals the Show, Which May Later Be His","The Wall Street Journal’s central banking newsletter for Friday, August 25, 2017"
163,"August 25, 2017 06:02 am ET",Today’s Top Supply Chain and Logistics News From WSJ,"Delivering up-to-the minute news, analysis, interviews and explanatory journalism on logistics, supply-chain management, e-commerce and more"
164,"August 25, 2017 05:30 am ET",Emerging-Markets Activist Investor Creates Niche in Hunt for Big Gains ,Self-described emerging-markets activist investor Teresa Barger seeks to persuade companies in the developing world that improving corporate governance and treatment of minority shareholders will boost their stock prices. 
165,"August 25, 2017 12:01 am ET","U.S. Stocks Rise, Notch Weekly Gains","The S&P 500 notched its first weekly gain in three weeks, as broad advances across sectors helped offset a slide in retail stocks. The index added 0.2%."
166,"August 25, 2017 12:01 am ET",Business Investment Gains Renewed Momentum,"Demand for long-lasting factory goods plunged in July, but a sharp drop in aircraft orders masked underlying signs of strength. "
167,"August 24, 2017 09:02 pm ET",Oil Rebounds in Asia as Hurricane Nears Texas ,"Oil futures posted solid gains in Asian trading Friday, reversing some of the market’s overnight selling amid concern about looming increases in U.S. crude supplies. "
168,"August 24, 2017 08:43 pm ET",First Hurricane in Decade Arrives in Transformed Oil Landscape,"While the energy sector previously would have fretted over a hurricane's threat to crude production, the worry these days is about the facilities that refine the oil instead of pump it, since the ability to tap U.S. shale formations has put more production at locations farther from the coast."
169,"August 24, 2017 07:07 pm ET",Quantum Energy Pledges $450 Million to New Oil-and-Gas Company,"The company, Vitruvian Exploration IV LLC, acquired or agreed to acquire around 120,000 net acres of undeveloped leasehold in the Eagle Ford shale, according to a press release."
170,"August 24, 2017 06:50 pm ET",João Lourenço to Become Angola’s First New President in 38 Years,"The ruling party in Angola claimed victory in a national election after preliminary results were announced Thursday, setting the stage for João Lourenço to become the country’s first new president in 38 years."
171,"August 24, 2017 06:37 pm ET",U.S. Sanctions Could Prompt J.P. Morgan to Push Venezuela From Bond Index ,What will J.P. Morgan Chase & Co. could do is weighing on emerging-markets debt investors as the Trump administration considers sanctions that could affect the ownership or trading of Venezuelan debt. 
172,"August 24, 2017 05:46 pm ET",Oil Edges Lower As Traders Eye Hurricane Harvey,Oil prices fell Thursday as concerns over a hurricane headed for the coast of Texas outweighed improving data on U.S. stockpiles and reports that the global oil cartel will consider extending a deal to cut back global supply.
173,"August 24, 2017 08:36 am ET","OPEC Keeps Options Open, Including Extending Cuts ","The oil cartel OPEC said all options remained open at its next meeting in November, including extending its effort to reduce the global petroleum glut by withholding supplies—a move that one member, Angola, now says it prefers."
174,"August 24, 2017 07:42 am ET",Easier Path to Insider-Trading Convictions | Yellen’s Future Hangs Over Jackson Hole | AmEx Settles With CFPB | Witkowski’s Take: Two Off-Key Notes in Banks’ Earnings,"The Wall Street Journal’s financial regulation newsletter for Thursday, August 24, 2017."
175,"August 24, 2017 07:33 am ET",Yellen and Draghi Speeches to Highlight Jackson Hole Conference | Yellen’s Future at the Fed Unresolved | Global Economies Grow in Sync | Douglas’s Take: A Novel Way to Exit QE,"The Wall Street Journal’s central banking newsletter for Thursday, August 24, 2017"
176,"August 24, 2017 06:55 am ET",U.S. Report Avoids Handouts for Coal and Nuclear—Energy Journal,"A U.S. federal study on the electric grid recommended minor market reforms to make power more reliable, rather than subsidies for beleaguered coal and nuclear-power producers."
177,"August 24, 2017 06:38 am ET","The 10-Point: Gerard Baker on Growing in Sync, a Military Transgender Ban, Budget Airlines and More","A personal, guided tour to the best scoops and stories every day in The Wall Street Journal, from Editor in Chief Gerard Baker."
178,"August 24, 2017 06:35 am ET",Easier Path to Insider-Trading Convictions | Yellen’s Future Hangs Over Jackson Hole | AmEx Settles With CFPB | Witkowski’s Take: Two Off-Key Notes in Banks’ Earnings,"The Wall Street Journal’s financial regulation newsletter for Thursday, August 24, 2017."
179,"August 24, 2017 03:43 am ET","WSJ City: World Economies Grow in Sync, Brexit Weighs on U.K. Farmland, Gulf Privatization Rush",
180,"August 24, 2017 01:26 am ET",WSJ’s Daily Shot: New Home Sales Disappoint; Homebuilders’ Shares Slump,
181,"August 24, 2017 12:01 am ET","Seadrill, a Big Offshore Oil Player, to Seek Bankruptcy Protection",Offshore-drilling services major Seadrill said it will likely file for bankruptcy protection as part of a plan to restructure around $10 billion in debt.
182,"August 23, 2017 07:38 pm ET",Big Economies Are Growing in Sync for First Time in Years ,"For the first time in a decade, the world’s major economies are growing in sync, a result of lingering low-interest-rate stimulus from central banks and the gradual fading of crises that over years ricocheted from the U.S. to Greece, Brazil and beyond."
183,"August 23, 2017 07:03 pm ET",Venezuelan Bonds Fall as U.S. Trading Sanctions Loom ,Venezuelan bond prices tumbled Wednesday as traders grappled with the prospect that U.S. sanctions could restrict trading in the troubled South American nation’s securities.
184,"August 23, 2017 07:00 pm ET",Cuomo’s Natural Gas Blockade,New York’s Governor is raising energy costs for millions of Americans.
185,"August 23, 2017 06:29 pm ET",U.S.: Preparing Sanctions Against More Venezuelan Officials    ,"The Trump administration will soon unveil a new package of Venezuelan sanctions that will hit officials in President Nicolás Maduro’s government and potentially targets in the financial sector, a senior administration official said Wednesday.  "
186,"August 23, 2017 03:26 pm ET",Oil Gains After Stockpiles Data,Oil prices flipped from losses to gains as U.S. data showed that supplies of oil and gasoline fell and as investors tried to gauge the impact of a storm in the Gulf of Mexico.
187,"August 23, 2017 02:09 pm ET",Angolans Vote for First New President in 38 Years ,"Angolans headed to the polls Wednesday to vote for their first new president in almost four decades, amid an economic crisis that has hurt Africa’s No. 2 oil producer and exacerbated complaints of mismanagement of the nation’s resources. "
188,"August 23, 2017 01:54 pm ET",Rosneft Prevails in Lawsuit Against Sistema    ,"A regional arbitration court in Russia ruled in favor of Russian oil giant PAO Rosneft, in a case seen as a test of the country’s investment climate.  "
189,"August 23, 2017 10:17 am ET",The Case for Buying Venezuelan Bonds,"Last month, Venezuelan bond prices tumbled when President Nicolas Maduro won a controversial vote. But one large holder of the debt thinks investors came to the wrong conclusion."
190,"August 23, 2017 08:39 am ET",The Morning Download: Wal-Mart Joins Google to Stake a Claim in Voice-Enabled Commerce,Wal-Mart and Google will battle Amazon for shopper traffic but the data collected from browsing and purchasing is also a prize.
191,"August 23, 2017 08:39 am ET","Morning Must-Reads: Trump Rally, Uber Markdown, Train Traffic Jam","The Must Reads are part of the Journal’s Morning MoneyBeat newsletter. To receive the newsletter via email, see http://on.wsj.com/MoneyBeatUSSignup"
192,"August 23, 2017 08:38 am ET",U.S. Considers Venezuelan Bond Trading Ban | Think Rates Are Going Up? Banks Don’t | Mnuchin’s Wife Apologizes Over Instagram Flap | Ackerman’s Take: Wells Fargo in Senate Hot Seat Again?,"The Wall Street Journal’s financial regulation newsletter for Wednesday, August 23, 2017."
193,"August 23, 2017 07:27 am ET","The 10-Point: Gerard Baker on Oil Company Management, U.S. Pressure on Pakistan, Bank Loans and More","A personal, guided tour to the best scoops and stories every day in The Wall Street Journal, from Editor in Chief Gerard Baker."
194,"August 23, 2017 07:05 am ET",The Morning Ledger: Companies Rally Support For Tax Overhaul,Large companies turn to employees and customers to broaden support for tax overhaul; Intuit CFO to retire; Chevron CEO to resign.
195,"August 23, 2017 06:55 am ET",U.S. Considers Venezuelan Bond Trading Ban | Think Rates Are Going Up? Banks Don’t | Mnuchin’s Wife Apologizes Over Instagram Flap | Ackerman’s Take: Wells Fargo in Senate Hot Seat Again?,"The Wall Street Journal’s financial regulation newsletter for Wednesday, August 23, 2017."
196,"August 23, 2017 06:47 am ET",Chevron CEO to Step Down—Energy Journal,"Chevron Corp. Chief Executive John Watson is planning to step down, as the energy giant looks to cut costs amid the low oil price environment."
197,"August 23, 2017 05:51 am ET",BHP to Replace Two Directors in Board Shuffle,"BHP Billiton said it plans to replace two directors amid its monthslong tussle with activist investor Elliott Management, following the miner’s decision earlier this week to exit its American shale oil and gas business."
198,"August 23, 2017 05:30 am ET",Saudi Aramco Sparks Rush to Mideast IPOs,"Saudi Arabia’s move to list its state-run oil giant, combined with years of lower oil prices, has inspired neighboring oil-producing countries to tap public markets as a new source of revenue."
199,"August 23, 2017 03:44 am ET","WSJ City: How the EU Might Influence British Law After Brexit, Miners Are Flush With Cash Again",
200,"August 23, 2017 01:24 am ET",WSJ’s Daily Shot: New vs. Used Car Price Differential Near Record High,
201,"August 23, 2017 12:30 am ET",What’s News: Business & Finance,What’s News: Business & Finance
202,"August 22, 2017 07:50 pm ET",Famed Plaza Hotel Is On the Block,"The Indian owners of the Plaza Hotel have hired a broker to sell the New York City landmark, a sign that a world-wide scramble among investors, celebrities and governments to acquire the property could be nearing an end. "
203,"August 22, 2017 05:40 pm ET",Chevron CEO’s Exit Reflects a Changing of the Guard for Big Oil,The departure of Chevron CEO John Watson underscores the dramatic shift under way at big oil companies as they adapt to a prolonged period of lower prices brought about by the U.S. shale boom.  
204,"August 22, 2017 04:35 pm ET",Oil Gains Ahead of Inventory Report ,"Oil prices edged higher on Tuesday, driven by supply disruptions in Libya and expectations for a drop in U.S. crude stockpiles."
205,"August 22, 2017 11:50 am ET",Miners Are Flush With Cash Again ,"Fueled by a sharp rise in commodities prices, companies like BHP Billiton, Glencore and Rio Tinto are flush with cash again, boosting dividends, cutting debt and shelling out cash for expansions. "
206,"August 22, 2017 11:27 am ET",Corruption Cases Cast a Pall Over Angola’s Coming Vote       ,"Angolans go to the polls on Wednesday to pick their first new president in decades, but money-laundering and bribery cases in Portugal are raising questions about the ability of Africa’s No. 2 oil producer to tackle corruption and right its economy.  "
207,"August 22, 2017 07:30 am ET",Neuberger Berman Arm Backs Energy Capital in New Power Play,"Dyal Capital Partners bought the equivalent of less than 20% of Energy Capital Partners in a deal that is below $500 million, said people familiar with the matter. "
208,"August 22, 2017 07:29 am ET",The Morning Ledger: Finance Chiefs Look to Free Up Working Capital,Freeing up working capital; Jeep eyeing Chrysler; Baby Boomers hindering job growth.
209,"August 22, 2017 06:50 am ET",BHP Looks to Sell Shale Assets—Energy Journal,"Australian mining group BHP Billiton Ltd. said it was actively looking to sell its onshore U.S. oil-and-gas operations, in a win for activist investor Elliott Management Corp."
210,"August 22, 2017 06:39 am ET",Today’s Top Supply Chain and Logistics News From WSJ,"Delivering up-to-the minute news, analysis, interviews and explanatory journalism on logistics, supply-chain management, e-commerce and more"
211,"August 22, 2017 03:50 am ET","WSJ City: BHP Billiton Eyes Shale Sale After Investor Pressure, Are Long-Term Investors the Market’s True Gamblers?",
212,"August 22, 2017 01:07 am ET",WSJ’s Daily Shot: Investors Are Giving Up on Trump’s Infrastructure Push,
213,"August 22, 2017 12:02 am ET",What’s News: Business & Finance,What’s News: Business & Finance
214,"August 22, 2017 12:01 am ET",What’s News: Business & Finance,What’s News: Business & Finance
215,"August 22, 2017 12:01 am ET",What’s News: Business & Finance,What’s News: Business & Finance
