,date,title,summary
299,"February 21, 2017 07:18 am ET",The Morning Ledger: Failed Unilever-Bid leaves Kraft Heinz under Pressure,"The reason for Kraft Heinz's bid for rival Unilever PLC was simple: For the U.S. packaged-food giant, cutting its own costs is no longer sufficient to improve profitability. Snap is meeting investors in New York and HSBC expands its buyback program despite a widening loss."
300,"February 21, 2017 06:50 am ET",Trump Asked to Make Good on Vow to Save Coal—Energy Journal,President Donald Trump has been asked to intervene in a coal plant closure
301,"February 21, 2017 06:46 am ET",Trump Will Be Able to Recast the Fed | Carstens Postpones Departure | BOJ’s Kuroda Won’t Raise Rates | BOE Still Sees Brexit Damaging Economy | Buell’s Take: The Politics of ECB Tightening,"The Wall Street Journal’s central banking newsletter for Tuesday, Feb. 21, 2017"
302,"February 21, 2017 06:30 am ET",Today’s Top Supply Chain and Logistics News From WSJ,"Delivering up-to-the minute news, analysis, interviews and explanatory journalism on logistics, supply-chain management, e-commerce and more"
303,"February 21, 2017 06:12 am ET","Kraft-Unilever Deal Is Off, but Warren Buffett’s Anomalies Live On ","Behind Kraft’s aborted bid for Unilever lies a tale of market anomalies that have lasted decades, helped make Warren Buffett’s fortune and may—perhaps—have ended in a mini-bubble last year. "
304,"February 21, 2017 05:25 am ET","BHP Billiton Returns to Profit, but Cautions Against Protectionism","The mining giant swung to a profit of $3.20 billion and more than doubled its half-year dividend, even as it warned of heightened economic uncertainty in the near term."
305,"February 21, 2017 03:35 am ET","WSJ City: HSBC’s Loss Widens, Miners Swing to Profit, Saudi Aramco Narrows Listing Options",
306,"February 21, 2017 12:01 am ET",What’s News: Business & Finance,What’s News: Business & Finance
307,"February 20, 2017 10:47 pm ET",Oil Prices Higher on Bullish Bets ,"Crude futures moved higher in Asia Tuesday as investors held on to their bullish positions, betting on the supply to tighten as major oil producers cut their output. "
308,"February 20, 2017 02:59 pm ET","Ecuador Leftist Leads Presidential Vote, but Runoff Appears Likely ","Ecuadoreans waited anxiously on Monday for official results from the vote to replace President Rafael Correa, as pollsters, political analysts and the opposition predicted the presidential election would go to a runoff. "
309,"February 20, 2017 01:47 pm ET",Templeton’s Mobius Foresees Rapid Recovery of Brazilian Economy ,"The sprawling anticorruption investigation known as Operation Car Wash is no longer weighing on Brazilian asset prices, and the local economy could recover quickly amid economic reforms, according to emerging markets investment guru Mark Mobius "
310,"February 20, 2017 12:33 pm ET",Freeport Heads Toward Showdown With Indonesia ,The copper miner’s dispute is threatening global supply of the metal and roiling the markets. 
311,"February 20, 2017 12:25 pm ET",Stocks Rise Despite European Uncertainties,"Global stocks continued their slow climb higher Monday, even as political jitters drove steep swings in European government bond markets."
312,"February 20, 2017 10:01 am ET",Bullish Oil Investors May Be Getting Ahead of Themselves ,"Investors have amassed a record number of bullish bets on oil, but market fundamentals have yet to catch up with their optimism—putting oil prices at risk of a large fall, analysts say. "
313,"February 20, 2017 08:00 am ET",Wall Street Starts to Contemplate GE After Jeff Immelt ,"Jeff Immelt gives no public signs he’s ready to retire as chief executive of General Electric, but investors are increasingly preparing for the inevitable. "
314,"February 20, 2017 07:11 am ET",HSBC Holdings Earnings Preview—What to Watch ,HSBC Holdings reports its fourth-quarter financial results Tuesday morning at 0400 GMT.
315,"February 20, 2017 06:57 am ET",Mester: Public Needs to Understand Policy Limitations | Fed’s Balance Sheet Could Lead to Volatility  | ECB’s Lautenschläger Wants Robust Inflation | PBOC Admits Difficulties | Douglas’s Take: BOE Sticks With Polymer,"The Wall Street Journal’s central banking newsletter for Monday, Feb. 20, 2017"
316,"February 20, 2017 05:32 am ET",Wealth Adviser Briefing: Norb Vonnegut on RIAs’ Response to Cyberattacks,"WSJ Wealth Adviser highlights some of the top news and analysis for wealth advisers and their clients, with pieces today on the signs your spouse may be considering divorce, the latest column from Norb Vonnegut, and the latest Adviser Voices on why wealth managers should continue serving clients' best interest even if the fiduciary rule goes away."
317,"February 20, 2017 05:26 am ET",Oil Prices Rise Despite Higher U.S. Rig Count    ,"Even though the rig increase takes the count to its highest level since October 2015, bullish sentiment about cuts by OPEC and other major producers appears to be lifting the market.  "
318,"February 19, 2017 10:19 pm ET",Oil Prices Under Pressure as U.S. Supply Grows ,"Crude futures barely moved in Asian trade Monday on signs that the U.S. oil production is on a steady uptrend, which could potentially thwart ongoing efforts by multiple oil producers to curb global supply. "
319,"February 19, 2017 08:37 pm ET",WSJ’s Daily Shot: Complacency Creeping into the Oil Markets,* China interbank rates spike as the PBoC tightens liquidity. * Poland's economy surprisingly strong. * The UK's retail sales slump. * European elections uncertainty on the rise. * US homebuilders can't find enough qualified workers.
320,"February 19, 2017 07:34 pm ET",Japan’s Trade Deficit Rises in January on Increased Imports,"Japan posted a larger-than-expected trade deficit in January as imports increased for the first time in two years, driven up by higher oil prices."
321,"February 18, 2017 08:54 am ET","This Week on the Frontiers, February 18th 2017",
322,"February 17, 2017 05:29 pm ET",Worst Gasoline Glut in 27 Years Could Be Oil Rally’s Nemesis,A gasoline glut brought on by drivers buying less at filling stations is emerging as one of the biggest threats to the yearlong oil-price rally.
323,"February 17, 2017 05:04 pm ET",Oil Held Back by Gasoline Glut,Crude futures posted their largest weekly losses in a month as record-high stockpiles drew some caution from traders who had been encouraged by cutbacks from the world's largest exporters. 
324,"February 17, 2017 02:54 pm ET",U.S. Oil-Rig Count Climbs by Six,"The number of rigs drilling for oil in the U.S. rose by six in the past week to 597, oil-field services company Baker Hughes said."
325,"February 17, 2017 02:32 pm ET",MacDonald Dettwiler In Talks to Buy DigitalGlobe,"Canadian satellite company MacDonald Dettwiler & Associates is in advanced talks to buy U.S. satellite-imaging provider DigitalGlobe Inc., according to people familiar with the matter."
326,"February 17, 2017 02:28 pm ET",Distressed Debt and Credit Funds See Resurgence in Profits ,Och-Ziff and Apollo Credit Fund Returns Swing Higher
327,"February 17, 2017 01:22 pm ET",Energy Firms Face Crude Reality: Better to Leave It in the Ground ,"High costs, low prices and tough environmental rules are forcing oil companies to curb production. Exxon is expected to soon disclose that as much as 3.6 billion barrels of oil that it planned to produce in Canada in the next few decades is no longer profitable to extract."
328,"February 17, 2017 01:19 pm ET",Pipeline Operator Enbridge’s Earnings Fall,Enbridge Inc. said its fourth-quarter earnings fell as the pipeline operator’s systems recovered from wildfires earlier in the year. 
329,"February 17, 2017 11:48 am ET",How Bill Walton’s Son Made $1 Billion in the Oil Patch,"Nate Walton, son of famed hoopster and broadcaster Bill Walton and a private-equity partner at Ares Management, orchestrated one of the most successful shale deals in recent years, expected to net more than a $1 billion within a year.     "
330,"February 17, 2017 08:55 am ET",When Fear Meets Greed in the Stock Market,"When stock prices rise, the VIX usually falls. But Mr. Colas reckons that relationship could change. That's because the factors that are pushing stock prices higher also threaten to increase uncertainty, which could push up the prices of options used to protect against a stock market decline, which are incorporated into the calculation of the VIX."
331,"February 17, 2017 07:23 am ET","The Morning Ledger: Why U.S. Firms with Big China Exposure Out-, not Underperform","Big U.S. exporters would be hit hard by a trade war with China. Nevertheless, shares of these companies have outperformed since Nov. 9. Samsung's heir apparent has been arrested and a reversal of Dodd-Frank could lead to a third of public companies no longer giving auditor warnings."
332,"February 17, 2017 07:09 am ET",The Oil Rally’s Nemesis Could Be U.S. Drivers—Energy Journal,U.S. Consumers Used Less Gasoline Last Month Which Helped a Record Supply Glut to Build Up
333,"February 17, 2017 05:40 am ET",Hurdles Mount for Saudi Aramco’s IPO,Complications restructuring Saudi Arabia’s state-owned oil company and disentangling its finances from those of the government are slowing the march toward what is expected to be the biggest initial public offering in history.
334,"February 17, 2017 05:30 am ET",Bankruptcy: Businesses Favor Speedy Chapter 11s – At A Glance,"What do an oil-and-gas driller, a trailer maker and a vodka distributor have in common? They’re among the companies that have recently sped through bankruptcy by taking advantage of a tool to avoid dragged-out and pricey restructurings. In what’s called a prepackaged bankruptcy, or prepack for short, a business has negotiated debt-repayment terms and put a restructuring plan to a creditor vote before it files for chapter 11 protection."
335,"February 17, 2017 05:30 am ET",Ecuador Faces New Choices in Presidential Election,"Voters in Ecuador go to the polls Sunday for the first time in a decade to elect a president other than Rafael Correa, opening a new chapter for a  country that had grown used to his free-spending, often combative ways."
336,"February 17, 2017 12:10 am ET",WSJ’s Daily Shot: Why Immigration Is Critical to U.S. Growth,* Philly Fed manufacturing index at a 33-year high. * CapEx could be improving in the US. * US oil exports spike. *  Marine La Pen odds keep rising. * BoJ owns 40% of outstanding JGBs. * China sold most treasuries in 2016. * Gold rising while VIX falls? Something has to give.
337,"February 16, 2017 10:23 pm ET",Oil Makes Modest Gains But Remains in a Tight Range ,Crude futures made moderate gains in Asia on Friday as larger-than-expected growth in U.S. crude stocks and production were overshadowed by news that the Organization of the Petroleum Exporting Countries could consider extending its production cuts for more months. 
338,"February 16, 2017 06:13 pm ET",TransCanada Tries Again for Nebraska’s Approval of Keystone,"TransCanada Corp. has rebooted its effort to build the Keystone XL oil pipeline across Nebraska, where it had met with opposition before it withdrew its application when the Obama administration denied the company a federal permit in late 2015."
339,"February 16, 2017 04:32 pm ET",Oil Gains on Possible Extension to Production Cuts       ,Crude oil futures edged higher as growing U.S. inventories were offset by reports that the Organization of the Petroleum Exporting Countries was prepared to consider extending supply cuts.     
340,"February 16, 2017 03:21 pm ET",Transcript: Boston Fed’s Eric Rosengren Speaks in New York,"Boston Fed President Eric Rosengren discussed the labor-force participation rate, the outlook for the economy and interest rates, and the housing market at an event in New York."
341,"February 16, 2017 02:56 pm ET",Natural Gas Falls to Nearly-Three-Month Low,"Natural-gas prices settled lower after storage levels failed to shrink as quickly as analysts expected, a bearish signal that the market may be oversupplied in the months to come. "
342,"February 16, 2017 01:30 pm ET",Offshore Vessel Servicers Poised for Brutal 2017,Hornbeck Offshore revenues plunge in oversupplied market
343,"February 16, 2017 12:58 pm ET",Falling Correlations Spell Opportunity for Investors ,"The tight synchronization that has characterized financial markets for much of the past decade is breaking down, presenting investors with opportunities and risks they haven’t grappled with in years. "
344,"February 16, 2017 12:28 pm ET",2017 Ford F-350: The Country Boy’s Rolls-Royce,"Ford’s Super Duty pickup truck can just about do it all. And for some buyers, the purchase qualifies for a very generous tax deduction. "
345,"February 16, 2017 11:43 am ET",How Saudis Cut Oil Output Without Really Cutting,"Saudi Arabia has led the way among major energy exporters in cutting oil production. At the same time, the kingdom is adding to global supply in a surprising way."
346,"February 16, 2017 10:59 am ET",Mexico’s Nafta Defenders,The U.S.-educated Mexican economists who negotiated the trade pact in the 1980s are worried more about their own country’s protectionist tendencies than about Donald Trump.
347,"February 16, 2017 10:04 am ET","Stocks to Watch: Kate Spade, MGM Resorts, Avon Products",
348,"February 16, 2017 09:37 am ET",Cenovus Energy Posts Surprise Quarterly Profit,"Cenovus Energy Inc. swung to a profit in the latest quarter, boosted by increased oil production."
349,"February 16, 2017 09:34 am ET",Suspend Your Disbelief: Here’s Why Two Bulls See Stocks Climbing From All-Time Highs,"A pair of distinctly different views from the bull camp both lay out cases for why stocks should rise--for awhile, at least."
350,"February 16, 2017 08:22 am ET",Yellen Defends Fed Efforts | Fed Officials Deliver the Message | Tarullo: Weak Demand Crimping Lending | Dudley: Makes Sense To Review Laws | Torry’s Take: Markets Put March in Play,"The Wall Street Journal’s central banking newsletter for Wednesday, Feb. 15, 2017"
351,"February 16, 2017 07:44 am ET",Encana Narrows Loss,Encana Corp. reported a smaller loss for the fourth quarter as the energy producer moved to cut costs.
352,"February 16, 2017 07:35 am ET",Oil Is Greasing the Wheels of Global Economy — Energy Journal,"The U.S. economy is showing signs of improvement amid an uptick in factory output,  increased petroleum production and a rise in consumer spending."
353,"February 16, 2017 06:35 am ET",Yellen Defends Fed Efforts | Fed Officials Deliver the Message | Tarullo: Weak Demand Crimping Lending | Dudley: Makes Sense To Review Laws | Torry’s Take: Markets Put March in Play,"The Wall Street Journal’s central banking newsletter for Wednesday, Feb. 15, 2017"
354,"February 16, 2017 12:08 am ET",WSJ’s Daily Shot: Americans’ Real Wage Growth Stalls as Inflation Bites,"* Broad increase in US CPI. * Americans go shopping (starting to use more plastic). * The Fed getting ready to get more aggressive with rate hikes. * Bonds take a hit but the stock market is now driven by ""irrational exuberance."" * Emerging market currencies (BRL, ZAR, EGP) rally. * China's interbank rate spikes as the PBoC tightens liquidity."
355,"February 15, 2017 11:37 pm ET",Oil Futures Edge Lower as Higher U.S. Inventories Weigh ,Crude oil futures edged lower in Asian trading on Thursday as higher U.S. oil inventories outweighed recent production cuts by Saudi Arabia and member nations of the Organization of the Petroleum Exporting Countries.
356,"February 15, 2017 05:28 pm ET",Data Signal Solid Momentum for U.S. Economy,"Stronger consumer spending, rising factory production and firming inflation are pointing to solid momentum for the U.S. economy and another interest-rate increase by the Federal Reserve, potentially as soon as next month."
357,"February 15, 2017 05:23 pm ET",Global Risks Begin to Recede,"It isn’t only in the U.S. that economic spirits are looking up, Greg Ip writes. Around the world, confidence is on the rise."
358,"February 15, 2017 05:07 pm ET",Bonanza Creek Energy Shareholders Weighing Rival Debt-Repayment Plan        ,Shareholders who have criticized oil-and-gas driller Bonanza Creek Energy Inc.’s restructuring plan have one week to reveal the financing details of a rival proposal to pay off the bankrupt company’s debts.   
359,"February 15, 2017 03:33 pm ET",Oil Prices Fall Slightly as U.S. Stockpiles Surge     ,Oil prices edged lower Wednesday after federal data showed that stockpiles of U.S. crude and gasoline surged to record levels last week.
360,"February 15, 2017 02:01 pm ET",Macquarie Can’t Skirt Bond Insurer’s $496 Million Toll Road Suit ,A New York judge rejected Macquarie Capital’s bid to toss a lawsuit from bond insurer Syncora Guarantee over $496 million in soured toll-road debt.
361,"February 15, 2017 10:00 am ET",U.S. Retail Sales in January Rose More Than Expected,"Retail sales rose broadly in January, a sign that firming wage gains and solid consumer sentiment could boost overall economic growth in 2017."
362,"February 15, 2017 09:26 am ET",Don’t Fight the Fed in 2017,"The markets have consistently bet against the Fed raising interest rates, and won. That may no longer be a winning bet."
363,"February 15, 2017 09:08 am ET",Retail Zombies Haunt Industry ,The lengthy list of retailers teetering on the edge of bankruptcy but not being allowed to die is holding the rest of the industry back. 
364,"February 15, 2017 09:05 am ET",Canada Factory Sales Post Surprise Surge in December ,"Canadian factory sales surprisingly surged in December, which capped off the best two-month performance in over five years and offered further evidence the economy has shifted into a higher gear. "
365,"February 15, 2017 08:35 am ET",U.S. Consumer Prices Up 0.6% in January,"A jump in gasoline prices helped push inflation to its strongest monthly gain in almost four years in January, a sign of steadily rising price pressures that may support additional moves by the Federal Reserve to raise interest rates this year."
366,"February 15, 2017 08:22 am ET","Acting SEC Chief Explains Deregulation Jumpstart | White Rejoins Law Firm | Big Bank’ Boom Times | Morgan Stanley Settles ETF Case | Borak’s Take: Tarullo Successor Will Have Clout, Yellen Signals","The Wall Street Journal’s financial regulation newsletter for Wednesday, February 15, 2017.​"
367,"February 15, 2017 08:04 am ET","Capital Journal Daybreak: Flynn Probed by FBI, More",
368,"February 15, 2017 08:04 am ET",Uganda’s Central Bank Cuts Lending Rate to 11.5%,Uganda’s central bank cut its key lending rate by 0.5 percentage point to 11.5% in an effort to support the commodity-driven economy despite rising food prices.
369,"February 15, 2017 07:12 am ET",Trump Does Away With Pay Disclosure Rule for Firms—Energy Journal,President Donald Trump Eliminated a Requirement that U.S. Companies Disclose Payments for Oil and Mineral Resources
370,"February 15, 2017 07:04 am ET",Tech Firms Fuel Berlin Office Boom ,Rental contracts in attractive central locations in Berlin are being auctioned off after years in which tenants were able to dictate lease terms and command perks.
371,"February 15, 2017 05:30 am ET",Saudis Ready Digital Push to Get Islamic Extremism Out of Schools,"The monarchy says it is determined to modernize its education system and the country more broadly, despite the pushback it has encountered from religious conservatives."
372,"February 15, 2017 03:17 am ET","WSJ City: The Wrong Kind of Inflation, Measuring OPEC’s Success, Foreign Investors’ Au Revoir",
373,"February 15, 2017 12:01 am ET",Air France-KLM Profit Climbs ,"Air France-KLM, Europe’s largest airline group by traffic, said net profit surged last year on a sharp drop in fuel costs, but warned that overcapacity in key markets is depressing airfares. "
374,"February 14, 2017 11:59 pm ET",Nigerian President’s Absence Intensifies Tensions,"Roiled by antigovernment protests, revived insurgencies and its worst recession in three decades, Africa’s most-populous nation is now fretting about the health of Nigerian President Muhammadu Buhari."
375,"February 14, 2017 11:44 pm ET",WSJ’s Daily Shot: Stock Market Ignoring Fed Warning Signs,* China's credit growth accelerates. * VIX futures hit new lows. * US small business sentiment takes off. * ECB buying up more bonds. * Inflation is picking up around the world. * Cheap cocoa isn't making chocolate cheaper.
376,"February 14, 2017 11:02 pm ET",Oil Futures Reverse Gains on Increased U.S. Oil Rig Activity ,Crude oil prices pulled back during early Asia trading on Wednesday reversing gains made in the New York session. 
377,"February 14, 2017 08:18 pm ET",Mexico’s Alfa to Sell Energy Assets ,"Mexican conglomerate Alfa SAB plans to sell a number of energy assets, including its share of the Eagle Ford Shale project in Texas, as it puts its energy industry expansion on hold. "
378,"February 14, 2017 07:53 pm ET",A Remarkable Turnaround for Stocks,"Last February, U.S. stocks were tumbling. Now, they are at all-time highs."
379,"February 14, 2017 07:15 pm ET",Pemex Sets Euro Corporate-Debt Record With $4.5 Billion Issue ,"Mexico’s national oil company Petróleos Mexicanos issued €4.25 billion ($4.5 billion) in bonds, the largest euro-denominated emerging-market corporate-bond deal on record."
380,"February 14, 2017 04:56 pm ET",Oil Inches Higher on OPEC Supply Cuts     ,Oil prices rose Tuesday on the back of data indicating that OPEC’s deal to cut production is holding.
381,"February 14, 2017 04:25 pm ET",One of the Last Bears in Oil Is Not Throwing in the Towel,"OPEC is following through on promises to cut oil production. Futures traders are betting on rising oil prices. Crude prices are rising back toward an 18-month high. Despite all that, Brian Singer is not convinced."
382,"February 14, 2017 01:18 pm ET","Despite Cheap Cocoa, the Price of Chocolate Will Break Valentine Hearts",
383,"February 14, 2017 11:17 am ET",Stone Energy Wins Approval for Bankruptcy-Exit Plan,Restructuring will reduce energy company’s debts by $1.2 billion and allow it to exit bankruptcy by the end of the month.
384,"February 14, 2017 10:17 am ET",Are OPEC’s Cuts Adding Up to Lower Oil Prices? ,Measuring the success of OPEC’s latest pledge to decrease oil output has never been harder as traders look beyond the group’s compliance numbers to gauge impact on prices. 
385,"February 14, 2017 09:18 am ET",Chinese Investors Pile Into London Property ,"While commercial real-estate deals in London have declined since Britain voted to leave the EU, one group of investors has become increasingly active: the Chinese."
386,"February 14, 2017 09:13 am ET",Investors Seek Protection Ahead of French Election,Investors were taken aback by political surprises last year. They aren't taking any chances when it comes to the forthcoming French elections.
387,"February 14, 2017 08:50 am ET","Yellen Testimony to Be Watched for Hints on Rates, Deregulation Concerns | New Reports Suggest Inflation Expectations Are Heating Up | Torry’s Take: Yellen Likely to Keep Her Options Open in Congressional Testimony","The Wall Street Journal’s central banking newsletter for Tuesday, February 14, 2017"
388,"February 14, 2017 07:45 am ET",Orion Energy Hits $480 Million Second Closing for Infrastructure Credit Fund,"The vehicle, Orion Energy Credit Opportunities Fund II LP, has a $750 million target. "
389,"February 14, 2017 07:17 am ET",The Morning Ledger: “Buy American”-Policy Presents Challenges to U.S. Steel Industry,"Different interpretations of what ""made in America"" means present a challenge for U.S. steel firms, PSA is looking into a potential acquisition of GM's European assets and Toshiba sees its Chairman depart."
390,"February 14, 2017 07:12 am ET",Taylor Woods Hedge-Fund Founders to Split ,The founders of commodities hedge-fund firm Taylor Woods Capital Management are splitting up after a 14% loss last year. 
391,"February 14, 2017 07:04 am ET",OPEC’s Supply Cut Isn’t Helping Oil Prices Much Lately—Energy Journal,OPEC's Compliance With Its Pledge to Cut Oil Output Isn't Helping Oil Prices Much Lately
392,"February 14, 2017 06:40 am ET",Today’s Top Supply Chain and Logistics News From WSJ,"Delivering up-to-the minute news, analysis, interviews and explanatory journalism on logistics, supply-chain management, e-commerce and more"
393,"February 14, 2017 12:01 am ET",What’s News: Business & Finance,What’s News: Business & Finance
394,"February 13, 2017 11:54 pm ET",Tesla Makes First Foray Into Middle East ,Tesla said it would accept online orders for its Model S sedan and Model X SUV in the United Arab Emirates. 
395,"February 13, 2017 11:32 pm ET",‘Buy America’ Tests Steel Industry,"With the Trump administration’s plans for $1 trillion infrastructure program using U.S.-made materials, some steel companies are concerned about how the policy is being interpreted."
396,"February 13, 2017 11:17 pm ET",China’s Prices Rise at Fastest Clip in More Than Two Years,"Prices in China climbed at their fastest pace last month in over two years, boosted by rising energy prices and Lunar New Year demand for food, though economists expect the momentum to wane before midyear. "
397,"February 13, 2017 10:35 pm ET",Oil Prices Edge Higher on OPEC Production Cuts ,"Crude prices moved higher in Asian trade Tuesday on evidence that major oil producers fulfilled their pledge to hold back production in January, but rising output elsewhere capped the gains. "
