,date,title,summary
0,"May 10, 2020 03:45 pm ET",Who Needs Oil When Even OPEC Telecommutes?,Changes wrought by the pandemic could dampen global demand for years and kill American shale.
1,"May 9, 2020 09:06 am ET",Putin Marks Victory Day Amid Pandemic With Muted Celebration,"Russian President Vladimir Putin held a watered-down celebration of the Soviet defeat of Nazi Germany on Saturday, with the coronavirus pandemic denying him what had been slated to be an extravagant display of Russia’s military might."
2,"May 8, 2020 05:45 pm ET",Why Is the Stock Market Rallying When the Economy Is So Bad?    ,Five reasons the stock market is soaring as the economy is floundering: from buoyant tech stocks to high earnings hopes to fear of missing out. 
3,"May 8, 2020 04:42 pm ET",Stocks Accelerate Gains After Jobs Report,"The Dow and S&P 500 rose, boosted by an April jobs report that wasn’t quite as bad as feared and signs of an easing in trade tensions between Washington and Beijing. "
4,"May 8, 2020 02:52 pm ET",Copper Rebounds on Hopes for Economic Recovery,"Copper prices rose, extending a recent rebound with investors anticipating an uptick in demand as parts of the world roll back lockdown measures and trade tensions ease. "
5,"May 8, 2020 02:33 pm ET",Penn Virginia Has Cash to Repay Lenders ,"On Thursday, Penn Virginia reported it had $20 million available under its revolver loan and $39 million in cash on hand, according to an earnings report. "
6,"May 8, 2020 01:44 pm ET",The Quant Taking On Climate Change ,"Robert Litterman was a legendary quantitative investor at Goldman Sachs. Now, as an adviser to federal regulators, he is urging action to manage the risk of global warming."
7,"May 8, 2020 10:22 am ET",Canada Set Fresh Job-Loss Record in April ,"Job losses in Canada nearly doubled in April from the previous month to mark a new record, and over a third of the labor force were either unemployed or underutilized."
8,"May 8, 2020 07:00 am ET",Americans Are Pumping Gas Again as States Reopen,"U.S. fuel makers see a gradual recovery in demand as coronavirus restrictions ease, but they warn the next months could be tough."
9,"May 7, 2020 09:13 pm ET",U.S. to Remove Patriot Missile Batteries From Saudi Arabia,"The U.S. is removing Patriot antimissile systems from Saudi Arabia and is considering reductions to other military assets—marking the end, for now, of a large-scale military buildup to counter Iran, according to U.S. officials. "
10,"May 7, 2020 05:03 pm ET",Transocean: Recovery Interrupted,"Transocean entered 2020 with its fleet mostly contracted through the first half, benefiting from what appeared to be the early stages of an industry recovery last year. But this is where the good news ends, writes Gimme Credit’s Evan I. Mann."
11,"May 7, 2020 03:38 pm ET",Soybean Futures Climb After China Makes Big Corn Purchase,
12,"May 7, 2020 03:05 pm ET",Natural Gas Drops After Rise in Stockpiles ,"Natural-gas prices fell, pausing a recent recovery after weekly inventory figures showed a larger-than-expected increase last week. "
13,"May 7, 2020 02:56 pm ET",The Glut Drowning the Oil Market ,The overwhelming supply of crude is threatening one of the world’s vital industries and could prolong the economic fallout from the coronavirus. 
14,"May 7, 2020 01:24 pm ET",Energy Spectrum Capital Closes $969 Million Fund VIII ,"Energy Spectrum Partners VIII LP received commitments from 82 limited partners, including pension funds, insurance companies, endowments and others. "
15,"May 7, 2020 12:46 pm ET",Islamic State Takes Fight to Iraqi Security Forces as Coalition’s Ties With Baghdad Fray ,"The militant group has stepped up attacks in Iraq, seeking to exploit cracks in Baghdad’s alliance with the U.S.-led coalition and new security challenges resulting from the coronavirus pandemic. "
16,"May 7, 2020 12:01 pm ET",Coronavirus Has Hit Some European Real-Estate Markets Harder Than Others,"How the pandemic has affected capital cities like London, Berlin and beyond."
17,"May 7, 2020 10:36 am ET",The Defense Haven Isn’t Overcrowded Yet    ,"The Covid-19 crisis highlights the attractiveness of defense contractors, but unwarranted fears about the U.S. government’s borrowing capacity are still holding back valuations.  "
18,"May 7, 2020 08:58 am ET",Fed’s Barkin Says U.S. Must Eventually Address Deficits; Lackluster Response to ECB Loan Program; BOE Stands Pat    ,"Richmond Fed leader Thomas Barkin said he’s concerned about mounting U.S. spending, saying that eventually there must be “real conversations” about how to deal with the cost of stimulus programs. In Europe, banks’ response to the European Central Bank’s loan program has been lackluster, while a senior ECB official said the central bank is “subject to the legal framework of the EU” in the wake of a critical ruling from Germany’s highest court. The Bank of England kept its policy on hold, while the central banks of Norway and Brazil both cut rates.  "
19,"May 7, 2020 08:13 am ET",Mexican Inflation Eases in April on Coronavirus Effects ,"Mexico’s consumer prices fell in April, pushing the annual inflation rate below the central bank’s 3% target as the fallout from the coronavirus pandemic slashed demand for many goods and services. "
20,"May 7, 2020 06:00 am ET",Warwick Aims to Wrap Up New Oil Investment Fund This Year ,Energy-focused firm Warwick Investment Group has collected more than $400 million so far for its new fund dedicated to buying working interests in oil-and-gas wells. 
21,"May 7, 2020 05:38 am ET",The Daily Shot: Nearly a Decade Worth of Job Gains Wiped Out in a Month,
22,"May 7, 2020 05:04 am ET",Norway’s Norges Bank Cuts Key Rate To Zero ,"In a surprise move, the central bank cut its key interest rate to zero, but made clear that it has now reached the floor for rates by ruling out any further cuts. "
23,"May 7, 2020 04:22 am ET",Global Food Prices Fall For Third Month as Coronavirus Saps Demand,
24,"May 6, 2020 04:41 pm ET","Dow Industrials Fall as Investors Look to Earnings, Economic Data ",The blue-chip index edged lower in a choppy trading session as investors continued to try to untangle data and corporate earnings to determine what the economy might look like in the months ahead. 
25,"May 6, 2020 03:23 pm ET",Oil’s ‘Relief Rally’ Stalls After Prices Double,The rally raises hopes—but not confidence—that the mounting fuel glut won’t overwhelm the world’s capacity to store oil.
26,"May 6, 2020 09:12 am ET",Pressure on Turkey’s Economy Builds as Lira Nears Record Low,"Turkey’s central bank has run short of foreign-currency reserves and has turned to the U.S. for possible help, but analysts say Washington is unlikely to oblige."
27,"May 6, 2020 08:55 am ET",Pro Bankruptcy Briefing: J.Crew Taps Bankruptcy Loan | Fortress Makes New Credit Bid for CraftWorks | Pioneer Energy Strikes Deal With Bondholders on New Plan    ,"J.Crew Group Inc. made its first appearance in bankruptcy court and won approval to tap more than $100 million in bankruptcy financing. Fortress Investment Group LLC said it would buy CraftWorks Holdings Inc. restaurant assets out of bankruptcy for a credit bid of $93 million, about $45 million less than it had initially offered. And Pioneer Energy Services Corp. has reached a new deal with a group of bondholders that had tried to renegotiate the company’s chapter 11 exit plan after oil prices went south.  "
28,"May 6, 2020 08:42 am ET",Some Fed Officials See the U.S. Recovering in Second Half; ECB Faces Renewed Legal Pressure Over Bond Purchases    ,"Three Fed officials said they are hopeful the U.S. economy will recover from the fallout of the coronavirus pandemic in the second half of this year. Meanwhile, lawmakers in Washington appear to be in support of giving small businesses some tax relief tied to loans in yet another bid to bolster the economy. And yesterday’s verdict from Germany’s highest court has left the European Central Bank facing renewed legal pressure over the future of its bond-buying program.  "
29,"May 6, 2020 08:02 am ET","In Russia, Putin Wrestles With Economic Impact of Coronavirus ",What was tipped to be a marquee year for the Russian leader has turned into one of the toughest challenges of his 20-year reign. 
30,"May 6, 2020 07:29 am ET",Chinese Bank Tries to Calm Storm Over Investors’ Oil Losses,"A top Chinese bank is trying to reach a deal with investors caught out by negative oil prices, after plans to hold individuals accountable for losses greater than their original investments drew scrutiny from regulators and sparked a social-media outcry."
31,"May 6, 2020 05:45 am ET",The Daily Shot: U.S. Exports Register the Biggest Decline in Recent History,
32,"May 6, 2020 12:01 am ET",What’s News: Business & Finance,What’s News: Business & Finance
33,"May 5, 2020 05:59 pm ET",Occidental Seeks to Lessen Roughly $40 Billion Debt Load,"Occidental Petroleum is examining ways to lessen its roughly $40 billion debt load following a historic plunge in oil prices and an ill-timed acquisition, which have put the Texas energy producer on shaky footing."
34,"May 5, 2020 05:32 pm ET",Recession Worries Moved Mexican Central Bank to Cut Rates in April,"The prospects of a deep economic recession and a sharp rise in unemployment as a result of the coronavirus pandemic prompted Mexican central bankers to cut interest rates for the second time in a month, minutes of the April meeting showed. "
35,"May 5, 2020 05:01 pm ET",Pioneer Strikes Deal With Bondholders to Exit Bankruptcy,The group had sought to renegotiate the restructuring plan after oil prices plunged. 
36,"May 5, 2020 04:21 pm ET",U.S. Stocks Rally for Second Straight Session,"The Dow and S&P 500 advanced, buoyed by optimism about the easing of restrictions on economic activity in parts of the U.S. and Europe."
37,"May 5, 2020 03:40 pm ET",Corn Rises as Oil Trends Higher,
38,"May 5, 2020 03:01 pm ET","Oil Prices Extend Rebound, Boosted by Demand Hopes    ",Crude prices were lifted by hopes for a bounce in fuel consumption as economies hard hit by the coronavirus pandemic slowly reopen for business.  
39,"May 5, 2020 02:47 pm ET",Total Pledges Net-Zero Emissions by 2050,French oil major Total SA said Tuesday it aims to achieve net-zero emissions by 2050 after engaging with a group of institutional investors with more than $40 trillion in assets.
40,"May 5, 2020 02:07 pm ET",U.S. March Trade Deficit Widened as Coronavirus Disruptions Spread,The U.S. trade deficit widened in March as the economic shock related to the coronavirus pandemic held down both imports and exports.
41,"May 5, 2020 12:49 pm ET",Services Businesses See Biggest Drop in Activity Since Last Recession ,"Activity across the U.S. service sector saw its steepest drop in April since the last recession as the coronavirus pandemic gained momentum, surveys of purchasing managers showed. "
42,"May 5, 2020 12:19 pm ET",BP Is Stuck in the Past ,British oil-and-gas producer BP is the only European supermajor that is carrying on as if nothing has permanently changed. 
43,"May 5, 2020 08:54 am ET","DuPont Swings to Loss, Posts Lower Sales ","The maker of nylon and other materials for the auto industry posted a net loss of $616 million, compared with a profit of $521 million in the same quarter last year. "
44,"May 5, 2020 08:40 am ET",California Is First State to Borrow From Federal Government to Cover Jobless Payments; German Court Expresses Concerns With ECB QE    ,"California became the first state to borrow from the Federal government to cover unemployment benefits, while lawmakers are starting to disagree about how much more to spend on stimulus. Outside the U.S., Germany’s highest court said the European Central Bank must justify its quantitative easing program.  "
45,"May 5, 2020 08:00 am ET",Property Investors See Fiber-Optic Cables as ‘Railroads of the Future’ ,"As business closures and stay-at-home orders hurt the real-estate sector, an obscure corner of the industry is benefiting from people staying at home."
46,"May 5, 2020 06:13 am ET",Assala Energy to Suspend Part of Operations in Gabon,
47,"May 5, 2020 06:02 am ET","WSJ Wealth Adviser Briefing: Investment Risk, Oil Majors, Grocery Delivery","Investors who wanted to account for stock-market danger have to figure which metrics to use; oil majors delayed deals amid volatile crude prices, and how to navigate grocery delivery services."
48,"May 5, 2020 05:46 am ET",The Daily Shot: Mexican Remittances Spike as U.S.-Based Workers Take Advantage of Weak Peso,
49,"May 5, 2020 05:30 am ET","Saudi Arabia, Hit With Oil Collapse and Pandemic, Tosses Lifelines ",The kingdom’s unprecedented stimulus measures to cushion the blow of collapsed oil prices and the coronavirus pandemic will force it to cut spending on its transformation away from oil.
50,"May 5, 2020 12:53 am ET",India Prepares Large-Scale Repatriation of Stranded Workers,"India is working with some Arab Gulf states in an effort to repatriate hundreds of thousands of migrant laborers stranded by the coronavirus pandemic, according to people familiar with the plans. "
51,"May 4, 2020 05:58 pm ET",Why You Can’t Find Rubbing Alcohol,The U.S. now has vast surpluses of a sanitizing liquid that consumers aren’t allowed to buy.
52,"May 4, 2020 05:54 pm ET",Boris and Bibi Ride Coronavirus Pandemic Popularity,"Covid-19 confirmed the ideas they’d been advancing, but other politicians struggle."
53,"May 4, 2020 04:23 pm ET","Stocks Rise Slightly Despite U.S.-China Tensions, Buffett Move","The Dow and S&P recovered losses and finished higher, following a rally in oil prices, as U.S.-China tensions escalated and investors reacted to Warren Buffett selling airline holdings."
54,"May 4, 2020 03:19 pm ET",Oil Prices End Higher After Another Volatile Session,"Oil prices erased a steep drop to close higher Monday, extending a recent stretch of volatile trading with investors retreating from near-dated futures contracts."
55,"May 4, 2020 01:22 pm ET","Some Shipping Lines May Not Survive Downturn, Hapag-Lloyd Chief Says ","Some container shipping companies may collapse if the global trade downturn stemming from coronavirus lockdowns extends to the end of the year or beyond, Hapag-Lloyd AG CEO Rolf Habben Jansen said. "
56,"May 4, 2020 12:44 pm ET",U.S. Factory Orders Plunged in March,"U.S. factory orders posted a record drop in March as efforts to contain the new coronavirus disrupted supply chains and quashed demand, the Commerce Department said."
57,"May 4, 2020 11:32 am ET","AGS WEEK AHEAD: More Rain Forecast for Europe, Black Sea; ISO Sugar Report Eyed",
58,"May 4, 2020 09:11 am ET",Pro Bankruptcy Briefing: J.Crew Files for Bankruptcy Protection | J. Jill Taps Restructuring Advisers | Antitrust Officials OK Dairy Co-op’s Purchase of Dean Foods    ,"J.Crew Group Inc., the preppy U.S. retailer that recently fell on hard times, Monday filed for bankruptcy protection. Women’s clothing retailer J. Jill Inc. has hired  investment bank Centerview Partners and law firm Kirkland & Ellis LLP to help fix its balance sheet after it had to close its stores due to the coronavirus pandemic, writes WSJ Pro’s Alex Gladstone and colleague Lillian Rizzo. Antitrust officials said they would approve the nation’s largest daily co-op buying Dean Foods Co. milk plants out of bankruptcy. And shale driller Ultra Petroleum Corp. is preparing to file for chapter 22, writes WSJ Pro’s Alex Gladstone and colleague Ryan Dezember, buckling once again.  "
59,"May 4, 2020 09:04 am ET",Fed Won’t Use Aid to Push Libor Replacement; Bank of Canada Picks New Governor; Jobs Report Likely to Show Record Unemployment    ,"The Fed has scrapped plans to use a new interest-rate benchmark in its Main Street Lending Program in the face of opposition from banks. Economists expect this week’s U.S. jobs report to show the highest unemployment rate since records began in 1948. And Tiff Macklem will become the Bank of Canada’s next governor. He was the bank’s senior deputy governor from 2010 to 2014, when Mark Carney was in charge.  "
60,"May 4, 2020 07:35 am ET","Oil Majors Delay Deals Amid Volatile Crude Prices, Lockdowns","Before Covid-19 and the oil-price rout, most of the world’s biggest energy companies had planned to sell billions in assets to help pay down debt and maintain dividends. Now, those divestment programs are in jeopardy."
61,"May 4, 2020 06:02 am ET","WSJ Wealth Adviser Briefing: Oil Crash Bet, Coal Producer Struggles, Museums Reopen","Investors were betting that the oil crash would weaken middle east currency pegs; coal producers struggled after years of investor payouts, and new rules were placed on visitors to reopening museums and galleries."
62,"May 4, 2020 05:54 am ET","ECB Survey Sees Slow Recovery, Low Inflation ","The coronavirus pandemic will likely lead to a period of benign inflation in the eurozone, according to a survey of ECB forecasters, rejecting suggestions that supply-chain bottlenecks and aggressive money-printing could push up consumer prices. "
63,"May 4, 2020 05:37 am ET",The Daily Shot: 40% of U.S. Small Businesses Are Skipping Rent in May,
64,"May 4, 2020 05:30 am ET","As Coronavirus Halts Tourism, Hawaii’s Job Losses Mount ","The state’s workforce has sought unemployment benefits at the highest rate in the nation since mid-March, reflecting how hard the coronavirus pandemic has hit its vital tourism industry."
65,"May 3, 2020 10:13 pm ET",Sustainable Funds Fell Less During the Selloff,"It is only a short period, but ESG funds held up a bit better than the overall market during the coronavirus-fueled stock drop. "
66,"May 3, 2020 10:06 pm ET",Good News for Investors Who Bet on Volatility,ETFs and ETNs linked to a volatility index have produced strong returns since the start of the year.
67,"May 3, 2020 10:00 pm ET",Oil ETF Is Down 83% So Far This Year,The $3.2 billion U.S. Oil ETF was pummeled by falling oil prices.
68,"May 3, 2020 09:00 am ET",Oil’s Crash Prompts Record Push to Store Fuel at Sea ,"The cost to ship gasoline, diesel and jet fuel around the world has soared to record highs, as traders look to dodge the commodity price crash by stashing refined oil at sea."
69,"May 3, 2020 05:30 am ET","Stocks Keep Rallying, Despite Lack of Visibility on Economy",Investors say they are “flying in the dark” as the dispersion of earnings estimates reaches its highest level since 2009. 
70,"May 3, 2020 12:29 am ET","Emerging and Growth Markets, May 2nd 2020",A weekly roundup of key news affecting emerging and growth markets from the Wall Street Journal and beyond.
71,"May 2, 2020 12:01 am ET",What’s News: Business & Finance,What’s News: Business & Finance
72,"May 2, 2020 12:00 am ET",Business After Coronavirus: How One Cleveland Restaurant’s Choices Ripple Through the Economy,"Ben Bebenroth had a restaurant, a catering business and a farm focused on local food. Now he is reimagining every aspect of his operation to survive in the coronavirus pandemic’s aftermath."
73,"May 1, 2020 08:57 pm ET",Transcript: St. Louis Fed President James Bullard Speaks With The Wall Street Journal,Federal Reserve Bank of St. Louis President James Bullard was interviewed by Michael S. Derby of The Wall Street Journal Friday.
74,"May 1, 2020 06:41 pm ET",Government Punts to Business,Spontaneous deregulation is happening as politicians turn to the public to fix the lockdown mess.
75,"May 1, 2020 04:58 pm ET",Tech Giants Pull Stocks Lower as Dow Falls More Than 600 Points,Shares slumped after Apple and Amazon reported earnings that highlighted the impact the coronavirus pandemic is having on the world’s biggest companies.
76,"May 1, 2020 04:43 pm ET",Rising Natural Gas Prices Are a Hot Bet ,"Investors, who just weeks ago shunned the fuel and the companies that sell it, are unwinding wagers that prices will fall, bidding up producers’ beaten-down shares and even buying their new bonds."
77,"May 1, 2020 04:26 pm ET",KPS Capital Bets on Energy in Buying Lufkin Unit of Baker Hughes ,"While many other investors are fleeing the energy industry, KPS Capital Partners is running straight into it. "
78,"May 1, 2020 04:20 pm ET","Ultra Petroleum Nears Another Bankruptcy, Showing Limits Of a Popular Trade","Ultra Petroleum Corp. is preparing to file for chapter 11 protection for the second time since 2016, according to people familiar with the matter, a sign of how some oil-and-gas companies that cleaned up their balance sheets in recent years are buckling once again."
79,"May 1, 2020 01:33 pm ET",Apollo Is Latest Private-Equity Firm Hammered by Coronavirus Rout,"The private-equity firm posted a first-quarter loss, becoming the third publicly traded private-equity firm to suffer financially from the pandemic."
80,"May 1, 2020 01:24 pm ET",Exxon: Heavy Lies the Dividend Crown ,"With oil prices in a meltdown and fuel demand in an epic slump due to the coronavirus pandemic, Exxon just reported its first quarterly loss in decades. Is it acting sensibly? The answer is a qualified ‘yes.’"
81,"May 1, 2020 09:52 am ET",Exxon Posts First Loss in Decades as Oil Giants Signal Trouble Ahead ,Exxon swung to a $610 million loss in the quarter as it took a “market-related” $2.9 billion charge. It reported $2.4 billion in profits during the same period last year.  
82,"May 1, 2020 08:49 am ET",AI Funds Decline—Then Recover—During Market Turmoil  ,Market experts warn the unpredictable nature of the economy these days could trip up some algorithms that rely on data gathered during better times. 
83,"May 1, 2020 08:42 am ET",Pro Bankruptcy Briefing: J.Crew Prepares for Bankruptcy | Lenders to Buy Dura Automotive | Revlon Lines Up $65 Million Loan    ,"J.Crew Group Inc., the preppy retailer backed by buyout firm TPG, is preparing to file for bankruptcy as soon as this weekend, writes WSJ Pro’s Soma Biswas and WSJ retail reporter Suzanne Kapner. Dura Automotive Systems LLC, a parts maker that drew buyout offers of more than $400 million less than two years ago, is being taken over by the company’s top lenders in bankruptcy for $55 million. And Revlon Inc. has lined up an additional $65 million in financing to help it weather the economic downturn over objections from a lender group, writes WSJ Pro’s Becky Yerak.  "
84,"May 1, 2020 08:35 am ET",Fed Loosens Main Street Lending Program’s Rules; ECB Makes Bargain Loans to Banks; BOC’s Poloz Defends Asset Purchases    ," As U.S. initial claims for unemployment benefits topped 30 million, the Fed expanded the scope of its forthcoming $600 billion lending program for small and midsize businesses hit by the coronavirus pandemic. Meanwhile, the European Central Bank said it would offer four-year loans to banks at an interest rate as low as minus 1%, while ECB President Christine Lagarde said the bank was ready to increase the scale of its new emergency bond-buying program “by as much as necessary and for as long as needed.” And the Bank of Canada’s Stephen Poloz defended the bank’s embrace of quantitative easing.  "
85,"May 1, 2020 08:26 am ET","Asia Keeps Up Oil Imports, and the Savings Add Up","Low oil prices are likely to help Asia’s largest economies restart as they begin to emerge from the worst of the coronavirus pandemic, although the lower cost isn’t a panacea."
86,"May 1, 2020 08:00 am ET",Soybeans Surge Higher -- Technical Analysis,
87,"May 1, 2020 06:05 am ET",The Daily Shot: U.S. Savings Rate Spikes,
88,"May 1, 2020 06:02 am ET","WSJ Wealth Adviser Briefing: Stock Market Surge, Cash-Hungry Firms, Financial Gift Giving","Investors who thought the market was missing something because it is up so much may have interpreted what has driven it up; cash-hungry companies reached for a lifeline in convertible bonds, and giving people financial gifts could lead to bad feelings."
89,"May 1, 2020 06:02 am ET",Gabon's 2019 Palm Oil Output Surged On Year,
90,"May 1, 2020 05:30 am ET",Investors Bet Oil Crash Will Weaken Middle East Currency Pegs,"Managed foreign-exchange rates in the Persian Gulf have survived financial crises, oil-price crashes and military conflicts. But crude’s recent drop to historic lows is tempting investors to bet against currency pegs once again."
91,"April 30, 2020 06:50 pm ET","Texas Shale Driller Concho Takes $12.6 Billion Charge, Citing Coronavirus Impacts ","Texas shale driller Concho Resources Inc. reported a net quarterly loss of $9.3 billion and wrote down the value of its oil and gas assets by $12.6 billion, a sign of the severe stress U.S. oil-and-gas companies are feeling as demand for their products erodes. "
92,"April 30, 2020 06:11 pm ET",Federal Reserve Expands Business Lending Program,"The Main Street Lending Program, unveiled earlier this month, will now allow larger businesses to participate, and it will relax minimum-loan amounts to help more small businesses."
93,"April 30, 2020 04:49 pm ET",Stocks Drop but Hold On to Big April Gains ,U.S. stocks finished their best month in decades on a downbeat note after fresh economic data further revealed the extent of the coronavirus pandemic’s damage.
94,"April 30, 2020 03:42 pm ET",Russian Prime Minister Tests Positive for Coronavirus ,"Russian Prime Minister Mikhail Mishustin said he tested positive for the new coronavirus and is temporarily suspending duties in office, as the country recorded its highest daily number of coronavirus cases."
95,"April 30, 2020 03:06 pm ET",Oil Rises on Hopes for Demand Recovery ,"Oil prices advanced in volatile trading, lifted by hopes for a rise in fuel consumption as lockdown measures to stop the coronavirus are rolled back. "
