,date,title,summary
273,"April 19, 2020 06:00 am ET",Fall of Natural Gas Prices Speeds Energy Shift in East Asia,"When natural gas became as cheap as coal in the U.S., it spawned an energy transformation that drove many companies out of business while generating opportunities for others. East Asia’s biggest economies are now going through the same upheaval. "
274,"April 19, 2020 12:01 am ET",Steelmakers’ Worst Slump in a Decade Seen Getting Worse ,U.S. steel companies are slashing production to match the collapse in demand and in anticipation that orders and prices will fall further.
275,"April 18, 2020 10:06 am ET","Emerging and Growth Markets, April 18th 2020",A weekly roundup of key news affecting emerging and growth markets from the Wall Street Journal and beyond.
276,"April 18, 2020 12:01 am ET",What’s News: Business & Finance,What’s News: Business & Finance
277,"April 17, 2020 06:44 pm ET",Moody’s Downgrades Mexico and State Oil Firm Pemex ,"Moody’s lowered Mexico’s credit rating Friday, becoming the third ratings firm to downgrade the country in recent weeks. "
278,"April 17, 2020 05:39 pm ET","Schlumberger Cuts Jobs, Slashes Dividend 75% in Historic Oil Rout ","The world’s largest oil driller is restructuring businesses, cutting jobs and closing facilities as it expects an acute downturn in oil-field activity. "
279,"April 17, 2020 04:11 pm ET",U.S. Crude Prices Drop to New 18-Year Low    ,"U.S. crude prices slid to a new 18-year low, recording another big weekly drop with the coronavirus pandemic erasing demand for fuel and pressuring energy producers."
280,"April 17, 2020 09:17 am ET",PE Daily: Private Equity’s PIPE Push | Montage’s Strategic Shift | PE-Backed Atomo Goes Public | China’s Centurium Puts New Fund on Hold    ,"It’s the end of another week of remote work here in Massachusetts, and the discussion about how and how to reopen the economy continues. Even if social-distancing rules are relaxed soon, it’s likely to take a while before the spread between buyer and seller price expectations reaches a new equilibrium and allows the flow of deal activity to get back to normal. In the meantime, some firms are looking to the public markets. As Will Louch and Preeti Singh report, private investments in public equity, or PIPEs, have surged this year. Preeti also has an interview with Christian Scharosch, managing director of family-office-backed Montage, about its tilt toward newer firms. Chris Cumming has news about what’s become an endangered species: an initial public offering. And an accounting scandal at a coffee chain has disrupted the fundraising plans of Chinese private-equity firm Centurium Capital.  "
281,"April 17, 2020 09:01 am ET",Pro Bankruptcy Briefing: Neiman Marcus Skips Bond Payments | Lenders Take Aim at Frontier Restructuring | McClatchy Gets Takeover Offer From Chatham    ,Luxury retailer Neiman Marcus Group Inc. is the latest chain to skip a payment owed to bondholders as the coronavirus pandemic keeps stores closed. Frontier Communications Corp.’s senior lenders say the telecommunications company’s prearranged bankruptcy workout is “a fragile house of cards” that won’t stand up in court. And a pair of hedge funds has agreed to forgive $263 million in debt in return for taking over the assets of newspaper publisher McClatchy Co.  
282,"April 17, 2020 08:54 am ET",Fed’s Williams Says Markets Have Stabilized; Tallying the Job-Market Damage; China Posts First Quarterly Drop in GDP    ,"As the Labor Department said 5.2 million Americans filed for unemployment benefits last week, New York Fed chief John Williams struck a hopeful note about the functioning of financial markets. Minneapolis Fed leader Neel Kashkari argued in the Financial Times that banks should suspend their dividend payouts. Elsewhere, China reported its first quarterly economic contraction on record, foreshadowing pain expected around the world as the coronavirus pandemic shuts borders, halts business activity and cripples supply chains. And central bankers in Sweden and Mexico are both, in different ways, at odds with politicians.  "
283,"April 17, 2020 07:00 am ET",Not a Bad Time to Be a Big Bank in a Relatively Quiet Week in Markets,"The stock market has been relatively tranquil this week, treading water in a nebulous middle ground between extremes. But there are still winners and losers."
284,"April 17, 2020 06:30 am ET",Flotilla of Saudi Oil Threatens to Worsen U.S. Supply Glut,"A fleet of tankers full of Saudi oil is slowly making its way to the U.S. Gulf Coast, threatening to worsen an already historic oversupply of crude. "
285,"April 17, 2020 05:59 am ET",The Daily Shot: States Are Rejecting Many Unemployment Applications,
286,"April 16, 2020 06:59 pm ET",America Won’t Have a Grand Reopening,The federal government should act to maintain private payrolls to the maximum extent possible.
287,"April 16, 2020 06:08 pm ET",Shale Driller Yuma Energy Files for Bankruptcy,"Yuma Energy, an oil-and-gas company that operates in Louisiana and Texas, has filed for bankruptcy, saying it has nearly run out of cash amid a downturn in energy prices and uncertainty about the coronavirus pandemic."
288,"April 16, 2020 03:12 pm ET","Oil Demand Will Fall by a Fifth in April, OPEC Forecasts ","Global oil demand will drop by 6.8 million barrels a day in 2020, with the sharpest contraction coming in April amid travel bans and lockdowns aimed at preventing the spread of the coronavirus, the Organization of the Petroleum Exporting Countries said. "
289,"April 16, 2020 12:32 pm ET",Shell Sets More Ambitious Emissions Goals ,Royal Dutch Shell agreed Thursday to set bolder carbon-emissions goals after engaging with a group of investors representing $40 trillion in assets under management. 
290,"April 16, 2020 08:58 am ET",Canadian Bankers Expect a Bond Boom ,"The Bank of Canada said it would buy Canadian corporate bonds for the first time, a move aimed at  unfreezing markets hit by coronavirus concerns."
291,"April 16, 2020 08:45 am ET",Pro Bankruptcy Briefing: Frontier Communications Files for Bankruptcy | J.C. Penney Skips Payment to Bondholders | Vince McMahon Wants Quick Sale of XFL    ,Telecommunications company Frontier Communications Corp. filed for bankruptcy with a $10 billion debt-for-equity swap with bondholders. Department store chain J.C. Penney Co. skipped a $12 million interest payment owed to bondholders setting the clock ticking on a bankruptcy filing. League founder Vince McMahon wants a quick sale of the XFL’s assets. Exploration and production company Yuma Energy Inc. filed for bankruptcy.  
292,"April 16, 2020 08:38 am ET",Beige Book Finds a Black-and-Blue U.S.; Brace for Another Unemployment Number; Bank of Canada Keeps Rates on Hold    ,"The Fed’s beige book painted a bleak picture of a U.S. economy hit by steep drops in consumer spending and industrial output last month. Today’s weekly jobless claims report will provide a new snapshot of the shock to the labor market. Outside the U.S., the Bank of Canada left its key rate unchanged after three cuts last month, while the Philippine central bank cut rates in an unscheduled move.  "
293,"April 16, 2020 08:00 am ET",Soybeans Retreat Third Session in Row -- Technical Analysis,
294,"April 16, 2020 06:07 am ET","WSJ Wealth Adviser Briefing: Airline Recession Threat, Saudi Dollar Bond, Travel Industry Devastation","The aid package for airlines shouldn’t be read as a recovery signal; Saudi Arabia marketed a dollar bond to plug spending gap amid low oil prices, and the coronavirus changed airlines, hotels and other travel businesses in a matter of weeks."
295,"April 16, 2020 05:40 am ET","The Daily Shot: U.S. Crude Oil Trading Below $20, Near 18-Year Lows",
296,"April 15, 2020 08:49 pm ET",New York State to Require Masks in Public Places,Gov. Andrew Cuomo said he was signing an executive order requiring people to wear a face covering when in a public setting where they can come into contact with others.
297,"April 15, 2020 07:14 pm ET",Fitch Cuts Mexico’s Ratings to Its Lowest Investment Grade ,"Fitch Ratings downgraded Mexico’s debt for the second time in less than a year, lowering its rating by one notch to the lowest investment grade, saying it expects a severe recession in 2020 as a result of the coronavirus pandemic."
298,"April 15, 2020 06:08 pm ET",Glutted Oil Markets’ Next Worry: Subzero Prices ,"As inventories of oil rapidly accumulate, producers could soon be forced to pay consumers to take it off their hands, effectively pushing prices below zero. "
299,"April 15, 2020 06:07 pm ET",Debt-Laden Occidental Opts to Pay Buffett’s Dividend in Shares ,"Occidental Petroleum has elected to pay a quarterly $200 million payment it owes Warren Buffett’s Berkshire Hathaway in shares, a sign of the financial strain the company is facing as the coronavirus erodes demand for oil. "
300,"April 15, 2020 04:45 pm ET",Stocks Drop as Oil Falls to 18-Year Low,The Dow and S&P 500 slid as investors assessed bank-earnings reports and dismal retail-sales numbers. The benchmark for U.S. crude prices settled below $20 a barrel for the first time since 2002. 
301,"April 15, 2020 04:08 pm ET",Swaths of U.S. Economy Froze in March,"Large chunks of the U.S. economy froze in March as the coronavirus pandemic closed malls, restaurants, factories and mines, causing Americans to cut retail spending by a record amount and the country’s industrial production output to plunge at the steepest rate in more than 70 years."
302,"April 15, 2020 03:38 pm ET",Saudi Arabia Set to Raise $7 Billion in Bond Sale to Plug Spending Gap,"Saudi Arabia is expected to raise around $7 billion via a dollar-denominated bond sale on Wednesday, joining other oil-exporting Persian Gulf states that tapped the debt markets to plug funding shortfalls."
303,"April 15, 2020 03:34 pm ET",Corn Futures Drop as Ethanol Production Slides to New Low,
304,"April 15, 2020 03:24 pm ET",Oil Demand Projected to Fall by Record Amount ,"Global oil demand is expected to fall by a record 9.3 million barrels a day this year as government-implemented lockdowns keep the economy at a near standstill, the International Energy Agency said."
305,"April 15, 2020 03:04 pm ET","Williams CFO Taps Debt, Poison Pill During Pandemic","Companies of all stripes have had to adapt their financial operations during the coronavirus pandemic. Oil and gas businesses such as Williams Cos. have been contending with the additional hurdle of a sharp decline in energy prices, which is pushing down stock prices."
306,"April 15, 2020 01:58 pm ET",Bank of Canada Leaves Key Interest Rate Unchanged ,The Bank of Canada left its key interest rate unchanged at 0.25% in a scheduled policy announcement on Wednesday and said it would begin purchasing provincial and corporate bonds to ease strains in those markets.
307,"April 15, 2020 12:35 pm ET",Dollar Climbs on Renewed Fears of Pandemic’s Cost,The dollar rallied against most currencies Wednesday as concerns about the economic impact of the coronavirus pandemic and the lack of a global policy response fueled investor jitters.
308,"April 15, 2020 06:00 am ET",BlackRock Raises $5.1 Billion for New Energy Infrastructure Fund,"BlackRock Inc. has raised $5.1 billion for a new fund focused on power plants, pipelines and other energy infrastructure assets and businesses."
309,"April 15, 2020 05:38 am ET",The Daily Shot: Record Dispersion in GDP Forecasts Amid Economic Uncertainty,
310,"April 14, 2020 05:50 pm ET",Texas Regulators Weigh Historic Oil Cuts as Coronavirus Saps Demand,The Railroad Commission of Texas is holding a hearing Tuesday at which oil industry leaders are debating whether the state could step in to restrict output—and opinions differ.
311,"April 14, 2020 05:15 pm ET",Stocks Gain as U.S. Weighs Restarting Economy,"U.S. stocks surged as investors looked ahead to the eventual reopening of the economy, even as earnings reports from big banks indicated that the coronavirus is taking a toll. "
312,"April 14, 2020 05:14 pm ET",Saudi Sovereign Wealth Fund Close to Completing $380 Million Deal for Premier League Soccer Club ,"Saudi Arabia’s sovereign-wealth fund is pressing forward with a roughly $380 million buyout of U.K. Premier League soccer team Newcastle United F.C., according to people familiar with the discussions."
313,"April 14, 2020 04:23 pm ET",Wells Fargo Profit Falls 89% Amid Coronavirus Crisis,The bank’s first-quarter profit sank 89% and it set aside billions of dollars to cover potential losses on loans to borrowers hurt by the coronavirus pandemic.
314,"April 14, 2020 02:51 pm ET",Oil Slides With Inventories Expected to Keep Rising ,"Crude prices fell, dropping back toward an 18-year low with inventories set to continue rising despite recent supply cuts. "
315,"April 14, 2020 12:29 pm ET",Banks Can Only Guess at Ultimate Virus Fallout ,JPMorgan Chase and Wells Fargo have set aside billions of dollars to cope with the coronavirus fallout. That may be far from enough. 
316,"April 14, 2020 10:16 am ET","Thirst for Oil Vanishes, Leaving Industry in Chaos    ","As people stay home to avoid the new coronavirus, storage tanks fill and rigs stop pumping, leaving the petroleum business “experiencing a shock like no other in its history.”"
317,"April 14, 2020 09:35 am ET",Pro Bankruptcy Briefing: Vince McMahon’s XFL Files for Bankruptcy | Fracking Company FTS International Hires Advisers | Retailer True Religion Files Chapter 22    ,"The coronavirus has upended Vince McMahon’s XFL reboot, and now the wrestling impresario will now try to sell his professional football league in bankruptcy. Hydraulic fracturing company FTS International Inc. has hired Lazard Ltd. and Kirkland & Ellis LLP amid the slump in commodity prices during the coronavirus pandemic, writes WSJ Pro’s Alex Gladstone. And  jeans maker True Religion is back in chapter 11 less than three years after it emerged from an earlier bankruptcy.  "
318,"April 14, 2020 09:12 am ET","Fed’s Clarida Says Programs Will Work; Grim New York Fed Activity Index; Pandemics Can Do Decades of Damage, Study Shows    ","Federal Reserve Vice Chairman Richard Clarida said the Fed’s program of support for the U.S. economy—which it says will enable $2.3 trillion in lending—will be enough to keep the U.S. economy out of deflation. Data from the New York Fed showed the fallout from the coronavirus pandemic intensifying. Meanwhile, a study of historic pandemics by the San Francisco Fed found that the economic aftereffects can last for about 40 years. And in Washington, President Trump said the federal government—not governors—will make the final call on letting Americans get back to work and reopening closed businesses.  "
319,"April 14, 2020 05:19 am ET",The Daily Shot: Freight Recession Deepens,
320,"April 13, 2020 07:08 pm ET",The Art of an Oil Deal,Trump uses diplomacy to limit the harm to U.S. shale producers. 
321,"April 13, 2020 05:57 pm ET","Trump Tactics, Plunging Demand Led to Oil Deal","The deal resolves a costly battle between Saudi Arabia and Russia that sank prices, delivering a win for the U.S. oil industry."
322,"April 13, 2020 05:31 pm ET",North America’s Oil Industry Is Shutting Off the Spigot,A sharp drop in fuel consumption caused by the coronavirus pandemic and exacerbated by a feud between the world’s largest producers has limited options for North American oil companies.
323,"April 13, 2020 05:13 pm ET","U.S. Treasury Yields Rise After Oil Agreement, Coronavirus Updates","The 30-year Treasury yield settled at 1.392%, its highest close since March 26."
324,"April 13, 2020 05:03 pm ET",GE’s Downgrade: Bad News Travels Slowly ,"GE is exposed in many ways to the economic downdraft of Covid-19, and Fitch’s downgrade is probably too mild and overdue."
325,"April 13, 2020 04:40 pm ET",Stocks Fall as Investors Brace for Earnings Season,"The S&P 500 slid, paring some of its gains after its best weekly performance since 1974, as investors looked ahead to the start of corporate earnings season. "
326,"April 13, 2020 03:57 pm ET",Soybean Futures Fall on Coronavirus Woes,
327,"April 13, 2020 03:06 pm ET",U.S. Crude Falls With Supply Cuts Inadequate to Combat Glut ,"U.S. crude-oil pared an earlier advance and closed lower, a sign of skepticism that global supply cuts will be enough to offset plunging fuel demand. "
328,"April 13, 2020 01:24 pm ET",Fracking Company FTS International Hires Restructuring Advisers ,The company has engaged restructuring advisers to help navigate the threat to its balance sheet caused by the slump in commodity prices amid the coronavirus pandemic. 
329,"April 13, 2020 09:47 am ET",Baker Hughes Pursues $1.8 Billion Restructuring Plan Amid Oil-Price Slump ,Baker Hughes said it is pursuing a restructuring plan that will result in about $1.8 billion in charges and expects to book a roughly $15 billion goodwill impairment charge for the first quarter as it faces the coronavirus pandemic and declines in oil and gas prices. 
330,"April 13, 2020 08:53 am ET",PE Daily: Silver Lake’s Consumer Quandary | Quantum Seeks $1 Billion | A Stimulus Lifeline for PE?    ,"As we enter yet another week of the world-wide collective battle against Covid-19, the economic toll is starting to add to the already horrific human one. Business closures are rapidly translating into furloughs and job losses. Private-equity backed companies aren’t immune from the fallout.  "
331,"April 13, 2020 08:43 am ET",Pro Bankruptcy Briefing: Chesapeake Investor Hires Akin Gump | Apex Parks Files for Bankruptcy | Judge OKs LA Times Owner’s Purchase of Hospital    ,"Mutual-fund company Franklin Resources Inc. has hired law firm Akin Gump Strauss Hauer & Feld LLP for negotiations with indebted oil-and-gas driller Chesapeake Energy Corp. Apex Parks Group LLC, whose amusement parks are closed due to the coronavirus pandemic, has filed for bankruptcy with plans to be acquired by a lender group led by Cerberus Capital Management LP. And the billionaire owner of the Los Angeles Times won court approval to buy the closed St. Vincent Medical Center out of bankruptcy and reopen it to help California fight the new coronavirus pandemic.  "
332,"April 13, 2020 08:34 am ET",Gauging Risks to Fed’s Independence; FAQs on the Fed’s Main Street Lending Program    ,"In his WSJ column, Greg Ip examines how the Fed’s key role in the response to the coronavirus crisis could create new threats to its independence. Meanwhile, if you have questions about the Fed’s Main Street Lending Program, you’re not alone. We have answers to some frequently asked questions about the program, and how the Fed may loan up to $600 billion through it.  "
333,"April 13, 2020 06:41 am ET","Newsletter: Oil, Ventilators, Toilet Paper and Pork",Your daily economics newsletter from The Wall Street Journal.
334,"April 13, 2020 05:56 am ET",The Daily Shot: Americans Familiarize Themselves with the Word ‘Forbearance’,
335,"April 13, 2020 12:01 am ET",What’s News: Business & Finance,What’s News: Business & Finance
336,"April 12, 2020 10:21 pm ET",The Art of the Oil Deal,"Donald Trump’s legendary deal-making ability during his years as a real-estate mogul is more fantasy than reality, but the president outdid himself in this weekend’s high-stakes oil diplomacy. "
337,"April 12, 2020 06:32 pm ET","U.S., Saudi Arabia, Russia Lead Pact for Record Oil Cuts","Twenty-three countries committed to withhold 9.7 million barrels a day of oil collectively from global markets. The deal, designed to address a mounting glut, came as President Trump intervened to help resolve a Saudi-Mexico standoff."
338,"April 12, 2020 01:16 pm ET",Auto Giants Trade Drills for Tweezers in Bid to Rush Coronavirus Ventilators,Ford and GM hope to head off a shortage of the lifesaving machines before the pandemic hits its peak. Little about their construction is like making cars and trucks.
339,"April 12, 2020 01:15 pm ET",What Would Ike Do About Current Oil Price Collapse?,Your editorial “Pain in the Oil Patch” (April 1) emphasizes business-government cooperation in a crisis. President Eisenhower successfully managed two related crises with some of the elements present today.
340,"April 12, 2020 08:00 am ET",Young Shale CEO Asks Texas to Curb Oil Output,"Matt Gallagher, the 37-year-old leader of Parsley Energy, wants fellow Texas oil producers to support a mandated production cut, as an industry where wildcatters frown at government intervention deals with a steep drop in crude prices amid the coronavirus pandemic."
341,"April 12, 2020 05:30 am ET",Looming Earnings Season Offers Next Test for Stock Market,The kickoff of earnings season this week will give investors a first glimpse of the impact of the coronavirus shutdown on corporate profits—and potentially clues about the outlook for the rest of the year.
342,"April 11, 2020 10:40 pm ET","Emerging and Growth Markets, April 11th 2020",A weekly roundup of key news affecting emerging and growth markets from the Wall Street Journal and beyond.
343,"April 10, 2020 07:50 pm ET",Industrialized Nations Fail to Come Up With Oil-Market Fix,A virtual summit of Group of 20 energy ministers failed to produce a detailed plan to help resolve an unprecedented oil glut partly triggered by the coronavirus pandemic.
344,"April 10, 2020 05:47 pm ET","Trump, Putin, Saudi Crown Prince Scramble to Fix Oil Markets ","The leaders of Russia, Saudi Arabia and the U.S. each badly miscalculated the pain caused by the collapse in oil prices. Now they are trying to rescue their economies and stave off any political damage at crucial moments for each. "
345,"April 10, 2020 05:26 pm ET",This Year’s Stress Test For Big Banks Is Real: the New Coronavirus,"The Fed is adjusting its annual “stress tests” for banks to incorporate lenders’ performance during the coronavirus-triggered downturn, which is worse than the hypothetical scenarios that the central bank previously planned. "
346,"April 10, 2020 04:51 pm ET",Markets Have Priced In the Lockdown Period. Now What?    ,"Two questions have buffeted financial markets over the past months: How long will Covid-19 lockdowns last; and how difficult will it be for the economy to recover? Investors are cheering early answers to the first, but shouldn’t forget they remain clueless about the second.  "
347,"April 10, 2020 02:15 pm ET",Bye Bye Bernie,"In these troubled times, America ruling out a socialist candidate is cause for optimism."
348,"April 10, 2020 12:25 pm ET",Coronavirus Disruptions Pushed U.S. Prices Down in March,U.S. consumer prices fell in March as oil prices plummeted and the economy began to strain under the new coronavirus pandemic.
349,"April 10, 2020 10:49 am ET",Russian Government Buys 50% Stake in Sberbank from Central Bank for $29 Billion ,The Russian government said it tapped its sovereign wealth fund to purchase the central bank’s 50% holding in the country’s largest lender. 
350,"April 10, 2020 09:32 am ET","Mexico to Cut Oil Production by 100,000 Barrels a Day ",Mexico’s president said the country will reduce its crude oil production as part of an agreement with OPEC and other producers to stabilize oil markets. 
351,"April 10, 2020 07:00 am ET","Quantum Energy Plans to Invest in Public Securities, Sources Say","Quantum Energy Partners is raising $500 million to $1 billion for a fund for investing in public securities, taking an unusual approach for a private-equity firm in a bid to capture gains from the latest slump in oil and gas."
352,"April 10, 2020 06:00 am ET",Commentary: Solving the Health-Care Equipment Supply Shortage ,"The woeful performance of these health-care supply chains raises the question of how such glaring shortages happened, asks MIT’s Yossi Sheffi. And just as important: How do we ensure that this doesn’t happen again? "
