,date,title,summary
204,"February 27, 2017 04:47 pm ET",Stock Market’s Latest Twist: Utilities Are Back on Top,"The S&P 500’s utility sector surged 4% last week, the group’s largest one-week advance since July of last year."
205,"February 27, 2017 04:04 pm ET",Oil Prices Settle Higher,Crude prices pared gains but settled higher Monday as investors continued to weigh rising U.S. crude production against high levels of compliance with OPEC’s production cut agreement.
206,"February 27, 2017 01:37 pm ET",Toisa Wants to Send Hyundai Dispute Back to London,Maritime shipping firm Toisa Ltd. says Hyundai Heavy Industries Co. owes it $90 million following the cancellation of a shipbuilding contract between the dry bulk carrier and the South Korean industrial giant.
207,"February 27, 2017 11:46 am ET",Manufacturing Activity Across Texas Up in February,"Manufacturing activity across Texas rose in February, according to a report Monday, and sentiment regarding future business conditions generally improved."
208,"February 27, 2017 10:38 am ET",Aircraft Sales Boosted U.S. Durable-Goods Orders in January,"Orders for long-lasting factory goods climbed last month due to purchases of military and civilian aircraft, overshadowing a weak start to 2017 for business investment in new equipment."
209,"February 27, 2017 09:47 am ET",Mexico Registers $3.29 Billion Trade Deficit in January,"Mexico ran up a trade deficit of $3.29 billion in January, similar to the year-ago gap as oil prices rose from a year before, pushing up both exports and imports of petroleum."
210,"February 27, 2017 09:37 am ET","Saudi King Leads Hundreds of Princes, Clerics, Military Officials on Asia Trip","Monarchy tries to build economic and religious ties in region, taking more independent tack after tensions with U.S. ally."
211,"February 27, 2017 09:34 am ET",Wesleyan Keeps Eye on the Long Game,"Five years into an effort to build its private-equity portfolio, the Wesleyan University endowment is still experiencing growing pains."
212,"February 27, 2017 08:03 am ET",Fed Loses Reliable Voice With Lockhart Exit | GAO: Modifying Stock Rules Could Diminish Fed Autonomy | Radical Experiment in Monetary Policy Isn’t Working | Former Regulators Warn Against Deregulation | Harrison’s Take: The March Towards March,"The Wall Street Journal’s central banking newsletter for Monday, February 27, 2017"
213,"February 27, 2017 07:59 am ET","Capital Journal Daybreak: GOP’s New Plan to Repeal Obamacare, More",
214,"February 27, 2017 07:26 am ET",The Morning Ledger: Chinese Firms Look at Investing More in U.S. Manufacturing,"A U.S. import tax could make more Chinese manufacturers set up factories in America, Warren Buffett believes he can still beat the market and a planned megamerger between the London Stock Exchange and Deutsche Börse is at risk."
215,"February 27, 2017 06:58 am ET",The Rise of a Global Oil-Price Guru—Energy Journal,"PIRA's Gary Ross Solidified His Fame With a Pessimistic 2014 Oil Price Forecast. Now Investors Pay Thousands of Dollars for His Insights,"
216,"February 27, 2017 06:42 am ET",Harrison’s Take: The March Towards March,This week is shaping up to be the one of the most consequential for the Federal Reserve so far this year.
217,"February 27, 2017 06:34 am ET",Fed Loses Reliable Voice With Lockhart Exit | GAO: Modifying Stock Rules Could Diminish Fed Autonomy | Radical Experiment in Monetary Policy Isn’t Working | Former Regulators Warn Against Deregulation | Harrison’s Take: The March Towards March,"The Wall Street Journal’s central banking newsletter for Monday, February 27, 2017"
218,"February 26, 2017 10:40 pm ET",WSJ’s Daily Shot: The Bond Market Loses Confidence in the Trump Bump,* The border tax is off again? * US rents continue to rise. * PPI rising in the Eurozone. * Brazil facing a credit crunch. *Mexico retail sales drop sharply.
219,"February 26, 2017 08:15 pm ET",Oil Prices See Modest Gains; Downside Pressure Remains ,"Crude futures drifted marginally higher in Asia Monday, but trading was largely tepid as investors saw little reason to rush back to the market."
220,"February 26, 2017 07:46 pm ET","Nikkei Down, Led by Insurers, as Hopes Wane for US Fiscal Steps ","Japanese stocks are down as market participants temper their expectations for a big, near-term U.S. fiscal stimulus ahead of Donald Trump’s address to Congress later this week."
221,"February 26, 2017 04:31 pm ET",The Illusory Flaws of ‘Border Adjustment’,Foreign exporters would pay for the Republicans’ proposed trillion-dollar corporate tax cut.
222,"February 26, 2017 02:07 pm ET",The World’s Most Radical Experiment in Monetary Policy Isn’t Working,"A generation of Japanese have grown accustomed to falling prices. That’s presented a seemingly impassable obstacle to the central bank, whose negative interest rates and other stimulus policies were supposed to spur wage and price increases."
223,"February 25, 2017 10:11 am ET",Wal-Mart Fights a Problem in the U.K.: It’s Too Pricey,"Wal-Mart’s Asda supermarket chain in the U.K., long one of its most profitable businesses, has been losing customers to discount rivals. Now it’s fighting back."
224,"February 25, 2017 09:00 am ET",Hasbro to Make Play-Doh American Again ,"Play-Doh will soon be squeezed out of a factory in the U.S. again, as Hasbro brings manufacturing of the popular moldable clay back to America, where it hasn’t been made since 2004."
225,"February 24, 2017 07:24 pm ET",Search for Yield Buoys Utilities Stocks,Utility companies posted their best weekly performance since July as investors poured money into dividend-paying stocks. Major indexes spent most of the session in the red before a buying spree in the last half-hour of trading buoyed shares.
226,"February 24, 2017 04:08 pm ET",Oil Prices Ease as U.S. Crude Stocks Rise Again    ,Oil prices eased as still bloated U.S. supplies continued to weigh on prices. 
227,"February 24, 2017 01:21 pm ET",U.S. Oil-Rig Count Climbs by Five,"The number of rigs drilling for oil in the U.S. rose by five in the past week to 602, according to oil-field services company Baker Hughes Inc., marking another week of increases."
228,"February 24, 2017 01:13 pm ET",Is Art Market Recovering? London Auctions May Tell,"In London, auctions with works by Picasso, Le Corbusier and Barceló could give evidence whether the ailing art market is finally turning around."
229,"February 24, 2017 01:05 pm ET",U.S. Oil Imports’ Path to Zero,"It was only 10 months ago that the U.S. was importing more crude than it had in years, and the idea of energy independence seemed strangely far away for a country in the middle of an oil boom.  Now it’s starting to look like a turning point has come."
230,"February 24, 2017 12:49 pm ET",From Arab Sheiks to Dakota Frackers: The Oil Industry’s Go-To Analyst ,Energy economist Gary Ross got his start in New York during a tumultuous period for oil in the 1970s. Now he boasts a personal network that spans the globe. 
231,"February 24, 2017 12:37 pm ET",Vale CEO to Step Down in May,"Brazilian mining giant Vale said its chief executive plans to step down when his term ends in May, amid reports of pressure to replace him with a political appointee."
232,"February 24, 2017 09:54 am ET",Cheap Flights to Europe: Bad for Airlines’ Fat Margins ,"The entry of long-haul, low-cost carriers like Norwegian Air to the trans-Atlantic market is upending a profitable patch for the likes of American, Delta and IAG-owned British Airways."
233,"February 24, 2017 09:12 am ET",Canada Inflation Breaks 2% Mark in January on Gas-Price Surge ,Inflation in Canada surged above the 2% mark in January on the biggest year-over-year jump in gasoline prices in over five years.
234,"February 24, 2017 08:50 am ET",Beware the Everything Rally,"The getting has been good. Stocks. Bonds. Gold. All have racked up gains this year, fueled by a Goldilocks-like mix of expectations for a dovish Federal Reserve and hope and uncertainty around the prospects for the Trump administration’s business-friendly policies."
235,"February 24, 2017 08:24 am ET","Royal Bank of Canada Posts Revenue, Profit Growth",Royal Bank of Canada posted revenue and profit growth in its first quarter because of lower loan-loss provisions and fewer insurance expenses.
236,"February 24, 2017 08:21 am ET",China Dials Back Its Lending to Wobbly Venezuela,"Beijing continued to lend money to Venezuela last year but in smaller amounts than the year before, reducing its exposure to one of the world’s worst-performing economies."
237,"February 24, 2017 07:30 am ET",Garcia’s Take: ‘Permania’ Sends Firms Running for a Profitable Exit,Private equity-backed energy companies already this year have sold billions of dollars in Permian Basin assets to publicly traded oil companies eager to expand their foothold in the region. 
238,"February 24, 2017 07:30 am ET",Garcia’s Take: ‘Permania’ Sends Firms Running for a Profitable Exit ,Private equity-backed energy companies already this year have sold billions of dollars in Permian Basin assets to publicly traded oil companies eager to expand their foothold in the region. 
239,"February 24, 2017 07:27 am ET",The Morning Ledger: Energy Sector Split over U.S. Border Tax,"For the U.S. oil-and-gas sector, a corporate tax overhaul proposed by House Republicans could be a game changer. Boeing said the plan could make it more competitive. Because of the uncertainty surrounding the plan, Viacom kept the backdoor open when it issued bonds worth $1.3 billion on Thursday."
240,"February 24, 2017 06:49 am ET",Emails Show EPA Chief Pruitt’s Work With Oil & Gas Firms—Energy Journal,Newly Released Emails Show Close Cooperation Between New EPA Chief Scott Pruitt And the Oil and Gas Industry
241,"February 24, 2017 06:47 am ET",British Airways Parent Jump-Starts Plans for Budget Trans-Atlantic Flights,"British Airways parent IAG said flights from Barcelona would start in June, a day after Norwegian Air Shuttle expanded its service with fares from $65. IAG also reported a 29% rise in profit and announced a share buyback."
242,"February 24, 2017 06:39 am ET",Today’s Top Supply Chain and Logistics News From WSJ,"Delivering up-to-the minute news, analysis, interviews and explanatory journalism on logistics, supply-chain management, e-commerce and more"
243,"February 24, 2017 06:38 am ET","The 10-Point: Gerard Baker on U.S. Tension with Mexico, China’s Economic-Team Shuffle and Oscar Activism","A personal, guided tour to the best scoops and stories every day in The Wall Street Journal, from Editor in Chief Gerard Baker."
244,"February 24, 2017 06:16 am ET",BASF May Invest in Iran’s Energy Sector,"BASF is exploring options for tapping Iran’s recently opened energy market, making it the latest in a long line of German firms looking to expand into the Islamic Republic. "
245,"February 24, 2017 05:43 am ET","U.S., Emerging-Market Stocks Get Trump Bump—but for Different Reasons","Stocks in the U.S. and emerging markets are on a tear, despite diverging views on how President Donald Trump’s economic plans will pan out. Less hawkish rhetoric on areas like trade and currencies is encouraging some investors that emerging-market stocks will be hit less hard than initially feared."
246,"February 23, 2017 11:55 pm ET",WSJ’s Daily Shot: Is the Reflation Trade in Trouble?,"* Copper, iron ore, other industrial commodities take a hit as the reflation trade questioned. * Gold rallies. * Infrastructure shares slump. * Retail stocks hammered on renewed talk of border tax. * Prison operators rally. * US crude oil production, exports on the rise. * Mexican peso recovers. *Brazil's credit crunch worsens. * China's wealth management products WMPs continue to pose risks. * Bitcoin is on fire."
247,"February 23, 2017 10:36 pm ET",Oil Prices Retreat But Trend Remains Upbeat ,Crude-oil prices moderated in Asia Friday as investors took profits following gains of over 1% during the New York session.
248,"February 23, 2017 07:13 pm ET",Belarus’s Russian Headache,The Kremlin isn’t happy as Minsk tries to move from Putin’s orbit.
249,"February 23, 2017 06:59 pm ET",Border-Adjustment Tax Divides Energy Sector ,"The proposal could benefit companies that export fuel products or sell domestic crude by making imported oil more expensive, but it also could hurt companies that must import crude from other countries."
250,"February 23, 2017 06:45 pm ET",Emerging-Market Currencies on the Rise After Postelection Rout,"Many major emerging-market currencies have clawed back the losses they suffered after Donald Trump’s election, the surest sign yet that investors believe accelerating global growth and a commodity-market rebound will continue. "
251,"February 23, 2017 05:31 pm ET",Soybeans Stage Land Grab as U.S. Farmers Chase Profits ,"Farmers are gearing up to sow more soybeans than ever before, betting on the oilseeds to keep them afloat as farm incomes drop for a fourth consecutive year. "
252,"February 23, 2017 04:34 pm ET",Oil Prices Settle Higher After U.S. Stocks Report ,Oil prices settled at their highest level in more than a year and a half as federal data showed U.S. crude glut grew more slowly than expected last week.
253,"February 23, 2017 04:30 pm ET",Where Are the Toilets? Order Glut Stretches Giant Jet Makers to Limit,"Steep production increases, caused by rapid airline expansion, are straining the supply chain that serves Airbus and Boeing. Suppliers of seats, toilets and engine parts are struggling to keep up."
254,"February 23, 2017 04:10 pm ET",Nasdaq Slips as Biotechnology Shares Decline,"Declines in biotechnology shares dragged down the Nasdaq Composite, pressuring an index that has soared so far this year. The Dow Jones Industrial Average climbed, setting another high."
255,"February 23, 2017 03:46 pm ET",Azure Midstream Cleared for March 10 Auction,Azure Midstream Partners LP received court approval to put a $151.1 million bid for its pipeline assets to the test at an auction next month.
256,"February 23, 2017 03:30 pm ET",Erickson Bondholders Object to Chapter 11 Plan,Indenture trustee Wilmington Trust objected to confirmation of a debt-cutting plan that would give bondholders control of the helicopter operator. 
257,"February 23, 2017 02:46 pm ET",Terra Firma Starts Sale Process for U.S. Wind-Energy Business ,"U.K. private-equity firm Terra Firma Capital Partners has launched a sale process for its U.S. wind-energy business, according to a person familiar with the matter, amid efforts by governments to reduce carbon emissions. "
258,"February 23, 2017 02:23 pm ET","Transcript: Fed’s Powell Discusses Inflation, Labor Market","Federal Reserve governor Jerome Powell took audience questions Wednesday following a speech to the Forecasters Club of New York. He discussed inflation, the labor market, financial regulation and the Fed’s balance sheet, among other topics. Here is a transcript of the exchange, lightly edited for clarity and length. "
259,"February 23, 2017 09:31 am ET",This Rally Is Crazy But It’s Nuts to Sell,"These are strange days for technical analysts. For those who seek out obscure clues to forecast the stock market’s next move, sell signals abound. The market, though, keeps chugging higher."
260,"February 23, 2017 08:36 am ET",Chesapeake Energy Revenue Falls on Cheaper Energy Prices,Chesapeake Energy said its fourth-quarter loss narrowed amid lower costs that helped offset a drop in revenue on reduced production and lower commodities prices. 
261,"February 23, 2017 08:00 am ET",Brazil Graft Scandal Has Firms Bulking Up Compliance Ranks ,"Companies in Brazil are racing to hire compliance officers to root out corruption, in a sign that the country’s investigation into graft at its state-run oil company is prompting a wider cleanup of Brazilian business. "
262,"February 23, 2017 07:22 am ET",The Morning Ledger: Mnuchin Plans Tax-Overhaul for August,"A U.S. tax-code overhaul could be secured by August, Treasury Secretary Steven Mnuchin said Wednesday. Exxon Mobil lowers its estimate of proved oil and gas reserves and Peugeot seeks to reassure governments over its planned acquisition of GM's European operations."
263,"February 23, 2017 07:02 am ET",Exxon Lowers Oil Reserve Estimates—Energy Journal,Exxon Mobil Corp. Says It Has to Shave Off about 15% of its Oil Reserves That Are Too Expensive to Extract
264,"February 23, 2017 06:26 am ET",Cashed Up Glencore Heads Back Into The Fray,Mining giant Glencore hasn’t wasted any time since its crisis to pivot back to acquisitions. 
265,"February 23, 2017 05:32 am ET",Wealth Adviser Briefing: Live Long and Don’t Prosper?,"WSJ Wealth Adviser highlights some of the top news and analysis for wealth advisers and their clients, with pieces today on longevity risk in retirement and, on the latest Watching Your Wealth podcast, how the wealthy deftly manage their money to get wealthier."
266,"February 23, 2017 02:01 am ET",Japanese Retail Investors Trade Trillions Amid Trump Tumult ,"U.S. President Donald Trump’s tumultuous first few months may be stressing policy makers and whipsawing some markets, but Japan’s day traders—a major force in yen trading—are having a blast. "
267,"February 23, 2017 12:01 am ET",What’s News: Business & Finance,What’s News: Business & Finance
268,"February 22, 2017 11:42 pm ET",WSJ’s Daily Shot: The Fed’s Ides of March,* An update on the FOMC minutes. * Next payrolls report could decide March hike. * Existing home sales highest in a decade. * Eurozone inflation keeps rising.  * German 2-year yield hits a record low.
269,"February 22, 2017 10:30 pm ET",Oil Prices Up But Remain Rangebound ,"Oil prices regained momentum in Asia Thursday, but the tug-of-war between ongoing supply cuts in the Middle East and increasing production in the U.S., kept prices rangebound."
270,"February 22, 2017 07:53 pm ET",Exxon Lowers Proved Reserve Estimates ,Extremely low energy prices during 2016 forced Exxon Mobil Corp. on Wednesday to lower its estimate of proved oil and gas reserves in the ground that the company controls. 
271,"February 22, 2017 06:37 pm ET",U.S. Stocks Pressured by Lower Oil Prices ,"A pullback in the price of oil weighed on shares of energy companies, dragging the S&P 500 slightly lower."
272,"February 22, 2017 04:56 pm ET",Southern Co.’s New ‘Clean Coal’ Plant May Not Be Cost-Efficient,"Southern Co. said it has nearly completed a first-of-its-kind “clean coal” power plant, though a new analysis suggests it might not make sense to burn coal in it."
273,"February 22, 2017 04:52 pm ET",Crude Rally Fizzles on Concerns Over U.S. Stockpiles,Oil prices retreated Wednesday on continued investor concern about high U.S. stockpiles.
274,"February 22, 2017 04:26 pm ET",Iraq Is a Huge Opportunity for Trump,"Abandoned in 2011, the country had made a remarkable comeback. The U.S. can help it succeed."
275,"February 22, 2017 02:43 pm ET",Oil Market Signals Doubt Over Border Adjustment Tax,"By one oil-market measure, investors are growing skeptical that the federal government will enact a controversial border adjustment tax."
276,"February 22, 2017 01:41 pm ET",Ultra Petroleum’s Earnings Surge With Chapter 11 Exit in Sight    ,Ultra Petroleum told investors it would ramp up capital spending and energy production this year to take advantage of a slimmed-down balance sheet once it emerges from chapter 11.  
277,"February 22, 2017 11:28 am ET",Fed Minutes Could Offer Hints on Timing of Rate Rises,"Minutes from the Federal Reserve’s latest policy meeting, to be released Wednesday, could provide insight on what officials are thinking about the timing of interest-rate increases and possible fiscal policy changes under the Trump administration."
278,"February 22, 2017 08:18 am ET",Non-OPEC Members Falling Short of Promised Production Cuts,"The best figures available, though imperfect, show reductions are “about 50%” of what was promised, Qatar’s oil minister said."
279,"February 22, 2017 08:08 am ET","Saudi Aramco, Petronas to Sign Joint-Venture Agreement","Saudi Arabian Oil Co., or Saudi Aramco, and Malaysia’s national oil company plan to sign an agreement Monday to jointly develop an up to $20 billion refining and petrochemicals project in the southern state of Johor, according to three people familiar with the matter. "
280,"February 22, 2017 07:55 am ET",What to Watch in Minutes | Kashkari Still Sees Room To Run Strongly | Williams Says Balance Sheet To Shrink | ECB Official Under Fire | Harrison’s Take: Will Minutes Reflect Cautious Statement or Bullish Fedspeak?,"The Wall Street Journal’s central banking newsletter for Wednesday, Feb. 22, 2017"
281,"February 22, 2017 07:20 am ET",The Morning Ledger: Tesla Expected to Burn More Cash Following SolarCity Integration,Tesla will today release its first earnings as a combined auto and clean-energy company. Saudi Aramco has chosen its IPO underwriters and ABB said it has been hit by a 'criminal scheme' in South Korea.
282,"February 22, 2017 07:16 am ET","Saudi Aramco Picks J.P. Morgan, HSBC, Morgan Stanley To Lead IPO—Energy Journal","State-owned Saudi Arabian Oil Co Has told J.P. Morgan, HSBC and Morgan Stanley They Will Be the Lead Underwriters for its Planned Initial Public Offering"
283,"February 21, 2017 11:57 pm ET",WSJ’s Daily Shot: From “Sell Everything” to “Buy Everything” in a Year,"* Fed officials talk 3 hikes. * Mortgage credit remains tight - 760 median borrower score. * Credit card debt now rising faster than auto loans. * Government can keep Fannie and Freddie earnings, court rules. * Credit spreads tighten. *Natural gas hammered on warm weather. * French spreads to Germany spike on Marine Le Pen's momentum in the polls."
284,"February 21, 2017 11:05 pm ET",Oil Up as OPEC Affirms Output Cut Plan ,U.S. oil prices stayed at a 19-month high in Asia Wednesday after oil leaders affirmed that the supply cut effort by heavyweights producers was making headway. 
285,"February 21, 2017 10:24 pm ET",Woodside Plans to Expand Western Australia LNG Output ,Woodside Petroleum is positioning to lift gas-export capacity in coming years in expectation that still-rising supplies of liquefied natural gas will be absorbed by higher Asian demand. 
286,"February 21, 2017 07:13 pm ET",Kuwait to Replace Wealth Fund Chief ,"The Kuwait Investment Authority is replacing its longstanding managing director, Bader Al-Saad, with the sovereign-wealth fund’s head of alternative investments, according to a person familiar with the matter."
287,"February 21, 2017 06:44 pm ET",Stock Indexes Climb to Records,"U.S. stock indexes notched fresh records, with all 11 sectors of the S&P 500 posting gains."
288,"February 21, 2017 06:38 pm ET","Saudi Aramco Picks J.P. Morgan, HSBC, Morgan Stanley as IPO Underwriters","Saudi Arabia’s state-owned energy company has told J.P. Morgan, HSBC and Morgan Stanley they will be the lead underwriters for its planned initial public offering, set to be the largest ever, according to people familiar with the matter. "
289,"February 21, 2017 05:47 pm ET",Woodside Annual Profit Jumps as Production Rises,Woodside Petroleum’s profit rebounded last year as production rose and the oil-and-gas producer didn’t see a repeat of the hefty charges that nearly tipped it to a loss in 2015. 
290,"February 21, 2017 05:04 pm ET",Oil Prices Rise on OPEC Optimism,U.S. oil prices rose to meet a 19-month high Tuesday as comments from leaders of the Organization of the Petroleum Exporting Countries encouraged investors to bet on shrinking supply and rising prices. 
291,"February 21, 2017 04:53 pm ET",States Push to Raise Gasoline Taxes      ,Republican and Democratic governors look to motorists at the gas pump to pay for road repairs and improvements.
292,"February 21, 2017 04:36 pm ET","Transcript: Fed’s Neel Kashkari Speaks in Golden Valley, Minn.","Minneapolis Fed President Neel Kashkari talked about the issue of “too big to fail” banks, watching for asset bubbles and sluggish productivity growth."
293,"February 21, 2017 04:25 pm ET",OPEC Chief Sees No U.S. Threat as Shale Production Rises,"OPEC Secretary-General Mohammed Barkindo said he would meet U.S. shale producers, as he sought to allay fears his cartel could be hurt by resurgent American output and the policies of President Donald Trump."
294,"February 21, 2017 12:51 pm ET","WSJ City’s Afternoon Briefing: Juncker Warns of ‘Steep’ Brexit Bill, BOE Defends Easing and Forecasts",
295,"February 21, 2017 09:39 am ET",Flynn’s Early Departure,A transcript of the weekend’s program on FOX News Channel.
296,"February 21, 2017 09:13 am ET",Value Stocks Can Retake the Leadership Position,"Investors shouldn’t give up on value stocks just yet. There’s one good reason to believe they will regain momentum and keep on chugging higher: Historically, they’re still cheap relative to their growth counterparts."
297,"February 21, 2017 08:14 am ET","The Morning Download: Ticketmaster, in Pursuit of Agility, Moves Infrastructure to Public Cloud","Live Nation Entertainment Inc.'s Ticketmaster is moving its massive IT infrastructure to the cloud, joining a growing number of large enterprises that are running core operations outside of their own data centers.  The cloud migration will allow the company’s developers to write software faster and respond to changes in consumer behavior sooner, CTO Jody Mulkey said."
298,"February 21, 2017 08:08 am ET",Trump Will Be Able to Recast the Fed | Carstens Postpones Departure | BOJ’s Kuroda Won’t Raise Rates | BOE Still Sees Brexit Damaging Economy | Buell’s Take: The Politics of ECB Tightening,"The Wall Street Journal’s central banking newsletter for Tuesday, Feb. 21, 2017"
