,date,title,summary
107,"November 25, 2019 07:06 pm ET",The Fighting Continues in Northern Syria,"The Kurds vow to defend themselves—alone if necessary—against Syria, Turkey and Russia."
108,"November 25, 2019 07:04 pm ET",I Should Never Have Gotten Involved With the MOB,Owning a medical office building proved too much to handle for this simple residential landlord.
109,"November 25, 2019 03:28 pm ET","Iranians Hold Pro-Establishment Rallies, Blaming U.S. for Unrest",Thousands of Iranians staged a pro-establishment rally in Tehran and other cities in a show of support after the country’s leaders suppressed protests that erupted this month over a sudden hike in gasoline prices.
110,"November 25, 2019 03:00 pm ET",Fresh Trade Optimism Hits Gold,"Monday reports that the U.S. and China are closing in on an initial trade accord represent the latest blow to gold’s 2019 rally, another threat to investors who had piled into bullion earlier in the year."
111,"November 25, 2019 01:15 pm ET",Here’s Something Else You’re Doing Wrong: Soy Sauce,"Forget that red-capped grocery store bottle, the humble condiment is putting on wine-like airs. Barrel-aged versions of soy sauce catch on with foodies in the U.S., ‘complex’ flavor"
112,"November 25, 2019 11:48 am ET",Inside the Mass-Tort Machine That Powers Thousands of Roundup Lawsuits,The weedkiller made by Bayer is the target of a sophisticated legal ecosystem that includes marketing firms to find potential clients. “Call the number on your screen now.”
113,"November 25, 2019 08:49 am ET",Big Oil Differs on Climate Change Strategy—Energy Journal,
114,"November 25, 2019 06:02 am ET","WSJ Wealth Adviser Briefing: Future of Online Trading, Tiny Tax Moves, Your Health Data","Potential merger between TD Ameritrade and Charles Schwab would help the pair bulk up in areas beyond commission-free trading; tiny tax moves can save you big on Medicare premiums, and your health data isn’t as safe as you think."
115,"November 25, 2019 03:47 am ET",The Daily Shot: Have Persistently Low Rates Depressed Productivity Growth?,
116,"November 24, 2019 02:21 pm ET",Parched Countries Tap the Nile River Through Farms,Oil-rich Gulf states grow crops in Egypt and Sudan to export out of Africa. That leaves locals increasingly dependent on imports to survive.
117,"November 24, 2019 09:14 am ET",How Apple and Microsoft Dwarf the Rest of the Market ,"Apple and Microsoft helped lift the Dow industrials above 28000 for the first time earlier this month, a milestone that underscored how much the two largest U.S. companies influence major stock indexes. "
118,"November 23, 2019 11:07 am ET","Emerging and Growth Markets, November 23rd 2019",A weekly roundup of key news affecting emerging and growth markets from the Wall Street Journal and beyond.
119,"November 23, 2019 01:52 am ET",How the Saudi Aramco IPO Came Back to Life       ,"To revive oil giant Aramco’s long-delayed initial public offering, the Saudi crown prince has slashed through his bureaucracy to silence or remove naysayers."
120,"November 22, 2019 04:32 pm ET",Investors Spurn Riskiest Corporate Bonds ,"Investors are demanding more compensation to hold the lowest-rated tier of U.S. corporate bonds than at any time in more than three years, highlighting a selloff that some have taken as a warning signal for other riskier assets. "
121,"November 22, 2019 03:32 pm ET",Shale Drillers’ Latest Problems: Hog Manure and Chicken Guts ,"It isn’t just Appalachian shale drillers that are swamping the natural-gas market. Chicken slaughterhouses, pig farms, expired yogurt and leftover bits from your last meal are contributing to the glut."
122,"November 22, 2019 01:01 pm ET","The Next Time You Trade in Your Car, It Could Be for a Phone ","To widen commuting options, new efforts aim to tie together all forms of transit within one mobile app. "
123,"November 22, 2019 11:07 am ET","It’s Slow Going, but Stuff Like Wheat and Oil Can Spice Up Your Returns",Investing in commodities can pay off. Just don’t expect to get rich quick.
124,"November 22, 2019 10:36 am ET",Exxon Is One of the Most Innovative Companies. But It Still (Mostly) Shuns Renewables.,The company is pouring money into making oil and gas as competitive as possible.
125,"November 22, 2019 09:34 am ET",PE Daily: Makeup Mixes With AI | Levine Leichtman Backs Tool Maker | WeWork Job Cuts Reach U.S.    ,"Good day to all and TGIF! Heading into a shortened holiday week we have an unusual deal story to tell, as WSJ Pro’s Luis Garcia reports on a beauty brand backed by L Catterton, Il Makiage, acquiring an AI company started by Israeli intelligence service veterans. The mix is aimed at making the brand’s e-commerce website a more eye-opening experience.  "
126,"November 22, 2019 05:30 am ET",Punt on Patriot Act Sets Up New Push by Opponents ,"The short-term renewal of the Patriot Act sets up an effort in Congress next year to strip the NSA of its metadata-collection program; conservative conference expands globally with assistance from Trump officials and allies, and more in Washington Wire. "
127,"November 22, 2019 03:49 am ET",The Daily Shot: Will the Fed Engineer a Fourth Mini-Cycle as the Third One Ends?,
128,"November 21, 2019 05:40 pm ET",Bearish Oil-Drilling Indicator Is Full of Holes ,"Energy traders think that oil from thousands of drilled but uncompleted wells can flood the market and keep raising output, but their assumptions may be way off, paving the way for higher crude prices. "
129,"November 21, 2019 03:08 pm ET",Falling Industrial Metals Highlight Lingering Trade Concerns,Falling prices of industrial metals such as copper and aluminum signal that some investors remain wary of setbacks to a U.S.-China trade deal.
130,"November 21, 2019 09:33 am ET",PE Daily: MBK Bags $6.5 Billion | Ethos .org Deal Spurs Concerns | Energy Capital Faces Claims of Mismanagement    ,"Good morning! As we near Thanksgiving week, plenty of firms are starting to chalk up the year’s numbers, and one, in Seoul, has much to be thankful about.  "
131,"November 21, 2019 08:00 am ET",End of Libor Creates Uncertainty for CME’s Giant Eurodollar Market ,"As the end of Libor looms, Eurodollar futures, which let traders bet on moves in short-term interest rates, are poised for the biggest shake-up since 1981."
132,"November 21, 2019 06:02 am ET","WSJ Wealth Adviser Briefing: Battery Metals, Mall Owners, Plane Seats","Battery metal stocks slide as other commodities stabilize; Carl Icahn places a big bet that mall owners won't be able to pay their debts, and many airlines ignore customer concerns about cramped seat spaces."
133,"November 21, 2019 03:34 am ET",The Daily Shot: U.S. Freight Recession Persists,
134,"November 20, 2019 07:00 pm ET",Oil Rallies as Stockpiles Rise Less Than Expected,Crude-oil prices snapped a two-session streak of declines after a weekly government report showed a smaller-than-anticipated rise in inventories.
135,"November 20, 2019 06:13 pm ET",Trudeau Turns to Trade-Deal Lieutenant to Quell Tension Over Energy ,"Canada’s Justin Trudeau is turning to Chrystia Freeland, his former foreign minister, to quell escalating regional tensions over resource development, as the prime minister unveils a new cabinet for his minority government."
136,"November 20, 2019 04:17 pm ET",Battery Metals Slide as Other Commodities Stabilize,"Commodities from oil to sugar are rebounding on hopes for a U.S.-China trade deal, but investors’ positive mood hasn’t extended to metals used in rechargeable batteries. "
137,"November 20, 2019 03:04 pm ET","China’s Slowing Economy, Rising Inflation Handcuff Central Bank","The People’s Bank of China, sticking with a rate-cutting strategy that hasn’t done much to reduce borrowing costs, made small reductions in its new reference rates for commercial-bank loans. "
138,"November 20, 2019 09:07 am ET",Pro Bankruptcy Briefing: Energy Slowdown Hits Approach Resources | General Motors Safe From Punitive Damages | California Resources Dives on Drilling Halt    ,"Good day. Financial distress in the U.S. oil patch seems to be accelerating, with Approach Resources Inc. becoming the latest energy explorer to wind up in chapter 11.  "
139,"November 20, 2019 03:55 am ET",The Daily Shot: Residential Construction Rebounds,
140,"November 19, 2019 09:45 pm ET","Iran Hands Out Cash, Backs Pro-Regime Rallies to Stop Protests","The new measures, which the government said had taken effect on Tuesday, come amid reports of a rising death toll and more arrests of protesters in Tehran and other major cities."
141,"November 19, 2019 08:03 pm ET",Should the Government Subsidize Nuclear Power? Advocates Square Off,"Nuclear-power proponents argue that the plants are the most reliable source of green power around. But critics say renewables are improving steadily, removing any need for nuclear."
142,"November 19, 2019 07:05 pm ET",Are Oil-and-Gas Companies a Good Investment?,A capital-intensive business has struggled to generate returns for shareholders—and now might face growing risks over climate change.
143,"November 19, 2019 07:02 pm ET",What Would Happen if the U.S. Banned Fracking?,Two experts discuss the consequences of eliminating fracking and whether to go all in or take a more gradual approach.
144,"November 19, 2019 05:37 pm ET",Conductors Begin Strike at Canadian National Railway ,Canadian National Railway conductors went on strike as talks over a new collective agreement continued past a midnight deadline set by their union. 
145,"November 19, 2019 04:08 pm ET",Fears of Excess Supply Hurt Oil ,"Fresh worries about excess oil supply are dragging down crude prices once again, reinforcing a trend that continues to weigh on the energy sector. "
146,"November 19, 2019 02:56 pm ET",Companies Adjust Financial Communications to Resonate With Humans and Robots ,"As markets scour financial statements for trading clues, executives turn to machine-learning tools, perception studies and speech recognition to help them choose their words carefully."
147,"November 19, 2019 02:08 pm ET",Should Cities Phase Out Gas Appliances and Require New Buildings to Be Electric?,Environmentalists say it will help accelerate the transition to a clean-energy future. Skeptics say it could hurt the environment more than it helps it.
148,"November 19, 2019 12:39 pm ET",Why Cheap Money Hasn’t Led to a Corporate Spending Boom ,"Weak economic growth made new factories unappealing, while the disruptive technologies where investors wanted to spend didn’t involve much investment."
149,"November 19, 2019 12:18 pm ET",Approach Resources Becomes Latest Energy Company to Declare Bankruptcy ,"The Fort Worth, Texas-based oil-and-gas company filed for bankruptcy Monday, saying it would consider options including a restructuring of its balance sheet and a going-concern sale. "
150,"November 19, 2019 08:46 am ET",Winter Relief for Europe’s Airlines Raises Too Many Hopes    ,Investors were expecting too little of European airlines going into the winter low season. Now they may be expecting too much.  
151,"November 19, 2019 06:41 am ET",Newsletter: The U.S. Is Producing Lots of Jobs. Are They Good Jobs?,Your daily economics newsletter from The Wall Street Journal.
152,"November 18, 2019 07:23 pm ET",Indigenous Bolivians March on Capital City ,"Thousands of indigenous Bolivians flooded into the capital, La Paz, on Monday as part of a broader effort to fatally weaken the one-week-old government of interim President Jeanine Añez, in part by depriving it of food and fuel. "
153,"November 18, 2019 05:35 pm ET",Airbus Books $14 Billion Deal With Air Arabia,The deal underscores the disadvantage American plane maker Boeing is facing for orders amid an eight-month grounding of the 737 MAX.
154,"November 18, 2019 05:13 pm ET",Why Luxury Giants Keep Popping the Question,Good things rarely come in small packages anymore in the luxury goods industry. The new advantages of scale mean investors can expect more takeover approaches like LVMH’s recent $14.5 billion bid for Tiffany.
155,"November 18, 2019 04:20 pm ET",U.S. Stocks Tick Higher in Quiet Session,"The Dow Jones Industrial Average, S&P 500 and Nasdaq Composite set another trio of closing records. But with few major economic and earnings reports on the calendar, the stock market’s moves were relatively muted. "
156,"November 18, 2019 12:53 pm ET",Sanchez Energy Wants to Override Junior Creditors on Restructuring Officer,"Sanchez Energy is seeking to appoint its preferred candidate for a chief restructuring officer at the behest of its top lenders, despite junior creditors’ requests for a different selection, according to a court filing."
157,"November 18, 2019 10:44 am ET",Uprisings Against the Mullahs,"Short on cash, the regime faces protests at home and in Iraq."
158,"November 18, 2019 09:51 am ET",Aramco Won’t Get Any Help From an Overpriced IPO,"By insisting on a high starting price for the Saudi oil giant, Crown Prince Mohammed bin Salman risks hitting local individual investors.  "
159,"November 18, 2019 09:42 am ET",PE Daily: Mass PRIM Hires Albourne | Bumble Bee Preps for Bankruptcy | Athletes Team Up With Private Equity | Non-Profit Primes the Diversity Pipeline    ,"Good day! I hope everyone had a great weekend! In recent years, I’ve heard more discussion among limited partners about the role of operational due diligence in selecting managers.  "
160,"November 18, 2019 09:23 am ET",Pro Bankruptcy Briefing: Bumble Bee Foods Prepares for Bankruptcy | Senior Bondholders Want EP Energy | MDC Energy Lenders Scrutinizing Transfers    ,"Good day. Canned tuna maker Bumble Bee Foods LLC is preparing to file for bankruptcy within days, writes WSJ Pro’s Alexander Gladstone.  "
161,"November 18, 2019 08:46 am ET",New Aramco IPO Deadline Looms—Energy Journal,
162,"November 18, 2019 08:21 am ET",Manufacturers Face New Threat From Fracking Slump,Slowing shale-drilling activity is the latest damper on U.S. manufacturers that had come to rely on a booming domestic energy market. 
163,"November 18, 2019 06:02 am ET","WSJ Wealth Adviser Briefing: China’s VC Boom Ends, U.S. Trade Uncertainty, Echo Studio","China’s venture-capital boom ends, Powell optimistic on economy but warns on trade, and a review of Amazon's Echo Studio."
164,"November 18, 2019 04:37 am ET",The Daily Shot: Temp Staffing Declining at the Fastest Pace in a Decade,
165,"November 17, 2019 03:19 pm ET",Aramco IPO Aims to Value Energy Giant at Up to $1.7 Trillion,"Saudi Arabia’s state-owned energy company is aiming for a valuation of $1.6 trillion to $1.7 trillion from its planned initial public offering, falling well short of the initial $2 trillion targeted by Crown Prince Mohammed bin Salman."
166,"November 16, 2019 10:15 am ET","Emerging and Growth Markets, November 16th 2019",A weekly roundup of key news affecting emerging and growth markets from the Wall Street Journal and beyond.
167,"November 16, 2019 12:01 am ET",Struggling Farmers Are Key to Trump’s Hopes in Minnesota,"Many of the struggling farmers in southern Minnesota who voted for President Trump in 2016 say they plan to do so again next year, which would be key for him as he hopes to flip a state he narrowly lost in 2016.  "
168,"November 15, 2019 05:56 pm ET",EP Energy Bondholders Want Control of the Company ,"Weighed down by $4.9 billion in debt and slumping oil prices, EP Energy filed for chapter 11 protection last month, the largest bankruptcy among U.S. energy producers since 2016. The Houston-based company has proposed a restructuring backed by junior bondholders that would turn them into shareholders while cutting $3.3 billion in debt. "
169,"November 15, 2019 03:21 pm ET",Billionaire Mexican Is Behind Company Suing Government      ,"A $2.4 billion lawsuit related to a tech startup is pitting Mexican billionaire Ricardo Salinas Pliego, a key private-sector ally of President Andrés Manuel López Obrador, against the Mexican leader’s government.   "
170,"November 15, 2019 03:16 pm ET","U.S. Oil Production Bucks Drilling Slowdown, Keeps Crude Prices in Check","Drillers are laying down rigs, hydraulic-fracturing equipment sits idle and U.S. energy producers are promising fiscal restraint. Yet domestic oil production keeps rising."
171,"November 15, 2019 01:47 pm ET",Ill Wind from U.S. Shale Patch Kicks Up Sandstorm ,The epic growth in fracking that recently turned the U.S. into a net exporter of petroleum products has spawned entirely new industries. One of them is the supply of sand.
172,"November 15, 2019 08:38 am ET",Powell Says Fed is Optimistic on Economy as Officials Signal Comfort With Rates; Bank of Mexico Cuts    ,Good day. Federal Reserve officials came about as close as they could to putting a nail in the coffin of further rate cuts in comments Thursday.  
173,"November 15, 2019 06:02 am ET","WSJ Wealth Adviser Briefing: Treasury Yields, Retirement Jobs, Airport Menu","Yields on U.S. government bonds have rebounded from near-historic lows hit just two months ago; one retiree decided to go back to work and took up three new jobs, and airports are updating their dining menus."
174,"November 15, 2019 05:39 am ET",Emirates’ Many Headwinds Test Its Big Bet on Big Jets,"Emirates Airline bet its future on giant planes and mega hubs, but the world’s biggest international airline is now in the middle of the most significant rethink of that strategy in its history."
175,"November 15, 2019 04:48 am ET",The Daily Shot: The Fed Has Reversed 40% of Its Balance Sheet Normalization,
176,"November 15, 2019 02:55 am ET",Amerisur Resources Agrees GBP242 Mln GeoPark Takeover,
177,"November 14, 2019 07:04 pm ET",FDA Panel Backs Expanding Use of Fish Oil Drug,An advisory panel recommended Thursday that the U.S. Food and Drug Administration approve expanding the use of a fish-oil derived drug to reduce the likelihood of heart attacks and strokes in high-risk patients.
178,"November 14, 2019 06:46 pm ET","‘Palm Beach, Mar-a-Lago and the Rise of America’s Xanadu’ Review: President Trump’s Fantasy Island","Mar-a-Lago could be a “winter White House,” Marjorie Merriweather Post told Lady Bird Johnson—a “more luxurious” Camp David."
179,"November 14, 2019 04:24 pm ET","Bank of Mexico Cuts Rates, as Expected ","The Bank of Mexico cut interest rates by a quarter percentage-point Thursday, as expected, continuing an easing cycle that started in August when inflation moved towards the bank’s target. "
180,"November 14, 2019 03:05 pm ET",OPEC Cuts U.S. Oil Output Growth Forecast,"The Organization of the Petroleum Exporting Countries lowered its oil production growth forecast for non-cartel countries for 2020, citing a downward adjustment to its forecast for the U.S. "
181,"November 14, 2019 09:03 am ET",Centerbridge’s Gallogy to Retire | Norwest Raises $2 Billion | Alpine Collects Largest Fund Yet    ,"Good frosty morning! Centerbridge Partners co-founder and leader Mark Gallogly has decided it is time for something different and has begun planning to step down, WSJ Pro’s Will Louch reports. Mr. Gallogly expects to focus much of his time after leaving the firm on public policy issues like climate change as well as running his family office. Meanwhile, co-founder Jeffrey Aronson has agreed to stay at the helm for at least another five years.  "
182,"November 14, 2019 04:20 am ET",President Energy Expects Increase in Oil Realization Price After Expiration of Argentina Decree,
183,"November 14, 2019 03:40 am ET",The Daily Shot: Core CPI Falls Despite Stronger Medical Care Inflation,
184,"November 13, 2019 11:06 pm ET",Latest Chinese Numbers Show Economy Dragging,China’s economy is showing fresh signs of weakness even as inflation continues to tick higher—a conundrum for policy makers as the trade dispute with the U.S. drags on.
185,"November 13, 2019 06:13 pm ET",Bond Investors Bet On Rise in Inflation    ,"Market-based measures of inflation expectations have climbed in recent weeks, lifted by investors’ falling concerns about a near-term recession and growing comfort with riskier assets.  "
186,"November 13, 2019 06:06 pm ET",Mike Henry to Become BHP Group CEO in January ,"BHP named Mike Henry as its new chief executive, opting for his experience running the most profitable operation of the global miner after a tumultuous period of big swings in commodity prices and exiting legacy assets. "
187,"November 13, 2019 05:02 pm ET","Dow, S&P 500 End at Records Again",The Dow Jones Industrial Average advanced as investors parsed the latest headlines on U.S-Chinese trade talks and Federal Reserve interest-rate policy.
188,"November 13, 2019 03:13 pm ET","Temperatures Are Falling, and so Are Heating Costs ","Winter weather has arrived, but heating fuels are priced like Americans still have their windows open. "
189,"November 13, 2019 01:17 pm ET",IEA Sees U.S. Shale Squeezing OPEC Influence ,"U.S. shale-oil production will reshape global energy markets in the years to come, the International Energy Agency said. "
190,"November 13, 2019 08:39 am ET",Pro Bankruptcy Briefing: Dean Foods Files for Bankruptcy | McDermott Discloses SEC Probe After Rescue | MDC Energy and Lenders Prepare for ’World War 3’    ,Good day. Dean Foods Co. filed for bankruptcy and said it hopes to line up the largest U.S. dairy cooperative as a stalking horse bidder. McDermott International Inc. investors say they didn’t know the oil-and-gas company was under investigation by the SEC when they pumped $1.7 billion into the business. A bankruptcy lawyer for real estate developer Mark Siffin’s MDC Energy LLC hopes to talk to lenders “before we start World War 3.”  
191,"November 13, 2019 08:34 am ET",Powell Heads to Capitol Hill; Harker Says October Rate Cut Wasn’t Needed; New Zealand Holds Rates Steady    ,"Good day. Federal Reserve Chairman Jerome Powell has the opportunity to finesse expectations about the rate path when he heads to Capitol Hill for two days of congressional hearings. Yesterday, Philadelphia Fed leader Patrick Harker discussed monetary policy, saying he thought the central bank’s October rate cut was the wrong move. And outside the U.S., policy makers in New Zealand surprised economists by keeping rates on hold.  "
192,"November 13, 2019 08:00 am ET",Soybean Bears Hit Pause Button -- Technical Analysis,
193,"November 13, 2019 07:04 am ET",Unilever Names Former Maersk CEO as Chairman,"Unilever has tapped the former head of Danish shipping company A.P. Moller Maersk as its new chairman, the second big change in the consumer giant’s top ranks in the past year."
194,"November 13, 2019 06:41 am ET","Newsletter: It’s Not the Economy Anymore, Stupid",Your daily economics newsletter from The Wall Street Journal.
195,"November 13, 2019 03:44 am ET",The Daily Shot: Heeding Financial Armageddon Predictions Can Be Costly,
196,"November 13, 2019 03:24 am ET",Tullow Oil Expects Lower-Than-Guided Oil Production in 2019; Shares Fall,
197,"November 13, 2019 12:06 am ET",China Says No to Marijuana but Lets Its Cannabis Industry Bloom,"Marijuana is seen as a dangerous narcotic in China, and possession there is strictly punished. That hasn’t stopped the country from trying to become a powerhouse in the fast-growing industry for cannabis products. "
198,"November 12, 2019 07:00 pm ET",McDermott Investors Lent $1.7 Billion Without Knowing of SEC Probe ,"The Houston-based oil-and-gas engineering company didn’t tell investors about the SEC’s investigation until after the ink had dried on the financing deal, believing the probe wouldn’t have a “material adverse effect” on the company. "
199,"November 12, 2019 03:56 pm ET","Crude Prices Swing Between Gains, Losses","Crude futures swung between small gains and losses after OPEC and its allies signaled they were planning to maintain their current curbs on crude output through next year, holding off on more aggressive cuts."
200,"November 12, 2019 03:51 pm ET",How to Get Die-Hard Meat Eaters to Try Impossible Burgers: Trick Them,"The rise of plant-based protein is inspiring early adopters to dupe family and friends—or in the case of restaurants, their customers. It doesn’t always go over well."
201,"November 12, 2019 11:34 am ET",Saudis Are Urged Not to ‘Miss the Train’ on Aramco IPO ,"Saudi Arabia’s middle class is preparing to invest billions of dollars in Aramco shares, as the populace gets the chance to own a sliver of the kingdom’s prized asset—the world’s most profitable company—for the first time."
202,"November 12, 2019 09:44 am ET",OPEC to Keep Oil Production Curbed Through 2020 ,"OPEC and an alliance of oil producers led by Russia are set to maintain their current curbs on crude output through next year, as some of their U.S. shale rivals plan production cuts of their own for 2020. "
203,"November 12, 2019 09:07 am ET",PE Daily: Pelican Pumps Capital Into Shepherd Safety | Prelude and Enlightened Hospitality Back Banza    ,"Good day! Much has been said about the pullback in the U.S. oil patch, with exploration and drilling companies reining in activities as investment capital ebbs. But some sectors are still courting investors, particularly those that provide services and infrastructure to the petroleum industry. Today, WSJ Pro’s Luis Garcia provides details about one such deal, in an exclusive look at an investment by Pelican Energy Partners in Shepherd Safety Systems.  "
