,date,title,summary
110,"November 1, 2017 04:37 am ET",Analysts Get Bullish on Oil for First Time in 6 Months on OPEC Hopes,Banks raised their oil-price forecasts for the first time in six months in October amid signs that production cuts by major suppliers are helping to rebalance the market. 
111,"November 1, 2017 04:26 am ET","WSJ City: Trump Looks at Immigration Changes After NY Terror Attack Kills Eight, Analysts Bullish on Oil",
112,"November 1, 2017 12:03 am ET",The Daily Shot: Moving Stuff Across the Country Is Becoming Expensive,
113,"October 31, 2017 08:57 pm ET",Oil Futures Gain Further as API Data Show Decline in Crude Stocks ,"Oil futures gain in Asian trading on Wednesday, adding to their overnight strength after the American Petroleum Institute data showed a bigger-than-expected decline in U.S. crude and gasoline inventories for last week.  "
114,"October 31, 2017 07:35 pm ET",Why the Dow Jones Industrial Average Crushed the S&P 500 in October,"The Dow industrials raced past its peers in October, as a pickup in economic growth around the world boosted shares of blue-chip companies that sell everything from bulldozers to airplanes."
115,"October 31, 2017 06:40 pm ET",Market Talk: Daily Analysis Roundup,"Read our compilation of concise, timely analysis by Wall Street Journal reporters. Hilton Settles Over Data Breach Notification Delay; More Investors Believe Brexit Will Affect Them; MetLife May Have Lost a Potential CEO in AIG Defection"
116,"October 31, 2017 06:36 pm ET","In Mainstream Move, Bitcoin Poised to Join Oil, Gold in Futures Trading","CME will launch a futures contract based on bitcoin, a big step toward moving the digital currency into the financial mainstream. "
117,"October 31, 2017 04:51 pm ET",Oil Hovers Near Multimonth Highs ,Oil prices continued to hit new multimonth highs Tuesday as a lower-than-expected U.S. production figure helped breathe new life into a recent rally.
118,"October 31, 2017 02:51 pm ET",Bitcoin’s Future? Here’s What You Should Know ,"Bitcoin is taking steps toward the big time, marrying the nine-year-old currency with a financial instrument that has been used to manage risks and make bets for more than a century. Here’s a breakdown of what this means. "
119,"October 31, 2017 01:05 pm ET","WSJ City PM: Markets Brace for First Rate Hike in a Decade, FCA Chief Joins Brexit Transition Call",
120,"October 31, 2017 08:22 am ET",BP to Restart Share Buybacks as Oil Industry Regains Footing,"BP on said it would restart its share buyback program after posting healthy third-quarter earnings, the latest signal that the oil industry has found its footing amid a modest crude-price recovery."
121,"October 31, 2017 07:28 am ET",The Morning Ledger: Apple Mulls Dropping Qualcomm Components,Apple is designing iPhones and iPads for next year that would jettison Qualcomm chips; Samsung shakes up leadership ranks; Burberry's Christopher Bailey to exit.
122,"October 31, 2017 06:46 am ET",BP to Restart Share Buybacks Amid Solid 3Q—Energy Journal,"British oil giant BP PLC on Tuesday announced plans to restart its share-buyback program, while reporting a strong set of earnings for the third quarter."
123,"October 31, 2017 06:33 am ET",Today’s Top Supply Chain and Logistics News From WSJ,"Delivering up-to-the minute news, analysis, interviews and explanatory journalism on logistics, supply-chain management, e-commerce and more"
124,"October 31, 2017 05:59 am ET",Why Asia’s Largest Oil Company Won’t Reward Investors,"PetroChina, which reported sharply higher third-quarter earnings Monday, has a lot of attractive features—state financial backing, enormous reserves, and a near-monopoly in the world’s most-important natural gas growth market. But policy and market forces are shifting against it."
125,"October 31, 2017 04:41 am ET","WSJ City: Trump’s Deregulatory Juggernaut, BP to Restart Buybacks",
126,"October 31, 2017 12:01 am ET",The Daily Shot: U.S. Household Savings Rate at a Decade Low,
127,"October 30, 2017 10:14 pm ET",Oil Prices Slightly Down in Asia After Hitting 8-Month High ,Oil prices are slightly lower in Asian trade Tuesday after closing at their highest level in 8 months overnight in the U.S.
128,"October 30, 2017 04:59 pm ET",Oil Prices Close at Eight-Month High,"U.S. oil prices closed at the highest level in eight months, as optimism over the rebalancing of the global oil market continued to boost prices."
129,"October 30, 2017 08:47 am ET",Trump Likely to Tap Powell for Fed Chief | States Press Equifax on Hack Disclosure | Michaels’s Take: New Attack on SEC’s Enforcement Arsenal,"The Wall Street Journal’s financial regulation newsletter for Monday, October 30, 2017."
130,"October 30, 2017 08:39 am ET","The Morning Download: Bank of America’s Cathy Bessant Bridges Business, Tech","Bank of America has a non-technologist, Cathy Bessant, in the role of chief operations and technology officer."
131,"October 30, 2017 05:30 am ET",Longtime Ally of Offshore Drillers Oversees Safety Agency,"As offshore drillers look to undo Obama-era safety rules, the head of the federal agency responsible for improving safety wants to stress safety but also to “drive performance” in the industry."
132,"October 30, 2017 05:19 am ET",Party’s Over? Chinese Markets Battered After Bout of Artificial Calm,"Chinese markets suffered a broad selloff, losing some of the shine they maintained during Beijing stage-managed an artificial calm for last week’s major congress of the Communist Party."
133,"October 30, 2017 12:00 am ET",The Daily Shot: Moody’s Forecasting a Spike in Home Sales Next Year,
134,"October 29, 2017 09:27 pm ET",Oil Futures Pare Back Early Gains in Asia,Oil futures were little changed in midday Asian trading after having opened solidly higher on the back of Friday’s 2% gains. 
135,"October 29, 2017 07:00 am ET","Stuck in Place, U.S. Homeowners Hunker Down Rather Than Move","Despite rising home prices and a growing economy, U.S. homeowners’ mobility rate is stuck at a 30-year low as many opt to stay put rather than move to pursue job opportunities or trade up for more space. "
136,"October 29, 2017 07:00 am ET",Why Are Markets Rising Everywhere? Investors Can’t Stop Buying Every Dip ,"Markets around the globe are surging to records, reflecting growing optimism about the world economy and fueling an increasing eagerness by investors to step in and buy assets whenever prices dip. "
137,"October 28, 2017 09:59 am ET",Saudis Back More Supply Cuts in Support of Oil Prices,Saudi Arabian Crown Prince Mohammed bin Salman said he backs limiting crude-oil output beyond an agreement among big oil producers that currently extends through March 2018. 
138,"October 28, 2017 09:43 am ET","This Week on the Frontiers, October 28th 2017",A weekly roundup of key news affecting frontier markets from the Wall Street Journal and beyond.
139,"October 28, 2017 12:01 am ET",What’s News: Business & Finance,What’s News: Business & Finance
140,"October 27, 2017 10:25 pm ET",Market Talk: Daily Analysis Roundup,"Read our compilation of concise, timely analysis by Wall Street Journal reporters. Facebook to Create Political Ad Archive for Future Elections; Nasdaq Soars to All-Time Highs on Tech Earnings; Warren Buffett Criticizes Bitcoin, Again"
141,"October 27, 2017 05:42 pm ET","U.S. Posts Solid 3% Economic Growth, Despite Hurricanes","The U.S. economy posted its best six-month stretch of growth in three years, rebounding quickly from two hurricanes and showing momentum for the final quarter."
142,"October 27, 2017 04:56 pm ET",Venezuela State Oil Company Says It Is Making Bond Payment,Venezuela’s cash-strapped state oil company said it would make an $842 million bond payment in a bid to quell default fears as the energy giant struggles with falling crude production and a punishing economic crisis.
143,"October 27, 2017 04:26 pm ET",Oil Rises; Brent Tops $60 a Barrel,"Oil prices rose, with Brent crude topping the elusive $60-a-barrel mark for the first time in more than two years amid hopes that OPEC will continue curbing output."
144,"October 27, 2017 01:57 pm ET","U.S. Oil Rig Count Rises, While Gas Rig Count Falls","The number of rigs drilling for oil in the U.S. rose this week by one to 737, Baker Hughes reported."
145,"October 27, 2017 01:33 pm ET","Oil Giants’ Profits Soar, but Investors Aren’t Sold    ","The world’s biggest Western energy companies, including Exxon Mobil and Chevron, are on track to post the highest annual profits since the oil market crashed three years ago. Still, shareholders want to see more. "
146,"October 27, 2017 10:59 am ET",Jamie Dimon Made $100 Million Zigging When Markets Zagged,Looking for a way to make money in bank stocks? Follow James Dimon’s lead.
147,"October 27, 2017 10:17 am ET",Total’s Renewables Bet Disappoints in Third Quarter,French oil giant Total has laid out a vision to expand in renewables and power. The challenge is to turn this business into a consistent profit machine.
148,"October 27, 2017 10:04 am ET",Prime Minister Najib Presents Malaysia’s Largest Budget Ahead of Elections ,"Prime Minister Najib Razak announced his largest annual spending plan for the country since becoming Malaysia’s leader in 2009, as he seeks to shore up support for his government ahead of a general election in 2018. "
149,"October 27, 2017 08:53 am ET",3% Third-Quarter U.S. Growth – At A Glance,Some key details from Friday's report on gross domestic product.
150,"October 27, 2017 08:05 am ET",The Morning Risk Report: U.S. Companies Target Vendors In Third-Party Assessments,"Cybersecurity is now the top concern for large U.S. companies when they conduct third-party risk assessments, yet bribery and corruption is the top concern for companies in Europe, the Middle East and Asia, according to a study by Navex Global."
151,"October 27, 2017 06:50 am ET","Oil Prices Slip, Missing Symbolic $60 a Barrel Target—Energy Journal","Oil prices on Friday morning gave up some of Thursday’s robust gains, as investors put the brakes on Brent crude’s upward march to the elusive $60-a-barrel mark."
152,"October 27, 2017 06:25 am ET",Today’s Top Supply Chain and Logistics News From WSJ,"Delivering up-to-the minute news, analysis, interviews and explanatory journalism on logistics, supply-chain management, e-commerce and more"
153,"October 27, 2017 03:44 am ET","WSJ City: Tech Giants Boom, RBS Posts Profit, Pivotal Day for Catalonia",
154,"October 26, 2017 10:05 pm ET",Oil Prices Maintain Thursday’s Gains in Asia  ,Oil prices were little changed in Asian trading Friday after overnight gains which saw the U.S. benchmark hit a fresh six-month high and Brent reach a new 2-year top. 
155,"October 26, 2017 09:09 pm ET",Pressure Builds on Venezuela With Big Payments Due This Week ,"Global investors have been bracing for a Venezuelan default for years, but a period of reckoning could be coming with more than $2 billion in bond payments due over the next several days."
156,"October 26, 2017 05:06 pm ET",Saudis Showcase Technology in Bid to Woo Business Leaders,"Saudi Arabia this week set out to dazzle the world’s business elite, who welcomed signs that an insular kingdom is opening up even though some expressed skepticism the monarchy could accomplish the grand goals it set out."
157,"October 26, 2017 04:32 pm ET",Oil Prices Finish Higher     ,"Oil prices closed at a six-month high, boosted by declining stockpiles of fuel and hopes that OPEC will extend a deal to limit global production."
158,"October 26, 2017 10:08 am ET",Mexico’s Trade Deficit Widened in September ,"Mexico logged a $1.89 billion trade deficit in September, wider than the year-earlier gap as growth in imports outpaced that of exports. "
159,"October 26, 2017 09:35 am ET",Big Oil’s Suddenly Popular Measure for Success: Break-Even Oil Price,"Investors are watching the once-obscure figure at which companies say they can sell oil for a profit, seeking assurance that they will continue paying dividends despite low energy prices."
160,"October 26, 2017 08:34 am ET",The Dollar May Not Be Stronger for Much Longer,"The dollar has been rebounding since September as investors have grown more optimistic about the prospects for U.S. interest-rate increases and a tax overhaul. But the U.S. currency’s comeback is on shaky ground, analysts warn."
161,"October 26, 2017 08:03 am ET","Noreika’s Job Status Raises Ethics Concerns | How Wall Street Scored Arbitration Win | Hayashi’s Take: Can GOP Kill Payday Rule, Too? Don’t Bet on It","The Wall Street Journal’s financial regulation newsletter for Thursday, October 26, 2017."
162,"October 26, 2017 07:31 am ET","Trump Thinking About Keeping Yellen | ECB to Decide Path of Stimulus Program | Brazil’s Central Bank Cuts Benchmark Rate | BOC Holds Tight on Nafta Concerns |  Harrison’s Take: The Economy’s Doing Well, Good News For The Next Fed Chair","The Wall Street Journal’s central banking newsletter for Thursday, October 26, 2017"
163,"October 26, 2017 07:20 am ET",The Morning Ledger: Oil Giants Focus on Breaking Even Amid Low Prices,Oil companies have rediscovered a once obscure business performance measure. Bayer might reduce the size of its planned rights issue to fund the planned takeover of Monsanto and SAP reports itself to U.S. authorities.
164,"October 26, 2017 06:47 am ET","Saudi Arabia, Russia Want to Extend Oil Production Cuts—Energy Journal",Saudi Arabia and Russia--the world's two largest producers of crude oil--want to extend an OPEC-led deal to curb global oil production through the end of next year
165,"October 26, 2017 06:25 am ET",The 10-Point: Gerard Baker on plans to roll back TV station ownership curbs and more,"A personal, guided tour to the best scoops and stories every day in The Wall Street Journal, from Editor in Chief Gerard Baker."
166,"October 26, 2017 06:16 am ET",Today’s Top Supply Chain and Logistics News From WSJ,"Delivering up-to-the minute news, analysis, interviews and explanatory journalism on logistics, supply-chain management, e-commerce and more"
167,"October 26, 2017 06:03 am ET","Harrison’s Take: The Economy’s Doing Well, Good News For The Next Fed Chair",Whoever leads the central bank starting next year will be taking over a sound ship with no icebergs in sight.
168,"October 26, 2017 05:56 am ET","Trump Thinking About Keeping Yellen | ECB to Decide Path of Stimulus Program | Brazil’s Central Bank Cuts Benchmark Rate | BOC Holds Tight on Nafta Concerns |  Harrison’s Take: The Economy’s Doing Well, Good News For The Next Fed Chair","The Wall Street Journal’s central banking newsletter for Thursday, October 26, 2017"
169,"October 26, 2017 02:44 am ET",The Daily Shot: Why Higher Inflation Could be Around the Corner,
170,"October 25, 2017 08:15 pm ET",White Deer to Sell Oil-Field-Services Company O-Tex in $240 Million Deal ,The private-equity firm is selling the provider of cementing services to C&J Energy Services.
171,"October 25, 2017 05:56 pm ET",Transcript: WSJ Interview With Bank of Mexico Gov. Agustín Carstens,"Bank of Mexico Gov. Agustín Carstens discussed the peso’s recent volatility, inflation that has begun receding from its summer highs and his move to lead the Bank for International Settlements."
172,"October 25, 2017 04:23 pm ET",Oil Pulls Back After Stocks Data,Oil prices continued to slide Wednesday after U.S. inventory data showed that stockpiles of crude oil rose last week.
173,"October 25, 2017 04:03 pm ET",Judge Rules Peabody Energy Bankruptcy Blocks Global-Warming Lawsuits ,A judge ruled Peabody Energy is protected by its recent bankruptcy from global-warming lawsuits brought by California coastal communities against fossil-fuel companies. 
174,"October 25, 2017 12:45 pm ET","WSJ City PM: What ECB’s Taper May Say About Rates, UK Growth Adds to BOE Expectations",
175,"October 25, 2017 12:32 pm ET","Saudi Arabia, Russia Want Oil Output Limits Through 2018 ","Top oil producers Saudi Arabia and Russia want to extend their agreement to limit petroleum production until the end of 2018 in their continuing effort to cut the global oil oversupply, people familiar with the matter said."
176,"October 25, 2017 08:56 am ET",Bank of Mexico’s Carstens: Patience Needed in Considering Interest Rate Cuts ,"Mexican central bank chief Agustín Carstens, in one of his last interviews before departing to Switzerland to head the Bank for International Settlements, said the Bank of Mexico needs to be patient and not in a hurry to cut interest rates."
177,"October 25, 2017 07:48 am ET","Congress Scraps Arbitration Rule | Trump Polls GOP Senators About Fed Chief | Deng’s Take: For China, Growth Trumps Curbing Debt","The Wall Street Journal’s financial regulation newsletter for Wednesday, October 25, 2017."
178,"October 25, 2017 07:23 am ET",Oil Prices Are Up. Why Aren’t Energy Shares? ,"Oil prices are bouncing back from a three-year slump, but investors in energy companies seem to have missed the memo."
179,"October 25, 2017 07:01 am ET","U.S., Chinese Investors Target Asian Renewables Giant — Energy Journal","U.S. private equity firm Global Infrastructure Partners has teamed up with other investors to acquire Asia’s Equis Energy for $3.7 billion, in the largest global renewable energy deal to date."
180,"October 25, 2017 05:30 am ET","China’s Stock Markets Are Calm, but Its Traders Are Restless ","Many market participants see Beijing’s hand behind an unusually long period of placid trading that has made the market more predictable, but often less profitable for them. "
181,"October 25, 2017 12:56 am ET",The Daily Shot: The Dow Leaves the S&P 500 in the Dust,
182,"October 24, 2017 07:23 pm ET",Owner of NYSE Agrees to Buy Bond-Trading Platform,Intercontinental Exchange Inc. said on Tuesday that it had agreed to buy a fixed income-trading platform from Virtu Financial Inc.
183,"October 24, 2017 05:00 pm ET",Oil Rises to Six-Month High on Hopes of Supplies Falling,"Oil prices closed at a six-month high on Tuesday, boosted by expectations for lower supply due to geopolitical risks, falling U.S. stockpiles and OPEC’s dedication to cutting production."
184,"October 24, 2017 04:46 pm ET",Caterpillar on Track to Break Sales Slump,"Caterpillar raised its sales and profit forecast for the year amid rising demand for construction and mining equipment, partly helped by an improving energy industry."
185,"October 24, 2017 09:01 am ET",Trucking Firms Facing Recruitment Problems Ahead of Holidays ,Trucking companies are worried about finding enough drivers now that the freight market is recovering. 
186,"October 24, 2017 07:41 am ET",Uber Investment Haunts Saudi Fund—Energy Journal,Saudi Arabia’s State-Owned Public Investment Fund Has Made Several Disappointing Investments
187,"October 24, 2017 07:38 am ET","Clearinghouses Fire Back | Arbitration Fight Heats Up | What to Watch: Peirce, Jackson Edge Closer to SEC Posts","The Wall Street Journal’s financial regulation newsletter for Tuesday, October 24, 2017."
188,"October 24, 2017 07:25 am ET","Fedspeak Cheat Sheet | Warsh Met With Pence | ECB Must Strike Right Balance | Why Draghi May Avoid a Key Word | Derby’s Take: If Warsh or Taylor Gets Fed Nod, Internal Unrest Might Follow","The Wall Street Journal’s central banking newsletter for Tuesday, October 24, 2017"
189,"October 24, 2017 07:22 am ET",The Morning Ledger: SEC Approves Accounting Rule Despite Resistance,A new rule requires auditors to provide investors with more information on what they learn when they audit a company’s books. Netflix launches a bond sale and Volkswagen wins approval for fixes to vehicles sold in the U.S.
190,"October 23, 2017 07:39 pm ET",Ill-Timed Uber Investment Roils a Giant Saudi Fund,"Saudi Arabia’s state-owned Public Investment Fund is poised to become one of the world’s biggest investors. But the PIF, as it is known, is off to a rocky start: After struggling to calculate its own value, it is mired in conflict over disappointing investments, including in Uber. "
191,"October 23, 2017 06:49 pm ET",Companies Mull Secret IPOs to Boost Sale Valuations,Confidential initial public offerings are increasingly being used to boost sale prices in a competitive market.
192,"October 23, 2017 04:22 pm ET",Fed Post Studies Oil-Price Pass-Through Into Core Inflation,"Oil-price changes have a limited but long-lasting effect on core inflation, according to findings from Cristina Conflitti and Matteo Luciani in a Federal Reserve FEDS Notes article."
193,"October 23, 2017 03:53 pm ET",Oil Prices Mixed Amid Tensions in Iraq    ,Oil prices fluctuated as investors tried to gauge the potential for supply disruptions resulting from tensions in the oil-rich Kurdish region of Iraq.
194,"October 23, 2017 01:57 pm ET",Transcript: Audience Q&A With Janet Yellen in Washington,"Federal Reserve Chairwoman Janet Yellen discussed the Fed’s struggle to reach its inflation target, negative interest rates as a policy tool and Congress’s efforts to change the tax code."
195,"October 23, 2017 01:39 pm ET",Central Bankers Cling to Stimulus Amid Weak Inflation,Leaders of the world’s largest central banks indicated that weak inflation in advanced economies could prolong the postcrisis era of easy-money policies.
196,"October 23, 2017 01:28 pm ET",Potlatch to Combine With Deltic Timber in Stock Swap ,Lumber companies Potlatch and Deltic Timber agreed to combine in an all-stock deal in which Deltic shareholders would receive 1.8 Potlatch common shares for each Deltic share they own.
197,"October 23, 2017 10:28 am ET",Natural Gas Prices May Surprise This Winter,"After nine years of booming production of natural gas, this winter could be one of the rare instances supply and demand conspire to drive up prices."
198,"October 23, 2017 09:26 am ET","Stocks to Watch: Tesla, GE, T-Mobile US, Broadsoft, AT&T, Arconic, Hasbro","Among the companies with shares expected to trade actively in Monday’s session are Tesla Inc., General Electric Co., T-Mobile US Inc., Broadsoft Inc. and AT&T Inc."
199,"October 23, 2017 08:15 am ET",The Morning Ledger: Executive Compensation Under Scrutiny as New GE Chief Zeroes in on Cost,"John Flannery plans changes to GE's compensation plans. Reporting at large, listed U.K. companies could be better, a regulator says. And, Tesla has agreed to set up its own production site in Shanghai, China."
200,"October 23, 2017 07:48 am ET",Risky Security Booming | Wells Fargo’s Woes Spread to Investment Bank | Rubin’s Take: How a Powell Fed Would Approach Derivatives,"The Wall Street Journal’s financial regulation newsletter for Monday, October 23, 2017."
201,"October 23, 2017 07:40 am ET","Big Firms Stand to Make Big Gains, Despite Low Oil Prices—Energy Journal","Some of the World’s  Largest Energy Companies Are Poised to Report Big Gains This Week, Despite Low Oil Prices"
202,"October 23, 2017 07:30 am ET",Yellen: May Need to Use Unconventional Policy Again | Trump Signals Yellen Still a Top Candidate | Europe’s Chances for a Wage Boom Look Slim | ECB Taper to Set Off Ripples | Blackstone’s Take: ECB Bond Move a Long Time Coming for Switzerland,"The Wall Street Journal’s central banking newsletter for Monday, October 23, 2017"
203,"October 23, 2017 06:24 am ET",Yellen: May Need to Use Unconventional Policy Again | Trump Signals Yellen Still a Top Candidate | Europe’s Chances for a Wage Boom Look Slim | ECB Taper to Set Off Ripples | Blackstone’s Take: ECB Bond Move a Long Time Coming for Switzerland,"The Wall Street Journal’s central banking newsletter for Monday, October 23, 2017"
204,"October 22, 2017 11:25 pm ET",The Daily Shot: Tech Shares no Longer in the Lead,
205,"October 22, 2017 10:02 pm ET",Financial Game Plan: A Military Man Transitions to Civilian Life,An adviser suggests Christopher Mellan take into account his new-take home pay and increased health-care costs for his family.
206,"October 22, 2017 07:36 pm ET",Potlatch Nears Deal to Combine With Deltic Timber in Stock Swap,"Lumber company Potlatch Corp. is nearing an all-stock deal to combine with Deltic Timber Corp., according to people familiar with the matter."
207,"October 22, 2017 04:10 pm ET",Trump Caves on Ethanol,The biofuels lobby overwhelms a core campaign promise.
208,"October 22, 2017 03:33 pm ET",ECB Taper to Have Ripples From Switzerland to Ivory Coast,The ECB is expected to begin unwinding its extraordinary monetary stimulus on Thursday. That could have a knock-on effect on markets in the countries whose monetary policy is most closely linked to the ECB.
209,"October 22, 2017 09:00 am ET","Trump Plan for Coal, Nuclear Power Draws Fire From Environmental, Oil Groups","A Trump administration proposal aimed at shoring up coal-fired and nuclear power plants has generated opposition from groups often at odds, including environmentalists, the oil and gas industry and some utilities."
210,"October 21, 2017 09:00 am ET",Former Energy Trader Goes All-In on Bitcoin ,J. Robert Collins Jr. spent most of the past 25 years trading commodities. Now he is making a big bet on something that makes commodity trading look almost tame: the roaring market for bitcoin and other cryptocurrencies.
211,"October 21, 2017 08:00 am ET",Qatar Makes Accounting Change Ahead of Bond Sale,An abrupt accounting change that nearly doubled Qatar’s hard currency assets is drawing investor scrutiny as the nation prepares for a major bond sale. 
212,"October 21, 2017 07:01 am ET",Christie’s to Sell Works From Bass Estate,"A van Gogh, a Matisse and a Rothko are among dozens of works that Christie’s will auction next month in New York. "
