,date,title,summary
0,"June 10, 2018 10:45 pm ET","Saudi Arabia, Kuwait and U.A.E. Pledge $2.5 Billion in Aid to Jordan","Saudi Arabia and its Gulf allies pledged $2.5 billion in support of Jordan’s monarchy after mass protests over economic grievances roiled the country, sparking fears of another Arab Spring."
1,"June 10, 2018 09:58 pm ET",Venezuela’s Long Road to Ruin,Few countries have provided such a perfect example of socialist policies in practice.
2,"June 10, 2018 08:22 pm ET",Oil Futures Edge Lower as Supply Concerns Persist,"Oil futures fell slightly to start the week in Asia, keeping pressure on a market that is pulled back from multiyear highs of late amid the prospect of increased supply. "
3,"June 10, 2018 01:35 pm ET",An Uneven Recovery in Stocks,Technology shares have powered much of the market’s rebound since the S&P 500 fell into correction territory in early February.
4,"June 10, 2018 01:23 am ET",Buyers of Iran’s Oil Balk at U.S. Push to Isolate Country      ,The Trump administration’s effort to pressure Iran depends on countries deeply skeptical of the U.S. campaign against the Islamic Republic.   
5,"June 9, 2018 07:43 am ET","This Week on the Frontiers, June 9th 2018",A weekly roundup of key news affecting frontier markets from the Wall Street Journal and beyond.
6,"June 9, 2018 12:01 am ET",What’s News: Business & Finance,What’s News: Business & Finance
7,"June 8, 2018 05:52 pm ET","Saudis Start to Ramp Up Oil Output, Ahead of OPEC Meeting","The kingdom began producing 100,000 barrels of oil a day more last month and plans to raise output again by at least that much, in shift from earlier plan."
8,"June 8, 2018 05:20 pm ET",U.S. Regulator Demands Trading Data From Bitcoin Exchanges ,Government investigators have demanded that several bitcoin exchanges hand over comprehensive trading data to assist a probe into whether manipulation is distorting prices in markets linked to the cryptocurrency.
9,"June 8, 2018 04:58 pm ET",Oil Prices Edge Lower After Recent Rally,"Oil prices edged lower, giving up some ground as investors continued to bet on increased supply despite concerns over output from Venezuela and Iran."
10,"June 8, 2018 02:07 pm ET",Enduro Resource Reaches $20 Million Deal to Sell Louisiana Properties,"Enduro Resource Partners LLC has a deal to sell undeveloped oil and gas properties in northern Louisiana to Comstock Resources Inc. for $20 million, subject to better offers."
11,"June 8, 2018 10:56 am ET",Trump’s Iran Gambit,"Despite his aggressive rhetoric, the president is not determined to topple the Islamic Republic, as some critics fear. For now, he seems more interested in making a new deal with Tehran."
12,"June 8, 2018 08:00 am ET",Hot Commodity in the Shale Boom: Truckers,A shortage of truckers to transport crude in the Permian Basin is threatening to slow a drilling boom that has helped lift U.S. oil production this year to all-time highs.
13,"June 8, 2018 07:51 am ET",Exxon Seeks to Show Its Devotion to the Environment—Energy Journal,Exxon Seeks Solutions for Climate Change
14,"June 8, 2018 03:10 am ET",Global Growth Isn’t Dead Yet ,"Asian trade growth is trending downward, but Friday’s trade numbers from China—and recent positive signs from the U.S.—hint the boom isn’t quite over yet. "
15,"June 8, 2018 02:33 am ET",China’s Trade Surplus Narrows—but Not With the U.S.,"China’s trade surplus narrowed in May on strong imports, through the gap with the U.S. widened—in part, some economists said, because of concerns that trade tensions could worsen in the months ahead."
16,"June 8, 2018 12:37 am ET",What’s News: Business & Finance,What’s News: Business & Finance
17,"June 7, 2018 03:36 pm ET",Oil Edges Up Amid Supply Jitters,"Crude prices ticked up, as the market refocused on geopolitical risks to supply in Iran and Venezuela ahead of a meeting of major producers later this month."
18,"June 7, 2018 03:01 pm ET",Brazil Hosts Major Auction for Oil Fields ,The world’s largest energy companies lined up for a major auction of coveted Brazilian oil fields. 
19,"June 7, 2018 12:33 pm ET",Smucker Forced to Raise Some Retail Prices,Shares in J.M. Smucker Co. fell sharply after the maker of Folgers coffee and Jif peanut butter said higher costs hurt profitability.  
20,"June 7, 2018 12:25 pm ET","WSJ City PM: US and China Reach Deal on ZTE, Congress Targets Another Silicon Valley Giant, Economists Raise Inflation Expections",
21,"June 7, 2018 09:44 am ET",Mexico’s Inflation Slowdown Stalled in May on Higher Fuel Costs ,Mexican inflation eased less than expected in May as higher gasoline and propane gas prices partly offset the impact of seasonal declines in electricity rates and lower fresh produce prices 
22,"June 7, 2018 07:51 am ET",The U.S. Sold a Record Amount of Oil in April—Energy Journal,The U.S. Exported $19.9 Billion in Petroleum
23,"June 7, 2018 07:27 am ET",Real Time Economics: U.S. Stance On Trade Unites Allies—Against the U.S.,"Today in Real Time Economics, we look at President Trump's trade talks with America's closest allies, a potential crimp in U.S. oil production, the high cost of coal mining, a new deal for China's ZTE, and why the U.S. is lagging its peers in labor-force participation."
24,"June 7, 2018 07:18 am ET","Oil Edges Up Amid Supply Jitters in Iran, Venezuela    ",Crude prices ticked up as the market refocused on geopolitical risks to supply in Iran and Venezuela.  
25,"June 7, 2018 07:05 am ET","The 10-Point: Gerard Baker on the coming G-7 summit, the race for House control and more","A personal, guided tour to the best scoops and stories every day in The Wall Street Journal, from Editor in Chief Gerard Baker."
26,"June 7, 2018 02:46 am ET",The Daily Shot: U.S. Equity Mutual Funds Still Shedding Assets,
27,"June 7, 2018 12:09 am ET",What’s News: Business & Finance,What’s News: Business & Finance
28,"June 7, 2018 12:01 am ET",Energy Sector Leads Dow Industrials Higher,"The Dow Jones Industrial Average climbed Thursday, ending at its highest level in nearly three months, as a jump in shares of oil-and-gas companies helped offset declines across the technology sector."
29,"June 6, 2018 11:50 pm ET",Trump’s Steel Tariffs Could Mess With Texas,Damage to U.S. industry from higher metal prices will be widespread. One of the biggest losers could be the industry best poised to reduce the U.S. trade deficit itself: oil and gas.
30,"June 6, 2018 08:23 pm ET",Trump Set to Push U.S. Trade Agenda at Tense G-7 Meeting,"President Trump, heading into this weekend’s meeting of the Group of Seven industrialized nations, has signaled his intention to continue pursuing an aggressive trade agenda even if it comes at the expense of U.S. standing in the world."
31,"June 6, 2018 08:01 pm ET",Oil Futures Gain in Asia as Equities Also Rally,Oil futures remained modestly higher in midday Asian trading Thursday following fresh weakness in the U.S. benchmark Wednesday on bearish inventory data. 
32,"June 6, 2018 06:22 pm ET","Dollar Lower on Weak U.S. Data, Stronger Euro","The U.S. dollar fell Wednesday, weighed down by the gains in the euro after an ECB official signaled the bank will be discussing ending its bond purchase program."
33,"June 6, 2018 06:21 pm ET","Economic, Political Turbulence Hits Brazil’s Real ","The Brazilian real has fallen to its lowest level against the dollar in more than two years, amid rising investor worries over recent economic and political turmoil."
34,"June 6, 2018 05:06 pm ET",Stocks Rise on Latest Global Trade Signals,"The Dow surged to its highest close in nearly three months Wednesday, with markets calm as investors weighed the latest signals on international trade."
35,"June 6, 2018 04:50 pm ET","As Oil Soars, Few Hedge Funds Are Left to Profit","Years of choppy and often falling crude markets have obliterated a once-prominent group of hedge funds, collectively running billions of dollars, who bet on commodities."
36,"June 6, 2018 04:41 pm ET",Oil Prices Fall as U.S. Data Exacerbates Supply Concerns,"Oil prices fell near a two-month low Wednesday, weighed down by data showing increased U.S. stockpiles and production."
37,"June 6, 2018 04:01 pm ET",Climbing Fuel Costs Lead Airlines to Raise Ticket Prices,"Jet-fuel prices have surged more than 50% over the past year, pushing carriers to raise fares and Delta Air Lines to cut its profit expectations. "
38,"June 6, 2018 03:19 pm ET",Record Oil Exports Help Cut U.S. Trade Gap,"The U.S. exported a record amount of oil in April, helping to narrow the nation’s trade gap while giving the economy a lift."
39,"June 6, 2018 12:31 pm ET","WSJ City PM: Few Hedge Funds Left to Profit from Oil’s Rebound, ECB’s Praet Sends Signal on QE Decision",
40,"June 6, 2018 10:30 am ET",Slumping Real Yields Reflect Slow-Growth Pains ,The retreat signals that investors don’t believe the world is poised for a sudden acceleration in economic growth.
41,"June 6, 2018 10:04 am ET",Canada’s Trade Deficit Narrowed In April,"Canada’s trade deficit narrowed in April as exports reached a record high on increased shipments of some mineral products, consumer goods and energy products. "
42,"June 6, 2018 08:14 am ET",GE Should Hang On to Baker Hughes ,"The oil-field-services firm is the one big asset GE could use to raise cash quickly, but it would be leaving billions on the table and signaling distress to the market if it sold. "
43,"June 6, 2018 08:00 am ET",‘We Got Lazy’: U.S. Recyclers Try Cleaning Up Their Scrap,"With China’s ban on mixed scrap paper and plastics from the U.S. and strict limits on contamination, recyclers face a growing backlog and vow to produce cleaner loads of recyclables."
44,"June 6, 2018 07:38 am ET",Where Did All the Oil Bulls Go?—Energy Journal,The Downturn in Oil Thinned Out the Herd of Energy Traders
45,"June 6, 2018 07:09 am ET",Real Time Economics: There Are More Job Openings Than People Looking For a Job,"Today in Real Time Economics, we look at more evidence of a tight labor market, hints of improving worker productivity, the latest trade developments, and steady global growth despite turmoil and uncertainty in parts of the world."
46,"June 6, 2018 07:00 am ET",Oil Field-Services Firms Refuel,Private-equity investors in the energy-services sector are raising new funds to capitalize on a deal environment that experts say finally has begun to improve.
47,"June 6, 2018 06:37 am ET",Indian Central Bank Raises Key Rate for First Time in More Than Four Years,India’s central bank raised its main lending rate after inflation picked up following a recent surge in crude-oil prices.
48,"June 6, 2018 06:10 am ET","WSJ Wealth Adviser Briefing: Volker Rule, IRS IT Overhaul, Less Chemo","Twitter to join S&P, the IRS overhauls its systems to help implement the new tax law, and doctors suggest less chemo and surgery for some cancer treatments."
49,"June 6, 2018 05:39 am ET",Fedspeak Cheat Sheet | Praet Confident Eurozone Inflation Is Returning to Target | Malaysia Central Bank Governor Resigns | RBI Raises Main Lending Rate | Hannon’s Take: Suspicious Minds and the ECB,"The Wall Street Journal’s central banking newsletter for Wednesday, June 6, 2018"
50,"June 6, 2018 03:39 am ET","WSJ City: China’s Offer on Trade, Global Economy Set to Weather Turmoil",
51,"June 6, 2018 02:01 am ET",The Daily Shot: Job Openings Exceed the Number of Unemployed Americans,
52,"June 5, 2018 08:34 pm ET",Oil Prices Rise in Asia Ahead of U.S. Inventory Data,"Oil futures added to Tuesday’s gains in Asia, with the market rebounding from a recent pullback ahead of U.S. inventory data. "
53,"June 5, 2018 07:20 pm ET",Rick Perry’s Obama Imitation,His intrusion to save coal and nuclear plants is as bad as renewable subsidies.
54,"June 5, 2018 07:06 pm ET",Oil Closes Higher Ahead of Stockpile Data,. 
55,"June 5, 2018 05:27 pm ET",Tech Stocks Lift Nasdaq to Another Record Close,"Technology stocks continued climbing Tuesday, pushing the Nasdaq Composite to a second consecutive record close."
56,"June 5, 2018 04:41 pm ET",Puerto Rico Lawmakers Target Venezuela Ties,"Puerto Rico could soon restrict government dealings with businesses connected to Venezuela, potentially ensnaring U.S. lobbying firms and building on a broader U.S. economic crackdown on the South American country."
57,"June 5, 2018 11:45 am ET","WSJ City PM: When Markets Move, Here’s Who Moves the Market",
58,"June 5, 2018 10:22 am ET",Brexit & Beyond: Gay Marriage Ruling Puts EU Court in Center of Fight,
59,"June 5, 2018 08:52 am ET",Some Bad News for Good News — Optimistic Forecasts Create Recessions ,"Good economic forecasts may be too much of a good thing, according to a new International Monetary Fund working paper, they could help cause a recession. "
60,"June 5, 2018 08:03 am ET",Banks Bet on Geopolitical Risk to Boost Oil—Energy Journal,Brent Is Projected to Average Over $70 a Barrel in 2018
61,"June 5, 2018 08:00 am ET","Undaunted by Iran Setback, French Energy Giant Total Expands in Russia","French oil giant Total has long had an appetite for politically risky deals. Now, it’s tapping resources in Russia and other tricky spots across the globe to become one of the world’s biggest natural gas suppliers."
62,"June 5, 2018 07:30 am ET",Private-Equity Firms Adapt to Energy Producer Discipline,"As public oil-and-gas producers tighten their belts, private-equity firms are putting more capital and time into developing assets to make them attractive targets. Firms also see fresh opportunities to partner with public energy producers."
63,"June 5, 2018 07:02 am ET",Real Time Economics: China Works to Skirt Steel Tariffs; Domestic Opposition Picks Up,"Today in Real Time Economics, we look at China's plans to keep flooding the global steel market, friendly fire for Trump's tariffs, a warning for Canada's economy, the dollar's direction, and how U.S. oil got stranded in...the U.S."
64,"June 5, 2018 06:07 am ET",BOE Official Sees ‘A Few’ Rate Rises | RBA Leaves Interest Rate on Hold | India’s Central Bank Expected to Hold Rate Steady | Harrison’s Take: The Fed and Emerging Markets,"The Wall Street Journal’s central banking newsletter for Tuesday, June 5, 2018"
65,"June 5, 2018 05:33 am ET",OPEC Faces New Concern Over Global Oil Stocks: China,China’s secretive crude reserves will help major producers determine whether to continue their supply cuts or open the taps wider again.
66,"June 5, 2018 03:50 am ET",WSJ City: Has the Stock Market Forgotten Lehman? US Confronts New Chinese Steel Play,
67,"June 5, 2018 01:47 am ET",The Daily Shot: Is the Retail Apocalypse Finally Ending?,
68,"June 5, 2018 01:09 am ET",India’s Central Bank Expected to Hold Rate Steady,"The Reserve Bank of India will likely wait until later this year to start raising rates, as it seeks more clarity on inflation trends after the recent surge in crude-oil prices."
69,"June 5, 2018 12:43 am ET",Why the Dollar Rally’s End Could Be Near,"The dollar’s monster rally since mid-April surprised investors and analysts. Now, some market participants say they’re ready to call a top in the dollar. Meanwhile major Asian indexes saw little change on Tuesday. "
70,"June 4, 2018 03:56 pm ET",Oil Approaches Eight-Week Low on Mounting Surplus    ,Oil prices fell to the lowest point since early April as traders anticipated growing domestic and global crude supplies.
71,"June 4, 2018 01:16 pm ET","A Decade Later, U.S. Stocks Behave Like Lehman Never Happened ","If all you had to go on was the return on U.S. stocks over the past decade, you’d never guess that the world’s financial system had its worst crisis in generations, let alone that stocks had their biggest crash since World War II. "
72,"June 4, 2018 12:25 pm ET",WSJ City PM: Why Tariffs Have Unleashed New Challenges and the Markets Are Now All About Risks,
73,"June 4, 2018 08:29 am ET",U.S. Oil Breaks Away From Global Prices,"As a global oil glut has evaporated, the U.S. is contending with its own flood of supply, which could bode well for consumers but undermine a broader recovery in the energy sector."
74,"June 4, 2018 07:32 am ET",New Energy Plan Could Save Coal and Nuclear Plants but Sacrifice Consumers—Energy Journal,"An Energy Department Plan to Save Nuclear, Coal-fired Power Plants Could Hit Consumers in the Wallet"
75,"June 4, 2018 06:30 am ET",Banks Sharply Raise Oil-Price Forecast on Geopolitical Risks ,"Banks raised their forecasts for oil prices for the eighth month in a row in May, amid escalating geopolitical risks to supply in Iran and Venezuela. "
76,"June 4, 2018 05:30 am ET",Mexico Front-Runner’s Ambitious Plan Depends on ‘Economizer-in-Chief’ ,Mexico’s leading presidential candidate has a daunting challenge that keeps his would-be finance minister awake at night: find some $20 billion every year to step up social spending and public investment without raising taxes or debt.  
77,"June 4, 2018 02:34 am ET","The Daily Shot: As the U.S. Population Ages, Labor Force Participation Stalls",
78,"June 4, 2018 02:32 am ET",The Next Threat to Oil Prices: China,"It has been a bad week or two for oil investors, but most concerns have centered on supply. Next up: demand. "
79,"June 3, 2018 11:52 pm ET",Samsonite and Short Sellers: This Isn’t Over Yet,"Asia stocks rose Monday, defying the appearing intensification of global trade tensions. Meanwhile, Samsonite’s chief executive is out and shares are rebounding, but its battle with short sellers might just be beginning. "
80,"June 3, 2018 03:30 pm ET",The Canard About Falling Incomes,"Don’t believe the government’s consumer-price index, which is obsolete."
81,"June 3, 2018 03:28 pm ET",‘Magic Bean’ Review: A Legume’s World Conquest,"Though soybeans are unloved by American consumers, the U.S. is the leading global soybean producer. How did that happen? Marc Levinson reviews “Magic Bean” by Matthew Roth."
82,"June 3, 2018 08:00 am ET",Dollar’s Strength Adds Stress to Emerging Market Currencies    ,"Central banks in a number of developing economies have raised interest rates or delayed rate cuts, as a now-stronger dollar has forced shifts in policy."
83,"June 2, 2018 10:41 am ET","This Week on the Frontiers, June 2nd 2018",A weekly roundup of key news affecting frontier markets from the Wall Street Journal and beyond.
84,"June 1, 2018 07:31 pm ET",Petrobras Names Monteiro as Interim Chief,"Brazilian oil firm Petróleo Brasileiro named Ivan Monteiro, the company’s chief financial officer, as interim chief executive officer after Pedro Parente resigned earlier in the day."
85,"June 1, 2018 07:01 pm ET",Deal Close Announcements: May 28-June 1,The following is a collection of this week’s deal closings for transactions involving private-equity firms and portfolio companies.
86,"June 1, 2018 05:17 pm ET",Oil Prices Fall on Rising Production    ,"Oil prices declined, weighed down by rising U.S. production and concerns over a potential increase in output from other major exporters."
87,"June 1, 2018 04:42 pm ET",How Companies Use the Latest Profits Fad to Fool You,"Eighty-six years ago this week, the stock market hit its worst low. Today’s high-flying market looks like a polar opposite. But information is still power."
88,"June 1, 2018 03:55 pm ET","Energy Department Eyes New Plan for Nuclear, Coal-Fired Power Plants",The Energy Department is proposing a new plan to bail out failing nuclear and coal-fired power plants by forcing grid operators to take the electricity they produce.
89,"June 1, 2018 02:00 pm ET","U.S., China Haggle Over Purchases of American Goods","U.S. and Chinese trade negotiators are haggling over how to get Beijing to keep recent promises to purchase more American farm and energy products, with Washington pushing for long-term contracts."
90,"June 1, 2018 12:23 pm ET",Transcript: Audience Q&A With Federal Reserve Board Governor Lael Brainard,Federal Reserve Board governor Lael Brainard took audience questions following remarks in New York.
91,"June 1, 2018 10:27 am ET","OPEC, Shale Squeeze Out Volatility in the Oil Market","Volatility in the oil market is being squeezed out by two giant forces, U.S. shale and OPEC, and even threats of war, sanctions and an economic crisis can’t rouse the markets."
92,"June 1, 2018 10:23 am ET",The Gentleman Cave: How to Create a Tastefully Macho Room,"Australian interior designer Greg Natale deconstructs a space he’s always found inspiring, a manly but sophisticated 1970s den in Madrid."
93,"June 1, 2018 10:02 am ET",Middle East Power Struggle Plays Out on New Stage,"The Horn of Africa is taking in billions in investment from Saudi Arabia, U.A.E., China and others vying for ports and military bases, in a contest that could affect access to the Suez Canal and the balance of power in the region. "
94,"June 1, 2018 09:04 am ET",The Morning Risk Report: Companies Face China’s Wrath About Taiwan,"China continues to pressure companies to acknowledge its control over Taiwan, Hong Kong and Tibet, putting businesses in the awkward position of trying to appease China while maintaining relationships in those places."
95,"June 1, 2018 07:50 am ET",GE’s Expansion Plans in Iran Are Shelved—Energy Journal,GE Pulls Back From Iran Ventures
96,"June 1, 2018 06:10 am ET","WSJ Wealth Adviser Briefing: Genial Central Bankers, European Doom Loop, Boozy Coke","Genial central bankers, alcoholic Coke, and the WSJ Wealth Adviser's calendar of events."
97,"June 1, 2018 05:30 am ET",The New Tech That Terrifies OPEC,"Saudi Arabia fought the U.S. shale oil industry by furiously pumping crude to drive down prices, but instead of killing shale the campaign spurred innovation that transformed U.S. drilling."
98,"June 1, 2018 03:09 am ET",The Daily Shot: The Spike in Steel Prices is a New Tax on Americans,
99,"May 31, 2018 09:37 pm ET",India’s Economic Expansion Outpaces Rival China ,"India’s economic expansion accelerated to the fastest pace in nearly two years, pulling further ahead of rival China, as the effects fade from the government’s crackdown on cash and adoption of a new tax. "
100,"May 31, 2018 07:03 pm ET","Stocks’ May Gains Cut Short by Trade Fears, Europe Woes",Strong first-quarter earnings growth helped power shares early in the month. Then came Italy and a ramped up trade dispute. 
101,"May 31, 2018 05:27 pm ET","EPA Gives $30 Million-Plus in Ethanol Credits to Oil Refiners, Angers Corn Growers","The Environmental Protection Agency awarded HollyFrontier and Sinclair Oil more than $30 million in retroactive biofuel credits, threatening to reignite a conflict between oil refiners and corn growers. "
102,"May 31, 2018 04:56 pm ET",Brazil’s Labor Strife Exposes Roadblocks to Temer’s Economic Agenda,"As Brazil began to recover from a crippling strike by truckers, some workers at oil giant Petrobras walked off the job, signaling growing opposition to President Michel Temer’s attempts to get the country’s finances in order. "
103,"May 31, 2018 04:04 pm ET",Wacky Prices Pinch Oil Producers’ Profits ,The differences between various types of crude are currently bigger than usual and in some cases counterintuitive.
104,"May 31, 2018 03:30 pm ET",Oil Prices Mixed as Supply Uncertainty Continues,"Oil prices were mixed after data showed a larger-than-expected decrease in U.S. stockpiles, but investors continued debating the future of the production-cut deal that has boosted prices."
105,"May 31, 2018 10:00 am ET",Wine Country Living in California,This Santa Rosa home includes a vineyard and was inspired by villages in the European countryside. It is currently listed for $7.8 million.
106,"May 31, 2018 09:02 am ET","U.S. Inflation Firms in April, Stays at Fed Target for Second Month Straight","Inflation remained at the Federal Reserve’s target in April for a second straight month, a sign of firming prices in the U.S. economy that underscores policy makers’ plans to gradually raise interest rates."
107,"May 31, 2018 07:39 am ET",IEA Says Mission Accomplished on Oil Market Rebalancing—Energy Journal,The International Energy Agency Says Producers Succeeded in Their Mission to Rebalance the Oil Market
108,"May 31, 2018 06:57 am ET","The 10-Point: Gerard Baker on Trump’s latest tariff move, Mexico’s ‘tropical messiah’ and more ","A personal, guided tour to the best scoops and stories every day in The Wall Street Journal, from Editor in Chief Gerard Baker."
109,"May 31, 2018 03:14 am ET",The Daily Shot: Firms Are Easing Drug Testing Requirements to Address Labor Shortages,
110,"May 30, 2018 07:15 pm ET",Sino Gas Agrees to Lone Star Takeover Bid Worth A$530 Million,"Sino Gas said Lone Star Fund X Acquisitions LLC is offering A$0.25 per share in cash to acquire the Australia-listed company, representing a premium of 19% to Wednesday’s closing share price of A$0.21. "
111,"May 30, 2018 05:17 pm ET",Oil Prices Steady After Big Drop on OPEC Talks    ,"Oil prices edged up Wednesday, while the U.S. dollar weakened, as the market appeared to steady after days of losses."
112,"May 30, 2018 05:13 pm ET",Stocks Bounce Back as Italy Fears Ebb,U.S. stocks recovered most of their losses as investors considered whether the prior day’s selloff driven by Italy’s unfolding political drama might have been overdone.
113,"May 30, 2018 02:42 pm ET",Fed’s Beige Book Finds Manufacturing Shifting Into Higher Gear,"Economic activity expanded at a moderate pace across most of the U.S. this spring, driven in part by a pickup in manufacturing activity despite trade tensions, according to a Federal Reserve report released Wednesday."
114,"May 30, 2018 12:35 pm ET","WSJ City PM: Europe’s Banks Face an All Too Familiar Problem, What to Make of Italy’s Bond Selloff",
115,"May 30, 2018 12:17 pm ET",Corporate Profits Boosted in Early 2018 by Tax Cuts,"The underlying trend for profits, however, showed some signs of strain."
