,date,title,summary
106,"November 29, 2017 02:27 pm ET","Russia, Saudi Arabia Clash Ahead of OPEC Meeting","Russia and Saudi Arabia are trying to hammer out differences over petroleum output ahead of OPEC’s meeting, highlighting the fragility of an energy alliance between the world’s two largest crude-oil producers."
107,"November 29, 2017 02:23 pm ET","A Year After OPEC’s Deal, Anticipation Is High for Continued Cuts ",The oil market is confronting a make-or-break moment as traders gauge whether major producers will come through on an expected deal this week to continue curbing output through the end of next year. 
108,"November 29, 2017 12:02 pm ET","WSJ City PM: Oil Producers Clash Ahead of OPEC Deal, Bitcoin Rush Continues, LSE’s Bad Timing",
109,"November 29, 2017 11:52 am ET",Retail Heir Is the Buyer Behind New York’s Priciest Foreclosure Auction,"A limited liability company controlled by David Lowy, whose father founded the Westfield Corp., purchased the home at One57, where he is listing another unit at a loss"
110,"November 29, 2017 10:04 am ET",T. Boone Pickens Lists Texas Ranch for $250 Million,"Over nearly five decades, the energy tycoon created a retreat in the Texas Panhandle with its own airport, art gallery and kennel for hunting dogs."
111,"November 29, 2017 09:02 am ET",One of America’s Oldest Energy Producers Splits in Two,"Consol Energy begins trading as separate coal and natural gas companies Wednesday, the final step in a corporate makeover years in the making."
112,"November 29, 2017 08:21 am ET","China Worries, Falling Oil Hit Copper Prices",Copper prices fell as continuing worries about demand from China and a fall in oil prices hit sentiment.
113,"November 29, 2017 07:11 am ET",Oil Falls as OPEC Deliberates Cuts—Energy Journal,Oil Falls Ahead of OPEC's Decision on Whether to Extend an Agreement to Cut Supply
114,"November 29, 2017 06:59 am ET","The 10-Point: Gerard Baker on tax-bill optimism, North Korea’s latest ICBM, oil’s rise, museum-worthy art and more","A personal, guided tour to the best scoops and stories every day in The Wall Street Journal, from Editor in Chief Gerard Baker."
115,"November 29, 2017 06:52 am ET",Today’s Top Supply Chain and Logistics News From WSJ,"Delivering up-to-the minute news, analysis, interviews and explanatory journalism on logistics, supply-chain management, e-commerce and more"
116,"November 29, 2017 04:58 am ET",Shell’s Gift to Investors Could Prove Premature,"Shell is finally scrapping its much-hated scrip-dividend program, with its accompanying shareholder dilution. Great news—but a closer look at the company’s financials and strategy raises some questions."
117,"November 29, 2017 02:00 am ET",Hopes for OPEC Action Boost Banks’ Oil-Price Forecasts ,Banks raised their oil-price forecasts for the second month in a row in November amid mounting expectations that OPEC and other big producers will reach a deal to support the market. 
118,"November 29, 2017 12:01 am ET","Rizzo’s Take: November Leveraged Loan Defaults Spike Due to Retail, Energy","A spike in the number of leveraged loan defaults this month, in addition to other expected defaults in the coming days, could make November the month with the most default activity since January 2012, according to a recent ratings agency report."
119,"November 28, 2017 11:30 pm ET",Oil Eases Further Following U.S. Inventory Reading,Oil futures pulled back further in Asian trading Wednesday following a surprise build in U.S. weekly crude inventories estimated by the American Petroleum Institute. 
120,"November 28, 2017 11:23 pm ET","The Daily Shot: Despite the Protectionist Rhetoric From Washington, U.S. Trade Deficit Worsens",
121,"November 28, 2017 06:57 pm ET",Oil Prices Chase $60 After a Year of Surging Demand ,"The price of oil in the U.S. has climbed to levels not seen since 2015, as unexpectedly strong global growth has helped soak up a supply glut that plagued the market for years."
122,"November 28, 2017 05:42 pm ET","Dow, S&P Post Biggest Gains Since September",Surging shares of financial companies helped the Dow Jones Industrial Average and the S&P 500 notch their biggest gains since September. 
123,"November 28, 2017 04:52 pm ET",Anxiety Over OPEC Cuts Weighs on Oil ,Oil prices edged lower Tuesday amid market jitters over whether—and for how long—OPEC and Russia will agree to extend their deal to curb crude production when they convene this week.
124,"November 28, 2017 04:33 pm ET","Rizzo’s Take: November Leveraged Loan Defaults Spike Due to Retail, Energy","A spike in the number of leveraged loan defaults this month, in addition to other expected defaults in the coming days, could make November the month with the most default activity since January 2012, according to a recent ratings agency report."
125,"November 28, 2017 04:21 pm ET",GOP Closes In on Opening Arctic Wildlife Refuge to Drilling,Oil companies and their allies are getting closer to opening the Arctic National Wildlife Refuge to drilling for the first time as congressional Republicans seek to use the tax overhaul to end the nearly 40-year debate. 
126,"November 28, 2017 09:05 am ET",Louisiana Stares Down a Budget Hole,"Louisiana lawmakers are scrambling to find a long-term fix for a looming fiscal crisis and avoid deep spending cuts, before $1 billion in temporary tax measures expire next year. "
127,"November 28, 2017 08:28 am ET","The Morning Download: Microsoft Adds SAP as Cloud Partner, Escalating Challenge to Amazon","The deal, expected to be announced Tuesday, means SAP will use Microsoft’s Azure Cloud internally, and highlight that usage to its own customers shopping for cloud services, in which different kinds of IT resources are accessed online as a service."
128,"November 28, 2017 07:25 am ET",The Morning Ledger: U.S. Retailers Put Pressure on Food Suppliers to Deliver on Time,U.S. increasingly impose fines on their suppliers for late shipments. Detroit auto makers meet with Vice President Pence to discuss the renegotiation of Nafta and Shell scraps its scrip dividend.
129,"November 28, 2017 07:16 am ET",Jitters Over OPEC Cut Weighs on Oil—Energy Journal,Oil Ministers from OPEC and Several External Producers Gather in Vienna
130,"November 28, 2017 03:41 am ET",Shell to Pay Its Dividend in Cash in Latest Sign of Health for Big Oil,"Royal Dutch Shell said it would begin paying its dividend only in cash, a fresh sign that big oil companies are trying to reward investors after struggling with three years of falling oil prices. "
131,"November 27, 2017 11:02 pm ET",The Daily Shot: Average New House Price Hits a Record as Luxury Home Sales Jump,
132,"November 27, 2017 05:02 pm ET","U.S. Stocks Mixed, Weighed Down by Energy Shares","The S&P 500 paused just shy of a record Monday, weighed down by a pullback in shares of energy companies. "
133,"November 27, 2017 04:06 pm ET",California Communities Look to Reopen Peabody Energy Global-Warming Lawsuits,Three California communities are appealing a bankruptcy judge’s recent decision that said Peabody Energy’s bankruptcy plan protects it from global-warming lawsuits.
134,"November 27, 2017 04:02 pm ET",Oil Falls Ahead of OPEC Meeting ,"Oil prices fell, ahead of a meeting scheduled for later this week between major crude producers, where a decision is expected on whether cuts will be extended. "
135,"November 27, 2017 03:15 pm ET",Seacor Liftboat Floats New Plan to Take Over Montco Offshore,Officials at Seacor Liftboat Holdings have a second proposal to take over the operations of bankrupt competitor Montco Offshore in a deal that leaves its founders behind.
136,"November 27, 2017 09:49 am ET",Mexico Registered $2.07 Billion Trade Deficit in October    ,"Mexico ran up a $2.07 billion trade deficit in October, more than double the shortfall in the year-earlier month as petroleum imports continued to rise, offsetting gains in shipments abroad of manufactured goods.  "
137,"November 27, 2017 08:59 am ET",SandRidge Adopts ‘Poison Pill’ After Carl Icahn Increases Stake ,SandRidge’s board adopted a so-called poison pill that would make it more difficult for activist investor Carl Icahn to increase his stake as he criticizes SandRidge’s plan to buy Bonanza Creek.
138,"November 27, 2017 07:49 am ET",The Morning Ledger: CFOs Want to Quit Excel,"CFOs say the ubiquitous spreadsheet software that revolutionized accounting in the 1980s hasn’t kept up with the demands of today's finance departments. Meredith acquires Time and pharmaceuticals firms invest $1.3 billion in the U.K., despite Brexit."
139,"November 27, 2017 07:25 am ET",Powell’s Path to Confirmation May Lack Drama | Fed’s Plan for 2017 Nears Completion | King Dollar Is the World’s Tyrant | Regulators to Meet on Global Capital Rules | Harrison’s Take: The Fed Puts Itself in an Epistemological Jam,"The Wall Street Journal’s central banking newsletter for Monday, November 27, 2017"
140,"November 27, 2017 07:15 am ET",Oil Eases Ahead of An OPEC Meeting—Energy Journal,Some Investors Are Worried That OPEC’s Supply Cut Could Send Prices Too High in 2018
141,"November 27, 2017 06:49 am ET","The 10-Point: Gerard Baker on a tale of two consumer-finance regulators, holiday shopping, slowing loan growth, ‘unboxing’ magic and more","A personal, guided tour to the best scoops and stories every day in The Wall Street Journal, from Editor in Chief Gerard Baker."
142,"November 27, 2017 06:36 am ET",Today’s Top Supply Chain and Logistics News From WSJ,"Delivering up-to-the minute news, analysis, interviews and explanatory journalism on logistics, supply-chain management, e-commerce and more"
143,"November 27, 2017 05:30 am ET",Stocks Around the Globe Stage Most Widely Shared Rally in Years ,"The vast majority of global stock markets in 2017 have surged either to fresh records or multiyear highs, one of the broadest rallies in years that investors say is a result of the increasingly synchronized global economic recovery."
144,"November 27, 2017 12:17 am ET",The Daily Shot: Is Mexico in Recession?,
145,"November 26, 2017 07:22 pm ET",Venezuelan General to Lead State Oil Industry,"President Nicolás Maduro named an active general to lead the state oil industry, Venezuela’s last major economic sector that had been outside the military’s control."
146,"November 26, 2017 01:49 pm ET",Oil Investors’ Surprise New Worry: An Over-Achieving OPEC ,"OPEC is poised to extend its production agreement, raising fears of price rises that risk curbing demand for crude and encouraging alternatives. "
147,"November 26, 2017 10:00 am ET",OPEC Plus Adds Uncertainty to Oil Market ,Russia’s importance to a deal to extend oil export cuts means that it holds the cards for OPEC and the deal will be less certain. 
148,"November 25, 2017 10:15 am ET","This Week on the Frontiers, November 25th 2017",A weekly roundup of key news affecting frontier markets from the Wall Street Journal and beyond.
149,"November 24, 2017 02:30 pm ET",Oil Rises to New Two-Year High,"Oil prices rose for the third session in a row Friday, as falling stockpiles and expectations for extended supply cuts boosted optimism in the market."
150,"November 24, 2017 01:52 pm ET","U.S. Stocks Extend Rally, Notch Weekly Gains",U.S. stocks capped off a quiet stretch of holiday trading with a weekly gain. The S&P 500 added 0.2%.
151,"November 24, 2017 10:30 am ET","As Money Tightens, an Oil Boom Town Fights for Its Share","The oil boom town of Williston, N.D., has hit a rough patch since energy prices flattened off and the state’s agricultural sector has softened. "
152,"November 24, 2017 09:37 am ET","Stocks to Watch: Chesapeake Energy, Cerner, PayPal and CenturyLink",
153,"November 24, 2017 09:20 am ET",Technology Ushers In a New Distributive Economy,"Intelligence is no longer just housed in the brains of human workers, but emerging through the constant interactions among machines, software and processes. As machines start to exhibit associative intelligence, something we thought only humans could do, current economic rules no longer apply, writes CIO Journal Columnist Irving Wladawsky-Berger."
154,"November 24, 2017 06:06 am ET",Have Trillions of Fed Dollars Broken a Bond Market Warning Sign? | ECB Officials Differed on Future of QE | SNB: Swiss Franc Too Strong | Derby’s Take: States’ Marijuana Legalization Is Making Things Hazy for the Fed,"The Wall Street Journal’s central banking newsletter for Friday, November 24, 2017"
155,"November 24, 2017 05:30 am ET","With Saudi Ties Fraying, Lebanese Premier’s Construction Empire Crumbles","Saudi Arabia is at the nexus of Lebanese Prime Minister Saad Hariri’s two big problems: his precarious political future and the looming collapse of his construction empire, a business built on decades of support from the Saudi royal family. "
156,"November 24, 2017 03:49 am ET",Rio Tinto Isn’t Tesla; It Should Hold Fire On a Lithium Bet,Lithium-battery and electric-vehicle plays are enjoying a futuristic ride into the stratosphere. Rio Tinto shouldn’t follow—at least not yet.
157,"November 24, 2017 12:30 am ET",The Changing Face of the Corporate Bond Market ,", even though companies are issuing more of them? "
158,"November 23, 2017 11:21 am ET","South Africa Holds Key Repo Rate, Adjusts GDP Forecasts ","The South African Reserve Bank kept its main interest rate on hold, a day before key ratings agencies are due to issue decisions on the country’s creditworthiness. "
159,"November 23, 2017 05:41 am ET",Oil Prices Dip After U.S. Crude Hits Two-Year High ,Oil prices eased after the U.S. market hit a more than two year high on reduced crude flow from Canada and falling stocks.  
160,"November 22, 2017 08:12 pm ET",Oil Futures Largely Maintain Wednesday’s Jump ,Oil futures edged lower in light Asian trading on Thursday after the U.S. benchmark hit its highest level in nearly 2 1/2 years. 
161,"November 22, 2017 06:00 pm ET",Carl Icahn Buys Stake in SandRidge Energy ,"Carl Icahn has purchased a 13.5% stake in SandRidge Energy Inc., joining a list of shareholders who say a deal the oil-and-gas producer struck last week for Bonanza Creek Energy Inc. makes little sense. "
162,"November 22, 2017 04:44 pm ET",Global Stocks Drift Following Rally,"Stocks stalled Wednesday ahead of the Thanksgiving holiday, as declines among technology and financial firms snapped the Dow Jones Industrial Average and the S&P 500’s two-day winning streaks."
163,"November 22, 2017 04:17 pm ET",Oil Hits Two-Year Highs as U.S. Stockpiles Drop,"Oil prices rose to the highest level in more than two years Wednesday, boosted by a drop in U.S. crude stockpiles."
164,"November 22, 2017 03:16 pm ET","The Morning Ledger: Uber Discloses Data Breach, Cover-Up",Uber discloses it has concealed a data breach affecting 57 million accounts. Meg Whitman steps down from HPE and U.K. companies plan to use fewer euros ahead of Brexit.
165,"November 22, 2017 01:48 pm ET",U.S. Oil-Rig Count Rises in Latest Week,"The number of rigs drilling for oil in the U.S. rose by nine to 747 this week, Baker Hughes, a GE company, reported."
166,"November 22, 2017 12:36 pm ET","WSJ City PM: UK Cuts Growth Forecasts, Hammond Offers Budget Sweeteners, Chinese Investors Circle City Trophies",
167,"November 22, 2017 12:01 pm ET",Transcript: Janet Yellen in Conversation With Mervyn King at NYU,"Federal Reserve Chairwoman Janet Yellen discusses how rate-setting meetings are conducted, the biggest challenges facing the central bank and why she became an economist."
168,"November 22, 2017 11:36 am ET",Rockwell Automation Rejects New Offer From Emerson    ,"Rockwell Automation rejected a third takeover offer from Emerson Electric, saying the unsolicited proposal undervalued the company and that Rockwell is better off on its own.   "
169,"November 22, 2017 09:47 am ET","Tech Rally Goes Global, Powering Stock Indexes to Fresh Records ","Shares in technology companies are outpacing other sectors this year by the widest margin since the height of the dot-com era, with a handful of key players dictating how markets are performing around the world."
170,"November 22, 2017 07:18 am ET",Oil Gains On Supply Disruptions—Energy Journal,Oil Gains on Supply Disruptions
171,"November 22, 2017 07:02 am ET",Yellen: Uncertain Weak Inflation Is Transitory | Minutes to Give Hints on Officials’ Mood | Fed Changes Quorum Rules | BOE Points to Further Rate Rises | Buell’s Take: Is Germany’s Loss Weidmann’s Gain?,"The Wall Street Journal’s central banking newsletter for Wednesday, November 22, 2017"
172,"November 22, 2017 04:01 am ET",Hang Seng Index Tops 30000 for First Time in a Decade,"Hong Kong’s main stock index surged past 30000 for the first time in 10 years, as a wave of Chinese buying and a surge in shares of tech giant Tencent Holdings propelled the market through its latest milestone."
173,"November 22, 2017 12:16 am ET",The Daily Shot: GOP Tax Effort Contributes to the Treasury Curve Flattening,
174,"November 21, 2017 08:26 pm ET",Oil Adds to Tuesday Gains Following API Data ,A sizable drop in U.S. oil inventories by API’s count has crude futures building on overnight gains.
175,"November 21, 2017 08:04 pm ET",Yellen Says She’s Uncertain Weak Inflation Is Transitory,"The Federal Reserve is monitoring inflation closely given officials’ uncertainty over whether the factors keeping it below their 2% target will prove endemic, Chairwoman Janet Yellen said."
176,"November 21, 2017 05:07 pm ET",Oil Rises Ahead of Thanksgiving Holiday,Oil futures gained Tuesday ahead of the Thanksgiving holiday and a meeting next week of major oil producers to discuss a possible extension of output cuts.
177,"November 21, 2017 07:54 am ET","The Morning Ledger: U.S. Sues To Block AT&T, Time Warner Deal",U.S. files a lawsuit challenging AT&T's merger with Time Warner; Volvo promises Uber self-driving fleet; Starboard discloses stake in Mellanox.
178,"November 21, 2017 07:10 am ET",Nebraska Officials Approve the Keystone XL Pipeline—Energy Journal,Nebraska Officials Approve the Keystone XL Pipeline
179,"November 21, 2017 06:54 am ET","The 10-Point: Gerard Baker on the feds’ AT&T-Time Warner roadblock, the latest move against North Korea, merger fever, the four temperaments and more","A personal, guided tour to the best scoops and stories every day in The Wall Street Journal, from Editor in Chief Gerard Baker."
180,"November 21, 2017 06:26 am ET",Today’s Top Supply Chain and Logistics News From WSJ,"Delivering up-to-the minute news, analysis, interviews and explanatory journalism on logistics, supply-chain management, e-commerce and more"
181,"November 21, 2017 12:23 am ET",Hedge Fund Bags Fast Profit From Venezuela Debt Crisis,A New York hedge fund has turned a quick $60 million profit by correctly guessing cash-strapped Venezuela would continue to pay its debts longer than many other investors imagined.
182,"November 20, 2017 11:24 pm ET",Commodity Bulls Ignoring a Few Large Elephants,Rising prices for growth-sensitive commodities have been one factor assuaging investors’ fears about richly valued stocks. But investors have been ignoring warning signs in metal and energy markets too. 
183,"November 20, 2017 05:59 pm ET",U.S. Stocks Rise,Gains in industrial shares helped push the Dow Jones Industrial Average higher on Monday.
184,"November 20, 2017 04:52 pm ET",Oil Pulls Back as OPEC Optimism Fades,Oil prices were steady ahead of next week’s meeting of global crude producers where an extension of output cuts is set to be discussed.  
185,"November 20, 2017 02:31 pm ET",Nigeria Set for $3 Billion Bond Sale as Pricing Suggests Favorable Demand,"Nigeria was set to sell $3 billion in debt on Monday, one of the largest bonds from an African nation and an indication that demand for some riskier investments remains strong."
186,"November 20, 2017 01:47 pm ET",Nebraska Regulators Approve Keystone XL Pipeline ,"Nebraska officials approved the Keystone XL pipeline, removing the last major regulatory hurdle, though the future of the long-delayed project remains far from certain."
187,"November 20, 2017 12:15 pm ET","WSJ City PM: Where Next for Germany, Getting Dangerously Expensive, Staley’s Plans for Barclays",
188,"November 20, 2017 08:01 am ET",Saudi Crackdown Sends Chill Through Neighbors’ Markets,"Political upheaval in Saudi Arabia has sent shares, currencies and bonds in the Middle East lower—but not in the kingdom itself."
189,"November 20, 2017 08:00 am ET",Growing Gas Glut Threatens West Texas Oil Boom ,"Natural gas is gushing out of West Texas, a byproduct of frenzied drilling for oil. That is a problem for energy producers, who are running out of places to send all of it. "
190,"November 20, 2017 07:27 am ET",The Morning Ledger: New Accounting Rule to Revamp Companies’ Financials,A new accounting standard requires companies to make changes to how they recognize revenue. British companies plan to make less use of the euro and Marvell is nearing a deal to buy Cavium.
191,"November 20, 2017 07:11 am ET","Oil Firms, Auto Makers Team Up to Improve the Combustion Engine—Energy Journal",
192,"November 20, 2017 07:05 am ET",Why The Oil Bust Is Still Troubling Southern Louisiana’s Economy,"While other energy hubs have rebounded, Houma, La., is still struggling."
193,"November 20, 2017 05:30 am ET",The Crude but Effective Way to Gauge the Oil Market ,"The widening discount of WTI to Brent crude seems odd now that the U.S. is an export juggernaut, but it explains a lot about the energy market. "
194,"November 20, 2017 12:15 am ET",The Daily Shot: Affordable Rental Housing Is Rapidly Disappearing,
195,"November 20, 2017 12:01 am ET",Corrigan’s Take: Bankruptcy Filings Among Oil and Gas Producers Dwindle; Service Providers Still Feel the Pain,"Reports released Thursday by law firm Haynes and Boone LLP show a significant slowdown in bankruptcies filed by oil and gas producers, while bankruptcies filed by oil-services companies continue to grow at a steady pace."
196,"November 19, 2017 09:04 pm ET",Brent Oil Continues to Underperform,"Brent crude futures continued to trail the U.S. benchmark in Asian trading on Monday, further narrowing a spread between the world’s two main oil contract types."
197,"November 19, 2017 05:11 pm ET",Quit Modifying Capitalism,"Profits should be pure, generated from price signals between buyers and sellers."
198,"November 19, 2017 04:20 pm ET",Venezuela Is Starving Its People,The Maduro regime is using its control of food to stamp out protests.
199,"November 19, 2017 02:17 pm ET",How China’s Acquisitive HNA Group Fell From Favor,"CEO Adam Tan drove the global ascent and ambition of the conglomerate, which has sought comparisons to Warren Buffett’s Berkshire Hathaway. It is now drawing the scrutiny of regulators and Wall Street, and its debt-fueled expansion has hit a wall."
200,"November 17, 2017 06:07 pm ET","For GE Investors, Growth in the Spring",John Flannery buys easy comparisons by beating down the share price.
201,"November 17, 2017 05:59 pm ET",Corrigan’s Take: Bankruptcy Filings Among Oil and Gas Producers Dwindle; Service Providers Still Feel the Pain ,"Reports released Thursday by law firm Haynes and Boone LLP show a significant slowdown in bankruptcies filed by oil and gas producers, while bankruptcies filed by oil-services companies continue to grow at a steady pace."
202,"November 17, 2017 05:40 pm ET",Emerging Market Bonds Falter as Investors Rush to the Exits,"Emerging market bonds are showing signs of stress, fresh evidence that investor interest in some of the world’s riskiest debt may be cooling down after a long rally."
203,"November 17, 2017 04:51 pm ET",U.S. Stocks Slip,"U.S. stocks slipped Friday, dragging the S&P 500 and Dow Jones Industrial Average to narrow weekly losses."
204,"November 17, 2017 03:23 pm ET",Review: Getting in on the Ground Floor With Silicon Valley’s ‘Troublemakers’,"Stress, sleep loss and operatic emotion: How the startup culture got going."
205,"November 17, 2017 03:18 pm ET",Oil Climbs on OPEC Expectations,"Oil prices gained Friday after a week of losses, on fresh signs that Saudi Arabia plans to back an extension of OPEC’s deal to curb global production."
206,"November 17, 2017 01:56 pm ET",Goldman’s Top 2018 Trades: It’s All About Emerging Markets,"Forget the U.S. Goldman says the hottest trades can be found in emerging markets like India, Chile and Peru."
207,"November 17, 2017 01:25 pm ET",U.S. Oil-Rig Count Unchanged in Latest Week,The number of rigs drilling for oil in the U.S. remained unchanged at 738 this week.The nation’s gas rig count rose. 
208,"November 17, 2017 08:12 am ET",Kaplan ‘Actively Considering’ Support for Rate Increase | Mester: Gradual Rate Path ‘Appropriate’ | Williams: Time to Weigh New Toolkit | Draghi Insists Stimulus Still Needed | Fairless Take: ECB Skeptics Cast Doubt On Another Extension To QE,"The Wall Street Journal’s central banking newsletter for Friday, November 17, 2017"
209,"November 17, 2017 07:00 am ET",Norway May Pull Its $1 Trillion Fund Out of Oil Stocks—Energy Journal,Norway’s Sovereign-Wealth Fund May Stop Buying Oil-and-Gas Stocks
210,"November 17, 2017 06:03 am ET",Kaplan ‘Actively Considering’ Support for Rate Increase | Mester: Gradual Rate Path ‘Appropriate’ | Williams: Time to Weigh New Toolkit | Draghi Insists Stimulus Still Needed | Fairless Take: ECB Skeptics Cast Doubt On Another Extension To QE,"The Wall Street Journal’s central banking newsletter for Friday, November 17, 2017"
211,"November 17, 2017 05:54 am ET",Asia’s Bond Market Hits a Rough Patch,"A trio of canceled bond sales and weakening investor demand for emerging-market junk bonds are pointing to new strains in Asia’s credit markets, after a strong rally earlier this year. "
