,date,title,summary
225,"May 22, 2018 12:01 am ET",Brazil Truck Drivers Strike Over Fuel Prices,"Truck drivers went on strike in Brazil against rising fuel prices for the second day on Tuesday, threatening the country’s sluggish recovery and pushing its cash-strapped government into a corner."
226,"May 21, 2018 07:17 pm ET",Rising Dollar Sparks Tumult in Emerging Markets ,"A resurgent dollar is exposing weaknesses in the developing world, pushing investors to unwind long-held bets on emerging-market stocks, bonds and currencies."
227,"May 21, 2018 07:04 pm ET",Stocks Surge as Fears of a Trade War With China Ebb,"U.S. stocks surged, powered by shares of industrials companies, as concerns about a trade war between the U.S. and China eased."
228,"May 21, 2018 05:18 pm ET","After Venezuela Strongman’s Victory, Isolated Nation Faces Growing Chaos ",its history. 
229,"May 21, 2018 05:11 pm ET",Trans-Atlantic Oil-Price Spread Soars as Supply Glut Disappears ,"U.S. oil prices are lagging behind global oil prices climbing toward $80 a barrel, the latest sign of a market that has gone from glutted to exceptionally tight in the past year. "
230,"May 21, 2018 04:35 pm ET",GE to Merge Rail Division With Wabtec in $11 Billion Deal ,The deal will allow GE to raise cash to fund its turnaround and shed one of its oldest operations. 
231,"May 21, 2018 03:37 pm ET",Oil Rises as Venezuela Election Puts Supply at Risk,"Oil prices rose Monday, with the U.S. benchmark hitting a fresh 3 1/2-year high as investors weighed further crude supply disruptions in Venezuela and Iran."
232,"May 21, 2018 01:22 pm ET","Icahn, Corvex Show Interest in Buying Energen","Activist investors Corvex Management and Carl Icahn say they are potentially interested in buying oil-and-gas company Energen, according to a securities filing."
233,"May 21, 2018 01:14 pm ET",Albany Is Pursuing Rational Energy Policies,"Reliability problems come from the faulty distribution of power, not its source, whether that be coal, oil, gas or solar. "
234,"May 21, 2018 01:09 pm ET",Pick Your Stock-Market Boom: Big Oil vs. Big Tech,There are two great times to make money in stock markets: the postcrash rebound and the end-of-cycle excess. Oil and technology fit the pattern perfectly in the past two years.  
235,"May 21, 2018 12:51 pm ET",Rex Energy to Pursue Dual-Track Chapter 11,Rex Energy Corp. has agreed to run a dual-track chapter 11 that will result in either a sale or reorganization of the business.
236,"May 21, 2018 12:01 pm ET",Why Are Two of Europe’s Star Currencies Selling Off?,
237,"May 21, 2018 09:55 am ET",Dollar Index Hits 6-month High on Trade Optimism,The U.S. dollar surged anew as investors cheered signs of easing trade tensions between the U.S. and China.
238,"May 21, 2018 09:00 am ET",Major Oil Companies Embrace Latin America ,"The world’s largest energy companies are placing enormous bets on Latin America, a region rich with oil that many avoided in the past. "
239,"May 21, 2018 07:36 am ET",Iran Challenges the EU to Take On U.S. Over Nuclear Pact—Energy Journal,Iran Vows to Uphold Nuclear Pact if the EU Offsets U.S. Sanctions
240,"May 21, 2018 07:30 am ET",Hastings Equity Holds $130 Million Initial Closing for Fourth Fund,The closing puts the energy services-focused firm about halfway to the $250 million it is seeking for the new offering.
241,"May 21, 2018 06:27 am ET",Small Outages Have Big Impact on Oil Prices ,Multiple oil supply outages at the same time helped prices hit a multi-year high and should keep the market tight into early summer. 
242,"May 21, 2018 05:45 am ET","Real Time Economics: U.S. Tariffs on Hold? | Where to Find Inflation | Chavismo Wins, Venezuela Suffers","Today in Real Time Economics, we look at the Trump administration's mixed message on China tariffs, the United States's two economies, software that shaves worker pay, the rise of U.S. bond yields, 13,000% inflation in Venezuela, and the dollar's rally."
243,"May 21, 2018 02:32 am ET",The Daily Shot: Americans Are Not in a Hurry to Take Equity Out of Their Homes,
244,"May 21, 2018 12:01 am ET",Venezuela’s Maduro Wins Re-Election Amid Opposition Boycott ,Nicolás Maduro won a second six-year term in a Venezuelan presidential election deemed illegitimate by the opposition and foreign governments. 
245,"May 21, 2018 12:01 am ET",Biswas’s Take: EP Energy Piles On Another $1 Billion in Debt to Avoid Restructuring,"EP Energy got some bad news from its banks recently, the company disclosed Thursday. A group of banks led by J.P. Morgan slashed the size of a revolver loan to the company by half, to $629 million."
246,"May 20, 2018 11:42 pm ET",Strong Car Demand From U.S. Boosts Japan’s Exports in April ,"Japanese exports rose 7.8% in April from a year ago, boosted by strong car demand from the U.S., data from Japan’s finance ministry showed Monday. "
247,"May 20, 2018 04:10 pm ET",Split in Goods and Services Inflation Underscores Fed’s Challenge ,"Inflation has been a puzzle in the U.S. economy for years, failing to move up much when the unemployment rate tumbled. To resolve the discrepancy, it helps to look at the U.S. as two economies: one for goods, another for services. "
248,"May 20, 2018 03:41 pm ET","In Venezuela Election, Maduro Loyalists Try to Boost Turnout",Angie Chong and other pro-government loyalists who distribute state-subsidized food in a Caracas slum went door-to-door on Sunday encouraging residents to vote in an election that many opposition members are boycotting.
249,"May 20, 2018 03:11 pm ET",Fall of a Malaysian Dynasty Puts Target on Alleged 1MDB Mastermind,"Financier Jho Low, accused of helping divert $4.5 billion, had been blithely partying and yachting around Asia. The prime minister’s shocking defeat makes Mr. Low a wanted man, but where is he?"
250,"May 20, 2018 09:00 am ET",Kraft Heinz Prepares to Take On Hellmann’s With a New Mayonnaise and ‘Mayochup’,"The Big Two are cutting prices and slinging out new concoctions as they battle changing eating habits, an array of new competitors and each other."
251,"May 20, 2018 09:00 am ET",Behind a Hedge Fund’s Billion-Dollar Bet on Busted Oil Companies ,"With oil prices at their highest level in three years, it would seem a good time to cash out of energy investments purchased cheaply during the oil rout. Hedge-fund manager Fir Tree is finding it isn’t."
252,"May 19, 2018 09:33 am ET","This Week on the Frontiers, May 19th 2018",A weekly roundup of key news affecting frontier markets from the Wall Street Journal and beyond.
253,"May 18, 2018 04:44 pm ET",U.S. Stocks Edge Lower for Week on Trade Worries,U.S. stocks showed signs of stalling as bubbling uncertainty around global trade policies and interest rates kept investors’ appetite for risk subdued.
254,"May 18, 2018 03:25 pm ET",Oil Closes Lower as Investors Take Profits,"Oil prices closed lower on Friday, after wavering between gains and losses in anticipation of renewed U.S. economic sanctions on Iran."
255,"May 18, 2018 03:25 pm ET",Biswas’s Take: EP Energy Piles On Another $1 Billion in Debt to Avoid Restructuring,"EP Energy got some bad news from its banks recently, the company disclosed Thursday. A group of banks led by J.P. Morgan slashed the size of a revolver loan to the company by half, to $629 million."
256,"May 18, 2018 03:10 pm ET",Oro Negro Restructuring Wins U.S. Court Recognition,"Mexico’s Perforadora Oro Negro, an offshore drilling contractor, won U.S. recognition of its bankruptcy proceeding, protecting its assets from creditors while it works to open a formal investigation into the circumstances of its collapse"
257,"May 18, 2018 12:24 pm ET","WSJ City: Italy’s Upstarts Set Collision Course With Europe, Cryptocurrency Firms Explore Bank Licenses",
258,"May 18, 2018 12:22 pm ET",Putin Avoids Overhaul With New Government,"Russian President Vladimir Putin approved a new government little changed from the previous one, signaling he is sticking to a course that has delivered weak growth and sent relations with the West to post-Cold War lows."
259,"May 18, 2018 10:06 am ET",North Korea’s Secret Army: How Operatives Abroad Aid the Regime    ,"Records of an undercover agent who lived as a businessman in Malaysia reveal the ways he kept goods flowing to North Korea, despite sanctions. "
260,"May 18, 2018 08:46 am ET",Copper Is Sending a Bearish Signal,"Copper is missing out on this year’s commodities rally as trade tensions linger, a worrying sign for investors who look at the industrial metal as an economic indicator."
261,"May 18, 2018 07:22 am ET",Nuclear Conundrums and Oil Headaches Dominate World Agenda—Energy Journal,The U.S. is Offering Sticks and Carrots for North Korea to Give Up Its Nuclear Weapons
262,"May 18, 2018 06:54 am ET",Real Time Economics: U.S.-China Tensions Easing? | ‘Nowhere Near’ a Nafta Deal | Mortgage Rates Hit 7-Year High,"Today in Real Time Economics, we look at progress and possibilities for U.S.-China trade relations, “gaping differences” in Nafta talks, President Trump's pressure on Germany, oil's latest jump, and the not coincidental rise of U.S. Treasury yields and U.S. mortgage rates."
263,"May 18, 2018 06:47 am ET","The 10-Point: Gerard Baker on uncertainty over the Trump-Kim summit, Congress pushing for tightened curbs on U.S.-China deals and more","A personal, guided tour to the best scoops and stories every day in The Wall Street Journal, from Editor in Chief Gerard Baker."
264,"May 18, 2018 06:29 am ET",Hundreds of Bitcoin Wannabes Show Hallmarks of Fraud | Crypto Firms Explore Getting Bank Licenses | Rubin’s Take: GOP Links CFTC Budget to Break for Banks,"The Wall Street Journal’s financial regulation newsletter for Friday, May 18, 2018."
265,"May 18, 2018 03:59 am ET","WSJ City: Saudis Discuss Oil Price Concerns, PayPal Snaps Up iZettle, Hundreds of Crypto Offerings Show Signs of Fraud",
266,"May 18, 2018 03:38 am ET",Japan’s Core Inflation Softens in April,"Japanese prices rose more slowly in April, showing how the tight job market has yet to build momentum for the Bank of Japan to reach its 2% inflation target. "
267,"May 18, 2018 02:56 am ET",The Daily Shot: Factory Workers See Faster Wage Growth and Longer Hours,
268,"May 17, 2018 08:33 pm ET",Oil Futures Rebound Some; Brent Still Below $80,Oil futures were modestly higher in Asian trading Friday following a reversal during U.S. action that saw the Brent global benchmark pull back from Thursday’s brief push through $80 a barrel.
269,"May 17, 2018 06:37 pm ET",Emerging-Market Currencies Fall Against Dollar ,"A range of emerging market currencies fell against the dollar, pressured by worries yields in the U.S. will continue rising. "
270,"May 17, 2018 06:11 pm ET",Santos Gets Binding Proposal From Habour,Santos Ltd. said it received a binding takeover proposal from private equity-backed oil-and-gas investor Harbour Energy Ltd.
271,"May 17, 2018 05:35 pm ET",U.S. Stocks Retreat on Trade Worries,"The Dow Jones Industrial Average fell Thursday, as investors seemed unfazed by upbeat earnings and more concerned with renewed trade tensions."
272,"May 17, 2018 05:06 pm ET","Saudis Discuss Oil-Price Concerns With OPEC, Russia ",Saudi Arabia said Thursday it was discussing concerns over volatile oil prices with other OPEC members and Russia after the cost of a barrel reached its highest level in three-and-a-half years.
273,"May 17, 2018 04:20 pm ET",Rex Energy Says It Will File for Bankruptcy ‘Imminently’    ,Rex Energy Corp. said it expects to file for bankruptcy “imminently” after talks with lenders and bondholders on restructuring its balance sheet outside of court protection were unsuccessful.
274,"May 17, 2018 03:50 pm ET",Brent Crude Hits $80 Amid Concerns Over Iran Supply ,"Brent crude prices pared gains to settle near unchanged after hitting $80 a barrel, as Washington’s decision to reinstate sanctions on Iran continued to fuel a rally that has pushed the market to 3 1/2 -year highs."
275,"May 17, 2018 03:17 pm ET",Quick Hits: PBOC Purchased Net 7.42 Billion Yuan of Forex in April,"The People’s Bank of China bought 7.42 billion yuan, or $1.16 billion, worth of foreign exchange in April, and the Reserve Bank of New Zealand closed its building following the discovery of asbestos in an air-quality test."
276,"May 17, 2018 12:53 pm ET",Maersk to Cut Services as It Battles Shipping Glut ,"A.P. Moller-Maersk said it would cut back on capacity to combat falling freight rates and rising fuel costs, after the Danish shipping giant reported a weak first quarter that sent its shares down about 8%. "
277,"May 17, 2018 12:33 pm ET","WSJ City PM: Don’t Expect a Rally on Strong Earnings, Europe Faces Fresh Battle, Brent Passes $80",
278,"May 17, 2018 10:55 am ET",Sharp Drops in Currencies Hint at Spreading Volatility,"Volatility is returning to a corner of the foreign-exchange market that has largely been resilient to recent stock and bond tumult, with currencies from Russia to Hong Kong posting outsize moves amid worries over global trade and interest rates."
279,"May 17, 2018 10:37 am ET",Kazakhstan Plans IPO of World’s Largest Uranium Miner,"Kazakhstan plans to sell at least 25% of the world’s largest uranium miner this year, the centerpiece of an effort to open up the economy of the former Soviet republic sandwiched between China and Russia. "
280,"May 17, 2018 08:15 am ET",Bank Indonesia Raises Rates to Prop Up Currency,"Bank Indonesia raised the benchmark rate by a quarter percentage point, to 4.50%, in a bid to bolster the weakening local currency and avoid stoking inflation. "
281,"May 17, 2018 07:30 am ET",Oil Breaks Through $80 as Firms Exit Iran Due to U.S. Sanctions —Energy Journal,Worries Over U.S. Sanctions on Iran Propelled Crude Prices Past $80 a Barrel
282,"May 17, 2018 06:10 am ET","WSJ Wealth Adviser Briefing: Halfbacks, Hedge Fund Charity, Reclining Nude",Former northerners are leaving their retirement homes in Florida and moving halfway back up; Blackstone promotes new energy fund; where graduates move after college.
283,"May 17, 2018 05:30 am ET","Oil Is Above $70, but Frackers Still Struggle to Make Money ","American shale drillers are still spending more money than they are making, even as oil prices rise. Only five of the top 20 oil companies that focus mainly on fracking managed to generate more cash than they spent in the first quarter."
284,"May 17, 2018 05:30 am ET",The Market’s New Boss ,The shift has been going on for some time but it became very clear this week: Interest rates are now more important than profits for stock performance. 
285,"May 17, 2018 03:46 am ET","WSJ City: Why Markets Aren’t In Meltdown Over Italy, Small Caps Point to U.S. Economy Outperforming",
286,"May 17, 2018 03:23 am ET",More 3 1/2-Year Highs for Oil Prices; Brent Nears $80,"Oil prices rose to fresh 3 1/2-year highs in Asia, helped by a pullback in the dollar, with Brent continuing its march to $80. "
287,"May 17, 2018 02:57 am ET",The Daily Shot: Will the Fed Overshoot on Rate Hikes?,
288,"May 16, 2018 05:29 pm ET",Canada Ready to Compensate Kinder Morgan for Pipeline Losses,Canada’s Liberal government pledged to cover Kinder Morgan’s losses on the Trans Mountain pipeline expansion caused by British Columbia’s efforts to delay and potentially kill the project.
289,"May 16, 2018 05:26 pm ET",Bondholders Push Jones Energy to Make Debt-Cutting Deal ,"A group of bondholders in oil-and-gas company Jones Energy have banded together, warning the company against any attempt to force a swap or debt buyback at a big discount."
290,"May 16, 2018 04:34 pm ET",Oil Rises on EIA Inventory Data,Oil prices climbed to fresh 3 1/2-year highs amid signs that the oil glut has disappeared.
291,"May 16, 2018 04:17 pm ET",Government Bond Yields Wobble Near Multiyear High,"U.S. government bond prices inched lower in quiet trade following a mixed batch of economic data, driving the yield on the benchmark 10-year note to a fresh multiyear high."
292,"May 16, 2018 03:54 pm ET",Oil Company Enduro Resource Files for Chapter 11,Company says it intends to complete a sale of its oil and gas assets in bankruptcy
293,"May 16, 2018 03:01 pm ET",Financial Conditions Are Starting to Get Tighter,"U.S. financial conditions are getting tighter, a development that threatens to crimp the flow of money through markets."
294,"May 16, 2018 02:50 pm ET",Venezuela’s Creditors Are Cutting Its Crude-Oil Lifeline ,"A series of court rulings are a major blow to the cash-strapped and increasingly isolated nation at a time when its once-thriving state energy monopoly, Petróleos de Venezuela, has been left in tatters after years of mismanagement. "
295,"May 16, 2018 12:15 pm ET",‘I Am the Mastermind’: Mohammed bin Salman’s Guide to Getting Rich,"The heir to the Saudi throne wasn’t always fabulously wealthy. Now, amid his crackdown on corruption, The Wall Street Journal has pieced together ways the crown prince and his brothers have leveraged businesses connected to government to make money—including a mammoth jet-leasing deal involving Airbus and the national airline.   "
296,"May 16, 2018 08:00 am ET",Oil Companies Look to Profit at the Pump,"Major oil companies are doubling down on gas stations, refineries and processing plants, betting on a once-unloved part of the energy business to shore up profits and expand their customer bases."
297,"May 16, 2018 06:40 am ET",Energy Journal: American Shoppers Shrug Off High Gas Prices,
298,"May 16, 2018 06:25 am ET","In Emerging Turmoil, What Links Argentina and Turkey?    ","Who’s next? The fear of contagion is stalking emerging markets again, but Argentina and Turkey have put themselves in the firing line while others have distanced themselves from it.  "
299,"May 16, 2018 05:30 am ET",European Companies Report Slower Earnings Growth,"European companies are reporting slower earnings growth as currency headwinds and higher input costs squeeze profits. Their profit outlook is overshadowed by the specter of potential tariffs, despite a robust economic forecast for the region. "
300,"May 16, 2018 02:38 am ET","The Daily Shot: Home Builders Are Optimistic, the Market Not so Much",
301,"May 15, 2018 06:31 pm ET",New York’s Green Energy Roulette,Gov. Cuomo uses up his state’s electricity margin of safety to advance his career.
302,"May 15, 2018 06:17 pm ET",Investors Are Wary as Companies Ramp Up Capital Spending,"U.S. companies are increasing spending on their businesses at the fastest pace in years, a long-awaited development following years of tepid growth. But investors may question whether it is worthwhile. "
303,"May 15, 2018 06:07 pm ET","Gold at a New Low for the Year, but ETF Investors Still Love It","Gold prices slumped, falling below the $1,300 level for the first time since December, but exchange-traded fund investors have been bullish on gold."
304,"May 15, 2018 05:55 pm ET","Kellogg Pulls Out of Venezuela, Citing Its ‘Deterioration’","Kellogg Co., citing the “deterioration” of Venezuela, said it was closing operations that employed 400 workers and produced much of the breakfast cereal consumed in the country."
305,"May 15, 2018 05:40 pm ET",Dow Industrials Snap Winning Streak,"U.S. stocks fell Tuesday, with the Dow Jones Industrial Average breaking an eight-session streak of gains."
306,"May 15, 2018 04:55 pm ET",Oil Prices Keep Climbing Despite Stronger Dollar,"Oil prices rose in volatile trading Tuesday, shrugging off a strong dollar and weak equity markets."
307,"May 15, 2018 10:40 am ET",German Economy Loses Luster as Global Tensions Bite,Europe’s largest economy cooled sharply in the first quarter amid a drop in government spending and weak exports – a sign that a stronger euro and global tensions are beginning to leave a mark on the German economy.
308,"May 15, 2018 08:11 am ET","Harbour Energy Working With ENN, Hony on Bid for Santos","Private-equity backed oil and gas investor Harbour Energy Ltd. continues to edge toward a takeover deal for Santos Ltd., negotiating for the support of Chinese investors that collectively hold the single biggest stake in the Australian company. "
309,"May 15, 2018 07:42 am ET",Rising Crude Prices Tempt Shale Oil Producers to Branch Out—Energy Journal,Rising Crude Prices Are Luring Shale Drillers Back to Previously Tapped Regions
310,"May 15, 2018 07:13 am ET",The Morning Ledger: Automation Frees Up Workers For More Creative Tasks,Automation drives job growth in certain sectors; Twitter Inc. CFO says more work ahead; Tesla Inc. reorganizes management structure.
311,"May 15, 2018 05:28 am ET",Trump’s ZTE Deal Is No U.S. Win ,The West’s main argument against Chinese trade practices has always been that it applies rules selectively and unfairly to achieve mercantilist aims. Now the U.S. is doing the same. 
312,"May 15, 2018 04:35 am ET",Fired-Up Coal Rivals Oil’s Rise,Traders are divided on the reason for coal's gains.
313,"May 15, 2018 02:08 am ET",The Daily Shot: A Broad-Based Acceleration in Wages Remains Elusive,
314,"May 15, 2018 01:26 am ET",Chinese Markets Are Opening Up. Some Investors Are Skeptical,"Elsewhere in Asia, markets were broadly lower Tuesday. Tech stocks struggled throughout the region, with tech-heavy indexes in South Korea and Taiwan dropping by 0.6% and 0.5%, respectively. Hong Kong’s Hang Seng index fell 0.9% by midday, with index heavyweight and internet giant Tencent Holdings Ltd. down 2.4%. "
315,"May 14, 2018 11:40 pm ET",What’s News: Business & Finance,What’s News: Business & Finance
316,"May 14, 2018 07:26 pm ET",Bond Market Shows Growth in U.S. Is Beating Europe,"The gap between the yields on 10-year U.S. Treasury notes and German government bonds reached its widest in almost three decades, a sign of investor confidence that growth remains steadier in the U.S. than Europe."
317,"May 14, 2018 05:14 pm ET",Gas Is Headed for $3. What That Means for the U.S. Economy,"Drivers gearing up for trips this summer face escalating prices at the gasoline pump, an early sign that $70-a-barrel oil is starting to reach into consumers’ wallets."
318,"May 14, 2018 03:47 pm ET",Oil Prices Rise on Tightening Global Market Signs,"Oil prices rose Monday on more signs of a tightening global oil market, despite the release of OPEC data which signaled robust production."
319,"May 14, 2018 12:56 pm ET","Lies, Damn Lies and Inflation ","In the U.S. and Europe, the central banks have been taking radically different monetary approaches even though the two regions have had similar inflation, job creation and inflation targets. One reason for this is that with no inflation scare in either the U.S. or eurozone, headline numbers matter. "
320,"May 14, 2018 11:34 am ET",Are Ether Futures Next?,"Exchange giant CME just took a step closer to launching futures on ether, the second-largest cryptocurrency."
321,"May 14, 2018 08:34 am ET",The Morning Download: Bank of America Explores Ethics of AI,"Bank of America, Inc. is pairing research into how artificial intelligence could be used to be detect fraud with an effort to understand the ethical implications of AI's use."
322,"May 14, 2018 07:39 am ET",OPEC’s Oil Production Crept Up Last Month—Energy Journal,OPEC’s Output Inched Up in April
323,"May 14, 2018 07:30 am ET",Cumming’s Take: The Contradictory Market for Debt Funds ,"Demand for distressed-debt funds has risen during the markets’ bumpy ride this year, but it hasn’t translated to much investment."
324,"May 14, 2018 07:30 am ET",Cumming’s Take: The Contradictory Market for Debt Funds ,"Demand for distressed-debt funds has risen during the markets’ bumpy ride this year, but it hasn’t translated to much investment."
325,"May 14, 2018 07:25 am ET",The Morning Ledger: U.S. Executives to Speak Out Against China Tariffs,"The U.S. trade representative’s office holds hearings on the administration's proposed China tariffs, President Trump extends a lifeline to ZTE and Xerox drops its Fujifilm merger plan."
326,"May 14, 2018 07:00 am ET",Shale Drillers Look Beyond Texas as Prices Rise ,"From Oklahoma to North Dakota, companies are increasing investment in oil fields that fell out of favor several years ago, as $70-a-barrel crude prices make fracking and horizontal drilling economical in more places again. "
327,"May 14, 2018 06:55 am ET",OPEC Output Rises on Higher Crude Production in Saudi Arabia,"OPEC said its crude oil output ticked up slightly last month, while total global supply continued to grow largely due to robust U.S. shale production."
328,"May 14, 2018 06:14 am ET",Mester: Economic Outlook Supports More Rate Rises | Bullard Still Opposes Rate Rises | ECB Official: Approaching End of Asset Purchases | Malaysia to Ensure Orderly Financial Markets | Timiraos’s Take: Confirmation Hearing Could Offer Clues About the Powell Fed,"The Wall Street Journal’s central banking newsletter for Monday, May 14, 2018"
329,"May 14, 2018 05:51 am ET",Timiraos’s Take: Clarida’s Confirmation Hearing Could Offer Clues About the Powell Fed,What questions might lawmakers press that could reveal new clues about the Fed’s potential policy path should Richard Clarida win confirmation?
330,"May 14, 2018 03:53 am ET","WSJ City: Italy’s Anti-Establishment Parties Agree Government Program, Trump Offers Lifeline to Sanctioned Chinese Firm ZTE",
331,"May 14, 2018 02:26 am ET",The Daily Shot: When Should We Expect the Next Recession?,
332,"May 13, 2018 08:55 pm ET",Oil Futures Ease Further From Multiyear Highs,"Oil futures extended morning weakness by midday Monday in Asia, itself building on Friday’s pullback from successive 3 1/2-year highs as investors grappled with supply uncertainty following the U.S. exit from the Iran nuclear deal. "
