,date,title,summary
111,"January 27, 2020 06:00 am ET","WSJ Wealth Adviser Briefing: Transport Stock Warning, Online Broker Boost, Young Investor Fears","Transportation stocks have been flashing potentially ominous signs for investors looking forward to a rise in global growth; online brokers became more popular after implementing zero commissions, and young investors let their gloomy view of the futures influence investing decisions."
112,"January 27, 2020 04:09 am ET","The Daily Shot: Measures to Contain Coronavirus Falter, Rattling Global Markets",
113,"January 25, 2020 01:27 pm ET","Emerging and Growth Markets, January 25th 2020",A weekly roundup of key news affecting emerging and growth markets from the Wall Street Journal and beyond.
114,"January 25, 2020 08:00 am ET",Italy’s Oil King Fights to Preserve His Legacy,"Claudio Descalzi is vying to remain CEO of Eni, the oil giant where he has worked for nearly four decades, as he denies any wrongdoing in a criminal case over the purchase of drilling rights in Nigeria."
115,"January 25, 2020 12:01 am ET",What’s News: Business & Finance,What’s News: Business & Finance
116,"January 24, 2020 06:31 pm ET",U.S. Crude Suffers Worst Week Since July ,"U.S. oil prices fell 7.5%, their sharpest weekly move lower since July, as the commodity was weighed down by fears that a deadly new virus spreading throughout China and other countries will hurt demand.  "
117,"January 24, 2020 04:37 pm ET",Stocks Drop on Worries About Virus Outbreak,"U.S. stocks fell Friday and ended the week lower on worries the deadly coronavirus outbreak is spreading. Energy was among the worst-performing sectors of the S&P 500, pulled down by slumping prices for crude oil."
118,"January 24, 2020 02:44 pm ET",Helicopter Merger Is Industry’s Response to Offshore Slowdown,The planned merger of helicopter operators Bristow Group and Era Group marks the troubled industry’s latest response to slumping demand for offshore choppers by oil-and-gas drillers after recent bankruptcy filings by Bristow and several competing companies.
119,"January 24, 2020 10:00 am ET",Starting Out: Salt Lake City on $50K a Year,"How far does a $50K salary go when you’re starting out? It depends on where you live. Meet Christianna Johnson, a civic engagement specialist in Salt Lake City. "
120,"January 24, 2020 09:01 am ET","Governor Holds the Cards After PG&E Deal | Retailers More Likely to Liquidate | Fairway Files for Bankruptcy With Offer for Five Stores
		
			","After PG&E Corp.’s deal with bondholders, California’s governor is the utility’s biggest hurdle to its emergence from bankruptcy later this year.   "
121,"January 24, 2020 04:06 am ET",The Daily Shot: Should the Fed Focus More on Asset Price Inflation?,
122,"January 24, 2020 02:34 am ET",88 Energy Raises A$5 Mln in Share Issue,
123,"January 23, 2020 07:12 pm ET",Jeff Bezos’ Unhappy Passage to India,The Amazon chief gets the cold shoulder from Modi. Other foreign companies may feel the chill.
124,"January 23, 2020 05:14 pm ET",U.S. Treasury Yields Extend Declines ,U.S. government yields extended a recent decline after concerns around the coronavirus outbreak in China drove investors to the relative safety of traditional havens. 
125,"January 23, 2020 05:07 pm ET",Energy Companies Darken S&P 500 Profit Picture,Corporate profits across the S&P 500 look a little brighter without energy companies in the mix. 
126,"January 23, 2020 05:03 pm ET",Puerto Rico Grid Contractor Faces Mounting Claims From Bribery Probe ,Mammoth Energy Services Inc. faces a lawsuit alleging the company paid bribes to cheat a competing contractor out of $500 million in government business. 
127,"January 23, 2020 04:47 pm ET",U.S. Stocks Recoup Steep Losses,The Dow Jones Industrial Average recovered most of its losses but closed in the red as mixed earnings reports and a worsening viral outbreak unsettled investors. 
128,"January 23, 2020 03:06 pm ET",Commodities Fall Alongside Global Stocks With Coronavirus Spreading ,"Commodities extended a recent slide Thursday amid signs that investors are bracing for a hit to economic growth in China, the world’s largest consumer of raw materials. "
129,"January 23, 2020 12:11 pm ET",The Koch Brothers Are Sitting on a Real Estate Empire Worth Hundreds of Millions,"Charles and his late brother David, as well as two other siblings, have purchased some of the most remarkable homes in the world. A look at their valuable portfolio."
130,"January 23, 2020 08:37 am ET",Pro Bankruptcy Briefing: PG&E Reaches Deal With Bondholders | McDermott Unveils Restructuring Details | Hilco Wins Auction for Philadelphia Refinery    ,PG&E Corp. said it reached a deal with bondholders as California Gov. Gavin Newsom again threatened a state takeover of the utility.  
131,"January 23, 2020 06:02 am ET","WSJ Wealth Adviser Briefing:  Options Election Play, Trade Finance Appeal, Best Plane Seats",
132,"January 23, 2020 03:41 am ET","ADM Energy Shares Fall After Profit, Cash Warning",
133,"January 23, 2020 02:40 am ET",The Daily Shot: It’s Been Decades Since the U.S. Had so Few Homes Listed for Sale,
134,"January 22, 2020 06:11 pm ET",Jimmy Carter’s Persian Gulf Success,"His doctrine, outlined 40 years ago, doesn’t get enough credit."
135,"January 22, 2020 03:46 pm ET",Crude Prices Fall on Coronavirus Fears    ,"Crude prices fell to seven-week lows, weighed down by concerns that a deadly strain of coronavirus that originated in China could dent demand for oil and jet fuel.  "
136,"January 22, 2020 11:27 am ET",Canada’s Annual Inflation Rate Rose 2.2% in December ,"The consumer-price index climbed last month on higher costs for gasoline, although data indicated a softening in underlying price pressures that some economists reckon will continue through 2020. "
137,"January 22, 2020 08:55 am ET",Pro Bankruptcy Briefing: McDermott International Strikes $4.6 Billion Debt Swap With Creditors | Holdout Banks Lose Bid to Block Alta Mesa Sale | Luminus to Buy Celadon’s Taylor Express Business    ,"McDermott International, an oil-industry-focused engineering and construction firm, said it would file a prepackaged bankruptcy after reaching a deal with its creditors on a $4.6 billion debt swap.  "
138,"January 22, 2020 06:40 am ET",Newsletter: Global Economic Tensions Are Here to Stay,Your daily economics newsletter from The Wall Street Journal.
139,"January 22, 2020 02:27 am ET",The Daily Shot: The U.S. Mobility Rate Continues to Decline,
140,"January 22, 2020 12:01 am ET",Recipe for a Cake Seriously Worth the Splurge,"Sauternes is a wine made for special occasions. Baked into a cake     it’s doubly extravagant, and the recipe is otherwise     surprisingly simple."
141,"January 21, 2020 07:40 pm ET",Holdout Banks Blocked From Challenging Alta Mesa Sale ,"Judge Marvin Isgur of the U.S. Bankruptcy Court in Houston precluded Bank of Texas, Huntington National Bank and other lenders from trying to block the proposed sale of Alta Mesa and its energy storage and pipeline subsidiary Kingfisher Midstream LLC. "
142,"January 21, 2020 06:10 pm ET",Natural-Gas Prices Fall Below $2 ,"Natural-gas futures fell to their lowest level in nearly four years, highlighting how a persistent glut has buffeted energy investors and producers."
143,"January 21, 2020 01:02 pm ET",Cold Comfort for U.S. Natural Gas Producers ,Unusually low prices for midwinter may foretell a prolonged price slump. 
144,"January 21, 2020 07:57 am ET",BP Names New Finance Chief Ahead of CEO’s Retirement,"Brian Gilvary will retire at the end of June and be succeeded by Murray Auchincloss, expanding changes to the company’s leadership ahead of Chief Executive Bob Dudley’s planned retirement."
145,"January 21, 2020 05:53 am ET",Caspian Sunrise Buys Drilling Vessel for $25 Mln From Shareholder -- Deal Digest,
146,"January 21, 2020 03:40 am ET",The Daily Shot: The Wuhan Pneumonia Virus Spooks Global Markets,
147,"January 20, 2020 01:03 pm ET","AGS WEEK AHEAD: Algeria Shops for Milling Wheat; Investors Cool on Coffee, Warm on Cocoa",
148,"January 20, 2020 12:17 pm ET",European Stocks Tick Lower on Fresh Strain to U.K. Ties ,European stocks drifted down after a top U.K. government official warned that the country may no longer be aligned with European Union rules and regulations after Brexit. 
149,"January 20, 2020 08:50 am ET",Leaders Confront Climate Change at Davos Gathering—Energy Journal,
150,"January 20, 2020 07:09 am ET","Oil Rises on Libyan, Iraqi Supply Disruption ","Oil prices rallied as a rebel group in Libya blocked a significant portion of the North African country’s crude exports and an Iraqi 70,000-barrel-a-day facility was forced to shut over the weekend. "
151,"January 20, 2020 05:32 am ET",South Sudan to Complete $289 Million Juba Power Grid by March,
152,"January 20, 2020 04:43 am ET",President Energy: Trafigura to Invest Up to $10 Mln via Share Subscriptions,
153,"January 20, 2020 03:44 am ET",Anglo African Shares Rise on Sale of Remaining ISA Investors Stake,
154,"January 20, 2020 02:51 am ET",The Daily Shot: Unusually Warm Weather Distorted December Economic Data,
155,"January 19, 2020 02:33 pm ET","In Stakeholder Capitalism, Shareholders Are Still King",Corporations are talking big about looking beyond share price. But don’t count on it.
156,"January 19, 2020 05:30 am ET",Replacing the Wisdom of Crowds With the Wisdom of Fink,The pledge last week by BlackRock CEO Larry Fink to push clients toward ESG investing highlights a risk: that markets are shifting from harnessing the wisdom of crowds to the wisdom of a handful of powerful money-management executives.
157,"January 18, 2020 09:38 am ET",Stakeholder Capitalism’s New Tenant: Airbnb,Airbnb’s plan to tie compensation to goals broader than profit is equivalent to telling companies’ owners they aren’t as important as they think. It remains to be seen whether Wall Street agrees.
158,"January 17, 2020 06:56 pm ET",Larry Fink’s Latest Sermon,The BlackRock CEO auditions to be the next Treasury Secretary.
159,"January 17, 2020 05:58 pm ET",China’s Slowing Growth Underlines Stress Facing Its Economy in 2020,"China emerged from 2019 with an official economic growth of 6.1%, within the government’s target but the lowest level in nearly three decades, as trade, investment, consumer spending and business confidence all face pressure. "
160,"January 17, 2020 03:42 pm ET",The U.S. Hasn’t Planted This Little Wheat in More Than a Century,"Much of the decline in planted wheat acres has come in recent years, concurrent with Russia’s ascent as the world’s dominant supplier and Midwestern farmers’ turn to more profitable crops, like corn and soybeans."
161,"January 17, 2020 11:08 am ET",The Middle East Isn’t Worth It Anymore,"With few vital American interests still at stake there, the U.S. should finally set aside its grandiose ambitions for the chaotic region."
162,"January 17, 2020 03:56 am ET","The Daily Shot: China’s Economic Activity Rebounds, but Concerns Linger About Nonperforming Loans",
163,"January 16, 2020 12:55 pm ET","Putin Ushers In New Prime Minister, Signaling Bid to Boost Economic Legacy","Lawmakers approved Vladimir Putin’s candidate as prime minister, the next step in a tightly choreographed transition that could set the stage for the president to retain a grip on power after his term ends."
164,"January 16, 2020 12:37 pm ET",Remembering the Mother of All Selloffs ,Oil’s reaction following the killing of Qassem Soleimani has some parallels with what happened during Operation Desert Storm in 1991. 
165,"January 16, 2020 09:11 am ET",PE Daily: Clearlake Lands Connecticut Cash | L.A. County Bulks Up for Co-Investing | SEC Panel Eyes Main Street    ,"The pace of private-equity fundraising sometimes raises concerns among investors, as Preeti Singh shows in her look at deliberations by Connecticut’s main public pension over investing in a new Clearlake Capital fund that’s nearly twice as big as its predecessor.   "
166,"January 16, 2020 08:55 am ET",The Era of Fed Power Is Over; Kaplan Warns on Investor Risk Taking; Beige Book Reports Continued Modest Growth    ,"With interest rates stuck around zero, the Federal Reserve and other central banks are left without their principal lever over the business cycle, Greg Ip writes in a Wall Street Journal analysis.  "
167,"January 16, 2020 06:00 am ET","WSJ Wealth Adviser Briefing: Commodity Boost, Wealthy Renters, Future Gym","The weakening dollar could lift commodities and commodity producers; developers build more luxury apartments in a bid to lure wealthy renters, and the gym of the future will feature senior citizens seeking small talk and little sweat."
168,"January 16, 2020 03:28 am ET","Empyrean Energy Raises GBP420,000 in Share Placing",
169,"January 15, 2020 06:40 pm ET",Weakening Dollar Could Lift Commodities in 2020 ,"After a year in which a strong dollar weighed on commodity prices, some banks now predict the U.S. dollar is set to weaken in 2020. That could herald good news for investors in commodities as well as producers. "
170,"January 15, 2020 06:19 pm ET","Barclays, FactSet Offer New Tool to Navigate Opaque Bond Market    ",The quest for transparency in fixed-income markets has Barclays and FactSet teaming up.
171,"January 15, 2020 03:17 pm ET",Florida to Buy Everglades Parcel to Save It From Oil Drilling ,Florida struck a deal to buy an expanse of land in the Everglades that will halt a plan to drill for oil that stirred outrage among conservationists.
172,"January 15, 2020 01:35 pm ET","U.S.-China Trade Détente, but a More Dangerous World ","Some of the trade war’s aims were accomplished, but many weren’t. "
173,"January 15, 2020 12:09 pm ET",Energy Capital Sweeps Up $6.8 Billion for New Power Bets,"Energy Capital Partners has amassed nearly $7 billion for its latest flagship fund and parallel co-investment pools targeting power plants and other energy-infrastructure assets, despite tepid interest from U.S. investors. "
174,"January 15, 2020 06:41 am ET",Newsletter: Everyday Low Prices,Your daily economics newsletter from The Wall Street Journal.
175,"January 15, 2020 04:24 am ET",The Daily Shot: Growth in Real Weekly Wages Stalls,
176,"January 15, 2020 02:37 am ET","Tullow Oil to Report Revenue, Gross Profit Fall for 2019, Backs 2020 Views",
177,"January 14, 2020 06:31 pm ET",Bernie Beats Hillary,Activists celebrate the end of moderation in the Democratic field.
178,"January 14, 2020 03:57 pm ET",Wheat Higher on Speculation About Russian Exports,
179,"January 14, 2020 03:33 pm ET",Sugar Prices Surge on Asian Supply Shortfall    ,"A brewing shortfall of sugar supply in Asia is lifting the global price of the sweetener, providing relief for farmers and refiners after an extended market slump.  "
180,"January 14, 2020 03:06 pm ET",Energy Companies Seize the Day With Bond Refinancings,"A surprise rally in riskier corporate bonds is providing much-needed help to some energy companies with lower credit ratings, allowing them to issue new bonds to push back looming repayment dates. "
181,"January 14, 2020 11:37 am ET",Smooth Sailing for Ships After Historic Fuel Switch ,"A major switch in maritime fuel aimed at reducing emissions from ships is proceeding smoothly, shipping executives say, with new blends available in most ports and operators reporting few problems adapting to the fuel. "
182,"January 14, 2020 10:41 am ET","PE Daily: Lacers Aging Fund Problem | Siguler Guff Raises $1.58 Billion | Albertson’s Preps for IPO, Again    ","The first, from our newest reporter Preeti Singh, outlines the 2020 pacing plans and challenges facing one Los Angeles public pension while the other one comes from yours truly about the newest, and so far largest, small buyout fund of funds from Siguler Guff.  "
183,"January 14, 2020 07:56 am ET",In Their Own Words With Buyout Firms,"Each year, Private Equity Analyst asks professionals across the private-markets industry to reflect on the year that has just ended and share projections for the one that lies ahead. This year’s contributions come from professionals from a range of industries, experiences and geographies."
184,"January 14, 2020 04:18 am ET",The Daily Shot: Companies with China Exposure Are Outperforming Again,
185,"January 13, 2020 03:22 pm ET",Unwind of Bullish Oil Bets Could Limit Crude-Price Gains    ,"A pullback in bullish oil bets could tamp down crude prices with tensions in the Middle East subsiding, a rapid shift after the U.S.-ordered killing of a top Iranian military leader had some traders positioning for further gains earlier this month.  "
186,"January 13, 2020 11:56 am ET",Alta Mesa’s Kingfisher Subsidiary Files Chapter 11 Too ,"Alta Mesa Resources Inc.’s oil and gas pipeline and storage subsidiary Kingfisher Midstream LLC filed for chapter 11 Monday morning, joining its bankrupt parent, with the plan of pursuing a joint bankruptcy sale. "
187,"January 13, 2020 11:28 am ET","Business Sentiment Remains Positive, Bank of Canada Survey Finds ","Business sentiment in Canada improved slightly in recent months and remains broadly positive in most parts of the country, a Bank of Canada survey found. "
188,"January 13, 2020 09:42 am ET",Pro Bankruptcy Briefing: Junk Drillers Pounce on Oil Rally | Blackjewel Probes CEO Payments | Private Lending Boom Eases    ,"Junk-rated energy companies aren’t completely shut off from high-yield debt markets, if the series of risky bond deals last week are any indication.  "
189,"January 13, 2020 09:39 am ET",Jobs Report Should Help Keep Fed on Sidelines; Fed’s 2014 Transcripts Released; Japan’s Inflation Lessons    ,The December jobs report should help keep the Federal Reserve on the sidelines when it comes to interest-rate moves.  
190,"January 13, 2020 08:38 am ET","Energy Journal—Traders, Oil Producers Divided on Mideast Tensions",
191,"January 13, 2020 07:33 am ET",Companies Will Walk the Walk—Will They Talk the Talk?    ,Companies will probably report modest profit growth in the fourth quarter. But they may also dash investors’ expectations for big earnings gains this year.     
192,"January 13, 2020 04:44 am ET",The Daily Shot: Is the U.S. Labor Market Turning Japanese?,
193,"January 13, 2020 03:54 am ET",Dekel Agri-Vision 2019 Crude Palm Oil Production Rose,
194,"January 13, 2020 03:05 am ET",The Perfect Way to Play Geopolitical Risk: Just Don’t ,"Equity investors have largely been rewarded for ignoring international political ructions, despite suggestions that such risks are at an all-time high.  "
195,"January 12, 2020 10:31 pm ET","Emerging and Growth Markets, January 11th 2020",A weekly roundup of key news affecting emerging and growth markets from the Wall Street Journal and beyond.
196,"January 12, 2020 08:25 pm ET","Iran Faces Growing Criticism at Home, Abroad Over Downing of Ukrainian Plane","Iran’s leadership attempted to contain international criticism and anger at home over its admission that its armed forces accidentally shot down a Ukrainian passenger airliner, following prior denials. "
197,"January 12, 2020 04:16 pm ET",Exxon Considers Sale of Oil Assets in Equatorial Guinea,"Exxon Mobil is in talks to sell its oil assets in Equatorial Guinea, the country’s oil minister said, and might be replaced by a Russian company."
198,"January 12, 2020 02:56 pm ET",Aramco Adds to Record IPO,"Saudi Aramco said it netted an additional $3.8 billion from its record initial public offering as it sold more shares to meet investor demand, boosting Crown Prince Mohammed bin Salman’s war chest to reshape the country’s oil-dependent economy."
199,"January 11, 2020 10:26 am ET",Oman Names Sultan Qaboos’s Cousin as Its New Ruler,"Oman named Haitham bin Tariq al-Said as its new ruler following the death of his cousin, Sultan Qaboos, elevating the royal to the helm of the U.S. ally at a tumultuous time in the Middle East."
200,"January 11, 2020 12:01 am ET",What’s News: Business & Finance,What’s News: Business & Finance
201,"January 10, 2020 05:54 pm ET",‘Bubble in the Sun’ Review: How Do You Like Them Oranges?,The rafﬁsh story of the Florida land boom of the 1920s—and how it helped bring on the Great Depression.
202,"January 10, 2020 04:13 pm ET",Risky Energy Companies Exploit Short-Lived Crude Rally,"Despite a chilly market for junk-rated energy companies, several borrowers exploited a short-lived oil rally and favorable market conditions to sell debt, suggesting that capital markets have opened slightly to the distressed sector."
203,"January 10, 2020 03:34 pm ET",Oil Logs Worst Week Since July as Iran Tensions Ease,"Crude-oil prices retreated Friday, giving the commodity its largest weekly drop since mid-July as traders anticipated plentiful supply and played down tensions that flared up earlier in the Middle East.  "
204,"January 10, 2020 12:03 pm ET",USDA Report: World Agricultural Supply and Demand Estimates,
205,"January 10, 2020 09:54 am ET",The Blessing and Curse of ‘Black Gold’,"From the pharaohs to John D. Rockefeller, oil has been key to the growth of civilization—but it comes at a high cost."
206,"January 10, 2020 08:00 am ET",Soybeans Erase Intraday Gains -- Technical Analysis,
207,"January 10, 2020 06:19 am ET",The Promise of Sustainable Aviation Fuel Isn’t for Today    ,"Since electric and hybrid planes won’t work at scale for decades, the aviation industry’s journey toward a greener future will need to be powered by sustainable fuels. But those with the most promise today might not be good long-term bets.  "
208,"January 10, 2020 05:30 am ET",Oil Producers Are Setting Billions of Dollars on Fire,"Massive amounts of natural gas are being burned to make way for oil production. Unless the incentives are changed, the harmful practice will become even more common in the U.S."
209,"January 10, 2020 03:11 am ET",The Daily Shot: Investors Now Want Companies to Focus on CapEx Instead of Buybacks and Dividends,
