,date,title,summary
125,"January 1, 2019 12:01 am ET",Bond Market Faces Greater Volatility in New Year,"Investors enter the new year increasingly uncertain about where the bond market is headed given the turbulent interplay between interest rates, growth, and inflation that intensified toward the end of 2018."
126,"January 1, 2019 12:01 am ET","Chesapeake Energy, Fracking Pioneer, Bet on Oil. Then Prices Plunged",Chesapeake Energy shifted its focus to oil from natural gas just in time for oil prices to tumble 40% since October.
127,"January 1, 2019 12:01 am ET",Investors on Edge After Stocks’ Biggest Yearly Loss Since 2008,Stock investors are heading into the new year with a sense of wariness after contending with sharp reversals across much of the market in the fourth quarter.
128,"January 1, 2019 12:01 am ET",Fears Loomed Large in Oil’s Worst Quarter Since 2014 ,"The U.S. crude benchmark finished the year at $45.41, a decline of 25% for 2018 after a slump that shaved $30 off the price from October’s high."
129,"December 31, 2018 06:26 pm ET",U.S. Stocks Make Emerging Markets Look Placid,"U.S. stocks have seesawed this month, dropping sharply before the Christmas holiday and then surging to end last week with gains. The gyrations have boosted investors’ expectations for volatility "
130,"December 31, 2018 03:47 pm ET","U.S. Oil Prices Rise, but End 2018 Down 25%","Oil prices rose slightly, driven by higher stock market prices on Wall Street. But U.S. crude prices ended the calendar year down 25% amid rising output from major oil producers and worries of an economic slowdown that could weaken oil demand."
131,"December 31, 2018 01:04 pm ET",PetroQuest Unsecured Creditors Seek Changes to Restructuring Plan,"The committee representing PetroQuest Energy’s unsecured creditors is challenging the terms of the oil-and-gas driller’s reorganization plan, which the company estimates would see unsecured creditors get less than 1 cent on the dollar."
132,"December 31, 2018 01:03 pm ET","Amazon, to Win in Booming Rural India, Reinvents Itself","The retailer is targeting hundreds of millions of new online shoppers in India’s countryside by simplifying its order screen with Hindi and videos, opening stores to help people shop and adding a fleet of local deliverymen who can take payments. "
133,"December 31, 2018 09:22 am ET",Miners Cut Back in Largest U.S. Coal Region,Miners in the Powder River Basin of Wyoming and Montana are leaving more of the fossil fuel in the ground as prices fall for alternatives including natural gas.
134,"December 31, 2018 08:00 am ET",Soybeans Bounce in Corrective Action -- Technical Analysis,
135,"December 31, 2018 08:00 am ET",Rising Emerging-Market Debt Sparks Anxiety,"A steady rise in the debt of developing countries is worrying some investors, highlighting the challenges faced by emerging markets in 2019 amid slowing global growth and tightening monetary policy. "
136,"December 31, 2018 07:35 am ET",Shale Drillers Cut Budgets as Oil Prices Drop ,"Some frackers are scaling back next year’s drilling plans amid weak crude prices, a quick reversal for an industry that months earlier expected 2019 to be a banner year."
137,"December 31, 2018 06:02 am ET","WSJ Wealth Adviser: Expert Advice, Chinese Bonds Offer Refuge, Cryptocurrency No Longer A Rebel Asset",
138,"December 31, 2018 03:09 am ET",Cabot Energy Shares Tumble on Planned Discounted Equity Fundraising,
139,"December 31, 2018 12:01 am ET",‘We Do All We Can So That People Don’t Kill Each Other’: The Experiment to Stop Latin America’s  Carnage,"A few places in Ecuador and Colombia are exceptions to the regional surge in homicides. Efforts include turning gang members into garbage collectors, and firing hundreds of corrupt police officers.  "
140,"December 30, 2018 02:58 pm ET",2018’s Biggest Loser Was the Liberal International Order,"The runners-up are China, the U.K., France’s Macron and Saudi Arabia’s Crown Prince Mohammed."
141,"December 28, 2018 10:06 pm ET",The Score: The Business Week in 7 Stocks,The Score: The Business Week in 7 Stocks
142,"December 28, 2018 07:20 pm ET",Dow Industrials Fall to End Volatile Week,All three major U.S. indexes snapped a three-week losing streak but are poised for annual losses for the first time since 2008.
143,"December 28, 2018 04:36 pm ET","Oil Finishes Higher, Moving in Tandem with Stocks",Oil prices closed higher after another volatile session featuring more swings alongside stocks and other risk assets.
144,"December 28, 2018 02:48 pm ET",ICE Canola Review: Canola Rallies With Soy,
145,"December 28, 2018 11:31 am ET",ICE Canola on Rise With Soymeal,
146,"December 28, 2018 10:07 am ET",ICE Canola up With Soy,
147,"December 28, 2018 08:49 am ET",Sudan’s Deadly Protests Pressure President’s Three-Decade Rule,Antigovernment protests across Sudan have left dozens of people dead and jolted the 30-year rule of President Omar al-Bashir just months after the U.S. lifted decadeslong sanctions.
148,"December 28, 2018 08:00 am ET",Pace of Soybean Declines Slows -- Technical Analysis,
149,"December 28, 2018 05:30 am ET",Battered Global Investors Find an Unlikely Safe Space: Chinese Bonds ,Investors have struggled to avoid losses this year and there aren’t many asset classes in positive territory as 2018 comes to a close. A rare refuge is the Chinese bond market. 
150,"December 27, 2018 05:26 pm ET","Oil Declines in Volatile, Thin Trading","Oil prices fell in thin trading volumes because of the holiday season, with analysts saying low liquidity had contributed to the particularly volatile trading this week."
151,"December 27, 2018 02:59 pm ET",ICE Canola Review: Canola Mixed Following Holiday Break,
152,"December 27, 2018 11:43 am ET","ICE Canola Weakens, Realigning With Soy",
153,"December 27, 2018 11:30 am ET","WSJ Wealth Adviser: Dow Posts Record 1000+ Point Gain, Investors Pull Back from Funds, ETFS",
154,"December 27, 2018 10:14 am ET",ICE Canola Playing Catch-up to U.S. Markets,
155,"December 27, 2018 09:30 am ET",Mount Sinai Sees Appetite for Dietitian-Designed Meal Services,"Mount Sinai’s venture fund is boosting its investment in Epicured, which provides meals for patients with serious digestive diseases. The move comes as more people look to food as part of their medical treatment, but it also raises conflict-of-interest questions.  "
156,"December 27, 2018 07:00 am ET",One Man’s Money-Draining Bet on Climate Change ,"The plan was to snap up rain forest in Borneo, preserve it from logging and sell carbon credits to big polluting companies in the developed world. But the carbon windfall never arrived."
157,"December 27, 2018 07:00 am ET",One Man’s Money-Draining Bet on Climate Change ,"The plan was to snap up rain forest in Borneo, preserve it from logging and sell carbon credits to big polluting companies in the developed world. But the carbon windfall never arrived."
158,"December 27, 2018 07:00 am ET",Vanadium Is Used to Strengthen Steel and China Can’t Get Enough of It,"Mining companies are revisiting projects to produce vanadium, as China implements new construction rules prompted by the deadly earthquake in Sichuan in 2008."
159,"December 27, 2018 05:30 am ET","In Booming Oil Field, Natural Gas Can Be Free ","American energy companies have spent billions of dollars in the past decade exploring for natural gas. But in parts of Texas and New Mexico, there is now so much of it that it is sometimes worthless. "
160,"December 27, 2018 05:03 am ET",Copper Climbs Amid Equity Rally,
161,"December 27, 2018 12:01 am ET",What’s News: Business & Finance,What’s News: Business & Finance
162,"December 26, 2018 11:07 pm ET","Dow Industrials Leap More Than 1,000 Points","The Dow Jones Industrial Average surged more than 1,000 points for the first time in a single session Wednesday, rebounding after a bruising four-session selloff put the blue-chip index and the S&P 500 on the brink of a bear market. "
163,"December 26, 2018 06:51 pm ET",Oil Rises by Most in Two Years as Wall Street Rebounds,Oil prices had their biggest one-day increase in more than two years Wednesday as a rebound in the U.S. stock market led to oil buying.
164,"December 26, 2018 09:55 am ET",The Bill Coming Due for Airlines,"Costs are a key concern for airline investors, who have fretted about pilot shortages, union disputes and oil prices over the past year. But there’s a less obvious bill that they will likely face in 2019: Higher airport fees."
165,"December 26, 2018 12:01 am ET",What’s News: Business & Finance,What’s News: Business & Finance
166,"December 25, 2018 07:54 pm ET",Behind the Market Swoon: The Herdlike Behavior of Computerized Trading,"The majority of trades come from machines, models, or passive investing formulas that move in unison and blazingly fast. This quarter’s sharp declines are symptoms of the modern market’s sensitivities, the same ones that drove gains through the first three-quarters of the year."
167,"December 25, 2018 11:01 am ET",India Overtakes China as Favored Target for Corporate Deals  ,"India is having its busiest year ever for corporate deal making, as foreign buyers are now spending more there than in China. "
168,"December 25, 2018 10:17 am ET",Credit the Energy Boom to Free-Market Grit,You need not always give in to mobs that demand an immediate and cost-free government solution
169,"December 25, 2018 09:47 am ET","With Bull Run in Jeopardy, Investors Find Few Havens ",Investors are running out of places to hide as the stock-market rout accelerates. 
170,"December 25, 2018 08:00 am ET",Hedge Fund Makes Billions Off Americans’ Underwater Mortgages ,"Fir Tree made a surprising wager—that many Americans would keep paying their home-loan debt, even after their homes’ value fell below what they owed."
171,"December 24, 2018 06:04 pm ET",Dollar Falls to Start the Week,"The dollar weakened on Monday, as concerns over a partial U.S. government shutdown and a sharp decline in stocks weighed on investor sentiment. "
172,"December 24, 2018 05:29 pm ET",U.S. Oil Prices Fall to 18-Month Low as Wall Street Tumbles,U.S. oil prices are down 44% since early October amid growing fears that a slowing global economy could sap demand.
173,"December 24, 2018 02:54 pm ET","Dow Falls Nearly 3%, Extending December Rout",The Dow Jones Industrial Average lost more than 650 points as Treasury Secretary Steven Mnuchin tried to instill calm into a jittery market. The S&P 500 is less than half a percentage point away from entering a bear market. 
174,"December 24, 2018 11:18 am ET",How China Built a Steel Behemoth and Convulsed World Trade,"A four-decade drive, driven by global demand and supported by government subsidies, cheap loans and tax breaks, helped bring China out of poverty. It also upended industries around the world and helped spark trade tensions with the U.S."
175,"December 24, 2018 07:00 am ET","Who Won Our Stock-Picking Game, Columnists or Readers? ","Annual picks made by Heard on the Street writers, published in late summer, resulted in an average loss of 9.14%, not counting dividends. That was actually a better performance than the S&P 500. "
176,"December 24, 2018 05:30 am ET",Banks Sharply Lower Oil-Price Forecasts ,"Banks in December significantly lowered their forecasts for oil prices in 2019, as crude markets remained under firm pressure amid worries over weakening demand and signs of a burgeoning global supply glut. "
177,"December 24, 2018 04:17 am ET",Victoria Oil & Gas Signs Gas-Supply Contract With Eneo Cameroon,
178,"December 23, 2018 12:00 pm ET","In the Stock Market, It’s a Dog-Eat-Dow World ","In the last three months of the year, stock prices have gone to the dogs. The Dogs of the Dow, that is. "
179,"December 23, 2018 09:30 am ET","This Week on the Frontiers, December 22nd 2018",
180,"December 23, 2018 07:00 am ET",Fuel Production Frenzy Spurs Lower Gas Prices,"If the gasoline oversupply gets too large, it could force refiners to cut back on processing rates, reducing a key element of demand for crude oil and likely adding more pressure on U.S. oil prices."
181,"December 22, 2018 12:01 am ET","One Year Later, Benefits From Corporate Tax Cut Seem Muted ","Twelve months after Congress cut business tax rates and sped up deductions to set off a capital spending boom, the results are proving modest at best."
182,"December 22, 2018 12:01 am ET","Climate Change Drives Fish Into New Waters, Remaking an Industry","The catch is shifting northward as water temperatures rise, forcing crews to retool their boats and rework their businesses. Pollock is retreating from Alaska while black sea bass throng around Rhode Island."
183,"December 21, 2018 06:38 pm ET",Stock Rout Puts Nasdaq in Bear Market,"Technology and other fast-growing companies tumbled, extending a painful stock-market rout that shaved about 400 points off the Dow industrials Friday and pulled the Nasdaq Composite into bear-market territory."
184,"December 21, 2018 04:33 pm ET",Oil Prices End Lower Despite Saudi Arabia’s Proposed Production Cuts,U.S. oil prices fell to a fresh 17-month low as worries about slowing demand outweighed reports that Saudi Arabia would further reduce its production of crude.
185,"December 21, 2018 04:31 pm ET",PE Under Fire at Pennsylvania’s State Pensions; Bluebird Network Exploring a Sale,A daily private-equity news digest from WSJ Pro.
186,"December 21, 2018 02:05 pm ET","Consumers on Firm Footing, Businesses Wary as 2019 Nears","The U.S. economy struck mixed chords as it rounded out the year, with consumer confidence high and households spending robustly but manufacturers pulling back as the global economy cools."
187,"December 21, 2018 12:47 pm ET",U.S. Consumer Spending Rose at Solid Rate in November,"Consumers stepped up spending again in November, a sign the main driver of the U.S. economy maintained its momentum toward the end of the year."
188,"December 21, 2018 10:57 am ET",Inflation Fell Below Fed’s Target in November ,"A key measure of inflation slowed sharply in November after a short-lived pickup in the previous month, making it likely that price gains will fall short of the Fed’s 2% target for a seventh consecutive year. "
189,"December 21, 2018 10:54 am ET","Canada Firms Widely Plan to Increase Investment, Hiring ","Canadian firms are keeping plans to increase their investment in machinery and equipment, and expand their payrolls, according to a Bank of Canada survey. "
190,"December 21, 2018 10:11 am ET",ICE Canola Weaker in Choppy Trade,
191,"December 21, 2018 09:58 am ET",Saudi Arabia: Heavy Lies the Oil Crown ,"By publishing a specific oil quota, Saudi Arabia is adding to output cuts announced at the OPEC meeting earlier this month, but it may have to absorb more pain. "
192,"December 21, 2018 09:57 am ET",Iraq Gets the Art of the Deal on Oil From Trump—Energy Journal,
193,"December 21, 2018 08:34 am ET",U.S. Durable Goods Orders Grew in November,"Demand for long-lasting goods produced by U.S. factories rose in November because of ramped up aircraft orders, but underlying data show weakening demand for other American-made goods."
194,"December 21, 2018 07:00 am ET",White Deer Energy Raises $540 Million for Oil-And-Gas Deals ,"The total collected for the Houston firm’s third pool of capital included about$100 million in commitments from the general partner, according to people familiar with the matter. It also included a co-investment vehicle, the people said."
195,"December 21, 2018 03:03 am ET",The Daily Shot: The U.S. Debt Maturity Profile Will Become Costly,
196,"December 21, 2018 12:01 am ET",What’s News: Business & Finance,What’s News: Business & Finance
197,"December 20, 2018 07:46 pm ET",China’s Hacking State,Indictments show cyber economic theft is a government operation.
198,"December 20, 2018 05:48 pm ET",Stocks Fall Sharply as Nasdaq Closes Near Bear Market,The Nasdaq Composite Index tumbled and threatened to enter a bear market as the Federal Reserve’s latest guidance on interest rates spooked investors in growth-sensitive assets such as technology shares.
199,"December 20, 2018 03:37 pm ET",Oil Drops to 17-Month Low,Oil prices hit a 17-month low as equity markets came under fresh selling pressure after the U.S. Federal Reserve raised interest rates.
200,"December 20, 2018 03:13 pm ET",Bank of Mexico Raises Interest Rates ,"Mexico’s central bank raised interest rates by a quarter percentage point, mirroring the move by the U.S. Federal Reserve earlier this week and citing persistent high inflation and uncertainty over some economic policies. "
201,"December 20, 2018 02:46 pm ET",Saudis to Cut More Oil Than Planned as OPEC Drums Up Pact,"Saudi Arabia plans to curb its oil output by more than it committed in a recent OPEC pact, according to documents seen by The Wall Street Journal that reveal the cartel’s efforts to be more transparent about its production. "
202,"December 20, 2018 02:34 pm ET","Gold Climbs as Equities, U.S. Dollar Weaken","Gold prices rose to their highest level since July on Thursday, fueled by dovish signals from the Federal Reserve and a weaker dollar. ."
203,"December 20, 2018 01:19 pm ET",M.P. Evans Group to Increase Buyback by $2.5 Million,
204,"December 20, 2018 11:09 am ET",Luxury Homeowners Discover the Delight of Sicily Living,Affluent Italians and Italy-minded foreign buyers are attracted to the Mediterranean’s largest island by the culture and relatively affordable prices. 
205,"December 20, 2018 10:10 am ET",ICE Canola Down in Morning Trade,
206,"December 20, 2018 09:40 am ET",The Morning Download: Quantum Computing Goes to Washington,Strange things happen in quantum-land. Quantum bits represent and store information in both 0s and 1s simultaneously. And Congress in late 2018 can pass a bipartisan bill
207,"December 20, 2018 08:36 am ET",Crude Prices Are Pressured After Fed Action—Energy Journal,
208,"December 20, 2018 08:00 am ET",A Forgettable Year for Energy Stocks Takes Another Pinch,"Some investors are skeptical U.S. shale producers can stem the tide, with many needing to churn out oil to remain profitable and boost supply to pay down debts."
209,"December 20, 2018 07:27 am ET",BOE Sees Intensifying Market Unease Over Brexit ,​The central bank’s policy makers voted unanimously to hold rates steady on Thursday. 
210,"December 20, 2018 06:49 am ET","Oil Demand Flashes Red, Sending Crude Prices Even Lower","It isn’t just that there is too much oil sloshing around the world. All of a sudden, there are also fears of too little demand."
211,"December 20, 2018 06:45 am ET",Real Time Economics: The Fed Speaks and Markets Recoil,
212,"December 20, 2018 04:17 am ET",The Daily Shot: The Markets’ and the Fed’s Diverging Views on Financial Conditions,
213,"December 19, 2018 04:53 pm ET",Stocks Slide After Fed Lifts Rates,"The Dow Jones Industrial Average swung nearly 900 points Wednesday, slumping after the Federal Reserve raised interest rates for the fourth time in 2018 and signaled a milder path of increases over the next year."
214,"December 19, 2018 03:16 pm ET","Oil Prices Rise on U.S. Inventory Decline, Saudi Pledge","Oil prices surged, recouping nearly half of their huge losses from a day earlier as U.S. oil inventories declined for a third week."
215,"December 19, 2018 12:23 pm ET",Nigeria's President Proposes 2019 Budget of NGN8.83 Trillion,
216,"December 19, 2018 10:32 am ET",Edward Lampert Won’t Serve as Stalking Horse for Sears,"Sears Holdings Corp. will hit the auction block without selecting a lead bidder for its stores amid criticism from creditors unhappy with a bid by the retailer’s chairman, Edward Lampert. "
217,"December 19, 2018 10:04 am ET",ICE Canola Choppy in Morning Trade,
218,"December 19, 2018 09:49 am ET",Canada Inflation Decelerates on Slump in Gasoline Prices ,Canada’s annual inflation rate decelerated sharply in November on lower gasoline prices. The pullback on price increases likely gives the Bank of Canada further reason to hold off on further rate rises in the immediate future. 
219,"December 19, 2018 08:36 am ET",Crude Stabilizes After Steep Drop—Energy Journal,
220,"December 19, 2018 07:39 am ET",Fed Rate Rise Expected | Thailand Raises Rates | Smaller Fed Moves Now Have Bigger Market Impacts | Economist Warns Fed May Have Surpassed Neutral Rate,"The Wall Street Journal’s central banking newsletter for Wednesday, December 19, 2018."
221,"December 19, 2018 07:16 am ET",Real Time Economics: The Fed’s Jerome Powell Is Ready to Answer Your Questions,
222,"December 19, 2018 05:10 am ET",Australian Banks Head for Worst Year Since Financial Crisis,"Investors are also fretting about the country’s economy, which has gone more than a quarter-century without a recession. "
223,"December 19, 2018 03:50 am ET",The Daily Shot: Oil Companies Expected to Slash Investment as Prices Tumble,
224,"December 19, 2018 03:36 am ET",Gulf Marine Services Shares Crash as It Warns It Will Breach Loans,
225,"December 19, 2018 12:01 am ET",What’s News: Business & Finance,What’s News: Business & Finance
226,"December 18, 2018 07:21 pm ET","The Trump Tax Cuts Boosted Growth and Jobs, but at What Cost?","The deficit has ballooned, and most of the benefits went to corporate profits rather than employees."
227,"December 18, 2018 05:52 pm ET",Conagra Finds New Buyer for Wesson,"Canadian agribusiness firm Richardson International has agreed to buy the cooking-oil brand, as Conagra refocuses its business on frozen meals and foods."
228,"December 18, 2018 05:29 pm ET",U.S. Oil Prices Down Almost 40% From High,"Oil prices fell to their lowest levels in over a year Tuesday, continuing a precipitous decline spurred by economic uncertainty and growing global supplies."
229,"December 18, 2018 04:12 pm ET","ICE Canola Closes Higher, Underpinned by Weak Canadian Dollar",
230,"December 18, 2018 04:12 pm ET",U.S. Stocks Close Higher as Oil Prices Slide,Shares fluctuated as a slide in oil prices stymied an attempted rebound by major indexes. 
231,"December 18, 2018 02:57 pm ET",Canada Reveals Financial Package for Energy Sector ,Canada unveiled Tuesday a package for the country’s struggling energy sector in a bid to minimize the economic and political fallout from depressed prices for oil. 
232,"December 18, 2018 02:17 pm ET",Saudi Arabia Plans More Spending Next Year to Boost Growth,The kingdom seeks to rally domestic support amid international criticism for the killing of dissident journalist Jamal Khashoggi. 
233,"December 18, 2018 02:11 pm ET",Copper Slips Further on Concerns About Demand,Copper prices fell for the fourth consecutive session as fresh worries about the global economy hit commodities across the board.
234,"December 18, 2018 12:35 pm ET",Investors Find Few Places to Hide in Rocky Year,"After a dramatic year, all three major U.S. stock indexes are on track to end 2018 lower for the first time since 2008."
235,"December 18, 2018 12:06 pm ET",ICE Canola Corrects Higher as Canadian Dollar Weakens,
236,"December 18, 2018 10:33 am ET",Investors Push Venezuela for Payment on $1.5 Billion Defaulted Bond,A group of investors is demanding the Venezuelan government pay off both the interest and principal of a defaulted $1.5 billion bond that won’t mature until 2034. 
237,"December 18, 2018 10:11 am ET",ICE Canola up With Soy,
238,"December 18, 2018 09:50 am ET",The Next Great Island Escape? This Little-Known African Country,The under-the-radar island nation of São Tomé and Príncipe offers an enthralling mix of history and luxury beach resorts.
239,"December 18, 2018 09:44 am ET",DNO Raises Stake in Faroe Petroleum Amid Takeover Battle,
240,"December 18, 2018 08:26 am ET",Energy Journal: North Korea Defies Sanctions and Turns Coal Into Energy,
241,"December 18, 2018 08:00 am ET","Soybeans Gain in Quiet, Inside Day -- Technical Analysis",
242,"December 18, 2018 06:55 am ET",When to Pounce on a Brexit Buying Opportunity    ,"Britain has become the outcast of global markets, untouchable for many as the country’s politics descends into chaos. This ought to create opportunities for those able to stomach the wild price swings as U.K. politicians abuse each other.  "
243,"December 18, 2018 06:43 am ET",Real Time Economics: The Fed Is Trying to Tell Us Something,
244,"December 18, 2018 03:52 am ET",The Daily Shot: U.S. Stocks Playing Catch-Up with the Rest of the World,
245,"December 18, 2018 12:01 am ET",Stocks Fall Sharply as Investors Fret Over Growth Outlook,U.S. stocks slumped with the Dow industrials falling more than 500 points as investors looked ahead to this week’s Federal Reserve meeting amid mounting signs of slowing economic growth around the world.
246,"December 17, 2018 07:15 pm ET",Time for a Fed Pause,Inflation and other economic signals justify interest-rate caution.
247,"December 17, 2018 03:35 pm ET",Oversupply Fears Drag U.S. Crude Under $50,"Oil settled below $50 a barrel on Monday for the first time in 14 months, signaling global growth fears are overshadowing major producers’ efforts to pare supply."
248,"December 17, 2018 03:09 pm ET",North Korea Turns Coal Into Gas to Weather Sanctions,"North Korea has accelerated a little-known program to use its abundant coal supply to produce synthetic gas, helping the isolated nation reduce its dependence on foreign oil and withstand sanctions aimed at curbing its nuclear program."
249,"December 17, 2018 03:02 pm ET",S&P Weakest Links Rise as Oil and Gas Companies Come Under Pressure,A global tally of vulnerable companies rose in November as volatile oil prices pressured the oil and gas sector. 
