,date,title,summary
216,"August 21, 2017 04:59 pm ET",U.S. Stocks Edge Higher After Selloff,"U.S. stocks inched higher, but declines in shares of energy companies capped the gains."
217,"August 21, 2017 04:14 pm ET",Crude Prices Lower as Summer Driving Season Nears End,"Oil prices fell Monday, pulled lower by falling prices for gasoline and diesel as the end of summer driving season approaches. "
218,"August 21, 2017 01:27 pm ET",Eclipse Watchers Are Driving Up Gas Prices,"As people flock to places where they can catch the solar eclipse, they’re giving the gasoline market a late summer boost."
219,"August 21, 2017 11:41 am ET",Bannon Bows Out,A transcript of the weekend’s program on FOX News channel.
220,"August 21, 2017 10:43 am ET",Total Buys Maersk Oil for $5 Billion,"French oil giant Total has agreed to acquire Danish conglomerate A.P. Moeller-Maersk’s oil unit for $4.95 billion, signaling a renewed appetite for deals in the global oil-and-gas industry."
221,"August 21, 2017 08:38 am ET",Should the U.S. Overhaul Audit Reports? | Trump and the CEOs | Suing Over Stock Drops Is on the Rise | Rubin’s Take: 1987 Crash Still Casts a Shadow,"The Wall Street Journal’s financial regulation newsletter for Monday, August 21, 2017."
222,"August 21, 2017 07:06 am ET",The Morning Ledger: New Audit Rule Could Bring Sunshine To U.S. Markets,Audit rule could reveal critical matters to investors; Sempra outbids Buffet for Oncor; SEC drops last 'London Whale' case.
223,"August 21, 2017 07:06 am ET",France’s Total Reaches Deal to Acquire Maersk Oil Unit—Energy Journal,French oil group Total SA has struck a $4.95 billion deal to acquire Danish conglomerate A.P. Moeller-Maersk A/S’s oil unit.
224,"August 21, 2017 06:40 am ET",Today’s Top Supply Chain and Logistics News From WSJ,"Delivering up-to-the minute news, analysis, interviews and explanatory journalism on logistics, supply-chain management, e-commerce and more"
225,"August 21, 2017 06:29 am ET",Should the U.S. Overhaul Audit Reports? | Trump and the CEOs | Suing Over Stock Drops Is on the Rise | Rubin’s Take: 1987 Crash Still Casts a Shadow,"The Wall Street Journal’s financial regulation newsletter for Monday, August 21, 2017."
226,"August 21, 2017 03:45 am ET","WSJ City: Draghi Likely to Lay Out an End to QE, Early Fissures in NAFTA Talks",
227,"August 21, 2017 01:27 am ET",WSJ’s Daily Shot: What Will U.S. Companies Do With the Repatriated Cash?,
228,"August 20, 2017 09:14 pm ET",Oil Futures Lack Direction in Asia Trade,"Oil futures are lacking direction in Asian trade at the start of the week, after Friday’s jump in prices. "
229,"August 20, 2017 03:52 pm ET",Playing Chicken With China,"Trump’s North Korea brinkmanship might seem scary, but it’s not that unusual."
230,"August 20, 2017 06:00 am ET",Old Oil Is New Again ,"As the costs of shale fracking rise, a growing number of small- and mid-sized oil firms from California to Oklahoma are forgoing expensive projects and opting for old-school wells instead. "
231,"August 19, 2017 10:51 am ET","This Week on the Frontiers, August 19th 2017",
232,"August 19, 2017 07:00 am ET","U.S. Exports Gas to Europe, and Russia Aims to Counter","As the first shipment of American liquefied natural gas heads to Lithuania, Russian companies are lowering prices, changing sales methods and developing their own LNG facilities. "
233,"August 18, 2017 08:45 pm ET",Blue Chips Fall for Second Week in a Row,"The Dow Jones Industrial Average ended the week lower, capping a rocky stretch that included political turmoil, terror attacks and disappointing earnings."
234,"August 18, 2017 06:04 pm ET","Weekly Bond Price Indications - Week Ended Aug. 17, 2017","The following chart has prices for junk-rated bonds, including weekly price changes and when those bonds mature."
235,"August 18, 2017 04:17 pm ET","Oil Rises on Refinery Outage, Weaker Dollar and Rig Drop",Oil prices vaulted higher after reports of a refinery outage kicked off a rally that continued throughout the afternoon as the dollar weakened and data showed a decline in the number of rigs drilling for oil in the U.S.
236,"August 18, 2017 03:49 pm ET",U.S. Oil-Rig Count Falls by Five in Latest Week,"The number of rigs drilling for oil in the U.S. fell by five in the past week to 763, according to oil-field services company Baker Hughes Inc., a unit of General Electric Co."
237,"August 18, 2017 07:30 am ET",Tripling Down on Emerging Markets With a New Leveraged ETF,"Direxion, the firm behind popular funds that bet on gold mining companies, oil prices and Chinese stocks, launches an ETF that aims to triple the returns of emerging-market bonds. "
238,"August 18, 2017 07:04 am ET","Relief on Corinthian Student Loans | Dimon’s Trump Stance Prompts Discussion | Pension Funds Sue Banks | Deng’s Take: How Stable Are China’s Markets, Really?","The Wall Street Journal’s financial regulation newsletter for Friday, August 18, 2017."
239,"August 18, 2017 07:00 am ET","Loading Up on Venezuela, Veteran Investor Embraces Crisis","One emerging-market investor, Michael Conelius, is bucking the trend and has accumulated so much debt issued by Venezuela’s government and state-owned oil company that he has become one of the country’s largest foreign creditors."
240,"August 18, 2017 06:55 am ET",Oil Players Consider Big Spending and Doubling Down — Energy Journal,"The U.S. is emerging as a price-setter for natural gas sales from Mozambique to Japan,  as volumes extracted by shale drillers go global, write Alison Sider and Christopher Matthews."
241,"August 18, 2017 06:41 am ET","Relief on Corinthian Student Loans | Dimon’s Trump Stance Prompts Discussion | Pension Funds Sue Banks | Deng’s Take: How Stable Are China’s Markets, Really?","The Wall Street Journal’s financial regulation newsletter for Friday, August 18, 2017."
242,"August 18, 2017 06:30 am ET",Today’s Top Supply Chain and Logistics News From WSJ,"Delivering up-to-the minute news, analysis, interviews and explanatory journalism on logistics, supply-chain management, e-commerce and more"
243,"August 18, 2017 05:30 am ET",How Goldman Lost $100 Million on a Gas Bet Gone Wrong,"Goldman lost more than $100 million in a wrong-way bet on regional natural-gas prices this spring, a setback that played a large role in the New York bank’s subpar second-quarter trading performance."
244,"August 18, 2017 02:00 am ET",WSJ’s Daily Shot: U.S. Auto Production Declines the Most Since 2009,
245,"August 17, 2017 10:26 pm ET",Oil Down Slightly in Asia Following Overnight Gains ,Oil futures are down a tad in Asian trade Friday after prices snap a three-day losing streak overnight. 
246,"August 17, 2017 06:29 pm ET",Ferrari 812 Superfast: The Italian Icon Lives On,"Outfitted with the most powerful engine in the company’s history, the Ferrari 812 Superfast revs like a street bike on nitrous and is capable of face-warping cornering."
247,"August 17, 2017 06:27 pm ET",Market Talk: Daily Analysis Roundup,"Read our compilation of concise, timely analysis by Wall Street Journal reporters. Aides Say Cohn Not Resigning; Kocherlakota To Yellen: Turn Down Any Job Trump Offers; New Triple-Leveraged ETF Launched For Emerging Market Bonds; Non-Chinese London Office Buyers May Pay Less; Oil-dependent African Countries Boost Standard Bank"
248,"August 17, 2017 05:30 pm ET",Henry Hub Emerges as Global Natural Gas Benchmark,"The Henry Hub in Louisiana has for years been a benchmark for U.S. contracts. Now it is helping to set prices from Mozambique to Japan, as a wave of U.S. natural gas being unlocked by shale drillers reaches Europe, South America and Asia. "
249,"August 17, 2017 04:27 pm ET",Oil Prices Settle Higher,Oil prices settled higher Thursday after being lower earlier in the session on fresh U.S. data showing a further ramp-up in shale production.
250,"August 17, 2017 11:20 am ET",Seadrill Warns Creditors of Big Losses,"Seadrill Ltd., one of the world’s biggest offshore drilling companies, warned creditors of major losses as part of its $10 billion debt-restructuring plan."
251,"August 17, 2017 11:06 am ET","Akzo Nobel, Elliott Make Peace After  Protracted Spat",Akzo Nobel reached a truce with Elliott Management giving the activist investor board representation following a monthslong standoff over Elliott’s push to force the Dutch chemicals company into talks over a $28 billion takeover bid.
252,"August 17, 2017 10:42 am ET","OPEC’s Sick Man, Venezuela Could Jolt Oil Market","Venezuela’s already falling oil production will get worse before it gets better, potentially roiling global energy markets."
253,"August 17, 2017 09:59 am ET",A Luxury Real-Estate Proposition,"Two native Texans with a love of all things French have listed their château in Normandy, a Paris apartment and a duplex in Chicago. They’ll sell only one of them to the first person with the best offer."
254,"August 17, 2017 09:59 am ET",Elliott Management Wants Energen to Explore Sale Options ,"Elliott Management has built a big position in Energen Corp., a natural-gas company already under pressure from another activist to sell itself. The hedge fund owns a stake between 4% and 5% and is joining with Corvex Management LP to urge a sale. "
255,"August 17, 2017 09:33 am ET",Canada Factory Sales Post Decline in June ,"Canadian factory sales fell in June, ending three-straight months of gains, mainly due to lower activity in oil, coal and transportation equipment industries. "
256,"August 17, 2017 07:35 am ET",Ex-Bank IT Worker in Insider-Trading Probe | China Targets Pyramid Schemes | States Step In on Retirement Savings | Witkowski’s Take: Fed Still Expects a Lot of Bank Boards,"The Wall Street Journal’s financial regulation newsletter for Thursday, August 17, 2017."
257,"August 17, 2017 07:25 am ET",Fed Officials Split Over Timing | Mester Favors More Rate Increases | Fed Expects a Lot of Bank Boards |   Davidson’s Take: Fed Sees Prospects For Near-Term Stimulus Dimming,"The Wall Street Journal’s central banking newsletter for Thursday, August 17, 2017"
258,"August 17, 2017 06:58 am ET",The Morning Ledger: Nafta Talks Start With Discord,The U.S. disagrees with Mexico and Canada on how to renegotiate Nafta. Apple joins a chorus of firms criticizing President Trump and a Danish bank no longer wants corporate cash.
259,"August 17, 2017 06:49 am ET","Suffering, Bribery and Blocks — Energy Journal",Oil prices are under pressure after weekly data from the EIA revealed U.S. production volumes are once again nearing their 2015 peak of around 9.6 million barrels a day.
260,"August 17, 2017 06:32 am ET",Ex-Bank IT Worker in Insider-Trading Probe | China Targets Pyramid Schemes | States Step In on Retirement Savings | Witkowski’s Take: Fed Still Expects a Lot of Bank Boards,"The Wall Street Journal’s financial regulation newsletter for Thursday, August 17, 2017."
261,"August 17, 2017 01:15 am ET",WSJ’s Daily Shot: Are US Homes Overvalued?,
262,"August 16, 2017 06:58 pm ET",More Sunny Days Are Likely Ahead for the U.S. Economy,"Economic expansions tend to go on until something kills them. Today, not many dangers lurk."
263,"August 16, 2017 03:36 pm ET",Oil Falls as Production Increase Outweighs Stockpile Decline,Oil prices fell to a three week low Wednesday as data showing an increase in U.S. oil production outweighed the largest weekly decline in oil stockpiles this year.
264,"August 16, 2017 03:13 pm ET",Toisa Readies for Vote on Chapter 11 Restructuring Plan    ,Shipping-fleet operator Toisa Ltd. has asked a judge to approve voting on a chapter 11 debt-restructuring plan that purports to repay all of its creditors in full.  
265,"August 16, 2017 03:12 pm ET",Quick Hits: Euro Down as Draghi May Not Reveal Much at Jackson Hole,"The euro weakened after Reuters reported that ECB President Mario Draghi isn’t likely to delivery a fresh policy message at next week’s Jackson Hole gathering, and minutes show that a Reserve Bank of India policy maker warned that August’s rate cut could amplify financial imbalances."
266,"August 16, 2017 02:52 pm ET","Brexit & Beyond: U.K.’s Post-Brexit Ireland Plan, Frankfurters Frosty to Brexit Bankers, Eurozone Growth Spreads",
267,"August 16, 2017 10:18 am ET","Maersk Posts Surprise Loss, Warns of Cyberattack Impact","Danish shipping giant A.P. Moller-Maersk said it swung to a surprise second-quarter loss, as it wrote down the value of its tanker and ports assets, and warned of the impact of a major cyberattack in June."
268,"August 16, 2017 08:38 am ET",Don’t Get Too Excited About Corporate Earnings,"Corporate earnings are looking peachy right now, but analysts and investors are warning not to get too excited about what lies ahead."
269,"August 16, 2017 07:44 am ET",Russian Ex-Minister Accuses Rosneft Oil Chief of Entrapment ,"A former Russian economy minister on trial for allegedly taking a $2 million bribe accused the head of the state oil company of entrapment, in the first hearing of a case that has raised speculation about power plays at the highest levels of the government. "
270,"August 16, 2017 07:34 am ET",Chamber Asks SEC to Reject Audit Rule | Massachusetts Probes ‘Maker-Taker’ | New Chairman for Wells Fargo | Michaels’s Take: Pay-Ratio Rule Is Here to Stay,"The Wall Street Journal’s financial regulation newsletter for Wednesday, Aug. 16, 2017."
271,"August 16, 2017 07:18 am ET",The Morning Ledger: Chief Executives Rethink Ties to White House,U.S. CEOs reconsider their alliances with the White House. Amazon loads up on debt and Tata Motors appoints a new finance chief.
272,"August 16, 2017 07:17 am ET",Blackstone Bets Its Cash on Natural Gas—Energy Journal,Blackstone Bets On the Rise of Natural Gas Production
273,"August 16, 2017 05:09 am ET",US Shale Oil Boom Hits Bump,"The U.S. shale oil boom has hit a bump, says Stephen Brennock at brokerage PVM. "
274,"August 16, 2017 01:38 am ET",WSJ’s Daily Shot: Are Quality Jobs Easy to Get? The Answer Depends on Your Political Affiliation.,
275,"August 16, 2017 12:01 am ET",Distressed-Debt Fund Returns Turn Anemic ,"Returns on U.S. distressed-debt funds have turned anemic after a stellar 2016 as fund managers found fewer troubled companies to invest in this year. One fund that is ahead of the pack, however, is VR Capital, a fund with a history of investing in emerging-markets debt."
276,"August 15, 2017 04:52 pm ET",Oil Falls on Demand Concerns    ,"Oil prices edged lower on Tuesday, weighed down by concerns over demand and a strengthening U.S. dollar."
277,"August 15, 2017 04:40 pm ET",Why Blackstone Is Betting $7 Billion on Natural Gas,"Private-equity firm Blackstone is making one of its biggest bets on the growth of natural gas production, wagering that even if gas prices remain stuck at depressed levels, it can profit."
278,"August 15, 2017 09:25 am ET",Oil Prices Lack Direction After Overnight Slide,"Oil prices were mainly flat in London trading, one day after hitting a three-week low on data showing increased U.S. shale production and a decline in Chinese refinery demand."
279,"August 15, 2017 07:20 am ET",Dudley Expects Another Rate Rise This Year - AP | Germany Refers QE Challenge to European Court | U.K. Consumer Inflation Flat in July | Harrison’s Take: Fed Promotes Wordiness Inflation,"The Wall Street Journal’s central banking newsletter for Tuesday, August 15, 2017"
280,"August 15, 2017 07:04 am ET",Oil Down On Concerns of U.S. Shale Ramp Up—Energy Journal,Oil Down On Concerns of Ramp in U.S. Shale
281,"August 15, 2017 05:06 am ET",U.K. Consumer Inflation Flat in July,"Britain’s consumer price inflation remained unchanged and growth in producers’ raw materials costs slowed sharply in July, adding to signs that a squeeze on U.K. households evident since last year’s Brexit vote might soon begin to ease. "
282,"August 15, 2017 01:09 am ET",WSJ’s Daily Shot: Are Investors Giving up on Tax Reform?,
283,"August 14, 2017 08:42 pm ET",U.S. Stocks Rise After Volatile Week,"U.S. stocks jumped Monday, with the S&P 500 posting its biggest one-day gain since April."
284,"August 14, 2017 05:39 pm ET",Oil Prices Drop to Three-Week Low,"Oil prices fell to a three-week low on Monday, hurt by a stronger U.S. dollar and troubling signs of lower demand."
285,"August 14, 2017 05:16 pm ET",Shadow Fed is Glum on Stock Market    ,"Camp Kotok’s fearless forecasters mainly see little change in economic and financial measures such as interest rates, GDP, bond yields and oil prices, but they are somewhat bearish on stocks.  "
286,"August 14, 2017 07:39 am ET","Pullback on Wall Street Rules | Investors Take On Mortgage Risk From Taxpayers | Fiduciary Rule Casualty | Ackerman’s Take: Dilemma Over Fannie, Freddie Finances","The Wall Street Journal’s financial regulation newsletter for Monday, August 14, 2017."
287,"August 14, 2017 07:36 am ET",Oil Weighed Down By Declining Crude Appetite—Energy Journal,Oil Weighed Down By Declining Crude Appetite
288,"August 14, 2017 07:30 am ET",Cumming’s Take: Is Private Equity’s Energy Bet Finally Paying Off?,"The oil-price downturn hasn’t played out quite like firms had hoped, but signs are improving."
289,"August 14, 2017 07:30 am ET",Cumming’s Take: Is Private Equity’s Energy Bet Finally Paying Off?,"The oil-price downturn hasn’t played out quite like firms had hoped, but signs are improving."
290,"August 14, 2017 06:39 am ET",Today’s Top Supply Chain and Logistics News From WSJ,"Delivering up-to-the minute news, analysis, interviews and explanatory journalism on logistics, supply-chain management, e-commerce and more"
291,"August 14, 2017 05:00 am ET",Eurozone Factory Output Slides ,"Activity at the eurozone’s factories, mines and utilities fell at its sharpest pace in 2017 during June, an indication that the economy may be settling down after an acceleration in growth during the first six months of the year."
292,"August 14, 2017 12:57 am ET",WSJ’s Daily Shot: New Car Prices Decline Most Since the Great Recession,
293,"August 12, 2017 09:57 am ET","This Week on the Frontiers, August 12th 2017",
294,"August 11, 2017 07:42 pm ET",U.S. Stocks Post Weekly Decline,"U.S. stocks rose Friday but notched their biggest weekly loss in months, shaken by disappointing earnings results and an escalation of threats between the U.S. and North Korea."
295,"August 11, 2017 04:50 pm ET","Weakest Links Drop in July, With Six Banks Leaving the List","A global tally of vulnerable companies fell about 6% in July, as distress in the consumer-product and energy sectors levels off."
296,"August 11, 2017 04:23 pm ET",Oil Gains After IEA Revises Data  ,"Crude futures turned from losses to gains, recovering from a selloff after the International Energy Agency revised its historical demand figures lower, indicating oil supplies might not be as tight as previously thought."
297,"August 11, 2017 04:20 pm ET",Bankrupt Montco Offshore Pursues a Second Survival Strategy: A Sale,"Struggling in the energy downturn, Montco Offshore Inc. is looking for buyers who are ready to offer a better deal than its current survival strategy of pairing up with a competitor."
298,"August 11, 2017 02:28 pm ET",U.S. Oil Rig Count Rises by Three,
299,"August 11, 2017 12:18 pm ET",WSJ City PM: How Do You Price a Problem Like Korea? EU Confronts Limits to Its Power,
300,"August 11, 2017 10:00 am ET",Rick George Built Suncor Into Canada’s Biggest Oil Company by Injecting Hope,"With Rick George at the helm, Suncor’s value soared to around $50 billion when he retired in 2012 from less than $1 billion two decades before. The company also became Canada’s largest oil producer, partly by taking over Petro-Canada. Mr. George died Aug. 1 at age 67."
301,"August 11, 2017 08:16 am ET","Garcia’s Take: For Some Energy-Focused Firms, Being Small Is a Big Thing",A new crop of private-equity shops is expanding its presence in the U.S. oil-and-gas sector by targeting small and midmarket deals. But will they eventually face the same challenges of overcrowding and higher prices as their upmarket brethren? 
302,"August 11, 2017 07:23 am ET","Garcia’s Take: For Some Energy-Focused Firms, Being Small Is a Big Thing",A new crop of private-equity shops is expanding its presence in the U.S. oil-and-gas sector by targeting small and midmarket deals. But will they eventually face the same challenges of overcrowding and higher prices as their upmarket brethren? 
303,"August 11, 2017 07:05 am ET",Major Oil Producers Increase Output Despite Deal To Curb Flows—Energy Journal,Major Oil Producers Have Ramped Up Their Output Despite a Deal to Curb Global Production
304,"August 11, 2017 06:34 am ET",Today’s Top Supply Chain and Logistics News From WSJ,"Delivering up-to-the minute news, analysis, interviews and explanatory journalism on logistics, supply-chain management, e-commerce and more"
305,"August 11, 2017 06:15 am ET",Global Oil Supply Grows on Higher OPEC Output Despite Deal ,"The global oil supply rose for a third consecutive month in July, even as the market continues to rebalance, the International Energy Agency said."
306,"August 11, 2017 01:21 am ET",WSJ’s Daily Shot: Speculators Betting Against VIX Get Caught in a Short Squeeze,
307,"August 11, 2017 12:24 am ET",Oil Prices Slip Back as Geopolitics Add to Pressure,Crude futures turned lower in midmorning Asian trading after rebounding a bit earlier following declines in the U.S. 
308,"August 11, 2017 12:01 am ET",What’s News: Business & Finance,What’s News: Business & Finance
309,"August 10, 2017 06:35 pm ET",British Columbia Vows to Block Pipeline Expansion,"The government of British Columbia, Canada’s westernmost province, vowed to use every legal option to stop construction of Kinder Morgan Inc.’s planned expansion of a pipeline connecting the Alberta oil sands with the Pacific Coast."
310,"August 10, 2017 06:18 pm ET",Reagan’s Economic Policies Then vs. Today,Cutting taxes in the manner suggested by Messrs. Gramm and Solon is highly unlikely to bring back 1980s growth rates.
311,"August 10, 2017 04:22 pm ET",Oil Pulls Back After Topping $50 a Barrel,"Oil futures fell Thursday, pulling back after topping $50 a barrel as investors weighed evidence that the world stock overhang is finally falling against rising OPEC production."
312,"August 10, 2017 03:46 pm ET","Brexit & Beyond: Italy’s Sharp Drop in Seaborne Migrants, Why EU Banks Banks Are Buying U.K. Bonds, U.K. House Sales Stall",
313,"August 10, 2017 01:10 pm ET",Spa Vacations for Men: The New Executive Perk,"Once spa getaways were ladies-only. Now, U.S. wellness retreats are wooing male execs with beer body scrubs and recreational tree climbing. And some CEOs are paying their employees to go."
314,"August 10, 2017 12:33 pm ET",What Global Markets Are Waiting for: A Sign on Inflation    ,"After an oil-inspired surge in headline inflation in the first half of 2017, the data in the second half will be vital for investors seeking insight into whether central bank words will become actions.  "
315,"August 10, 2017 12:24 pm ET","WSJ City: Lessons From the 2007 Financial Crisis, Opec Output Rises, Lego Replaces British CEO",
316,"August 10, 2017 11:24 am ET",Hamptons Décor That’s Urbane But Not Uppity ,"In a shoreside retreat, strategic design brings beachy elegance to a dining room without going overboard."
317,"August 10, 2017 11:03 am ET",Glencore Bets Heavy on an Electric Car Future ,Glencore is betting that being in the “right” commodities for a battery and electric car dominated future is more important than big cash payouts now. 
318,"August 10, 2017 10:24 am ET",Inside Maine’s Exclusive Prouts Neck Community,Many of the 200 or so homes on this the rocky peninsula have been in the same families for generations.
319,"August 10, 2017 08:18 am ET",How the U.S. Might Detect and Deter an Attack on Guam,News and analysis from the WSJ's Washington bureau.
320,"August 10, 2017 07:41 am ET",Labor Seeks Fiduciary-Rule Delay | SEC Punts on Chicago Exchange Deal | Canadian Private-Equity Firm Accused of Fraud | Rubin’s Take: The Long Road Away From Libor,"The Wall Street Journal’s financial regulation newsletter for Thursday, Aug. 10, 2017."
321,"August 10, 2017 07:26 am ET",OPEC Says Crude Output Rose in July ,"OPEC’s crude-oil production rose further in July, in the latest sign the cartel’s efforts to reduce output and drain a global supply glut are falling short. "
322,"August 10, 2017 06:20 am ET",Investors Worry Permian Oil Output Is Waning—Energy Journal,Investors Worry That Permian Oil Output Is Waning
323,"August 10, 2017 05:30 am ET",Why Goldman Sachs Seized a Client’s 217-Foot Yacht ,"The story behind Goldman’s nautical trophy catalogs the inevitable outcome of Wall Street’s latest gold rush: lending to wealthy clients, the loans backed by everything from Warhols to fine wine. "
324,"August 10, 2017 01:36 am ET","WSJ’s Daily Shot: For the First Time in Decades, Doctors Are Not Raising Their Fees",
