,date,title,summary
333,"May 13, 2018 01:46 pm ET",The Argentine Peso’s Death Spiral,"To solve the problem, President Macri needs to get aggressive in challenging Peronism."
334,"May 13, 2018 10:00 am ET",Venezuela’s Oil Meltdown Is Getting Worse ,"Death spiral is an overused term, but it is justified when describing Venezuela’s oil industry right now. Energy consumers and investors should pay attention."
335,"May 13, 2018 08:19 am ET",Abu Dhabi Jumps Into Middle East Oil-Refining Rush ,"Abu Dhabi’s national oil company said it would spend $45 billion over the next five years to join other giant, state-run petroleum giants, like Saudi Aramco, in refining much of their own crude instead of just exporting it. "
336,"May 12, 2018 10:22 am ET","This Week on the Frontiers, May 12th 2018",A weekly roundup of key news affecting frontier markets from the Wall Street Journal and beyond.
337,"May 12, 2018 12:01 am ET","In New York, Rockwell’s Vision of FDR’s ‘Freedoms’",Four beloved paintings that raised millions in war bonds headline a major exhibition; ‘Rosie the Riveter’ at work.
338,"May 11, 2018 10:22 pm ET",John McCain: ‘Vladimir Putin Is an Evil Man’,"In an excerpt from his new memoir, Sen. McCain discusses his longstanding opposition to the Russian strongman—and his own role in receiving ‘the Steele dossier’ about Donald Trump."
339,"May 11, 2018 07:02 pm ET","Rising Dollar Pummels Emerging-Market Bonds, Cooling Off a Hot Sector ","The dollar’s rise is squeezing bond markets in developing countries like Argentina, Indonesia and Turkey, gutting what had been a popular trade for investors seeking higher-yielding returns."
340,"May 11, 2018 06:32 pm ET",From Russia With No Love Lost,Anti-Putin crusader Bill Browder on his disillusionment with Moscow’s leader and his tangles with the man behind the Trump dossier.
341,"May 11, 2018 05:16 pm ET",U.S. Stocks Post Biggest One-Week Gain Since March,"Bets on inflation remaining muted helped push investors back into the market, lifting the S&P 500 and Dow Jones Industrial Average to their biggest one-week gain since March."
342,"May 11, 2018 04:38 pm ET",The Endless Clinton Campaign,The former secretary of State offers more criticism of U.S. leadership from overseas.
343,"May 11, 2018 04:06 pm ET",Oil Holds On to Gains After Trump’s Iran Decision    ,"Oil prices fell Friday, stalling after surging to more-than-three-year highs after President Donald Trump’s decision to pull the U.S. out of the Iran nuclear deal."
344,"May 11, 2018 03:34 pm ET",Quick Hits: Fed Promises Vote on Lifting Wells Fargo Asset Cap,"Federal Reserve Chairman Jerome Powell said the central bank’s board would vote on whether to remove restrictions on Wells Fargo’s growth, and Bank of Japan Gov. Haruhiko Kuroda said the government has work to do to boost growth. "
345,"May 11, 2018 02:26 pm ET",Weakest Links Tally Falls to 30-Month Low,Global count of vulnerable companies declines to 184 in April
346,"May 11, 2018 12:57 pm ET","WSJ City PM: How Iranian Oil Squeeze Could Upset OPEC Deal, Barclays CEO Fined, Silverlake’s £2.2 Billion Property Play",
347,"May 11, 2018 11:45 am ET",Bet on African Petrol Stations Pays Off for Helios,Helios has locked in a three-times return from Vivo Energy and still holds a big stake.
348,"May 11, 2018 11:24 am ET","Dollar Gauge Threatens 3-session Skid, First Weekly Drop Since Mid-April","A popular gauge of the U.S. dollar’s strength edged lower early Friday, putting it on track to mark a third straight loss after a brisk run-up and its first weekly decline after three consecutive weekly gains."
349,"May 11, 2018 08:18 am ET",Trump to Unveil Plan to Curb Drug Prices,News and analysis from WSJ's Washington bureau
350,"May 11, 2018 07:40 am ET",Energy Journal: Iran Deal Collapse Is Messing Up the Oil Order,Producers May Exit the OPEC Supply Cut Deal
351,"May 11, 2018 07:22 am ET",The Morning Ledger: Europe Readies For Battle Over Data Privacy,Finance chiefs considering marketing budgets or decisions around user data should keep a close eye on Europe. Goldman and Apple plan to launch a credit card and the largest U.S. IPO of the year flops.
352,"May 11, 2018 07:14 am ET",Real Time Economics: Nafta’s Deadline | The Next Recession | American Goods Held Up at Chinese Ports,"Today in Real Time Economics, we look at Nafta's looming deadlines, economic forecasts for the next recession, more tit-for-tat in the U.S.-China trade fight, U.S. efforts to cut Iran off from the global economy, the crab economy, and the insidious effect of inflation on American wages."
353,"May 11, 2018 05:30 am ET",Squeeze on Iranian Oil Could Upset OPEC Pact,"A resumption of U.S. sanctions on Iran could take Iranian oil off the market and pressure the delicate agreement between Saudi Arabia, Russia and other major producers underlying the OPEC pact on production limits."
354,"May 11, 2018 05:30 am ET",Quotas Make a Comeback as Countries Seek U.S. Tariff Exemptions,Some countries are accepting quotas on their exports to the U.S. as they strike deals with the Trump administration to avoid tariffs. 
355,"May 11, 2018 03:46 am ET","WSJ City: US Moves to Cut Iran from World Economy, Buybacks Support Jittery Stock Market",
356,"May 11, 2018 03:00 am ET",The Daily Shot: New Cars Driven Deeper Into Deflation,
357,"May 10, 2018 09:03 pm ET",Oil Futures Ease From Fresh 3-1/2-Year Highs,Oil futures was slightly lower in midday Asian trading after hitting fresh 3 1/2-year highs Thursday amid continued worries about the Middle East.
358,"May 10, 2018 06:22 pm ET",Heart of America’s Oil Boom Can’t Fetch Good Prices for Its Crude,"The main U.S. oil benchmark, West Texas Intermediate, has soared to its highest level in years at $71 a barrel. But good luck getting that price in West Texas."
359,"May 10, 2018 06:07 pm ET","U.S. Stocks Climb as Inflation Fears, Volatility Ebb","U.S. stocks rose and market volatility continued to fade, as fears of runaway inflation abated to help send the Dow Jones Industrial Average higher for a sixth consecutive session."
360,"May 10, 2018 04:25 pm ET",Crude Prices Set New 3-Year High in Wake of Iran Sanctions,"Oil prices wavered between gains and losses, with the U.S.’s withdrawal from the Iran nuclear agreement continuing to reverberate across markets. "
361,"May 10, 2018 12:44 pm ET",Consumer Inflation Pressures Are Still Modest,"A pick-up in inflation shows few signs of spiraling out of control, which should comfort investors worried about a recent acceleration in consumer prices."
362,"May 10, 2018 12:37 pm ET",Blackstone Launches Energy Fund to Capitalize on Rising Price of Oil,"The world’s biggest listed private-equity firm, Blackstone Group, is marketing its latest energy fund to capitalize on rebounding oil prices and tighter financial discipline among public oil producers. "
363,"May 10, 2018 11:59 am ET",Ignore Headline Inflation at Your Peril ,"Rising gasoline prices aren’t reflected in the core inflation measures the Federal Reserve focuses on, but that doesn’t mean they don’t matter. "
364,"May 10, 2018 11:03 am ET",Will Argentina’s Nightmare Spread?,"“Emerging markets are under pressure because the dollar is strong and U.S. rates are rising, while growth in China, the key spoke in international commerce, is slowing. Moreover, oil prices are high, pressuring current account balances. What’s unusual is that this is all happening at once,” Nathaniel Taplin writes for The Wall Street Journal."
365,"May 10, 2018 10:43 am ET",The Art of Faking a Ferrari,Rare-car craftsman Mark Lyon went from fixing up Ferraris to building perfect replicas. Dan Neil hops behind the wheel of an imposter Ferrari 250 SWB and wonders if it’s better than driving the real thing.
366,"May 10, 2018 07:47 am ET","Sorry, This Oil Route Is Closed Due to a Collapse in the Iran Deal—Energy Journal",California Moves Toward Becoming First State to Require Solar Panels on New Homes
367,"May 10, 2018 06:50 am ET","The 10-Point: Gerard Baker on Trump welcoming home the released American detainees, China’s next step in trade talks with the U.S. and more","A personal, guided tour to the best scoops and stories every day in The Wall Street Journal, from Editor in Chief Gerard Baker."
368,"May 10, 2018 06:47 am ET",Bostic Sees Inflation Above Target | Rising Dollar Spells Pain | Kuroda: BOJ to Watch for Financial Risks | RBNZ Stands Pat | Philippine Central Bank Raises Rates | Torry’s Take: Cloudy With a Chance of Moderation,"The Wall Street Journal’s central banking newsletter for Thursday, May 10, 2018"
369,"May 10, 2018 06:21 am ET",Argentina’s Warning: Currency Reserves Aren’t Everything,"Argentina went from robust to bust in a matter of months, leaving investors scratching their heads. Among the mysteries: why the country’s record hoard of currency reserves did so little to stem the crisis."
370,"May 10, 2018 03:39 am ET","WSJ City: RBS Agrees $4.9 Billion U.S. Settlement, Investors Await BOE’s Interest Rate Plan",
371,"May 10, 2018 02:37 am ET","The Daily Shot: Despite Weaker PPI, Inflation Expectations Hit Multi-Year Highs",
372,"May 10, 2018 12:04 am ET",What’s News: Business & Finance,What’s News: Business & Finance
