,date,title,summary
221,"July 25, 2017 06:49 pm ET",Petronas Ends Canadian LNG Project,"Malaysian state-owned energy company Petronas said it was ending its multibillion-dollar plan to build a natural-gas export terminal on Canada’s west coast, saying prolonged low natural-gas prices doomed the project."
222,"July 25, 2017 05:41 pm ET",Oil Gains on Saudi Push for Compliance With Output Cuts ,"Oil prices rose for the second day in a row, as investors found reassurance from OPEC’s attempts to limit crude supply and signs of slowing production in the U.S."
223,"July 25, 2017 03:38 pm ET",U.S. Government Bonds Pull Back Ahead of Fed Statement,A bout of selling hit the U.S. government bond market Tuesday as investors hedged their bets ahead of the conclusion of the Federal Reserve’s two-day policy meeting.
224,"July 25, 2017 01:05 pm ET",Ryanair Has ‘Serious’ Interest in Alitalia,"Ryanair has made a nonbinding proposal for Alitalia, but the Irish airline’s chief executive isn’t in a rush to head down the aisle until he sees how the unprofitable Italian carrier’s restructuring shakes out. "
225,"July 25, 2017 01:05 pm ET",Electric Cars Help America Depend Less on Oil,Ensuring fuel diversity is essential for America to remain prosperous and secure in the 21st century.
226,"July 25, 2017 10:56 am ET",The Coming Squeeze for Shale Oil Drillers,"Oil field services firms such as Halliburton and Schlumberger see more improvement in the U.S. shale patch, but their rising margins may come at the expense of oil and gas producers’ profits."
227,"July 25, 2017 08:13 am ET",Quantum Energy Partners Leads $300 Million Investment to Form New Oil Company,Impact Exploration and Production Partners LLC seeks acquisition and development opportunities in the Rocky Mountain region. The investment is the latest of a series of deals the energy private-equity firm has made this year.
228,"July 25, 2017 07:00 am ET","The Morning Risk Report: Life Sciences Firms Need Focus on Communications, Disclosures",Securities fraud lawsuits against life sciences and health-care companies are continuing to increase and show no signs of slowing down.
229,"July 25, 2017 06:57 am ET",Saudi Arabia Cuts Oil Exports to Prop Up Crude Prices—Energy Journal,Saudi Arabia Says It Will Limit Its Exports in August to Prop Up Sagging Oil Prices
230,"July 25, 2017 06:45 am ET","The 10-Point: Gerard Baker on the Senate Health-Care Vote, China’s North Korea Border Crisis, 60th Birthday Parties and More","A personal, guided tour to the best scoops and stories every day in The Wall Street Journal, from Editor in Chief Gerard Baker."
231,"July 25, 2017 01:46 am ET",WSJ’s Daily Shot: Cash Buyers Pull Back Amid Record Home Prices,
232,"July 25, 2017 12:01 am ET",What’s News: Business & Finance,What’s News: Business & Finance
233,"July 25, 2017 12:01 am ET",What’s News: Business & Finance,What’s News: Business & Finance
234,"July 25, 2017 12:01 am ET",What’s News: Business & Finance,What’s News: Business & Finance
235,"July 25, 2017 12:01 am ET",Biswas’s Take: Castlelake Sees More Opportunities in Illiquid Debt and Hard Assets Than Corporate Debt,The firm raises $2.4 billion for its latest fund
236,"July 24, 2017 09:12 pm ET",Oil Prices Add to Gains Amid OPEC Supply Moves,Oil futures added to overnight gains in Asian trading Tuesday as fresh pledges from Saudi Arabia and Nigeria to respectively pull back on exports and output raised hopes that market rebalancing is on the way.
237,"July 24, 2017 06:04 pm ET",Biswas’s Take: Castlelake Sees More Opportunities in Illiquid Debt and Hard Assets Than Corporate Debt,The firm raises $2.4 billion for its latest fund
238,"July 24, 2017 05:15 pm ET",Saudi Arabia Cuts Oil Exports,Internal discord among OPEC members and big oil-producing allies spilled into public view as the group struggles with its efforts to raise prices for crude.
239,"July 24, 2017 05:04 pm ET",Venezuela Bonds Slide Following Sanctions Threat ,"Venezuelan bond prices tumbled to their lowest levels of the year, as default fears grew following U.S. President Donald Trump’s threat to impose sanctions on the country. "
240,"July 24, 2017 04:51 pm ET",Ex-Apollo Executive’s Firm Offers to Buy Out Troubled Energy Fund ,EnerVest Ltd. is in talks with Mountain Capital Management to salvage what is left of a $1.5 billion private-equity pool whose oil-patch wagers are struggling under debt.
241,"July 24, 2017 04:32 pm ET",Oil Higher After Saudi Arabia Announces Limit on Exports    ,"Oil prices rose after Saudi Arabia announced it would curtail oil exports, and OPEC officials said they were contemplating a crackdown on countries that haven’t kept to pledges to cut production.  "
242,"July 24, 2017 12:09 pm ET","WSJ City PM: OPEC Looks Inward in Crude Price Slide, Zombie Companies Lurk, Greece Plans Bond Return",
243,"July 24, 2017 09:26 am ET","Stocks to Watch: Blue Apron, WebMD, Halliburton, Hibbett Sports, Hasbro","Among the companies with shares expected to trade actively in Monday’s session are Blue Apron Holdings Inc., WebMD Health Corp, Halliburton Co., Hibbett Sports Inc. and Hasbro Inc."
244,"July 24, 2017 09:11 am ET","Morning Must-Reads: Kushner’s Disclosure, Wall Street Vs. Congress, OPEC Worries","The Must Reads are part of the Journal’s Morning MoneyBeat newsletter. To receive the newsletter via email, see http://on.wsj.com/MoneyBeatUSSignup"
245,"July 24, 2017 08:34 am ET","The Morning Download: Autonomous Industry, Closing in Fast, Will Drive Down Operating Costs",Wholesale automation is about to drive down operating costs for a host of industries.
246,"July 24, 2017 07:38 am ET","Banker Pay Lower, Despite Deregulatory Push | Battle Over CFPB’s Complaint Database | Scaramucci’s Path to Trump’s Communications Director | Witkowski’s Take: Flood-Insurance Fix Leaves Program Under Water","The Wall Street Journal’s financial regulation newsletter for Monday, July 24, 2017."
247,"July 24, 2017 07:17 am ET",The Morning Ledger: Xi Jinping Sign-Off Serves Blow to Dalian Wanda’s  Buying Spree,"China keeps clamping down on large private companies, the U.S. and the U.K. move to scrutinize foreign investors and Foxconn mulls opening a production facility in Wisconsin."
248,"July 24, 2017 06:54 am ET","Ryanair Profit Soared 55% in Latest Quarter, Topping Expectations","Ryanair, Europe’s largest airline by passenger numbers, said net profit rose 55% in its fiscal first quarter, bolstered by strong ticket prices—but warned that overcapacity will continue to pressure fares."
249,"July 24, 2017 06:48 am ET",OPEC Is Pumping Over the Limit—Energy Journal,OPEC Pumped Too Much Crude in June
250,"July 24, 2017 06:47 am ET",Good News: China Is Making Less Useless Stuff ,"After years of overinvestment, which helped to sink global prices for steel, aluminum and other products, some of the worst-offending sectors in China are looking a bit better. "
251,"July 24, 2017 03:36 am ET","WSJ City: IMF Cuts UK Growth Forecast, Markets Risk No Brexit Deal Shock, Wall Street Loses on Banker Pay",
252,"July 24, 2017 12:24 am ET","WSJ’s Daily Shot: All Hail Netflix, King of the World",
253,"July 24, 2017 12:01 am ET",What’s News: Business & Finance,What’s News: Business & Finance
254,"July 24, 2017 12:01 am ET",What’s News: Business & Finance,What’s News: Business & Finance
255,"July 23, 2017 08:50 pm ET",Oil Prices Turn Higher in Asia Ahead of OPEC Meeting,"After early weakness, oil futures moved into the green by midday Monday in Asian trading."
256,"July 23, 2017 06:14 pm ET",OPEC Grapples With Growing Threats to Oil Deal,OPEC is worried that its plan to drain a global oil glut—and thereby raise crude prices—isn’t working.
257,"July 21, 2017 08:05 pm ET",S&P 500 Rises for the Week,The S&P 500 inched lower Friday but held on to a weekly gain as signs of health in corporate profits boosted shares. 
258,"July 21, 2017 07:04 pm ET",Schlumberger CEO Blames U.S. Investors for Stagnant Oil Prices      ,"U.S. investors are driving down the price of oil by shoveling too much money into American shale companies, the chief executive of the world’s largest oil-field service firm said as his company reported quarterly earnings.  "
259,"July 21, 2017 06:44 pm ET",California Says Tesla Is Too Big to Fail,State Democrats can’t stop throwing taxpayer money at the electric vehicle wunderkind.
260,"July 21, 2017 04:13 pm ET",Oil Retreats on OPEC Doubts,Oil’s rally fell flat with a late-week selloff canceling out early-week gains after new questions emerged about OPEC’s ability to hold to its promise of output cuts.
261,"July 21, 2017 01:35 pm ET",U.S. Oil-Rig Count Falls by One,"The number of rigs drilling for oil in the U.S. fell by one in the past week to 764, according to oil-field services company Baker Hughes. The gas-rig count also fell by one. "
262,"July 21, 2017 10:30 am ET",Meet Your New Landlord: Wall Street ,Big investors transform suburban neighborhoods by buying up single-family homes and renting them out. Their bet: the U.S. homeownership rate will stay low and rents will continue to rise.
263,"July 21, 2017 09:01 am ET",Soaring Tech Stocks Are Setting a High Bar,"The tech-heavy Nasdaq Composite index marked its 10th consecutive daily gain on Thursday, the longest streak in more than two years. The recent run has tech once again leading the way, after a rocky June that pushed shares of many red-hot tech giants lower."
264,"July 21, 2017 08:48 am ET",Regulators Drop Pursuit of Bonus Limits | Digital Money Transfer Proposals Coming | ‘The Mooch’ Getting White House Gig | Ackerman’s Take: Arbitration Rule Tough to Kill,"The Wall Street Journal’s financial regulation newsletter for Friday, July 21, 2017."
265,"July 21, 2017 08:44 am ET",ECB Echoes Global Caution | Inflation Seen Undershooting ECB  Target for Next 2 Years | Fed to Improve Electronic Money Transfers | South Africa Cuts Repo Rate | Buell’s Take: Mario Draghi’s Endless Car Ride,"The Wall Street Journal’s central banking newsletter for Friday, July 21, 2017"
266,"July 21, 2017 07:00 am ET","Among Iraqis Freed From ISIS, Resentment Festers",Iraq’s government is struggling to rebuild Sunni areas liberated from Islamic State—a challenge in any effort to end a cycle of sectarianism and an insurgency that has been pushed underground.  
267,"July 21, 2017 06:28 am ET",Today’s Top Supply Chain and Logistics News From WSJ,"Delivering up-to-the minute news, analysis, interviews and explanatory journalism on logistics, supply-chain management, e-commerce and more"
268,"July 21, 2017 06:18 am ET",Exxon Fined Over Russia Sanctions Violation—Energy Journal,The U.S. Treasury Department slapped Exxon Mobil Corp. with a $2 million fine for allegedly expanding its business ties with the Kremlin in violation of U.S. sanctions on Russia.
269,"July 21, 2017 06:04 am ET","BHP Sees a Hungry Planet, Elliott Sees Another Shale Disaster ","BHP has written off billions in U.S. shale investments, but it is poised to plow a substantial amount of funds into potassium fertilizer, or potash. Activist shareholder Elliott is kicking up a fuss. "
270,"July 21, 2017 03:11 am ET","WSJ City: Tech Is No Bubble, Big Brexit Gaps Remain",
271,"July 21, 2017 01:20 am ET",WSJ’s Daily Shot: This Is the Year of Robotics and A.I.,
272,"July 21, 2017 12:01 am ET",Paragon Offshore Finds Itself Back in Bankruptcy Court,"Just days after Paragon Offshore emerged from chapter 11 protection, the oil-and-gas company and its subsidiaries have once again filed for bankruptcy protection."
273,"July 20, 2017 11:43 pm ET","Regulators Drop Pursuit of Banker, CEO Pay Restrictions","Several regulators under the Trump administration have dropped pursuit of a long-running plan to restrict bonuses on Wall Street, as part of a wider effort to stop working on unfinished rules put in place after the financial crisis."
274,"July 20, 2017 09:03 pm ET",Oil Prices Maintain U.S. Declines in Asia Trade,Oil prices have turned slightly lower in Asia on Friday after initially trading higher following Thursday’s pullback in the U.S. 
275,"July 20, 2017 03:38 pm ET",Oil Retreats From a Seven-Week High,Crude prices retreated after hitting a seven-week high Thursday.
276,"July 20, 2017 03:24 pm ET",Gas Everywhere but No Way to Ship It     ,Natural gas pipeline delays in the Marcellus and Utica shale producing regions have caused a sharp discount for gas sold in the region.  
277,"July 20, 2017 03:05 pm ET",The Highs and Lows for Fallen S&P 500 Stocks,How the mighty have fallen.
278,"July 20, 2017 02:27 pm ET","Tech Is No Bubble, But the Stock Market Might Be","U.S. technology stocks have finally passed their 17-year-old bubble-era high, and the speed of this year’s rally has many concerned.   "
279,"July 20, 2017 01:41 pm ET",BP Said to Be Shopping Its North Sea Oil Fields,"BP has approached potential buyers of its oil-and-gas production assets in the North Sea, people familiar with the matter said."
280,"July 20, 2017 01:38 pm ET","2018 Dodge Challenger SRT Demon: A Drag-Racing Beast, Unleashed","Dan Neil rockets down Indianapolis’s Lucas Oil Raceway in a 2018 Dodge SRT Challenger Demon, the quickest production car in existence."
281,"July 20, 2017 01:11 pm ET",‘Do What You Can’,Senate Republicans try once more to rewrite ObamaCare.
282,"July 20, 2017 11:57 am ET",Oilman Russell Gordy Has a $96 Million Collection—of Ranches,"He has amassed 155,000 acres of land for hunting, fishing and raising cattle. He sometimes loses track of how many ranches he owns "
283,"July 20, 2017 11:41 am ET",Breitburn Cleared to Reduce Senior Debt With Hedging Proceeds    ,A judge has granted Breitburn Energy’s request to pay down senior debt using nearly $460 million in proceeds from hedges that were terminated when it filed for chapter 11 protection a year ago.  
284,"July 20, 2017 11:15 am ET",Energy Decouples From Other Commodities,"Returns in energy have gone through a unique split from other materials this year, as a wave of U.S. supply has weighed on oil prices and pushed overall commodity returns to a seven-year low."
285,"July 20, 2017 10:44 am ET",South Africa Cuts Repo Rate Amid Weaker Growth Outlook,"The South African Reserve Bank on cut its main repo rate to 6.75% from 7%, as it reduced its forecast for economic growth and inflation."
286,"July 20, 2017 07:22 am ET",Japan’s Inflation Dream Slips Further Into Future,"Japan’s central bank pushed back its forecast for reaching 2% inflation for a sixth time under Governor Haruhiko Kuroda, again highlighting the country’s struggle to achieve stable price growth."
287,"July 20, 2017 07:00 am ET",GE Earnings: What to Watch ,General Electric Co. is set to report second-quarter earnings before the market opens on Friday. Here is what you need to know. 
288,"July 20, 2017 06:49 am ET",U.S. Crude Stockpiles Decline—Energy Journal,
289,"July 20, 2017 05:40 am ET","WSJ Wealth Adviser Briefing: Fees, Commissions and the Fiduciary Rule","WSJ Wealth Adviser highlights some of the top news and analysis for wealth advisers and their clients, with pieces today including: the growing trend of brokers pursuing independence and breaking away from the wirehouses; the fiduciary rule's early impact on fees and commissions; the latest Adviser Profile, this one on Spuds Powell; and how to position your portfolio for second-half turbulence."
290,"July 20, 2017 03:24 am ET","WSJ City: What to Expect From Mario Draghi, Tech Stocks Beat Dot Com Record, EU Won’t Ride to UK’s Rescue",
291,"July 20, 2017 03:08 am ET",Oil Prices Remain Near 6-Week Highs in Asia ,"Crude futures paused in Asia after hitting six-week high, though the larger-than-expected decline in U.S. crude inventories last week reinforced a view that global markets are rebalancing. "
292,"July 20, 2017 01:16 am ET",WSJ’s Daily Shot: The Treasury Will Run Out of Money in Less Than Three Months,
293,"July 19, 2017 05:21 pm ET","Dow, S&P 500, Nasdaq Close at Records","Broad gains in U.S. stocks sent major indexes to a trio of records. The Dow industrials, the S&P 500 and the Nasdaq Composite hit new highs, with all 11 sectors of the S&P 500 posting gains."
294,"July 19, 2017 03:20 pm ET",Oil Rises on Bigger-Than-Expected Inventory Decline,Oil prices climbed to a six-week high Wednesday after a U.S. government report showed sharp drawdowns in oil and fuel stockpiles.
295,"July 19, 2017 03:07 pm ET","From Seed to Smoke, Uruguay Is Now First Nation to Oversee Pot Sales ",Tiny South American country embarks on ambitious experiment to regulate the cultivation and sale of marijuana.
296,"July 19, 2017 02:48 pm ET",Black Bay Energy Capital Backs Oil Field-Services Company,ADS Services provides pressure control equipment and services in the Permian Basin of West Texas and southern New Mexico.
297,"July 19, 2017 11:58 am ET","WSJ City PM: Frankfurt Takes Early Brexit Lead, Investors Grow More Bearish, Morgan Stanley Traders Outperform",
298,"July 19, 2017 11:48 am ET",Profile: Earning Clients’ Trust by Aligning Goals,": Spuds Powell, managing director at Kayne Anderson Rudnick in Los Angeles, says “your greatest priority, and greatest challenge, as an adviser is earning the trust of your clients”--something his firm does by investing alongside clients."
299,"July 19, 2017 08:00 am ET",Traders Falter in Worst First Half for Commodities Since 2010 ,"Major commodity players such as banks and hedge funds have stumbled, as low volatility and a faltering oil recovery derailed returns during the first half. "
300,"July 19, 2017 07:27 am ET",What Fed Officials Are Saying | Draghi Expected to Reinforce Tightening Signals | BOJ More Confident | Amazon Is BOJ’s New Problem | Douglas’s Take: Slowdown in UK Inflation Won’t End Rate Rise Debate,"The Wall Street Journal’s central banking newsletter for Wednesday, July 19, 2017"
301,"July 19, 2017 06:49 am ET",Ecuador Breaks Ranks With OPEC on Production Deal–Energy Journal,
302,"July 19, 2017 06:33 am ET",Douglas’s Take: Slowdown in UK Inflation Won’t End Rate Rise Debate,Consumer price-inflation in the U.K. slowed unexpectedly in June but it would be premature to conclude that an interest rate rise is off the table.
303,"July 19, 2017 06:29 am ET",What Fed Officials Are Saying | Draghi Expected to Reinforce Tightening Signals | BOJ More Confident | Amazon Is BOJ’s New Problem | Douglas’s Take: Slowdown in UK Inflation Won’t End Rate Rise Debate,"The Wall Street Journal’s central banking newsletter for Wednesday, July 19, 2017"
304,"July 19, 2017 01:05 am ET","WSJ’s Daily Shot: Make Over $100,000? Don’t Worry, Be Happy",
305,"July 19, 2017 12:01 am ET",What’s News: Business & Finance,What’s News: Business & Finance
306,"July 18, 2017 09:13 pm ET",Crude Futures Lack Direction Ahead of U.S. Oil Data,"Oil prices were lacking direction in Asia trade Wednesday, as the market awaits fresh data on U.S. crude inventories, which was seen to have increased last week. "
307,"July 18, 2017 07:03 pm ET",U.S. Weighs Sanctions on Venezuela ,"The Trump administration said it was prepared to impose “strong and swift” economic sanctions on Venezuela, including banning its crude-oil exports to the U.S., if its president proceeds with a plan to rewrite the constitution. "
308,"July 18, 2017 04:07 pm ET",Vanguard Natural Resources Wins Bankruptcy Plan Confirmation,The court approval paves the way for the Texas oil and gas company to exit bankruptcy protection in the hands of its bondholders.
309,"July 18, 2017 03:58 pm ET",Oil Edges Up Ahead of U.S. Stocks Data,"Oil prices rose, reviving a recent string of gains on several factors, including a falling dollar and more momentum behind the idea that the worst of a longstanding glut may be past."
310,"July 18, 2017 03:01 pm ET",Ecuador to Pump Over OPEC Oil Limit ,Ecuador has broken ranks with fellow OPEC members as the South American country’s energy minister said it could no longer hold up its end of an agreement to cut oil production.
311,"July 18, 2017 01:47 pm ET",Paragon Offshore Emerges From Bankruptcy Protection,"Senior lenders now control the oil and gas company, which spent more than a year under court protection."
312,"July 18, 2017 09:47 am ET",U.K. Inflation Eases Unexpectedly in June,"U.K. consumer inflation slowed unexpectedly in June, new figures showed, offering a tentative sign that a lengthy squeeze on households evident since last year’s Brexit vote may soon begin to ease"
313,"July 18, 2017 07:04 am ET",Monetary Policy in Japan Has a New Problem: Amazon,"Retailers have been cutting prices in response to the rise of online rivals like Amazon, disrupting what had seemed like perfect conditions for Japan to get the stable dose of inflation it has long been looking for."
314,"July 18, 2017 06:54 am ET",Oil Prices Rise on U.S. Data Hopes — Energy Journal,Oil prices recover on U.S. data and corporations take action after listening to their investors.
315,"July 18, 2017 05:35 am ET",WSJ Wealth Adviser Briefing: 401(k) Savings and Adviser Voice,"WSJ Wealth Adviser highlights some of the top news and analysis for wealth advisers and their clients, with pieces today including: the unlikely source of increased 401(k) savings; Adviser Voices, on an opportunity for investors to get direct access to real-estate projects; and the latest Watching Your Wealth podcast, this one offering tips for millennials who want to move out of their parents' house."
316,"July 18, 2017 03:20 am ET","WSJ City: UK Growth Forecast Trimmed, BNP Paribas Fined, US Senate Abandons Healthcare Bill",
317,"July 18, 2017 02:31 am ET",Oil Prices Edge Up Ahead of Wednesday’s U.S. Data,"Oil prices recovered slightly in Asian trade, after the weeklong rally fizzled  on fresh data that showed U.S. production would continue to trend higher this year."
318,"July 18, 2017 01:46 am ET",WSJ’s Daily Shot: What Portion of the Economy Could Be Impacted by Trump’s Proposed Tariffs?,
319,"July 17, 2017 06:48 pm ET",Ensco Bondholders Unhappy With Atwood Oceanics Deal ,"A group of Ensco PLC’s bondholders are considering agitating against the offshore contract drilling company’s plan to buy Atwood Oceanics Inc., a smaller peer, in an all-stock deal, according to a person familiar with the matter."
320,"July 17, 2017 06:20 pm ET",Nasdaq Rises for Seventh Consecutive Session,"The Nasdaq rose for a seventh straight session, extending its rebound after last month’s turbulence in technology stocks. The Dow Jones Industrial Average and S&P 500 retreated from records. "
321,"July 17, 2017 05:16 pm ET",Germany Should Say Danke for U.S. Oil,Angela Merkel’s slaps at Trump don’t help her country’s cause. America’s frackers do.
322,"July 17, 2017 03:49 pm ET",Oil Falls as Oversupply Concerns Persist,"Oil prices reversed gains on Monday, as investors weighed signs of strong demand against a global glut that’s proven difficult to reduce."
323,"July 17, 2017 11:12 am ET",Robotic Hogwash! Artificial Intelligence Will Not Take Over Wall Street,"A decade on, artificial intelligence and machine learning are the buzzwords in automated investment. But for all the hype, applying AI to investment still has serious problems. "
324,"July 17, 2017 07:52 am ET",Nasdaq Urges Treasurys Clearing | China Sets Cabinet Panel on Financial Rules | Yellen’s Q&A With Senators | Wells Fargo Defections Pick Up | Hayashi’s Take: CFPB’s Arbitration Database Plan,"The Wall Street Journal’s financial regulation newsletter for Monday, July 17, 2017."
325,"July 17, 2017 07:37 am ET",Kaplan Wants Balance-Sheet Reduction to Start Soon | Evans: Rate Increases ‘Remains to Be Seen’ | Growth Shows ECB Stimulus Payoff | China Forges New Financial Controls Body | Torry’s Take: What’s a Little Low Inflation Between Friends?,"The Wall Street Journal’s central banking newsletter for Monday, July 17, 2017"
326,"July 17, 2017 07:04 am ET",A Private-Equity Flop in the Oil Business—Energy Journal,
327,"July 17, 2017 06:59 am ET","The 10-Point: Gerard Baker on the latest health-bill setback, P&G’s proxy fight, Federer’s triumph and more","A personal, guided tour to the best scoops and stories every day in The Wall Street Journal, from Editor in Chief Gerard Baker."
328,"July 17, 2017 06:48 am ET",Nasdaq Urges Treasurys Clearing | China Sets Cabinet Panel on Financial Rules | Yellen’s Q&A With Senators | Wells Fargo Defections Pick Up | Hayashi’s Take: CFPB’s Arbitration Database Plan,"The Wall Street Journal’s financial regulation newsletter for Monday, July 17, 2017."
329,"July 17, 2017 06:01 am ET","Emirates, Flydubai Connect in New Middle East Airline Alliance ","Dubai-based carriers Emirates and Flydubai are going to work more closely together through a wide-ranging tie-up, in the latest sign that intensifying political and economic pressures are making Middle East carriers rethink their business plans. "
330,"July 17, 2017 05:26 am ET",The Vanishing Reward for Buying High-Yield Bonds     ,A closer look at high-yield bonds shows the reward on offer isn’t quite what it seems.  
331,"July 17, 2017 12:26 am ET",What’s News: Business & Finance,What’s News: Business & Finance
332,"July 17, 2017 12:01 am ET",What’s News: Business & Finance,What’s News: Business & Finance
333,"July 17, 2017 12:01 am ET",What’s News: Business & Finance,What’s News: Business & Finance
334,"July 16, 2017 09:27 pm ET","WSJ’s Daily Shot: Milk, Eggs and Bread Haven’t Been This Cheap Since 2007",
335,"July 16, 2017 08:52 pm ET",Oil Starts Week Up Slightly,"Crude futures were off to an upbeat start in Asia, adding to gains seen every day last week for benchmark prices. "
