,date,title,summary
90,"January 21, 2021 04:47 pm ET",U.S. Rejoined the Paris Climate Accord. Meeting Emissions Goals Will Be Harder.,"World leaders welcomed the return of the U.S. to the Paris Agreement, but it won't be easy to reassert global leadership and meet targets to reduce their carbon footprints."
91,"January 21, 2021 01:02 pm ET",Who Knew My Old Gadgets Had Super Powers?,Too bad I threw out the manual for that voice-operated weed whacker.
92,"January 21, 2021 09:12 am ET","Paccar, Under Armour, Ford, United: What to Watch When the Stock Market Opens Today",Technology shares are leading gains in futures markets.
93,"January 21, 2021 05:30 am ET",Palm Oil Market Soars,"The price of palm oil, used in products from chocolate to toothpaste, is near a decade high and likely to climb further as pandemic-related labor woes hurt production while demand strengthens."
94,"January 20, 2021 05:44 pm ET",Many Are Happy to Pay a Bit More for Clean Energy,"There are many who will happily pay more—to encourage alternative sources, to put long-term impact ahead of short-term savings and to better reflect total costs associated with production, distribution, use, etc."
95,"January 20, 2021 06:20 am ET",Hong Kong Stocks Swell as Market Eats Up Chinese Cash,"Hong Kong shares have surged to a 20-month high, and trading volumes have hit records, as investors from mainland China have jumped into the market in search of bargains and stocks not available back home."
96,"January 20, 2021 05:12 am ET",Bank Negara Malaysia Keeps Policy Rate Unchanged at 1.75% ,Bank Negara Malaysia expects the growth trajectory to improve from the second quarter onward. 
97,"January 19, 2021 06:41 pm ET",Great Lakes Pipeline Adds Heat to U.S.-Canada Energy Tensions ,"Michigan has ordered Calgary-based Enbridge to close an oil pipeline that supplies Canada’s most populous region, adding another point of conflict in the energy relationship between the U.S. and Canada.  "
98,"January 19, 2021 04:54 pm ET",Stocks Rise on Hopes for More Stimulus,U.S. stocks climbed as Janet Yellen endorsed higher coronavirus relief spending and some of the country’s biggest banks beat expectations for fourth-quarter earnings.
99,"January 19, 2021 01:55 pm ET","After 144 Years, LME Proposes Closing Trading Ring","The London Metal Exchange is proposing closing its open-outcry ring, where traders have swapped metals like copper and lead using shouts and hand signals for 144 years, in a bid to attract more financial players to its marketplace. "
100,"January 19, 2021 08:57 am ET","Janet Yellen’s Debt Question; Policy Updates to Come from BOC, ECB, BOJ    ","Janet Yellen plans to tell lawmakers today that the U.S. risks a longer, more painful recession unless Congress approves more aid and urge them to “act big” to shore up the recovery. A big question is hanging over Joe Biden’s pick for Treasury Secretary: How much debt is too much? Elsewhere, policy updates from central bankers in Canada, the European Union and Japan are on this week’s economic agenda.  "
101,"January 19, 2021 12:01 am ET",What’s News: Business & Finance,What’s News: Business & Finance
102,"January 18, 2021 04:04 pm ET",Global Stocks Edge Up as Investors Await Earnings Flurry,"Stocks ticked higher as investors awaited a busy week of corporate earnings, economic data and central-bank decisions."
103,"January 18, 2021 03:56 pm ET","After Stock Surge, Investors Ask Companies What’s Ahead",An epic stock rally faces a key test in coming weeks as investors learn what executives expect for profits and revenues in coming periods. 
104,"January 18, 2021 09:50 am ET",Biden’s Climate Plan to Get a Boost From Democrat-Led Senate,"The Senate has been reluctant to forcefully address climate issues with new regulations, but expectations are growing after election victories in Georgia Jan. 5 gave Democrats control of that chamber. "
105,"January 17, 2021 09:26 pm ET",Record Liquefied Natural Gas Prices in Asia Won’t Last ,"A cold snap and a supply crunch have created a perfect storm for liquefied natural gas prices in Asia, but investors in the sector should be aware that the pendulum is likely to swing the other way soon. "
106,"January 17, 2021 02:00 pm ET",Will Covid-19 Shake Up Capitalism?,The pandemic sped up demands for changes in the economic system. Shareholders might want to brace for change.
107,"January 17, 2021 11:56 am ET",Oil-and-Gas Industry Faces a Long Recovery From Pandemic Lows,Spending on oil production world-wide isn’t expected to climb back up to pre-pandemic levels through at least 2025.
108,"January 16, 2021 10:26 am ET","Emerging and Growth Markets, January 16th 2021",A weekly roundup of key news affecting emerging and growth markets from the Wall Street Journal and beyond.
109,"January 16, 2021 05:30 am ET",Groceries Prove a Pandemic Bright Spot for BP and Shell ,Oil majors bet offering more fresh food and services at gas-station stores can help offset declining oil income. 
110,"January 15, 2021 04:36 pm ET","Stocks Fall After Joe Biden Plan, Weak Retail Sales",The S&P 500 ended the week with losses as investors worry that new stimulus plans will lead to higher taxes. 
111,"January 15, 2021 03:10 pm ET",Soybeans Fall as Traders Reap Profits,
112,"January 15, 2021 11:31 am ET",PE Daily: PE Fundraising Falls in 2020 but Secondaries Boom | Roark Seeks $5 Billion for Fund VI    ,"As we head into the long weekend, we offer up some fundraising features for your reading enjoyment. Few of you will be surprised to hear that private-equity fundraising fell in 2020, although some regions and strategies actually posted gains, as our own Chris Cumming reports this morning. One subsector of the industry, secondary funds, posted a record year for capital formation, thanks in large part to a handful of multibillion-dollar funds. Speaking of multibillion-dollar funds, Preeti Singh has news that Roark Capital Group is pitching its next flagship fund with a goal of $5 billion.  "
113,"January 15, 2021 11:03 am ET",Today’s Logistics Report: YRC’s Heavyweight Aid; Fighting for Chips; Vetting Suppliers,Today’s Top Supply Chain & Logistics News from WSJ.
114,"January 15, 2021 09:56 am ET",Powell Sees a Long Recovery for U.S. Job Market; Biden Proposes $1.9 Trillion Pandemic Relief Plan    ,"December’s job loss report was unwelcome news for the Federal Reserve, Chairman Jerome Powell said Thursday in a webcast, saying the economy ""is far from our goals.” The situation argues for keeping the Fed’s easy-money policies and asset purchasing campaign in place for the foreseeable future, Mr. Powell added. Meanwhile, President-elect Joe Biden unveiled his Covid-19 relief plan. It calls for Congress to back a round of $1,400-per-person direct payments to most households, a $400-per-week unemployment insurance supplement through September, expanded paid leave and increases in the child tax credit.  "
115,"January 14, 2021 03:21 pm ET",Corn Up Again on Strong Export Sales,
116,"January 14, 2021 01:10 pm ET",Oil Market Has Plenty of Wild Cards Remaining ,"Saudi Arabia’s production cut has helped send front-month Brent crude oil prices up by 7% in two weeks, following an OPEC-plus agreement to leave output flat, but there is still room for surprise from two formidable oil players outside that group. "
117,"January 14, 2021 09:17 am ET",Oil Demand Recovery Set to Fall Short of Pre-Covid Levels This Year ,"Global appetite for oil will remain subdued in the first quarter of 2021 due to coronavirus lockdown measures and rising infection rates, the Organization of the Petroleum Exporting Countries said."
118,"January 14, 2021 09:12 am ET",Pro Bankruptcy Briefing: DOJ Settles With Bankrupt Retailer Over PPP Fraud; Chesapeake To Shed $7 Billion Debt; Marriott Clashes With Washington Hotel    ,The Justice Department’s first civil fraud settlement surrounding the Paycheck Protection Program is with a bankrupt online retailer that didn’t disclose its pending chapter 11 case. A bankruptcy judge confirmed Chesapeake Energy’s $7 billion debt-cutting plan and had some pointed words for its CEO. The Marriott Wardman Park’s bankruptcy could run into obstacles from the hotel’s erstwhile manager. And Christopher & Banks Corp. said Thursday it has filed for chapter 11 protection.  
119,"January 14, 2021 09:05 am ET","GameStop, Delta, BlackRock: What to Watch When the Stock Market Opens Today",U.S. stock futures ticked up ahead of a Biden speech on stimulus plans.
120,"January 13, 2021 08:42 pm ET",Fracking Pioneer Chesapeake Energy Cleared to Exit Bankruptcy ,"Judge David Jones of the U.S. Bankruptcy Court in Houston said Wednesday he would confirm the fracking pioneer’s chapter 11 plan, ruling against a more junior creditor group that argued during a nearly monthlong trial that they would be shortchanged in the restructuring."
121,"January 13, 2021 09:11 am ET",Officials Signal Uncertainty Over the Future of Fed Bond Buying; Growth in Job Postings Slowed in December    ,"Fed officials have been offering hints about the outlook for their bond buying, with some saying it could persist unchanged through the year and others saying they can’t make a prediction with uncertainty surrounding how the economy recovers from the pandemic. Meanwhile, the number of U.S. help-wanted ads increased more slowly in December, evidence the labor market is losing momentum amid rising coronavirus cases.  "
122,"January 12, 2021 04:47 pm ET",U.S. Stocks Finish Slightly Higher,"Major U.S. stock indexes edged slightly higher, though weakness in the shares of technology and social-media companies capped their gains."
123,"January 12, 2021 04:16 pm ET",U.S. Treasury Yields Pare Gains After Strong Auction ,A Treasury Department auction of new 10-year notes met strong demand from investors. The 10-year yield was still on course to rise for a seventh consecutive trading session. 
124,"January 12, 2021 04:07 pm ET","Oil Producers Commit to Supply Curbs, Sustaining Price Rally ","Oil is extending a steady recovery into 2021, aided by fresh signals that the world’s biggest producers won’t turn on the spigots and flood the market. "
125,"January 12, 2021 12:02 pm ET",USDA Report: World Agricultural Supply and Demand Estimates,
126,"January 12, 2021 09:11 am ET","Twitter, Tesla, Realty Income: What to Watch When the Stock Market Opens Today","S&P 500 futures are edging higher, pointing to muted gains after dropping on Monday."
127,"January 12, 2021 06:02 am ET","WSJ Wealth Adviser Briefing: Revamping Bonus Plans, Value in the Great Outdoors, Execs on Factory Floor","U.S. companies revamped bonus plans as the pandemic upended financial forecasts; consumers and investors were expected to continue finding value in outdoor activities, and manufacturers who lost workers recruited their executives for the factory floor."
128,"January 11, 2021 11:54 pm ET","Emerging and Growth Markets, December 26th 2020",A weekly roundup of key news affecting emerging and growth markets from the Wall Street Journal and beyond.
129,"January 11, 2021 11:39 pm ET","Emerging and Growth Markets, January 9th 2021",A weekly roundup of key news affecting emerging and growth markets from the Wall Street Journal and beyond.
130,"January 11, 2021 01:47 pm ET","James ‘Jim Bob’ Moffett, Who Helped Build Freeport-McMoRan, Dies at 82 ",The oil wildcatter turned mining prospector helped turn Freeport-McMoRan into a natural-resources giant.
131,"January 11, 2021 06:02 am ET","WSJ Wealth Adviser Briefing: Rental Home Construction, Investing in 2021, Traveling After Covid","Investors built tens of thousands of homes in expectation that Americans would flock to spacious suburban living; a continued push into hot assets from last year could eventually get you burned, and six getaway goals were discovered for 2021 with new ways to realize each one."
132,"January 11, 2021 05:25 am ET",Cold Snap Sparks Record Rise in Natural Gas Prices in Asia,"A blast of cold weather in northeast Asia and a shortage of ships for transporting gas have sparked a scramble for cargoes of liquefied natural gas, igniting a steep rise in prices."
