,date,title,summary
116,"May 30, 2018 12:04 pm ET",OPEC’s Alliance With Russia Shows Signs of Fracturing ,"The first cracks are showing in an alliance of petroleum-producing countries, with some OPEC members accusing Saudi Arabia of capitulating to U.S. and Russian pressure for lower prices."
117,"May 30, 2018 08:46 am ET",Global Oil Stocks Fall to Three-Year Low ,"Commercial oil stocks in industrialized economies have fallen to their lowest level in three years, the International Energy Agency said, in the latest sign that the global supply glut has been mopped up and the market rebalanced. "
118,"May 30, 2018 07:42 am ET",U.S.-China Trade Talks Teeter on the Edge—Energy Journal,The Trump Administration Surprised Beijing with Move Towards Applying Tariffs on Chinese Imports
119,"May 30, 2018 03:16 am ET",Rupee’s Fall Points to Uncertain Future for Investment in India,"The rupee is the worst performing currency in Asia this year, flirting with an all-time low as rising oil prices rewrite the once-shining fundamentals of Asia’s third-largest economy. It’s just one of the challenges facing Prime Minister Narendra Modi ahead of elections next year. "
120,"May 30, 2018 02:55 am ET",The Daily Shot: Itexit Would Be Far More Disastrous Than Brexit,
121,"May 29, 2018 08:26 pm ET",Stock Declines Put Added Pressure on Oil Prices,Fresh Wednesday morning selling in oil futures stopped by midday in Asia as continued risk aversion hit markets as equities in the region fell some 1.5%. 
122,"May 29, 2018 07:19 pm ET",Fossil-Fuel Divestment Is Futile,"If climate activists have their way, oil prices will rise—and so will stocks in energy companies."
123,"May 29, 2018 04:55 pm ET",Stocks Tumble on Italy’s Political Instability,"Worries about Italy and Spain gripped markets Tuesday, triggering declines in stocks, a drop in the euro and big moves in bond markets."
124,"May 29, 2018 03:45 pm ET",U.S. Oil Prices Fall as Supply Worries Linger   ,"U.S. oil prices extended their recent declines Tuesday, with some investors still worried about the impact of higher supply with two of the world’s largest producers nearing an agreement to boost output."
125,"May 29, 2018 03:06 pm ET",Brazil’s Temer Vows to End Strike and Continue Economic Overhauls,Brazil’s President Michel Temer pledged on Tuesday to end a disruptive truckers strike and press on with his efforts to overhaul Latin America’s largest economy. 
126,"May 29, 2018 12:27 pm ET","Bank of Canada Seen on Hold Amid Trade Uncertainty, Housing Slowdown",The Bank of Canada is expected to leave its benchmark interest rate unchanged Wednesday as the country faces concern over slowing housing markets and stalled trade negotiations with the U.S.
127,"May 29, 2018 12:18 pm ET",The Morning Risk Report: Risk-Modeling Skills Prized by CEOs,"Specialists in emerging technology, cybersecurity and risk-and-scenario modeling willare going to be among the most sought-after employees in the next three years, according to a survey of 400 U.S.-based chief executives by KPMG LLP."
128,"May 29, 2018 12:01 pm ET","WSJ City PM: Eurozone Risk Aversion Is Back, Why Bank Investors Fear Return of Doom Loop",
129,"May 29, 2018 10:56 am ET",The Family That Has Elevated Everyday Items to Art,"Over generations, the Auböck family of Vienna has built a temple to craftsmanship."
130,"May 29, 2018 10:49 am ET","Kimbell Royalty to Buy Haymaker Mineral, Royalty Interests for $404 Million","Haymaker’s private-equity sponsors, KKR & Co. and Kayne Anderson Capital Advisors, along with Haymaker management, will own a roughly 37% stake in Kimbell upon closing."
131,"May 29, 2018 09:22 am ET","Stocks to Watch: Apple, Qualcomm, Disney, 21st Century Fox, Chevron, Johnson & Johnson, Starbucks","Among the companies with shares expected to trade actively in Tuesday's session are Apple, Qualcomm, Disney, Chevron and Johnson & Johnson."
132,"May 29, 2018 09:13 am ET","For Oil Prices, Political Risks Dwarf the Dollar    ","Oil prices are trading at levels not seen since late 2014, defying what is often a considerable obstacle to crude and other commodities rallying: a stronger dollar. "
133,"May 29, 2018 07:32 am ET",Saudi Arabia to the Oil Market: Jump but Not Too High—Energy Journal,
134,"May 29, 2018 07:16 am ET","Real Time Economics: Is a Tight Labor Market Really, Finally Generating Higher Wages?","Today in Real Time Economics, we look at wage gains in the U.S., political trouble for the euro, Trump administration trade tactics, the country with the power to move oil prices, and the vast but shallow gig economy."
135,"May 29, 2018 07:05 am ET","The 10-Point: Gerard Baker on summit brinkmanship, financiers’ fading power and more","A personal, guided tour to the best scoops and stories every day in The Wall Street Journal, from Editor in Chief Gerard Baker."
136,"May 29, 2018 05:30 am ET",Banks Hunting Growth Loosen Terms on Business Loans ,"Faced with tepid loan growth and heated competition for clients, banks are sweetening their deals on loans to businesses, a development that is concerning regulators. "
137,"May 29, 2018 05:30 am ET",U.S. Sanctions Start to Pinch Shipping in Iran ,"It will be months before new U.S. sanctions against Iran take hold, but global shipping operators are already pulling back from the big oil-exporting nation. "
138,"May 29, 2018 03:51 am ET","WSJ City: Italy’s Drama Raises Stakes for Euro, Investors Come Home to U.S. Stocks",
139,"May 29, 2018 02:25 am ET",The Daily Shot: Who Has the Capacity to Boost Oil Output?,
140,"May 29, 2018 01:39 am ET",Asian Energy Stocks Feel the Pinch as Global Oil Prices Pull Back ,Asia-Pacific stock markets were largely lower following declines in Europe the previous day. Japan’s Nikkei 225 index declined 1.1% by midday on the back of a strengthening yen.
141,"May 28, 2018 05:19 pm ET",Brazil Truckers Strike to Cost Government $2.6 Billion Through End of Year ,"Brazil’s government said that concessions to end a crippling truckers strike will have a high cost for taxpayers even as the country’s businesses and consumers struggle with shortages of fuel, food, medicines and other vital goods. "
142,"May 28, 2018 12:14 pm ET",Italian Political Crisis Roils Markets ,"Political turmoil in Italy put markets on edge with Italian bonds and stocks selling off sharply, renewing fears among investors in one of Europe’s largest economies."
143,"May 28, 2018 07:29 am ET",Chinese Energy Company’s Missed Bond Payment Fans Fears of More Defaults ,Chinese conglomerate that backed out of $5.2 billion deal for a Hong Kong skyscraper has defaulted on a set of U.S. dollar bonds—the third time this year an Asian company has defaulted on its U.S. dollar debt.
144,"May 28, 2018 07:00 am ET","Shale Surges, but Oil Market Power Swings Back to Saudis","The U.S. is producing more oil than ever, but when it comes to pulling the strings of the market, Saudi Arabia is still king."
145,"May 28, 2018 01:13 am ET","Money Is About to Flow Into China, Just as It Pours Out of Tencent",Asian stocks were up Monday as weekend diplomacy revived the potential for a summit between President Donald Trump and North Korean leader Kim Jong Un. But Mainland Chinese investors are yanking money out of Tencent Holdings Ltd.—one of the country’s highest-profile companies
146,"May 27, 2018 10:26 pm ET","Gold Falls With Oil, Dollar; Korea Worries Cool",London spot-gold prices have also fallen amid oil’s skid and even as the dollar is down in Asia this morning. 
147,"May 27, 2018 08:29 pm ET","Japan, Korea Stocks Start Higher; Australia Lags","A decidedly mixed open with Japan and Korea starting higher after the weekend meeting between Moon and Kim, while equities in Australia are lower. "
148,"May 27, 2018 08:15 pm ET",Oil Steadies After Fresh Morning Slump in Asia,A fresh Monday morning slump in oil futures steadied by midday in Asia as investors continued to react to the possibility of major oil producers including Russia and Saudi Arabia boosting production. 
149,"May 26, 2018 09:55 am ET","This Week on the Frontiers, May 26th 2018",A weekly roundup of key news affecting frontier markets from the Wall Street Journal and beyond.
150,"May 26, 2018 12:01 am ET",What’s News: Business & Finance,What’s News: Business & Finance
151,"May 25, 2018 09:02 pm ET",Investors Are Taking Stock of Trade,"U.S. stocks booked slight gains for the week, though continuing trade negotiations with China, along with geopolitical tensions with North Korea and worries about rising interest rates, have kept investors on edge."
152,"May 25, 2018 08:01 pm ET",Trump Team Seeks Truce With Congress Over ZTE,The Trump administration is scrambling on Capitol Hill to keep lawmakers from undermining talks with China by blocking a deal to roll back penalties on telecom giant ZTE.
153,"May 25, 2018 06:54 pm ET",Russia Gets New Sway Over Oil Prices,"Russia and Saudi Arabia are hammering out the terms of a deal to jointly increase oil production—a move that sent prices sharply lower and that extends, at least for now, a crucial role for Moscow in influencing global prices. "
154,"May 25, 2018 06:37 pm ET",Brazil Calls in Military as Truck Drivers Defy Union Agreement With Government,"Brazil’s government called in the military in a last-ditch attempt to force truckers to stop blockading highways as a five-day-old strike halted shipments of food, fuel, medicine, and shut down the nation’s auto industry."
155,"May 25, 2018 04:59 pm ET",U.S. Stocks Stall as Oil Falls and Global Worries Mount,"U.S. stocks stalled Friday but hung on to weekly gains, as tumbling oil prices and worries over political risks from North Korea to Italy kept investors on guard."
156,"May 25, 2018 03:59 pm ET",Oil Tumbles as Major Producers Near Deal to Increase Output,Oil prices plunged as Saudi Arabia and Russia neared an agreement to increase oil production after more than a year of holding crude off the market.
157,"May 25, 2018 03:36 pm ET",Oil Giants Target Free Riders ,Russia and Saudi Arabia may bring an early end to their agreement curtailing oil production as market dynamics point to a switch. The end result: prices are heading lower.
158,"May 25, 2018 02:41 pm ET",Gold Little Changed With Markets Calm,"Gold prices swung between small gains and losses before closing slightly lower, hurt by a stronger dollar but benefiting from a continued drop in Treasury yields."
159,"May 25, 2018 02:12 pm ET",Dollar Rises Against Broad Range of Currencies,"The dollar rose against a broad range of currencies Friday, boosted by political uncertainty in Europe and a drop in oil prices. "
160,"May 25, 2018 02:02 pm ET",Corruption Currents: Man Jailed for 660 Years Wants His Gold Bars Back,A man serving 660 years in prison for laundering money on behalf of a Colombian drug cartel wants his gold bars back.
161,"May 25, 2018 12:46 pm ET","WSJ City PM: Hedge Funds Raise Bets Against Italy, US Websites Go Dark in Europe as GDPR Kicks In",
162,"May 25, 2018 10:30 am ET",Butch Granville Steered Texaco Through Oil-Market Turmoil in the 1970s,"Maurice F. “Butch” Granville, a Texas-born oil executive who was CEO of Texaco in the 1970s, died May 14. He was 102. "
163,"May 25, 2018 10:11 am ET",Business Investment Rebounds in April,"A proxy for business investment rose a solid rate last month, but overall durable goods orders fell in April due to a decline in aircraft demand."
164,"May 25, 2018 09:23 am ET",Oil Falls as Producers Ponder Boosting Output—Energy Journal,"Chances of Global Sanctions on Iran ""Almost Nil,"" Says Obama Nuclear Official"
165,"May 25, 2018 07:15 am ET","Real Time Economics: What Do Tariffs, Oil Prices, a Tight Labor Market and Rising Borrowing Costs Mean for the Economy?","Today in Real Time Economics, we look at pushback on proposed auto tariffs, rising prices on U.S. steel, climbing borrowing costs, a shortage of summer workers, Europe's soft patch, and who's paying for $80 a barrel oil."
166,"May 25, 2018 06:29 am ET",U.S. Steel Prices on Knife’s Edge as Tariff Deadline Nears,"U.S. steel prices won’t stop breaking away from those in Asia and Europe, in a rally driven by confusion about what Washington’s import tariffs will look like."
167,"May 25, 2018 06:23 am ET","The 10-Point: Gerard Baker on the canceled Trump-Kim summit, Europe’s new privacy law and more","A personal, guided tour to the best scoops and stories every day in The Wall Street Journal, from Editor in Chief Gerard Baker."
168,"May 25, 2018 03:57 am ET",Big Trouble in Little Japan,"Japan’s economy shrank last quarter for the first time since 2015. Analysts have focused on still-weak inflation, but the real problem may be slowing global growth."
169,"May 25, 2018 02:40 am ET",The Daily Shot: Is the Fed Becoming Complacent About Downside Risks to the Economy?,
170,"May 25, 2018 02:34 am ET","Trump Cancels North Korea Summit, but Impact on Asian Stocks Is Muted—for Now","Stocks in Asia weakened after President Donald Trump cancelled a June summit with North Korean leader Kim Jong Un. Still, investor worries were softened by expectations that the two countries could continue talking."
171,"May 24, 2018 11:45 pm ET",What’s News: Business & Finance,What’s News: Business & Finance
172,"May 24, 2018 10:26 pm ET","Brazil Reaches a Pact in Truck Strike, but Big Union Rejects It ","Brazil’s government said it had reached an agreement with several truckers unions to suspend a four-day strike that has disrupted the economy, but one of the country’s biggest drivers groups said it would continue the work stoppage. "
173,"May 24, 2018 10:09 pm ET",New 1MDB Probe Risks Peeling Back Corruption Built Up Over Decades ,"Malaysia’s new government faces an awkward problem: Having renewed the investigation into 1MDB, it must now decide how far it should pursue companies that played supporting roles in a massive financial swindle."
174,"May 24, 2018 08:06 pm ET",Oil Prices Remain Capped by Potential of Higher OPEC Output,Oil futures fell slightly in Asian trading Friday morning after the 1%-plus decline during Thursday’s global session amid prospects of major oil producers offsetting any declines from Iran and Venezuela. 
175,"May 24, 2018 05:09 pm ET",U.S. Stocks Fall After Trump Nixes North Korea Summit,"The Dow Jones Industrial Average declined after President Donald Trump called off a summit with North Korea, hitting investors with another wave of uncertainty."
176,"May 24, 2018 04:02 pm ET",Oil Slips as Investors See Easing to OPEC Output Cut    ,Oil prices eased amid growing expectations that the production-cut pact that helped sop up a glut of crude could be relaxed.
177,"May 24, 2018 03:25 pm ET",Quick Hits: San Francisco Fed Says Bitcoin Bears Bubble Trappings,"The San Francisco Fed says bitcoin’s price swings are suggestive of a bubble, Singapore’s central bank took steps to regulate cryptocurrencies, and the People’s Bank of China is seen easing monetary policy. "
178,"May 24, 2018 03:05 pm ET",S&P Global Moves to Start Ratings Business in China ,"S&P Global Inc., the financial-information giant, plans to build a stand-alone ratings business in China, bringing it a step closer to expanding its presence in one of the world’s biggest corporate bond markets. "
179,"May 24, 2018 02:12 pm ET",U.S. Existing Home Sales Fell in April,"Sales of previously owned U.S. homes declined in April, as inventory shortages and rising prices weigh on the market and higher mortgage rates begin to pose a threat to demand for the first time in years."
180,"May 24, 2018 01:19 pm ET",Europe to Clinch Cheaper Russian Gas With Gazprom Deal ,"The European Union settled its multiyear antitrust case against Gazprom, clinching promises of cheaper natural-gas flows from Russia as President Trump demands the bloc taps U.S. energy exports and cuts its dependence on Moscow."
181,"May 24, 2018 12:29 pm ET","WSJ City PM: Firms Set for Europe’s ‘Mammoth’ Privacy Law, Why Deutsche Bank Needs Radical Ideas",
182,"May 24, 2018 12:29 pm ET",Europe’s Economy Throws a Wrench in the ECB’s Plans,The outlook for the eurozone economy is darkening at just the wrong time for the European Central Bank.
183,"May 24, 2018 11:53 am ET",The Tragedy of Venezuela,"When reporter Anatoly Kurmanaev started covering the country five years ago, the petrodollar-fueled party was still raging, but the greed and incompetence of the Socialist government soon began to take their devastating toll."
184,"May 24, 2018 11:43 am ET","Russia, OPEC Members to Discuss Easing Oil Output Cap ",Russia and other large oil producers will next month discuss relaxing an agreement that has cut output and helped support crude prices—a move that could relieve some of that price pressure in coming weeks.
185,"May 24, 2018 10:07 am ET","South Africa’s Economy May Have Shrunk in First Quarter, Warns Central Bank ",The South African Reserve Bank kept its main repo rate at 6.5% and warned that the economy might have shrunk in the first quarter of 2018 due to weak mining and manufacturing performance. 
186,"May 24, 2018 07:35 am ET","Unlikely Supporter Exxon, Pledges to Fight Climate Change—Energy Journal",Exxon Pledges to Cut Emissions
187,"May 24, 2018 03:22 am ET",The Daily Shot: Average New House Price Hits a Record as Builders Sell More Luxury Homes,
188,"May 24, 2018 01:05 am ET",Malaysia’s Markets Are Feeling the Aftermath of Its Shock Election,"Asian stock markets were broadly lower on Thursday over concerns about the latest U.S.-China trade negotiations. Japanese auto stocks slumped. Toyota and Honda each fell 3.2%, weighed down by news that the Trump administration is considering imposing new tariffs on vehicle and auto-parts imports. "
189,"May 23, 2018 04:44 pm ET",U.S. Stocks Rise After Fed Minutes,U.S. stocks erased early losses and closed higher Wednesday after minutes from the Federal Reserve’s latest meeting showed the central bank plans to stay on a gradual path of rate increases.
190,"May 23, 2018 03:59 pm ET","WSJ City PM: Deutsche Bank Zeroes In on 10,000 Job Cuts, Europe’s Opaque Trades, What to Expect from Fed Minutes",
191,"May 23, 2018 03:37 pm ET",Oil Mixed on Possible OPEC Production Increase    ,Oil prices were mixed Wednesday as U.S. data showed big increases in crude and fuel stockpiles and as investors weighed whether the Organization of the Petroleum Exporting Countries could ramp up crude production.
192,"May 23, 2018 03:34 pm ET",Harvey Gulf Wins Court OK to Exit Bankruptcy ,"Senior lenders to take over offshore oil services firm, CEO Shane Guidry gets bonuses and equity stake"
193,"May 23, 2018 03:20 pm ET",Turkish Lira Recovers After Central Bank Lifts Key Rate ,The Turkish lira plunged before recovering after the central bank answered concerns over spiraling inflation and its own independence from government with a rate increase.
194,"May 23, 2018 03:16 pm ET",Advance Auto Parts Grapples With Higher Fuel Costs,An unexpected jump in fuel prices during the latest quarter gummed up the supply chain and tapped the brakes on profitability at Advance Auto Parts Inc.
195,"May 23, 2018 02:30 pm ET",Turkey’s Central Bank Lifts Key Rate Amid Lira’s Fall,"Turkey’s central bank took emergency action late Wednesday, raising one of its interest rates by 3 percentage points, in a bid to stop the Turkish lira’s fall one month from presidential and parliamentary elections."
196,"May 23, 2018 07:53 am ET",What Is Happening to Global Growth? ,The soft patch in the global economy is looking more soft and less like a patch. 
197,"May 23, 2018 07:42 am ET",Keep Your Eye on Venezuela’s Oil—Energy Journal,Looming U.S. Sanctions on Iran Misdirected Global Attention from Washington’s Measures against Venezuela
198,"May 23, 2018 06:10 am ET","WSJ Wealth Adviser Briefing: Amazon, Rising Dollar, Preppy Remix","The last recession’s “lost generation,” rising international airfares, and a preppy remix."
199,"May 23, 2018 05:41 am ET","In Booming Japan, the Phillips Curve Is Dead","Standard models of the economy are built on a simple relationship: When unemployment goes down, inflation eventually goes up. That relationship has looked sickly for years. In Japan, it may be dead, a preview of what central bankers may confront everywhere."
200,"May 23, 2018 03:49 am ET","WSJ City: Investors Eye Bumpy Ride in Italy, U.S. Set to Roll Back Postcrisis Regulation",
201,"May 23, 2018 02:46 am ET",The Daily Shot: Second-Quarter U.S. GDP Growth to Exceed 3%,
202,"May 23, 2018 02:22 am ET",China’s Reduction of Auto Import Tariffs Steers Asia Stocks Lower ,"Asian stocks were largely lower Wednesday as investors weighed the implications of the latest trade tensions between the U.S. and China, along with the possible cancellation of a planned June summit between President Donald Trump and North Korea’s Kim Jong Un. Hong Kong and Japan led broader declines, both falling around 1%."
203,"May 23, 2018 12:01 am ET",What’s News: Business & Finance,What’s News: Business & Finance
204,"May 22, 2018 08:52 pm ET",U.S. Pullback in Oil Prices Continues in Asia ,"The sharp midday Tuesday pullback in oil prices continued Wednesday morning in Asia, with Brent’s second test of $80 a barrel failing amid the potential of major oil producers offsetting anticipated production declines in Iran and Venezuela. "
205,"May 22, 2018 06:56 pm ET",Harvey Gulf Seeks Court OK to Exit Bankruptcy,"Senior lenders to take over offshore oil services firm, CEO Shane Guidry gets bonuses and equity stake"
206,"May 22, 2018 06:30 pm ET",U.S. Stocks Slip as Investors Weigh Trade Talks,U.S. stocks slid Tuesday as investors weighed the latest trade tensions between the U.S. and China and as President Donald Trump said his June summit with North Korean leader Kim Jong Un “may not work out.”
207,"May 22, 2018 06:22 pm ET",Why Venezuela Sanctions Are Even More Bullish for Oil Than Iran Sanctions ,New U.S. sanctions on Venezuela’s oil production are expected to reduce global supply even more than sanctions on Iran—which could provide another boost to rising crude prices. 
208,"May 22, 2018 05:24 pm ET","Oil Prices Rise on U.S. Sanctions Threats Against Iran, Then Fall Back",Oil prices again broke through the $80 a barrel threshold after the U.S. threatened to tighten economic sanctions against Iran. 
209,"May 22, 2018 04:34 pm ET",Why Copper Is Missing Out on the Commodities Rally , a possible slowdown in China and troubling signs in Europe and Japan. Prices of copper have fallen nearly 5% this year. 
210,"May 22, 2018 03:42 pm ET",Corruption Currents: Dirty Russian Money Continues Flowing to U.K.,U.K. lawmakers backed a crackdown on Russian money laundering following a report on illicit flows continuing to make their way into Great Britain.
211,"May 22, 2018 03:35 pm ET","WSJ City PM: What to Expect from Zuckerberg’s European Grilling, Cambridge Analytica Staff Told Firm Is Liquidating",
212,"May 22, 2018 11:31 am ET",Gold Prices Tick Up from Worst Levels of 2018,"Gold futures rose slightly Tuesday as the dollar pulled back from multimonth highs, but the precious metal still hovered near the lowest levels of the year."
213,"May 22, 2018 08:48 am ET",Investors Dip Back Into Emerging Market Stocks,"Investors are warming back up to emerging market stocks, brushing off the volatility that’s been pummeling assets across developing countries lately."
214,"May 22, 2018 08:42 am ET",What to Watch in Tonight’s Primaries,"What to watch in tonight's primaries, and more in the Capital Journal Daybreak newsletter"
215,"May 22, 2018 08:03 am ET",Santos Rejects $10 Billion Takeover Bid as Oil Prices Rise,"Australia-based Santos rejected a $10 billion takeover bid by Harbour Energy, saying the offer undervalued it given recent oil-price gains."
216,"May 22, 2018 07:30 am ET",Garcia’s Take: Private-Equity Firms Must Adapt as Shale Revolution Matures,"With oil-and-gas producers concentrating on developing the known shale plays, private-equity firms are finding fewer opportunities to strike gold with new discoveries."
217,"May 22, 2018 07:30 am ET",Garcia’s Take: Private-Equity Firms Must Adapt as Shale Revolution Matures,"With oil-and-gas producers concentrating on developing the known shale plays, private-equity firms are finding fewer opportunities to strike gold with new discoveries."
218,"May 22, 2018 07:21 am ET",Iran Balks at New U.S. Requirements for Sanctions Relief—Energy Journal,U.S. to Iran: Stop Enriching All Uranium
219,"May 22, 2018 07:12 am ET",Real Time Economics: China Wins the First Round In Trade Fight,"Today in Real Time Economics, we look at apparent U.S.-China trade detente, a fresh high for oil prices, slow employment gains in steel cities, the Great Recession's lost generation, and the job market for bright-eyed college grads."
220,"May 22, 2018 06:29 am ET","The 10-Point: Gerard Baker on U.S. demands for a new Iran deal, receding fears of a U.S.-China trade war and more","A personal, guided tour to the best scoops and stories every day in The Wall Street Journal, from Editor in Chief Gerard Baker."
221,"May 22, 2018 06:10 am ET","WSJ Wealth Adviser Briefing: Debt, Mortgage Rates, Summer Concerts","Mortgage rates hit a seven-year high, female billionaires are on the rise, and the Great Recession lingers."
222,"May 22, 2018 05:30 am ET","In Trade War With U.S., China Gets the Upper Hand","Among all the trade fights that President Donald Trump has picked, his hand against China is the strongest. Yet Beijing, incredibly, appears to be winning."
223,"May 22, 2018 03:38 am ET","WSJ City: US and China Near Deal on ZTE, A Tale of Two Booming Stock Sectors",
224,"May 22, 2018 02:58 am ET",The Daily Shot: U.S. Credit Card Delinquencies Expected to Climb,
