,date,title,summary
113,"June 28, 2017","Fast Europe Open: UK house prices, France consumer confidence","...in bite-sized chunks (all times London):
07.00: UK Nationwide house prices07.45: France consumer confidence10.00: Italy consumer price index12.00: UK Prime..."
114,"June 27, 2017",Trade chokepoints risk food price surge,"...The growing importance of global trade in agricultural commodities has increased the risks of disruption at key transport “chokepoints”, potentially triggering food price surges.
The..."
115,"June 21, 2017",Centrica sells last big UK power stations,...has been selling big central power assets and reducing its exposure to oil and gas exploration and production to focus on services for homeowners and...
116,"June 21, 2017",Vattenfall to enter UK consumer energy market,"...the UK remained an attractive market despite the political risks posed by price caps and Brexit.
“This is a vote of confidence in the UK..."
117,"June 20, 2017",Centrica to close UK’s largest gas storage site,"...Britain’s largest storage site for natural gas is to close permanently, leaving the country more dependent on imports and exposed to price shocks.
Centrica..."
118,"June 20, 2017",Leading corporations support US carbon tax campaign,...carbon adjustment” — a tariff imposed on goods from countries that do not price carbon — and a corresponding rebate for countries that have higher taxes on...
119,"June 19, 2017",Enel chief forecasts green revolution to charge ahead,"...solar power generation.
“In the next two to three years battery storage prices will go down and battery performance will go up so these will..."
120,"June 18, 2017",US corn ethanol producers to tap into overseas demand,"...not stopped ethanol companies from building in the corn belt. With grain prices low and foreign demand robust, plants are still making a profit. 
Ringneck..."
121,"June 15, 2017",Trump can’t put the green genie back in the bottle,...Mr Trump wants to boost the US coal industry and encourage onshore oil production but electorates across the developed world have shown that they will...
122,"June 13, 2017",Output from Opec members climbed in May,"...May for a further nine months.
The data in Opec’s monthly oil market report illustrates the latest challenge facing the group, which is already..."
123,"June 11, 2017",State investors stock up on record gold reserves amid uncertainty,"...its status as a “haven asset” and to take advantage of rising prices.
“There was a lot of political uncertainty in the past year. There..."
124,"June 22, 2017",US stock futures edge lower with oil at centre stage,"...as investors continue to keep a wary eye on moves in the oil market.
With about 90 minutes to go before the markets open, futures..."
125,"June 21, 2017",Oil stocks lower as crude hits seven-month low,"...Oil equities were the worst performing sector in Asia on Wednesday after oil hit its lowest level in seven months.
Prices for the black stuff..."
126,"June 18, 2017",Saudi Aramco cleans up financials to bolster valuation,"...in a March research paper. 
The kingdom plans to gradually increase energy prices towards market rates starting in 2017. 
The Saudi Aramco flotation is the..."
127,"June 15, 2017",Berlin hits back at US move to tighten sanctions on Russia,"...pipeline as a competitor.  
“The goal is to secure jobs in the oil and gas industry in the USA,” they said. “Who gives us energy..."
128,"June 14, 2017",Elliott Advisors calls for BHP Billiton shake-up under new chairman,"...past eight years on its acquisitions in US shale, money spent on oil exploration and share buybacks at “inflated market prices”. 
The fund has called..."
129,"June 14, 2017",Oil dives to 7-month lows after unexpected jump in gasoline stockpile,"...Oil tumbled to a 7-month low on Wednesday after gasoline inventories unexpectedly rose and crude stockpiles fell less than expected last week.
Prices..."
130,"June 14, 2017",Excess oil inventories to last until 2018 – IEA,...Russia have this year joined forces to cut output and reduce an oil market surplus that is keeping pressure on prices. Producers agreed in May...
131,"June 13, 2017",BP highlights ‘decisive’ shift away from coal power,"...to save it.
That was the message from BP, the UK-based oil group, as it published energy data on Tuesday showing that global coal..."
132,"June 13, 2017",Noble Group jumps 11% as rivals eye oil business,"...year following reports the troubled commodities trader has received approaches for its oil business.
Hong Kong-based Noble still remains in talks with its lenders..."
133,"June 12, 2017",Ineos to spend €2bn on expanding petrochemicals capacity,"...chemicals analyst at Raymond James. “Ineos is making a bet that gas prices will remain weak because there’s so much of it available.”
Ineos..."
134,"June 12, 2017",Qatar diplomatic spat reignites UK gas supplies fears,"...UK gas will be imported.
Ken Cronin, chief executive of UK Onshore Oil & Gas, which represents the nascent UK shale industry, said political tensions over..."
135,"June 12, 2017",UK engineer Weir acquires Singapore-based oil business,"...Weir Group, the maker of heavy-duty equipment for the oil and mining sectors, has unveiled an acquisition aimed at strengthening its position as energy..."
136,"July 6, 2017",Qatar Airways commits to buying American Airlines shares,"...4.75 per cent on the open market “depending on the share price”, Akbar al-Baker said in Dublin.
Qatar Airways last month notified American..."
137,"July 6, 2017",Swiss inflation falls to 7-month low,"...Prices in Switzerland unexpectedly dropped in June after four months of rises, as a strong franc continues to limit inflation.
Average consumer prices dropped..."
138,"July 4, 2017",Former Glencore traders launch metal trading platform,"...to underpin bitcoin markets — as a way to settle deals in the oil market.
Open Mineral will focus on the raw form of metal, which..."
139,"July 3, 2017",US stocks gain but institutional investors show nerves,"...for crude oil in more than five years, lifting energy stocks,
The price of Brent and West Texas Intermediate oil — the international, North Sea and..."
140,"July 1, 2017",United Utilities slips on fears of end to boom times,...Lower bond yields have driven valuations near all-time highs yet tougher price controls are coming at a time when financing costs cannot fall much...
141,"June 30, 2017","Investors Chronicle: Debenhams, Chemring, Stagecoach","...the gold price.
The point here is simple. Relationships between the gold price and economic fundamentals are unstable. Yes, higher oil prices, lower interest rates..."
142,"June 29, 2017",Private equity buyouts hit highest level in decade,"...some industry insiders and analysts are now warning about the ever higher prices that groups are paying to seal deals, adding to the challenge of..."
143,"June 29, 2017",Italy’s Manutencoop recuts junk bond after pushback,"...a company is sold to another buyer.
The deal is scheduled to price on Thursday afternoon.
Despite the high yields on offer, investors said they..."
144,"June 28, 2017",Japan outlaws restrictions on resale of LNG cargoes,"...fuel from the US, Australia and Africa are expected to push down prices. 
“Japanese users predict excess supply of LNG, ” said the JFTC. “They are..."
145,"June 27, 2017",Top China think-tank forecasts Q2 GDP of 6.8%,"...Premier Li Keqiang’s prediction.
The academy also forecasts China’s consumer price index to have risen 1.4 per cent for the second quarter..."
146,"June 27, 2017",Vale moves to limit Brazilian government’s influence,"...One of Brazil’s most important companies after Petrobras, the state-controlled oil company, Vale was privatised 20 years ago.
But analysts say it has..."
147,"June 26, 2017",Evergrande’s $6.6bn bond deal shakes Asia markets,"...s booming bond markets, analysts have warned, following a rare first-day price fall that left buyers of the deal nursing losses of $250m.
Asian..."
148,"June 26, 2017",Opening Quote: Carlyle’s spoonful of sugar for Holland & Barrett owners,"...per cent since the start of the year, but Phoenix’s offer price still marks a 61 per cent discount to Hornby’s share price..."
149,"June 22, 2017",Mexico hikes rates for 7th straight time to 7%,"...in March 2009.
It comes as Banxico is battling to tame consumer prices that are now running at twice its target level. Extraordinary gasoline price..."
150,"June 20, 2017",Noble confirms key repayment deadline pushed back,"...to find a strategic investor and will have to sell its US oil business.
“The oil business remains one of the ‘easier’ businesses to sell..."
151,"June 17, 2017",Venezuela’s food parcels prove imperfect solution to crisis,"...anything to buy.”
Yet with such a huge difference between the market price for the goods and the price paid — and an even bigger gap..."
152,"June 16, 2017",Banks poised to throw crisis-hit Noble a lifeline,"...solutions to its debt problems, such as the sale of its US oil business. 
But Noble’s lenders have moved to tighten the terms of..."
153,"June 16, 2017",BHP chooses Ken MacKenzie as new chairman ,"...board and management to achieve this,” he said.
The BHP Billiton share price was about flat, down 0.02 per cent at A$23.01 in..."
154,"June 12, 2017","Fast Asia Open: Australia business confidence, Hong Kong producer inflation","...Kong):
09.30: Australia NAB business conditions and confidence12.30: Malaysia palm oil production, exports and stockpiles04.30: Hong Kong producer price index and industrial..."
155,"June 12, 2017",Opening Quote: Mitie to clean up its act after accounting woes,"...of immigration detention centres. And it work on baggage handling at Heathrow.
Oil industry engineer Weir is trying to look beyond the UK. This morning..."
156,"June 12, 2017",E-commerce lures Salim Group back to banking after two decades Premium content,"...no official announcement of the acquisition has yet been made.
The purchase price may seem like a drop in the ocean for Salim. While complex..."
157,"July 9, 2017",–Trade with China offers clues to North Korea’s economic health,"...we know about North Korean trade with China? 
Its top imports are oil and oil products, as well as coke for its steel mills. Years..."
158,"July 7, 2017",Emerging market investors wary of taper talk,"...in the past two weeks, so the strong performance of EM asset prices seen this year faces a major test. 
As investors await details of..."
159,"July 3, 2017",ECB speakers set to deliver policy hints,...after fears of a co-ordinated shift in policy hit global bond prices last week. Economic data from Canada and the US may also assume...
160,"June 29, 2017",Liberia prepares for life after Nobel prize-winning president,...is trying to breathe life into an economy hit by lower commodity prices and weak investor confidence. The election will be an indicator of whether...
161,"June 23, 2017",FT Health: war and the spread of disease,...sales forecasts for 2017-2022 by $390bn in the expectation of lower prices but  investors  seem relaxed about President Trump's promise to stop drug...
162,"June 22, 2017",Trump looks to lift LNG exports in US trade shift,"...had sought to tread a fine line, embracing jobs created by shale oil and gas while recognising concerns about the environmental impact of fracking, as..."
163,"June 21, 2017",US stocks set for more losses as energy remains in focus,"...crude oil fell into the first bear market since last summer.
Although oil has bounced back from Tuesday’s session lows, prices could take a..."
164,"June 20, 2017",WTI settles in bear market,"...The oil bear is back.
West Texas Intermediate, the US oil benchmark, officially fell back into bear market territory on Tuesday as concerns over..."
165,"June 19, 2017",China calls on domestic investors to boost commodity presence,"...as the largest buyer of raw materials seeks a greater say over prices.   
Beijing wants to make it easier for commercial banks, insurance companies and..."
166,"June 19, 2017",Argentina launches century bond,"...debt denominated in dollars, euros and sterling, and in 2015 the Brazilian oil company Petrobras sold $2.5bn of century bonds, which on Monday traded..."
167,"June 15, 2017",Islamic bond market stunned by ‘unlawful’ sukuk claim,"...Iraq, which is in a better position to pay thanks to increased oil exports in recent months.
“All rights and awards are confirmed — we just..."
168,"June 13, 2017",Canadian dollar climbs to near 4-month high as markets ramp up rate hike bets,...has largely adjusted to the fallout from the collapse in global crude prices and issued upbeat comments on the economy. She also hinted that the...
