,날짜,제목,요약
1685,2019.01.31.,지난해 세계 LNG선 90% '조선 빅3'가 수주,빠르게 회복하는 조선 업황 올해 수주 14% 증가 예상 中·日 경쟁력 약화 반사이익도 [ 김보형 기자 ] 선박 공급 과잉과 국제 유가 하락 여파로 침체에 빠졌던 조선 업황이 작년부터 빠르게 회복되고 있다....
1686,2019.02.03.,3일 휘발유값 하락세... 평균 1344 원 대 형성,"국내 휘발유 가격이 국제 유가와 유류세 효과 등으로 가격 하락세를 보였다. 한국석유공사 유가 정보 서비스인 '오피넷' 에 따르면, 이달 3일 보통 휘발윳값은 -0.11원 떨어진 리터당 1344.10원으로 집계됐다...."
1687,2019.01.25.,"뉴욕증시, 미·중 무역협상 긴장 속 혼조세 마감","4% 가량, 사우스웨스트항공은 6.3% 상승했습니다. 한편, 국제유가는뉴욕상업거래소(NYMEX)에서 3월 인도분 서부 텍사스산 원유는 배럴당 0.51달러 상승한 53.13달러에 거래를 마쳤습니다. [사진 출처 : EPA=연합뉴스] ( )"
1688,2019.01.21.,"무협, 산자부와 '민관합동 수출전략회의' 개최","이번 회의는 미·중 통상분쟁, 노딜 브렉시트 등 통상환경의 불확실성과 함께 반도체 시황 악화, 국제 유가 하락 등 글로벌 시장의 변동성이 커지는 상황에서 무역업계와 정부, 지원기관이 함께 수출활력 제고방안을..."
1689,2019.01.24.,"""마두로는 전직 대통령"" 압박하는 美…원유 수입 금지 카드 꺼내나",하지만 이후 국제유가가 급락했고 외화 유입이 크게 줄면서 베네수엘라에 부족한 물자를 해외에서 수입해올 자금이 부족한 상황에 놓였다. 결국 이로 인해 국내에서 생필품의 가격이 급등하는 등 물가가 빠르게 올랐고...
1690,2019.01.30.,[뉴욕마감] 애플 실적 변수에 '혼조'···다우↑·나스닥↓,"[대형 기술주 FAANG 일제히 하락…英 파운드 약세, 국제유가 급등] 뉴욕증시가 혼조세를 보였다. 전통주들은 강세를 띤 반면 기술주들은 애플의 실적 발표를 앞두고 약세로 마감했다. 장 마감 후 발표된 애플의 실적은..."
1691,2019.02.01.,"현대중공업, 지난해 4분기 영업손실 2030억…적자폭 축소",현대오일뱅크는 국제유가 급락에 따른 재고손실을 반영하며 4분기 1753억원의 영업손실을 발표한 바 있다. 현대중공업 관계자는 “연초부터 선주들의 수주 문의가 이어지는 등 올해도 업황 회복세가 지속될...
1692,2019.01.24.,[일문일답] 이주열 “하반기 반도체 회복 전환 판단”,물가 전망치도 낮췄지만 국제유가 하락 등 공급 요인과 정부의 복지정책 강화에 상당부분 기인한다. 물가상승률이 지금은 1% 초반으로 낮아졌지만 점차 높아져 하반기에는 1% 중반수준으로 올라설 것으로 본다. -올해...
1693,2019.01.28.,"베네수엘라 마두로, 재선거 계획 내놓으라는 유럽 요구 거부","물러날 때가 아닙니다."" 마두로 대통령은 국제유가 하락 속에 미국의 경제 제재가 더해져 초래된 극심한 경제난을 못 이겨 많은 국민이 해외로 탈출하는 가운데 지난 10일 두 번째 6년 임기를 시작했습니다. 연합뉴스..."
1694,2019.01.28.,"[ET투자뉴스]삼성중공업, ""상선 수주 호조, …"" BUY-KTB투자증권","한편 ""최근 국제유가 반등에 따라 해양 기대감 상승. 회사는 인도 릴라이언스 프로젝트의 발주 시점을 올해 상반기로 예상. 호주 바로사 및 나이지리아 자바자바는 하반기로 예상. 지난 몇년간 글로벌..."
1695,2019.01.28.,"S-OIL, 2018년 매출 25조4,633억…전년比 21.9% ↑","2018년 4분기 매출액은 국제유가 하락으로 전분기 대비 4.5% 감소했고, 4분기 영업이익은 유가 급락에 따른 대규모 재고 관련 손실(-3,910억원) 영향으로 적자를 기록했다. 정유 부문은 견조한 제품 수요 성장에도..."
1696,2019.02.03.,"[주간주요공시] 삼성전자, 2년 연속 최대 실적 경신",80달러대이던 국제유가(두바이유 기준)는 지난해 10월부터 가격 급락이 시작돼 현재 50달러 대다. 유가가 떨어지면 기존에 정유사가 구매해 둔 원유 가치도 내려가 손실을 입게 된다.
1697,2019.01.20.,중소기업 ‘역대 최대’ 1146억달러 수출…반도체·한류 영향,"플라스틱 제품(55억달러, 6.1% 증가)은 국제 유가 상승으로 수출 단가가 올라가면서 2년 연속 수출 1위 품목을 차지했다. 특히 글로벌 전기차 생산량이 늘어나면서 리튬이온 이차전지용 플라스틱 제품의 대미 수출이..."
1698,2019.01.24.,"미국이 정부 인정 안 한다는데, 마두로의 앞날은",2014년 국제 유가가 정점을 찍은 이후 저유가 기조로 베네수엘라 경제가 파산으로 치닫는데 불을 지핀 점을 감안하면 미국과의 단교는 마두로 정권의 자충수나 마찬가지다. 더구나 미국은 베네수엘라에 대한 경제 제재...
1699,2019.01.23.,지난해 석유제품 400억 달러 수출...'사상 최고',"석유제품 수출액은 국제유가와 제품 수출단가 상승에 힘입어 전년보다 33％ 늘어난 399억 6천만 달러, 45조 원에 달했습니다. 이에 따라 석유제품은 지난해 '주요 13개 수출 품목' 순위에서 반도체와 일반기계, 석유화학에..."
1700,2019.01.23.,지난해 석유제품 400억 달러 수출...'사상 최고',"석유제품 수출액은 국제유가와 제품 수출단가 상승에 힘입어 전년보다 33％ 늘어난 399억 6천만 달러, 45조 원에 달했습니다. 이에 따라 석유제품은 지난해 '주요 13개 수출 품목' 순위에서 반도체와 일반기계, 석유화학에..."
1701,2019.01.21.,"연초 수출 두자릿 수↓ '경고음'…정부, '비상체제' 가동","최근 미‧중 통상분쟁, 노딜 브렉시트 가능성 등으로 통상환경의 불확실성이 높아진 데다 세계무역 성장세 둔화, 반도체 시황 악화, 국제 유가 하락 등 글로벌 시장의 변동성도 커지며 대외 수출여건이 악화한..."
1702,2019.01.24.,"한은, 기준금리 연 1.75%로 동결···경기우려에 일단 관망",국제유가는 하락하고 수요 측면에서 상승 압력도 좀처럼 늘지 않고 있기 때문이다. 이런 가운데 한은을 압박하던 한미 금리 역전폭 확대 부담도 다소 완화되어 한미 금리 차가 1%포인트를 넘는 시점이 미뤄졌다. 미 연준은...
1703,2019.01.28.,"에쓰오일, 작년 영업익 6806억…전년比 50.4%↓",지난해 4분기 영업이익은 유가 급락에 따른 대규모 재고 관련 손실(-3910억원) 영향에 2924억원의 적자를 냈다. 매출액은 국제유가 하락으로 전분기 대비 4.5% 감소한 6조8613억원을 기록했다.
1704,2019.02.07.,"[국제유가] 美 재고 증가세, 예상치 하회…유가 사흘만에 상승세 전환","美 재고 증가세, 예상치 하회…유가 사흘만에 상승세 전환 국제유가가 사흘만에 상승세로 전환했다. 7일 한국석유공사에 따르면 지난 6일(현지시간) 뉴욕상업거래소(NYMEX)에서 거래된 미국 서부텍사스산원유(WTI)는..."
1705,2019.01.23.,경제 파탄·쿠데타 시도…바람 잘 날 없는 베네수엘라,"경제정책의 실패로 인한 인플레이션, 부정부패, 국제 유가 하락, 미국의 경제제재 등이 겹쳤기 때문이다. 유엔은 인구의 7%에 달하는 230만명이 경제위기를 견디지 못하고 베네수엘라를 탈출한 것으로 보고 있다. 가디언은..."
1706,2019.01.20.,지난해 중소기업 수출액 1146억달러… 역대 최대,플라스틱 제품의 수출은 전년 대비 6.1% 늘어난 55억달러로 국제 유가 상승에 따른 수출단가 상승과 주요국 제조업의 호황으로 지난해에 이어 2년 연속 수출 1위 품목에 올랐다. 자동차 부품은 중국으로의 수출이...
1707,2019.02.01.,1월 수출 -5.8%. 무역흑자 10억달러대로 급감,"이처럼 수출이 감소한 것은 수출물량은 견조한 증가세를 보였으나, 반도체 가격 급락과 국제유가 하락에 따른 반도체·석유제품의 수출 부진 때문이었다. 수출물량은 전년 동기 대비 8.4% 증가했지만, 수출단가가..."
1708,2019.01.31.,"한전 사장, 전기요금 인상 추진",국제유가 상승과 정부의 탈원전 정책 등으로 전력 구매 단가가 높아진 데 따른 자사의 경영 부담을 공개적으로 토로한 것이다.그러면서 김 사장은 정부가 검토 중인 산업용 심야 경부하 전기요금과 주택용 전기요금...
1709,2019.02.01.,"가격 떨어지고 中은 뒤쫓고…반도체·석화 ""침체 끝 안보여""",조선과 자동차산업 위기 속에 울산 경제를 지탱했던 석유화학 산업은 국제유가 하락으로 지난해 4분기부터 고전을 면치 못하고 있다. 나프타를 원료로 플라스틱과 섬유 등을 만드는 울산석유화학공단 소재 B사는...
1710,2019.02.01.,"가격 떨어지고 中은 뒤쫓고…반도체·석화 ""침체 끝 안보여""",조선과 자동차산업 위기 속에 울산 경제를 지탱했던 석유화학 산업은 국제유가 하락으로 지난해 4분기부터 고전을 면치 못하고 있다. 나프타를 원료로 플라스틱과 섬유 등을 만드는 울산석유화학공단 소재 B사는...
1711,2019.01.21.,"수출도 위험하다… 정부, 수출 컨트롤타워 올해 첫 가동","이번 회의는 미·중 통상분쟁, 노딜 브렉시트 등 통상 환경의 불확실성과 함께 반도체 시황 악화, 국제 유가 하락 등 글로벌 시장의 변동성이 커지는 상황에서 무역업계와 정부, 지원기관이 함께 수출 활력 제고 방안을..."
1712,2019.01.27.,작년 항공여객 '역대 최고'…'인천 2터미널·평창올림픽' 영향,"진현환 국토부 항공정책관은 ""국제유가의 급등락, 사드 제재 영향 등에도 불구하고 지방공항의 해외노선 확대, LCC의 항공노선 다변화, 평창 동계올림픽 개최 등의 영향으로 항공여객이 역대 최고실적을 달성했다..."
1713,2019.01.31.,"현대重지주, 지난해 영업이익 8686억원…""자회사 실적 개선""",4분기 영업이익은 현대일렉트릭이 흑자전환을 실현했으나 현대오일뱅크가 국제유가 급락에 직격탄을 맞아 재고손실을 반영해 1753억원의 영업손실을 기록했다. 현대중공업의 4분기 매출은 3조7110억원으로 조선부문...
1714,2019.01.28.,에쓰오일 지난해 영업익 6806억...전년比 50.4%↓,4분기 매출은 국제유가 하락으로 전분기 대비 4.5% 감소했다. 영업이익은 유가 급락에 따른 대규모 재고 관련 손실(-3910억원) 영향이 컸다. 에쓰오일의 2018년 4분기 사업부문별 실적은 △정유 매출 5조3030억원...
1715,2019.01.29.,"[ET투자뉴스]S-Oil, ""1분기 흑자전환!…"" BUY(유지)-유진투자증권","정유사업부는 현 수준의 낮은 정제마진을 가정해도 1분기 국제유가 상승으로 재고평가이익이 증가해 영업이익 323억원(흑전qoq)이 예상된다""라고 밝혔다. 한편 ""최근 미국 정유사의 가동률 상승, 휘발유..."
1716,2019.01.25.,'마두로 퇴진' 베네수엘라 반정부 시위 사망자 26명으로 늘어,현재 베네수엘라는 국제유가 하락 속에 미국의 경제제재가 더해져 초래된 극심한 식량난 등 경제위기와 정국혼란을 못 이겨 많은 국민이 해외로 탈출하는 상황이다. 마두로는 작년 5월 치러진 대선에서 68% 득표율로...
1717,2019.01.25.,반도체 부진 등으로 지난달 수출액지수 3.3%↓…15개월 만에 첫 하락,국제유가 상승 영향으로 교역조건이 13개월 연속으로 악화했다. 한국은행이 25일 발표한 ‘2018년 12월 무역지수 및 교역조건’을 보면 지난달 순상품교역조건지수(2010=100)는 92.65로 1년 전 같은 달보다 6.8...
1718,2019.01.29.,`마두로 퇴진시위`에 35명 사망·850명 체포…8명 불법 처형,현재 베네수엘라는 국제유가 하락 속에 미국의 경제제재가 더해져 초래된 극심한 식량난 등 경제위기와 정국 혼란을 못 이겨 많은 국민이 해외로 탈출하는 등 총체적 난국에 빠진 상황이다. 마두로 대통령은 지난해 5월...
1719,2019.01.24.,"이주열 한은 총재 “집값 안정, 소비여력 높여”",이어 그는 “반도체 경기가 하반기가 되면 회복될 것이라는 전망이 우세한 상황이고 국제유가가 지난해보다 상당폭 하락했다”며 “올해 비교적 큰 폭의 경상수지 흑자를 유지할 것으로 전망되기 때문에 과도하게 우려할...
1720,2019.01.22.,허세홍 사장의 실험…GS칼텍스 주유소 LG전자와 만난다,GS칼텍스는 정유사업 비중이 67%(2017년 기준)에 달해 국제유가 급등락에 따라 수익이 좌우되는 한계를 가지고 있기 때문이다. 구 회장 역시 같은 고민을 가지고 있다. LG가의 장자승계원칙에 따라 잡음없이 경영권 승계를...
1721,2019.01.25.,"마두로 vs 과이도, 혼돈의 베네수엘라…파워게임 시작한 美-러(종합)",전날 국제유가는 베네수엘라의 혼란이 심화하면서 시장의 공급과잉 우려가 줄어 반등했다. 뉴욕상업거래소(NYMEX)에서 3월 인도분 서부 텍사스산 원유(WTI)는 배럴당 1.0% 상승한 53.13달러에 거래를 마쳤다. 블룸버그통신은...
1722,2019.01.30.,2018년 울산항 물동량 2년 연속 2억톤 달성…최대기록,"하반기에는 국제유가의 하락, 철강쿼터제등 외부환경의 영향으로전년 실적을 경신하지 못할 것으로 예측됐다. 하지만 신규항로 개설과 공컨 수급의 원활화를 통한 컨테이너 화물의 최대실적 경신과 자동차..."
1723,2019.01.23.,"정유사, 수출산업 우뚝… ""작년 '5억배럴' 사상 최대""","수출액 역시 국제유가 및 단가 상승에 힘입어 2017년대비 약 33% 증가한 약 399억6000만 달러를 기록, 400억 달러에 육박했다. LG화학, 롯데케미칼 등 석유화학업체의 부생유 및 LPG 수출과 SK가스, E1 등 가스업체의..."
1724,2019.01.24.,[한은 금리동결]다시 하락한 물가...연중 금리동결로 가나?(종합),"이주열 한은 총재도 지난 2일 기자들과의 신년 다과회에서 최근의 국제유가 하락을 언급하며 ""물가는 생각보다 더 낮아질 수 있다""고 언급했다. 시장에서는 이를 완화적 통화정책을 유지하겠다는 의지의 표현으로..."
1725,2019.01.12.,휘발유가격 10주 연속 하락…서울도 1200원대 등장,10월 다섯 째 주까지 18주 연속 상승하면서 리터당 1690원까지 올랐던 휘발유 가격은 유류세 인하조치와 함께 국제유가 하락과 맞물려 대폭 떨어졌다. 지역별로는 최고가 지역인 서울의 휘발유 가격이 전주보다 18....
1726,2019.01.24.,"오늘 금통위, 韓銀 올 성장전망 낮출까?…금리는 동결 유력","이주열 한은 총재는 이달초 신년 간담회에서 ""지난해 10월부터 국제유가가 많이 떨어져 물가 상승률은 생각보다 더 낮아질 것""이라고 하향 조정 가능성을 시사한 바 있다. 금리동결 가능성은 기정사실화된 분위기다...."
1727,2019.01.19.,휘발유값 1천348원 34개월만에 최저치…하락폭은 11주만에 최소,"8원을 기록했습니다. 석유공사는 ""국제유가는 중국의 경기부양책 기대감 고조 등으로 인해 상승했지만 국내 제품 가격은 기존 국제유가 하락이 시차를 두고 반영되기 때문에 약보합세를 보일 것""이라고 전망했습니다."
1728,2019.01.24.,베네수엘라 정국 대혼돈···마두로 재임 13일만에 퇴진위기,마두로 대통령은 국제유가 하락 속에 미국의 경제제재가 더해져 초래된 극심한 식량난 등 경제위기와 정국혼란을 못 이겨 많은 국민이 해외로 탈출하는 가운데 지난 10일 두 번째 6년 임기를 시작했다. 마두로는 작년 5월...
1729,2019.01.25.,"집값 전망, 최저치로 하락…소비심리 여전히 '비관적'","농·축·수산물 가격 오름세가 둔화하고 국제유가가 하락한 영향이 반영된 것으로 풀이된다. 향후 1년간 소비자물가 상승에 영향을 미칠 주요 품목(복수응답)으로는 '공공요금'(50.0%), '농·축·수산물'(33.7%), '개인..."
1730,2019.01.25.,"집값 전망, 최저치로 하락…소비심리 여전히 '비관적'","농·축·수산물 가격 오름세가 둔화하고 국제유가가 하락한 영향이 반영된 것으로 풀이된다. 향후 1년간 소비자물가 상승에 영향을 미칠 주요 품목(복수응답)으로는 '공공요금'(50.0%), '농·축·수산물'(33.7%), '개인..."
1731,2019.01.26.,휘발유값 12주 째 하락… 34개월 만 최저치,휘발유 가격 하락엔 ‘정부의 유류세 인하’와 더불어 ‘국제 유가 하락’이 큰 역할을 했다. 한편 1월 넷째주 경유 가격은 리터당 1243.6 원을 기록했다. 1월 셋째주보다 2.3 원 하락했다.
1732,2019.02.01.,"뉴욕증시, 美 1월 고용 '서프라이즈' 상승 출발","국제유가는 상승했다. 3월물 서부텍사스산 원유(WTI) 가격은 전 거래일보다 0.78% 상승한 54.21달러에, 브렌트유는 1.0% 오른 61.45달러에 움직였다. 시카고상품거래소(CME) 페드워치에 따르면 연방기금(FF) 금리선물 시장은..."
1733,2019.01.21.,2년연속 6000억달러 달성위해 민관수출전략회의 가동,"성 장관은 “선진국 경기와 세계무역 성장세 둔화, 반도체 시황과 국제 유가 하락 등 대외 수출여건이 우리 수출에 부정적인 영향을 미치고 있어 이에 선제 대응하기 위해 민관 합동 총력 수출지원체제를 가동한다”고..."
1734,2019.01.17.,2월 국제선 유류할증료 또 내린다…최고 4만5천원→1만9천원,유가 하락에 새해들어 5계단↓…국내선 할증료도 4천400원→3천300원 국제유가 하락 영향으로 다음달 국제선 항공권 유류할증료가 이달에 이어 또 내린다. 이에 따라 국제선 항공권에 이동 거리에 따라 추가로 붙는...
1735,2019.01.19.,휘발유·경유 가격 인하폭 34개월만에 최저치 기록,석유공사는 “국제유가는 러시아 감산 이행 발언 및 중국 경기부양책 기대감 고조 등으로 인해 상승했다”며 “그러나 국내 제품 가격은 기존 국제유가 하락이 시차를 두고 반영됨에 따라 약보합을 보일 것으로...
1736,2019.01.27.,지난해 항공여객 역대 최대…국제선 LCC 비중 30%,"진현환 국토부 항공정책관은 ""국제유가 급등락, 사드 제재 영향 등에도 불구하고 지방공항의 해외노선 확대, LCC의 항공노선 다변화, 평창 동계올림픽 개최 등으로 항공여객이 역대 최고 실적을 달성했다""며..."
1737,2019.01.24.,"이주열 ""시장 시각, 실물 흐름보다 비관적…금리 인하 단계 아냐""","아울러 ""반도체 경기가 하반기가 되면 회복될 것이라는 전망이 우세한 상황이고 국제유가가 지난해보다 상당폭 하락했다""며 ""올해 비교적 큰 폭의 경상수지 흑자를 유지할 것으로 전망되고 있기 때문에 과도하게 우려할..."
1738,2019.01.25.,대통령 2명 ‘안갯속’ 베네수엘라…‘국제전’ 비화,주요 산유국인 베네수엘라의 정정 불안이 심화하면서 원유 공급이 줄 것이라는 전망에 국제유가는 상승했다. 미국이 베네수엘라산 원유에 대한 수출 제재를 가할 수 있다는 전망까지 나오면서 원유시장의 불확실성이...
1739,2019.01.24.,"KOTRA ""수출 총력체계 구축…2년 연속 수출 6천억 달러 달성 견인""","중동의 경우 국제유가 변동성 확대와 국제정세 영향 등으로 수출 감소가 예상되고 있다고 KOTRA는 전했습니다. 다만, 최근 세계 경제는 주요국 성장둔화, 신흥국 금융위기, 유가하락 가능성 등 하방요인이 가시화되고..."
1740,2019.02.01.,"GS칼텍스, 지난해 영업익 1조2342억원…전년比 38.3%↓",지난해 4분기에는 급격한 국제유가 하락에 따른 재고평가손실과 정제마진 둔화로 인한 수익성 악화로 부진한 실적을 보였다. 4분기 영업손실은 2670억원으로 전년 동기 영업이익 6281억원에서 적자전환했다....
1741,2019.01.24.,[His 스토리] 마두로 쫓아낼 36세 후안 과이도...'베네수엘라 다크호스',"1998년 빈민층의 지지를 받아 대통령으로 당선됐던 차베스 대통령은 국정을 안정시키기 보단 포퓰리즘 정책을 폈고, 국제 유가 하락으로 실업률과 물가는 폭등하며 경제성장률이 마이너스로 떨어졌다. 과이도 역시 이..."
1742,2019.01.29.,"'476조원의 남자' 사우디 왕세자, 살인배후 의혹에도 '화려한 복귀'","사우디는 국제 유가가 정점에 달했던 2011년 국내총생산(GDP) 성장률이 10%에 달했으나, 2017년에는 역성장(-0.7%)으로 추락했다. 유가가 어느 정도 회복한 올해도 2.6% 성장에 그칠 것으로 예상된다. 알 팔리 장관은 ""NIDLP는..."
1743,2019.01.24.,작년 한-러 교역 248억 달러…전년보다 31% 증가,"2014년 정점을 찍었던 양국 교역은 같은 해 터진 크림 사태와 서방의 대러 제재, 국제 유가 하락 등의 영향으로 2015년 160억 달러, 2016년 134억 달러로 크게 줄었었다."
1744,2019.01.12.,휘발유값 34개월만에 '최저'…하락폭은 점차 '축소',지난해 10월 다섯째주까지 18주 연속 상승하면서 리터당 1690원까지 올랐던 휘발유 가격은 국제유가가 40% 가까이 떨어진 영향과 맞물려 대폭 하락했다. 다만 유류세 인하 직후 7주 동안 휘발유 가격이 주당 평균...
1745,2019.01.28.,"S-OIL, 3년만에 분기 적자… 작년 영업이익도 '반토막'",지난해 4분기 급변한 국제유가로 인해 크게 손실을 보면서 연간 영업이익도 전년도보다 절반가량 축소됐다. 그나마 비정유부문이 흑자를 유지해 정유부문의 손실을 만회한 것으로 나타났다. S-OIL은 지난해 4분기...
1746,2019.01.29.,[Invest]현대중공업의 현대오일뱅크 지분 매각 손익계산서,"지난해 말 미국의 원유 생산 확대와 글로벌 경기침체에 대한 우려로 국제유가는 급락하기 시작했고, 이에 따라 정유사들의 정제 마진 또한 급격히 줄어들었다. 역마진 우려까지 나오자 정유업체의 주가도 급락했다...."
1747,2019.01.28.,"현대오일뱅크 영업익 41.9% 감소…""정제마진 줄었다""","80달러대이던 국제유가(두바이유 기준)는 지난해 10월부터 가격 급락이 시작돼 현재 50달러 대다. 유가가 떨어지면 기존에 정유사가 구매해 둔 원유 가치도 내려가 손실을 입게 된다. 업계 관계자는 ""정유업계 모두..."
1748,2019.01.21.,‘수출 경고등’ 켜졌다…연초 반도체 수출 29% 급감,"그러나 미·중 통상분쟁과 노 딜 브렉시트(No-deal Brexit, 영국의 조건 없는 EU 탈퇴), 반도체 시황 악화, 국제유가 하락 등 대외 불확실성이 커 목표 달성이 쉽지만은 않을 것으로 전망하고 있다. 산업통상자원부와..."
1749,2019.01.21.,"새해 수출 '경고음'…정부, 총력지원 '비상체제' 가동","최근 미‧중 통상분쟁, 노딜 브렉시트 가능성 등으로 통상환경의 불확실성이 높아진 데다 세계무역 성장세 둔화, 반도체 시황 악화, 국제 유가 하락 등 글로벌 시장의 변동성도 커지며 대외 수출여건이 악화하고 있다. 특히..."
1750,2019.01.23.,"정유업계, 지난해 석유제품 수출량 사상최대 경신…4억9399만 배럴",석유제품 수출액은 국제유가 및 제품수출단가 상승에 힘입어 2017년대비 약 33% 증가한 약 399억6000만달러를 기록해 400억달러에 육박했다. 이 같은 수출액 증가에 힘입어 석유제품은 산업통상자원부가 발표한 2018년...
1751,2019.01.24.,"이주열, 성장 눈높이 낮추며 금리인하설엔 선긋기",물가상승률 전망치가 낮아진 것은 국제유가 하락 등 공급 요인과 정부 복지정책 강화 등에 상당부분 기인한 것이라고 설명했다. 수요측 압력이 낮아진 것은 아니라는 의미다. 이 총재는 또 금융안정 리스크에 관해...
1752,2019.01.28.,"에쓰오일, 지난해 4분기 영업익 적자전환…RUC·ODC 설비가동 수익 기여 미미","매출액 6조8613억원, 영업손실 2924억원 국제유가 하락 여파로 정유부문 실적 악화 아시아투데이 = 에쓰오일의 지난해 4분기 영업이익이 국제유가 하락 여파로 적자 전환했다. 4분기부터 실적에 기여할 것으로..."
1753,2019.02.01.,"1월 소비자물가, 전년대비 0.8% 상승… 1년 만에 1% ↓","이는 국제유가 하락과 정부의 유류세 인하 조치 등에 따른 영향으로 보인다. 반면, 서민들의 체감도가 높은 외식비는 지난해 1월보다 3.1％ 상승해, 서민가계의 고민을 깊게 만들고 있다. 외식물가는 지난해 4월에..."
