,날짜,제목,요약
2019,2021.01.15.,"[해외시황] 뉴욕, 2조 달러 부양책에도 금리 불안에 하락",이런 가운데 국제 유가는 미국의 추가 경기부양 기대감에 상승했다. 이날 뉴욕상업거래소(NYMEX)에서 2월 인도분 서부 텍사스산 원유(WTI)는 전날보다 배럴당 1.3%(0.66달러) 오른 53.57달러에 거래를 마쳤다. 런던...
2020,2021.01.19.,"세계증시, 옐런 연설·기업 어닝 기대감에 상승",3% 상승 중이다. 상품시장에서는 경기부양에 힘입어 석유수요가 회복할 것이라는 기대에 국제유가가 상승 중이다. 간밤 6주 만에 최저치까지 내렸던 금 현물 가격은 온스당 1843달러로 0.3% 반등 중이다.
2021,2021.01.13.,"뉴욕증시, 美부양책 기대에도 금리 상승 부담 혼조 출발","국제유가는 상승했다. 2월물 서부텍사스산 원유(WTI) 가격은 전 거래일보다 0.92% 오른 52.73달러에, 브렌트유는 1.04% 상승한 56.24달러에 움직였다. jwoh@yna.co.kr 본 기사는 인포맥스 금융정보 단말기에서 2시간 더 빠른 00시..."
2022,2021.01.23.,"나스닥, 3일째 사상 최고치…다우·S&P500은 하락 전환","국제 유가와 금값은 하락했다. 이날 뉴욕상업거래소(NYMEX)에서 3월 인도분 서부 텍사스산 원유(WTI)는 전날보다 배럴당 0.86달러(1.6%) 하락한 52.27달러에 거래를 마쳤고, 뉴욕상품거래소에서 2월 인도분 금은..."
2023,2021.01.21.,'바이드노믹스' 개막… 새 통상질서 기대감↑·친환경 규제 '양날의 검',국제유가도 꿈틀댄다. 지난해 국제유가는 코로나19 영향으로 원유 수요가 줄면서 급락했다. 하지만 한국은행은 지난 17일 내놓은 해외경제포커스 '최근 국제원자재 가격의 상승 배경 및 전망' 보고서에서 최근 유가 상승...
2024,2021.01.21.,"지난해 부산수출액, 최근 10년 중 가장 낮아","그러나 백신 보급에 따른 팬데믹 극복, 국제 유가의 완만한 상승, 작년 수출 급감에 따른 기저효과 등의 영향으로 올해 부산의 수출규모는 증가세로 전환될 것으로 예상한다. 김상래 한국무역협회 과장은 ""지난해..."
2025,2021.01.16.,"미국 증시, 경기 부양책 재료 끝…다우지수 0.57% 하락",국제 유가는 중국에서 코로나19가 재확산한다는 소식에 급락했다. 이날 뉴욕상업거래소(NYMEX)에서 2월 인도분 서부 텍사스산 원유(WTI)는 전날보다 배럴당 2.3%(1.21달러) 떨어진 52.36달러에 거래를 마쳤다. 런던...
2026,2021.01.22.,"주유소 휘발유 가격 9주째 올라, 리터당 전국 평균 1447.2원","1월 셋째 주(22일 제외) 평균 국제유가(두바이유 기준)는 직전 주보다 배럴당 0.4달러 내린 55.3달러로 집계됐다. 한국석유공사는 ""국제유가는 국제에너지기구(IEA)의 2021년 석유수요 전망치 하향조정과 코로나19..."
2027,2021.01.13.,기관 매수세에 장 초반 코스피 상승,서상영 키움증권 연구원은 “전일 미국 증시에서 국채금리가 안정세를 찾는 모습을 보이면서 기술주의 낙폭이 축소됐다”며 “달러 약세와 국제유가가 오름세가 나타나면서 외국인의 수급 부담이...
2028,2021.01.12.,펄펄 끓는 원자재 시장… 경기 반등보다 인플레 먼저 오나,국제유가는 서부텍사스산 원유(WTI) 기준으로 OPEC+(석유수출국기구와 10개 주요 산유국의 연대체)의 감산 영향까지 겹치면서 8일 종가 기준 52.24달러로 코로나19 발생 직전인 지난해 2월 24일(51.43달러) 이후 최고치를...
2029,2021.01.19.,"SK E&S, SK그룹 수소밸류체인 중심축 부상… 재무안정성은 부담","이미 코로나19 여파로 전력수요 감소, 국제유가 하락 등 비우호적 사업 환경이 지속되는 가운데 투자 확대와 대규모 배당 등으로 현금흐름이 악화했기 때문이다. 글로벌 신용평가사인 무디스는 SK E&S의 신용등급을..."
2030,2021.01.14.,"유가 하락, WTI 52.91달러…석유수요 회복 지연 우려","국제유가는 코로나19 확산 지속 따른 석유수요 우려, 미국 휘발유 재고 증가 등으로 하락했다. 다만 사우디 2월 공급물량 축소 등은 하락폭을 제한했다. 14일 한국석유공사에 따르면 13일(현지시간) 뉴욕상업거래소..."
2031,2021.01.20.,"[바이든 시대] 기업들, `자국우선주의` 큰 변화 없을 것…불확실성 감소는 긍...","여기에 바이든 정부의 친환경 정책이 국제유가를 상승시키고, 대규모 경기부양책으로 원·달러 환율이 가파르게 내려갈 수 있다는 분석도 나온다. 조선 기자재를 생산하는 A사는 ""매출의 80%가 수출용이어서 환율변동에..."
2032,2021.01.28.,"美바이든 대통령, 연방토지 원유 시추 금지 행정명령",국제유가 변동폭이 미미하다. 보합세 기조가 유지되고 있다. 석유공사에 따르면 27일 거래된 브렌트 가격은 전 날 대비 배럴당 0.10불 떨어진 55.81불을 형성했다. WTI와 두바이유는 올랐는데 그 폭은 무시할 만한...
2033,2021.01.15.,"정유 4사, 4분기에도 '고난의 행군'…낮은 정제마진이 발목",◆ 정제마진 1.4 달러서 지지부진…국제유가는 상승세 정유 4사의 실적 부진의 배경에는 회복하지 못하고 있는 정제마진이 자리하고 있는 것으로 분석된다. 이달 첫째 주 싱가포르 복합정제마진은 배럴당 1.4달러에...
2034,2021.01.13.,"WTI,1.8%…사우디 감산·달러약세에 상승 마감",김나래 특파원=국제 유가가 12일(현지시간) 사우디 감산과 미국 달러화 약세에 힘입어 상승했다. 원유 배럴 [사진=로이터 뉴스핌] 이날 뉴욕상업거래소(NYMEX)에서 2월 인도분 서부 텍사스산 원유(WTI)는 전 거래일 대비...
2035,2021.01.20.,원전 5기 가동 중단 예고…전기요금 '널뛰기' 우려,특히 지난해 전기요금 개편에 포함된 연료비 연동제가 올해부터 도입됨에 따라 최근 오름세로 전환한 LNG 가격 등 국제유가가 반영될 경우 발전 단가 인상이 불가피할 것으로 보인다. 20일 한국수력원자력에 따르면...
2036,2021.01.11.,"2020년 CPI 2.5% 상승, 3년째 2%대 유지",전문가들은 국제 유가와 구리를 포함한 비철금속 가격 상승에 더해 지난해 PPI 상승률이 낮았던 기저효과로 인해 올 상반기 PPI는 전년 동기 대비 상승세를 이어갈 것으로 전망했다. [사진=국가통계국] 중국의...
2037,2021.01.17.,"한은 ""원유 등 국제 원자재 가격 계속 오를 것""","이어 한은은 ""특히 국제 유가는 OPEC+(석유수출국기구와 10개 주요 산유국 협의체) 감산, 미국 셰일 생산 둔화 속에서 향후 원자재 가격 상승을 주도할 것""이라고 덧붙였습니다. 비철금속과 곡물 가격의 상승 압력도 상당..."
2038,2021.01.14.,"미 주가, 혼조세로 마감","국제유가는 미국의 원유 재고가 크게 감소했음에도 불구하고 코로나19로 인한 수요 감소 우려로 하락했다. 미 서부텍사스원유 2월 인도분은 배럴당 52.91달러에, 브렌트유 3월 인도분은 56.06달러에 거래됐다 (사진..."
2039,2021.01.14.,월가 달구는 인플레 논쟁… 저금리 시대 짧아지나?,"지난해 저물가에 따른 기저효과, 국제유가 상승 등 공급 측 물가 상승 압력도 있는 상태다. 인플레이션 압력이 예상보다 커지면 연방준비제도(Fed)의 테이퍼링(양적완화 축소) 시기가 더 빨라질 수 있다는 전망이..."
2040,2021.01.13.,"美 증시, 금리 급등 부담에도 부양책 기대감에 상승 [뉴욕증시]","오늘 국제유가 상승에 힘입어 에너지 섹터가 3.5% 급등했고, 전날 부진했던 소비재 섹터가 1.3% 반등이 나왔습니다. 이 밖에 자재와 금융, 산업주도 1% 넘게 올랐는데요. 반면 커뮤니케이션 섹터와 헬스케어 섹터는 1% 넘게..."
2041,2021.01.25.,금호리조트 품는 박찬구 이번에도 '선택과 집중' 통할까?,"여기에 더해 장밋빛 전망과는 반대로 코로나19 백신에 따른 펜데믹 사태 종료, 국제유가 급등에 따른 석유화학제품 마진 악화로 금호석유화학의 올해가 그리 순탄하지만은 않을 것이라는 전망도 있다. 실제..."
2042,2021.01.20.,"[바이든 시대] 해외건설업계, 위기와 기회 공존","도스보카스 미국의 바이든 정부가 본격 시작되면서 미중 갈등으로 인한 국제유가, 친환경 정책 기조, 코로나19로 인한 경제 회복 등이 국내 건설업계의 해외수주 변수가 될 것으로 예상된다. 지난해 삼성엔지니어링이..."
2043,2021.01.19.,[스톡+ 데일리 픽] 오늘(19일)의 추천주는 SK·LG전자,"미국 뉴욕증시는 18일(현지시간) '마틴 루터 킹 데이(Martin Luther King Day)'를 맞아 휴장했다.미국의 흑인 인권운동가 마틴 루터 킹 주니어의 탄생을 기념하는 날로, 매년 1월 세 번째 월요일이다.국제유가와 금값..."
2044,2021.01.13.,[코스피 마감]개인·외인 동반 매수에 3100선 다지기,출처=마켓포인트서상영 키움증권 연구원은 “달러 약세 및 국제유가 상승 등 위험자산 선호심리가 높아지자 외국인의 현물 매도세가 축소되며 상승 전환했다“면서 ”상승 종목의 숫자가 더욱 많은 점도...
2045,2021.01.13.,[Asia마감]美부양책 기대감에 日닛케이 1.04% ↑,국제유가 상승도 투자 심리를 고조시켰다. 12일(현지시간) 뉴욕상업거래소(NYMEX)에서 2월 인도분 서부 텍사스산 원유(WTI)는 전 거래일 대비 0.96달러(1.8%) 오른 53.21달러로 거래를 마쳤다. 종가 기준 지난해 2월...
2046,2021.01.22.,'코로나19 팬데믹' 대전세종충남 수출 선방... 전국 평균보다 높아,"전국 평균 -5.4%와 비교하면 모두 양호한 실적을 나타냈다.글로벌 경기둔화 속에서 자동차 생산 감소로 부품 수출이 감소했고, 국제유가 인하에 따른 석유·화학제품 단가 하락으로 지역 수출 여건은 악재였다...."
2047,2021.02.04.,"[미국시장 서머리-2월4일]뉴욕증시, 기업 실적 주목 혼조 마감…다우 0.12% 상...","시장에서는 경기 부양책 규모나 도입 시기 등에 대한 불확실성이 여전하지만, 결국 추가 조치가 나올 것이란 전망이 지배적임.국제유가는 미 원유재고 감소 등에 상승. 뉴욕상업거래소(NYMEX)에서 서부 텍사스산..."
2048,2021.01.14.,픽업트럭도 고급화가 대세? 쌍용차 줄고 미국차 늘어,"등 대중 브랜드의 픽업트럭은 최근 차박 트렌드로 인해 인기를 끌고 있는 미니밴이나 대형 SUV와 경쟁 구도를 형성해 다소 불리할 수 있다""고 설명했다. 오아름 기자 or@autotimes.co.kr ▶ 재고 부담으로 국제 유가 하락"
2049,2021.01.15.,약발 없는 바이든 부양책…美증시 3대 지수 하락 마감,국제유가는 상승세를 나타냈다. 뉴욕상업거래소(NYMEX)에서 2월 인도분 서부 텍사스산 원유(WTI)는 전날보다 배럴당 1.3%(0.66달러) 오른 53.57달러에 거래를 마쳤다. 다우존스 마켓데이터에 따르면 종가 기준으로...
2050,2021.01.25.,"[더벨]에쓰오일, 9년만에 CFO 교체...배경은","1조원대 영업적자가 예상되는데, 이는 2014년 국제 유가하락으로 2897억원의 영업손실을 기록한 이후 처음이다. 현금창출력을 나타내는 에비타(EBITDA)는 코로나19로 마이너스로 전환한 지난해를 제외해도 2016년..."
2051,2021.01.26.,"[글로벌 마켓] 美증시, 나스닥 사상 최고치 경신…0.69% 상승 마감","발행을 통해 3조 7천억원 가량을 조달하자, 주가가 51% 폭등했습니다. ◇ 국제유가 국제유가는 오름세입니다. ◇ 원·달러 환율 원·달러 환율은 1100원 70전에 거래 마쳤습니다. (자세한 내용은 동영상을 시청하시기 바랍니다.)"
2052,2021.01.13.,"뉴욕증시, 소폭 상승…다우지수, 0.19%↑","국제 유가는 오르고 금값은 내렸다. 이날 뉴욕상업거래소에서 2월 인도분 서부 텍사스산 원유(WTI)는 전날보다 배럴당 0.96달러(1.8%) 오른 53.21달러에 거래를 마쳤고, 뉴욕상품거래소에서 2월 인도분 금은 온스당..."
2053,2021.01.21.,"2년 연속 감소세 보인 광주·전남 수출, “올해는 회복할 것”","올해는 2년 연속 감소했던 광주전남지역 수출실적이 세계 경기 회복세와 국제유가 반등, 코로나19 기저효과 등으로 회복할 것이라는 전망이 나왔다. 한국무역협회 광주전남지역본부가 1월 21일 내놓은 '2021 지역 수출입..."
2054,2021.01.13.,재정 부양책에도 금리상승 부담...뉴욕증시 '혼조세' 출발,"국제유가도 상승했다. 2월물 서부텍사스산 원유(WTI) 가격은 전 거래일보다 0.92% 오른 52.73달러에, 브렌트유는 1.04% 오른 56.24달러다. 【 청년일보=온라인뉴스팀 】 12일 뉴욕증시는 정부의 재정 부양책에도 불구 국채..."
2055,2021.01.15.,"뉴욕증시, 美 국채금리 오르자 하락…기술주 부진 [간밤 해외시황]","아메리칸에어라인과 보잉도 각각 5.86%, 1.30% 상승했다. 국제유가가 상승하고 하반기 회복기에 대한 기대가 높아지자 엑손모빌은 3.90% 뛰었다. 셰브론과 코노코필립스도 각각 2.40%, 1.79% 올랐다. 윤진우 한경닷컴 기자"
2056,2021.01.11.,美 국채금리 1%대 진입…3200 돌파한 코스피 랠리에 제동거나,"여기에 국제유가(WTI)가 배럴 당 50달러를 넘어 52달러까지 상승한 점은 오일 머니의 숨통을 트이게 할 수도 있고, 원자재 시장 전반으로 훈풍이 이어질 경우 자원 수출 신흥국들에 대한 시각도 좋아질 것이라고 봤다. 실제..."
2057,2021.01.20.,[WTI] 배럴당 52.98달러.. 전일비 +1.18%,"98달러로 전일 대비 1.18% 상승했다. 최근 5년 국제유가(WTI) 가격 일별 추이 (자료: 아이투자 인더스트리워치 서비스) [관련 기업] SK이노베이션, S-Oil, GS, 롯데케미칼, 금호석유, 대한유화, LG화학"
2058,2021.01.22.,131조로 불어난 한전 부채…경영효율 개선 급선무,"이 같은 추세의 주요 원인은 한전 본사 매각과 국제유가 등락이 꼽힌다. 한전은 2015년 서울 삼성동 본사 부지를 현대자동차그룹에 10.5조원에 매각, 대규모의 자금이 유입됐다. 또 에너지 가격 하락 등에 따른..."
2059,2021.01.13.,개인 순매수세에 코스피·코스닥 상승,"중심으로 낙폭이 커지자 주가 지수가 하락 전환하는 모습을 보이기도 했다""며 ""달러약세와 국제유가 상승 등 위험자산 선호심리가 높아지면서 외국인의 현물매도세가 축소돼 상승전환에 성공했다""고 말했다."
2060,2021.01.21.,2020년 12월 생산자물가 전월비 0.7%↑…공산품 중심 상승 - 한은,"한국은행 측은 ""국제유가 상승 등의 영향으로 공산품을 중심으로 생산자물가가 올랐다""고 설명했다. 전년 동월 대비로는 0.1% 올랐다. 9개월 연속 하락 후 상승 전환이다. 농림수산품은 축산물과 수산물이..."
2061,2021.01.18.,"정유4사, 4분기도 영업손실… 백신 접종 이후에나 반등 전망",정제마진 부진은 지속됐으며 국제유가의 극적인 반등도 찾아볼 수 없었다. 다만 코로나19 백신 접종이 본격화된 하반기 이후 수송용을 비롯한 석유제품 수요 회복으로 정유업계 실적 반등이 가능할 것이라는 관측이...
2062,2021.01.16.,"정부, 설 명절 대책 나온다... 집한제한 업종 소상공인 특별대출도","국제유가 상승 영향으로 공산품 생산자물가는 0.2% 올랐지만, 농림수산품이 배추 등 농산물(-4.5%)을 중심으로 1.6% 떨어졌다. 12월에는 최근 오름세인 일부 농림수산품의 생산자물가가 얼마나 영향을 미쳤을지 주목된다...."
2063,2021.01.11.,경기순환주 투자하던 월가 `미래에 투자하라`…뉴욕증시 바이든 효과 부각,"대표적으로 에너지 부문을 보면, 코로나19 백신개발에 따른 경기 회복 기대감 속에 국제 유가가 다시 회복세를 보이고 있지만 글로벌 자금은 단기 경기 순환을 넘어 중장기 ESG 부문으로 발걸음을 돌리는 분위기다...."
2064,2021.01.26.,"베트남 LNG발전소, 규제 등에 발목 잡혀…30건중 9개만 성사",이밖에 최근 코로나19 및 국제유가 상승에 따른 투자비용 및 발전비용 상승도 우려되는 대목이다. 최근 몇달간 아시아시장에서 LNG 수요가 늘면서 LNG 현물가격은 가파르게 올랐다. 이 같은 상승세는 코로나19에서...
2065,2021.01.18.,"1월2주 광물價 유연탄·우라늄·철광석↑, 구리 등 나머지↓","유연탄은 국제유가 상승과 중국, 인도의 수입증가에 따라 가격이 상승했으며 톤당 87.98달러로 전주대비 8.9% 올랐다. 우라늄은 파운드당 30.57달러로 전주대비 1.9% 상승했다. 철광석은 중국의 수입 증가에 따른 가격..."
2066,2021.01.20.,"뉴욕증시, 옐런 재무장관 경기부양 의지 확인 상승 출발","국제유가는 상승했다. 2월물 서부텍사스산 원유(WTI) 가격은 전 거래일보다 0.36% 상승한 52.58달러에, 브렌트유는 1.37% 오른 55.50달러에 움직였다. jwoh@yna.co.kr 본 기사는 인포맥스 금융정보 단말기에서 2시간 더 빠른..."
2067,2021.01.12.,"유가 보합, WTI 52.25달러…코로나 봉쇄조치 확산","국제유가는 코로나 19 확산에 따른 봉쇄조치, 달러지수 반등 등으로 하락했다. 다만 사우디 감산 등은 하락폭을 제한했다. 12일 한국석유공사에 따르면 11일(현지시간) 뉴욕상업거래소(NYMEX)의 미국 서부텍사스산원유..."
2068,2021.01.12.,"美 증시 ""너무 올랐나?""...고점 부담·정국 불안에 하락 [뉴욕증시]","유럽의 변이 바이러스 확산과 중국의 코로나19 재확산 등 전세계적으로 경제 봉쇄 조치에 대한 우려가 커지면서, 국제유가는 상승세가 꺾였습니다. WTI는 0.3% 내린 52달러 선에 거래됐고, 브렌트유도 0.8% 하락하고..."
2069,2021.01.14.,"""코로나發 충격타 '수출물가'마저 휩쓸었다""…수출물가 5.3%↓‧6년 만에 최대...",다만 지난달부터 국제유가 상승 영향으로 6개월 만에 다시 오름세로 전환했다. 2020년도 9~12월 '수출물가지수' 등락률. 자료=한국은행 14일 한국은행이 발표한 수출입물가지수 통계에 따르면 지난해 12월...
2070,2021.01.28.,"백신 공급 지연 우려, 빅테크 실적 발표 임박...뉴욕 증시 급락 출발","76% 내렸다. 국제유가는 하락했다. 3월물 서부텍사스산 원유(WTI) 가격은 전 거래일보다 0.95% 하락한 52.11달러에, 브렌트유는 0.86% 내린 55.43달러에 움직였다. 【 청년일보=전화수 기자 】 보잉777X[사진=연합뉴스]"
2071,2021.01.13.,두 달 만에 9% 껑충…“기름값 2월까지 더 오를 듯”,"국제유가가 오르며 국내 기름값도 뛰는 건데 다음 달까지 계속 오를 것이란 전망입니다. 박정서 기자입니다. [리포트] 서울 양재동의 한 주유소. 운전자들은 그새 오른 기름값에 깜짝 놀랍니다. [주유소 이용 고객] ""좀..."
2072,2021.01.20.,슈퍼부양책·초장기채권·증세…‘바이드노믹스’도 본격화,"뉴욕 증시 주요 지수들은 옐런 지명자의 경기 부양 지지 발언 등에 힘입어 상승 마감했고, 국제 유가 역시 원유 수요 감소 전망에도 상승세를 나타냈다. 이른바 ‘바이든식 뉴딜’ 역시 본궤도에 오를 것으로 예상된다...."
2073,2021.01.14.,12월 수출물가 5개월 연속 하락…수입물가는 상승 - 한은,"국제유가가 상승하면서 광산품, 석탄및석유제품을 중심으로 수입물가가 상승했다고 한국은행 측은 설명했다. 두바이유가(월평균, 달러/bbl)는 2020년 11월 43.42달러에서 12월 49.84달러로 올랐다. 수입물가에서..."
2074,2021.01.21.,"한국무협, 대전·세종·충남 수출 코로나19에도 선방","2020년은 코로나19로 인한 글로벌 경기둔화 속에서 자동차 생산 감소로 인한 부품 수출 감소, 국제유가 인하에 따른 석유·화학제품 단가 하락 등 악재가 잇따랐지만, 2분의4분기 저점을 찍은 후 반도체와 컴퓨터..."
2075,2021.01.21.,정유사 대표들 코로나19에도 현장경영 박차…'조경목 대표' 톱,'후세인 알 카타니 S-OIL 대표'는 지난해 8월 30일 정기보수(TA)가 종료된 울산공장을 직원 격려차 방문해 국제 유가 급락과 코로나19로 인한 석유소비 감소로 역대 최악의 위기를 맞이한 S-OIL 직원들의 사기를 북돋웠다....
2076,2021.01.22.,[뉴욕증시 마감] 바이든 낙관론에 S&P·나스닥 '또' 사상 최고...다우는 '털썩...,국제유가는 미국의 원유 재고가 늘어났다는 소식에 주춤했다. 뉴욕상업거래소(NYMEX)에서 2월 인도분 서부텍사스산원유(WTI)는 배럴당 0.3% 내려간 53.13달러에 거래를 마쳤다. 런던 ICE 선물거래소의 3월물 브렌트유는...
2077,2021.01.16.,전국 주유소 휘발유 가격 8주 연속 상승...1월 2주 대구 휘발유 리터당 1천42...,국내 휘발윳값은 국제유가 상승세에 따라 지난해 11월 말부터 오르고 있다.전국 최고가인 서울 휘발유 가격은 전주 대비 10.0원 오른 ℓ당 1천515.0원을 기록해 전국 평균보다 75.7원 높았다. 대구는 ℓ당 1천425원을...
2078,2021.01.26.,"애플 실적 공개 '목전'...뉴욕증시, 혼조세 출발","국제유가도 하락했다. 3월물 서부텍사스산 원유(WTI) 가격은 전 거래일보다 0.08% 하락한 52.23달러에, 브렌트유는 0.09% 내린 55.36달러에 움직였다. 【 청년일보=전화수 기자 】 서울 강남구 신사동 애플 가로수길 매장..."
2079,2021.01.14.,"[해외시황] 뉴욕, 금리 진정·정치 불안 혼조 마감…다우 0.03%↓",국제 유가는 하락했다. 이날 뉴욕상업거래소(NYMEX)에서 2월 인도분 서부 텍사스산 원유(WTI)는 전날보다 배럴당 0.6%(0.30달러) 떨어진 52.91달러에 거래를 마쳤다. 지난해 5월 이후 가장 긴 6거래일 연속 상승세에...
2080,2021.01.14.,[주식경제] K-조선이 뜬다...수주 릴레이에 올해 전망도 '맑음'?,국제 유가 상승·환율 변동성...올해 조선업에 미칠 영향은? = 유가는 수주 및 주가와 밀접한 연관이 있다. 통상 조선주 주가의 70% 정도를 유가가 설명을 한다. 유가 회복은 올해 발주에 긍정적인 영향을 미칠 것이다....
2081,2021.01.13.,"코스피 방향전환 시작될까…""영향제한적, '숨고르기 장세'""","그러면서 ""이러한 변화는 오늘 한국증시의 변동성 축소기대를 높인다""며 ""더불어 중소형지수인 '러셀2000' 지수 1.77% 급등, 달러약세 및 국제유가 상승 등은 외국인 수급부담을 완화시킬 것으로 예상돼 지수반등..."
2082,2021.01.14.,"작년 12월 수출물가, 5개월째 내림세…전년 동월 대비 5.4%↓","국제유가 상승으로 석탄 및 석유제품(+10.9%)은 올랐으나 원/달러 환율 하락세가 이어지면서 컴퓨터, 전자 및 광학기기(-1.3%) 등이 내렸습니다. 두바이유는 배럴당 11월 43.4달러에서 12월 49.8달러로 올랐고, 원/달러..."
2083,2021.01.29.,[뉴욕증시 마감] '게임스톱 대전' 마무리에 강한 반등세...다우 300p↑,유럽도 반등세...국제유가·금값 하락 유럽 주요국 증시는 미국 고용지표 개선과 증시 반등세에 함께 오름세를 기록했다. 이날 독일 프랑크푸르트증시의 DAX30지수는 전날 종가 대비 0.33% 오른 1만3665.93으로...
2084,2021.01.21.,[채권-장전] 바이든 시대,국제유가는 3일 연속 오르면서 바이든 행정부의 경기부양에 대한 기대감을 나타냈다. 다만 유럽과 중국에서 코로나19 확산세가 강화됐다는 소식에 따른 수요 감소 우려로 상승폭은 제한됐다. 뉴욕상업거래소(NYMEX)...
2085,2021.01.23.,[뉴욕증시 마감] '바이든 허니문 끝?'...코로나19 추가 충격 현실 우려에 혼조...,국제 유가는 하락세를 보였다. 세계 최대 원유 수입국인 중국과 동남아시아 지역의 코로나19 재확산 상황과 미국의 원유 재고가 급증했다는 발표로 원유 수요 악화 전망에 압력을 가한 탓이다. 이날 미국...
2086,2021.01.18.,세계증시 하락... 바이러스 공포가 경제회복 기대 덮어,4% 오르고 있다. 반면 국제유가는 유럽과 미국 등 봉쇄조치 강화에 차익실현 움직임까지 나타나 하락하고 있다. 가상화폐 대표 격인 비트코인은 이날 3만6236달러로 1.2% 상승 중이다.
2087,2021.01.13.,[개장] 코스피 3120선 소폭 상승 출발… 코스닥도↑,"이어 ""더불어 중소형 지수인 러셀2000지수 1.77% 급등, 달러 약세 및 국제유가 상승 등은 외국인 수급 부담을 완화 시킬 것으로 예상돼 지수 반등 가능성을 높인다""며 ""특히 CES 영향 등을 감안해 최근 부진했던 코스닥..."
