,날짜,제목,요약
1400,2019.06.25.,소비심리자심리지수 두 달째 하락...'집값 상승' 전망 늘어,"물가수준전망 CSI(143)는 국제유가 하락 등으로 인해 지난달보다 2포인트 떨어졌다. 물가인식 및 기대인플레이션율은 각각 2.2%, 2.1%로 한 달 전 대비 0.1%포인트씩 하락했다. 향후 1년간 소비자물가 상승에 영향을 미칠..."
1401,2019.07.05.,미국의 『다국적 호르무즈 해협 감시/호송 프로그램』 제안,"따라서 이곳에서의 항행의 자유 보장은 중동 석유 수입국만이 아닌, 국제유가에 영향을 주어 세계 경기를 좌우하는 전략적 관건이 될 수 있다. 그러나 미국이 제안한 다국적 센티널 프로그램에 대해..."
1402,2019.06.17.,7월 국제선 유류할증료 한 단계 내린다…최고 6만 1천 원→4만 9천 원,▲ 이륙 준비하는 대한항공 비행기 국제유가 하락 영향으로 다음달 국제선 항공권 유류할증료가 3개월 만에 한 단계 내립니다. 이에 따라 국제선 항공권에 이동 거리에 따라 추가로 붙는 유류할증료는 다음 달...
1403,2019.06.16.,[주간전망]6월 FOMC 눈치보기 예상…종목장세 지속,"미국에서는 최근 경기지표 부진과 예상치를 밑도는 물가, 국제유가의 하락 등이 이어지고 있다. 중앙은행 입장에서 보면 금리인하 가능성을 열어둘 수 있는 환경이 조성된 셈이다. FOMC에서 점도표(dot plot)와..."
1404,2019.06.25.,"금리 인하 시그널… 이주열 총재 ""상황따라 적절히 대응"" 재차강조","올해 물가 상승률이 크게 둔화한 것은 수요측 물가 상승 압력이 약화한 가운데 국제유가, 농축산물 가격 등 공급측 요인과 정부의 복지정책 강화에 따른 물가 하방 압력이 증대됐기 때문이다. 이 총재는 ""수요 측면에서..."
1405,2019.06.18.,기업 성장·수익·안정성 모두 악화,한은 관계자는 “2016년 3분기는 국제유가 하락이 매출 감소로 이어졌다면 올해 1분기는 반도체 가격 하락과 출하 감소가 가장 큰 영향을 줬다”고 설명했다. 한은 1분기 3333곳 조사 매출 10분기 만에 역성장...
1406,2019.06.27.,"[Hot-Line] ""S-Oil, 2분기 적자 전환 예상""…목표가↓","정제마진의 약세가 이어지는 가운데 분기 말 국제유가가 하락한 영향으로 재고평가손실까지 발생할 것으로 예상돼서다. 석유화학 부문에 대해 황유식 연구원은 ""지난 3월부터 시작된 PX 설비 정기보수가 다음달까지..."
1407,2019.07.05.,"광물공사, 주요 광물가격 동향(6월 4주차)","2% 감소했고, 전기차 배터리 증산기조도 이어지면서 가격 상승요인으로 작용 ◈유연탄: 국제유가 상승에도 불구, 인도의 증산에 따른 가격 하락 (가격)톤당 67.05 달러로 전주 대비 2.2%하락 (동향)국제유가 상승에도..."
1408,2019.06.29.,"휘발유 1501원·경유 1363원, 4주 연속 하락","7원 하락한 1415.1원, 최저가 정유사는 SK에너지로 5.6원 내린 1361.8원을 기록했다. 국제유가는 미 원유재고 및 원유생산 감소, OPEC+ 감산 연장에 대한 기대감 등의 영향으로 상승했다."
1409,2019.06.28.,[뉴욕증시] 미-중 정상회담 결과 기다리며 혼조...다우만 하락,"여기에 오늘 국제유가도 G20와 오펙의 산유량 결정 회담 등 굵직한 이벤트들을 앞두고 보합권에서 거래됐습니다. WTI는 0.1% 상승한 59.43달러에 거래됐구요, 브렌트유는 0.1% 상승한 66.55 달러에 거래되고 있습니다...."
1410,2019.06.29.,4주 연속 하락..서울 평균 휘발윳값 1600원 아래로,"최저가 정유사는 SK에너지로 5.6원 내린 리터당 1361.8원에 휘발유를 공급했다.국제 유가는 미국 원유 재고와 원유 생산 감소, OPEC(석유수출국기구) 감산 연장에 대한 기대감 등의 영향으로 상승했다.국제 휘발유..."
1411,2019.06.21.,[데일리 국제금융시장] 금리 인하 기대감에 상승,국제유가는 미국과 이란 간 충돌 우려에 급등했다. 이날 뉴욕상업거래소(NYMEX)에서 7월 인도분 서부 텍사스산 원유(WTI)는 전날보다 배럴당 5.4%(2.89달러) 뛴 56.65달러에 거래를 마쳤다. 이는 올해 들어 하루 기준으로...
1412,2019.07.03.,"성장률 전망 하향... 원화환율 상승 지속, 엔화환율 하락",국제유가는 미국의 석유비축량 감소로 아시아시장에서 소폭 상승했다. 브렌트유는 배럴당 62.50 달러로 0.16% 올랐고 미국산원유는 56.46 달러로 0.37% 상승했다. 미국석유협회(API)는 지난주 미국의 석유비축량이...
1413,2019.06.14.,5월 수출입물가 나란히 2%대 상승…환율 오른 영향,"국제유가는 내렸으나 환율 영향으로 수입물가도 오른 것으로 풀이됐습니다. 원재료는 1.4%, 중간재는 2.4% 상승했습니다. 자본재와 소비재는 각각 3.4%, 2.6% 올랐습니다. 품목별로 보면 원유가 1.4%, 철광석이 3.7..."
1414,2019.07.04.,"[ET투자뉴스]오전중 조정, 오후들어 반등","70%) ◈ 국제유가 반등, 정유주 상승세 S-Oil(+4.33%),GS(+2.18%),SK이노베이션(+5.86%) ◈ 인보사 미국 임상3상 재개 계획에 코오롱그룹주 낙폭 축소 코오롱(-1.91%),코오롱우(-0.88%),코오롱생명과학(-0.42%),코오롱인더(+0.55..."
1415,2019.06.27.,"아시아나항공(020560) 종목알파고 분석, 외국인/기관 실시간 수급과 추가 매수...","국제유가 상승으로 인한 유류비 증가, 마일리지 이연수익 및 항공기 정비 충당부채 추가설정 등 영업외 손익감소 영향으로 영업이익, 당기순이익이 큰 폭으로 감소함. ◆알파고 상세 분석 - 미래주가 분석 알파고의..."
1416,2019.07.03.,"[증시브리핑] 뉴욕증시, 美·EU 무역갈등에 상승세 ‘주춤’",◇ 국제유가 국제유가는 오늘 크게 내렸습니다. 산유국들은 내년 3월까지 감산 조치를 연장하기로 합의했는데요. 감산 연장에도 불구하고 수요 둔화를 우려하는 목소리가 여전해 급락한 것으로 보입니다. WTI 4.8...
1417,2019.07.02.,미국증시 '상승폭 확 축소'...G20효과 벌써 소멸?,"이날 국제 유가 흐름도 마찬가지였다. 미국증시가 시작될 무렵 국제 유가가 급등했다. 북해산 유가와 미국산 유가가 아시아 시장에서 2% 대 급등했고 미국, 유럽 시장 초반에도 유가 급등세는 이어졌다. 미국증시 장초반..."
1418,2019.06.18.,5월 금통위 금리인하 의견 2명…무게중심은 '지켜보자',"D금통위원은 ""국제유가, 환율 등 (물가) 상방 리스크도 병존하고 있다. 최근 부진한 경제상황과 향후 하방리스크에도 성장과 물가흐름은 지난 4월 전망에 부합하게 높아지는 방향으로 움직일 가능성이 크다""며 금리동결을..."
1419,2019.06.23.,도내 평균 휘발유값 3주째 하락세,"국제유가는 미국 원유재고 감소, 미국-이란 간 군사적 충돌 등의 상승요인과 함께 세계 석유 수요 증가세 둔화 전망 등 하락 요인이 혼재하면서 강보합세를 보였다. 박기원 기자 ⓒ경남신문. 무단 전재 및 재배포..."
1420,2019.06.19.,"KAIST, 지방산·바이오디젤 생산 가능한 미생물 개발",특히 우리나라의 경우 석유를 전량 수입에 의존하기 때문에 국제 유가 변동에 매우 취약해 환경문제를 해결하고 원유를 대체하기 위해 지속 가능한 바이오 기반 재생에너지의 생산이 필수다. 따라서 재생 가능한 자원...
1421,2019.07.04.,EIA 원유재고 109만 배럴 감소…WTI 상승 폭 축소,원유 재고가 시장 예상보다 덜 줄어들면서 국제유가는 상승 폭을 줄였다. 마켓워치에 따르면 서부텍사스원유(WTI)는 지표 발표 직후 배럴당 56.57달러에 거래됐다. 지표 발표 전에는 56.94달러에 거래됐다. jwoh@yna.co....
1422,2019.07.05.,"신개념 차테크 '엘림모터스' 자동차 전세 서비스, 비용 부담은 줄이고 안전성...",국제 유가 상승에 따라 전국 주유소 휘발유 평균 가격이 리터 당 1600원을 돌파했다. 치솟는 기름값에 차량 유지 조차 힘든 요즘 많은 사람들이 택하는 차량 활용 방법은 '차테크'다. 차테크란 차량의 원 금액을 모두...
1423,2019.06.22.,[뉴욕마감] 中슈퍼컴퓨터 제재+이란 전운…다우 0.1%↓,◇美동부 최대 필라델피아 정유시설서 대형 폭발 국제유가는 올랐다. 중동의 지정학적 불안에 미국 동부 최대 정유시설에서 대형 화재가 발생했다는 소식까지 겹쳤다. 이날 오후 3시42분 현재 뉴욕상업거래소(NYMEX)...
1424,2019.06.20.,5월 생산자물가 보합세…농수산품↓ 공산품↑,"농림수산품 가격은 출하량이 늘면서 내린 반면, 공산품은 국제유가 및 환율 상승에 올랐다. 20일 한국은행이 발표한 '2019년 5월 생산자물가지수'에 따르면 지난달 생산자물가지수는 103.73으로 전월(103.68)과 보합세다...."
1425,2019.06.30.,"울산 수출, 석달 연속 두자릿수 증가율","주요 품목별로는 석유제품의 수출은 국제유가 하락(△6.8%) 및 중국, 대만 등의 정제설비 증설에 따른 수출단가의 하락(△8.2%)에도 불구하고 수출물량이 크게 늘어나(15.4%) 수출액이 지난해 같은 달 대비 5.9% 증가한..."
1426,2019.06.12.,[데일리 국제금융시장] 中부양책에도 '약보합',국제유가 역시 보합권에 머물렀다. 뉴욕상업거래소(NYMEX)에서 7월 인도분 서부 텍사스산 원유(WTI)는 이날 배럴당 0.02%(0.01달러) 오른 53.27달러에 거래를 마쳤다. 런던 ICE 선물거래소의 8월물 브렌트유는 전날과 비슷한...
1427,2019.06.14.,중동서 유조선 2척 폭발 사고…어뢰 공격설 제기,"◀ 앵커 ▶ 어뢰 공격을 받았다는 의혹이 제기됐고, 국제 유가는 치솟았습니다. 남재현 기자입니다. ◀ 리포트 ▶ 11만톤급 유조선에서 검은 연기와 함께 화염이 솟아 오릅니다. 유조선에서 현지시간으로 어제 새벽 6시쯤..."
1428,2019.06.28.,"""셰일가스 혁명, 기업들에겐 재앙""",최근 국제유가가 하락하면서 올해 2분기 실적은 더욱 암울할 전망이다. 결국 셰일업계는 월가의 관심은 물론 신뢰마저 잃게 되면서 존폐의 갈림길에 놓였다. '셰일혁명의 꿈은 실패한 게 아니냐'는 인식이 월가를...
1429,2019.06.25.,"소비심리 두달째 악화…소비자 ""6개월 뒤 지출 현재보다 줄일 것""","물가수준전망 CSI(143)는 국제유가 하락 등 영향으로 지난달보다 2포인트 떨어졌다. 현재생활형편(91), 생활형편전망(92), 가계수입전망(97) 등 여타 경제상황 및 전망에 관한 CSI는 전월과 같거나 ±1포인트 내외의..."
1430,2019.06.18.,"반도체 호황에 웃던 기업들, 지금은 불황에 ‘울상’",한은 관계자는 “2016년 3분기에는 국제유가 하락이 매출 감소로 이어졌다면 올해 1분기는 반도체 가격 하락과 출하 감소가 가장 큰 영향을 줬다”고 설명했다. 수익성 지표도 나빠졌다. 영업이익이 줄어든...
1431,2019.06.30.,7월 국제 LPG가격 두달 연속 하락,8월 국내가격에 반영되는 7월 국제 LPG가격이 국제유가의 하향 안정세와 하절기 수요감소로 인해 두달 연속 하락했다. 사우디 아람코사가 발표한 8월 국제 LPG가격은 프로판이 톤당 375달러로 전월대비 톤당 55달러가...
1432,2019.06.19.,"KAIST, 지방산∙바이오디젤 생산 가능한 미생물 개발",특히 우리나라의 경우 석유를 전량 수입에 의존하기 때문에 국제 유가 변동에 매우 취약해 환경문제를 해결과 원유를 대체할 수 있는 지속 가능한 바이오 기반 재생에너지의 생산이 필수다. 따라서 재생 가능한 자원...
1433,2019.06.25.,6월 소비자심리지수 하락…소비지출 전망 악화,"한은은 ""소비자물가 상승률이 낮은 오름세를 유지하는 가운데 국제유가 급락 등으로 석유류제품 가격 상승 기대가 약화했다""고 말했다. 향후 1년간 소비자물가 상승에 영향을 미칠 주요 품목의 응답 비중으로..."
1434,2019.06.25.,미국의 고강도 제재…이란 “전쟁 갈망”으로 해석,미국의 초강경 대이란 제재와 이에 반발하며 전쟁 운운하는 이란의 반응에 국제유가는 24일(현지시간) 상승 압박을 받았다. 이날 뉴욕상업거래소(NYMEX)에서 8월 인도분 서부 텍사스산 원유(WTI)는 배럴당 0.80%(0.47달러)...
1435,2019.06.27.,전국 주유소 휘발유 가격 50일 만에 1400원대로 하락,올해 들어 국내 휘발윳값은 국제유가 상승과 이란산 원유 수입 금지 등의 영향으로 꾸준히 오르다가 유류세 인하 폭을 15%에서 7%로 조정한 지난 5월 7일을 기점으로 5개월 만에 1500원선을 돌파했다. 유류세 인하...
1436,2019.06.28.,전국 휘발유 가격 50일만에 1400원대 하락,올해 들어 국내 휘발윳값은 국제유가 상승과 이란산 원유 수입 금지 등의 영향으로 꾸준히 오르다가 유류세 인하 폭을 15%에서 7%로 조정한 지난 5월7일을 기점으로 5개월 만에 1천500원선을 돌파했다. 유류세...
1437,2019.06.15.,"'호르무즈 위기' 우리는?…""당장은 괜찮아""","당장 우리나라에 피해를 주는 건 없을 거라고 보지만, 장기적으로 국제유가가 어찌 될지 상황을 지켜보고 있습니다. 김수진 기자입니다. ◀ 리포트 ▶ 정부와 정유업계는 오만해 유조선 피격이 당장 국내 산업계에 미치는..."
1438,2019.06.26.,이주열 “0%대 물가상승”… 금리인하 시그널,물가상승률이 0%대였던 시기는 외환위기 직후인 1999년(0.8%)과 국제유가가 크게 떨어진 2015년(0.7%)뿐이다. 물가상승률이 한은 목표치보다 낮으면 금리를 인하할 여지가 커진다. 경기 진작을 위해선 일정 수준의...
1439,2019.07.02.,[외신브리핑] 트럼프 “중국과의 무역협상 이미 시작됐다”,"◇ 이란, 우라늄 저장한도 초과 중동에서는 긴장감이 고조되고 있어 국제유가를 자극할 것으로 우려되는데요. 이란이 저농축 우라늄 저장한도를 초과했다고 밝혔습니다. CNBC에 ""이란, 2015년 핵 합의 저장한도 위반 밝혀..."
1440,2019.06.24.,"""무역전쟁 악재에 올 수출·설비투자 6% 감소… 성장률도 2.4%로 둔화""","국제유가는 원유 수요 제한으로 연평균 기준 전년 대비 4.7% 하락한 배럴당 66달러 수준으로 예상했다. 원·달러 환율은 연평균 기준으로 1150원대로 봤다. 홍성욱 산업연구원 연구위원은 현재 경기 상황에 대해 ""수출 및..."
1441,2019.06.14.,원화 약세에 수출입물가 2%대 껑충,국제유가는 내렸으나 환율 영향으로 수입물가도 오른 것으로 해석된다. 두바이유를 보면 지난 4월에는 월평균 배럴당 70.94달러였던 것이 지난달에는 배럴당 69.38달러로 떨어졌다. 원재료는 광산품이 올라 1.4...
1442,2019.07.03.,미국증시 '외화내빈'...반도체 부진 속 FAANG이 증시 겨우 견인,"미-중 무역협상에 대한 회의적 시각, 미-유럽연합(EU) 무역분쟁 우려, 수요둔화 우려 속의 국제 유가 추락 등이 미국증시 투자자들을 신중하게 만들었다. 뉴욕증권거래소에 따르면 이날 뉴욕증시 3대 지수 중 우량주..."
1443,2019.06.26.,[원유마감]WTI 나흘 만에 하락…미국-이란 긴장 고조,국제유가가 25일(현지시간) 하락했다. 중동지역에서 미국과 이란의 긴장이 고조된 가운데 미국 텍사스원유(WTI) 선물은 나흘 만에 하락세로 방향을 바꿨다. WTI 선물은 배럴당 7센트(0.1%) 하락한 57.83달러를 기록했다....
1444,2019.06.25.,"이주열 한은 총재, 물가 충격에 스탠스 변화?","7%에 비해 상당 폭 낮아졌을 뿐만 아니라 물가안정목표인 2%를 크게 하회했다""며 이는 수출과 투자 감소와 소비 증가세  및 국제유가 하락에 따른 것이라고 밝혔다. 이에 따라 금년 중 소비자물가 상승률은 지난 4월..."
1445,2019.06.20.,[연합뉴스 이 시각 헤드라인] - 08:00,전문보기: http://yna.kr/FZR5fK-DA6p ■ 5월 생산자물가 전월대비 보합…유가↑·농산물↓ 국제유가가 상승했지만 농산물 가격이 하락하면서 5월 생산자물가가 전월 대비 보합을 나타냈다. 한국은행이 20일 발표한...
1446,2019.06.30.,"[그래픽뉴스] 미·중 무역분쟁 불확실성, 수출 마이너스 성장","석유화학은 북미 신증설 설비의 가동, 석유제품은 국제유가 하락과 대규모 정기보수 등으로 10% 안팎의 수출 감소세가 예상된다. 철강제품은 글로벌 수요 정체, 중국 생산 증가에 따른 단가 하락, 미국 등의 수입규제..."
1447,2019.06.26.,"""29일 트럼프-시진핑 만나… 무역협상 일단 휴전될 것""","캡테인은 그런 형세가 2011년 유로존(유로화 사용 19개국) 금융위기, 1980년대 중반의 국제유가 붕괴, '테킬라 위기'로 불리는 1990년대 중남미 외환위기와 강도가 비슷한 완만한 경기침체일 것이라고 전망했다. 씨티그룹도..."
1448,2019.07.03.,"정부, 올해 성장률 2.4~2.5%로 하향조정","세계경기 침체에 따른 국제유가 하락을 반영해서다. 한편 내년 실질 GDP 성장률은 올해 전망치보다 0.1∼0.2%포인트 높은 2.6%를 제시했다. 취업자 증가 폭은 20만명으로 올해 전망치와 같고, 소비(2.5%)·설비투자(2.8..."
1449,2019.06.27.,[뉴욕증시] 미-중 무역담판 앞두고 혼조...나스닥만 상승,"애보트랩 -1.52% 존슨앤존슨 -1.66% 브리스톨마이어 -1.86% 머크&컴퍼니 -1.99% 한편 오늘 국제유가, 지난 주 미국의 원유 재고가 1,279만 배럴 급감했다고 알려지며 상승폭을 확대했습니다. WTI는 2.7% 상승한 59.38 달러에..."
1450,2019.06.27.,[뉴욕증시] 미-중 무역담판 앞두고 혼조...나스닥만 상승,"애보트랩 -1.52% 존슨앤존슨 -1.66% 브리스톨마이어 -1.86% 머크&컴퍼니 -1.99% 한편 오늘 국제유가, 지난 주 미국의 원유 재고가 1,279만 배럴 급감했다고 알려지며 상승폭을 확대했습니다. WTI는 2.7% 상승한 59.38 달러에..."
1451,2019.06.25.,"[직문직답]소비자물가 상승률, 4년만에 0%대로 떨어지나","공급측면에서 보면 올해 들어 국제유가가 지난해 같은기간에 비해 3% 이상 하락했고 농산물 수급여건도 개선됐음. 정부정책측면에서는 일부 공공요금이 인상됐으나 무상교육 확대, 건강보험 보장성이 강화. 이러한 공급..."
1452,2019.06.25.,"박범계 ""한전, 수조원 이익날 때 서민전기료 인하했어야…공적기능 못했다""","한전의 적자 원인은 탈(脫) 원전 정책 추진이 아닌 국제유가 상승에 따른 것이라고 강조하기도 했다. 박 의원은 ""한전 적자는 국제유가의 영향이 절대적""이라며 ""(한전 적자를 이유로) 국민에게 안전한 에너지원비중을..."
1453,2019.06.17.,7월 국제선 유류할증료 인하…6만 1200원→4만 9200원,"다만 국제유가 영향에 따라 향후 변동될 가능성도 적지 않은 것으로 분석된다. 17일 항공업계에 따르면, 국제선 유류할증료는 현재 5단계에서 다음달부터 4단계로 한 단계 내려간다. 유류할증료는 싱가포르..."
1454,2019.06.25.,지속되는 경기 비관론…소비자심리 두달 연속 하락,"소비자물가상승률이 낮은 오름세를 유지하는 가운데 국제유가 급락 등에 따라 석유류제품의 가격 상승 기대가 약화된 영향이다. 지난 1년간 소비자물가 상승률에 대한 인식을 보여주는 물가 인식은 2.2%, 향후..."
1455,2019.06.26.,“충돌 불똥 맞을라”… 중동해역 피해 美로 뱃길 돌리는 유조선들,미국산 원유 수요 증가와 필라델피아 정유공장 화재 등으로 WTI 가격이 상승세를 타고 있는 반면 트럼프 대통령의 이란에 대한 군사 행동 철회로 국제유가 급등세는 진정되는 모습이다. 트럼프 대통령은 이날 트위터에...
1456,2019.06.25.,"중동 긴장감 고조, 복잡해진 투자자 셈법",국제유가는 혼조세였다. 이날 뉴욕상업거래소(NYMEX)에서 8월분 WTI(서부텍사스산원유)는 전 거래일보다 배럴당 32센트(0.56%) 오른 57.75달러에 거래를 마쳤다. 전문가들은 미국과 이란의 갈등이 장기화 될 가능성이 높다고...
1457,2019.06.28.,[뉴욕마감]G20 미·중 무역담판 불확실성…이틀째 혼조세,국제유가는 혼조세를 보였다. 이날 뉴욕상업거래소(NYMEX)에서 8월 인도분 서부텍사스산 원유(WTI)는 전날보다 배럴당 0.1%(0.05%) 상승한 59.43달러에 거래를 마쳤다. 런던 ICE 선물거래소의 8월물 브렌트유는 오후 3시 30분...
1458,2019.06.29.,전국 기름값 한달째 하락…서울 1600원선 하회,한편 국제유가는 지난주 미국의 원유재고가 대폭 감소했다는 소식과 미 동부 정제시설 폐쇄 결정 등으로 5주만에 최고 수준을 보였다. 미국 에너지정보청(EIA)은 지난주 미 원유 재고가 전주 대비 1280만배럴...
1459,2019.07.03.,경제 하반기 성장률(GDP) 하향 조정 & GDP/설비투자...소비-투자-수출 전망치...,"세계경기 침체에 따른 국제유가 하락을 반영해서다. GDP 성장률은 올해 전망치보다 0.1∼0.2%포인트 높은 2.6%를 제시했다. 미중 무역갈등 등 대외여건이 악화되면서, 투자와 수출이 어렵다는 판단에 따른 것이다. 취업자..."
1460,2019.06.21.,"“트럼프, 이란 공격 승인했다 철회”…페르시아만 긴장 파고 급상승",고조되며 국제유가 상승 일각선 “배럴당 150달러 돌파” 전망까지 도널드 트럼프 미국 대통령이 미군 무인정찰기(드론) 격추 소식에 이란에 대한 보복 공격을 지시했다가 돌연 취소했다고 미국 언론이 보도했다. 실제...
1461,2019.06.20.,[뉴욕마감]美 금리 동결에도 '비둘기 신호'에 안도…소폭 상승,국제유가는 이날 소폭 내렸다. 이날 뉴욕상업거래소(NYMEX)에서 7월 인도분 서부 텍사스산 원유(WTI)는 전날보다 배럴당 0.3%(0.14달러) 내린 53.76달러에 장을 마쳤다. 런던 ICE 선물거래소의 8월물 브렌트유도 오후...
1462,2019.06.16.,G20 에너지·환경장관 “중동 정세악화 우려…시장 안정화 노력”,미국과 이란의 갈등 속에 지난 13일 호르무즈해협과 가까운 오만 해상에서 2척의 유조선이 피격된 이후 국제유가는 오름세를 보이고 있습니다. 이번 G20 에너지·환경장관회의에서는 '혁신'을 주제로 환경보호와...
1463,2019.07.03.,LPG 가격 ‘세 자릿수’ 바겐세일…LPG 車 구매 심리 부채질 준비 완료,업계 한 관계자는 “국제유가가 내려가면서 LPG 가격도 자연스럽게 인하할 수 있었다”고 전했다. 지난 3월 LPG 차량 운행 대상이 모든 운전자로 확대되면서 필연적으로 수요가 급증할 것으로 예측된 바 있다. 이번...
1464,2019.06.21.,"지난해 대미 경상수지 흑자 247억달러, 6년 만에 최소",흑자 규모는 전년보다 174억3000만달러 늘었다. 국제유가 상승에 중동 지역에 대한 경상수지 적자는 435억4000만달러에서 620억8000만달러로 커졌다. 한경닷컴 뉴스룸
1465,2019.07.02.,[증시브리핑] 미중 무역전쟁 휴전…S&P500 사상 최고치,◇ 국제유가 미중정상회담 결과를 지켜보던 원유 시장인데요. 국제유가는 오늘 상승했습니다. 무역전쟁 휴전 소식에 이어 OPEC의 감산 정책이 9개월 연장될 예정인데요. 비OPEC 산유국들의 승인만 받으면 최종 확정될...
1466,2019.06.15.,"셰일 덕에 1등 산유국 된 美, '중동 콤플렉스' 벗어났다","이날 국제 유가의 기준이 되는 브렌트유는 2.2% 상승하는 데 그쳤다. 평소 등락률과 큰 차이가 없는 수준이었다. 이날 뉴욕 증시는 오히려 에너지 업종 강세로 소폭 상승하면서 마감하기도 했다. 뉴욕타임스(NYT)는 ""셰일..."
1467,2019.06.13.,"아베 이란 방문 중 일본 유조선 피격, 유가 3% 이상 폭등","공격 주체와 배경은 즉각 알려지지 않았지만, 중동의 긴장이 높아지는 가운데 서부텍사스유와 브렌트유 등 국제유가는 3% 이상 폭등했다. <로이터> 통신은 13일 호르무즈해협 오른쪽 오만만에서 유조선 2척이 의문의 공격을..."
1468,2019.06.17.,국제선 유류할증료 7월에 내린다…국내선은 동결,국제유가 하락 영향으로 다음달 국제선 항공권 유류할증료가 3개월 만에 한 단계 내린다. 이에 따라 국제선 항공권에 이동 거리에 따라 추가로 붙는 유류할증료는 다음 달 발권 기준 편도 최고 6만1천200원에서...
