,날짜,제목,요약
2442,2019.01.26.,26일 휘발유값 하락세... 평균 1344 원 대 형성,"국내 휘발유 가격이 국제 유가와 유류세 효과 등으로 가격 하락세를 보였다. 한국석유공사 유가 정보 서비스인 '오피넷' 에 따르면, 이달 26일 보통 휘발윳값은 -0.39원 떨어진 리터당 1344.88원으로 집계됐다...."
2443,2019.01.22.,"연초 수출 두 자릿수 감소…""범정부 컨트롤타워 가동""","성 장관은 “선진국 경기와 세계무역 성장세 둔화, 반도체 시황과 국제 유가 하락 등 대외 수출여건이 우리 수출에 부정적인 영향을 미치고 있어 이에 선제적으로 대응하기 위해 민관 합동 총력 수출지원체제를..."
2444,2019.01.12.,"뉴욕 증시, 소폭 하락 마감…다우 0.02% S&P 500 0.01%↓",미 뉴욕 증시는 11일(현지시간) 국제유가 약세와 이에 따른 에너지 관련 주식들의 하락으로 소폭 하락 마감했다. 이날 하락으로 S&P 500 지수는 5일 간의 연속 상승을 끝내고 6거래일 만에 하락세로 돌아섰다....
2445,2019.01.29.,막판 상승 전환한 코스피 2180선 회복…하락 기운 감돈 제약‧바이오株,서상영 키움증권 연구원은 “캐터필라 실적 부진으로 중국 경기 둔화 이슈가 재부각되며 국제유가가 하락하는 등 위험자산 선호심리가 약화된 점은 부담이다. 또 백악관에서 30~31일 있을 무역협상에 대해...
2446,2019.01.26.,"석유의 저주, 베네수엘라…네덜란드 병에 망한 경제","나라 경제는 국제유가의 등락에 경제가 좌지우지되고, 좌파가 집권하면서 국민들이 정부가 주는 복지에 만족하다가 외국 자본이 이탈하고 생활필수품을 수입할 돈이 바닥난 것이다. 원유 생산시설을 개수하거나..."
2447,2019.01.24.,"세계증시, 지표+무역+정치 악재와 성장우려로 투심 침체","국제유가는 경제성장 우려에 하락 중이다. 런던선물시장의 북해산 브렌트유 가격은 배럴당 60달러87센트로 0.4%, 미국 서부텍사스산원유(WTI) 선물 가격은 52달러38센트로 0.5% 각각 내리고 있다. 런던선물시장의 북해산..."
2448,2019.01.23.,"일본은행 총재 ""미중 무역마찰, 펀더멘탈에 영향 없어""(상보)","구로다 총재는 ""올해 물가 상승률 전망치를 하향 조정한 것은 국제유가의 하락을 반영한 결정""이라고 말했다. 그는 ""다만 유가 하락은 일시적일 것으로 보고 있다""면서 ""물가 상승률이 2%를 향해 견조하게 오르고 있어..."
2449,2019.01.28.,"현대오일뱅크, 작년 영업익 6천610억원…4Q 1천753억 적자","국제유가 하락에 따른 재고 관련 손실로 추정된다. 현대오일뱅크는 지난해 연결기준으로 매출 21조5천36억원과 영업이익 6천610억원, 당기순이익 4천38억원 등의 실적을 기록했다고 28일 공시했다. 매출은..."
2450,2019.01.15.,수출입물가 두 달 연속 동반 하락…환율·유가 영향,"국제 유가 하락으로 수입물가지수는 수출물가지수보다 더 큰 폭으로 떨어졌다. 12월 수입물가지수는 85.01로 11월(88.01)보다 3.4% 하락했다. 부문별로 원재료(6.6%), 중간재(2.7%)와 자본재(0.4%) 및 소비재(0.8%)가..."
2451,2019.01.29.,美 기업 실적부진에 원‧달러 환율 상승,서상영 키움증권 연구원은 “캐터필러 실적 부진으로 중국 경기 둔화 이슈가 재 부각되며 국제유가가 하락하는 등 위험자산 선호심리가 약화됐다”면서 “백악관에서 30~31일 있을 무역협상에 대해 대중국...
2452,2019.01.13.,부산 지난주 휘발유가 ‘전국 최저’,석유공사 측은 “국제유가는 위험자산 투자 심리 개선 과 미·중 무역협상의 긍정적 평가 등으로 상승했다”면서 “그러나 국내 제품 가격은 기존 국제유가 하락분 반영 등의 영향으로 약세를 보일 것으로...
2453,2019.01.25.,한러항로/ 러 ‘연휴여파’ 일시적 물동량 급감,취항선사들은 지난해 긴급유류할증료(EBS)를 부과했지만 최근 국제유가가 크게 떨어지면서 해상운임에 유류비를 포함하는 ‘올인레이트’를 받고 있다고 전했다. 국제유가가 더 떨어지게 된다면 유류비가...
2454,2019.01.11.,휘발유 값 10주 연속 하락…리터당 1355원,"석유공사 관계자는 ""1월 2주차에 국제유가는 위험자산 투자 심리 개선 및 미·중 무역협상 긍적적 평가 등으로 상승했다""며 ""하지만 국내 제품 가격은 기존 국제유가 하락분 반영 등의 영향으로 약세를 보일 것으로..."
2455,2019.01.15.,반도체 수출물가 5개월째 하락…플래시메모리는 14개월째 내리막,5% 떨어진 데 이어 두 달 연속 내렸다. 수입물가 2개월 연속 하락은 전년 11∼12월 이후 처음이다. 지난해 10월 배럴당 80달러 안팎까지 치솟았던 국제유가가 11월부터 아래로 방향을 틀며 수입물가를 끌어내린 모양새다.
2456,2019.01.29.,"S-Oil, 목표가 12만5000원 유지...전일종가 9만9000원 -하이투자證","▶ 4Q18 Review : 국제유가 급락으로 인한 재고평가손실로 어닝 쇼크 ▶ 1Q19/2019 Preview : 실적은 1Q19 부터, 업황은 2Q19 부터 턴어라운드 S-Oil은 지난해 4분기 연결기준 잠정 매출액이 6조8613억원으로 전년..."
2457,2019.01.25.,중남미항로/ 다시 회복하는 남미동안…춘절 분수령,100달러대의 부대운임을 제시한 선사도 있는 반면 최근 국제유가가 50달러대로 급락한 것을 반영해 할증료를 걷지 않는 선사들도 포착된다. 주요 선사들의 화물적재율(소석률)은 90~100%대를 기록했다. 하지만 일부...
2458,2019.01.29.,[모닝리포트] 예타면제 발표,"11%) - 미국이 중국 화웨이에 대한 기소를 추진, 미중무역협상과 관련된 캐터필라 주가하락, 엔비디아의 실적조정 등 악재체크 - 美증시의 조정세와 함께 국제 유가가 글로벌 경제 둔화 우려로 하락세(WTI -3.16..."
2459,2019.01.22.,"KCGI, 한진에 '유휴자산' 정리하라지만…기초체력 약화 우려도","한진그룹 관계자는 ""항공사는 비상상황에 대비해 한달간의 비축유는 물론 국제유가가 떨어질 때마다 항공유를 사면서 30%정도는 헤지수단을 활용하고 있다""며 ""KCGI가 연료비에 대한 20% 안팎의 헤지가 필요하다고..."
2460,2019.01.22.,"KCGI, 한진에 '유휴자산' 정리하라지만…기초체력 약화 우려도","한진그룹 관계자는 ""항공사는 비상상황에 대비해 한달간의 비축유는 물론 국제유가가 떨어질 때마다 항공유를 사면서 30%정도는 헤지수단을 활용하고 있다""며 ""KCGI가 연료비에 대한 20% 안팎의 헤지가 필요하다고..."
2461,2019.01.21.,"수출 활력제고, 민ㆍ관 손잡다","이번 회의는 미ㆍ중 통상분쟁, 노딜 브렉시트 등 통상환경의 불확실성과 함께 반도체 시황 악화, 국제 유가 하락 등 글로벌 시장의 변동성이 커지는 상황에서 무역업계와 정부, 지원기관이 함께 수출활력 제고방안을..."
2462,2019.01.21.,1월3주 유연탄·철광석 ↑···우라늄 하락,코레스에 따르면 유연탄은 국제유가 상승 및 공급 이슈에 따라 톤당 99.81달러로 전주대비 2.8% 가격이 상승했다. 국제유가 상승과 함께 중국과 인도의 수입 증가에 따른 가격 상승. 2018년 중국의 수입량은...
2463,2019.02.01.,해외건설 ‘新 실크로드’ 개척만이 살길,"국제유가 향방이 불확실한 상황에서, 글로벌 지정학적 리스크와 해외 업체 경쟁 등이 상존하고 있기 때문이다. 김 연구원은 “건설사의 해외 사업기조는 ‘현상 유지’비중이 다소 높지만, ‘적극적’ 또는..."
2464,2019.01.23.,"""지역난방공사, 열요금 인하요인 해소로 실적개선 기대""",열부문은 요금동결과 연료비 정산에 의한 인하요인이 반영되면서 연간 적자를 기록할 것으로 예상된다.국제유가는 지난해 11월부터 본격적으로 하락했다. 시차를 고려하면 국내 LNG 가격은 3월부터 하락할 것으로...
2465,2019.01.20.,지난해 中企 수출액 1146억달러···'역대최대',"국제 유가 상승에 따른 수출 단가 상승과 주요국 제조업 호황으로 2년 연속 수출 1위를 차지했다. 반도체제조용 장비 수출은 34.0% 늘어난 31억달러를 기록했고, 평판DP제조용 장비 수출은 68.0% 늘어난 30억달러를..."
2466,2019.01.24.,[한은 올 성장률 하향 조정] 정부 돈풀어 떠받친 성장… 수출둔화 장기화땐 버...,올해 실업률 전망치는 3.8%로 제시했다. 올해 소비자물가는 1.4% 상승할 것으로 전망했다. 지난해 10월(1.7%) 대비 0.3%포인트나 떨어뜨린 것이다. 이는 국제유가 하락세를 반영한 것이다.
2467,2019.01.16.,올해 상반기 수출 전망 기대와 우려 교차,"상반기 수출에 영향을 미칠 불안요인(복수응답)에 대해서는 국제유가의 불안정성과 인건비 상승 등에 따른 여파로 '원자재 가격 인상(29.0%)'이라는 응답이 가장 많았으며 이어서 '미-중 무역전쟁(26.9%)', '환율불안(17.2..."
2468,2019.01.28.,"[주간광물] 1월 4주 광물종합지수 전주 대비 0,8%P 상승",니켈·아연은 국제유가 상승 및 공급 이슈에 따라 가격이 상승했다. 구리는 하락했다. 중국의 경기지표 부진 및 미 연방정부 셧다운 장기화에 따른 금융시장 불안에도 불구하고 국제유가 상승세 지속과 광종별...
2469,2019.01.16.,"정유 4社, 4분기에 줄줄이 적자",2018년 국제유가 최고치와 최저치가 같은 분기에 나타나면서 정유사는 원유를 비싸게 사들여 정제한 뒤 싼값에 석유 제품을 파는 처지가 됐다. 여기에 휘발유 등 석유제품의 글로벌 공급 과잉으로 정제마진(석유제품...
2470,2019.01.25.,동남아항로/ ‘플로팅 FAF’ 도입 본격화…화주 예의주시,선사들이 올해부터 플로팅 FAF를 도입한 건 국제유가의 등락이 심각한 경영리스크로 작용했기 때문이다. 지난해 국제유가(두바이유)는 배럴당 60~70달러선을 오르내리다가 10월 한때 최고점인 84달러까지 치솟았다. 이후...
2471,2019.01.13.,반도체·중국 '양날개' 꺾인 수출…올해안에 회복 가능할까,"국제유가 하락세도 수출에 부정적 요인이다. 문병기 한국무역협회 수석연구원은 ""반도체와 유가, 중국 때문에 특히 1분기 수출이 많이 부진할 것으로 예상한다""며 ""작년 1분기 실적이 매우 좋았기 때문에 올해..."
2472,2019.01.16.,[원유마감]WTI 3% 이상 상승…中 경기부양책 기대감,국제유가가 15일(현지시간) 3% 이상 급등했다. 중국이 둔화한 경제에 대해 경기부양책을 실시할 것이라고 발표한 것이 유가에 호재로 작용했다. 서부텍사스원유(WTI) 선물은 1.60달러(2.8%) 급등한 배럴당 52.11달러를...
2473,2019.01.29.,"美, 베네수엘라 국영 석유기업 제재…WTI 반등(상보)",한편 미국의 제재 방침이 발표되면서 국제유가도 반등했다. 마켓워치에 따르면 3월물 서부텍사스원유(WTI)는 장 마감 이후 전자 거래에서 오후 4시께(미 동부시간) 기준 배럴당 52.18달러 수준으로 반등했다. WTI는...
2474,2019.01.17.,[투자의 창] 주가의 판단은 주관적이다,예를 들어 국제유가가 하락하면 대한항공의 주가 상승을 기대할 수 있으나 실제로 주가가 상승하더라도 반드시 그 요인 때문에 그랬다고 단정할 수는 없는 것이다. 투자자가 미처 알지 못한 다른 변수가 주가에 더 크게...
2475,2019.01.23.,"뉴욕증시, IBM 등 주요 기업 실적 호조 상승 출발","국제유가는 상승했다. 3월물 서부텍사스산 원유(WTI) 가격은 전 거래일보다 0.3% 오른 53.17달러에, 브렌트유는 0.34% 상승한 61.71달러에 움직였다. 시카고상품거래소(CME) 페드워치에 따르면 연방기금(FF) 금리선물 시장은..."
2476,2019.01.15.,"油價에 흔들린 현대상선, 유류비 관리 나섰다",작년 10월 중순부터 시작된 국제 유가 하락으로 벙커유 가격도 떨어진 상태다. 작년 10월 싱가포르 기준으로 L당 525달러까지 올랐던 벙커유 가격은 401달러로 23% 낮아졌다. 해운업계에서는 벙커유 가격 하락에...
2477,2019.01.15.,"S-Oil, 4Q 실적 정제마진 하락에 적자전환…목표가↓-IBK","함형도 IBK투자증권 연구원은 “4분기 매출액은 전년 동기대비 4.8% 감소한 5조5000억원, 영업손실은 1676억원으로 적자전환을 기록할 것”이라며 “정유사업 부문은 국제유가 하락의 여파가 금번 실적악화의..."
2478,2019.01.30.,혼돈의 원유 매장량 1위 베네수엘라..국내 휘발유 가격 하락 흐름 최대 악재,이로 인해 국제원유 수급 차질이 예상됨에 따라 국제유가는 상승세를 이어가고 있다.이와 연동해 국내 휘발유 가격 하락 흐름이 눈에 띄게 둔화를 보이고 있다. 업계에서는 휘발유 가격 하락이 바닥을 찍었고...
2479,2019.01.19.,휘발유값 34개월만에 최저치…리터당 1348원,"석유공사는 ""국제유가는 러시아 감산 이행 발언 및 중국 경기부양책 기대감 고조 등으로 인해 상승했다""면서 ""그러나 국내 제품 가격은 기존 국제유가 하락이 시차를 두고 반영됨에 따라 약보합을 보일 것으로..."
2480,2019.01.20.,지난해 中企 수출 1146억달러'역대 최대',플라스틱 제품의 수출은 6.1% 늘어난 55억달러로 국제 유가 상승에 따른 수출 단가 상승과 주요국 제조업 호황으로 2년 연속 수출 1위를 차지했다. 반도체제조용 장비(31억달러)와 평판DP제조용 장비(30억달러)...
2481,2019.01.22.,[이데일리N] 지난해 경제성장률 '6년래 최저'…4분기는 '깜짝성장' 外,"생산자물가 3개월 연속 ‘내리막’…“국제유가 하락 탓” 2. 지난해 경제성장률 ‘6년래 최저’…4분기는 ‘깜짝성장’ 3. 이 총리 “방송통신업계, 왜곡·조작 정보 바로잡아야” 4. ‘미분양 빨간불’ 반년 새 16..."
2482,2019.01.24.,투자부진에 수출까지 둔화…韓 경제 '첩첩산중',임금상승 등이 서비스 가격의 상승요인으로 작용하겠으나 수요측 물가상승압력이 크지 않은 가운데 국제유가 하락 등이 하방압력으로 작용하면서 완만한 오름세를 기록할 것으로 보인다. 식료품·에너지를 제외한...
2483,2019.01.25.,"실적공개 앞둔 정유업계, 4분기 적자 현실화","국제유가 폭락 등의 여파로 2014년 이후 4년만에 최악의 성적표가 예상되기 때문이다. 25일 업계에 따르면 SK이노베이션, GS칼텍스, 에쓰오일(S-Oil), 현대오일뱅크 등 국내 정유4사 가운데 상장사인 SK이노베이션과..."
2484,2019.01.15.,[원자재시황] 中 경기둔화 우려로 하락..WTI 2.1%↓,국제유가는 14일(현지시간) 중국의 경기 둔화 우려로 인해 하락 마감했다. 이날 뉴욕상업거래소(NYMEX)에서 2월 인도분 서부 텍사스산 원유(WTI)는 전 거래일보다 2.1%(1.08달러) 떨어진 50.51달러에 장을 마쳤다. 런던 ICE...
2485,2019.01.31.,[채권-장전] 美금리 2.6%대로 하락..예상보다 더 도비시했다는 평가받은 FOMC,국제 유가는 베네수엘라 정국 불안 재료로 2% 가까이 급등했다. 미국의 베네수엘라 제재 효과가 지속된 것이다. WTI 선물은 전장보다 배럴당 92센트(1.7%) 오른 54.23달러에장을 마쳤다. 올해 들어 연준의 금리인상...
2486,2019.01.21.,"성윤모 산업부 장관 ""민관 합동 총력 수출지원체제 가동""","성 장관은 이날 한국무역보험공사 대회의실에서 '민관 합동 수출전략회의'를 열고 ""선진국 경기 및 세계무역 성장세 둔화, 반도체 시황, 국제 유가 하락 등 대외 수출여건이 우리 수출에 부정적인 영향을 미치고 있다""며..."
2487,2019.01.24.,"조선3사, 유조선 수주가격 추가 상승 낙관 못해 예의주시",박무현 하나금융투자 연구원은 지난해 하반기부터 국제유가가 하락세를 보이는 데다 중고선 해체량이 늘고 있어 유조선 수요가 계속 증가할 것으로 분석하기도 했다. 유조선은 LNG운반선과 함께 한국 조선사들이...
2488,2019.01.31.,"""3대 호재 폭발""...미국증시, 반도체 · IT · 바이오 · FAANG '급등'",이날 미국 원유재고 증가세가 소폭에 그치면서 국제유가가 전날에 이어 또 오르자 미국증시 내 시가총액 비중이 큰 정유주들도 미국증시 상승을 거들었다. 쉐브론(+1.06%) 엑손모빌(+1.09%) 등의 주가가 상승했다....
2489,2019.01.25.,25일 휘발유값 하락세... 평균 1345 원 대 형성,"국내 휘발유 가격이 국제 유가와 유류세 효과 등으로 가격 하락세를 보였다. 한국석유공사 유가 정보 서비스인 '오피넷' 에 따르면, 이달 25일 보통 휘발윳값은 -0.19원 떨어진 리터당 1345.16원으로 집계됐다...."
2490,2019.01.21.,투자 안정성이 중요해진 올해 주목할 만한 금융상품은?,"아울러 국제유가 변동도 중요하다. 유가는 인플레이션 발생에 영향을 미치기 때문이다. 마지막으로 유럽의 정치, 경제 상황이다. 이로 인해 유로화가 영향을 받고 덩달아 달러 강세가 유발될 수 있다. 대구은행은 투자..."
2491,2019.01.19.,"휘발유 가격, 11주 연속 하락...전국 평균 리터당 1348원",한국석유공사 관계자는 “국제유가는 러시아 감산이행 발언 및 중국 경기부양책 기대감 고조 등으로 인해 상승했으나 국내제품가격은 기존 국제유가 하락이 시차를 두고 반영됨에 따라 약보합을 보일 것으로...
2492,2019.02.01.,국민연금이 주주권 행사할 경우 조양호 회장 체제는,대한항공이 지금 국제유가가 낮아 항공업계는 호시즌인데도 주가가 오르지 않는 이유는 갑질 논란 때문이라는 분석이 지배적입니다. 오너일가는 경영에서 물러나라는 여론이 충분히 형성됐다는 합리적인 이유가 있는...
2493,2019.01.23.,"정유사, '마진 회복' 총력…美·中 정기보수 호재",지난해 10월부터 급락했던 국제유가로 인해 작년 4분기 대규모 영업손실이 예상되는 상황이다. 정유사업의 수익성은 '정제마진(精製 margin)'과 직결된다. 정제마진(싱가포르 복합정제마진 기준)이란 수입하는 원유...
2494,2019.01.24.,"2019년 주력산업 기상도 “수출 둔화, 생산 부진, 내수 위축, 수입 증가”","2019년 수출은 세계경기 성장세 둔화로 인해 수출물량이 소폭 증가에 그치고, 반도체 가격 하락과 국제유가의 횡보 전망 등으로 수출단가도 하락 압력이 커지면서 연간 증가율이 2018년보다 낮은 3.7% 전망된다. 수입은..."
2495,2019.01.23.,[뉴욕마감]글로벌 경제 둔화 우려에 급락,국제유가도 세계 경제 성장 둔화의 우려로 큰 폭으로 하락했다. 이날 뉴욕상업거래소(NYMEX)에서 2월 인도분 서부 텍사스산 원유(WTI)는 전 거래일보다 배럴당 1.03달러(1.91%) 하락한 52.77달러에 거래를 마쳤다....
2496,2019.01.21.,[사설] 수출격감 쇼크… 마지막 보루 무너져선 안된다,국제유가하락으로 해양플랜트와 해외건설 수요도 크게 기대할 수 없는 상황이다. 이럴 때일수록 수출 상품 및 서비스의 경쟁력을 높이는 데 주력해야 한다. 그간의 노력으로 상당한 효과를 내고 있는 수출지역 다변화...
2497,2019.01.12.,휘발유·경유 값 10주 연속 하락...1월 둘째주 리터당 1355원,국제유가 하락 여파로 국내 휘발유·경유 가격이 10주 연속 하락했다. 2016년 3월 이후 32개월 만 최저치다. 12일 한국석유공사 유가정보 서비스 오피넷에 따르면 1월 둘째주 국내 주유소 휘발유 판매 가격은 ℓ당...
2498,2019.01.22.,"[종합2보] 세계증시, 세계 경제 비관론 확산되며 하락","상품 시장에서는 세계 경제성장 우려에 국제유가가 하락하고 있다. 런던선물시장의 북해산 브렌트유 가격은 배럴당 62달러19센트로 55센트, 미국 서부텍사스산원유(WTI) 선물 가격은 53달러41센트로 39센트 각각 내리고..."
2499,2019.01.15.,수익률 10%… 브라질펀드 ‘나홀로 고공행진’,"최근 국제 유가가 하락하면서 세계 3위 원유 수입국인 인도의 증시가 반등했기 때문이다. 전문가들은 나렌드라 모디 인도 총리의 제조업 육성과 외국인 투자 확대, 인프라 개발 등의 정책에도 점수를 주고 있다. 비록..."
2500,2019.01.21.,내수부진에 수출시장까지 '삐끗',국제유가 하락으로 소비자물가상승률 전망치가 하향 조정될 가능성이 높은 상황이라는 것 외에는 이렇다 할 호재가 없다. 연초부터 불안한 경기 흐름에 통화정책은 완화기조가 지속될 전망이다. 이번 금통위에서의...
2501,2019.01.25.,"베네수엘라 마두로 재임에 혼란 가속화...""반정부 시위자 26명 사망""",최대 산유국 중 하나로 원유 수출 의존도가 높은 베네수엘라는 2014년 국제유가가 급락한 뒤 경제 위기를 맞았다. 음식과 의약품 등 생필품 부족 현상으로 경제난이 장기화되면서 물가 상승률이 급등하는 등 국가 부도...
2502,2019.01.24.,"한은, 올해 성장률 전망치 하향조정. 2.7%→2.6%","그는 연초 수출 부진과 관련해선 ""금액 기준으로는 작년 수준에 이르지 못할 수도 있지만 수출 물량은 여전히 증가세""라며 ""반도체 경기가 하반기가 되면 회복될 것이라는 전망이 우세한 상황이고 국제유가가 지난해보다..."
2503,2019.01.17.,2월 국제선 유류할증료 또 내린다…최고 4만5000원→1만9000원,국제유가가 크게 내리면서 다음달 국제선 항공권 유류할증료가 이달에 이어 또 내린다. 이에 따라 국제선 항공권에 이동 거리에 따라 추가로 붙는 유류할증료는 다음 달 발권 기준 편도 최고 4만5100원에서...
2504,2019.01.29.,"""에쓰오일, 올해엔 실적 나아질 것""...흥국증권","""정제마진 개선 여부 주시""...주식투자 판단은 늘 신중히 해야 에쓰오일(S-Oil)이 지난해 4분기에 국제유가 급락에 따른 재고평가손실 여파로 2924억원의 영업적자를 기록한 가운데 29일 흥국증권이 ""이 회사의 실적이..."
2505,2019.01.22.,"무역협회, 민관합동 수출 총력 지원체제 가동","이번 회의는 미·중 통상분쟁, 노딜 브렉시트 등 통상환경의 불확실성과 함께 반도체 시황 악화, 국제유가 하락 등 글로벌 시장의 변동성이 커지는 상황에서 무역업계와 정부, 지원기관이 함께 수출활력 제고방안을..."
2506,2019.01.24.,"[Who?]마두로, '빈민의 영웅'에서 경제파탄 원흉으로",2014년 중반부터 시작된 국제유가 급락세는 베네수엘라 경제에 치명상을 입혔다. 석유 수출을 통해 정부 재정을 메우고 기본적인 생필품마저 수입에 의존하던 베네수엘라 경제는 끝 모르게 추락을 거듭했다. 연간 2만%가...
2507,2019.01.22.,연초에도 부진한 정제마진…정유사 불안한 출발,국제 유가가 회복세를 나타내고 있다는 점도 긍정적이다. 지난해 10월 배럴당 84달러에서 이달 초 54달러까지 고꾸라진 두바이유는 지난 18일 59달러로 소폭 상승했다. WTI도 작년 10월 76달러에서 지난달 24일 42달러까지...
2508,2019.01.22.,우울했던 중국·원유펀드 다시 웃는다,"22일 업계에 따르면, 원유수출국기구(OPEC)의 감산 합의 이후 국제유가는 반등세를 나타내고 있다. 뉴욕상업거래소(NYMEX)에서 2월 인도분 서부텍사스산원유(WTI)는 지난해 연말 배럴당 42.36달러까지 꺾였지만, 올들어..."
2509,2019.01.26.,2018년 12월 교역조건 지수 92.65…1년째 여건 불리,"다만 국제유가 내림세로 교역조건 악화 흐름은 완만, 전월대비로는 2.7% 상승했다. 12월 교역조건에 반영된 12월 두바이유가는 57.32달러로 배럴당 65.56달러였던 11월보다 12.6% 내렸다. 교역조건 지수는 1단위..."
2510,2019.01.16.,"연기금이 사는 정유주, 바닥 가까워졌나",최근 국제유가 하락세가 진정되는 추세 속에서 정유업종의 1·4분기 실적개선 전망이 나오며 연기금의 매수세가 이어지고 있다. 다만 SK이노베이션(096770)은 정유 사업 외에 전기차 배터리 사업 성장성이 주목받는...
2511,2019.01.11.,"베네수엘라 마두로 대통령,국제사회 반대 속에 두번째 임기 시작",주 베네수엘라 대사관을 폐쇄하고 자국 외교관들을 철수시키기로 했다. 베네수엘라는 국제유가 하락속에 미국의 경제제재가 더해져 극심한 경제난을 겪고 있으며 이를 못견디고 지난 2015년 이후 230만명이 고국을 등졌다.
