,날짜,제목,요약
2990,2020.05.25.,"세계증시 상승...독일 재계지수, 경제개선 반영","상품시장에서도 경제 낙관론에 힘입어 국제유가가 상승하고 있다. 북해산 브렌트유 선물 가격은 배럴당 35달러18센트로 0.14%, 미국 서부텍사스산원유(WTI) 선물은 33달러44센트로 0.57% 각각 상승 중이다. 외환시장은..."
2991,2020.05.26.,올해 한 차례도 흑자 못 본 정제마진 '어찌하오리까…',특히 국제 유가 하락과 내수 수요 호조에 힘입어 정제마진이 상승하면서 5월 현재 중국 국영정유사 가동률은 79% 수준까지 상승한 것으로 집계되고 있다. 코로나19 확산 이전인 올해 1월 중국 국영정유사 가동률인 82...
2992,2020.05.27.,"뉴욕증시, 경제 재개·코로나19 백신 기대 급등 출발","국제유가는 상승했다. 7월물 서부텍사스산 원유(WTI) 가격은 전 거래일보다 3.28% 오른 34.44달러에, 브렌트유는 1.80% 상승한 36.17달러에 움직였다. jwoh@yna.co.kr 본 기사는 인포맥스 금융정보 단말기에서 2시간 더 빠른..."
2993,2020.05.12.,"[종합] 한화솔루션, 태양광 최고 영업이익률 경신…'어닝서프라이즈'","영업이익은 국제유가 약세에 따른 원료가격 하락으로 제품 스프레드(마진폭)가 확대되면서 4.1% 늘었다. 특히 태양광 부문은 매출이 지난해 같은 기간에 비해 14% 늘어난 9천57억원, 영업이익이 2배 이상 늘어난..."
2994,2020.05.15.,올 하반기 수요회복 관측…WTI 9% 급등,사진=AFP[뉴욕=이데일리 이준기 특파원] 국제유가는 14일(현지시간) 급등했다. 이날 뉴욕상업거래소(NYMEX)에서 6월 인도분 서부 텍사스산 원유(WTI)는 전 거래일 대비 배럴당 9.0%(2.27달러) 뛰어오른 27.56달러에...
2995,2020.05.22.,"한화건설, 이라크 비스마야 신도시 사업여건 개선",이라크 정부는 올해 초부터 코로나 19의 전 세계적인 확산과 국제유가 하락으로 국가 재정 운용에 어려움을 겪어왔다. 경제 악화가 장기화됨에 따라 이라크 정부가 발주한 국가사업들의 진행 속도를 늦추고 있는...
2996,2020.05.14.,정유사 신용전망 무더기 하향조정,국제유가(두바이 기준)가 배럴당 30달러 이상 하락하면서 재고 시차효과 및 기말 재고자산 평가 등으로 4개사 합산 약 3.1조원의 유가 변동 관련 손실이 반영됐다. 한신평은 주요 정유사들의 올해 영업이익은 대부분...
2997,2020.05.28.,"플라스틱 재활용률 높인 용인시, 코로나 대응 모범으로",현재 코로나19로 국제유가가 하락하면서 플라스틱 재생원료의 경쟁력이 떨어져 해외 수출 의존도가 높은 페트(PET) 재생원료의 매출이 급감한 상태다. 1~3월 평균 1만6천855t의 재활용 업체의 페트 재생원료 판매량은...
2998,2020.06.01.,딜링룸 24시…챙겨봐야 할 국제경제뉴스,지수와 국제 유가가 반등세라고 CNBC 등 주요 외신이 보도. 29일 CNBC에 따르면 일부 외신은 트럼프 대통령이 중국과의 1단계 무역합의를 파기하지 않을 것이라고 보도. http://news.einfomax.co.kr/news...
2999,2020.05.26.,"세계증시, 경제활동 재개에 10주만에 최고...S&P500, 3000P 목전",상품시장에서는 석유수출국기구(OPEC)의 감산과 미국 및 캐나다의 시추활동 감소로 국제유가가 상승하고 있다. 미국과 캐나다의 셰일유 시추공(rig) 수는 3주 연속 사상최저치를 기록했다. 북해산 브렌트유 선물은...
3000,2020.05.12.,"사우디 국영석유업체 아람코, 1·4분기 순익 25% 급감",국제유가 급락과 글로벌 원유 수요 속에 사우디아라비아의 국영석유기업 아람코의 순익이 지난 1·4분기 25% 감소한 것으로 나타났다. 경제전문방송 CNBC를 비롯한 외신 보도에 따르면 12일 공개한 1·4분기 실적에서...
3001,2020.05.26.,건설사도 '포스트 코로나' 대비…'신사업 개발' 박차,건설사들이 포스트 코로나 시대를 대비한 신사업 발굴에 속도를 내고 있다.25일 관련업계에 따르면 현대건설은 향후 해외 건설시장이 코로나19로 인한 경기 침체와 국제유가 하락 등의 영향으로 입찰 경쟁이 더욱 심화될...
3002,2020.05.21.,"뉴욕증시, 경제 정상화 기대에 호조...다우, 1.52% 상승 마감","뉴욕증시 주요 지수가 경제 활동 재개에 대한 기대와 국제유가 강세 등에 힘입어 동반 상승했습니다. 현지 시간 20일 뉴욕증권거래소에서 다우존스 30 산업평균지수는 전장 대비 1.52% 오른 24,575.90에 거래를..."
3003,2020.05.28.,"금통위, 기준금리 0.50%로 25bp 인하…코로나 경기 부진 방어",국제유가가 큰 폭으로 하락했고 외식물가도 낮아졌다. 4월 취업자 수는 47만6천명 감소하면서 21년 만에 최대 폭으로 줄었다. 심리지수는 정부의 재난지원금 효과에 상승했다. 5월 소비자심리지수는 전월 대비 6....
3004,2020.05.15.,지난달 수출 물가 전월대비 1.6% 감소…유가 하락 여파,국제유가 하락 영향으로 지난달 수출입물가가 전월 대비 하락했습니다. 한국은행이 발표한 수출입물가지수 통계에 따르면 지난달 수출물가는 전월 대비 1.6% 하락해 3월에 이어 두달 째 하락했습니다. 수입물가도 전월...
3005,2020.05.22.,이라크 신임 총리 지원…한화 '비스야마 신도시 사업' 탄력,이라크 정부는 올해 초부터 신종 코로나바이러스감염증(코로나19)의 전 세계적인 확산과 국제유가 하락으로 국가 재정 운용에 어려움을 겪어왔다. 경제 악화가 장기화됨에 따라 이라크 정부가 발주한 국가사업들의 진행...
3006,2020.05.15.,"뉴욕증시, 침체 우려 對 경제 재개 기대에 급등락…다우, 1.62% 상승 마감","수요 회복 기대로 국제 유가가 큰 폭 오른 점도 주가 상승에 이바지했다. 서부텍사스원유(WTI) 6월물은 이날 전장대비 9% 오르며, 배럴당 27.56달러로 마감했다. 종목별로는 뱅크오브아메리카 주가가 4% 올랐고..."
3007,2020.05.12.,미국 4월 소비자물가지수 0.8% 하락…금융위기 후 최대 하락폭,"국제유가 폭락 속에 에너지 물가도 급락했다. 4월 근원 소비자물가는 전달보다 0.4% 떨어져 1957년 이후로 최대 하락폭이라고 블룸버그통신은 전했다. 근원 물가는 변동성이 높은 에너지·식품을 제외한 것으로, 미..."
3008,2020.05.18.,"[올댓차이나] 홍콩 증시, 경제활동 기대에 반등 마감...H주 0.54%↑","주말 뉴욕 증시가 강세를 보이고 국제유가 선물이 상승한 것도 투자심리를 자극했다. 중국핑안보험이 0.19%, 중국 통신주 중국이동 1.33%, 중국 부동산주 비구이위안 0.81%, 홍콩교역소 0.95% 각각 올랐다...."
3009,2020.05.13.,"노르웨이, 국부펀드서 역대 최대 규모 자금 인출한다",노르웨이 정부가 신종 코로나바이러스 감염증(코로나19) 사태와 국제유가 쇼크의 여파로 노르웨이 국부펀드에서 올해 역대 최대 규모의 자금을 인출하기로 했다. 블룸버그 통신에 따르면 노르웨이 정부는 12일...
3010,2020.05.15.,한전 3년만에 흑자 전환…1분기 영업이익 4306억,코로나19 확산과 겨울철 난방 수요 감소 등 전기판매량은 줄었으나 국제 유가 하락에 따른 연료비 감소요인이 주요했다. 한국전력공사는 15일 올해 1분기 기준 연결 영업이익이 전년동기 대비 1조605억원 증가한...
3011,2020.05.27.,"해줌, 상반기 태양광 고정가격계약 경쟁입찰 대안 무료 서비스","코로나19로 인한 국제유가 폭락으로 SMP 가격은 하락세이고, REC 가격 또한 2019년 12월을 기점으로 40원대를 유지하고 있기 때문이다. 한줄기 희망이었던 상반기 고정가격계약 가격 경쟁 입찰 또한 2019년 하반기에..."
3012,2020.05.11.,[위클리 국제금융시장]美 4월 소매판매·산업생산 등에 주목해야,◇원유시장 지난주 국제유가는 미국 원유 채굴장비 감소와 수요 회복 기대에 힘입어 상승했다. 뉴욕상업거래소(NYMEX)에서 6월 인도분 서부 텍사스산 원유(WTI)는 지난주 25% 올랐다. 미국을 비롯한 세계 주요국의 경제...
3013,2020.05.12.,[뉴욕마감] 코로나19가 부추긴 나스닥 독주,국제유가는 하락세로 돌아섰다. 이날 뉴욕상업거래소(NYMEX)에서 6월 인도분 서부 텍사스산 원유(WTI)는 배럴당2.4%(0.60달러) 하락한 24.14달러에 거래를 마쳤다. 국제벤치마크유종인 브렌트유는 배럴당 2.65%(0....
3014,2020.05.24.,[전문가 기고] 코로나19가 붕괴시킨 글로벌 공급사슬(상),"대표적 사례가 국제 유가 급락과 미국 각 도시에서 전염병 확산 위험에도 불구하고 ‘Stay-at-home’ 대신 ‘Open’을 주장하며 시위를 벌이고 있는 자영업자, 소상공인들이다. 셋째, 공급사슬관리 기능 중 수요와..."
3015,2020.05.12.,푸틴에게도 큰소리친 사우디 왕세자의 승자없는 게임...점점 멀어져가는 왕자...,"‘욱하는 성격’으로 유명한 빈 살만 왕세자는 통화 뒤 오히려 25% 원유 증산을 감행했고, 갑작스런 사우디의 증산에 국제 유가는 더 곤두박질쳤다. 결국 지난달 14일 러시아는 사우디가 원래 요구했던 감산량의 10배인..."
3016,2020.05.12.,"한화솔루션, 1Q 영업익 1590억 전년비 62%↑(종합)","영업이익은 국제 유가 약세에 따른 원료 가격 하락으로 제품 스프레드(마진폭)가 확대되면서 4.1% 늘었다. 태양광 부문은 매출이 지난해 같은 기간에 비해 14% 늘어난 9057억원, 영업이익이 2배 이상 늘어난 1009억원을..."
3017,2020.05.30.,"[오늘의 글로벌마켓] 뉴욕증시, 트럼프 중국문제 회견에도 지수 등락 엇갈려",국제유가는 크게 상승했다. 욕상업거래소(NYMEX)에서 7월 인도분 서부 텍사스산 원유(WTI)는 전날보다 배럴당 1.78 달러(5.3%) 오른 35.49달러에 거래를 마쳤다. 서부 텍사스산 원유(WTI)는 이번 달 약 90% 가까이 오르며 한...
3018,2020.05.11.,원유·레버리지·곱버스 ETF ETN에 '기본예탁금' 도입,금융위는 최근 국제 유가 급락으로 순자산가치가 ‘0’에 가까워진 원유 ETP 상품의 액면병합을 허용하는 방안도 검토하고 있다. 액면병합을 하면 실제 가치 변동은 없지만 액면가(주가)가 높아져 변동성을 낮추는...
3019,2020.05.11.,5월 첫 열흘 수출 '반 토막'...코로나19 충격 본격화,"품목별로는 승용차가 80.4%, 석유제품이 75.6% 크게 줄었고 무선통신기기 수출도 35.9%나 줄어 세계경기 침체와 국제유가 하락의 여파가 확인됐습니다. 나라별로는 미국과 EU 수출이 각각 54.8%와 50.6%씩 절반 넘게 감소했고..."
3020,2020.05.11.,"신한BNP파리바자산운용, 코로나 이후 구조변화 수혜주 투자 펀드 출시","이외에도 고령화 사회 진행 심화와 국제유가의 구조적 약세 지속에 따른 에너지 패러다임의 변화, 저금리 기조의 지속이라는 구조적인 변화 속에서 통해 제약/바이오 및 전기차, 대체에너지 및 배당주 등 사회 구조..."
3021,2020.05.26.,26일 휘발유값 상승세... 1257 원,"국내 휘발유 가격이 국제 유가와 유류세 효과 등으로 가격 상승세를 보였다. 한국석유공사 유가 정보 서비스인 '오피넷' 에 따르면, 이달 26일 보통 휘발윳값은 +1.79원 리터당 1257.27원으로 집계됐다...."
3022,2020.05.12.,[원유마감]WTI 2.4% 하락…사우디 추가 감산 효과 반나절,국제유가가 하락했다. 사우디 아라비아가 추가 감산을 약속했지만 신종 코로나바이러스 감염증(코로나19) 재유행 우려가 더 컸다. 11일(현지시간) 미국 서부 텍사스원유(WTI)의 6월 인도 선물은 전장 대비 0.60달러(2.4...
3023,2020.05.14.,"OPEC ""올해 전세계 원유 수요 9.1% 하락"" 전망",국제유가는 코로나19 재유행 가능성에 일제히 하락했다. 이날 미국 서부텍사스산원유(WTI)는 전일 대비 배럴당 0.49달러 하락한 25.29달러로 거래를 마쳤다. 유럽거래소(ICE)의 브렌트유(Brent)는 전일 대비 배럴당 0....
3024,2020.05.19.,"코스피, 외인·기관 동반매수에 장중 1980선 돌파",국제유가 회복 소식도 증시에 긍정적 재료였다. 이날 뉴욕상업거래소(NYMEX)에서 6월 인도분 서부텍사스산원유(WTI)는 배럴당 8.1% 상승한 31.82달러에 거래를 마쳤다. 런던 ICE선물거래소에서 브렌트유 7월물은 7.1...
3025,2020.05.28.,"한은 ""올해 경제성장률 -0.2%…코로나 장기화땐 -1.8%""","올해 소비자물가 상승률은 국제유가 하락, 경기 둔화 등의 영향으로 지난 2월 전망치(1.0%)보다 0.7%포인트 낮은 0.3%로 제시됐다. 식료품·에너지 물가를 뺀 근원물가 상승률은 올해는 0.4%, 내년은 0.9%를 나타낼 것으로..."
3026,2020.05.14.,"한신평, SK이노베이션 등 정유사 5곳 신용등급 전망 '하향조정'""","국제유가(두바이유 기준)가 배럴당 30달러 이상 하락한 결과다. 한신평에 따르면 올해 1·4분기 SK이노베이션은 -1조8000억원, GS칼텍스 -1조원, S-OIL -1조원, 현대오일뱅크 -6000억원 등 4사 합산 총 -4조4000억원의 대규모..."
3027,2020.05.16.,휘발유 16주 연속 하락…리터당 1250원,"국제유가는 두바이유 기준 배럴당 27.6달러로 전주 대비 1.8달러 올랐다. 한국석유공사는 ""주요 산유국 추가 감산 계획 및 국제에너지기구(IEA)의 올해 석유 수요 전망치 상향 조정 등의 영향으로 상승했다""고..."
3028,2020.05.12.,"한화솔루션, 올 1분기 영업이익 전년 동기 대비 62% 증가","영업이익은 국제 유가 약세에 따른 원료 가격 하락으로 제품 마진폭이 확대되면서 4.1% 늘었다. 태양광 부문 매출은 전년 동기 대비 14% 늘어난 9057억 원, 영업이익은 2배 이상 늘어난 1009억 원을 각각 기록했다...."
3029,2020.05.25.,"세종시설공단, 재활용품 주요 품목 매각 단가 인하","25일 공단에 따르면, 최근 코로나19로 인한 경기침체와 국제유가 하락으로 국내외 판로가 차단되고 가격이 폭락하는 등 재생원료의 경쟁력이 하락하면서 재활용 시장의 경기불황이 계속되고 있다. 이에 세종시와 공단은..."
3030,2020.05.25.,"세종시설공단, 재활용품 주요 품목 매각 단가 인하","25일 공단에 따르면, 최근 코로나19로 인한 경기침체와 국제유가 하락으로 국내외 판로가 차단되고 가격이 폭락하는 등 재생원료의 경쟁력이 하락하면서 재활용 시장의 경기불황이 계속되고 있다. 이에 세종시와 공단은..."
3031,2020.05.23.,"17주 연속 내린 휘발유값, 다음주 오른다",국제유가의 상승세에도 국내 휘발유 가격은 17주 연속 하락했지만 하락폭은 리터당 0.4원에 불과했다. 정유사가 주유소에 공급하는 가격이 2주 연속 오르면서 17주 연속 하락을 끝으로 내주 휘발유 가격은 상승세로...
3032,2020.05.15.,"4월 수입물가지수, 전년 동월 대비 14.1% 하락",15일 한국은행에 따르면 올해 4월 수입물가는 국제유가 하락 등의 영향으로 전월 대비 5.1% 하락했다. 두바이 유가는 지난 3월 평균 33.71달러에서 4월 20.39달러로 전월대비 39.5% 떨어졌다. 원재료는 광산품 등이 내려...
3033,2020.05.16.,"3월엔 ‘삼전’, 4월엔 ‘원유’… 동학개미들, 5월엔 뭐를 사고 있나","하지만 4월 들어 국내외 증시는 진정세를 보인 반면, 국제 유가가 마이너스를 기록하는 등 전례 없는 변동성을 나타내자 유가 움직임에 베팅하는 고위험ㆍ고수익 추구 패턴을 보였다. 4월 한달 간 개인 순매수 종목..."
3034,2020.05.15.,[뉴욕마감] 신규 실업자 감소에 반등…다우 1.6%↑,하반기 원유 비축량 감소 전망…WTI 9% 급등 국제유가가 급등세로 돌아섰다. 국제에너지기구(IEA)가 올 하반기 석유 수요 회복으로 원유 비축량이 줄어들 것으로 내다보면서다. 이날 뉴욕상업거래소(NYMEX)에서 WTI(서부...
3035,2020.05.21.,"'꿈의 직장' 불린 정유4사, '4.4조원 적자'에 구조조정 가능성은?",이처럼 정유4사의 1분기 최악의 실적 원인은 국제 유가가 급락했으나 수요 절벽이 이어지며 재고품 가치가 떨어진 게 주된 요인으로 분석되고 있다. 또 코로나19로 인한 운송 수요 감소로 휘발유와 항공유 제품의 정제...
3036,2020.05.11.,GS칼텍스 영업손실 1조318억원···정유 4사 '적자쇼크',이는 코로나19 봉쇄조치 해제 또는 완화에 대한 기대감으로 국제유가가 급등한 반면 실제 석유제품 수요는 늘어나지 않은 결과로 풀이된다. 지난주 두바이유 가격은 25.8달러로 전주 대비 약 42% 가까이 올랐으나...
3037,2020.05.27.,[뉴욕증시 마감] 경제 재개에 백신 개발까지 '훈풍'…다우 2.17%↑,국제유가도 올랐다. 주요 산유국들이 원유 감산 합의를 충실히 이행하고 있다는 신뢰감이 유가 상승에 힘을 보탰다. 뉴욕상업거래소(NYMEX)에서 7월 인도분 서부텍사스산 원유(WTI)는 전 거래일보다 배럴당 3.3...
3038,2020.05.27.,제주지역 휘발유 가격 60원 '껑충'…코로나 영향 끝?,"이와 관련 정유업계는 ""그동안 코로나바이러스 감염증-19(코로나19)' 확산 여파로 하락세였던 휘발유 가격이 바닥을 찍었으나,  국제 유가와 유류세 효과 등으로 가격 상승세를 보이고 있다""고 설명했다. 그러면서..."
3039,2020.05.12.,"美소비자물가, 금융위기 후 최대폭 하락…디플레 우려↑","국제유가 폭락이 물가 하락을 선도했다. 휘발유 물가는 4월 중 20.6% 곤두박질쳤다. 항공·호텔·소매 업종을 중심으로 물가가 크게 떨어진 점도 한몫했다. 반면, 식료품 물가는 2.6% 뛰며 1974년 이후 최대 상승 폭을..."
3040,2020.05.13.,불안한 셧다운 완화 우려에…뉴욕증시 2% 뚝,반면 주요 산유국들의 감산 움직임이 가속화하면서 국제유가는 강세를 보였다. 이날 뉴욕상업거래소에서 6월 인도분 서부 텍사스산 원유(WTI)는 배럴당 6.8%(1.64달러) 급등한 25.78달러에 거래를 마쳤다. 런던 ICE...
3041,2020.05.14.,원유 개미 “종목 멋대로 바꿔 손실” VS 삼성자산운용 “투자자 보호 조치”,신종 코로나바이러스감염증(코로나19) 여파로 국제유가가 극심한 변동성을 띠는 가운데 원유 선물을 기초자산으로 한 상장지수펀드(ETF)에 ‘베팅’한 개인투자자들이 삼성자산운용에 대해 운용 과정에서 투자자...
3042,2020.05.12.,"한화솔루션, 1Q 영업익 1590억원…전년比 62% 증가","케미칼 부문 매출은 코로나19 확산에 따른 석유화학 제품 수요 감소 여파 영향이 있었고, 영업이익의 경우 국제 유가 약세에 따른 원료 가격 하락으로 제품 마진폭이 확대됐다는 게 한화솔루션의 설명이다. 태양광..."
3043,2020.05.22.,"한화건설, 코로나19에도 이라크 비스마야 신도시 사업 탄력",이라크 정부는 코로나19의 확산과 국제유가 하락으로 국가 재정 운용에 어려움을 겪자 지난 2월 말부터 비스마야 신도시 건설 사업을 비롯한 국가사업의 진행 속도를 늦추기로 했다. 이에 한화건설은 지난달 말 신도시...
3044,2020.05.15.,"엔화, 유가 상승·美증시 강세에 1달러=107엔대 전반 하락 출발","일본 엔화 환율은 15일 국제 유가가 상승하고 뉴욕 증시가 대폭 오르면서 저리스크 통화인 엔에 매도가 선행, 1달러=107엔대 전반으로 내려 시작했다. 도쿄 외환시장에서 엔화 환율은 이날 오전 8시30분 시점에..."
3045,2020.05.12.,KDI “코로나19로 소비·수출 감소하며 한국 경기 위축 심화”,"국제유가는 경기침체로 원유 수요가 크게 감소할 것으로 예상되는 가운데 공급 확대 우려가 지속되면서 큰 폭의 하락세를 나타냈으며, 코로나19 확산에 따른 수요 부진과 주요 산유국 간 갈등 지속으로 저유가..."
3046,2020.05.17.,레버리지·인버스 ETP 투자 장벽↑…기본예탁금 1000만원 의무,최근 국제 유가 급등락 속 원유 선물 ETN에 투기광풍이 불자 금융당국이 투자자의 진입장벽을 높인 것으로 풀이된다. 금융위원회는 이같은 내용을 골자로 한 'ETF ETN 시장 건전화 방안'을 17일 발표했다. 금융위에 따르면...
3047,2020.05.21.,美 증시 상승…본격적 봉쇄 완화·기술주 강세,[국제유가] 국제유가는 각국의 봉쇄 완화 움직임 속 원유 수요 증가 기대와 미국 원유재고의 감소로 상승했습니다. 미국 에너지정보청은 지난주 원유재고가 약 498만 배럴 감소했다고 발표했습니다. 이로써 이주...
3048,2020.05.19.,‘모더나’가 이끈 증시···코로나 백신 기대에 다우 3.8% 급등 [데일리 국...,국제유가도 8% 안팎 치솟았다. 계약 만기일(19일)을 하루 앞둔 6월 인도분 서부텍사스산중질유(WTI)는 배럴당 8.1%(2.39달러) 상승한 31.82달러에 거래를 마쳤다. 5월물 WTI가 만기일 전날인 지난달 20일 초유의...
3049,2020.05.26.,"카타르 대규모 LNG선 발주, 경쟁 선사 발주 심리 자극할 전망",국제유가의 급락과 코로나 바이러스로 인한 경기 침체 상황이지만 카타르는 LNG 개발 계획을 계획대로 추진하고 있다는 것을 밝히기도 했다. 카타르는 자신들의 LNG 수출을 늘리기 위해 한국 조선소에서 건조된 선박이...
3050,2020.05.12.,"제조업·수출 집어삼킨 코로나…KDI ""경기위축 심화""",1% 상승에 그쳤다. 정 실장은 “수요가 당장 개선할 것으로 보기 어렵고 국제유가 하락 폭이 커졌기 때문에 당분간 저물가를 유지할 것으로 본다”고 말했다. 한국개발연구원 제공 조해영
3051,2020.05.19.,코로나 치료제 '기대감'에 급등…항공·여행주 상승세,시가 총액 상위 종목 살펴보면 오르는 종목이 우세한 가운데 국제 유가가 회복세를 보여주면서 정유주가 강세를 보이고 있습니다. 흥구석유는 3거래일 연속 상승세를 이어가고 있고 미국 바이오기업 모더나가 코로나19...
3052,2020.06.05.,"국제유가, 감산합의 불확실성 부각 영향 혼조세-WTI 0.3% 상승…국제금값 1%대...",국제유가는 4일(현지시간) 산유국들의 감산합의 연장이 불확실해지면서 혼조세를 나타냈다. 이날 뉴욕상업거래소(NYMEX)에서 7월 인도분 서부 텍사스산 원유(WTI)는 배럴당 0.3%(0.12달러) 상승한 37.41달러에 거래를...
3053,2020.05.13.,'개발'에서 '안보'로…자원정책 방향 전환,코로나19 사태 속에 국제유가가 폭락과 폭등을 반복하며 에너지 자원 94％를 수입하는 자원 빈국인 우리나라를 어렵게 하고 있습니다. 정부가 이 시점에서 물량 확보 중심이던 자원개발 정책을 대대적으로 전환하기로...
3054,2020.05.15.,"[종합] 한전, 1분기 영업이익 4306억 흑자전환…'코로나19'가 살렸다",'코로나바이러스 감염증-19(코로나19)' 여파로 인한 전기판매량이 줄었지만 국제유가 하락으로 연료비·구입비가 크게 줄면서 수익성 개선에 큰 도움이 된 것으로 분석된다. 15일 한전이 발표한 '2020년 1분기 결산...
3055,2020.05.18.,"유럽 주식시장, 경제충격 완화 기대로 오전장 2% 오름세",국제 유가도 선물 시장에서 올랐다. 미국의 장기 국채는 투자자들의 낙관적 전망을 반영해 매입가가 떨어졌다. 미 월스트리트는 정규장 이전의 전자거래에서 다우 존스와 S&P 선물 모두 1.5% 상승세를 나타냈다....
3056,2020.05.21.,"美 경제 회복 기대감에…코스피, 두 달반 만에 2000선 '탈환'","시장은 미국 등 주요국의 경제 재개 움직임, 국제유가 상승세, 미중 무역갈등 상황에 반응했다. 코로나19 백신과 관련된 긍정적인 소식도 있었다. 미국 제약업체 이노비오는 개발 중인 코로나19 백신이 쥐와..."
3057,2020.05.15.,"한국전력, 1분기 영업이익 4306억원…3년만에 흑자전환",국제유가 하락·연료 구입비 감소…영업이익 흑자전환 겨울 난방 수요 감소·코로나19 여파로 전기판매수익 1331억원 감소 한국전력은 1분기 연결기준 영업이익이 3년만에 흑자를 기록했다고 15일 공시했다. 한전은...
3058,2020.05.21.,"다우지수, 1.52%↑…코로나19발 혼조세 지속",뉴욕증시에서 주요 지수는 경제 활동 정상화 기대와 국제유가 강세 등에 힘입어 상승했다. 20일(이하 현지 시각) 뉴욕증시 다우존스 산업평균지수는 전 거래일 대비 369.04p(1.52%) 상승한 2만4575.90에 거래를 마쳤다....
