,날짜,제목,요약
976,2019.05.10.,"[미중 무역협상] 관세폭탄 전쟁 확전, 중국 보복+ 트럼프 또 협박… 무디스 경...","국제신용평가사 무디스는 2000 달러 규모의 중국 제품에 대한 관세율 인상으로 미국의 경제성장률이 2019년... 담화문에서 유감과 더불어 보복 조치를 언급했다. 가오 대변인은 ""중국은 (미국의 관세율 인상에 대해)..."
977,2019.04.18.,[경상시론]유가를 보면 울산경제가 보인다,국제유가가 다시 상승하는 모습이 심상치 않다. 올초부터 꾸준히 상승하는 흐름을 이어가더니 지금은 연초대비 35%나 뛰었고(두바이유 기준) 추가상승도 이상하지 않게 여겨진다. 유가가 지난해 10월 이후 하락하면서...
978,2019.04.15.,국제유가도 상승…기름값 ‘잔인한 5월’ 예고,이미 기름값은 현재도 국제유가 상승 탓에 8주째 가파르게 오르는 형국이다. 한국석유공사 유가 정보 서비스 오피넷에 따르면 4월 둘째 주 전국 주유소의 보통 휘발유 판매가격은 전주보다 ℓ당 10.3원 오른 1천408....
979,2019.04.22.,[녹색창 핫뉴스 브리핑] #세월호 막말 차명진 고소 #쥐꼬리 국민연금 #국제유...,"22일 오후 5시 기준 네이버(Naver)의 많이 본 뉴스에는 <말 바꾼 국방부 ""초계기 근접시 군사적 조치 日에 설명""(정치)>, <""美, 이란 원유제재 예외 연장 안할 것""…국제유가 급등(경제)>, <아내를 성폭행한 남편 친구..."
980,2019.04.14.,"OPEC, 두 달째 감산목표 초과 달성…국제유가 상승",OPEC의 감산목표 초과 달성으로 국제유가가 지속 상승하고 있다. 14일 한국은행이 발간한 '최근 해외경제 동향'을 보면 OPEC은 감산이행률 목표를 2개월 연속 초과 달성했다. OPEC은 지난해 12월 합의한 감산 목표치를...
981,2019.05.10.,신동빈의 꿈...글로벌 톱7 화학기업 시동,한때 국제유가가 급락해 셰일 존폐 위기가 거론됐지만 신 회장은 탁월한 국제 감각으로 셰일을 기반으로 한 유화 공장 건설을 밀어붙여 단숨에 세계 화학 기업들을 선도하는 위치에 올라섰다. 대부분 화학제품의 기초...
982,2019.04.18.,[국제유가]WTI 0.5% 하락 반전…美휘발유재고 예상보다 덜 감소,"17일(현지시간) 미국 서부텍사스원유(WTI)가 0.5% 하락, 배럴당 63달러 대로 내려섰다. 하루 만에 반락했다. 장 초반 원유재고 감소 소식에 올랐다가 반락했다. 휘발유재고 감소폭이 예상보다 작다는 사실이 뒤늦게..."
983,2019.04.11.,"올해 평균 국제유가 전망, 매월 오르는 중~",미국 에너지정보청(EIA)이 전망하는 올해 유가가 매월 상향 조정중이다. EIA는 매월 단기에너지전망보고서인 STEO(Short-Term Energy Outlook)를 발간하는데 4월 전망에 따르면 올해 WTI 평균 유가는 배럴당 58.8달러로...
984,2019.04.23.,"[특징주] 흥구석유 등 석유화학주, 국제유가 급등에 ‘강세’",이투데이=오예린 기자 | 미국의 이란산 원유 수입 전면 금지에 따라 국제 유가가 급등하면서 석유화학주가 장 초반 강세를 보이고 있다. 23일 오전 9시 25분 기준 흥구석유는 전일 대비 27.23%오른 5420원에 거래되고...
985,2019.04.12.,11일 국제유가 하락,"한국석유공사는 11일 국제유가는 OPEC의 증산 가능성 대두, IMF의 세계경제성장률 전망 하향 조정, 미 달러화 강세 등의 영향으로 하락했고, 3월 OPEC의 원유 생산 감소 등은 하락폭을 제한했다고 전했다."
986,2019.04.12.,환율·국제유가 상승으로 3월 수출입물가 오름세,"환율, 국제유가 상승 등의 영향으로 지난 3월 수출과 수입 물가가 동반 상승했다. 한국은행이 12일 발표한 '2019년 3월 수출입물가지수'에 따르면 3월 수출물가지수는 83.36으로 전월(82.95) 대비 0.5% 상승했다. 2개월..."
987,2019.04.12.,"국제유가, 수요위축 전망 속 약세…WTI 1.6%↓",국제유가는 11일(현지시간) 비교적 큰 폭으로 하락했다. 이날 뉴욕상업거래소(NYMEX)에서 5월 인도분 서부 텍사스산 원유(WTI)는 배럴당 1.6%(1.03달러) 내린 63.58달러에 거래를 마쳤다. 글로벌 경기 둔화 흐름과 맞물려...
988,2019.04.11.,"국제유가, OPEC 산유량 감소에 강세…WTI 1.0%↑",국제유가가 10일(현지시간) 상승했다. 이날 뉴욕상업거래소(NYMEX)에서 5월 인도분 서부 텍사스산 원유(WTI)는 전날보다 배럴당 1.0%(0.63달러) 상승한 64.61달러에 거래를 마쳤다. 석유수출국기구(OPEC)의 원유 공급이...
989,2019.04.17.,'조선·철강·해운'…국제유가 상승에 교차하는 '희비 쌍곡선',"해운."" 최근 본격적인 상승기류를 타고 있는 국제유가에 대한 업종별 엇갈린 반응이다. 무엇보다 조선·철강·해운 업종의 경우 유가 변동에 따른 민감도가 높은 산업들로, 경영 성패를 가를 만큼 최대 변수로 꼽히기도..."
990,2019.04.25.,"홍남기 ""국제유가, 시장 우려만큼 급등하지 않을 것""",
991,2019.05.10.,[국제유가] WTI↓·브렌트유↑ '혼조'…미중 무역협상 최종담판 주시,이날 국제유가는 미·중 무역협상 최종담판에 대한 불확실성이 부각되며 혼조세를 보였다. 미국 워싱턴DC에서 양국이 최종 담판을 벌일 예정인 가운데 합의와 결렬에 대한 예측이 교차하는 모습을 보였다. 아울러...
992,2019.04.22.,WTI 국제유가 65달러 돌파…지난 11월 이후 최고치,미국이 오는 5월2일 끝나는 이란산 원유 수입금지 조치에 대한 예외를 연장하지 않을 것이라는 보도가 나오면서 국제유가가 배럴당 65달러를 돌파하며 지난해 10월 이후 최고치를 기록했다. 21일(현지시간) 미 CNBC...
993,2019.04.11.,"""미국 휘발유 재고 격감""...국제 유가 '상승', 러시아 증시 '급등'",10일(뉴욕-런던시각) 국제 유가가 상승했다. 미국의 주간 원유 재고는 크게 늘었지만 휘발유 재고가 격감한 것이 유가를 지지했다. 미국 경제방송 CNBC에 따르면 이날 뉴욕 상업거래소에서 미국 서부텍사스산원유 5월...
994,2019.04.11.,"""국제유가, 주가상승에 오버 슈팅 기대""-하나금투","올해 국제 유가(WTI) 상승률이 40%를 넘어선 가운데, 시장의 투자 심리가 갈수록 커지면서 원유 시장 내부의 상황과 상관없이 유가가 동반 상승할 것이라는 전망이 나왔다. 김훈길 하나금융투자 연구원은 11일 보고서에서..."
995,2019.04.17.,"국제유가 반등, 리비아 내전과 이란 원유 수출 감소로 공급 불안",국제유가가 반등했다. 리비아 내전 격화로 원유 생산이 차질을 빚고 이란의 원유 수출량이 올해 들어 최저선으로 떨어져 원유 공급이 줄어들 수 있다는 불안감이 유가 상승 요인으로 작용한 것으로 보인다. 16일...
996,2019.05.10.,"셰일가스 붐 올라탄 롯데, '중화학 중심' 변신 가속도",최근 들어 국제 유가가 배럴당 60달러 대로 급등하고 중동ㆍ베네수엘라 등의 지정학적 위기가 고조되면서 다시 글로벌 석유화학업계에선 2차 셰일가스 붐이 일고 있다. 실제 셰일가스 생산지인 미국 텍사스 일대에는...
997,2019.04.23.,[이란산 원유수입 금지]유가만 바라보는 업계…철강·조선·항공 '희비' 엇갈...,"국제유가 상승으로 셰일오일 개발 등 시추 건수가 늘고, 통상 시추기 증가는 유정용 강관 수요로 직결된다. 또 선박 건조용 소재인 후판도 수요가 확대될 전망이다. 유가가 오르면 해양자원개발 수요가..."
998,2019.04.17.,[국제유가] 리비아 내전 등 지정학적 이슈로 공급 감소 우려...국제유가 상승...,이영노 기자 ynlee@ajunews.com 16일(현지시간) 국제유가가 하향세를 보인지 하루 만에 다시 반등했다. 뉴욕상업거래소(NYMEX) 5월 인도분 서부텍사스산원유(WTI)는 직전 거래일 대비 0.64달러(1.01%) 오른 배럴당 64.04달러를...
999,2019.04.16.,[국제유가]WTI 0.8% 반락…골드만 등 실적부진에 경기불확실성↑,국제통화기금(IMF)이 세계경제 하방 위험에 우려를 표한 점도 유가에 부정적이었다. 뉴욕상업거래소(NYMEX)에서 WTI 선물은 전장보다 배럴당 49센트(0.8%) 내린 63.40달러에 장을 마쳤다. ICE 선물거래소의 브렌트유는...
1000,2019.04.17.,"뉴욕증시 주요지수 상승, 유가도 1% 올라",국제유가는 하루 만에 상승세로 돌아섰다. 이날 뉴욕상업거래소(NYMEX)에서 5월 인도분 서부 텍사스산 원유(WTI)는 전날보다 배럴당 1%(0.65달러) 상승한 64.05달러에 장을 마쳤다. 미국의 이란 및 베네수엘라에...
1001,2019.04.23.,[채권-장전] 美금리 다시 2.6%에 다가서..6개월 최고치 근접한 유가와 한미 성...,일단 미국의 이란 제재 재개로 국제유가가 추가로 오를 가능성이 있다. 사우디 중심의 OPEC+는 감산을 지속하고 있으며 베네수엘라는 미국의 제재로 생산 차질을 빚고 있다. 이런 상황에서 이란에 대한 제재는...
1002,2019.04.13.,중국 무역지표 호전...국제 유가 · 러시아증시 '상승',원유 최대 수입국 중국 수요증가 기대...미국 채굴장비 증가는 유가 상승폭 제한 12일(뉴욕-런던시각) 국제 유가가 상승했다. 원유 최대 수입국인 중국의 경제지표 호조가 유가를 견인했다. 미국 경제방송 CNBC에...
1003,2019.04.18.,너무 올랐나?...미국증시 & 국제유가 '동반 숨고르기',이날엔 미국증시와 국제유가가 최근 고공행진하다가 이날 소폭씩 하락하며 '동반 숨고르기'를 한 것이 눈길을 끌었다. 미국 경제방송 CNBC에 따르면 이날 뉴욕상업거래소에서 5월 인도분 미국서부텍사스산원유(WTI)...
1004,2019.04.19.,[국제유가]WTI 0.4% 반등…美원유재고 감소 vs 유로존지표 부진,다만 유로존 지표 부진이 경기우려를 자극한 여파로 유가의 추가 상승은 제한됐다. 뉴욕상업거래소(NYMEX)에서 WTI 선물은 전장보다 배럴당 24센트(0.4%) 상승한 64.00달러에 장을 마쳤다. 주간으로는 0.2% 올라 7주...
1005,2019.04.16.,'유가 상승 따른 지나친 공급 타이트' OPEC 원치 않아,국제유가가 상승하면 세계 석유 수요가 감소할 수 있다고 국제에너지기구(IEA)가 밝혔다. 석유정보망에 따르면 IEA는 최근의 세계 석유 수급이 타이트해졌다고 분석했다. 미국 경제 제재 등의 여파로 세계 최대...
1006,2019.05.10.,미중 무역협상 불안...한국 경제는?,"왜냐하면 국제유가가 올 1월에 한 52달러로 했다가, 두바이 유 기준으로요. 지금 한 72달러 하니까 한 40% 가까이 오르지 않았습니까? 그러니까 그 부분이 포함되니까 사실은 소비자들이 느끼는 체감 가격은 굉장히 높을..."
1007,2019.05.08.,기름값 올릴 땐 ‘총알’ 누가 주도하나?,"국제유가는 미국과 이란의 긴장이 고조될 때마다 들썩이고 있고, 정부의 유류세 인하분은 8월 말이면 모두 환원돼 또 한차례 기름값 급등이 예상됩니다. 이번 유류세 인하분 일부 환원 시행을 앞두고 정부 및 업계..."
1008,2019.04.23.,"국제유가, 이란 원유 수출 전면 봉쇄에 6개월 만의 최고치…WTI, 2.7%↑",이투데이=배준호 기자 | 국제유가는 22일(현지시간) 급등했다. 뉴욕상업거래소(NYMEX)에서 5월 인도분 서부텍사스산 중질유(WTI) 가격은 전 거래일 대비 1.70달러(2.7%) 급등한 배럴당 65.70달러로 거래를 마쳤다. 영국 런던...
1009,2019.04.17.,[국제유가]WTI 1% 반등…주가 상승 + 리비아 내전 격화,"16일(현지시간) 미국 서부텍사스원유(WTI)가 1% 상승, 배럴당 64달러 대로 올라섰다. 하루 만에 반등했다. 뉴욕주가가 실적호재로 오르는 등 위험선호 분위기 속에 리비아 내전 격화에 따른 공급 차질 우려가..."
1010,2019.04.17.,[국제유가]WTI 1% 반등…주가 상승 + 리비아 내전 격화,"16일(현지시간) 미국 서부텍사스원유(WTI)가 1% 상승, 배럴당 64달러 대로 올라섰다. 하루 만에 반등했다. 뉴욕주가가 실적호재로 오르는 등 위험선호 분위기 속에 리비아 내전 격화에 따른 공급 차질 우려가..."
1011,2019.05.09.,"이언주 ""유류세에 탄력세율 적용해야""","휘발유에 ℓ당 교통세, 지방주행세, 교육세 등 고정세금 746원이 붙고 부가세까지 합치면 휘발유 1ℓ에는 870원이 돼, 국제유가가 0원이어도 휘발유 값은 ℓ당 900원 이하로 떨어질 수 없는 구조라는 것이다. 이 의원이..."
1012,2019.05.10.,"롯데케미칼, 공격적인 투자로 글로벌 화학사로 ‘도약’","투자결정 이후인 2014년 국제유가 급락으로 셰일가스가 원가경쟁력을 잃자 당시 해외 경쟁업체들의 셰일가스 프로젝트가 7건이나 취소됐지만, 롯데케미칼은 계획을 그대로 밀어붙였다. 당시 언젠가 국제유가가 다시..."
1013,2019.04.26.,"국제유가, 공급 과잉 해소 기대감에 소폭 하락...WTI 1.0%↓",이투데이=배수경 기자 | 국제유가는 25일(현지시간)까지 이틀 연속 하락세를 이어갔다. 이날 뉴욕상업거래소(NYMEX)에서 서부 텍사스산 중질유(WTI) 6월물 가격은 전날보다 0.68달러(1.0%) 하락한 배럴당 65.21달러에 거래를...
1014,2019.04.18.,"국제유가, 숨고르기 장세에 하락…WTI 0.5%↓",이투데이=배준호 기자 | 국제유가는 17일(현지시간) 하락했다. 뉴욕상업거래소(NYMEX)에서 5월 인도분 서부텍사스산 중질유(WTI) 가격은 전일 대비 0.29달러(0.5%) 하락한 배럴당 63.76달러로 거래를 마쳤다. 영국 런던...
1015,2019.05.08.,외인 배당 덮쳐...4월 경상적자 전환 가능성도,그럼에도 4월 국제 유가가 상승해 경상수지 적자를 배제할 수 없는 상황이다. 두바이유는 지난 1월 배럴당 51.86달러에서 지난달 말 70달러까지 치솟은 바 있다. 조 연구위원은 “수출과 연관된 수입은 줄었지만 개인이나...
1016,2019.04.12.,[국제유가] WTI 5개월래 최고치 경신 후 차익실현으로 하락세...WTI 1.58%↓,"이영노 기자 ynlee@ajunews.com 11일(현지시간) 국제유가가 장중 한때 5개월래 최고치를 기록한 후, 차익실현 매물로 인해 결국 하락세로 돌아섰다. 뉴욕상업거래소(NYMEX) 5월 인도분 서부텍사스산원유(WTI)는 전장 대비..."
1017,2019.04.16.,"[글로벌 에너지] 트럼프 행정부, ‘이란산 원유 제재 연장’ 결정 딜레마...‘...",이는 사우디아라비아가 주도하는 OPEC 회원국과 러시아가 이끄는 비회원국이 감산 조치를 이어가면서 국제유가를 끌어올리는 상황을 비판한 것으로 풀이된다. 더불어 트럼프 행정부 입장에서는 제재 조치 연장 결정과...
1018,2019.04.12.,"수출입물가 두달째 소폭 오름세, 유가상승vs반도체·LCD 하락","국제유가가 상승세를 이어가면서 오름세를 견인했지만, 반도체와 액정표시장치(LCD) 등 전기 및 전자기기 하락세가 지속됐기 때문이다. 유가 오름세가 계속되면서 상방압력이 계속될 가능성이 높지만, 반도체..."
1019,2019.04.15.,[국제유가]WTI 0.5% 반등…中수출 호조 + 리비아 내전 위기,"리비아 내전 위기로 불거진 공급차질 우려와 중국 수출지표 호재에 따른 수요 기대가 유가를... 주간으로는 WTI가 1.3%, 브렌트유가 1.7% 각각 올랐다. 지난달 중국 수출이 급반등했다. 해관총서 발표에 따르면 3월..."
1020,2019.04.22.,"[주간 유가 전망] 국제유가, 상승 지속 전망…""'오버슈팅' 우려""",이투데이=문선영 기자 | 이번주(4월22~26일) 국제유가는 산유국들의 지정학적 리스크가 지속되면서 상승세를 이어갈 전망이다. 지난 주 뉴욕상업거래소(NYMEX)에서 미국 서부텍사스원유(WTI)는 전주 대비 0.17% 오른 64달러에...
1021,2019.05.08.,"국제유가, 미중 무역전쟁 발발 가능성 부상 큰 폭 하락",국제유가가 트럼프 대통령의 관세인상 발언의 영향으로 미중간 무역전쟁 발발 가능성 우려가 고조되면서 큰폭 하락했다. 7일(현지시각) 뉴욕상업거래소에서 서부 텍사스산 중질유(WTI) 6월 인도분은 전 거래일보다 1.4...
1022,2019.04.13.,"국제유가 2분기 혼조세 계속될 듯급반전에 시장 혼란…IEA ""2분기 신호 혼재""","국제유가가 지속적으로 오르고 있는 가운데 산유국의 정정 불안, 도널드 트럼프 미국 대통령의 증산 압박 등 불확실성이 커지면서 국제유가가 혼조세를 보일 것으로 예상된다. 작년  말 배럴당 51달러까지 떨어졌던..."
1023,2019.05.10.,"[이각범의 화쟁토론 75] '베네수엘라의 길, 그리스의 길, 우리는 어떻게 해야...","한상춘: -베네수엘라는 정부와 시장의 실패를 복합적으로 보여줘, 재정 재원이 국제유가에서 만들어질 때는 포퓰리즘 환영받지만 유가 하락으로 재원이 받쳐주지 못해 파탄 이른 것. -국제금융시장 접근도 떨어질 때 경제..."
1024,2019.04.12.,7월엔 OPEC도 증산?...국제 유가 · 러시아증시 '동반 급락',11일(뉴욕-런던 시각) 국제 유가가 하락했다. 향후 OPEC(석유수출국기구)의 원유 증산 가능성이 유가를 짓눌렀다. 미국 경제방송 CNBC에 따르면 이날 런던ICE 선물거래소에서 사고 팔린 6월 인도분 북해산 브렌트유...
1025,2019.05.08.,"경상수지 7년 흑자 '흔들'…한은 ""4월 적자 예단 못 해""",최근 국제유가가 오르면서 경상수지를 악화시킬 수 있는 변수로 등장했다. 우리나라가 주로 수입하는 두바이유의 경우 지난 1월 배럴당 51.86달러로 연중 최저치를 기록하다 지난달말에는 74달러까지 올랐다....
1026,2019.04.17.,"""지정학적 리스크"" 부각...국제 유가 반등, 미국증시에도 긍정 영향",16일(뉴욕-런던 시각) 국제 유가가 전날의 하락세를 딛고 반등했다. 지정학적 리스크들에 의한 주요국 원유생산차질 이슈가 유가 상승 요인으로 작용했다. 미국 경제방송 CNBC에 따르면 이날 뉴욕상업거래소에서 미국...
1027,2019.05.08.,"기름값 올릴 때는 빨리, 내릴 때는 천천히...소비자만 '골탕'","◇ 국제유가 상승으로 국내 기름값 추가 인상 가능성 커 휘발유 가격을 올리고 내린 주유소 숫자에서도 차이가 있었다. 에너지석유시장감시단은 유류세 인하 폭 축소 시행 첫 날인 지난 7일, 휘발유 판매 가격을..."
1028,2019.05.10.,"신동빈, 美셰일가스 심장부 공략…롯데케미칼 신공장 가동","지년 몇 년간 유가 하락으로 셰일가스가 가격경쟁력을 잃었지만 최근 국제유가가 배럴당 70달러대에 진입해 경쟁력을 회복했다는 평가다. 이번 초대형 설비 구축으로 롯데케미칼의 국내외 생산량은 연간 450만톤, 세계..."
1029,2019.05.07.,유류세 인하폭 축소 첫날 전국 기름값 1천500원 눈앞(종합),"업계는 국제 유가 상승도 겹쳐 앞으로 1∼2주간은 기름값 상승이 이어질 것이라고 분석했다. 정유사 관계자는 ""주유소들은 가격을 내릴 보다 올릴 때 더 빨리 움직일 것으로 보이고 국제 유가 상승도 계속돼..."
1030,2019.04.12.,[국제유가]WTI 1.6% 반락…IEA 원유수요 경고 + 美주간재고 급증,전 거래일 나온 미 주간 원유재고 급증 악재와 국제에너지기구(IEA)의 원유수요 경고가 유가를 압박했다. 뉴욕상업거래소(NYMEX)에서 WTI 선물은 전장보다 배럴당 1.03달러(1.6%) 내린 63.58달러에 장을 마쳤다. ICE...
1031,2019.05.09.,[원유마감] 상승…중동 위기 고조 + 美 원유재고 감소,국제유가가 8일(현지시간) 상승했다. 미국과 이란 사이의 긴장 고조로 인한 원유 공급 우려로 인해 유가가 부양됐다. 미국의 원유 재고가 예상보다 큰 폭으로 감소한 점도 유가 상승에 보탬을 줬다. WTI 선물은...
1032,2019.04.12.,[주간유가] 주유소 휘발유 판매가격 8주 연속 상승,6원/ℓ을 나타냈다. 국제유가가 3월 OPEC 원유생산량 감소와 미국 석유제품 재고 감소 및 미국의 베네수엘라 추가 제재 등으로 인해 상승함에 따라 국내제품가격도 오름세를 이어갈 것으로 전망된다.
1033,2019.04.13.,"국제 유가 올랐는데, 미국증시 '쉐브론' 주가는 왜 추락?","쉐브론 M&A 소식에 쉐브론, 엑손모빌 등 주요 정유주 하락 12일(미국시각) 국제 유가가 상승했지만 미국 주요 정유주들은 급락해 눈길을 끌었다. CNBC에 따르면 이날 미국산 유가와 북해산 브렌트유 가격이 상승했다...."
1034,2019.05.08.,"LPG 인상분 100% 반영, 서울 LPG 연료값 900원 돌파 눈앞","업계 관계자는 “국제 유가, 플레이어들의 트레이딩 상황, 운송선의 상태 등이 부탄 공급가에 영향을 미치기 때문에 앞으로 상승 폭을 예측하기는 어렵다”고 말했다. 오는 9월부터는 유류세가 원래대로..."
1035,2019.04.22.,"생산 투자 위축-자본 이탈, 한국경제에 드리운 ‘高유가 원화 약세의 그늘’",국제유가 상승은 경제 전반의 비용 상승으로 이어질 수 있어서다. 에너지 비용이 상승하면 기업은 원가 상승 압력을 받게 되고 생산활동과 투자는 위축된다. 실제 국제유가가 배럴당 100달러를 웃돌았던 2011년~2014년...
1036,2019.04.17.,"국제유가, 공급 압박 불안에 상승…WTI, 1.0%↑",이투데이=배준호 기자 | 국제유가는 16일(현지시간) 상승했다. 뉴욕상업거래소(NYMEX)에서 5월 인도분 서부텍사스산 중질유(WTI) 가격은 전 거래일 대비 0.65달러(1.0%) 상승한 배럴당 64.05달러로 거래를 마쳤다. 영국 런던...
1037,2019.05.07.,전국 휘발유가격 5개월만에 1천500원 돌파…서울은 곧 1천600원(종합3보),"아울러 업계는 국제 유가 상승도 겹쳐 앞으로 1∼2주간은 기름값 상승이 이어질 것이라고 분석했다. 정유사 관계자는 ""주유소들은 가격을 내릴 보다 올릴 때 더 빨리 움직일 것으로 보이고 국제 유가 상승도 계속돼..."
1038,2019.05.04.,"국제유가, 사흘만에 반등...WTI 0.2%↑",국제유가가 3일(현지시각) 사흘만에 반등했다. 이날 선물시장인 뉴욕상업거래소에서 미국산 원유의 기준유인 서부텍사스산원유(WTI) 6월 인도분은 전날보다 0.2% 오른 배럴당 61.94달러에 거래를 마쳤다. 영국 런던ICE...
1039,2019.05.06.,미중 무역협상 강대강 대치…막판 진통에 타결전망 '흔들',"당장 중국 증권시장의 주가와 위안화 가치, 국제유가가 6일 일제히 하락세를 보이는 등 시장이 예민한 반응을 보였다. 순조롭게 결승점을 향해 가던 것으로 보였던 미·중 협상이 다시 소용돌이 속에 빠져든 것은 트럼프..."
1040,2019.05.09.,유류세 인하폭 축소 첫날… 전국 주유소 71%가 가격 올렸다,하지만 국제 유가 상승으로 기름 값이 계속 오르자 정부는 인하율은 축소하면서 8월 31일까지 연장했다. 작년 11월 유류세 인하 이후 국제 유가는 큰 폭으로 떨어졌다가 올 들어 30% 넘게 올랐기 때문이다. 유가가...
1041,2019.05.07.,유류세 인하폭 축소 첫날 전국 기름값 1천500원 눈앞,속에 지난 6일(현지시간) 뉴욕상업거래소(NYMEX)에서 6월 인도분 서부 텍사스산 원유(WTI)는 전 거래일보다 배럴당 0.5%(0.31달러) 오른 62.25달러에 거래를 마쳤다. 국제 유가는 2∼3주 시차를 두고 국내 유가 반영된다.
1042,2019.05.10.,미중 무역협상 끝내 결렬 ? 국제유가WTI 0.7%↓… 무역전쟁 관세폭탄 → 경기...,미중 무역협상이 막판으로 치당고 있는 가운데 국제유가가 하락했다. 10일 뉴욕증시와 거래소에 따르면 미국의 주종 원유인 서부 텍사스산 원유 즉 WTI는 배럴당 0.7%(0.42달러)...
1043,2019.05.08.,휘발유값 “내릴 땐 ‘찔끔’ 오를 땐 ‘순식간’” 사실이었다,그러나 주유소의 재고 물량이 소진되기 전인 데다 하루 만에 국제유가 상승세를 반영할 수 없기 때문에 직영주유소나 일부 자영주유소만 가격을 인상해야 한다. 그런데도 10곳 중 5곳에서 가격을 올렸다. 휘발유...
1044,2019.05.10.,"환율마저 급등…기름값, 유류세 인하 이전으로 회귀하나",업계가 소비자 부담을 줄이기 위해 인상폭을 단계적으로 반영하겠다고 밝힌 가운데 일부에서는 국제유가 상승분과 함께 연일 최고점을 경신하고 있는 환율까지 고려한다면 국내 유가는 머지않아  지난해 유류세...
