,날짜,제목,요약
1968,2019.02.15.,"세계증시, 美·中 지표 악재에 투심 악화",한편 상품시장에서는 석유수출국기구(OPEC)의 감산이 지속되고 특히 사우디아라비아가 예상보다 큰 폭으로 수출량과 생산량을 줄였다는 소식에 국제유가가 상승하고 있다. 런던선물시장의 북해산 브렌트유 가격은...
1969,2019.02.11.,"대한항공, 결국 '어닝쇼크의 덫'…아시아나‧제주항공도 위태","업계에서는 국제유가와 환율이 불안정한 흐름을 보이는 등 비우호적인 영업환경과 명절 특수의 역기저 효과까지 더해지며 실적개선이 불투명할 것으로 내다봤다. 시장에서는 이 같은 상황을 반영, 대한항공의 4분기..."
1970,2019.02.20.,"한화케미칼, 작년 영업익 3천543억원…전망치 하회(종합)",한화케미칼은 올해 1분기부터 국제유가 하락에 따른 저가원료 투입 효과가 가시화될 것으로 내다봤다. 한편 한화케미칼은 이날 이사회를 통해 발행주식 수(보통주 기준)의 1%에 해당하는 자사주 163만1천104주를 매입...
1971,2019.02.19.,3월 국제선 유류할증료 최고 3만 4천800원으로 인상,하락세를 보이던 국제유가가 다시 상승세로 돌아서면서 다음달 국제선 항공권 유류할증료가 오릅니다. 항공업계에 따르면 3월 국제선 유류할증료는 2단계에서 3단계로 한 단계 인상됩니다. 이에 따라 국제선의...
1972,2019.02.17.,[사진] 전국 주유소 휘발유 가격 15주째 하락세,국내 휘발유 가격이 국제 유가와 유류세 효과 등으로 15주 연속 가격 하락세를 이어갔다. 한국석유공사 유가 정보 서비스인 '오피넷'에 따르면 이달 둘째주 전국 주유소의 보통 휘발유 판매 가격은 전주보다 ℓ당...
1973,2019.02.14.,"""미국 원유 생산량 계속해서 늘릴 것...OPEC 감산 견제""","올해 원유 수요 전망치는 국제유가 하락, 중국의 석유화학 프로젝트, 글로벌 경기 둔화 등을 고려해 지난달과 동일하게 일간 140만 배럴 증가할 것으로 전망했다. IEA는 ""다만 미국의 셰일은 경질유 성격을 가지는..."
1974,2019.02.26.,"[Biz 브리프] ""트럼프, 정책 이해 부족"" 외",국제유가 3%대 급락 국제유가가 3%대의 급락세를 보였다. 25일 뉴욕상업거래소에서 4월 인도분 서부 텍사스산 원유는 전 거래일보다 배럴당 1.78달러(3.1%) 하락한 55.48달러에 거래를 마쳤다. 트럼프 대통령은 이날 오전...
1975,2019.02.17.,"아시아나, 지난해 6조8506억 사상 최대매출","영업이익은 국제유가 상승으로 전년 대비 유류비가 4천327억원 증가했음에도, 항공운송·IT사업 부문 등의 연결자회사 영업이 좋은 성과를 나타내면서 흑자 기조를 유지했다고 아시아나항공은 설명했다...."
1976,2019.02.15.,"정부, 조만간 '수출활력 제고대책' 발표…""2월중 확정""","한편, 이 차관은 ""소비자물가는 작년에 이어 올해 1월, 설 연휴 기간 중 안정적 흐름을 유지하고 있다""며 유류세 인하와 건강보험 보장성 확대, 국제유가 하락 등이 안정세 기여한 것으로 보인다""고 평가했다. 다만 ""최근..."
1977,2019.02.13.,"뉴욕증시, 미·중 무역협상 기대 지속 상승 출발","국제유가는 상승했다. 3월물 서부텍사스산 원유(WTI) 가격은 전 거래일보다 1.13% 오른 53.70달러에, 브렌트유는 1.38% 상승한 63.28달러에 움직였다. 시카고상품거래소(CME) 페드워치에 따르면 연방기금(FF) 금리선물 시장은..."
1978,2019.02.11.,"OCI, 태양광 불황 직격탄…영업익 '반토막'","그간 석유화학사업에서 500억원 이상의 꾸준한 영업이익을 거둬왔으나, 지난해 하반기 급격하게 하락한 국제유가와 미중 무역분쟁이 실적에 직접적인 영향을 미쳤다는 분석이다. 미국 서부텍사스산 원유(WTI)..."
1979,2019.02.16.,"뉴욕증시, 미·중 협상 지속 방침에 안도 상승 출발","국제유가도 큰 폭 올랐다. 3월물 서부텍사스산 원유(WTI) 가격은 전 거래일보다 2.02% 상승한 55.51달러에, 브렌트유는 1.80% 오른 65.73달러에 움직였다. 시카고상품거래소(CME) 페드워치에 따르면 연방기금(FF) 금리선물..."
1980,2019.02.14.,"금호아시아나, ‘유동성 위기설’ 진화","매출은 전년 대비 10% 증가한 것이며, 국제유가 상승과 불안정한 대내외 경제변수 영향에도 안정적인 이익을 시현한 것이라고 자평했다. 금호아시아나가 그룹 차원에서 실적을 공개한 것은 이례적이다. 이날..."
1981,2019.02.11.,2월 1주차 주요 광물價 1.7% ↑,"다만, 미 달러가치와 국제유가는 상기 상승압력을 제약하는 방향으로 작용했다. 2월 1주차 미 달러 인덱스는 96.29로 전주대비 0.7% 상승했으며, 같은 기간 국제유가(WTI)는 배럴당 52.72달러로 전주대비 4.6..."
1982,2019.02.20.,[뉴스핌 뉴스레터] 글로벌 모닝뉴스 20일,"20일자 글로벌 모닝뉴스 바로가기 20일 아침 배달된 '글로벌 모닝뉴스'는 <트럼프 “핵실험 없는 한 서둘 것 없어” ‥文 대통령, “美 요구하면 경협 떠맡을 용의”>란 톱기사와 함께 ▲ 국제유가, 미·중 무역협상..."
1983,2019.02.13.,고(高)물가보다 무서운 저(低)물가…한국 경제 성장엔진 식어가나,"지난해의 경우 국제유가가 돌연 하락한 데다, 문재인 정부의 복지정책 영향에 보건비 등이 오히려 하락한 영향이 주로 꼽혔다. 그러나 6년째 목표 수준을 하회하는 저물가가 이어지고 있는 것에는 근본적인 이유가..."
1984,2019.02.14.,"‘빛바랜 역대 최대 매출’…대한항공-아시아나항공, 유류비 ‘발목’","국제유가 상승에 따라 유류할증료를 부과한다고는 하지만, 이를 모두 상쇄할 수는 없다는 게 항공 업계 쪽 주장이다. 실제 아시아나항공의 경우 작년보다 유류비가 4327억원 늘었고, 대한항공의 경우 6779억원이다."
1985,2019.02.15.,"[펀드줌인]미래에셋인도채권펀드, 印 우량 국공채 투자...3개월 수익률 3.82%",다만 지난해 국제유가 급등락에 원유 수입국인 인도 경제에 대한 우려가 커지면서 1년 수익률은 -0.47%로 부진했다. 최근 인도 채권의 투자 매력이 커진 것은 중앙은행의 금리 인하 때문이다. 인도중앙은행(RBI)은 7일...
1986,2019.02.19.,19일 휘발유값 하락세... 평균 1342 원 대 형성,"국내 휘발유 가격이 국제 유가와 유류세 효과 등으로 가격 하락세를 보였다. 한국석유공사 유가 정보 서비스인 '오피넷' 에 따르면, 이달 19일 보통 휘발윳값은 -0.09원 떨어진 리터당 1342.66원으로 집계됐다...."
1987,2019.02.14.,[에셋+ 한눈에 보는 펀드] 美 금리동결 등 훈풍···국내주식형 7.15%↑,"지난달 초 중국 제조업지표 부진 및 애플 쇼크로 글로벌증시는 하락 출발했지만, 이후 미국 중국 무역협상에 대한 우려 완화 및 국제유가의 상승으로 글로벌증시는 상승세를 이어갔다. 지난달 중반 영국의 브렉시트..."
1988,2019.02.13.,"석유산업, A부터 Z까지…반도체 버금가는 수출 효자","이렇게 채굴된 원유가 국제유가 단골손님으로 등장하는 세계 3대 지표 원유(Marker Crude)인 Dubai유(UAE), WTI유(미국), Brent유(영국)다. 3대 지표 원유에 아랍국가가 단 하나뿐이라 의아스러울 수도 있다. 이는 많은 사람들이..."
1989,2019.02.14.,"아시아나항공, 지난해 영업익 1784억…전년比 35.3%↓","아시아나항공은 항공운송부문 및 연결 자회사 영업실적 호조에 따라 역대 최대 매출액을 기록했으나, 국제유가 상승으로 인한 유류비 증가로 영업이익이 감소했다고 분석했다. 또한 환율 상승으로 인한..."
1990,2019.02.13.,"'절치부심' OPEC, 1월 원유 감산량 목표치 근접...러시아는 '미달'",OPEC과 러시아 등 10개 비회원 산유국으로 구성된 'OPEC+'는 지난해 12월 국제유가를 지지하기 위해 2019년 1월부터 6개월간 하루 평균 120만 배럴의 원유를 감산하기로 합의했다. 120만 배럴 가운데 러시아를 비롯한...
1991,2019.02.16.,"휘발유 값 15주 연속 하락…평균 1,342.7원",이번 달 둘째주 전국 주유소 휘발유 평균 가격은 리터당 1342.7원이고 경유는 1241.8원입니다. 석유공사는 국제유가 강보합세와 유류세 인하 효과로 휘발유 가격이 당분간 비슷한 수준을 유지할 것으로 내다 봤습니다.
1992,2019.02.21.,[증시브리핑] ‘FOMC 의사록’ 발표 후 美증시 소폭 상승,"국제유가는 사우디아라비아와 나이지리아를 포함한 산유국들의 연이은 감산 소식에 상승했습니다. 미국의 생산량은 여전히 증가하고 있지만, 유가는 지난 11월 이후 최고 수준을 기록 중입니다. 지금까지 글로벌..."
1993,2019.02.13.,LCC 전성시대…2018년 실적 '새역사' 쓰다,가파른 국제유가 상승 등 비용 증가 요인이 그 원인으로 꼽힌다. 제주항공은 “이 같은 상황에서도 지난해 4분기에도 이익 54억원을 내며 선방을 했다”며 긍정적인 평가를 내놓았다. 최초의 LCC 항공인 티웨이항공...
1994,2019.02.15.,韓 제조업의 추락… 지난해 4분기 ‘어닝 쇼크’,전자·유화 등 대표기업 영업익 30% 급감 국제유가·반도체 판가 하락 ‘직격탄’ 주요기업 중 포스코·기아차만 실적 개선 아시아투데이 = 올초부터 국내 제조업이 위기 국면을 맞고 있다. 우리나라 대표 제조업 기업들은...
1995,2019.02.13.,"""제주항공, 지방발 노선 확대로 단기 수익성 감소…목표가↓""-키움","이어 그는 ""국제 유가가 현 수준을 유지한다면 1분기 실적에 대한 기대감은 유효하다""며 ""장기적으로 제주항공의 지방거점 확보 전략은 합리적이라고 생각된다""고 말했다. 차은지 한경닷컴 기자"
1996,2019.02.21.,[오늘의 주요 국제금융뉴스](21일),"http://news.einfomax.co.kr/news/articleView.html?idxno=4017364 ▲캐피탈이코노믹 ""수요 약화로 유가 랠리 제동 가능"" - 최근 빠른 상승 곡선을 그리고 있는 국제유가에 제동이 걸릴 수 있다는 진단이 나왔다.20일..."
1997,2019.02.17.,"코너 몰린 방위산업, 수출·혁신에 길 묻다","국방기술품질원이 발표한 '2018 세계 방산시장 연감'에 수록된 2017년 전 세계 국방비 지출 현황을 보면 중동 지역 국방비 지출액은 2009년부터 2015년까지 총 41% 급증했으며, 2016년 국제유가 하락의 영향으로 감소했다가..."
1998,2019.02.20.,"[해외시황] 뉴욕, 미중 무역협상 MOU 기대 상승…유럽 '혼조'",이런 가운데 국제유가는 5거래일 연속으로 오름세를 이어나갔다. 이날 뉴욕상업거래소에서 3월 인도분 서부텍사스산원유(WTI)는 배럴당 0.50달러(0.89%) 상승한 56.09달러에 거래를 마쳤다. 런던선물거래소에서 4월물...
1999,2019.02.17.,[사진] 국내 휘발유 가격 15주째 하락...평균 1342.7원,국내 휘발유 가격이 국제 유가와 유류세 효과 등으로 15주 연속 가격 하락세를 이어갔다. 한국석유공사 유가 정보 서비스인 '오피넷'에 따르면 이달 둘째주 전국 주유소의 보통 휘발유 판매 가격은 전주보다 ℓ당...
2000,2019.02.17.,[사진] 휘발유 가격 15주째 하락...전주 대비 1.3원 ↓,국내 휘발유 가격이 국제 유가와 유류세 효과 등으로 15주 연속 가격 하락세를 이어갔다. 한국석유공사 유가 정보 서비스인 '오피넷'에 따르면 이달 둘째주 전국 주유소의 보통 휘발유 판매 가격은 전주보다 ℓ당...
2001,2019.02.14.,[뉴욕증시] 무역협상 낙관론에 상승...나스닥 약세장 탈출 임박,"<상품시장> 오늘 국제유가는 오펙의 산유량이 최저를 기록한 점과, 사우디의 추가 감산이 겹치며 계속해서 상승탄력을 받았습니다. 여기에 미중 무역 협상이 낙관적 전망을 보이며 상승 지지력을 제공했는데요..."
2002,2019.02.17.,[이번주 증시 핫이슈]미·중 무역협상·車관세 보고서·FOMC 의사록 '주목',국제유가는 나흘째 상승세를 이어갔다. 이날 뉴욕상업거래소(NYMEX)에서 3월 인도분 서부 텍사스산 원유(WTI)는 전날보다 배럴당 2.2%(1.18달러) 오른 55.59달러에 장을 마감했다. 스탠더드앤드푸어스(S&P) 500 지수는...
2003,2019.02.22.,EIA 원유재고 367만 배럴 증가…WTI 낙폭 축소,"미국 원유 재고가 시장 예상보다 다소 많이 늘었지만, 휘발유 등의 재고는 감소하면서 국제유가는 낙폭을 다소 줄였다. 다만 지표에 따른 움직임은 크지 않았고, 하락세는 유지됐다. 마켓워치에 따르면 지표 발표..."
2004,2019.02.16.,[주간해외펀드] 춘절 이후 중국펀드 강세... 2.94% 올라,"반면 국제유가가 반등 이후 다시 내리막으로 전환, 에너지기업들의 부진이 이어지면서 남미신흥국주식과 유럽신흥국주식은 각각 1.53%, 2.42% 약세를 보였다. 국가별로는 러시아가 2.53% 떨어져 가장 큰 낙폭을..."
2005,2019.02.13.,"[ET투자뉴스]지역난방공사, ""구조적인 개선이 필…"" HOLD (MAINTAIN)-하이투자","또한 하이투자증권에서 ""동사의 전력부문 실적은 국제유가 안정화로 인해 1Q19 을 바닥으로 단기적인 실적 회복이 가능하다. 지난 1Q18~3Q18 의 전력부문 실적 악화는 연료비 인상 및 정산대금 1 개월 지연에..."
2006,2019.02.12.,"제주항공, 부가매출의 수익모델 만들기 성공으로 수익 방어","하지만 국제유가 상승에 따른 유류비 부담 증가, 몸집 불리기 경쟁, 특가 경쟁 등 영업환경이 매우 좋지 않았던 것을 감안하면 제주항공이 경쟁사보다 수익성 악화를 잘 방어해냈다는 평가가 나온다. 제주항공은..."
2007,2019.02.13.,[뉴욕증시] 셧다운 잠정 합의·무역 협상 우려 완화에 상승,"<상품시장> 오늘 국제유가는 OPEC의 1월 산유량이 전월대비 약 80만 배럴 줄어들면서 상승 했는데요, 여기에 사우디가 추가 감산을 시사하면서 상승폭을 키웠습니다. WTI는 1.3% 상승한 53.10달러에 거래됐구요, 브렌트유도..."
2008,2019.02.14.,"뉴욕증시, 美·中 무역협상 타결 기대에 '강세'…다우 0.46%↑ ",여기에 사우디아라비아의 추가 감산 방침 등으로 국제유가가 오름세를 이어가는 점도 에너지주 중심으로 증시에 활력을 더했다. 서부텍사스원유(WTI)는 전일 1.3% 오른 데 이어 이날도 1.5% 상승했다. 이날 종목별로는...
2009,2019.02.14.,"수출, 암울한 스타트… 돌파구는 어디에?","4%로 견조한 성장률을 보인 반면, 경기요인에 영향을 많이 받는 반도체 가격과 국제유가 동향이 하락세를 보였다. 반도체·석유제품·석유화학 부문을 제외하면 1월 수출은 315억 달러 수준으로 전년동기대비 0.7..."
2010,2019.02.12.,[뉴욕증시] 미중 협상 주시·셧다운 재발 우려에 혼조,<상품시장> 오늘 국제유가 미국과 중국의 협상을 주시하며 떨어졌습니다. 다만 OPEC과 러시아등의 생산량이 하루 평균 120만 배럴 감산을 지속하면서 낙폭은 제한됐습니다. WTI 0.6% 떨어진 52.41달러에 거래됐구요...
2011,2019.02.22.,[증시브리핑] 美 증시 하락…경제지표 부진에 경기둔화 우려,국제유가는 미국의 원유 생산량이 계속해서 증가하면서 결국 하락했습니다. 미국의 생산량은 5주째 상승하면서 1년 만에 최고치를 기록했습니다. 지금까지 글로벌 증시브리핑이었습니다.
2012,2019.02.19.,반도체 부진에… 도내 무역수지도 적자,"수원세관 관계자는 ""미·중 통상 분쟁 등의 통상 여건으로 중국 경기가 둔화되고, 반도체 단가와 국제 유가 하락으로 주요 품목의 수출단가가 하락하면서 지난달 수출액이 줄었다""고 분석했다."
2013,2019.02.21.,[LCC 상장 4사 2019년 과제 ④에어부산 한태근] 낮아진 수익성 개선해야 재역...,"한동안 떨어지던 국제유가가 상승세를 보이고, 국토교통부가 국적 LCC의 신규 면허 심사를 추진하고 있는 데다 외국 항공사들까지 국내 진출에 속도를 내면서 치열한 경쟁이 예고되고 있어서다. 이에 제주항공..."
2014,2019.02.13.,"[뉴욕마감]美·中협상시한 연장, 셧다운 위기모면 기대에 상승",국제유가는 석유수출국기구(OPEC)와 최대 산유국인 사우디아라비아의 감산 소식에 힘을 받으며 상승했다. 이날 뉴욕상업거래소(NYMEX)에서 3월 인도분 서부 텍사스산 원유(WTI)는 전날보다 배럴당 1.3%(0.69달러) 오른 53....
2015,2019.02.13.,<오후여담>新OPEC 對 셰일,하지만 지금은 “국제유가가 더 떨어져야 한다”며 반(反)OPEC 감정을 감추지 않는 도널드 트럼프 대통령이 버티고 있다. 세 불리를 느낀 OPEC의 선택은 새로운 카르텔이다. 이미 2016년부터 러시아 등 비OPEC 산유국...
2016,2019.02.15.,"대한항공·아시아나항공, 오너리스크에도 최대 매출 냈지만 수익성은 악화",국내외 여행수요 증가 및 신시장 개척과 미국 델타항공과의 태평양노선 조인트벤처 시행에 따른 시너지 효과가 주효했다는 분석이다.그러나 국제유가 상승이 발목을 잡으며 영업이익은 2017년 대비 27.6% 대폭 감소한...
2017,2019.02.13.,"""제주항공, 지방발 노선 확대로 단기 수익성 감소""","것으로 예상돼 향후 L/F는 상승할 것""이라고 전망했다. 그는 ""국제 유가가 현 수준을 유지한다면 올해 1분기 실적에 대한 기대감은 유효하다""며 ""장기적으로 제주항공의 지방거점 확보 전략은 합리적""이라고 전망했다."
2018,2019.02.18.,"[더벨]에어부산, 수익성 뒷걸음질…빛바랜 '최대 매출'",국제유가 상승으로 인한 유류비 증가와 환율 상승으로 외화환산손실이 발생하면 재무적 부담이 커진다.지난해의 경우 1분기 두바이유 가격은 배럴당 60달러 수준에서 5월을 기점으로 70달러로 올랐다. 이어...
2019,2019.02.18.,18일 휘발유값 상승세... 평균 1342 원 대 형성,"국내 휘발유 가격이 국제 유가와 유류세 효과 등으로 가격 상승세를 보였다. 한국석유공사 유가 정보 서비스인 '오피넷' 에 따르면, 이달 18일 보통 휘발윳값은 +0.07원 떨어진 리터당 1342.69원으로 집계됐다...."
2020,2019.02.14.,"아시아나항공, 작년 영업이익 1784억…전년比 35.3% ↓","회사 측은 ""매출액은 항공운송부문 및 연결 자회사 영업실적 호조에 따라 전년대비 10% 증가하여 역대 최대 매출액을 기록했으나, 국제유가 상승으로 인한 유류비 증가로 영업이익 감소 및 환율 상승으로 인한..."
2021,2019.02.13.,"[ET투자뉴스]롯데케미칼, ""이번이 바닥일 어닝…"" BUY (MAINTAIN)-하이투자증...","연초 국제유가 회복에 따라 화학제품가격도 일부 반등하였고, 이에 실적으로 반영되는 1M Lag 제품 Spread 가 크게 개선되었기 때문이다. 저가원료 투입에 따른 재고 효과로 큰 폭의 실적 개선을 기대해 볼..."
2022,2019.02.19.,"[어닝 2018]이웅열 빠진 코오롱인더, 분할후 최악 실적",국제 유가가 오르면서 화학섬유 사업 전반의 원자재 비용 부담이 커진 것이 타격이 됐다. 코오롱인더스트리로서는 그룹 수장이 갑작스럽게 자리를 비운 상황에서 수익성을 정상화해야하는 시험대에 올라서게 된...
2023,2019.02.17.,"정유사 평균 공급價, 휘발유-0.6원, 경유 15.2원 각각 올라","한편 국제유가는 OPEC 1월 생산량 감소, 베네수엘라 정정불안 지속 등의 영향으로 상승했지만 미국의 원유재고 증가 등은 유가 상승폭을 제한했다. 이로 인해 국내 석유제품가격은 국제유가의 강보합세와..."
2024,2019.02.19.,"2019 기계산업, 생산·수출 모두 1%대 소폭 성장 전망","플랜트의 경우 2018년 정부의 신재생에너지 정책, 국제 유가의 상승 국면 중단 후 지속 하락 등 복합적 영향으로 수주 기근을 겪었다. 건설기계 분야는 굴삭기의 연간 판매 실적이 중국 시장의 큰 폭 확대와 미국..."
2025,2019.02.12.,[뉴욕마감]무역협상·워싱턴 정국 경색…불확실성에 투자자 갈팡질팡,금값은 뉴욕상품거래소 기준 4월 인도분이 전날보다 온스당 0.5%(6.60달러) 하락한 1311.90달러를 기록했다. 국제 유가는 3월 인도분 서부 텍사스산 원유(WTI)가 전 거래일보다 배럴당 0.6%(0.31달러) 떨어진 52.41달러를 기록했다.
2026,2019.02.26.,"한국증시 ""관망""...삼성엔지니어링 · 한국항공우주 · 현대로템 '껑충'","국제유가 급락 소식에 SK이노베이션(-1.63%), S-Oil(-0.80%) 등이 하락했다. 삼성엔지니어링은 1분기 실적이 기대된다는 전망이 나오면서 3.82% 급등했다. 외국인들은 그러나 이날 151만주를 순매도했다...."
2027,2019.02.14.,"아시아나항공 작년 매출 신기록, 영업이익은 유류비 늘어 뒷걸음",국제유가 상승으로 2017년보다 유류비가 4327억 원 증가한 영향을 받았다. 다만 연결 자회사의 영업 호조로 흑자는 유지했다. 순이익은 외화 환산손실이 발생하면서 적자로 전환했다. 재무구조는 2017년보다 개선됐다....
2028,2019.02.14.,"뉴욕증시, 美 소매판매 급감 충격 하락 출발","국제유가는 혼재했다. 3월물 서부텍사스산 원유(WTI) 가격은 전 거래일보다 0.65% 하락한 53.65달러에, 브렌트유는 0.28% 오른 63.79달러에 움직였다. 시카고상품거래소(CME) 페드워치에 따르면 연방기금(FF) 금리선물..."
2029,2019.02.14.,"트럼프 ""중국, 미국의견 대단히 존중하는 상황""",황숙혜 특파원 = 미국과 중국의 무역협상 진전에 대한 기대에 뉴욕증시와 국제 유가가 동반 상승한 가운데 도널드 트럼프 미국 대통령이 또 한 차례 장밋빛 발언을 내놓았다. 양국 협상 팀이 무역전쟁 재점화를 차단하기...
2030,2019.02.12.,"제주항공의 2가지 전략, 최대 매출과 18분기 연속 흑자 견인","영업이익은 국제유가의 가파른 상승 등 비용 증가 요인에도 지난 4분기에도 54억원의 이익을 내 2017년 수준을 유지하며 연간 기준 2011년부터 8년 연속, 분기 기준 2014년 3분기 이후 18분기 연속 영업이익을..."
2031,2019.03.08.,[1보] 경상수지 흑자폭 9개월만 최저..반도체 등 단가하락에 수출악화,반도체 단가와 국제유가 하락에 따른 수출악화가 원인이 됐다. 여행수지도 방학이라는 계절적 요인에 적자폭이 확대됐다. 반면 외국인의 국내 증권투자는 주식시장을 중심으로 5개월만에 유입세를 보였다. 8일...
2032,2019.02.11.,구직급여 지급액 ‘사상 최대’…지난해보다 39% 급증,"국제유가 하락 영향으로 지표상 으로 소비자물가 상승률은 떨어졌지만, 실제 소비자들의 인식은 변하지 않은 겁니다. [앵커] 소비자들은 왜 실제와 달리 물가가 떨어졌다고 느끼지 못한 겁니까? [기자] 460여 개에..."
2033,2019.02.14.,"주유소 휘발유 가격 하락세 끝물...""오를 일만 남았다""","이는 정부의 유류세 인하 정책에 국제유가 및 국제 제품가격 하락이 맞물린 결과다. 앞서 정부는 지난해 11월 국제유가 상승 등으로 국민들의 유류비 부담이 커지자 휘발유와 경유, LPG부탄 등 수송용 연료에 대한..."
2034,2019.02.21.,"대전 보통휘발유 평균판매가 ℓ당 1330원, 전주 대비 소폭 상승",휘발유 가격은 정부의 유류세 인하 등으로 지난해 큰 폭 내림세를 보였지만 올해 들어 국제유가 상승 등의 영향으로 낙폭이 줄어든 데 이어 반등에 나섰고 향후 인상도 예고됐다. 21일 한국석유공사 유가정보서비스...
2035,2019.02.14.,"금호아시아나그룹 지난해 매출 9조8000억, 전년비 10%↑",금호아시아나그룹은 국제유가가 안정세를 보이는 가운데 사드로 촉발된 한국과 중국의 갈등도 해소되고 있어 아시아나항공이 실적 개선의 주축이 될 것이라고 내다봤다. 이에 안정적인 재무구조와 약...
2036,2019.02.12.,"[뉴욕마감]월가, 미·중 무역협상 관망세 지속…혼조 마감",국제유가는 무역협상을 관망하며 하락했다. 뉴욕상업거래소(NYMEX)에서 3월 인도분 서부 텍사스산 원유(WTI)는 전 거래일보다 배럴당 0.6%(0.31달러) 떨어진 52.41달러에 장을 마쳤다. 런던 ICE 선물거래소의 4월물...
