,날짜,제목,요약
708,2018.01.12.,날개 단 국제유가…‘低배기량·高연비’ 한국ㆍ일본車 청신호,이투데이=김준형 기자 | 덩치 큰 SUV·픽업 트럭 수요 위축 전망 ‘글로벌 車시장’ 재편 가능성 국제유가 상승세를 바탕으로 글로벌 자동차 시장이 재편될 가능성이 나왔다. 저배기량과 연비 좋은 차에 집중해온 한국과...
709,2018.01.12.,"정유업계, 유가 고공행진 속 정제마진 이상에 '긴장'",(서울=연합인포맥스) 이민재 기자 = 지난해 저유가와 정제마진 강세로 호황을 누린 국내 정유업체들이 최근 들어 가파른 상승세를 나타내는 국제유가 동향을 예의주시하고 있다. 겨울철 성수기임에도 유가 상승으로...
710,2018.01.17.,너무 급히 올랐나?...국제 유가 & 美 정유주 동반 하락,BP의 주가는 멕시코만 악재 및 유가 하락 겹치며 3% 이상 추락 [초이스경제 이미애 기자] 16일(미국시각) 국제 유가가 모처럼 급락했다. 그간 너무 가파르게 오른데 따른 피로감이 이날 가장 큰 하락 이유였다....
711,2018.01.12.,날개 단 국제유가…‘低배기량·高연비’ 한국ㆍ일본車 청신호,이투데이=김준형 기자 | 덩치 큰 SUV·픽업 트럭 수요 위축 전망 ‘글로벌 車시장’ 재편 가능성 국제유가 상승세를 바탕으로 글로벌 자동차 시장이 재편될 가능성이 나왔다. 저배기량과 연비 좋은 차에 집중해온 한국과...
712,2018.01.12.,"정유업계, 유가 고공행진 속 정제마진 이상에 '긴장'",(서울=연합인포맥스) 이민재 기자 = 지난해 저유가와 정제마진 강세로 호황을 누린 국내 정유업체들이 최근 들어 가파른 상승세를 나타내는 국제유가 동향을 예의주시하고 있다. 겨울철 성수기임에도 유가 상승으로...
713,2018.01.18.,"한은 ""공격적 통화긴축, 버블붕괴, 유가급등 위험 제한적""","국제유가 급등 가능성도 제한적이라고 봤다. 석유수출국기구(OPEC) 산유국의 정정 불안이 높아지고 있으나 셰일오일 증가, 감산합의의 조기 종료 가능성 등으로 과거(1, 2차 석유위기)와 같은 유가 급등 위험은..."
714,2018.01.16.,"국제유가, 30년래 최고치...美 셰일 업체 자극할까 우려",이투데이=이지민 기자 | 산유국 감산 효과에 국제 유가 고공행진 국제유가가 15일(현지시간) 3년 만에 최고치를 기록했다. 높아진 유가가 미국의 셰일 업체를 자극해 유가 하락 압력으로 돌아올 것이라는 불안감도...
715,2018.02.10.,작년 세수 규모는…올해 첫 고용성적표 내주 발표,국제유가 상승과 원/달러 환율 하락이 엇갈린 가운데 수출입물가가 어떤 방향으로 움직였을지가 관심이다. 작년 12월에는 원화상승 효과가 더 크게 반영되며 수출입물가가 동반 하락했다. 이날 작년 12월과 연간...
716,2018.02.10.,"휘발유값 28주 연속 오름세...제주도 '1637원', 상승폭 가장 커","석유공사는 미 달러화 강세와 미 금리 인상 가속화 전망, 2018년 미국 원유 생산 전망치 상향 조정, 미 원유 재고 증가 등에 따라 국제유가가 하락하면서 국내유가 상승세는 완화될 것으로 전망된다고 밝혔다...."
717,2018.01.17.,[투데이 잇(it)슈] 국제유가 고공행진…전망과 투자전략,"#[투데이 잇(it)슈] 국제유가 고공행진…전망과 투자전략 시시각각 변화하는 글로벌 마켓, 월가엔 지금 무슨일이? 간밤 핫한 이슈를 집중 분석, 관련 국내외 종목의 투자 전략까지 한방에 제시합니다! <출연자..."
718,2018.01.13.,국제유가 또 뛰었지만...미국의 원유증산 우려도 부각,이날 국제 유가가 또 오르자 미국증시 내 주요 정유업체인 쉐브론(+0.78%) 엑손모빌(+0.68%) 등의 주가도 상승세를 이어갔다. 하지만 원유시장에 대한 일말의 불안감도 표출된 하루였다. 이날 원유정보제공업체...
719,2018.01.11.,"대신증권 ""국제유가, 70달러까지 상승 가능""","[한스경제 김지호] 대신증권은 11일 국제유가가 배럴당 70달러까지 상승할 수 있다고 전망했다. 박형중 연구원은 ""최근 도널드 트럼프 미국 대통령의 중동정책, 이란 반정부 시위, 베네수엘라 디폴트 위험 등 지정학적..."
720,2018.02.10.,휘발유값 28주 연속 상승...주유소 판매가격은?,최장 기간 상승 기록을 이어온 유가는 국제유가가 하락하면서 상승세가 완화될 것으로 보인다. 10일 한국석유공사 유가 정보 시스템인 오피넷에 따르면 지난주 휘발유 판매가격은 전주 대비 4.2원 상승한 리터...
721,2018.01.13.,국제유가 또 뛰었지만...미국의 원유증산 우려도 부각,이날 국제 유가가 또 오르자 미국증시 내 주요 정유업체인 쉐브론(+0.78%) 엑손모빌(+0.68%) 등의 주가도 상승세를 이어갔다. 하지만 원유시장에 대한 일말의 불안감도 표출된 하루였다. 이날 원유정보제공업체...
722,2018.01.11.,"대신증권 ""국제유가, 70달러까지 상승 가능""","[한스경제 김지호] 대신증권은 11일 국제유가가 배럴당 70달러까지 상승할 수 있다고 전망했다. 박형중 연구원은 ""최근 도널드 트럼프 미국 대통령의 중동정책, 이란 반정부 시위, 베네수엘라 디폴트 위험 등 지정학적..."
723,2018.01.15.,"전반적 하락 예상되는 원 달러 환율, 상승 중인 국제 유가 등으로 1,060원대 ...","중인 국제 유가 등으로 저점 매수세 출회 시 1,060원대 이하에서는 하락폭이 제한될 수 있을 것으로 보인다. ▶ 금일 달러/원 예상 범위 : 1,054.33 ~ 1,069.33원 ▶ 체크포인트 ■ 전일 외국인 주식 매매 동향 : -1,175.86억..."
724,2018.01.12.,"국제유가, 나흘째 상승·3년 만에 최고치…브렌트유, 장중 70달러 돌파",이투데이=배준호 기자 | 국제유가가 새해 들어 강한 상승세를 보인 끝에 3년여 만에 최고 수준을 나타내고 있다. 국제유가 벤치마크인 미국 서부텍사스산 중질유(WTI) 가격은 11일(현지시간) 나흘째 상승했다. 2월...
725,2018.02.09.,한풀 꺾인 내수… 전산업생산·투자는 두 달 연속 증가세,"한파로 일부 채소류 및 수산물 가격 강세를 버였지만 기저효과와 축산물 가격 하락 등으로 농축수산물이 하락세(-0.6%)로 전환했고, 최근 국제유가 상승세에도 기저효과 및 환율절상 등으로 석유류의 상승폭이 4.5%로..."
726,2018.01.11.,"국제유가 과열?... WTI · 브렌트, 64달러 & 70달러 근접",상승 요인 많으나 미국 셰일오일 증산 우려 등은 늘 경계해야 [초이스경제 이미애 기자] 10일(미국시각)에도 국제 유가는 상승세를 이어갔다.  3거래일 연속 올랐다. 그러나 시장 일각에선 과열을 경고하는 목소리도...
727,2018.02.08.,"호반건설, 전국적 인지도 얻었지만... 해외진출 가능성 스스로 좁혀","해외건설 사업은 환율, 국제유가 변동을 비롯한 사업 리스크가 큰 시장인데도 호반건설이 3,000억원 규모의 손실을 확인한 것만으로 쉽게 물러서는 모습을 보이면서 해외 진출의 자질이라 할 수 있는 ‘인내와..."
728,2018.01.11.,"유가상승 지속, 전기차에 기회되나","반면 23주째 국제유가가 상승한 지난 7일 서울의 한 주유소에선 휘발유가 1968원/L, 경유가 1768원/L에 팔리고 있다. 1월 첫째주 전국 주유소 휘발유 판매가격은 전주 대비 1.8원 상승한 1544.9원/L을 기록했다. [전기신문]..."
729,2018.02.09.,"WTI·브렌트유, 배럴당 60弗 다시 붕괴?","국제유가, 美생산 증가에 닷새째 하락 [서울경제] 국제유가는 8일(현지시간) 하락세를 지속했다. 이날 뉴욕상업거래소(NYMEX)에서 3월 인도분 서부 텍사스산 원유(WTI)는 배럴당 1%(0.64달러) 내린 61.15달러에 거래를..."
730,2018.02.10.,휘발유값 28주 연속 상승세…최고가 SK에너지 제품,"석유공사는 “미국 달러화 강세와 금리 인상 가속화 전망, 올해 미국 원유 생산 전망치 상향 조정 및 원유 재고 증가 등의 영향으로 국제유가가 하락하면서 국내 유가 상승세는 다소 완화될 것”이라고 내다봤다...."
731,2018.01.11.,"유가상승 지속, 전기차에 기회되나","반면 23주째 국제유가가 상승한 지난 7일 서울의 한 주유소에선 휘발유가 1968원/L, 경유가 1768원/L에 팔리고 있다. 1월 첫째주 전국 주유소 휘발유 판매가격은 전주 대비 1.8원 상승한 1544.9원/L을 기록했다. [전기신문]..."
732,2018.02.09.,"WTI·브렌트유, 배럴당 60弗 다시 붕괴?","국제유가, 美생산 증가에 닷새째 하락 [서울경제] 국제유가는 8일(현지시간) 하락세를 지속했다. 이날 뉴욕상업거래소(NYMEX)에서 3월 인도분 서부 텍사스산 원유(WTI)는 배럴당 1%(0.64달러) 내린 61.15달러에 거래를..."
733,2018.01.12.,국제 유가 또 오르며 미국증시까지 견인...그러나 유가 전망은 엇갈려,"씨티 ""유가 연내 80달러 가능"" vs UAE장관 ""원유시장 불안 요인 존재"" [초이스경제 이미애 기자] 11일(미국시각) 국제 유가가 또 뛰었다. 4거래일 연속 올랐다. 글로벌 원유 가격의 기준이 되는 북해산 브렌트 유가는 장중..."
734,2018.02.10.,"널뛴 美채권금리…뉴욕증시, 1%대 상승 마감","◇일제히 반등…국제유가는 올 들어 처음 60달러 밑으로 떨어져 9일(현지시각) 다우존스산업지수는 전날보다 330.44포인트(1.38%) 오른 2만4190.90을, S&P500지수는 38.55포인트(1.49%) 상승한 2619.55를 기록했다...."
735,2018.02.09.,"[ET투자뉴스]GS, ""2018년 정유와 …"" 매수(유지)-KB증권","국제유가 강세와 에너지 수요 확대를 통해 SMP가격의 강세가 지속될 것""라고 분석했다. 또한 KB증권에서 ""동사의 4분기 매출액과 영업이익은 4조 2,071억원, 5,371억원으로 전년동기대비 각각 13.5%, 5.0..."
736,2018.01.11.,천정부지 유가에 쪼그라든 정제마진... 정유업계 한숨,(그래픽) 10면 국제유가 추이와 싱가포르 정제마진(2단) [메트로신문 | 오세성 기자] 지난해 유례없는 호황을 누린 정유업계가 천정부지로 오르는 국제유가에 긴장하고 있다. 10일 국제유가는 서부 텍사스산 원유(WTI)...
737,2018.02.10.,[뉴욕마감]상승 반전..다우 1.38%↑,국제유가는 엿새째 하락세를 기록했다. 뉴욕상업거래소(NYMEX)에서 3월 인도분 서부 텍사스산 원유(WTI)는 전날보다 3.2%(1.95달러) 급락한 59.20달러를 기록했다. WTI가 올해 들어 60달러 밑으로 떨어진 것은 처음이다....
738,2018.02.08.,"대한항공, 지난해 당기순이익 9079억 '사상 최대'","영업이익의 경우 국제유가 상승에 따라 전년에 비해 하락했지만, 당기순이익은 원화 강세 등으로 인한 외화환산차익 등이 발생해 흑자전환했다. 이에 지난해 3월 유상증자 및 6월 영구채 발행을 통한 자본확충으로..."
739,2018.02.10.,"'검은 일주일' 보낸 중국, 리스크 큰 원유 선물 3월 개시 강행 자신감",중국의 원유 수입(흰색)과 국제유가(브렌트유 기준) 추이 /블룸버그 지난해 미국을 제치고 세계 최대 원유수입국이 된 중국이 위안화로 결제하는 원유 선물 시장을 개장하는 건 위안화 국제화를 가속화하는 대표적인...
740,2018.02.08.,"대한항공, 지난해 당기순이익 9079억 '사상 최대'","영업이익의 경우 국제유가 상승에 따라 전년에 비해 하락했지만, 당기순이익은 원화 강세 등으로 인한 외화환산차익 등이 발생해 흑자전환했다. 이에 지난해 3월 유상증자 및 6월 영구채 발행을 통한 자본확충으로..."
741,2018.02.10.,"'검은 일주일' 보낸 중국, 리스크 큰 원유 선물 3월 개시 강행 자신감",중국의 원유 수입(흰색)과 국제유가(브렌트유 기준) 추이 /블룸버그 지난해 미국을 제치고 세계 최대 원유수입국이 된 중국이 위안화로 결제하는 원유 선물 시장을 개장하는 건 위안화 국제화를 가속화하는 대표적인...
742,2018.01.13.,국제유가 5일 연속 상승…WTI 64달러 돌파,"[한스경제 신진주] 국제유가가 닷새 연속 올랐다. 13일 뉴욕상업거래소에서 2월 인도분 서부 텍사스산 원유, WTI는 전날보다 배럴당 0.8% 오른 64달러 30센트를 기록했다. 64달러 77센트를 기록했던 지난 2014년 12월 이후..."
743,2018.02.08.,"한미 금리역전 임박에 한은 ""성장·물가 등 종합 고려""","또, 소비자 물가 외에 근원 물가, 기대인플레이션, 국제유가, 글로벌 인플레이션, 각종 보조 물가지표, GDP(국내총생산)갭, 고용·제조업 유휴생산능력 지표 움직임도 주의깊게 살펴보겠다고 말했다. 미국 등 주요국..."
744,2018.02.08.,미국 셰일 붐이 만든 석유라이벌 러시아-사우디 '밀월',국제 유가가 최근 배럴당 70달러 선까지 올라 사우디와 러시아는 일단 한숨을 돌린 상태다. 사우디의 석유 수입이 늘어나면서 기업공개(IPO)를 준비하는 국영 석유회사 아람코의 기업가치도 올라갈 수 있을 것으로 보인다....
745,2018.02.06.,"제주항공, 영업이익 1천억원 시대…""LCC 최초""(종합)",제주항공은 지난해 '사드 보복' 여파로 중국인 관광객이 감소하고 국제유가가 반등하는 등 부정적인 외부 환경에도 나름의 전략으로 이를 극복하며 이같은 실적을 거뒀다. 중단거리 노선 중심의 공격적인 기단...
746,2018.02.09.,엔저의 힘…日수입차 올해도 씽씽 달린다,올해 역시 국제 유가가 60달러대를 유지하고 엔화 약세도 지속될 것이란 전망이 나오면서 일본차 강세 현상은 지속될 것이란 분석이다. 국내 일본차 업체들 역시 잇달아 신차 출시를 준비하며 출격 준비를 갖춘...
747,2018.02.08.,"코스피, 상승 출발해 장중 2,420선 회복","서상영 키움증권 연구원은 ""미국 증시가 장 후반에 하락 전환했으나 시장은 최근 변동성 장세에서 한발 물러나는 모습""이라며 ""국제유가 하락 외에 한국 증시에 악영향을 줄 재료는 많지 않다""고 설명했다...."
748,2018.02.09.,이란 생산량 증대 계획 발표…WTI 61.15달러,[매일일보 변효선 기자]  8일(현지시간) 국제유가가 하락했다. 9일 한국석유공사에 따르면 8일(현지시간) 뉴욕상업거래소(NYMEX)에서 거래되는 서부 텍사스산 원유(WTI)는 전일 대비 0.64달러 하락한...
749,2018.02.10.,[월간펀드평가] 해외주식형펀드 수익률 7.27%...브라질 펀드 날았다,세부 지역별로는 국제유가상승의 영향으로 브라질 펀드가 13.54%로 가장 우수한 성과를 달성했다. 그 중 미래에셋자산운용이 15.7%의 수익률로 브라질 펀드를 가장 잘 굴린 것으로 나타났다. KB자산운용은 14.11...
750,2018.02.06.,"제주항공, 고공비행","제주항공은 지난해 중국인 관광객 감소, 국제유가 반등 등의 악재를 탄력적 경영을 통해 이겨냈다. 수요가 많은 일본·동남아 노선 위주로 노선을 유연하게 운용하고 단일기재를 기반으로 한 다양한 노선..."
751,2018.01.18.,"장민 조사국장 ""국제유가, 지금과 같은 상승세 이어지진 않을 듯""",2018년 경제전망 설명회 (끝)
752,2018.02.07.,"""석유화학에 2조 투자""… '탈정유' 나선 GS칼텍스",국제 유가는 석유수출국기구(OPEC)의 감산 연장 등으로 배럴당 65달러를 웃돌며 3년여 만에 가장 높은 수준을 유지하고 있다. 유가가 오르면 에틸렌 등 석유화학제품 수요가 줄어들 가능성이 크다. 연말까지 미국에서...
753,2018.02.08.,"코스피, 장중 2,420선 회복…코스닥도 2%대 상승(종합)","서상영 키움증권 연구원은 ""미국 증시가 장 후반에 하락 전환했으나 시장은 최근 변동성 장세에서 한발 물러나는 모습""이라며 ""국제유가 하락 외에 한국 증시에 악영향을 줄 재료는 많지 않다""고 설명했다...."
754,2018.02.09.,국내선 유류할증료 4400원으로 인상,지난해 하반기 국제유가가 상승세로 돌아선 뒤 올 들어 배럴당 60달러를 넘어서면서 상승세를 지속하고 있다. 유류할증료는 싱가포르 원유 현물시장에서 거래되는 항공유(MOPS)의 2개월 평균가격에 따라 변동된다....
755,2018.02.09.,'8조 불발' 살짝 아쉽지만…정유4사 또 최대이익,정유업계가 유례없는 초호황을 맞은데는 국제유가의 완만한 상승세가 꼽힌다. 휘발유와 경유 공급은 부족한 반면 이를 공급할 수 있는 고도화 설비를 갖춘 업체가 많지 않다는 점도 호재다. 국내 정유업체들의 경우...
756,2018.02.10.,"뉴욕증시, 전일 급락 딛고 상승 출발","국제유가는 미국 원유 생산 증가 우려에 내렸다. 3월물 서부텍사스산 원유(WTI) 가격은 전 거래일보다 0.98% 하락한 60.51달러에, 브렌트유는 0.93% 내린 64.21달러에 움직였다. 시카고상품거래소(CME) 페드워치에 따르면..."
757,2018.02.10.,평창올림픽 17일간 열전 돌입...'미-중 안보 대화' 상반기 개최 ,베네수엘라에서는 국제유가 하락 등에 따른 경제난으로 지난해 4월부터 마두로 대통령의 퇴진을 요구하는 반정부 시위가 이어져 지금까지 100여 명이 숨졌는데요. 트럼프 행정부는 좌파 사회주의 정권인 마두로 정부의...
758,2018.02.09.,"28주 연속 오른 휘발유값, 1리터당 1563.8원…사상 최장 기록 연장",다만 한국석유공사는 국제유가가 하락하면서 국내유가 상승세가 완화될 것으로 내다봤다. 조선일보DB 2일 한국석유공사 유가 정보 서비스 ‘오피넷’에 따르면 2018년 2월 첫째 주 국내 주유소 휘발유...
759,2018.02.09.,[개장시황]美증시 패닉에 코스피 2%대 하락 출발…코스닥도 재차 급락,"이어 ""국제유가 또한 미국 산유량 증가 가능성이 제기되며 60달러 초반까지 하락한 점 또한 좋은 흐름은 아니다""라면서 ""영국 중앙은행인 영란은행(BOE)이 통화정책 회의 결과와 함께 발표한 인플레이션..."
760,2018.01.18.,"장민 조사국장 ""국제유가, 셰일오일 생산 증가로 증가세 둔화 전망""",2018년 경제전망 설명회 (끝)
761,2018.02.06.,"제주항공, 국적 LCC 중 첫 年영업이익 1000억 돌파","지난해는 사드 여파로 인한 중국인 관광객 감소, 국제유가 반등으로 인한 비용 부담 등 부정적 외부변수들이 많았음에도 불구하고 사상 최대 실적이었던 2016년 실적을 다시 한번 뛰어넘었다. 제주항공은..."
762,2018.02.10.,최저임금發 쇼크·청년실업 나아졌을까··올해 첫 고용성적표 나와,국제 유가 상승과 원·달러 환율 하락이 엇갈린 가운데 수출입물가가 어떤 방향으로 움직였을지도 주목된다. 작년 12월에는 원화상승 효과가 크게 반영돼 수출입물가가 동반 하락했다. 이날 작년 12월과 연간 통화...
763,2018.02.09.,LNG선 수주 행렬…미운오리 신세 벗는 조선업계,- 국제유가 상승ㆍ셰일가스 수출ㆍ환경기준 강화로 LNG선 발주 ‘훈풍’ - 올들어 잇단 수주ㆍ수주목표 일제히 상향…주가도 상승세 최악의 수주절벽으로 부실 업종의 대명사로 낙인찍혔던 조선업계에 온기가...
764,2018.02.07.,"석유화학 힘싣는 허진수 GS칼텍스 회장 ""올레핀에 2조 투자""",실제로 GS칼텍스의 경우 지난 2012년부터 3년 동안 국제유가가 배럴당 100달러가 넘을 때는 오히려 적자를 냈다. 허 회장 역시 균형 잡힌 사업 포트폴리오 구축을 지속적으로 강조해왔다. 지난해 창립 50주년...
765,2018.02.09.,"뉴욕증시, 기업실적·경제지표 주목 속 하락 출발","국제유가는 미국 생산 증가 우려가 지속하는 가운데 혼조세를 나타냈다. 3월물 서부텍사스산 원유(WTI) 가격은 전 거래일보다 0.32% 상승한 61.99달러에, 브렌트유는 0.15% 낮은 65.41달러에 움직였다...."
766,2018.02.08.,다시 오른 美 국채 금리…뉴욕증시 하락 마감,국제유가는 하락 흐름을 이어갔다. 뉴욕상업거래소(NYMEX)에서 3월 인도분 서부 텍사스산 원유(WTI)는 배럴당 1.60달러(2.5%) 하락한 61.79달러에 거래를 마쳤다. 4거래일 연속 하락세다. 런던 ICE선물거래소의 브렌트유...
767,2018.01.13.,국제 유가 뛰자...중국도 휘발유 & 디젤유 가격 전격 인상,이 번 정제유의 가격조정 주기 내에 국제유가는 대폭 상승하여 3년래 최고치에 달했다. 이 영향으로 말미암아 중국 내 유가는 상승했고 휘발유와 디젤유의 소매가격도 더불어 인상됐다. 최근 중국...
768,2018.02.08.,[국제유가] 심상찮은 하락세,[국제유가] 심상찮은 하락세 국제유가의 최근 미국 원유 생산량 증가 전망 등으로 촉발된 하락세가 심상치 않다. 8일 한국석유공사에 따르면 7일(현지시간) 미국 뉴욕상품거래소(NTMEX)에서 서부텍사스산원유...
769,2018.02.03.,휘발유값 '역대 최장' 27주째 상승…전국평균 리터당 1559.6원,국제유가가 국내유가에 반영되기까지는 2~3주 정도가 걸린다. 3일 한국석유공사 유가정보 서비스 오피넷에 따르면 1월 다섯째주 기준 전국 주유소 휘발유 평균 가격은 전주보다 4.3원 오른 리터당 1559.6원을...
770,2018.01.13.,국제 유가 뛰자...중국도 휘발유 & 디젤유 가격 전격 인상,이 번 정제유의 가격조정 주기 내에 국제유가는 대폭 상승하여 3년래 최고치에 달했다. 이 영향으로 말미암아 중국 내 유가는 상승했고 휘발유와 디젤유의 소매가격도 더불어 인상됐다. 최근 중국...
771,2018.02.09.,LNG선 수주 순풍…‘가슴 졸인’ 조선업계 숨 크게 쉬다,"국제유가 상승과 중국 LNG 수요 증가, 미국 셰일가스 수출 증가 및 환경규제 강화 등이 맞물리면서 LNG선 발주 여력이 커지자 조선업계가 모처럼 회복기에 접어들어섰다는 분석이 나온다. 신규 수주에 힘입어..."
772,2018.02.08.,[국제유가] 심상찮은 하락세,[국제유가] 심상찮은 하락세 국제유가의 최근 미국 원유 생산량 증가 전망 등으로 촉발된 하락세가 심상치 않다. 8일 한국석유공사에 따르면 7일(현지시간) 미국 뉴욕상품거래소(NTMEX)에서 서부텍사스산원유...
773,2018.02.03.,휘발유값 '역대 최장' 27주째 상승…전국평균 리터당 1559.6원,국제유가가 국내유가에 반영되기까지는 2~3주 정도가 걸린다. 3일 한국석유공사 유가정보 서비스 오피넷에 따르면 1월 다섯째주 기준 전국 주유소 휘발유 평균 가격은 전주보다 4.3원 오른 리터당 1559.6원을...
774,2018.02.10.,3월 국내선 유류할증료 4400원…18개월만에 최고,<사진제공=대한항공> [뉴스웍스=김영길기자] 국제유가 고공행진이 이어지면서 3월 국내선 유류할증료가 4400원으로 오른다. 항공업계에 따르면 국내 항공업체들은 다음달부터 국내선 유류할증료를 3300원에서...
775,2018.02.09.,"정유업계, 비(非)정유 사업으로 '이동'",원유를 정제해 휘발유 경유 등을 뽑아내는 정유 사업은 국제 유가에 따라 변동의 폭이 크고 이 사업만으로는 큰 이익을 거두기 어렵기 때문이다. 중국인도 등에서 석유화학 제품의 수요가 빠른 속도로 늘고 있어...
776,2018.02.07.,"세아베스틸, 매출 '3조 클럽'",세아베스틸은 국제 유가가 오르면서 수요가 늘고 있는 시추용 봉강 등 고부가가치 에너지 제품 판매를 늘린다는 방침이다. 세아베스틸은 올해 수출량이 40만t까지 확대될 것으로 전망했다. [한경닷컴 바로가기]...
777,2018.02.08.,"韓銀 ""물가 상승 압력 크지 않아 통화 완화 기조 유지…금융 불균형 누적은 우...",한은은 “국제 유가와 원·달러 환율의 급격한 움직임 등으로 앞으로 물가 경로의 불확실성이 크게 증대됐다는 점을 감안해 이들 요인이 물가에 미치는 영향을 면밀하게 모니터링할 필요가 있다”고 진단했다. 한은은...
778,2018.02.06.,"제주항공, 지난해 영업익 사상 첫 1000억 돌파","제주항공은 ""지난해 중국인 관광객 감소, 국제유가 반등 등 부정적 외부 변수들이 많았음에도 불구하고 사상 최대 실적이었던 전년 실적을 또다시 큰 폭으로 뛰어넘어 고공 성장을 이어왔다""고 평가했다...."
