,날짜,제목,요약
2166,2018.01.12.,'먹을 것 부족한' 베네수…약탈사태로 한달새 6명 사망,세계 최대 산유국 중 하나인 베네수엘라는 지난 2014년 국제유가 급락 이후 극심한 경제난을 겪고 있으며 식량을 비롯한 생필품 부족 사태가 장기화하고 있다. 현지 대학에 따르면 베네수엘라 인구 가운데 30.2%가...
2167,2018.01.18.,"[한은, 2년연속 3%대 성장 전망] ‘3% 성장’ 떠받칠 3대 포인트, 최저임금.평...","그러면서도 하반기에는 국제유가 상승 효과로 물가가 점차 상승압력을 받을 것으로 내다봤다. 올해 한은이 전제한 평균 원유도입단가는 배럴당 59달러로, 지난해(54달러)보다 높다. 내년에는 수요 측면 요인이 점차..."
2168,2018.01.22.,"""한국가스공사 주가 오른다"", 올해 순이익 흑자전환 가능","신 연구원은 ""올해 예상실적 기준으로 산정한 주당순자산가치(BPS) 9만6914원에 0.6배를 적용해 목표주가를 산출했다""며 ""(국제유가가) 장기적으로 서부텍사스중질유(WTI) 기준 배럴 당 65달러를 웃돌 경우 해외..."
2169,2018.01.23.,[경남 경기 전망] 조선해양·철강 약한 회복세… 올해도 저성장 계속된다,"다만, 올해는 원유 수요 회복, 주요 산유국의 감산 합의 이행 등으로 공급과잉 우려가 완화되면서 국제유가가 완만한 상승 흐름을 보일 것으로 예상되고 이에 따라 해양플랜트 실적 개선이 기대된다. 지난해까지는..."
2170,2018.01.15.,"""GS건설, 우호적 환경에 실적 안정권이 눈 앞에""","그는 ""국제유가는 지난해 말 배럴 당 60달러에서 현재는 65달러까지 상승하며 해외발주 환경 개선 기대감이 높아지고 있다""며 ""지난해 유가가 50달러였던 점을 감안하면 해외 수주 목표치도 뚜렷한 개선을 보일..."
2171,2018.01.13.,경제지표는 나쁘지 않은데… 문제는 청년 실업,다만 12월에는 원화 가치가 상승(환율 하락)하면서 국제유가 오름세가 물가에 영향을 덜 미치도록 완충 역할을 했지만 앞으로도 이런 현상이 지속될 것으로 보기는 어렵다. 실제 새해 들어 환율 하락세는 다소 진정된...
2172,2018.01.24.,"LG생활건강, 화장품 훨훨 날았지만 숙제도 늘었다","박종대 하나금융투자 연구원은 ""생활용품과 음료 부문 부진이 일시적인지 확신하기 어렵다""면서 ""생활용품은 헤어케어에 이어 홈케어까지 가격 경쟁이 심해지고 있고, 음료는 국제유가와 오렌지과즙 등 원가..."
2173,2018.01.19.,"시동 켠 해외수주… 전문가 ""지역·공종 편식 탈피해야""",이처럼 연초부터 수주 낭보가 이어지면서 국제유가 반등을 토대로 300억달러 벽을 3년 만에 넘어설 것이라는 기대감이 높아지고 있다. 문제는 국내 건설기업들의 해외 진출 약점 중 하나인 '중동 편중'이 여전하다는...
2174,2018.01.26.,현대건설 4Q 영업익 2천204억원 '부진'…환차손 가세(상보),"현대건설은 올해 영업계획과 관련해 ""국제유가 상승에 따른 해외발주 증가 기대감으로 중동·아시아 지역 중심의 해외 시장에서 선택과 집중, 시장다변화 전략을 통해 수주를 확대할 계획이다""고 설명했다. 이어..."
2175,2018.01.23.,[조선 인력 10만명 붕괴 눈앞]3년새 10만명 떠나...업황 회복돼도 숙련인력 없...,"세계 경기 회복에 따른 무역 확대와 국제유가 상승, 노후선박 교체시기가 맞물리며 업황이 개선되는 초입기라는 분석이다. 세계 시장에서 한국의 점유율(수주량 기준)은 지난해 27.7%, 중국은 39.5%, 일본은 8.6%다...."
2176,2018.01.23.,3년만에 '70달러' 고지 점령한 브렌트유,이날 국제 유가의 상승세를 주도한 것은 이라크였다. 아랍에미리트(UAE) 아부다비에서 1월 13일 열린 회의에 참석한 자바 알루아이비 이라크 석유 장관은 “생산량 감축을 연말까지 지속하기로 한 OPEC 합의가...
2177,2018.01.23.,"에쓰오일 목표주가 높아져, 정유업 호황으로 수익 좋아져","에쓰오일은 지난해 4분기에도 정제마진 확대와 국제유가 상승에 힘입어 견조한 실적을 냈을 것으로 추정됐다. 전 연구원은 ""국제유가는 두바이유를 기준으로 지난해 4분기 평균 유가가 배럴당 59.6달러로 집계됐는데..."
2178,2018.01.30.,"[30일 시황] 코스피 1%대 급락…외국인·기관, 전기전자주 '팔자'",이날 코스피는 국채금리 상승에 따른 해외증시 및 국제유가 하락 등에 따른 아시아 증시의 전반적인 약세를 보인 가운데 외국인‧기관 동반 전기전자주 중심의 차익매물 출회로 하락 마감했다. 전기전자...
2179,2018.01.13.,휘발유 24주 연속 상승…리터당 1천547.9원,"한국석유공사는 ""미국의 대 이란 신규 제재 부과 가능성과 미국 달러화 약세 등으로 국제유가가 상승함에 따라 국내 유가는 오름세를 이어갈 것""으로 전망했습니다. 연합뉴스TV : 02-398-4441(기사문의ㆍ제보) 카톡..."
2180,2018.01.11.,"美 증시, 중국 발 리스크에 주춤...유가 3년만에 최고치",국제유가는 전날에 이어 또 올랐다. 이날 뉴욕상업거래소(NYMEX)에서 2월 인도분 서부 텍사스산 원유(WTI)는 전날보다 배럴당 1%(0.61달러) 오른 63.57달러에 거래를 마쳤다. 이는 약 3년 만에 최고 수준이다. 런던...
2181,2018.01.18.,"현대제철, 후육관 공장 인수… 강관사업 `다각화` 활로 모색","현대알비 6만2000톤 규모 공장 국제유가 상승 해외 수요 전망 보호무역·조선업 불황 '이중고' 20년만에 재진출… 부진 타개 현대제철 당진제철소 현대제철 제공 현대제철이 송유관과 시추관, 대형 건축물 등에 쓰이는..."
2182,2018.01.20.,주유소 휘발유값 25주째 상승… 1리터 당 1551.5원,"한국석유공사 관계자는 ""러시아의 감산지속 필요 발언, 나이지리아 원유 공급 차질 가능성, 미 달러화 약세 등으로 국제유가가 강세를 보임에 따라 국내유가는 상승세를 이어갈 것""이라고 전망했다. 이남의 기자..."
2183,2018.01.27.,국적기 국제 유류할증료 인상…뉴욕-인천 20불 올려 180불,이 때문에 국제유가 하락으로 한국을 출발하는 국제선 유류할증료가 '0원'일 때도 국적 항공사들은 미주발 노선에 편도기준 80달러의 유류할증료를 부과해 왔다. 오는 2월(발권일 기준)부터 한 달간 한국을...
2184,2018.01.16.,24주 연속…무섭게 오르는 기름값,2원을 기록했다. 지난해 전국 주유소 휘발유 평균 가격은 1ℓ당 1천402.6원이었으나 국제 유가가 꾸준히 오르고 있어 상승세는 당분간 지속될 전망이다. ⓒ매일신문 - www.imaeil.com
2185,2018.01.14.,"이라크·UAE 등 ""OPEC 감산, 연말까지 지속돼야""","국제유가 70弗 육박에도… ""감산지속땐 셰일시장 확대"" 일부 산유국 우려에 반박 이라크, 아랍에미리트연합(UAE), 카타르, 오만 등 주요 산유국들이 석유수출국기구(OPEC)와 러시아 등 비 OPEC 산유국들의 감산이 당초..."
2186,2018.01.11.,'배고픈' 베네수…식료품트럭 습격중 10대소년 사망,"세계 최대 산유국 중 하나인 베네수엘라는 2014년 국제유가가 폭락하면서 경제위기 직격탄을 맞았다. 그 뒤 정권 부패와 정책 실패, 미국의 제재 등을 겪으며 극심한 인플레이션과 식량·의약품 품귀 현상 등 경제난의..."
2187,2018.01.19.,"뉴욕증시, 사상 최고 경신 부담에 소폭 하락 출발","국제유가는 미국 원유재고 감소에도 내림세를 보였다. 2월물 서부텍사스산 원유(WTI) 가격은 전 거래일보다 0.42% 하락한 63.70달러에, 브렌트유는 0.53% 낮은 69.01달러에 움직였다. 시카고상품거래소(CME) 페드워치에..."
2188,2018.01.21.,"반도체·정유·석화, 호실적 따라 올해도 성과급 기대↑",정유업계는 지난해 국제유가가 완만한 상승세를 보인 가운데 수익성 지표인 정제마진도 양호한 수준을 유지하면서 주력인 정유 사업에서 나쁘지 않은 실적을 거뒀다.  여기에 신규 사업으로...
2189,2018.01.17.,"뉴욕증시, 다우 사상 첫 26,000선 돌파 출발","국제유가는 최근 가격 상승에 따른 일부 이익 실현 움직임 등으로 내렸다. 2월물 서부텍사스산 원유(WTI) 가격은 전 거래일보다 0.36% 하락한 64.07달러에, 브렌트유는 1.05% 낮은 69.52달러에 움직였다...."
2190,2018.01.19.,"사우디, 남미 청정 에너지 시장에 '눈독'",석유수출국기구(OPEC) 중 최대 산유국인 사우디는 최근 국제유가 하락으로 재정적자를 겪고 있다. 지난 2015년 사우디 에너지 공급의 전부를 가스와 석유가 차지했다. 현재 사우디 정부는 옥상 태양열에 대한 보조금을...
2191,2018.01.14.,"이라크·UAE ""OPEC 감산 연말까지 지속돼야""","국제유가 기준물인 브렌트유는 런던시장(ICE)에서 11일 장중 배럴당 70.05달러까지 치솟았고, 이후 상승세가 꺾이기는 했지만 12일에도 0.6% 추가 상승하며 배럴당 69.87달러로 지난주를 마감했다. 블룸버그는 OPEC의 주된..."
2192,2018.01.18.,"항공업계, 항공유 인상에 '전전긍긍'","인천국제공항에 항공기들이 대기해 있는 모습 (사진=서울파이낸스 DB) 대한항공만 국내 유류 탱크 보유…나머지 항공사, 헤지수단 '無' 유류비 줄이기 위해 유류할증료 조정 및 가격 고려한 주유 중 국제유가가..."
2193,2018.01.17.,"뉴욕증시, 다우 사상 첫 26,000선 돌파 출발","국제유가는 최근 가격 상승에 따른 일부 이익 실현 움직임 등으로 내렸습니다. 2월물 서부텍사스산 원유 가격은 전 거래일보다 0.36% 하락한 64.07달러에, 브렌트유는 1.05% 낮은 69.52달러에 움직였습니다...."
2194,2018.01.15.,"""현대건설기계 주가 저평가"", 건설장비 글로벌 수요 증가","유 연구원은 ""건설장비 업황이 지속적으로 개선되기 위해서는 선진국에서 신흥국으로 이어지는 경기개선의 선순환이 중요하다""며 ""최근 국제유가 등 원자재 가격 상승과 신흥국들의 인프라 투자 확대로 건설장비 업황..."
2195,2018.01.22.,1월 수출 증가율 한자릿수로 둔화…반도체·석유제품 호조,품목별 수출을 보면 반도체 호조가 지속되고 있는 가운데 국제유가 상승에 힘입어 석유제품도 큰 폭의 증가세를 보이고 있다. 반도체 수출액은 전년대비 41.2%나 급증했고 석유제품도 24.3% 늘었으며 선박도 5.5...
2196,2018.01.19.,"OPEC, 2018 년 미국 생산 전망치 상향 조정 - 키움","OPEC은 최근 국제유가 상승으로 북미 지역을 중심으로 생산량이 증가할 수 있다고 진단. 미국 증산은 국제 유가 상단을 제한시킬 것 최근 WTI는 배럴당 64달러, 브렌트유는 배럴당 70달러 선까지 오르면서 2017년 중..."
2197,2018.01.25.,"[에너지 View] 12년 안에 석유시대 끝난다?...""2030년 전기차 40%…원유수요 ...",일각에서는 중국과 인도의 전기차 채택 가속화로 국제유가가 폭락할 수 있다는 우려도 제기된다. 앞서 중국과 인도는 2040년까지 화석연료 차량 판매를 중단하겠다는 계획을 제시했다. 이는 극심한 스모그가 양국...
2198,2018.01.15.,"서울경제TV 해외선물의 신, 해외선물 팀셰르파 쎈(SEN) 시황",1월12일 국제유가는 미국 원유채굴장비건수 증가에도 매수세가 추가로 유입되며 상승마감했습니다. 전주 미국의 원유재고가 8주째 감소했다는 소식과 이란에 대한 정치적 불확실성이 지속되고 있는 점에 유가가...
2199,2018.01.26.,"정유 업계, 지난해 영업익 10조원 안팎…2년 연속 ‘성과급 잔치’ 전망",이는 지난해 국제유가 상승과 미국을 강타한 태풍 ‘하비’의 영향으로 현지 정유·화학공장이 생산 중단에 따른 반사이익을 거뒀기 때문이다. 24일 증권업계와 정유업계에 따르면 국내 정유 빅4(SK이노베이션...
2200,2018.01.16.,"서울경제TV 해외선물의 신, 해외선물 팀셰르파 쎈(SEN) 시황",Crude Oil 2월물 : 배럴당 $65 돌파 실패시 단기 매도 관점 국제유가는 전일 마틴루터킹 휴장일을 맞이하여 조기종료한 가운데 전반적인 상승흐름은 여전히 유지하는 모습을 보여주었습니다. 미국의 기타 정유재고가...
2201,2018.01.18.,[뉴욕증시] 기업실적 기대감 다우지수 300p 이상 상승...3대지수 사상 최고,먼저 국제유가 확인해보겠습니다. 전날 숨고르기 장세에 들어갔던 국제유가. 오늘 장에서는 미국의 주간 원유재고 발표를 기다리는 가운데 상승했습니다. o 뉴욕 상업거래소에서 거래되는 서부텍사스산원유가격은...
2202,2018.01.25.,"한국농촌경제연구원, '2018 농업전망대회' 개최","최저임금 인상 및 국제유가 상승 등으로 농업경영비는 전년 대비 3.5% 증가하고 2018년 농업소득은 전년대비 8.7% 감소한 1,014만 원 내외가 될 것으로 전망했다. 농가인구는 2.1% 감소한 239만 명으로 전년대비 2.0..."
2203,2018.01.11.,"산업부차관 ""엔지니어링산업 高가치 고용창출 주도 적극 지원""","마지막으로 이 차관은 ""수년간 국내 사회 기반시설(SOC)의 투자감소와 저유가에 따른 중동 발주물량 급감에도 수주실적 회복에 대해 엔지니어링 업계의 노고를 치하한다""면서 ""올해는 세계경제의 완만한 회복세, 국제유가..."
2204,2018.01.21.,올해 IPO 최대 축제장 '기대'…현대오일뱅크 등 대거 입성,최근 국제유가가 반등하면서 고유가에 대한 우려가 나오고 있기에 올해가 상장을 위한 '최적기'라는 분석이 지배적이다.  또 카카오게임즈는 코스닥 시장 신규상장 최대어로 꼽힌다. 지난해 국내...
2205,2018.01.20.,"뉴욕증시, 미 연방정부 폐쇄 우려에도 상승 출발","국제유가는 석유수출국기구(OPEC)의 지난달 원유 생산 증가 소식에 내렸다. 2월물 서부텍사스산 원유(WTI) 가격은 전 거래일보다 0.52% 하락한 63.62달러에, 브렌트유는 0.4% 내린 69.03달러에 움직였다...."
2206,2018.01.25.,[에너지경제신문 오프라인] 먼저 만나는 에너지경제신문 헤드라인 - 1월 26일,"에너지 국제유가 강세장… 美셰일기업 첫 흑자전환 눈앞""팜오일 열대우림 훼손"" … EU, 바이오연료 사용 금지이란·인니 석유제품 수요 감소…천연가스 늘며 이라크 등 확대 ◇전국용인시, 5곳에 문학자판기 설치..."
2207,2018.01.22.,[임병용 GS건설 사장] “국내외 프로젝트 수행 역량 강화”,"◇ 유가 상승 호기 맞은 ‘EPC’ 지난해 하반기부터 국제유가가 반등하기 시작, 올해 들어 3년 만에 배럴당 70달러를 돌파했다. 지난 2~3년간 국내 건설업계 해외 수주를 힘들게 했던 ‘저유가’ 시대가 끝이 보이고..."
2208,2018.01.13.,새해에도 기름값 고공행진…24주 연속 상승,"한국석유공사는 ""미국의 대(對) 이란 신규 제재 부과 가능성, 미국 달러화 약세 등으로 국제유가가 상승함에 따라 국내 유가는 오름세를 이어갈 것으로 전망된다""고 밝혔다. /주홍철 기자 jhc@ggilbo.com 주홍철 기자..."
2209,2018.01.26.,벼랑끝 농업소득…1000만원 선도 위태,최저임금 인상과 국제유가 상승에 따라 농업경영비가 3.5% 증가할 것으로 전망되기 때문이다. 특히 최저임금 인상의 영향이 컸다. 올해부터 큰 폭으로 뛴 최저임금이 적용돼 농업임금이 13%나 오를 것이라는 게...
2210,2018.01.16.,"채권전문가 99% ""1월 한은 기준금리 동결될 것""",응답자의 33.0%는 시중금리 상승세를 예상했고 국제유가 상승으로 1월 물가 상승을 전망하는 응답자 비율은 26.0%로 전달보다 8.0%p 높아졌다. 환율 상승을 전망한 응답자 비율도 전달 8.0%보다 높은 12.0%로 조사됐다.
2211,2018.01.11.,"‘최저임금 인상 편승’ 가격인상 막는다…정부, 특별물가조사","“다만, 국제유가 변동성 확대 등 리스크 요인에 유념하면서 최저임금 인상을 빌미로 한 인플레 심리 확산 가능성에 선제적으로 대응할 필요가 있다”고 말했다. 그러면서 “정부는 일자리 안정자금의 차질 없는..."
2212,2018.01.29.,"'사상 최대 실적' 포스코대우, 4거래일 연속 강세","박종렬 현대차투자증권 연구원은 ""환율하락에도 불구하고 세계경기 호조에 따른 교역량 확대와 국제 유가를 비롯한 원자재 가격 상승 등으로 종합상사 업체들의 영업환경이 우호적""이라며 ""트레이딩과..."
2213,2018.01.30.,"[전문가시황]미 국채금리 급등, 인플레이션 신호?",유로화 약세에도 불구하고 유럽 주요국 증시는 국제유가 하락으로 에너지 관련주가 조정을 받으면서 하락세로 전환됐습니다. 반도체 기업 AMS의 주가가 17% 급등했지만 시장 하락을 막지는 못했습니다. 영국 증시는 0.08...
2214,2018.01.15.,신3 고현상과 2018년 한국경제,"최근 들어 국제유가와 원화가치가 오르고 있고, 금리도 인상가능성이 제기되면서 신3고현상이 뚜렷해지고 있다. 1980년대 중반에는 국제적으로 저유가, 저달러, 저금리가 지속되면서 3저호황을 맞았고 우리 경제에 큰..."
2215,2018.01.11.,"유류세 지난해 23조원 걷었다...리터당 휘발유 912원, 경유 676원씩","국제 경유가격이 리터당 256.34원 오를 때, 정유사는 424.15원, 주유소는 리터 당 130.25원 올렸고, 국제 경유가가 217.23원 내릴 때, 정유사는 393.98원, 주유소는 80.21원 내렸다고 계산됐다. 휘발유, 경유 판매량으로..."
2216,2018.01.16.,한은 금통위 “2% 물가안정목표 변경 필요성 낮다”,"다만 이는 국제유가 상승 등 외부 공급요인 영향이 컸고, 경기회복 등 수요 측면의 물가상승 압력은 여전히 낮다는 게 한은 판단이다. 이에 따라 한은은 앞으로도 2% 안팎의 낮은 물가안정목표제를 유지해 당분간 완화적..."
2217,2018.01.17.,"[오늘의 환율전망] 원/달러, 1064~1065원 출발 예상",김 이코노미스트는 “미국 뉴욕증시와 국제유가 등 위험자산 선호심리가 주춤해진 만큼 이날 원/달러 환율도 추가 하락보다는 소폭 상승이 예상된다”고 분석했다. 김수정 기자 superb@mt.co.kr <저작권자 ⓒ '성공을...
2218,2018.01.16.,주유소 휘발유 가격 24주째 상승,국내 유가는 국제 유가가 오르면 덩달아 오르게 된다. 지난 11일(현지 시간) 런던ICE 선물거래소의 브렌트유 선물 가격이 배럴당 69.26달러를 기록하는 등 국제 유가가 2014년 12월 70.54달러 이후 3년 만에 최고...
2219,2018.01.22.,"항공/여행, 수요와 수익 변동성이 낮아진다 - 키움",또한 경기 상황 개선에 따른 국제 유가 상승은 수요도 동반 견인하는 경우가 대부분이어서 수요 위축 우려는 과도하다고 판단된다. 이런 요인들에 따라 향후 수요 변동성이 낮아지고 이익 안정성이 강화되면 낮은...
2220,2018.01.24.,"정유업계, 지난해 석유제품 수출량 4.7억배럴…43%↑","대한석유협회 관계자는 ""올해는 글로벌 석유수요 증가와 국제유가 강세로 수출량 및 수출액 모두 지난해보다 확대될 것으로 전망된다""며 ""정유업계는 글로벌 연료 환경규제에 대응해 시설투자 확대와 베트남과..."
2221,2018.01.26.,"[사설] 치솟는 천연가스 값, LNG발전 확대 방침 다시 살펴야",LNG 수입이 연평균 40% 늘어난 데다 국제유가가 100달러(2011~2014년)를 넘나들면서 2015년까지 5년 연속 무역수지 적자를 기록했다. 정부는 몇 개월 앞조차 내다보지 못한 전력수급 계획을 하루빨리 현실에 맞게...
2222,2018.01.18.,멀리보고 담아두기 - 신한,"최근 국제유가의 가파른 상승 덕이다. WTI(서부텍사스중질유) 가격이 1개월여만에 10% 이상 급등하며 배럴당 65달러선에 근접했다. 달러 약세 기조 속에 이란발 지정학적 리스크, 공급 차질 가능성, 미국 한파 등이..."
2223,2018.01.23.,"""최저임금 여파로 농업소득 8.7% 감소"" 전망","이는 최저임금 인상에 농업임금이 13.0% 오르고 국제유가 상승에 따른 투입재 가격이 2.1% 상승하면서 농업경영비가 늘어날 것이란 분석에 따른 것입니다. [ⓒ 매일경제TV Mmoney & mktv.co.kr, 무단전재 및 재배포 금지..."
2224,2018.01.31.,"[해외시황] 뉴욕, 채권시장 불안 속 일제히 하락…유럽도↓",이런 가운데 국제유가는 미국의 원유생산량 증가 우려에 이틀 연속 하락했다. 이날 뉴욕상업거래소에서 3월 인도분 서부텍사스산원유(WTI)는 전일 대비 배럴당 1.06달러(1.5%) 내려간 64.50달러로 거래를 마쳤다....
2225,2018.01.14.,올해 수출 경기의 최대 복병은 '원화 강세'…원·엔 환율 1% 떨어지면 수출 0...,최근 상승세를 보이고 있는 국제유가도 올해 수출 경기의 주요 변수로 꼽혔다. 유가가 오르면 초기엔 수출단가 인상 효과로 기업들의 수출금액이 늘어난다. 하지만 중장기적으로 수출단가 인상은 수출물량 감소로...
2226,2018.01.26.,"""한국가스공사 LNG부문 실적 호조로 이익증가예상...목표가↑""","향후 한국가스공사 주가는 국제 유가 흐름과 연동되어 움직일 것으로 보인다. 2018년 한국가스공사의 세전 적정투자보수가 전년대비 971억원 증가할 것으로 판단하나, valuation에 미치는 영향은 미수금 회수..."
2227,2018.01.13.,새해에도 기름값 무섭게 오른다…24주 연속 상승,4원 상승한 1천340.3원으로 집계돼 25주 연속 상승세입니다. 한국석유공사는 미국의 대 이란 신규 제재 부과 가능성과 미국 달러화 약세로 국제유가가 상승하면서 국내 유가도 오름세를 이어갈 것으로 전망했습니다.
2228,2018.01.17.,"""코스닥, 900 하회하면 단기 조정…조정폭 제한적일 것""",최근 국제유가(WTI) 강세에 대해서는 건설업종에 주목했다. 정 연구원은 “최근 상승 과정에서 62달러에 위치한 지난 2015년 고점을 돌파한 점이 긍정적”이라면서 “건설업종은 작년 10월 고점대에서 탄력이 둔화되고...
2229,2018.01.13.,새해에도 기름값 '고공행진' 휘발유 1리터당 1547.9원… 24주 연속 상승,"한국석유공사는 ""미국의 대(對) 이란 신규 제재 부과 가능성, 미국 달러화 약세 등으로 국제유가가 상승함에 따라 국내 유가는 오름세를 이어갈 것으로 전망된다""고 밝혔다. /디지털뉴스부 "
2230,2018.01.20.,"포천시, 설 명절·올림픽 대비 물가안정 대책 추진","32개 품목은 수요급증, 국제유가 인상, 기상여건 악화, AI 발생 등으로 인한 가격급등이 예상되는 사과·배·밤 등 농산물 13개, 소고기·돼지고기·닭고기 등 축산물 5개, 조기·갈치·명태 등 수산물 5개, 외식용 돼지갈비..."
2231,2018.01.16.,[박재현의 ‘한 발 멀리서’]어느 날 ‘가난한 왕’의 고궁을 나오면서,만약 올해 물가가 오른다면 국제유가 등 대외변수 때문이거나 치솟는 부동산 가격 때문일 것이다. 고용이 줄어든다면 그동안 저금리로 버텼던 좀비 기업들이 금리 상승으로 도산하기 때문이지 최저임금이 올라서가...
2232,2018.01.17.,쇄신안 내놓은 삼성重…특수선 수주·해양플랜트 경쟁력 강화,"남 사장은 “수주목표액 비중은 조선 60%, 해양 40%가 될 것”이라며 “국제유가가 배럴당 70달러에 달하며 오일 메이저 기업들의 손익분기점인 50달러 이상 수준에서 안정화되고 있다”고 전했다. 이종혜 기자 hey333..."
2233,2018.01.31.,"러 자동차시장 작년 11% 성장…국내 업계, 적극 공략해야",국제 유가가 상승해 배럴당 75달러 이상으로 유지되는 게 러시아 경제에 가장 이상적이다. 이 경우 신차 시장은 더욱 큰 폭으로 성장할 수 있다. 연간 175만대까지도 바라볼 수 있다는 예측이 나온다. 하지만 배럴당...
2234,2018.01.17.,"경기도, 설 명절ㆍ평창 동계올림픽 앞두고 불공정행위 근절ㆍ물가안정 관리 총...","32개 품목은 수요급증, 국제유가 인상, 기상여건 악화, AI 발생 등으로 말미암은 가격급등이 예상되는 사과ㆍ배ㆍ밤 등 농산물 13개, 소ㆍ돼지ㆍ닭고기 등 축산물 5개, 조기ㆍ갈치ㆍ명태 등 수산물 5개, 돼지갈비ㆍ삼겹살 등..."
