,날짜,제목,요약
565,2019.07.11.,"유가 상승, WTI 60.43달러…미 원유재고 급감",국제유가는 비교적 큰 폭으로 올랐다. 11일 한국석유공사에 따르면 10일(현지시간) 뉴욕상업거래소(NYMEX)의 미국 서부텍사스산원유(WTI) 가격은 전일 대비 배럴당 2.60달러 오른 60.43달러를 기록했다. 유럽거래소...
566,2019.07.20.,"국제유가, 수요 감소보다 중동 긴장 '상승 반전'…WTI 0.6%↑",하락세를 보이던 국제유가가 상승 반전했다. 경제 둔화에 따른 수요 감소 전망보다는 미국과 이란 간 긴장감이 더 크게 작용했다. 다만 유가 상승폭은 제한됐다. 19일(현지시간) 뉴욕상업거래소(NYMEX)에서 8월...
567,2019.08.10.,전국 휘발윳값 3주 연속 상승…ℓ당 1500원 육박,"3원, 최고가 상표는 SK에너지로 ℓ당 1367.5원을 기록했다. 석유공사는 ""국제유가는 미-중 무역갈등 심화, 미국의 원유 및 석유제품 재고 증가 등의 영향으로 하락했다""고 설명했다."
568,2019.07.12.,"국제유가, OPEC 내년 원유 수요 감소 전망에 하락"," 국제유가가 11일(현지시간) 하락했다. 열대성 폭풍 배리(Barry) 상륙에 따른 원유 생산 차질 우려에도 불구, 석유수출국기구(OPEC)가 내년 전세계 원유 수요가 줄어들 것으로 전망하면서 유가는 전날 기록한 7주래..."
569,2019.07.18.,[국제유가] 미 석유제품 재고 증가 등으로 하락,"17일 국제유가는 미 석유제품 재고 증가, 미 멕시코만 원유생산 재개 소식 등으로 하락했고 이란의 미-이란 협상 가능성 반박, 미 달러화 약세 등은 하락폭을 제한했다. 한국석유공사 국제유가 동향에 따르면 WTI는..."
570,2019.07.18.,[국제유가] 미 석유제품 재고 증가 등으로 하락,"17일 국제유가는 미 석유제품 재고 증가, 미 멕시코만 원유생산 재개 소식 등으로 하락했고 이란의 미-이란 협상 가능성 반박, 미 달러화 약세 등은 하락폭을 제한했다. 한국석유공사 국제유가 동향에 따르면 WTI는..."
571,2019.07.11.,[국제유가] 10일 두바이유 등 국제유가 상승,"10일 국제유가는 중동산 두바이유를 비롯해 서부 텍사스산 원유, 북해산 브렌트유 등이 모두 상승했다. 한국석유공사(사장 양수영)는 서부 텍사스산 원유인 WTI가 전일대비 배럴당 2.60달러 상승한 60.43달러에..."
572,2019.07.15.,"7월 2주차 국제 유가, 재고·생산 감소 ↑",한국석유공사 석유동향팀은 12일 ‘유가정보서비스 오피넷’을 통해 ‘2019년 7월 2주 주간 국제유가동향’을 발표했다. 이에 따르면 대서양 유종인 브렌트(Brent)유는 전주보다 배럴당 3.22달러 상승한 66.52달러를...
573,2019.07.16.,[국제유가] 폭풍 약화로 멕시코만 원유생산 재개…유가하락,국제유가는 미국 멕시코만의 원유생산 일부 재개 등 요인에 따라 떨어졌다. 한국석유공사에 따르면 11일 북해산 브렌트유 선물은 배럴당 66.48달러로 전일대비 0.24달러 떨어졌다. 서부 텍사스산 원유(WTI)는 0.63달러...
574,2019.07.11.,"국제유가 4%대 급등, 미국 원유재고 대폭 줄고 금리인하 기대도 작용",국제유가가 크게 뛰었다. 10일 뉴욕 상업거래소(NYMEX)에서 서부텍사스산 원유(WTI)는 전날보다 배럴당 4.49%(2.6달러) 오른 60.43달러에 거래를 마쳤다. 10일 서부텍사스산 원유 가격이 배럴당 60달러를 넘어서는 등...
575,2019.07.12.,6월 수출입물가 5개월만에 동반하락…환율·유가하락이 원인,수입물가는 국제유가가 낮은 수준에 머문 것이 하락의 원인으로 해석된다. 국제유가는 지난달 중순 이후 반등했지만 5월과 비교해서는 낮은 수준을 유지하고 있다. 6월 두바이유 평균가는 배럴당 61.78달러로 5월...
576,2019.07.25.,"[국제유가]WTI 1.6% 반락… 사우디·쿠웨이트 ""중립지대 원유생산 재개""",지난주 미 휘발유 재고가 예상보다 덜 줄어든 점도 유가를 압박했다. 뉴욕상업거래소(NYMEX)에서 WTI... 해당 지역의 생산이 재개될 경우 일평균 50만배럴 원유가 새롭게 공급된다. 미 에너지정보청(EIA)에...
577,2019.07.18.,17일 국제유가 하락,"한국석유공사는 17일 국제유가는 미 석유제품 재고 증가, 미 멕시코만 원유생산 재개 소식 등으로 하락했고, 이란의 미국과 협상가능성 반박, 미 달러화 약세 등은 하락폭을 제한했다고 전했다."
578,2019.07.17.,[국제유가] 16일 두바이유 등 국제유가 하락,"16일 국제유가는 중동산 두바이유를 비롯해 서부 텍사스산 원유, 북해산 브렌트유 등이 모두 하락했다. 한국석유공사(사장 양수영)는 서부 텍사스산 원유인 WTI가 전일대비 배럴당 1.96달러 하락한 57.62달러에, 북해산..."
579,2019.08.10.,휘발윳값 3주 연속 오르며 1천500원 '턱밑',"경유 판매가격은 2주 연속 상승해 전주 대비 1원 오른 리터당 1,352.6원이었습니다. 석유공사 관계자는 최근 국제유가 하락으로 국내 휘발유와 경유 가격 상승세가 지속하지는 않을 것으로 내다봤습니다."
580,2019.07.23.,"""중동 긴장 고조""...국제 유가 뛰며 미국증시 견인","22일(미국시각) 국제 유가가 상승하면서 미국증시에 훈풍을 가했다. 이란 변수 지속, 리비아 최대 유전 원유생산 중단 등이 유가를 견인했다. 블룸버그 집계에 따르면 이날 뉴욕상업거래소에서 미국 동부시각 오후..."
581,2019.07.27.,"커들로 ""미-중 협상 큰 기대 안해""...국제 유가 또 '혼조', 미국증시 에너지주...","26일(미국시각) 국제 유가가 전일에 이어 또 다시 혼조세를 보였다. 미국산 유가는 소폭 상승했지만, 북해산 브렌트유 가격은 소폭 상승하다 막판 하락세로 돌아섰다. 이날 미국 경제지표 호조는 미국산 유가에..."
582,2019.07.22.,“향후 이란·미국 간 갈등 심화하더라도 국제유가 상승은 제한적” - 대신증...,대신증권은 22일 “향후 이란과 미국 간의 갈등이 심화하더라도 국제유가 상승은 제한적일 것”이라고 전망했다. 김소현 대신증권 연구원은 “이란의 호르무즈 해협 봉쇄 가능성과 이란과 미국의 전쟁 가능성이 작기...
583,2019.07.16.,"국제유가, 중국 2분기 성장률 우려에 하락…WTI 1.1%↓",국제유가는 15일(현지시간) 소폭 하락했다. 이날 뉴욕상업거래소(NYMEX)에서 8월 인도분 서부 텍사스산 원유(WTI)는 전 거래일보다 배럴당 1.1%(0.63달러) 떨어진 59.58달러에 거래를 마쳤다. 이날 국제유가는 중국의...
584,2019.07.19.,"[원자재시황] 국제유가, 美 증시 약세·생산 회복 영향에 1개월래 최저수준.....",국제유가가 18일(현지시간) 하락했다. 뉴욕상업거래소에서 8월물 서부 텍사스산 원유(WTI) 가격은 배럴당 1.48달러(2.6%) 하락한 55.30달러에 장을 마감했다. 브렌트유는 1.73센트(2.7%) 내린 61.93달러를 기록했다. WTI와...
585,2019.07.16.,[국제유가]中 성장률 부진에 하락세,중국의 경제성장률 부진 탓에 원유 수요가 감소할 거란 우려가 불거지면서 유가에 하방 압력을 가했다. 중국 국가통계국은 이날 2분기 경제성장률이 6.2%(전년동기 대비)로 잠정 집계됐다고 밝혔다. 이는 지난...
586,2019.07.12.,"국제유가, 수요감소 예측에 하락…WTI 0.4%↓",국제유가가 11일(현지시간) 소폭 내렸다. 이날 뉴욕상업거래소(NYMEX)에서 8월 인도분 서부 텍사스산 원유(WTI)는 전날보다 배럴당 0.4%(0.23달러) 떨어진 60.20달러에 거래를 마쳤다. 내년 원유 수요가 줄어들 것이라는...
587,2019.07.17.,16일 국제유가 하락,"한국석유공사는 16일 국제유가는 미국과 이란 간 긴장감 완화 기대, 미 멕시코만 원유생산 일부 재개 지속, 중국 경제의 불확실성 증대 영향 지속, 미 달러화 강세 등의 영향으로 하락했다고 전했다."
588,2019.07.26.,"국제 유가 ""상승하다 혼조세로""...에너지 주가 '추락'하며 미국증시에 '직격탄...",25일(미국시각) 국제 유가가 상승세를 보이다가 막판에 혼조세로 전환됐다. 유가는 시간이 흐를수록 비실대는 모습을 보였다. 미국산 유가는 소폭 상승했지만 북해산 브렌트유 가격은 소폭 상승하다 막판 하락세로...
589,2019.07.21.,6월 생산자물가 전월 대비 0.3% 하락→유가하락 영향,"한국은행은 ""6월 생산자물가가 전월 대비 0.3% 하락했다""며 ""국제유가 하락 등의 영향으로 5개월 만에 하락으로 전환했다""고 밝혔다. 한국은행 자료에 따르면 지난달 생산자물가는 103.49(2015=100)로 5월(103.79)보다 0.3..."
590,2019.08.09.,"""설빙, 가맹 모집 때 거짓 수익정보 제공""…경고 조치",■ 국제유가 나흘 만에 반등…저가성 매수세 유입 다음은 국제유가가 나흘 만에 반등했다는 소식입니다. 현지시간 8일 뉴욕상업거래소에서 거래되는 9월 인도분 서부 텍사스산 원유가 전날보다 배럴당 2.8% 오른 52....
591,2019.07.13.,"국제 유가, 중동 지정학 리스크에 소폭 반등 마감","국제 유가는 12일(현지시간) 중동을 둘러싼 지정학적 리스크가 높아진 여파로 소폭 반등해 마감했다. 뉴욕상업거래소(NYME)에서 이날 서부 텍사스산 원유(WTI) 8월 인도분은 전일 대비 0.01달러, 0.02% 오른 배럴당 60...."
592,2019.08.10.,휘발유 가격 3주 연속 오름세…서울 리터당 1588원,국내 유가가 오른 것은 국제유가 상승분이 2∼3주 시차를 두고 반영된 것이다. 다만 최근에는 유가가 하락하는 추세여서 국내 휘발유 및 경유 가격이 계속 오르진 않을 것으로 전망된다. 지역별로는 서울 지역...
593,2019.07.26.,"국제유가, 미 원유 재고 급감에 상승...WTI 0.3%↑",이투데이=김서영 기자 | 국제유가는 25일(현지시간) 상승했다. 뉴욕상업거래소(NYMEX)에서 9월 인도분 서부텍사스산 중질유(WTI) 가격은 전일 대비 0.14달러(0.3%) 상승한 배럴당 56.02달러로 거래를 마쳤다. 영국 런던...
594,2019.07.11.,[국제유가] 美원유재고 예상보다 크게 감소...국제유가 상승 WTI 4.44%↑,이영노 기자 ynlee@ajunews.com 10일(현지시간) 국제유가가 미국 원유 재고량 감소와 열대성 폭풍 우려에 따른 생산시설 가동 중단 소식까지 겹치면서 큰 폭으로 올랐다. 이날 뉴욕상업거래소(NYMEX) 8월 인도분...
595,2019.07.18.,[국제유가] 미-이란 긴장감 완화 기대에 폭락,미-이란 긴장감 완화 기대 등의 요인으로 국제유가가 대폭 떨어졌다. 한국석유공사에 따르면 16일 북해산 브렌트유 선물은 배럴당 64.35달러로 전일대비 2.13달러 떨어졌다. 서부 텍사스산 원유(WTI)는 1.96달러 하락한...
596,2019.07.17.,[국제유가]중동 지역 긴장 완화에 하락세,중동 지역의 긴장이 완화되면서 원유 수급 우려가 잦아든 점이 유가에 하방 압력을 가했다. 외신에 따르면 도널드 트럼프 미국 대통령은 이날 각료회의에서 “이란과 많은 진전이 이뤄졌다”며 “이란의...
597,2019.07.12.,[국제유가]WTI 0.4%↓… OPEC 내년 수요감소 전망이 멕시코만 폭풍 상쇄,유가는 장 초반 멕시코만 폭풍에 따른 생산차질 우려로 올랐다가 방향을 바꿨다. 뉴욕상업거래소(NYMEX)... 반면 미 멕시코만 생산활동 감소는 장 초반 유가에 상방 압력을 불어넣었다. 허리케인급 열대성 폭풍이...
598,2019.07.11.,[국제유가] 미국 원유 재고 큰 폭 감소 등으로 상승,"10일 국제유가는 미국 원유 재고 큰 폭 감소, 미 멕시코만 생산 감소, 미 달러화 약세 등의 영향으로 상승했다. 한국석유공사 국제유가 동향에 따르면 WTI는 전일대비 배럴당 2.60 달러 오른 60.43 달러, 브렌트유는 2.85..."
599,2019.07.16.,15일 국제유가 하락,"한국석유공사는 15일 국제유가는 미국 멕시코만의 원유생산 일부 재개, 중국 2분기 경제성장률 부진, 미 달러화 강세 등의 영향으로 하락했고, 중국 6월 정제처리량 증가 등은 상승폭을 제한했다고 전했다."
600,2019.08.10.,3주 연속 오르는 휘발윳값… 1494원 기록,국내 유가가 오른 것은 국제유가 상승분이 2∼3주 시차를 두고 반영된 것이다. 다만 최근에는 유가가 하락하는 추세여서 국내 휘발유 및 경유 가격이 계속 오르진 않을 것으로 전망된다. 지역별로는 서울 지역...
601,2019.07.16.,15일 국제유가 하락,"한국석유공사는 15일 국제유가는 미국 멕시코만의 원유생산 일부 재개, 중국 2분기 경제성장률 부진, 미 달러화 강세 등의 영향으로 하락했고, 중국 6월 정제처리량 증가 등은 상승폭을 제한했다고 전했다."
602,2019.07.12.,"[국제유가] 11일 두바이유 ↑, WTI․Brent유 ↓","11일 국제유가는 중동산 두바이유가 상승한 가운데 서부 텍사스산 원유, 북해산 브렌트유 등은 하락했다. 한국석유공사(사장 양수영)는 서부 텍사스산 원유인 WTI가 전일대비 배럴당 0.23달러 하락한 60.20달러에..."
603,2019.07.19.,"유가 60달러중반, 기초유분 소폭 상승",19일 석유화학업계에 따르면 12일 기준 두바이산 국제유가는 배럴당 전주대비 4달러(6.9%) 상승한 65.88달러였다. 이란 유조선 억류 관련 갈등이 지속되고 석유수출국기구(OPEC) 6월 원유생산 감소와 미국 기준금리 인하...
604,2019.07.12.,유가·환율 하락에 수출입물가 동반 하락…반도체 타격 커,투데이코리아=최한결 기자 | 국제유가가 하락해 지난 6월 수출입물가지수가 동반 하락했다. 수출물가는 4개월 연속 상승 후 하락 반전했다. 특히 반도체는 수출물가가 9개월 연속 하락하다 지난 5월 소폭...
605,2019.07.15.,12일 국제유가 상승,"한국석유공사는 12일 국제유가는 미국 멕시코만의 원유생산 차질, 지난주 미국 원유 시추기 수 감소, 미 달러 약세 등의 영향으로 상승했고, 국제에너지기구의 내년 OPEC 생산원유에 대한 수요 감소 전망 등은..."
606,2019.07.17.,[국제유가] 미-이란 긴장감 완화 기대 등으로 하락,"16일 국제유가는 미-이란 긴장감 완화 기대, 미 멕시코만 원유생산 일부 재개 지속, 중국 경제의 불확실성 증대 영향 지속, 미 달러화 강세 등의 영향으로 하락했다. 한국석유공사 국제유가 동향에 따르면 WTI는..."
607,2019.07.19.,[국제유가] 美멕시코만 원유생산시설 가동재개...국제유가 하락세 WTI 3.13%↓,이영노 기자 ynlee@ajunews.com 18일(현지시간) 국제유가가 열대성 폭풍으로 멈췄던 원유 생산 시설이 재가동됐단 소식에 하락세를 나타냈다. 뉴욕상업거래소(NYMEX) 8월 인도분 서부텍사스산원유(WTI)는 직전 거래일 대비...
608,2019.07.16.,美 허리케인 약화...국제 유가 & 미국증시 에너지주 '하락',"15일(미국시각) 국제 유가가 하락했다. 중국의 성장률 추락, 미국 허리케인 세력 약화 등이 유가 하락 이유였다. 미국증시 내 에너지 섹터의 주가도 고개를 숙였다. 블룸버그 집계에 따르면 이날 미국 동부시각 오후..."
609,2019.07.17.,미-이란 긴장완화 기대에 국제유가 3.3% 급락,국제유가가 16일(현지시간) 큰 폭으로 하락했다. 이날 뉴욕상업거래소(NYMEX)에서 8월 인도분 서부 텍사스산 원유(WTI)는 전날보다 배럴당 3.3%(1.96달러) 떨어진 57.62달러에 거래를 마쳤다. 도널드 트럼프 미국 대통령이...
610,2019.07.19.,[국제유가] 美멕시코만 원유생산시설 가동재개...국제유가 하락세 WTI 3.13%↓,이영노 기자 ynlee@ajunews.com 18일(현지시간) 국제유가가 열대성 폭풍으로 멈췄던 원유 생산 시설이 재가동됐단 소식에 하락세를 나타냈다. 뉴욕상업거래소(NYMEX) 8월 인도분 서부텍사스산원유(WTI)는 직전 거래일 대비...
611,2019.07.16.,美 허리케인 약화...국제 유가 & 미국증시 에너지주 '하락',"15일(미국시각) 국제 유가가 하락했다. 중국의 성장률 추락, 미국 허리케인 세력 약화 등이 유가 하락 이유였다. 미국증시 내 에너지 섹터의 주가도 고개를 숙였다. 블룸버그 집계에 따르면 이날 미국 동부시각 오후..."
612,2019.07.17.,미-이란 긴장완화 기대에 국제유가 3.3% 급락,국제유가가 16일(현지시간) 큰 폭으로 하락했다. 이날 뉴욕상업거래소(NYMEX)에서 8월 인도분 서부 텍사스산 원유(WTI)는 전날보다 배럴당 3.3%(1.96달러) 떨어진 57.62달러에 거래를 마쳤다. 도널드 트럼프 미국 대통령이...
613,2019.07.11.,"국제유가, 美재고 감소·허리케인 예보에 급등···WTI 4.5%↑",미국 원유 재고 감소 영향과 초강력 허리케인 예보에 국제유가가 폭등했다. 10일(현지시간) 뉴욕상품거래소(NYMEX)에서 8월 인도분 서부 텍사스산 원유(WTI)는 전날보다 배럴당 4.5%(2.60달러) 급등한 60.43달러에 거래를...
614,2019.07.14.,"[국제유가] 12일 Dubai유 ↓, WTI・Brent유 ↑","12일 국제유가는 중동산 두바이유가 하락한 가운데 서부 텍사스산 원유, 북해산 브렌트유 등은 상승했다. 한국석유공사(사장 양수영)는 서부 텍사스산 원유인 WTI가 전일대비 배럴당 0.01달러 상승한 60.21달러에..."
615,2019.07.12.,"뉴욕증시,연준 금리인하 시사 다우지수 사상 첫 2만7천 돌파ㆍ국제유가 WTI 0...",국제유가는 내년 원유 수요가 줄어들 것이라는 전망에 소폭  하락했다. 이날 뉴욕상업거래소(NYMEX)에서 8월 인도분 서부 텍사스산 원유(WTI)는 전날보다 배럴당 0.4%(0.23달러) 떨어진 60.20달러에 거래를 마쳤다. 런던...
616,2019.07.13.,국제유가 '강보합'...허리케인 vs 공급과잉 우려 '충돌',국제유가가 강보합세를 나타냈다. 열대성 폭풍 배리(Barry)로 미국 걸프만에서 원유 생산이 절반 이상 줄었으나 전세계 원유 공급 과잉에 대한 우려로 상승이 제한됐다. 12일(현지시간) 뉴욕상업거래소(NYMEX)에서 8월...
617,2019.07.13.,"유가 상승, WTI 60.21달러…美 멕시코만 열대성 폭풍 북상",국제유가는 소폭 상승 마감했다. 13일 한국석유공사에 따르면 12일(현지시간) 뉴욕상업거래소(NYMEX)의 미국 서부텍사스산원유(WTI) 가격은 전일 대비 배럴당 0.01달러 소폭 상승한 60.21달러를 기록했다. 유럽거래소...
618,2019.07.19.,[주간유가] 휘발유·경유 판매가격 7주 연속 하락,"2원 오른 1409.4원/ℓ을 나타냈다. 국제유가는 내년 대OPEC 수요 감소 전망, 미국의 석유제품 재고 증가 등의 상승 요인과 미국 원유 생산 및 시추기 수 감소 등의 하락 요인이 혼재해 약보합세를 보였다."
619,2019.07.24.,"중동긴장 지속, 미-중 협상 기대감 속...국제 유가 & 美 에너지 주가 '또 상승...",23일(미국시각) 국제 유가가 전일이 이어 또 오르면서 연일 미국증시에 긍정적인 영향을 미쳤다. 이날에는 중동불안 지속과 함께 미-중 무역협상 기대감이 유가에 호재로 작용했다. 블룸버그 집계에 따르면 이날 미국...
620,2019.07.13.,"국제유가, 소폭 상승...""허리케인 우려 vs 수요 감소""",지난 10일 폭등했던 국제유가는 11일 숨고르기 흐름을 보였다가 하루 만에 다시 오름세로 돌아섰다. 수요 감소와 재고 증가 전망 속에서도 미국 허리케인 우려 등 상승요인이 나타난 때문으로 풀이된다. 블룸버그...
621,2019.07.17.,"트럼프 ""이란과 진전""...국제 유가 '급락', 미국증시 에너지주 '추락'",16일(미국시각) 국제 유가가 급락했다. 미국-이란 간 관계 호전 기대가 유가 급락의 주된 이유였다. 유가 급락 속에 미국증시 정유주들도 고개를 숙였다. 블룸버그 집계에 따르면 이날 뉴욕상업거래소에서 미국...
622,2019.07.11.,"국제유가, 미국 재고 감소에 급등…WTI 4.5%↑", 국제유가가 4%대 치솟았다. 10일(현지시간) 뉴욕상품거래소(NYMEX)에서 8월 인도분 서부 텍사스산 원유(WTI)는 전날보다 배럴당 4.5%(2.60달러) 급등한 60.43달러에 거래를 마쳤다. 미국 재고가 급감하면서 국제유가를...
623,2019.08.10.,휘발유 가격 3주 연속 올라…리터당 1494원·전주比 2.0원↑,"3달러로 전주 대비 4.5달러 떨어졌다. 석유공사 관계자는 ""국제유가는 미중 무역갈등 심화, 미국의 원유 및 석유제품 재고 증가 등의 영향으로 하락했다""고 말했다."
624,2019.07.17.,"[국제유가] 트럼프 ""이란과 많은 진전 있었다""...국제유가 하락 WTI 2.80%↓",이영노 기자 ynlee@ajunews.com 16일(현지시간) 국제유가가 미국과 이란 간 갈등이 해소될 기미가 보이자 하락세를 나타냈다. 뉴욕상업거래소(NYMEX) 8월 인도분 서부텍사스산원유(WTI)는 직전 거래일 대비 1.67달러(2.80...
625,2019.07.12.,11일 국제유가 하락,"05달러 상승한 배럴당 65.95달러에 마감됐다. 한국석유공사는 11일 국제유가는 내년 OPEC 원유수요 감소 전망 등의 영향으로 하락했고, 미 멕시코만 생산 감소, 미 달러화 약세 등은 하락폭을 제한했다고 전했다."
626,2019.08.10.,"휘발유값 3주 연속 상승...""계속 오르진 않을 것""",국내 유가가 오른 것은 국제유가 상승분이 2∼3주 시차를 두고 반영된 것이다. 다만 최근에는 유가가 하락하는 추세여서 국내 휘발유 및 경유 가격이 계속 오르진 않을 것으로 전망된다. 지역별로는 서울 지역...
627,2019.07.12.,[국제유가] 대OPEC 원유 수요 감소 전망으로 하락,11일 국제유가는 내년 대OPEC 원유 수요(OPEC이 생산하는 원유에 대한 글로벌 수요) 감소 전망 등의 영향으로 하락했다. 한국석유공사 국제유가 동향에 따르면 WTI는 전일대비 배럴당 0.23 달러 내려간 60.20 달러...
628,2019.07.11.,[국제유가]美 원유 재고 감소에 상승세,미국의 원유 재고 감소가 유가에 상승 압력을 가했다. 미 에너지정보청(EIA)에 따르면 미국의 원유 재고는 지난주 950만배럴 줄었다. 전문가 예상치인 300만배럴 감소를 크게 상회한 수치다. 이날...
629,2019.07.11.,10일 국제유가 상승,"27달러 상승한 배럴당 63.90달러에 마감됐다. 한국석유공사는 10일 국제유가는 미국 원유재고 큰 폭 감소, 미 멕시코만 생산 감소, 미 달러화 약세 등의 영향으로 상승했다고 전했다."
630,2019.07.19.,"국제 유가, '중동 불안 엄습'에도 급락...무슨 일?","18일(미국시각) 국제 유가가 급락했다. 이란의 외국 유조선 억류 소식, 트럼프의 ""미국이 이란 무인기 격추"" 발언에도 유가는 떨어졌다. 미국 멕시코만 원유생산 재개 소식이 유가를 압박했다. 블룸버그 집계에..."
631,2019.07.19.,[국제유가]WTI 2.6% 하락…러시아 송유관 정상화,"18일(이하 현지시간) 미국 서부텍사스원유(WTI)가 2.6% 하락, 배럴당 55달러 대로 떨어졌다. 나흘 연속 낮아지며 4주 만에 최저를 기록했다. 이란 관련 긴장으로 상승했다가 급히 방향을 틀었다. 가동에 차질을 빚던..."
632,2019.07.11.,[국제유가]WTI 4.5% 급등…원유재고 급감 + 멕시코만 폭풍 우려,미 멕시코만 생산활동 감소도 유가에 상방 압력을 불어넣었다. 이날이나 다음날 해당 지역에 폭풍이... 달러인덱스가 금리인하 기대감에 하락한 점 역시 유가를 끌어올렸다. 제롬 파월 연방준비제도(연준)...
633,2019.07.22.,"[주간 유가 전망] ""국제유가, 이란 갈등 재점화…영향은 제한적""",이투데이=문선영 기자 | 이번주(7월 22~26일) 국제유가는 다시 부각된 미국과 이란간 갈등으로 변동성이 확대될 것이란 전망이다. 지난주 뉴욕상업거래소(NYMEX)에서 미국 서부텍사스원유(WTI)는 전주 대비 3.9% 하락한 57....
634,2019.08.10.,"8월 첫째주 전국 휘발윳값 ℓ당 1494원, 3주 연속 오름세",국내 유가가 오른 것은 국제유가 상승분이 2∼3주 시차를 두고 반영된 것이다.다만 최근에는 유가가 하락하는 추세여서 국내 휘발유 및 경유 가격이 계속 오르진 않을 것으로 전망된다. 지역별로는 서울 지역...
635,2019.07.25.,"국제유가, 미국 원유재고 감소에도 하락…WTI 1.6%↓",이투데이=배준호 기자 | 국제유가는 24일(현지시간) 하락했다. 뉴욕상업거래소(NYMEX)에서 9월 인도분 서부텍사스산 중질유(WTI) 가격은 전일 대비 0.89달러(1.6%) 하락한 배럴당 55.88달러로 거래를 마쳤다. 영국 런던...
