,날짜,제목,요약
1397,2021.02.03.,[기고] 합리적인 전기요금으로의 첫 걸음 '전기요금체계 개편',이는 사업자가 관리할 수 없는 국제유가·환율 등에 영향받는 연료비 변동분을 전기요금에 반영하고 이를 사전에 예고한다는 것이다. 두 번째는 '기후환경비용'이다. 기존에 전기요금에 반영돼 왔던 환경비용들을...
1398,2021.01.31.,"한은 ""미국경제, 코로나 백신 보급 및 재정부양책 힘입어 회복 전망""",브라질의 경우 정부의 취약계층을 대상으로 한 대규모 긴급재난지원금 지급 등으로 소비를 중심으로 개선세를 유지하고 있다고 봤다.한은 관계자는 “1월중 국제유가(두바이유 기준)는 50달러 중반 수준으로...
1399,2021.01.17.,"한은 ""원유 등 국제 원자재가격 오름세 당분간 이어질 것""","한은은 17일 '최근 국제원자재가격 상승 배경 및 전망' 보고서에서 ""국제 원자재 가격은 글로벌 경기 회복, 위험자산 선호 등에 크게 영향을 받아 상승세를 이어갈 것""이라며 ""특히 국제 유가는 OPEC+(석유수출국기구와..."
1400,2021.01.15.,"법원에 기업회생 신청한 이스타항공, 기사회생하나",이스타항공은 이번 기업회생 절차 신청의 이유로 ▲사드 및 일본 불매운동 ▲코로나19로 인한 여객감소 ▲저비용항공사의 과도한 경쟁으로 인한 운임료 하락 및 수익률 악화 ▲국제유가 상승으로 인한 부담 ▲호황기에...
1401,2021.01.22.,"뉴욕증시, 바이든 정책 기대에도 레벨 부담 혼조 출발","유럽 주요국 증시도 혼조세다. 범유럽지수인 Stoxx 600지수는 0.24% 올랐다. 국제유가는 하락했다. 2월물 서부텍사스산 원유(WTI) 가격은 전 거래일보다 0.75% 내린 52.91달러에, 브렌트유는 0.62% 하락한 55.75달러에 움직였다."
1402,2021.01.24.,울산 기름값 9주 연속 상승세 지속,"국제유가가 올해 석유 수요 전망이 하향 조정된 영향으로 상승세를 멈췄지만, 울산의 기름값은 9주 연속 상승세를 지속하고 있다. 24일 한국석유공사 유가정보서비스 오피넷에 따르면 1월 셋째 주(1월 18~21일)..."
1403,2021.01.27.,"대우조선해양, 비상 경영 가동…임원 임금 50% 반납 등 원가 절감 박차","하지만 국제유가 하락이 이어지면서 해양플랜트 발주가 중단된 상황에 코로나19로 상선 발주도 끊기면서 일감 부족에 허덕이고 있다. 그나마 세밑 릴레이 수주로 분위기는 끌어올렸지만, 설계, 자재 확보 등 준비..."
1404,2021.01.26.,"5개 발전 공기업, 올해 1조 원대 순손실 전망",SMP는 국제유가의 영향을 받아 시차를 두고 등락한다. 최근의 유가 회복세에 따라 SMP가 소폭 반등하겠으나 코로나19 확산 이전 수준까지 회복하진 못할 것이란 게 업계 예상이다. 전력시장에 경쟁을 촉진하겠다는 정부...
1405,2021.02.04.,"뉴욕증시 혼조세...옐런 부양책 처리 촉구, 게임스톱 '삼일천하'","39% 올랐다. 국제유가는 상승했다. 3월물 서부텍사스산 원유(WTI) 가격은 전 거래일보다 1.13% 오른 55.39달러에, 브렌트유는 1.06% 상승한 58.07달러에 움직였다. 【 청년일보=전화수 기자 】 뉴욕 증권거래소[사진=연합뉴스]"
1406,2021.02.05.,"[핫키워드5] 경상수지 '흑자', 합계출산율 0.9명, '브랜드' 주민 선택, 정의용...","코로나19 여파로 수출입 규모가 재작년보다 모두 줄었지만, 국제유가 급락 등 원자재 가격 하락으로 인해 상품수지 흑자가 커졌습니다. 또, 하늘길이 막혀 해외여행 수요가 줄면서 서비스수지 적자폭은 100억 달러 이상 준..."
1407,2021.02.03.,해외지역 전문가들이 생각하는 올해 수출 전략 어떤게 있나,"국제유가가 50달러 후반대로 회복되면서 러시아, 카자흐스탄 등 산유국 중심의 경기회복도 기대되는 상태다. CIS지역본부는 홈코노미, ICT, 그린, 의료바이어 분야 협력사업을 추진한다. 온라인유통 확산에 대응해..."
1408,2021.02.01.,중동發 쇼크에 1월 해외 수주액 '반토막',국제금융협회(IIF)에 따르면 국제유가는 1분기 40.2달러 수준에 머무르다가 2분기부터 45달러를 상회할 전망이다. 국제금융협회는 4분기까지 상승세를 이어가더라도 국제유가가 46달러선에 그칠 것으로 전망했다....
1409,2021.02.03.,"통계청, 지난달 소비자물가 0.6%↑…넉달 연속 0%대 상승률",공업제품은 가공식품이 1.6% 올랐지만 석유류가 8.6% 내려 전체적으로 0.6% 하락했으며 국제유가가 상승 전환함에 따라 석유류 하락폭은 둔화됐습니다. 반면 전기·수도·가스는 최근 유가하락 추세 반영으로...
1410,2021.02.05.,"SK인천석유화학, 분기 적자 500억대로 줄여…재무구조 개선까진 난항","지난해 산유국들의 국제유가 전쟁과 코로나19 확산에 따라 유가 변동성이 확대된 데다 주요 제품인 파라자일렌(PX) 스프레드(제품가격과 원재료 가격의 차, 수익성 지표)가 약세를 보인 탓에 대규모 손실이..."
1411,2021.01.15.,"이스타항공, 회생절차 신청…法 ″보전처분 및 포괄적 금지명령″","이스타항공 측은 신청 원인으로 사드 및 일본 불매운동, 코로나19로 인한 여객감소, 저비용항공사의 과도한 경쟁으로 인한 운임료 하락 및 수익률 악화, 국제유가 상승으로 인한 부담, 호황기에 체결한 리스료 부채 등을..."
1412,2021.01.23.,주유소 휘발윳값 9주째 오름세,다만 국제유가는 올해 석유 수요 전망이 하향 조정된 영향으로 상승세를 멈췄다. 23일 한국석유공사 유가정보서비스 오피넷에 따르면 1월 셋째 주(1.18∼21) 전국 주유소 휘발유 평균 가격은 지난주보다 7.9원...
1413,2021.01.28.,"에쓰오일, 지난해 매출 31% 감소…정유부문 1조6960억 '적자'",에쓰오일은 이 같은 실적에 대해 코로나19 대유행으로 인한 석유제품의 수요 급감에 따른 정제마진 악화와 국제 유가 하락에 따른 재고 평가 손실 등의 영향을 받았다고 설명했다. 사업부문별로는 정유부문에서...
1414,2021.01.26.,"미국증시, S&P·나스닥 사상최고…애플·MS 등 기술주 주도 [출근전 모닝브리...","■ 국제유가 상승 금값 하락 국제유가는 유럽과 중국에서 코로나19 우려가 나왔지만, 미국의 경기부양책과 수요 증가에 대한 기대감이 나오면서 강세를 보였다. WTI는 0.9% 오른 52달러 선에 거래됐고, 브렌트유도 0.7..."
1415,2021.01.27.,미국증시 소폭 하락 '숨고르기'…MS·스타벅스 실적희비 [출근전 꼭 봐야하는...,"■ 국제유가 및 금값 국제유가는 미국과 유럽, 중국에서의 코로나19 재확산에 따른 원유 수요 감소 우려가 나오면서 하락했다. WTI는 0.42% 내린 52달러 선에 거래됐고, 브렌트유도 0.05% 소폭 하락했다. 금은 이날..."
1416,2021.01.28.,"S-OIL, 정제마진 하락에 영업이익·순이익 동반 감소","국제유가 하락에 따른 제품 판매단가 하락 영향으로 S-OIL의 지난해 연간 매출액이 전년대비 31% 하락한 16조 8,297억원을 기록했다. 이로 인해 4,201억원이었던 영업이익은 지난해 1조877억원으로 감소했으며 654억원..."
1417,2021.01.21.,지난달 생산자물가 0.7% 상승… 딸기 117%·사과 21% '폭등,국제유가가 오르면서 화학제품 등 공산품 가격이 뛰었고 농산물 가격도 상승했다. 한국은행이 21일 발표한 ’2020년 12월 생산자물가지수‘에 따르면 지난해 12월 생산자물가지수는 103.78(2015=100)로 전월 대비 0.7...
1418,2021.01.29.,WTI 1% 급락…달러 강세 + 글로벌 원유 수요 위축 우려,국제유가가 일제히 급락했다. 28일(현지시간) 미국 서부텍사스원유(WTI) 3월 인도분 선물은 전장 대비 51센트(0.96%) 내린 배럴당 52.34달러를 기록했다. 북해 브렌트유 3월물 역시 27센트(0.48%) 하락해 배럴당 55....
1419,2021.01.21.,"""장바구니 들기가 무섭다""…12월 생산자물가 전월비 0.7% 상승","12월 공산품 지수는 국제유가 상승과 전방산업 수요 회복의 영향으로 전월 대비 1.0% 오른 100.71을 기록했다. 특히 석탄및석유제품 전월 대비 11.0% 상승하며 큰 폭의 오름세를 나타냈고, 화학제품도 1.2% 증가해 공산품..."
1420,2021.01.26.,"[일문일답] 한은 ""코로나 충격 집중된 취약계층 고려한 정책 펼쳐야""","팬데믹으로 국제유가 등이 낮아지면서 실질 GNI가 실질 GDP보다 높아졌다."" -4분기 성장률이 예상치 상회. 우리 경제가 회복궤도 진입했는지 궁금. ""아직 우리 성장률은 회복 궤도에 올랐다고 할 수 없다. 추세성장률..."
1421,2021.01.28.,"에쓰오일, 2020년 영업손실 1조877억…전년대비 '적자전환'",에쓰오일의 이 같은 지난해 실적은 코로나19 대유행으로 인한 수요 급감에 따른 정제마진 악화와 국제 유가 하락에 따른 재고 평가 손실 등의 영향이 컸던 것으로 풀이된다. 지난해 4분기 영업이익은 931억원으로 전년...
1422,2021.02.02.,생활물가지수 '상승세'로 전환,석유류는 국제유가 회복세로 하락폭이 -12.6%에서 -8.6%로 축소됐다. 전기·수도·가스는 전기요금 인하로 하락폭이 커졌고 공공서비스는 고교무상교육·급식 등 정책효과 지속으로 전월과 유사한 수준을 유지했다....
1423,2021.01.30.,"뉴욕증시, '개인 대 공매도 헤지펀드' 과열 양상에 다우 2.03%↓…WTI 52.20달...","국제 유가는 변이 바이러스에 대한 염려 속에 혼조세를 보였고, 국제 금값은 '게임스톱 사태'에 따른 뉴욕증시 거품 논란 속에 7거래일 만에 하락세를 멈췄다. 29일(현지시간) 뉴욕증시에서 다우존스30..."
1424,2021.02.03.,"코스피, 3일 연속 상승...개인·외국인 동반 매수에 3100선 회복",이날 국제유가는 1년 래 최고치를 기록했다. 2일(현지시간) 미국 서부텍사스원유(WTI) 3월 인도분 선물은 전장 대비 1.21달러(2.3%) 오른 배럴당 54.76달러를 기록했다. 금값과 은값은 하락했다. 4월 인도분...
1425,2021.02.09.,[뉴욕증시S+] 국제유가 폭등에 에너지 관련주 ‘신바람’… 피드몬트 등 리튬...,47% 신종 코로나바이러스 감염증(코로나19) 대유행으로부터 빠른 경제 회복에 대한 기대감이 커지며 국제유가가 폭등해 에너지 관련주가 4.2% 상승하는 등 신바람을 냈다. 8일(현지 시각)...
1426,2021.02.04.,"“일감부족·선가부담” K-조선, 위기극복 성공할까?",경기회복을 위한 발주량이 증가할 것으로 보이지만 국제유가가 급락하면서 해양플랜트 시장이 위축돼 있고 코로나19의 영향이 단기간에 회복되기 어려운 이유에서다. 이봉진 한화투자증권 연구원은 “조선사는...
1427,2021.02.02.,미 증시 변동성 완화…주요 지수 일제히 상승,"국제 유가와 금값은 올랐다. 이날 뉴욕 상품거래소에서 4월 인도분 금은 온스당 13.60달러(0.7%) 오른 1863.90달러에 장을 마감했고, 뉴욕상업거래소에서 3월 인도분 서부 텍사스산 원유(WTI)는 배럴당 1.35달러(2.6..."
1428,2021.01.25.,"""방역이 관건인데""…수출 호조에 커지는 `V자형` 회복 기대감","원화 강세, 국제유가 하락 등을 반영한 것이다. 다만 겉으로 보이는 실물 지표와 달리 체감 경기는 여전히 꽁꽁 얼어붙은 상황이다. 작년 12월 제조업의 경기실사지수는 81로 7개월만에 꺾였고 소비자심리지수도 89.8로..."
1429,2021.01.28.,(뉴욕마감)뉴욕증시 3개월 만에 최대폭 급락,한편 국제유가는 미국의 원유 재고 급감 소식에도 혼조세를 나타냈다. 27일(현지시간) 뉴욕상업거래소(NYMEX)에서 3월 인도분 서부 텍사스산 원유(WTI)는 전날보다 배럴당 0.5%(0.24달러) 오른 52.85달러에 거래를...
1430,2021.01.25.,"""방역이 관건인데""…수출 호조에 커지는 `V자형` 회복 기대감","원화 강세, 국제유가 하락 등을 반영한 것이다. 다만 겉으로 보이는 실물 지표와 달리 체감 경기는 여전히 꽁꽁 얼어붙은 상황이다. 작년 12월 제조업의 경기실사지수는 81로 7개월만에 꺾였고 소비자심리지수도 89.8로..."
1431,2021.01.28.,(뉴욕마감)뉴욕증시 3개월 만에 최대폭 급락,한편 국제유가는 미국의 원유 재고 급감 소식에도 혼조세를 나타냈다. 27일(현지시간) 뉴욕상업거래소(NYMEX)에서 3월 인도분 서부 텍사스산 원유(WTI)는 전날보다 배럴당 0.5%(0.24달러) 오른 52.85달러에 거래를...
1432,2021.01.28.,에쓰오일 작년 결국 1조원 넘는 적자,"에쓰오일 측은 ""지난해 코로나19 대유행으로 석유제품의 수요 급감에 따른 정제마진 악화와 국제유가 하락에 따른 재고평가 손실 등의 영향으로 막대한 영업적자를 기록했다""고 설명했다. 사업부문별로..."
1433,2021.02.04.,"뉴욕증시, 기업실적 공개에 혼조 마감… WTI 55.69달러 '1년새 최고치'",국제유가와 금값도 올랐다. 3일(현지시간) 뉴욕증권거래소(NYSE)에서 우량주 중심의 다우존스30산업평균지수는 전 거래일 대비 36.12포인트(0.12%) 상승한 3만723.60에 장을 마감했다. 또 대형주 중심의...
1434,2021.01.26.,"뉴욕증시, 블루칩 실적 기대에 상승 출발","유럽 주요국 증시는 반등했다. 범유럽지수인 Stoxx 600지수는 0.86% 올랐다. 국제유가도 상승했다. 3월물 서부텍사스산 원유(WTI) 가격은 전 거래일보다 0.49% 상승한 53.03달러에, 브렌트유는 0.64% 오른 56.24달러에 움직였다."
1435,2021.01.21.,올해 광주전남 수출 '나아지나'…자동차·화학 효자 기대,"광주전남 무역협회, 2년 연속 감소 지역 수출 '회복세' 올해는 2년 연속 감소했던 광주·전남지역 수출실적이 세계 경기 회복세와 국제유가 반등, 코로나19 기저효과 등으로 회복할 것이라는 전망이 나왔다. 한국무역협회..."
1436,2021.01.13.,"미국 증시, 대규모 재정 부양책 기대…다우, 0.19% 상승",국제 유가는 미국 달러화 약세에 힘입어 상승했다. 이날 뉴욕상업거래소(NYMEX)에서 2월 인도분 서부 텍사스산 원유(WTI)는 전날보다 배럴당 1.8%(0.96달러) 오른 53.21달러에 거래를 마쳤다. 종가 기준으로 지난해 2월21일...
1437,2021.01.27.,"[원유마감]혼조세…로이터 ""사우디 리야드 2차례 폭발음""",국제유가가 혼조세를 보였다. 26일(현지시간) 미국 서부텍사스원유(WTI) 3월 인도분 선물은 전장 대비 16센트(0.6%) 내린 배럴당 52.61달러를 기록했다. 북해 브렌트유 3월물은 3센트(0.1%) 오른 배럴당 55.91달러를 나타냈다....
1438,2021.01.16.,휘발유 가격 최근 한 달 새 최고…리터당 1443.94원,"한국석유공사 측은 1월 둘째 주 국제유가 동향을 발표하면서 ""이번 주 국제유가는 세계은행의 코로나19로 금융위기 경고에도 불구하고 미국 약 1.5달러 규모의 추가 부양책 발표 예정과 사우디 2~3월 추가 감산..."
1439,2021.02.02.,"쉽지 않은 정유업계 마진 개선…""바닥 지나는 중""",지난주 국제유가는 수요 불확실성에 약보합을 기록했다. 지난 29일(현지시간) 뉴욕상업거래소(NYMEX)의 미국 서부텍사스산원유(WTI)는 전 거래일 대비 배럴당 0.14달러 하락한 52.20달러에 장을 마감했다. 주초 미국...
1440,2021.02.02.,"쉽지 않은 정유업계 마진 개선…""바닥 지나는 중""",지난주 국제유가는 수요 불확실성에 약보합을 기록했다. 지난 29일(현지시간) 뉴욕상업거래소(NYMEX)의 미국 서부텍사스산원유(WTI)는 전 거래일 대비 배럴당 0.14달러 하락한 52.20달러에 장을 마감했다. 주초 미국...
1441,2021.01.16.,휘발유값 8주 연속 상승세…전국 주유소 평균 1439원,"석유공사는 ""미국의 경기 부양책 예고와 사우디의 2∼3월 추가 감산, 중국의 원유 수입 증가 등 영향으로 국제유가가 상승세를 기록 중""이라고 분석했습니다. 수입 원유의 기준인 두바이유 가격은 전주보다 2.7달러..."
1442,2021.02.02.,코스피 외국인 매수에 이틀째 반등...3100선 회복은 실패,이날 국제유가는 2% 넘게 상승했다. 1일(현지시간) 미국 서부텍사스원유(WTI) 3월 인도분 선물은 전장 대비 1.35달러(2.6%) 급등한 배럴당 53.55달러를 기록했다. 금값과 은값도 상승했다. 4월 인도분 금은...
1443,2021.02.05.,[서학개미 뭐샀나] 게임스톱 상투 잡은 서학개미?…매수·매도 금액 1위,"그리고 1위, 2위는 각각 애플과 테슬라가 차지했습니다. 국제유가는 오름세를 유지합니다. 원·달러 환율은 1118원 50전에 거래 마쳤습니다. (자세한 내용은 동영상을 시청하시기 바랍니다.)"
1444,2021.01.17.,한은 “원유 등 국제 원자재가격 당분간 오름세”,"한은은 17일 ‘최근 국제 원자재 가격 상승 배경 및 전망’ 보고서에서 “국제 원자재 가격은 글로벌 경기회복, 위험 자산 선호 등에 크게 영향을 받아 상승세를 이어갈 것”이라며 “특히 국제 유가는 OPEC..."
1445,2021.01.29.,베이징공항 이용객 86.3%↓···코로나 방역에 中춘제 이동 급감,이에 따라 국제유가가 하락하는 등 글로벌 경제에도 영향을 미치고 있다. 29일 중국 관영 글로벌타임스에 따르면 중국의 춘윈(春運·춘제 특별수송기간) 첫날인 지난 28일 수도 베이징 서우두공항을 이용한...
1446,2021.01.28.,"에쓰오일, 작년 영업손실 1조877억…적자전환",회사측은 작년 영업실적은 코로나 대유행으로 인한 석유제품의 수요 급감에 따른 정제마진 악화와 국제 유가 하락에 따른 재고 평가 손실 등의 영향이라고 설명했다. 사업부문별로는 정유부문은 1조 6960억원의...
1447,2021.01.28.,"극심해진 개인투자자 투기···美, 게임스탑 134%·AMC 301% 기형적 폭등 [데...",국제유가는 미국의 원유 재고 급감 소식에도 혼조세를 보였다.이날 뉴욕상업거래소(NYMEX)의 3월 인도분 서부 텍사스산 원유(WTI)는 전날보다 배럴당 0.5%(0.24달러) 오른 52.85달러에 거래를 마쳤다. 런던...
1448,2021.02.02.,작년 ‘최악 성적표’ 받은 정유사...상반기 실적도 ‘주춤’,최근 국제유가가 상승세를 보이고 있으나 정제마진이 여전히 손익분기점에 미치지 못하며 정유사들은 올해 상반기에도 실적 정상화가 힘들 것으로 예상된다. SK이노베이션은 지난해 2조5688억원의 영업적자를...
1449,2021.02.04.,[유동원의 투자전략] 美기술주 투자 늦지 않았다…상승여력 1위는?,"132%…또 '껑충' - 금리상승, 금융주엔 도움…증시 전반엔 경계요인 - 국제유가 3거래일 연속 랠리…WTI 1.7% - 유가 어느덧 55달러 넘었다…코로나 이전 수준 회복 - GM, 부평공장 가동 절반 축소…반도체 공급 부족..."
1450,2021.01.14.,"미국 증시, 금리 진정·물가 안도 혼조세…S&P, 0.23% 상승",국제 유가는 거의 일주일 만에 하락했다. 이날 뉴욕상업거래소(NYMEX)에서 2월 인도분 서부 텍사스산 원유(WTI)는 전날보다 배럴당 0.6%(0.30달러) 떨어진 52.91달러에 거래를 마쳤다. 지난해 5월 이후 가장 긴 6거래일...
1451,2021.01.12.,"미국 증시, 연초 랠리 후유증…나스닥, 1.25% 하락",국제 유가는 혼조세를 보였다. 이날 뉴욕상업거래소(NYMEX)에서 2월 인도분 서부 텍사스산 원유(WTI)는 전 거래일보다 배럴당 0.02%(0.01달러) 오른 52.25달러에 거래를 마쳤다. 런던 ICE선물거래소의 3월물 브렌트유는 오후...
1452,2021.02.04.,"[채권-개장] 3년 강보합, 10년 약보합 출발","전일 미국채시장에선 예상을 웃돈 지난달 미 고용 및 서비스업 지표, 미 대규모 경기부양책 기대, 국제유가 급등세 등이 수익률을 끌어올렸다. 10년 국채수익률이 3.6bp 오른 1.132%를 기록했다. 오전 9시 20 현재..."
1453,2021.01.20.,"뉴욕증시, 옐런 재무장관 경기부양 의지 확인 상승 출발","유럽 주요국 증시는 혼조세다. 범유럽지수인 Stoxx 600지수는 0.11% 내렸다. 국제유가는 상승했다. 2월물 서부텍사스산 원유(WTI) 가격은 전 거래일보다 0.36% 상승한 52.58달러에, 브렌트유는 1.37% 오른 55.50달러에 움직였다."
1454,2021.02.04.,EIA 원유재고 99만 배럴 감소…WTI 상승폭 축소,국제유가는 원유 재고의 감소 규모가 다소 작았지만 휘발유 재고가 큰 폭 증가하면서 상승 폭을 줄였다. 마켓워치에 따르면 서부텍사스원유(WTI)는 지표 발표 이후 배럴당 55.73달러에 거래됐다. 지표 발표...
1455,2021.02.01.,세계증시 랠리...'레딧 군단' 진격에 실버 관련 자산 급등,"국제유가도 상품시장 추세를 거스르지 않고 1% 가량 상승 중이다. 하지만 기술주 거품과 끝나지 않는 팬데믹, 백신 공급 차질에 따른 유럽과 미국의 경제 모멘텀 회복 지연 등이 금융 시장을 위협하는 더욱 큰..."
1456,2021.01.24.,휘발유 값 9주째 상승세,국제유가는 내림세로 돌아섰지만 국내 가격에 반영되기까지 시차가 있어 당분간 관성적 인상 가능성이 있다. 24일 한국석유공사 유가정보서비스 오피넷에 따르면 1월 셋째 주 전국 주유소 휘발유 평균 가격은...
1457,2021.01.23.,부양책 '반란표'에 혼조…나스닥은 또 최고치[뉴욕마감],中 코로나 재확산 우려에 WTI 1.6%↓ 국제유가는 1% 넘게 떨어졌다. 세계 1위 원유 수입국인 중국의 코로나19 재확산에 미국의 원유재고 급증 소식이 겹친 결과다. 이날 뉴욕상업거래소(NYMEX)에서 WTI(서부 텍사스산...
1458,2021.02.02.,"뉴욕증시, 게임스톱 등 변동성 축소 '나스닥 2.55%↑'…  WTI 53.55달러",국제유가도 상승했다. 이날 뉴욕상업거래소(NYMEX)에서 3월 인도분 서부텍사스산원유(WTI)는 배럴당 1.35달러(2.6%) 오른 53.55달러에 장을 마감했다. 유가는 석유수출국기구(OPEC)의 최대 산유국인 사우디아라비아가 2...
1459,2021.02.03.,"'코로나·탈탄소 기조'에 생존 위협받는 빅오일...""하루빨리 사업다각화에 나...",지난해 신종 코로나바이러스 감염증(코로나19) 사태로 인한 수요 침체와 국제유가 폭락의 여파로 석유업체들이 역대 최악 수준의 성적표를 기록했는데 석유산업이 갈수록 세계적인 탈(脫)탄소 기조에 계속 위협을...
1460,2021.02.01.,[WTI] 배럴당 52.2달러.. 전일비 -0.27%,"2달러로 전일 대비 0.27% 하락했다. 최근 5년 국제유가(WTI) 가격 일별 추이 (자료: 아이투자 인더스트리워치 서비스) [관련 기업] SK이노베이션, S-Oil, GS, 롯데케미칼, 금호석유, 대한유화, LG화학"
1461,2021.01.21.,'농산물 값 너무 올랐네'...지난달 생산자물가 0.7% 상승,"국제유가가 오르면서 공산품 물가도 다소 올랐다. 21일 한국은행에 따르면 지난달 생산자물가지수는 103.78로, 11월(103.09)보다 0.7% 올랐다. 생산자물가지수는 2015년 물가 수준을 100으로 상정했을 때 가중치를 고려한..."
1462,2021.01.27.,두 얼굴의 '원자재 슈퍼사이클' 온다,지난해 4월 장중 마이너스까지 기록한 국제 유가는 50달러 선까지 회복됐다. 이날 뉴욕상업거래소(NYMEX)에서 3월 인도분 서부텍사스산원유(WTI)는 배럴당 52.61달러로 장을 마쳤다. 과거 원자재 슈퍼사이클이 공급과...
1463,2021.02.02.,[뉴욕증시 마감] '게임스톱 떨어지자 지수 반등'...다우 3만선 회복,국제유가는 수요 전망 개선과 사우디아라비아의 감산 개시 등으로 상승 마감했다. 석유수출국기구(OPEC)의 최대 산유국인 사우디는 이번 달과 다음 달 하루 100만 배럴을 감산하기로 하면서 국제 원유 재고 감소...
1464,2021.01.15.,"법원, 기업회생 신청한 이스타항공에 '포괄적 금지명령'","사드와 일본 불매운동, 코로나19로 인한 여객 감소, 미국 보잉사 제조 비행기의 운항 중단, 저비용항공사간 과도 경쟁으로 인한 운임료 하락, 리스료 부채와 국제유가 상승으로 인한 부담으로 기업회생을 신청했습니다. [ ]"
1465,2021.01.24.,부산 주유소 기름값 10개월 만에 최고치 휘발유 L당 1449원,재고는 440만 배럴이 늘어 시장 전망(250만 배럴 감소)보다 크게 많았다. 국제유가가 국내 기름값에 영향을 미치는데는 2~3주 시차가 있는만큼 국내 기름값은 앞으로 소폭 더 오른 뒤 보합세를 유지할 것으로 전망된다.
