,날짜,제목,요약
641,2019.02.11.,미국생산시설 확대... 국제유가 하락,"미국의 석유생산시설 확대로 인해 국제유가가 11일 아시아시장에서 하락했다. 블룸버그 집계에 따르면, 브렌트유가는 이날 오후 4시10분(한국시간) 현재 배럴당 61.90 달러로 전주말보다 0.32% 하락했다. 미국산원유는..."
642,2019.02.18.,[국제유가]WTI 2.2%↑ ‘3개월 최고’…사우디 생산차질 + 무역협상 낙관,미국과 중국의 무역협상 타결 기대도 유가의 추가 상승을 이끌었다. 뉴욕상업거래소(NYMEX)에서 WTI 선물은 전장보다 배럴당 1.18달러(2.2%) 오른 55.59달러에 장을 마쳤다. ICE 선물거래소의 브렌트유는 배럴당 1.68달러(2.6...
643,2019.02.11.,"""미국의 국제유가 누르기, 한국엔 호재""","김장열 ""삼성전자, SK하이닉스 중장기 긍정적""...투자 판단은 신중히 해야 골든브릿지투자증권이 삼성전자·SK하이닉스 등 글로벌 반도체 주가전망을 다루고 국제 유가, 미-중 및 미-북 협상 관련 진단도 함께 내놔 눈길을..."
644,2019.02.15.,[국제유가]WTI 1% 상승…무역협상 낙관 + OPEC 감산효과 지속,이와 관련해 한 원유전문가는 “OPEC 감산이 글로벌 원유시장 수급에 미칠 효과를 감안하면 지난 2~3일 동안 나타난 유가 랠리는 이상할 것이 전혀 없다”고 평가했다.
645,2019.03.09.,기름값 들썩...휘발유 가격 3주째 상승,"문제는 5월 초면 유류세 인하 조치가 끝나는 데다, 올해 들어 오름폭이 커진 국제유가 상승분이 반영되면 국내 기름값이 더 큰 폭으로 인상될 수 있습니다. 보도에 김현우 기자입니다. [기자] 휘발유와 경유 가격 오름세가..."
646,2019.03.09.,휘발유 값 ℓ당 4.4원 오른 1350원…3주 연속↑,최고가 서울 1450.8원‧최저가 대구 1312.1원 “국제유가 상승분 시차 두고 반영…오름세 유지” 전국 휘발유 주간 평균가격이 3주째 상승세를 이어갔다. 최고가 지역인 서울은 1450원대를 넘어섰다. 8일...
647,2019.02.15.,사우디아라비아 일평균 100만배럴 유전 폐쇄... 국제유가 상승,"사우디아라비아가 일평균 100만 배럴 이상 생산하는 유전을 폐쇄한 영향으로 국제유가가 15일 아시아 시장에서 상승세를 지속했다. 블룸버그 집계에 따르면, 브렌트유가는 이날 오후 4시38분(한국시간) 현재 배럴당 64...."
648,2019.02.16.,사우디의 추가 감산 다짐···국제유가 상승 가능성 부각,이번주 국제유가는 사우디아라비아의 추가 감산 가능성 언급으로 인해 강세가 이어졌다. 사우디아라비아는 산유국간의 감산 합의 이행으로 지난달에도 일평균 산유량을 줄인 데 이어 앞으로도 추가 감산 가능성을...
649,2019.02.14.,중국 석유수입도 증가... 국제유가 아시아에서 상승 지속,"미국과 중국의 무역 갈등 해소 기대와 함께 중국의 석유수입이 늘어난 것으로 나타나면서 국제유가가 14일 아시아시장에서 상승세를 이어갔다. 블룸버그 집계에 따르면, 브렌트유가는 이날 오후 4시35분..."
650,2019.03.09.,휘발유값 3주 연속 상승…상승폭도 커져,유류세 인하와 국제유가 급락으로 쉼 없이 떨어지던 전국 휘발유 값이 반등한 후 3주 연속 올랐다. 상승폭도 점점 커지는 모습이다. 9일 한국석유공사 유가정보서비스 오피넷에 따르면 3월 첫째주 기준 전국...
651,2019.03.08.,1월 경상수지 흑자 9개월만에 최소...반도체 수출 부진 영향(종합),"하락한 국제유가로 수입이 1년 전에 비해 2% 줄었지만 수출이 -5.4%나 줄면서 상품수지가 악화됐다는 분석이다. 수출 감소폭은 작년 9월(-6.2%) 이후 가장 컸다. 수출 감소에 대해 한은은 ""반도체·석유제품 등 주력 품목..."
652,2019.02.13.,"국제유가, OPEC·사우디 감산에 상승…WTI 1.3%↑",이투데이=배준호 기자 | 국제유가는 12일(현지시간) 상승했다. 뉴욕상업거래소(NYMEX)에서 3월 인도분 서부텍사스산 중질유(WTI) 가격은 전일 대비 0.69달러(1.3%) 상승한 배럴당 53.10달러로 거래를 마쳤다. 영국 런던...
653,2019.02.12.,[국제유가]WTI 0.6%↓…달러화 강세 + 미중 차관급회담 주시,강세가 유가를 압박했다. 이날 뉴욕상업거래소(NYMEX)에서 WTI 선물은 전장보다 배럴당 31센트(0.59%) 하락한... 중국은 미 해군의 작전 소식에 미국이 자국의 영해를 침범했다며 유감을 표하며 중·대형 선박을 겨냥할...
654,2019.02.13.,[국제유가]WTI 1.3% 반등…사우디 “산유량 더 줄이겠다”,"12일(현지시간) 미국 서부텍사스원유(WTI)가 1.3% 반등, 배럴당 53달러 대로 올라섰다. 거의 1주일 만에 최고치로, 하루 만에 상승세로 전환했다. 지난달 사우디아라비아가 목표 이상으로 감산에 나선 가운데..."
655,2019.03.06.,"국제유가, 中 성장률 목표 하향 조정에 소폭 하락",국제유가가 5일(현지시각) 중국의 올해 성장률 목표치 하향 조정 영향으로 소폭 하락했다. 이날 선물시장인 뉴욕상업거래소에서 미국산 원유의 기준유인 서부텍사스산원유(WTI) 4월 인도분은 전장보다 0.1%(0.03달러)...
656,2019.03.10.,짙어진 경기둔화 우려…구리·원유ETF '흔들',횡보하는 유가 ETF 올 들어 지난달 중순까지 상승세를 탔던 국제 유가가 2월 하순부터 횡보세에 접어들면서 관련 ETF들의 성과도 지지부진하다. 올 들어 지난달 말까지 21.83% 급등했던 ‘KODEX 원유선물(H)’은 이달...
657,2019.02.11.,[국제유가]WTI 0.2% 반등…리비아 공급차질이 무역갈등 우려 압도,글로벌 경기둔화 불안감도 유가의 추가 상승을 제한했다. 이날 뉴욕상업거래소(NYMEX)에서 WTI 선물은... 리비아발 생산차질 재료가 유가를 뒷받침했다. 무스타파 사날라 리비아 국영석유공사(NOC) 회장은 현지 최대...
658,2019.03.07.,"국제유가, 미국 재고 급증무역협상 관망에 혼조",국제유가가 6일(현지시간) 미국의 원유 재고가 급증하고 시장 투자자들이 미국과 중국의 무역 합의안 세부 내용을 주시하면서 거래를 대기하는 등 투자 심리 약화에 혼조세를 나타냈다. 이날 선물시장인...
659,2019.02.16.,"""유가 호재 증가""...국제 유가 · 러시아증시 · 미국증시 정유주 '동반 급등...","무역협상 기대, 사우디 유전 폐쇄, 베네수엘라 감산, 일부 유가 긍정 전망 등이 호재 15일(뉴욕-런던시각) 국제 유가가 또 올랐다. 나흘 연속 상승이다. 미-중 무역협상에 대한 긍정 반응, 그에 따른 위험자산 선호..."
660,2019.03.09.,주유소 기름값 3주째 상승…“당분간 오름세 지속”,"3원 상승했다. 최저가 지역은 대구로 지난주 대비 4.2원 오른 1312.1원에 거래됐다. 석유공사는 국내 제품가격은 기존 국제유가 상승분이 시차를 두고 반영되는 만큼, 당분간 오름세가 이어질 것으로 전망했다. 이윤화"
661,2019.02.11.,[주간유가] 휘발유 가격 1344.0원/ℓ… 14주 연속 하락,국제유가는 OPEC 1월 생산량 감소 추정과 미 고용지표 호조 등으로 상승했으나 국내제품가격은 보합세를 보인 기존 국제유가가 시차를 두고 반영됨에 따라 미세한 조정을 보인 지난주와 비슷한 가격대를...
662,2019.03.05.,"국제유가, OPEC 감산 기대에 1.4% 상승",국제유가가 4일(현지시각) 석유수출기구(OPEC)와 주요 산유국의 감산이 이어질 것이란 기대에 상승했다. 이날 선물시장인 뉴욕상업거래소에서 미국산 원유의 기준유인 서부텍사스산원유(WTI) 4월 인도분은 전장보다 1.4...
663,2019.02.13.,국제 유가 · 미국증시 에너지주 · 러시아증시 '급등'...3가지 호재는?,"달러약세, OPEC감산, 미-중무역협상기대에 유가 하루 만에 반등 12일(런던-뉴욕시각) 국제 유가가 전날의 하락세를 뒤로하고 상승했다. 美中무역협상 기대 상승에 따른 위험자산 선호심리, OPEC(석유수출국기구)의..."
664,2019.02.14.,"국제 유가 · 미국증시 에너지주, 이틀연속 상승...OPEC · 사우디 감산 영향",베네수엘라 제재 영향도 유가 상승 거들어 13일(뉴욕-런던시각) 국제 유가가 또 올랐다. 이틀 연속 상승이다. 뉴욕상업거래소(NYMEX)에 따르면 이날 3월 인도분 미국서부텍사스산원유(WTI)는 가격은 배럴당 53.90...
665,2019.02.15.,"美 악재에도, 국제 유가 · 미국증시 에너지 주 연일 상승...중국이 유가 견인","미-중 협상 기대, 중국 석유수입 급증 등이 유가 상승 요인 제공 14일(뉴욕-런던 시각) 국제 유가가 또 올랐다. 사흘 연속 상승이다. 중국의 원유수입 증가, 미-중 무역협상 기대감 지속, OPEC의 산유량 감소 기대감 지속..."
666,2019.02.13.,"산유국 감산, 국제유가 아시아에서 급등... 국내 정유주가도 상승","사우디아라비아 등 산유국들의 감산으로 국제유가가 13일 아시아 시장에서 급등했다. 블룸버그 집계에 따르면, 브렌트유가는 이날 오후 3시59분(한국시간) 현재 배럴당 63.11 달러로 전날보다 1.11% 상승했다...."
667,2019.02.12.,"산유국 감산이 공급과잉 압도... 국제유가, 아시아시장에서 상승","산유국들의 감산효과로 국제유가가 12일 아시아시장에서 상승했다. 블룸버그 집계에 따르면, 브렌트유가는 이날 오후 4시28분(한국시간) 현재 배럴당 61.83 달러로 전날보다 0.55% 상승했다. 미국산원유는 52.62 달러로 0.4..."
668,2019.02.18.,"[주간 유가 전망] 국제유가, 석유수출기구 감산 기조에 5% '급등'",이투데이=윤기쁨 기자 | 지난주 국제유가는 전주 대비 5% 가까이 급증했다. 석유수출기구의 원유 감산 기조로 당분간 상승세는 지속될 전망이다. 18일 뉴욕상업거래소(NYMEX)에서는 미국 서부텍사스원유(WTI)가 전주...
669,2019.03.07.,"국제유가, 美원유 재고 증가에 WTI 0.6% 하락",미국의 원유 재고가 큰 폭으로 증가하면서 국제유가가 6일(현지시간) 약세를 나타냈다. 이날 뉴욕상업거래소(NYMEX)에서 4월 인도분 서부 텍사스산 원유(WTI)는 전날보다 배럴당 0.34달러(0.6%) 하락한 56.22달러에 거래를...
670,2019.02.12.,"산유국 감산이 공급과잉 압도... 국제유가, 아시아시장에서 상승","산유국들의 감산효과로 국제유가가 12일 아시아시장에서 상승했다. 블룸버그 집계에 따르면, 브렌트유가는 이날 오후 4시28분(한국시간) 현재 배럴당 61.83 달러로 전날보다 0.55% 상승했다. 미국산원유는 52.62 달러로 0.4..."
671,2019.03.09.,휘발유·경유 가격 3주째 ‘오름세’…휘발유 전주대비 4.4원 올라,"석유공사는 기존 국제유가 상승분이 시차를 두고 반영되는 만큼, 당분간 오름세가 이어질 것으로 전망했다. 한편 우리나라가 주로 수입하는 두바이유는 전주와 동일한 배럴당 65.9달러 수준에서 거래돼 보합세를..."
672,2019.02.18.,"[주간 유가 전망] 국제유가, 석유수출기구 감산 기조에 5% '급등'",이투데이=윤기쁨 기자 | 지난주 국제유가는 전주 대비 5% 가까이 급증했다. 석유수출기구의 원유 감산 기조로 당분간 상승세는 지속될 전망이다. 18일 뉴욕상업거래소(NYMEX)에서는 미국 서부텍사스원유(WTI)가 전주...
673,2019.03.07.,"국제유가, 美원유 재고 증가에 WTI 0.6% 하락",미국의 원유 재고가 큰 폭으로 증가하면서 국제유가가 6일(현지시간) 약세를 나타냈다. 이날 뉴욕상업거래소(NYMEX)에서 4월 인도분 서부 텍사스산 원유(WTI)는 전날보다 배럴당 0.34달러(0.6%) 하락한 56.22달러에 거래를...
674,2019.03.08.,반도체 · 對中수출 흔들.. 경상수지 '불안한 흑자',"국제유가 하락으로 수입이 1년 전에 비해 2% 줄었지만 수출이 -5.4%나 줄면서 상품수지가 악화됐다는 분석이다. 수출 감소폭은 지난해 9월(-6.2%) 이후 가장 컸다. 한은은 ""반도체·석유제품 등 주력품목 단가가..."
675,2019.03.09.,"국내 휘발유 값, 인상세로 전환…3주 연속 오르며 리터당 1350.3원","국제유가 상승에 따라 3주 연속 인상된 상황으로, 당분간 계속 오를 것이란 분석이 나온다. 9일 한국석유공사 유가정보서비스 오피넷에 따르면 3월 첫째주 주유소 휘발유 판매가격은 전주 대비 4.4원 상승한 리터당..."
676,2019.03.09.,기름값 들썩...휘발유 가격 3주째 상승,"문제는 5월 초면 유류세 인하 조치가 끝나는 데다, 올해 들어 오름폭이 커진 국제유가 상승분이 반영되면 국내 기름값이 더 큰 폭으로 인상될 수 있습니다. 보도에 김현우 기자입니다. [기자] 휘발유와 경유 가격 오름세가..."
677,2019.03.10.,'1→4달러' 정제마진 회복에 정유사 1분기 실적 '파란불',"작년 4분기 정유업계는 정제마진 하락, 국제유가 하락으로 재고평가손실이 커지면서 정유 4사를 합쳐 4분기에 1조원이 넘는 영업손실을 냈었다. SK이노베이션 2789억원, GS칼텍스 2670억원, 에쓰오일 2924억원..."
678,2019.03.05.,12년 만에 3만불 넘었다…작년 1인당 국민소득 3만1천349달러,국제 유가 상승으로 수입 물가는 올랐으나 반도체 가격 상승률 둔화 때문에 수출 물가는 그만큼 오르지 않았다. 실제로 우리나라 포괄적인 물가수준을 나타내는 GDP 디플레이터는 0.3%였다. GDP 디플레이터는...
679,2019.03.09.,"[이 시각 뉴스룸] 트럼프 ""김 위원장과 관계 좋아…미사일 재개 땐 큰 실망""","석유공사는 ""국내 기름 값 오름세는 국제유가 상승에 따른 것으로 당분간 이어질 것""이라고 예측했습니다. 5. 기온 상승, 대구 낮 최고 17도…나들이 좋은 날씨 쌀쌀했던 오전과는 달리 낮에는 기온이 빠르게 오르고..."
680,2019.03.09.,"국내 휘발유 값, 인상세로 전환…3주 연속 오르며 리터당 1350.3원","국제유가 상승에 따라 3주 연속 인상된 상황으로, 당분간 계속 오를 것이란 분석이 나온다. 9일 한국석유공사 유가정보서비스 오피넷에 따르면 3월 첫째주 주유소 휘발유 판매가격은 전주 대비 4.4원 상승한 리터당..."
681,2019.03.09.,기름값 들썩...휘발유 가격 3주째 상승,"문제는 5월 초면 유류세 인하 조치가 끝나는 데다, 올해 들어 오름폭이 커진 국제유가 상승분이 반영되면 국내 기름값이 더 큰 폭으로 인상될 수 있습니다. 보도에 김현우 기자입니다. [기자] 휘발유와 경유 가격 오름세가..."
682,2019.03.09.,"전국 휘발유·경유 가격, 3주 연속 오름세","석유수출국기구(OPEC)의 원유생산량 감소전망과 리비아 유전 생산 재개 등 각종 하락요인이 겹치면서 국제유가는 보합세를 보인 가운데, 국제유가가 국내 제품가격에 추후 반영되면 당분간 오름세를 보일 것으로..."
683,2019.03.10.,'1→4달러' 정제마진 회복에 정유사 1분기 실적 '파란불',"작년 4분기 정유업계는 정제마진 하락, 국제유가 하락으로 재고평가손실이 커지면서 정유 4사를 합쳐 4분기에 1조원이 넘는 영업손실을 냈었다. SK이노베이션 2789억원, GS칼텍스 2670억원, 에쓰오일 2924억원..."
684,2019.03.05.,12년 만에 3만불 넘었다…작년 1인당 국민소득 3만1천349달러,국제 유가 상승으로 수입 물가는 올랐으나 반도체 가격 상승률 둔화 때문에 수출 물가는 그만큼 오르지 않았다. 실제로 우리나라 포괄적인 물가수준을 나타내는 GDP 디플레이터는 0.3%였다. GDP 디플레이터는...
685,2019.03.09.,"[이 시각 뉴스룸] 트럼프 ""김 위원장과 관계 좋아…미사일 재개 땐 큰 실망""","석유공사는 ""국내 기름 값 오름세는 국제유가 상승에 따른 것으로 당분간 이어질 것""이라고 예측했습니다. 5. 기온 상승, 대구 낮 최고 17도…나들이 좋은 날씨 쌀쌀했던 오전과는 달리 낮에는 기온이 빠르게 오르고..."
686,2019.03.10.,울산지역 휘발유 가격 4주째 상승세 지속,"석유공사는 ""국제유가는 2월 석유수출국기구(OPEC) 원유생산량 감소 전망과 러시아 감산 목표 달성 가능성 등 상승요인과 미국 원유재고 증가 및 리비아 유전 생산 재개라는 하락요인이 혼재해 보합세를 보였다""고..."
687,2019.03.08.,"국제유가 사흘 만에 반등...OPEC 감산, 베네수엘라 석유 수출 차질",국제유가는 7일(현지시각) 사흘 만에 반등했다. 산유국 감산 등에 따른 공급 감소로 글로벌 기준유와 미국산 원유의 기준유가 각각 60달러 중반과 50달러 중반을 넘어 추가상승을 위한 에너지를 축적하는 모양새다....
688,2019.03.10.,"사우디 ""OPEC 석유 감산정책 지속"" 재확인",도널드 트럼프 미국 대통령은 OPEC 산유국의 감산을 통한 국제유가 상승 유도에 연일 부정적인 입장을 표명하고 있다. 그러나 OPEC의 감산정책은 당분간 유지될 것으로 예상된다.
689,2019.03.08.,S-Oil '고배당 타이틀' 반납,"S-OIL은 지난해 국제유가 변동에 따른 정제 마진 감소 탓에 4·4분기 들어 2,923억원의 영업 손실을 기록했고 연간 당기순이익은 전년 대비 79.3% 줄어든 2,580억원에 그쳤다. 지난해 말 상업 가동을 시작한 울산의..."
690,2019.03.09.,휘발유값 3주 연속↑…리터당 1350원 기록,"한국석유공사 관계자는 ""국제유가는 지난달 석유수출기구(OPEC) 원유생산량 감소 전망 및 러시아 감산목표 달성 가능 시사 등의 상승요인과 미 원유재고 증가 등의 하락요인이 혼재하며 보합했다""며 ""국내..."
691,2019.03.10.,"휘발유 가격 3주째 상승... 서울 1450원, 가장 비싸","석유공사 측은 ""국제유가는 2월 석유수출국기구(OPEC) 원유생산량 감소 전망과 러시아 감산 목표 달성 가능성 등 상승요인과 미국 원유재고 증가 및 리비아 유전 생산 재개라는 하락요인이 혼재해 보합세를 보였다""며..."
692,2019.03.08.,"국제유가 사흘 만에 반등...OPEC 감산, 베네수엘라 석유 수출 차질",국제유가는 7일(현지시각) 사흘 만에 반등했다. 산유국 감산 등에 따른 공급 감소로 글로벌 기준유와 미국산 원유의 기준유가 각각 60달러 중반과 50달러 중반을 넘어 추가상승을 위한 에너지를 축적하는 모양새다....
693,2019.03.10.,"사우디 ""OPEC 석유 감산정책 지속"" 재확인",도널드 트럼프 미국 대통령은 OPEC 산유국의 감산을 통한 국제유가 상승 유도에 연일 부정적인 입장을 표명하고 있다. 그러나 OPEC의 감산정책은 당분간 유지될 것으로 예상된다.
694,2019.03.09.,전국 휘발유값 3주째 오름세…리터당 1350.3원,석유공사는 “국제유가는 2월 석유수출국기구(OPEC) 원유생산량 감소 전망과 러시아 감산 목표 달성 가능성 등 상승요인과 미국 원유재고 증가 및 리비아 유전 생산 재개라는 하락요인이 혼재해 보합세를 보였다”...
695,2019.03.08.,S-Oil '고배당 타이틀' 반납,"S-OIL은 지난해 국제유가 변동에 따른 정제 마진 감소 탓에 4·4분기 들어 2,923억원의 영업 손실을 기록했고 연간 당기순이익은 전년 대비 79.3% 줄어든 2,580억원에 그쳤다. 지난해 말 상업 가동을 시작한 울산의..."
696,2019.03.08.,주당 4700→150원…에쓰오일 '배당 쇼크',작년 4분기에 국제유가(서부텍사스원유 기준)가 38.0% 급락하면서 재고평가손실이 확대된 탓이다. 중국 등 글로벌 주요국 경기 부진으로 정제마진(석유제품 가격에서 생산비용을 뺀 금액)은 급감했다. 작년 2월과...
697,2019.02.12.,"국제유가, 미·중 무역협상 관망에 소폭 하락…WTI 0.6%↓",이투데이=배준호 기자 | 국제유가는 11일(현지시간) 소폭 하락했다. 뉴욕상업거래소(NYMEX)에서 3월 인도분 서부텍사스산 중질유(WTI) 가격은 전일 대비 0.31달러(0.6%) 하락한 배럴당 52.41달러로 거래를 마쳤다. 영국 런던...
698,2019.03.08.,"정부 ""서민 생활 밀접한 가공식품 가격 오름세…안정 노력""","겨울 동안 예년에 비해 양호했던 기상 여건과 더불어 국제 유가 하락, 유류세 인하 등에 따라 기름값이 크게 떨어지면서 물가 상승률이 낮았던 것으로 정부는 판단하고 있다. 다만 떡, 과자 등 가공식품의 경우 지난해..."
699,2019.03.08.,유류세 인하에 1월 휘발유 소비 5년래 최대,"다만 국제유가 상승으로 가격이 반등 조짐을 보이고 유류세 인하 조치가 5월 초에 종료됨에 따라 향후에는 수요 둔화가 예상된다. S&P글로벌플래츠 공사 관계자의 말을 인용해 ""지난달 넷째주 이후 휘발유 가격이..."
700,2019.03.08.,유류세 인하에 1월 휘발유 소비 5년래 최대,"다만 국제유가 상승으로 가격이 반등 조짐을 보이고 유류세 인하 조치가 5월 초에 종료됨에 따라 향후에는 수요 둔화가 예상된다. S&P글로벌플래츠 공사 관계자의 말을 인용해 ""지난달 넷째주 이후 휘발유 가격이..."
701,2019.03.09.,전국 휘발유 가격 3주째 상승세…서울 가장 높아,그동안 휘발유와 경유가격은 지난 해 11월 정부의 유류세 인하 정책과 함께 국제유가 하락이 맞물리며 줄곧 하락세를 이어갔다. 상승폭은 지난 2월 셋째 주에는 0.2% 수준으로 상승했지만 넷째 주에서는 3.0원으로...
702,2019.03.09.,"휘발유·경유값 3주째 상승… ""더 오른다""",5원으로 지난주 대비 1.6원 뛰었고 경유는 1169.8원으로 0.4원 상승했다. 석유공사 관계자는 “국내제품가격은 기존 국제유가 상승분이 시차를 두고 반영됨에 따라 오름세가 유지될 것”이라고 전망했다.
703,2019.03.10.,"‘덤벼 트럼프’ 사우디, ""원유 감산 정책 변화 없다...올해 수요 견조""",OPEC과 비OPEC 산유국들은 국제유가를 지지하기 위해 올해 1월 1일부터 6개월간 하루 평균 120만 배럴 감산하기로 합의했다. 실제 지난달 OPEC의 원유 생산량은 전일보다 80만 배럴 감소했다. 이 중 사우디는 지난해 12월...
704,2019.03.05.,1인당 국민소득 3만1349달러…12년 만에 3만달러 시대 진입(종합),"국제유가 상승, 반도체 등 수출 주력품목 단가 하락으로 교역조건이 악화되면서 지난해 실질 GNI 증가율은 2011년 이후 처음으로 실질 GDP 증가율을 밑돌았다. 우리가 생산해 판매한 가격보다 수입가격이 더 크게..."
705,2019.03.09.,정유사 공급 휘발유 리터당 1.6원 내리고 등유 0.4원 올라,"한편 2월 OPEC 원유생산량 감소 전망, 러시아 감산목표 달성 가능 시사 등과 같은 국제유가 상승요인과 미 원유재고 증가, 리비아 유전 생산 재개 등의 하락요인이 혼재하면서 국제유가는 보합세를 보였다. 이로..."
706,2019.03.09.,[혼돈의 베네수엘라] ③ 중남미 정치지형 '우향우'…역내 질서재편 '시동'(끝...,국제유가 상승 등에 따른 경제 호황 속에 차베스 전 대통령은 재임 기간 정부 세입의 60% 이상을 사회복지에 투입했다. 2003년 62.1%였던 빈곤율이 2011년 31.9%까지 떨어지면서 그는 빈민 등 사회적 약자 계층의 절대적인...
707,2019.03.09.,리터당 1350.3원… 3주연속 치솟는 휘발유값,"석유공사는 ""국제유가는 2월 석유수출국기구(OPEC) 원유생산량 감소 전망과 러시아 감산 목표 달성 가능성 등 상승요인과 미국 원유재고 증가 및 리비아 유전 생산 재개라는 하락요인이 혼재해 보합세를 보였다..."
708,2019.03.10.,광주·전남지역 휘발유·경유값 오름폭 커져,"석유공사는 ""국제유가는 2월 OPEC 원유생산량 감소 전망, 러시아 감산목표 달성 가능 시사 등의 상승요인과 미 원유재고 증가, 리비아 유전 생산 재개 등의 하락요인이 혼재하면서 보합세를 보였다""면서..."
709,2019.02.14.,"국제유가, 사우디 감산 호재에 3개월 만의 최고치…WTI 1.5%↑",이투데이=배준호 기자 | 국제유가는 13일(현지시간) 상승했다. 뉴욕상업거래소(NYMEX)에서 3월 인도분 서부텍사스산 중질유(WTI) 가격은 전일 대비 0.80달러(1.5%) 상승한 배럴당 53.90달러로 거래를 마쳤다. 영국 런던...
710,2019.03.10.,광주·전남지역 휘발유·경유값 오름폭 커져,"석유공사는 ""국제유가는 2월 OPEC 원유생산량 감소 전망, 러시아 감산목표 달성 가능 시사 등의 상승요인과 미 원유재고 증가, 리비아 유전 생산 재개 등의 하락요인이 혼재하면서 보합세를 보였다""면서..."
