,날짜,제목,요약
703,2019.07.09.,"IAEA “이란, 핵합의 제한 넘겨 우라늄 농축” 확인···美 ""최대압박 지속""",한편 미-이란의 갈등으로 중동 위기가 고조된 가운데 국제유가는 ‘이란 사태’를 주시하며 혼조를 나타냈다. 8일 뉴욕상업거래소(NYMEX)에서 8월 인도분 서부 텍사스산 원유(WTI)는 배럴당 0.3%(0.15달러) 상승한 57....
704,2019.07.10.,"신학철, LG화학의 미래를 전기자동차에 건다",국내는 물론 글로벌 정유업체들은 몇 년 전부터 국제유가와 정제마진에 따라 실적이 불안정한 정유사업 의존도를 낮추기 위해 공격적으로 화학제품 생산설비를 증설하고 있다. 기초석유화학제품부터 고부가 제품까지...
705,2019.07.10.,"우리금융경제硏, ""3분기 국내경제 성장률 2.6% 전망""",국제 유가가 작년보다 낮은 수준에 머물고 있는 점도 소비자물가 상승률을 낮추는 주요인으로 꼽았다. 3분기 취업자는 전년대비 21만2천명 늘어나며 20만명을 상회하는 증가세를 유지할 것으로 내다봤다. 정부의 일자리...
706,2019.06.17.,"[주간 유가 전망] 국제유가, 수요감소로 하향 안정화 기대",이투데이=김나은 기자 | 이번주(6월 17일~21일) 국제유가는 수요 위축에 대한 우려에 하방 압력을 받을 것으로 전망된다. 지난주 뉴욕상업거래소(NYMEX)에서 미국 서부텍사스원유(WTI)는 전주 대비 2.74% 하락한 배럴당 52....
707,2019.06.13.,"국제유가, 미국 원유재고 증가에 급락…WTI 4.0%↓",이투데이=배준호 기자 | 국제유가는 12일(현지시간) 급락했다. 뉴욕상업거래소(NYMEX)에서 7월 인도분 서부텍사스산 중질유(WTI) 가격은 전일 대비 2.13달러(4.0%) 급락한 배럴당 51.14달러로 거래를 마쳤다. 영국 런던...
708,2019.07.08.,"트럼프 경고에도...이란, 우라늄 농축 '레드라인' 넘겼다",합의에 있는 우라늄 농축 농도 제한 파기를 지속적으로 경고해왔다는 점에서 이번에 군사옵션을 실행할 가능성도 배제할 수 없다는 관측이 나온다. 이에 따라 국제 유가 상승 등에 따른 국내 경제에도 악영향이 예상된다.
709,2019.07.09.,[김지석의 화.들.짝] 중동·동북아의 전쟁과 평화,이란의 끈질긴 저항과 함께 국제 유가는 급등하고 중동 전역이 심한 갈등에 휩싸이게 된다. 공멸의 길이다. 미국 정부 안에서도 의견 일치가 돼 있지 않다. 국방부와 군부 인사들은 중국·러시아에 초점을 맞춘 대국 경쟁을...
710,2019.07.09.,[김지석의 화.들.짝] 중동·동북아의 전쟁과 평화,이란의 끈질긴 저항과 함께 국제 유가는 급등하고 중동 전역이 심한 갈등에 휩싸이게 된다. 공멸의 길이다. 미국 정부 안에서도 의견 일치가 돼 있지 않다. 국방부와 군부 인사들은 중국·러시아에 초점을 맞춘 대국 경쟁을...
711,2019.07.10.,"[뉴욕증시] 다우지수 흔들, 파월 한마디에 금리인하 기대 와르르… 코스피 코...",중국위안화 환율 일본엔화 환율 코스피 코스닥 원달러환율 국제유가 국제금값 미국 뉴욕증시실시간 시세 Stock Market Overview Index Value Change Net / % NASDAQ 8146.34 47.96 ▲ 0.59% NASDAQ-100 (NDX) 7833.31 47.52...
712,2019.07.09.,[뉴욕마감] '애플 쇼크'에 기술주 꽁꽁…나스닥 0.8%↓,국제유가는 혼조세였다. 이날 뉴욕상업거래소(NYMEX)에서 8월분 WTI(서부 텍사스산 원유)는 전날보다 배럴당 15센트(0.3%) 상승한 57.66달러에 장을 마쳤다. 반면 국제 원유시장의 기준물인 북해산 브렌트유 8월분은...
713,2019.07.04.,'수출 내리막'에 상품수지 악화…5년여만에 최소(종합),"수입은 국제유가 약세 등으로 전년동월대비 1.0% 감소한 426억4000만달러를 나타냈다. 문소상 한은 금융통계부장은 ""글로벌 경기 둔화, 미·중 무역갈등, 반도체 가격 하락 등 수출 감소의 영향으로 상품수지..."
714,2019.06.14.,"[특징주] 오만해 유조선 2척 피격, 국제유가 3% 이상 폭등에 극동유화 등 관련...","호르무즈해협 인근 긴장 고조로 인해 원유 공급에 차질이 발생할 경우 유가가 상승, 석유 도소매업체 등이 수혜를 볼 것이라는 기대감이 작용된 것으로 풀이된다. 한편 극동유화는 S-Oil과 전국 석유 공급망을 구축..."
715,2019.07.10.,"세계증시, 파월 연준 의장 ‘입’ 쳐다보며 보합",68달러로 0.3% 하락 중이다. 반면 국제유가는 중동 긴장 고조와 미국 원유재고가 4주 연속 감소했다는 소식에 상승하고 있다. 6개 통화 대비 달러지수 10일 추이 [자료=인베스팅닷컴]
716,2019.07.09.,"[ET투자뉴스]S-Oil, ""2Q19를 바닥으로…"" BUY(유지)-하이투자증권","◆ Report briefing 하이투자증권에서 S-Oil(010950)에 대해 ""정제마진/국제유가하락 및 PX #2 정기보수영향: 동사의 2Q19 실적은 매출액6조2,689억원[q/q +15.5%, 1M Cons. 5조8,116억원], 영업적자329억원[q/q 적전, 1M Cons...."
717,2019.07.09.,"하이투자證 ""SK이노베이션, 2분기 바닥으로 실적 개선세 전망""","원민석 연구원은 먼저 ""정유부문 영업이익은 3124억원으로 전분기대비 흑자전환할 것으로 전망한다""며 ""정제마진이 전분기 대비 악화됐지만 1분기 국제유가 상승에 따른 원유재고평가이익이 2분기 실적에 온기로..."
718,2019.06.18.,"국제유가, 중국 경기둔화에 하락…WTI 1.1%↓",이투데이=배준호 기자 | 국제유가는 17일(현지시간) 하락했다. 뉴욕상업거래소(NYMEX)에서 7월 인도분 서부텍사스산 중질유(WTI) 가격은 전일 대비 0.58달러(1.1%) 하락한 배럴당 51.93달러로 거래를 마쳤다. 영국 런던...
719,2019.07.09.,中희토류 보복에 가격 '껑충'...美는 웃는다,"미국은 과거에도 풍부한 셰일가스 매장량에도 불구, 채산성이 맞지않아 소량 생산했지만 국제유가가 치솟자 '셰일 붐'이 일었다. 한때 셰일가스는 배럴당 50달러를 훌쩍 넘어야 채산성이 맞았지만 현재는 30달러대에서도..."
720,2019.07.09.,中희토류 보복에 가격 '껑충'...美는 웃는다,"미국은 과거에도 풍부한 셰일가스 매장량에도 불구, 채산성이 맞지않아 소량 생산했지만 국제유가가 치솟자 '셰일 붐'이 일었다. 한때 셰일가스는 배럴당 50달러를 훌쩍 넘어야 채산성이 맞았지만 현재는 30달러대에서도..."
721,2019.07.09.,"유가 혼조, WTI 57.66달러…미-이란 핵합의 갈등 고조",국제유가는 이란 핵합의 갈등 고조 및 글로벌 무역 분쟁 여파에 대한 우려로 혼조세를 보였다. 9일 한국석유공사에 따르면 8일(현지시간) 뉴욕상업거래소(NYMEX)의 미국 서부텍사스산원유(WTI) 가격은 전일 대비...
722,2019.07.10.,"세계 에너지 시장의 큰손 사우디, 태양광으로 탈석유 박차",수출과 재정의 석유 의존도가 너무 큰 것은 물론 낮은 국제유가는 경상수지와 재정수지를 악화시켜 신규 투자를 위축시키고 있다. 또한 신규 투자 위축은 국내총생산(GDP) 성장률을 끌어내리고 실업률을 올리는 핵심...
723,2019.07.09.,"뉴욕증시·다우지수, 악재 계속될까? 연준 결과에 주목","국제유가는 소폭 올랐다. 8월물 서부텍사스산 원유(WTI) 가격은 전 거래일보다 0.30% 상승한 57.68달러에, 브렌트유는 0.37% 오른 64.47달러에 움직였다. 시카고상품거래소(CME) 페드워치에 따르면 연방기금(FF) 금리선물..."
724,2019.07.09.,배터리 매출만 32조 목표…LG그룹 '1옵션' 바뀌나,국제유가 등 지엽적 변수들을 감안하더라도 장기적으로 전기차 시장이 확대될 수밖에 없는 구조다. LG화학이 5년 내 배터리 매출 31조6000억원을 달성한다면 이는 LG그룹 내부적으로도 상당히 의미있는 변화다....
725,2019.06.11.,"국제유가, 무역· 러시아 감산 불확실성에 하락…WTI 1.4%↓",이투데이=배준호 기자 | 국제유가는 10일(현지시간) 하락했다. 뉴욕상업거래소(NYMEX)에서 7월 인도분 서부텍사스산 중질유(WTI) 가격은 전일 대비 0.73달러(1.4%) 하락한 배럴당 53.26달러로 거래를 마쳤다. 영국 런던...
726,2019.07.02.,"소비자물가 상승률 6개월째 0%대…""복지확대 영향""(종합)","김윤성 통계청 물가동향과장은 ""서비스물가가 낮은 상승률을 보였고 석유류도 작년 대비 국제유가 하락이 이어지고 유류세 인하 요인도 있어서 하락세가 지속됐다""며 ""소비가 부진한 것도 일부 영향을 미쳐서 1..."
727,2019.07.10.,[뉴욕마감]제롬 파월의 '입'에 쏠린 눈길…투자자들 관망에 혼조세,국제유가는 이날 소폭 올랐다. 이날 뉴욕상업거래소(NYMEX)에서 8월 인도분 서부 텍사스산 원유(WTI)는 배럴당 0.3%(0.17달러) 오른 57.83달러에 거래를 마쳤다. 런던 ICE 선물거래소의 9월물 브렌트유도 오후 3시30분 현재...
728,2019.07.10.,"러시아 증시 나홀로 급등, 아직 더 오를 수 있다","국제유가가 전년 대비 상승한 덕분에 재정수지와 경상수지가 흑자로 돌아섰고, 러시아 중앙은행은 이달 중 기준금리 50bp 인하를 예고해 다른 신흥국에 비해 통화 안정성이 높아졌다. 이해선 연구원은 “지금 같은..."
729,2019.07.10.,'이란 사태' 여파 지속…WTI 0.3%↑,국제유가는 9일(현지시간) 소폭 올랐다. 이날 뉴욕상업거래소(NYMEX)에서 8월 인도분 서부 텍사스산 원유(WTI)는 배럴당 0.3%(0.17달러) 오른 57.83달러에 장을 마감했다. 런던 ICE 선물거래소의 9월물 브렌트유도...
730,2019.07.02.,"소비자물가 상승률 6개월째 0%대…""하반기도 높지 않을 것""(종합2보)","김윤성 통계청 물가동향과장은 ""서비스물가가 낮은 상승률을 보였고 석유류도 작년 대비 국제유가 하락이 이어지고 유류세 인하 요인도 있어서 하락세가 지속했다""며 ""소비가 부진한 것도 일부 영향을 미쳐서 1%대..."
731,2019.06.13.,"국제유가, 오만해 유조선 피격 소식에 급등…WTI 2.4%↑",
732,2019.07.10.,"미 뉴욕증시, 파월 Fed의장 의회 증언 앞두고 혼조세 마감",국제유가는 올랐다. 이날 뉴욕상업거래소(NYMEX)에서 8월분 WTI(서부 텍사스산 원유)는 전날보다 배럴당 17센트(0.3%) 상승한 57.83달러에 장을 마쳤다. 시장은 하루 앞으로 다가온 파월 의장의 의회 증언 일정에...
733,2019.07.09.,[뉴욕마감]美 금리 인하 전망 약화에 기술주 중심 하락,국제유가는 혼조세를 보였다. 이날 뉴욕상업거래소(NYMEX)에서 8월 인도분 서부 텍사스산 원유(WTI)는 배럴당 0.3%(0.15달러) 상승한 57.66달러에 거래를 마쳤다. 반면 런던 ICE 선물거래소의 9월물 브렌트유는 오후...
734,2019.07.09.,[Who Is ?] 이호승 청와대 경제수석비서관,"국제 유가가 오른다든지, 특정 품목의 수요가 갑자기 늘어나서 공급이 못 따라가 물가가 오를 수도 있다. 한마디로 종합적 요인이 작용한다. 그래서 이번 최저임금 상승으로 물가가 올랐다는 일부 보도는 증거가..."
735,2019.07.06.,"전국 기름값, 두 달 만에 1천500원 아래로","2원 내려간 1천358.4원이었습니다. 휘발유 가격과 경유 가격은 5주 연속 하락했습니다. 한국석유공사는 ""미국의 경기지표가 부진하면서 국제유가가 하락했다""며 하락 배경을 설명했습니다. [사진 출처 : 연합뉴스]"
736,2019.07.02.,[2보] 6월 소비자물가 0.7% 상승…반년째 0%대 상승률,"김윤성 통계청 물가동향과장은 ""서비스물가가 낮은 상승률을 보였고 석유류도 작년 대비 국제유가 하락이 이어지고 유류세 인하 요인도 있어서 하락세가 지속됐다""며 ""소비가 부진한 것도 일부 영향을 미쳐서 1..."
737,2019.07.09.,"뉴욕증시, 파월 증언 경계 하락 출발","국제유가는 하락했다. 8월물 서부텍사스산 원유(WTI) 가격은 전 거래일보다 0.42% 하락한 57.42달러에, 브렌트유는 0.23% 내린 63.96달러에 움직였다. 시카고상품거래소(CME) 페드워치에 따르면 연방기금(FF) 금리선물..."
738,2019.07.02.,한전 '요금체계 개편' 전기료 인상하나…정부는 '일축',"한편 지난해 국제유가 상승과 원전가동률 하락 때문에 한전이 2천억원 정도 적자를 봤던 것과 달리 올해의 경우 유가가 비교적 안정세이고 원전가동률도 올라가는 추세여서, 한전 재무상황이 언제 호전될지도 전반적..."
739,2019.07.09.,[뉴욕증시] 애플 비관론 확산·연준 정책 방향 주시 속 하락,"대규모 구조조정 예고에 급락 [국제유가] 중동 지역 긴장 고조에 WTI 상승 오늘 뉴욕증시, 지난 금요일 미국의 비농업 고용지표가 호조를 보인 가운데 연준의 금리 인하 기대가 후퇴한 채 출발했습니다. 여기에..."
740,2019.07.09.,[뉴욕증시] 애플 비관론 확산·연준 정책 방향 주시 속 하락,"대규모 구조조정 예고에 급락 [국제유가] 중동 지역 긴장 고조에 WTI 상승 오늘 뉴욕증시, 지난 금요일 미국의 비농업 고용지표가 호조를 보인 가운데 연준의 금리 인하 기대가 후퇴한 채 출발했습니다. 여기에..."
741,2019.07.10.,"[해외시황] 뉴욕, 파월 증언 앞두고 혼조세…유럽↓","이런 가운데 국제유가는 '이란 사태'의 추이를 주목하는 가운데, 신중한 기조를 유지하며 소폭 상승했다. 이날 뉴욕상업거래소(NYMEX)에서 8월 인도분 서부텍사스산원유(WTI)는 배럴당 0.29%(0.17달러) 오른 57.83달러에..."
742,2019.07.02.,소비자물가 6개월 연속 0%대…디스인플레이션 조짐(종합),"2015년에는 국제유가가 급락했고 메르스(중동호흡기증후군) 사태도 발생해 소비심리가 크게 얼어붙었던 때다. 올해 들어 소비자물가 상승률이 0%대로 뚝 떨어진 직접적인 원인은 기름값이 낮은 수준을 보이고, 따뜻한..."
743,2019.07.10.,[뉴스텔링] 삼성·현대차·SK·LG…‘재계연합’ 가능할까,"미중무역 분쟁이 고조됐으며, 중동 산유국들과 미국 간의 마찰 등으로 환율·금리·국제유가의 불확실성이 커졌다. 이재용 삼성전자 부회장이 일본 정부의 대(對)한국 수출 규제에 대한 대책 논의를 위해 지난 7일 오후..."
744,2019.07.03.,어려워진 韓경제…정부도 성장률 전망 0.2%p 내려,국제유가 하락과 농축수산물 가격 안정 등 공급측 요인을 고려했다. 올들어 6개월 연속 소비자물가 상승률이 0%대에 머무른 것을 반영한 것이다. 경상수지 흑자 규모는 605억달러(약 70조6337억원)로 전망했다....
745,2019.06.12.,"국제유가, 글로벌 경기둔화 불안·감산 기대 교차에 보합…WTI 0.02%↑",이투데이=배준호 기자 | 국제유가는 11일(현지시간) 보합권에서 움직였다. 뉴욕상업거래소(NYMEX)에서 7월 인도분 서부텍사스산 중질유(WTI) 가격은 전일 대비 0.01달러(0.02%) 상승한 배럴당 53.27달러로 거래를 마쳤다....
746,2019.07.09.,"해양플랜트 부품社 티에스엠텍, 법정관리 4년만에 매물로","한 업계 관계자는 “최근 국제 유가 상승으로 해양플랜트 업황이 회복 조짐을 보이면서, 법원을 잇따라 찾았던 해양플랜트 관련 기업들에 대한 시장의 관심도 높아지고 있다”고 전했다."
747,2019.07.09.,"뉴욕증시, 연준 금리인하 기대 후퇴 하락 출발","국제유가는 소폭 올랐다. 8월물 서부텍사스산 원유(WTI) 가격은 전 거래일보다 0.30% 상승한 57.68달러에, 브렌트유는 0.37% 오른 64.47달러에 움직였다. 시카고상품거래소(CME) 페드워치에 따르면 연방기금(FF) 금리선물..."
748,2019.07.09.,저평가에 배당도 기대되는 美 에너지 업종,"미국 서부텍사스원유(WTI)를 기준으로 배럴당 50달러까지 하락했던 국제 유가가 서서히 반등하고 있다. 변동성은 커질 수 있으나, 현 수준에서 국제 유가는 상승 쪽으로 방향을 잡을 가능성이 크다는 의견을 제시한다...."
749,2019.07.09.,"미 뉴욕증시, 애플 2% 이상 하락",7%에 달했다. 국제유가는 혼조세였다. 이날 뉴욕상업거래소(NYMEX)에서 8월분 WTI(서부 텍사스산 원유)는 전날보다 배럴당 15센트(0.3%) 상승한 57.66달러에 장을 마쳤다. 이성구 글로벌경제신문 전문위원
750,2019.07.09.,"미 뉴욕증시, 애플 2% 이상 하락",7%에 달했다. 국제유가는 혼조세였다. 이날 뉴욕상업거래소(NYMEX)에서 8월분 WTI(서부 텍사스산 원유)는 전날보다 배럴당 15센트(0.3%) 상승한 57.66달러에 장을 마쳤다. 이성구 글로벌경제신문 전문위원
751,2019.07.02.,"OPEC, 원유감산 9개월 연장",미중 무역전쟁의 여파로 중국의 원유수요 감소가 예상되는 가운데 더 이상의 국제유가 하락을 막기 위한 조치로 풀이된다. 1일(현지시간) 월스트리트저널(WSJ) 등은 OPEC 회원국들이 이날 오스트리아 빈에서...
752,2019.07.06.,"휘발유, 두 달 만에 1500원 밑돌아","5달러 내린 62.7달러였다. 한국석유공사 관계자는 ""미국 원유 재고가 기대보다 감소 폭이 적었고 미국의 경기지표가 부진하면서 국제유가가 하락했다""고 설명했다."
753,2019.07.10.,[오늘의 글로벌마켓]파월의 '입'에 쏠린 눈...관망 심리 속 혼조세 마감,국제유가는 소폭 상승했다. 이날 뉴욕상업거래소(NYMEX)에서 8월 인도분 서부 텍사스산 원유(WTI)는 전일보다 배럴당 0.17달러(0.3%) 오른 57.83달러에 장을 마쳤다. 국제 금값은 상승했다. 이날 뉴욕상품거래소(COMEX)...
754,2019.07.10.,파월 의회출석 앞두고 원화환율·엔화환율 소폭 상승,"국제유가는 미국의 석유비축량 감소와 중동지역 긴장으로 아시아시장에서 큰 폭으로 올랐다. 브렌트유는 배럴당 65.33 달러로 1.82% 올랐고 미국산원유는 59.06 달러로 2.13% 상승했다. CNBC에 따르면, 미국석유협회..."
755,2019.07.06.,전국 휘발유 가격 5주째 하락…리터당 1400원대 진입,"국제유가는 두바이유 기준으로 배럴당 62.7달러를 기록해 전주 대비 1.5달러 올랐다. 석유공사는 ""기대보다 적은 감소폭을 보인 미국 원유 재고와 미 경기지표 부진 등의 영향으로 하락했다""고 밝혔다...."
756,2019.07.09.,[뉴욕증시] 금리 인하 기대 약화·애플 전망 부진에 3대지수 하락,"예고 [국제유가] 중동 지역 긴장 고조에 WTI 상승 오늘 뉴욕증시, 지난 금요일 미국의 비농업 고용지표가 호조를 보인 가운데 연준의 금리 인하 기대가 후퇴한 채 출발했습니다. 여기에 무역협상 관련 불안도 잔존하면서..."
757,2019.07.06.,"국제유가, 英 이란 유조선 억류 위기감 증폭 상승","국제유가가 5일(현지시간) 상승했다. 글로벌 경제 둔화 가능성에 하락세를 보였지만 이날은 이란과 서방간의 갈등이 이어지며 중동 위기감이 재차 부상, 상승했다. 서부텍사스산원유(WTI) 8월 인도분은 이날..."
758,2019.07.09.,"세계증시, 연준 금리인하 기대 줄어 3일 연속 하락",상품시장에서는 이란 위기에도 불구하고 세계 경제성장 둔화로 수요가 약화될 것이란 우려에 국제유가가 소폭 하락하고 있다. 금값도 미달러가 상승하면서 소폭 하락하고 있다. 6개 주요 통화 대비 달러지수 9일 추이...
759,2019.07.04.,5월 경상수지 한 달 만에 흑자 전환,수입(426억4천만달러)은 국제유가 약세와 기계류 수입 감소로 1년 전보다 1% 감소했다. 서비스수지 적자(9억달러) 규모는 운송·여행수지 개선으로 2년5개월만에 가장 작았다. 중국인 입국자 수가 2년3개월 만에...
760,2019.07.04.,5월 경상수지 한 달 만에 흑자 전환,수입(426억4천만달러)은 국제유가 약세와 기계류 수입 감소로 1년 전보다 1% 감소했다. 서비스수지 적자(9억달러) 규모는 운송·여행수지 개선으로 2년5개월만에 가장 작았다. 중국인 입국자 수가 2년3개월 만에...
761,2019.07.02.,"국제유가, 감산연장·무역분쟁 휴전에 WTI 1.1% 상승",석유수출국기구(OPEC)의 감산합의 연장 기정사실화와 미-중 무역분쟁 일시 합의 등의 영향으로 국제유가가 상승했다. 일부 전문가들은 경제침체로 유가상승 추세가 지속되지 않을 수 있다고 보고 있다. 1일(현지시간)...
762,2019.07.06.,전국 휘발유 가격 5주째 하락…리터당 1400원대 진입,"3원 낮았다. 국제유가는 두바이유 기준으로 배럴당 62.7달러를 기록해 전주 대비 1.5달러 올랐다. 석유공사는 ""기대보다 적은 감소폭을 보인 미국 원유 재고와 미 경기지표 부진 등의 영향으로 하락했다""고 밝혔다."
763,2019.07.02.,"0%대 저물가 반년째 지속…“복지확대 영향” Vs ""준(準) 디플레""",물가상승률이 6개월 이상 1% 미만을 유지한 건 국제유가가 큰 폭 내렸던 2015년 2~11월(10개월 연속)과 1999년 2~9월(8개월 연속)뿐이다. 연간으로도 0%대 물가상승률을 기록할 가능성이 커졌다. 연간 물가상승률이 0%대를...
764,2019.07.09.,"[해외시황] 뉴욕, 연준 금리인하 기대 약화에 하락…유럽↓",이런 가운데 국제유가는 8일(현지시각) 이란 사태를 주시하면서 혼조세를 나타냈다. 이날 뉴욕상업거래소(NYMEX)에서 8월 인도분 서부텍사스산원유(WTI)는 배럴당 0.26%(0.15달러) 상승한 57.66달러로 장을 끝냈다. 반면...
765,2019.07.06.,"전국 기름값, 두 달 만에 ℓ당 1500원 아래로",0원에 판매해 GS칼텍스와 함께 1500원대를 유지했다. 한국석유공사는 미국 원유 재고가 기대보다 감소 폭이 적었고 미국의 경기지표가 부진하면서 국제유가가 하락한 것으로 내다봤다. 디지털뉴스부기자
766,2019.07.10.,[증시브리핑] 美증시 혼조세…연준의장 증언에 ‘주목’,◇ 국제유가 국제유가는 상승했습니다. 투자자들은 이란을 주목하고 있는데요. 와중에 주요 산유국인 러시아의 월간 산유량이 3년 만에 최저치로 떨어진 점도 유가 상승을 보탰습니다. ◇ 원·달러 환율 원·달러 환율은...
767,2019.07.02.,'복지 확대' 6월 소비자물가 0.7% 상승...6개월째 0%대(종합2보),소비자물가지수 주요 등락률 추이 고교 무상급식 등 복지정책 확대와 국제유가 하락의 영향을 받아 6월 소비자물가가 6개월 연속 0%대 상승률을 기록했다. 2일 통계청이 발표한 ‘6월 소비자물가 동향’에 따르면...
768,2019.07.10.,코스피 장중 2060선 회복 현대건설 강세 코스닥도 7P이상 상승세,국제유가는 소폭 올랐다. 이날 뉴욕상업거래소(NYMEX)에서 8월 인도분 서부 텍사스산 원유(WTI)는 배럴당 0.3%(0.17달러) 오른 57.83달러에 거래를 마쳤다. 런던 ICE 선물거래소의 9월물 브렌트유도 오후 3시30분 현재...
769,2019.07.08.,[Who is ?] 김창범 한화케미칼 대표이사 부회장,그러나 이런 석유화학 범용 제품은 국제유가에 따라 마진율이 영향받아 불안정하다. 최근에는 정유회사들이 석유화학 생산시장에 뛰어들면서 범용제품은 증설경쟁이 벌어져 규모의 경제가 실현되고 있다. 이런...
770,2019.07.02.,'복지 확대' 6월 소비자물가 0.7% 상승...6개월째 0%대(종합2보),소비자물가지수 주요 등락률 추이 고교 무상급식 등 복지정책 확대와 국제유가 하락의 영향을 받아 6월 소비자물가가 6개월 연속 0%대 상승률을 기록했다. 2일 통계청이 발표한 ‘6월 소비자물가 동향’에 따르면...
771,2019.07.06.,휘발유 가격 5주 연속 하락..전국 평균 1500원 아래로 안정세,업체가 이달 공급가를 반년 만에 최대폭으로 인하한 데 따른 효과다. 휘발유과 경유 가격 인하는 국제유가의 하락 덕분이다. 한국이 주로 수입하는 두바이유는 전주보다 배럴당 1.5달러 내린 62.7달러였다. 주영로
772,2019.07.10.,코스피 장중 2060선 회복 현대건설 강세 코스닥도 7P이상 상승세,국제유가는 소폭 올랐다. 이날 뉴욕상업거래소(NYMEX)에서 8월 인도분 서부 텍사스산 원유(WTI)는 배럴당 0.3%(0.17달러) 오른 57.83달러에 거래를 마쳤다. 런던 ICE 선물거래소의 9월물 브렌트유도 오후 3시30분 현재...
773,2019.07.08.,[Who is ?] 김창범 한화케미칼 대표이사 부회장,그러나 이런 석유화학 범용 제품은 국제유가에 따라 마진율이 영향받아 불안정하다. 최근에는 정유회사들이 석유화학 생산시장에 뛰어들면서 범용제품은 증설경쟁이 벌어져 규모의 경제가 실현되고 있다. 이런...
