,날짜,제목,요약
3013,2021.11.23.,전세계가 인플레 걱정인데 나홀로 디플레와 싸우는 日,"국제유가 및 원자재 가격이 급격히 상승한 여파로 일본의 지난달 생산자물가지수(PPI) 상승폭은 전년동월 대비 8% 증가, 40년 만에 최고 상승폭을 기록했다. 가격 인상에 소극적이었던 일본 기업들도 한계치에 다다른..."
3014,2021.11.29.,코로나19 새로운 변이 '오미크론'…글로벌 경기 회복 적신호,"고공행진하던 국제유가는 각국의 봉쇄 조치에 따른 경기위축 우려와 수요 감소 전망으로 급락했다. 26일 뉴욕상업거래소에서 1월물 서부텍사스산원유(WTI) 가격은 13.06%, 브렌트유는 10.7% 하락했다. 영국 경제전문 잡지..."
3015,2021.11.12.,"끝모를 공급병목에 연쇄 충격파···""최후보루 '재정 둑' 쌓아놔야""",공급 병목 등으로 국제 유가가 오르면서 물가를 자극하자 중앙은행의 긴축 시계도 빨라지고 있다. 공급 병목이 언제 해소될지 예측하기 어려운 데다 미국 연방준비제도(Fed·연준) 등 주요국의 정책 전환마저 예고된 만큼...
3016,2021.11.29.,먹거리 물가 1년째 줄인상...소비자 불만 고조,"있다""며 ""국제유가 등 원자재 가격 상승세가 계속돼 4분기 생활 물가가 더욱 우려스러운 상황이다. 정부는 선제적 대책을 마련해 원자재 값 상승이 소비자 부담으로 전가되는 상황을 방지해야 한다""고 우려를 표하기도..."
3017,2021.11.26.,"주유소 휘발유 가격 2주째 내려, 리터당 전국 평균 1687.5원","11월 둘째 주 평균 국제유가(두바이유 기준) 직전 주보다 배럴당 0.6달러 하락한 80.1달러로 집계됐다. 한국석유공사 ""국제유가는 미국 원유재고 증가와 전략비축유 방출 발표, 유럽 코로나19에 따른 봉쇄조치..."
3018,2021.11.12.,휘발유 리터당 최대 164원 싸진다…유류세 20% 인하,"유류세 인하분을 반영해 가격을 낮추도록 정유업계에 협조를 요청했다. 직영주유소와 알뜰주유소는 전체의 19.2% 수준이다. 한편, 국제유가 상승세가 지속된다면 유류세 체감 효과는 반감될 것이라는 우려도 나온다."
3019,2021.11.12.,오늘부터 유류세 인하…완벽 적용까지 최대 2주,"한 정유업계 관계자는 ""국제유가 급등에 따른 서민경제 부담완화를 위해 유류세 20% 인하가 됐지만 유가 상승은 고점을 찍은 상태가 아니어서 지금 추세대로만 올라도 국민 체감 강도는 높지 않을 수 있다""고 말했다."
3020,2021.11.12.,오늘부터 유류세 인하…완벽 적용까지 최대 2주,"한 정유업계 관계자는 ""국제유가 급등에 따른 서민경제 부담완화를 위해 유류세 20% 인하가 됐지만 유가 상승은 고점을 찍은 상태가 아니어서 지금 추세대로만 올라도 국민 체감 강도는 높지 않을 수 있다""고 말했다."
3021,2021.11.25.,"'탄소중립 해결사' 토요타 하이브리드 ""현실적 대안""",실제 원유 감산 합의로 무섭게 치솟던 국제 유가는 정부가 '한시적 유류세 인하 카드'를 꺼낼 정도로 국내에 적지 않은 영향을 미치고 있다. 이른바 '안전속도3050 정책'이라고도 불리는 도로교통법 시행규칙이 지난 4월...
3022,2021.11.13.,요소값 한 달 새 30% 급등… 수입물가 급등세에 기름 부었다,국제 유가는 두바이유 기준으로 12.4% 상승했다. 이에 따라 지난달 전체 수입물가지수는 전월 대비 4.8% 오른 130.43으로 집계됐다. 6개월 연속 오르며 2013년 2월(130.83) 이후 8년8개월 만에 최고치를 기록했다. 정부는...
3023,2021.11.11.,"광주은행, 외환 매매 예약 서비스 시행…환테크 편의 기대",글로벌 경기부진과 국제 유가 상승에 따른 인플레이션 우려가 커지면서 안전자산을 선호하는 움직임이 늘어남에 따라 재테크 수단으로 외화예금 또는 환율 상승으로 수익을 얻는 환테크에 관심을 보이는 고객들이...
3024,2021.11.16.,교권 침해 교사 요청 시 교권보호위 열어야…특별휴가 우선 부여,"지난해 하반기부터 국제유가가 상승하면서 재활용가능품목 단가도 상승했으며, 그로 인해 폐기물 수거나 수급 상황이 안정적인 것으로 나타났다. 정부는 공동주택이나 단독주택의 재활용품 분리배출을 지원하기 위해..."
3025,2021.11.18.,"중국 ""비축유 일부 방출 작업 진행""...바이든 요청에 따른 것인지는 불확실","조 바이든 행정부가 치솟는 국제 유가를 억제하기 위해 한국, 중국, 일본 등에 석유 비축분을 방출해달라고 요청한 가운데 중국이 비축유 일부를 방출하는 절차에 착수했다.17일(현지시간) 로이터와 블룸버그 통신에..."
3026,2021.11.11.,오늘부터 반년간 ‘유류세 20% 인하’…ℓ당 휘발유 164원·경유는 116원,이번 유류세 인하 조치는 당정이 최근 국제유가 급등으로 기름값이 치솟자 내년 4월30일까지 20% 유류세 인하를 결정한 데 따른 것이다. 한국석유공사 유가정보서비스 오피넷에 따르면 지난 10일 오후 7시 기준 전국...
3027,2021.11.15.,지금까지는 예고편…글로벌 공급난에 물가 위기 본격,"연일 치솟는 국제유가는 지금도 악재로 작용하고 있다. 현재로선 전망이 밝지 않다. 경기와 물가, 금리라는 변수들이 얽히다 보니 문제 해결 실마리 찾기가 어렵다. 무엇보다 글로벌 공급망 병목현상을 해결해야..."
3028,2021.11.20.,"[이번주 ETF] 인플레 헤지, 농산물 ETF로 해볼까…'DBA'","국제유가는 배럴당 80달러 선을 하회하고, 물가 상승 압력의 주된 요인이 됐던 천연가스 가격 또한 잠잠해졌습니다. 반면 5~6개월째 횡보하던 농산물은 들썩이고 있습니다. 일부 신고가를 경신하는 등 소맥, 옥수수..."
3029,2021.11.17.,"미, 중에 “전략 비축분 원유 공동 방출” 제안",미국이 중국 쪽에 국제 유가 안정화를 위해 전략 비축분 원유 공동 방출을 제안한 것으로 전해졌다. 미-중 갈등 격화 속에 양국 간 실질적인 협력의 새로운 모델이 될 수 있을지 관심을 모은다. 17일 <사우스차이나...
3030,2021.11.25.,[창간 16주년] 해외건설 다시 뛴다...수주환경 개선에 부푼 꿈,"올 해외수주액 200~300억 달러선으로 침체 국제유가 70달러 돌파…건설 경기 반등 기대 ""글로벌경기 회복따라 내년엔 400억 달러 예상"" 국내 건설사들이 해외건설시장에서 다시 뛴다. ‘위드 코로나’와 국제유가..."
3031,2021.11.11.,내일 유류세 인하 앞두고 썰렁한 주유소…가격 반영은 1~2주 걸려,"게다가 국제유가도 계속 오르는 상황이어서, 유류세를 내려도 운전자들이 가격 인하를 체감하기 어려울 수 있다는 우려도 나옵니다. MBN뉴스 안병욱입니다. 영상취재 : 안석준 기자 영상편집 : 이유진"
3032,2021.11.12.,"기재부 “경제 대외 불확실성 여전…내수 여건은 점차 개선""","이어 “최근 국제 유가와 함께 주요국 물가도 높은 수준으로, 우리나라 물가 상방 압력이 높은 상황”이라고 덧붙였다.기재부는 우리나라 대면서비스업 등 내수여건은 점차 개선될 가능성이 있다고 분석했다. 지난달..."
3033,2021.11.17.,'소비 살아있다' 증시 강세...'EV' 루시드 급등[뉴욕마감](종합),런던 ICE 선물거래소에서 오후 11시10분 기준 국제유가의 기준물인 1월분 북해산 브렌트유는 배럴당 0.35달러(0.43%) 오른 82.40달러를 기록 중이다. 금 가격은 내렸다. 이날 뉴욕상품거래소에서 12월 인도분 금 가격은 전...
3034,2021.11.17.,[fn광장] 인플레이션과 자산가격,공급 측면에서도 국제유가 등 원자재 가격이 급등하면서 시차를 두고 물가를 올리고 있다. 국제유가가 상승하면 2개월 후 물가가 가장 많이 올랐다. 여기다가 일부 원자재와 중간재의 병목현상까지 더해지면서...
3035,2021.11.11.,"한은 총재 ""높은 소비자물가 상승률 지속될 것…불확실성 커져""","""공급병목 등 불확실성에 전망 어려워…위드코로나로 소비 개선세는 확대"" 한국은행 측은 최근 글로벌 공급 부족 현상과 함께 국제유가가 상승하고 수요측 물가 압력이 높아진 점을 들어 ""예상보다 높은 소비자물가..."
3036,2021.11.12.,유류세 20% 인하 오늘부터 실시,정부와 더불어민주당은 국제유가가 급등하자 지난달 26일 물가 안정과 서민경제 부담 완화를 위해 내년 4월 30일까지 유류세를 20% 인하하기로 했다. 이에 따라 휘발유에 부과되는 유류세는 리터(ℓ)당...
3037,2021.11.15.,‘씀씀이 축소→고용감소’ 악순환…재침체 기로 놓인 한국 경제 [김익환의 외...,국제유가와 원자잿값이 고공행진을 이어가는 등 물가 오름세가 꺾일 조짐은 보이지 않고 있다. 여기에 시장금리가 연일 뜀박질하면서 가계·기업의 이자비용 상환 부담은 한층 커졌다. 치솟는 원·달러 환율은 해외서...
3038,2021.11.12.,오늘부터 유류세 20% 인하…휘발유 리터당 164원↓,"최근 국제유가 급등으로 국내 기름값 부담이 크게 늘자 물가 안정과 서민경제 부담을 낮추기 위한 한시적인 조치다. 유류세 인하는 내년 4월 말까지 계속된다.이번 조치로 최근 휘발유 가격 기준 리터당 1,805원에서 1..."
3039,2021.11.16.,美 10년물 국채금리 1.6% 돌파···나스닥 소폭 하락 [데일리 국제금융시장],국제유가는 미국 정부의 전략적 비축유 공급 가능성이 제기되는 가운데 소폭 올랐다. 이날 뉴욕상업거래소의 12월물 서부텍사스산원유(WTI) 가격은 전 거래일 대비 0.09달러(0.11%) 상승한 배럴당 80.88달러에...
3040,2021.11.12.,오늘부터 유류세 20% 인하…휘발유 리터당 164원↓,"최근 국제유가 급등으로 국내 기름값 부담이 크게 늘자 물가 안정과 서민경제 부담을 낮추기 위한 한시적인 조치다. 유류세 인하는 내년 4월 말까지 계속된다.이번 조치로 최근 휘발유 가격 기준 리터당 1,805원에서 1..."
3041,2021.11.16.,美 10년물 국채금리 1.6% 돌파···나스닥 소폭 하락 [데일리 국제금융시장],국제유가는 미국 정부의 전략적 비축유 공급 가능성이 제기되는 가운데 소폭 올랐다. 이날 뉴욕상업거래소의 12월물 서부텍사스산원유(WTI) 가격은 전 거래일 대비 0.09달러(0.11%) 상승한 배럴당 80.88달러에...
3042,2021.11.12.,"이주열 “고물가 지속, 인플레 일시적일지 의문”…금리인상 시사",초래됐다”며 “국제유가가 상승하고 수요 측 물가 압력이 높아지면서 예상보다 높은 소비자물가 상승률이 당분간 지속될 것으로 보인다”고 밝혔다. 올 상반기까지만 해도 일시적일 것이라 예견했던 인플레이션에...
3043,2021.11.15.,"세아제강지주 3분기 실적 대폭 늘어, 에너지용 강관사업 호조","세아제강은 ""위드 코로나정책에 기반한 글로벌 경제회복세가 뚜렷하며 국제유가 강세와 미국 인프라 예산법안 통과, 해상풍력 등 신재생에너지 프로젝트 증가로 강관·구조물 판매와 수익성 호조세 지속할 것으로..."
3044,2021.11.11.,12일부터 유류세 20% 인하…가격 체감 1~2주 소요,"최근 국제유가가 급등하자, 지난달 26일 당정은 물가 안정과 서민경제 부담 완화를 위해 내년 4월 30일까지 유류세를 인하하기로 결정한 바 있다. 한국석유공사 유가 정보서비스 오피넷에 따르면 지난 10일 오후 7시..."
3045,2021.11.15.,8주 고공행진 휘발윳값 드디어 꺾인다,국제유가의 상승으로 고공행진하던 휘발유·경유 등 석유제품 가격을 붙잡기 위해 정부는 지난 12일부터 유류세 20% 인하 조치를 단행했다. 이날부터 정유공장에서 반출된 석유제품에 대한 유류세가 인하되는...
3046,2021.11.16.,<10문10답>글로벌 에너지 대란… 韓 경제는,"탄소 중립의 역설 ‘그린플레이션’ 충격파 원자재·물류비 도미노↑… 산업계 초비상 “국제유가 100달러까지 갈 것” “천연가스 내년까지 고공행진” 시장 전망… 글로벌 혼란 계속 등유, 유류세 인하 대상서 제외..."
3047,2021.11.29.,[Invest]오미크론 변이' 공포...코스피 2900선은 가까스로 사수,"국제 유가가 급반등했고, 상해 지수가 약보합을 기록하는 등 대외 여건이 안정세를 보인 덕분이다. 다만 원달러 환율은 지난 주말의 악재를 소화하며 장초반 1200원선에 육박하기도 했다. 원달러 환율은..."
3048,2021.11.17.,"휘발유값 내년에 떨어질까…""OPEC+와 美 셰일에 달렸다""",국제유가 기준인 북해 브렌트유는 배럴당 86달러까지 올랐고 일부 이코노미스트들은 100달러도 넘겨 경제 회복을 위협할 수 있다고 경고한다. 공급이 늘면 유가랠리가 한풀 꺾일 수 있다. 국제에너지기구(IEA)는 내년...
3049,2021.11.14.,"장바구니 물가 급등한 이유 있었다…FAO 식품가격지수, 10년來 최고","3%)하겠으나, 곡물·설탕 가격은 작황 개선으로 하락(각각 -9.8%, -5.1%)할 것으로 전망했다. 다만, 국제유가 추이와 라니냐 등 남미지역 이상기후 가능성 등 가격 불안 요인은 여전히 상존하고 있는 만큼 변동성은 크다."
3050,2021.12.01.,해외 건설수주 침체…코로나19 새 변이에 물량 확보 '비상',최근 오미크론 변이 확산으로 각국의 봉쇄 조치가 이어지고 있는 데다 국제유가도 다시 급락하고 있어서다. 다만 현재까지 중동에서 수주한 사업에는 문제가 없이 진행될 것으로 예상된다. 건설사들은...
3051,2021.11.30.,딜링룸 24시…챙겨봐야 할 국제경제뉴스,""" - 글로벌 투자은행인 JP모건은 남아프리카공화국발 신종 코로나바이러스 감염증(코로나19) 변이 공포에 10% 이상 추락한 국제 유가가 브렌트유 기준으로 내년에 배럴당 125달러에 이르고 2023년에는..."
3052,2021.11.25.,"한은, 올해 성장률 전망 4.0% '유지'…물가상승률 전망은 2.3%로 '상향'(종합...","국제유가 및 원자재 가격 상승, 공급병목, 소비수요 점진 증가 등을 반영한 것으로 풀이된다. 물가상승이 일시적에 그치지 않을 경우 인플레이션 우려를 더하고 있는 상황에서 상향 조정된 점이 주목된다. 한은은..."
3053,2021.11.24.,[WTI] 배럴당 78.5달러...+2.28%,"5달러로 전일 대비 2.28% 상승했다. 최근 5년 국제유가(WTI) 가격 일별 추이 (자료: 아이투자 인더스트리워치 서비스) [관련 기업] SK이노베이션, S-Oil, GS, 롯데케미칼, 금호석유, 대한유화, LG화학"
3054,2021.11.12.,5개월 만에 그린북에서 사라진 “내수 불확실성”···위드코로나발 경기회복...,"10월 국제유가는 천연가스 공급부족에 따른 석유대체수요 발생, OPEC+의 감산 기조 유지 등으로 오름세를 이어가고 있다. 배럴당 두바이유 가격은 10월 넷째 주 기준 83.3달러로 전주(83.1달러)보다도 상승했다. 기재부..."
3055,2021.12.06.,"OPEC 사무총장 ""일단은 증산 유지… 시장공급 계속 조정할 것""",지난 2일 OPEC과 러시아 등 주요 산유국으로 이뤄진 OPEC+가 미국 등의 비축유 방출과 코로나19 오미크론 변이 확산으로 수급 압박을 받을 것이라는 우려에도 일일 40만 배럴 증산을 유지하기로 결정한 후에 국제유가는...
3056,2021.11.22.,"중국發 인플레이션, 국내 농산물도 영향","국제유가와 원자재 가격, 지난해 부진에 따른 기저효과 등의 영향이다. 물론 수입뿐 아니라 중국을 대상으로 한 한국식품 수출도 꽤 증가하는 추세다. 한국농수산식품유통공사 상하이 지사에 따르면, 올해 1~5월 한국..."
3057,2021.11.24.,"오일 인플레이션 전쟁에 나선 바이든, 중간선거 앞두고 시진핑에 손 내밀어","바이든 대통령의 적극적인 의지에도 불구하고 이날 국제유가는 상승해, 향후 유가 향방에 대한 어두운 전망이 예고되는 상황이다. 사우디아라비아, 러시아 등이 미국 등의 증산 요구에 응하지 않고 있기 때문이다...."
3058,2021.11.12.,(영상)10월 수입물가 전년비 35.8%↑…13년 만에 최대폭,"뉴스토마토 = 김충범 기자 | 국제유가 상승, 원자재 가격 급등 여파로 수입물가가 전년 대비 35.8% 오르는 등 13년 만에 최대폭의 상승률을 기록했다. 또 수출물가도 석탄·석유, 화학제품 등 공산품 상승 여파로..."
3059,2021.11.16.,"현대硏마저 금리 인상 신중론···""비용 인플레는 경기 고려해야“",여기에 글로벌 저금리 기조가 오랫동안 이어지면서 풍부해진 유동성이 인플레이션을 유발하고 있을 뿐 아니라 최근 국제유가도 배럴당 80달러가 넘는 수준까지 상승해 물가를 끌어 올리고 있다. 에너지 가격 급등은 다시...
3060,2021.11.11.,"""물가상승 일시적"" vs ""당분간 지속 우려""...엇갈린 해석",물가에 가장 큰 영향을 미치는 국제유가가 내년 연평균 배럴당 70달러 안팎으로 올해와 비슷한 수준이 될 것으로 전망했습니다. KDI는 최근의 물가상승률을 일시적 현상으로 분석한 겁니다. 이 같은 전망은 물가 당국인...
3061,2021.11.17.,[경제뭐니] 유류세 내렸는데…휘발유 가격 따져보니,"국내 수입 원유의 기준인 두바이유는 배럴당 70달러 안팎에서 지난달부터 80달러대로 올랐는데요, 더 많은 주유소가 가격을 내리더라도 국제유가가 오르면 기름값 상승을 부추겨 유류세 인하 효과도 반감될 수 있습니다...."
3062,2021.11.11.,유류세 20% 내린다…휘발유 ℓ당 164원·경유 116원↓,이번 유류세 인하 조치는 최근 국제유가가 급등하면서 정부가 물가 안정과 서민경제 부담 완화를 위해 내년 4월 30일까지 유류세를 20% 인하하기로 한 데 따른 것이다. 유류세 인하분이 소비자가격에 반영된다고...
3063,2021.11.20.,대구지역 휘발유 가격 107원 뚝 떨어져 ℓ당 1천600원대,정유사 직영주유소 및 알뜰주유소의 경우 유류세 인하분을 시행 당일부터 반영했으나 일반 자영 주유소에서는 아직 반영되지 않은 곳이 있기 때문이다.국내 유가 선행지표인 국제유가는 하락세를 보였다. 국내...
3064,2021.11.17.,11월 17일 미국증시 특징주,"다음으로 국제유가 살펴보겠습니다. 유럽 내 코로나 확진자 수 증가와 향후 몇 개월 간원유 공급이 늘어날 것이라는 전망을 주시한 가운데, WTI와 브렌트유가 반대로 움직이고 있습니다. WTI는 소폭 하락하며 80달러선에..."
3065,2021.11.13.,[르포] 유류세 인하 첫날...직영·알뜰주유소만 북적,연일 상승하는 국제유가와 더불어 국내유가도 계속 오르자 정부는 물가 안정화 차원에서 2년 만에 유류세 내렸다. 2018년에는 유류세 15% 인하했던 걸 이번에는 5% 추가해 20%까지 내렸다. 12일 오전 안양시 동안구에 위치한...
3066,2021.11.24.,"뉴욕증시, 시장 금리 상승에 혼조 마감…다우 0.55%↑·나스닥 0.5%↓",나오면서 국제유가는 2%대 상승했다. 시카고옵션거래소(CBOE)에서 변동성지수(VIX)는 전장 대비 0.21포인트(1.10%) 상승한 19.38을 기록했다. 필라델피아 반도체 지수는 전 거래일보다 12.70(0.33%) 내린 3834.43에 장을...
3067,2021.11.24.,"美 뉴욕증시, 국채 금리 급등에 지수별 혼조세 마감",한편 국제유가는 전날보다 상승했다. 뉴욕상업거래소(NYMEX)에서 12월물 서부텍사스산원유(WTI) 가격은 전거래일보다 2.3% 오른 배럴당 78.50달러에 장을 마감했다. 이날 바이든 미 대통령은 이날 성명을 통해...
3068,2021.11.25.,올해 경제성장률 4.0% 유지…소비자물가는 내년에도 2% 달할 전망,"소비자물가는 국제유가 등 원자재가격 상승세로 인한 공급측 요인에 이어 경기회복으로 수요측 물가상승 압력도 확대되면서 올해 2.3%, 내년에는 2.0%에 달할 것으로 예상된다. 한국은행은 25일 '경제전망'을 통해 올해..."
3069,2021.11.11.,광주은행 “환테크 편리하게 하세요”,세계 경기부진과 국제 유가 상승에 따른 인플레이션 우려가 커지면서 안전자산을 선호하는 움직임이 늘어남에 따라 재테크 수단으로 외화예금 또는 환율 상승으로 수익을 얻는 환테크에 관심을 보이는 고객들이 크게...
3070,2021.11.11.,올해 韓경제 성장률 4.0% '턱걸이'… 연내 추가 금리인상 반영,"국제유가를 비롯한 원자잿값 상승의 영향이 내년 중반 이후 점차 소멸할 거로 판단했다. 앞서 경제협력개발기구(OECD)는 9월 발표한 '중간 경제전망'에서 내년 물가상승률 전망치를 주요 20개국(G20)은 3.9%, 한국은 1.8%로..."
3071,2021.11.18.,"[올댓차이나] 중국, 비축석유 추가 방출 방침 확인...""美 요청에 호응""",이에 따라 시장에는 미국 정부가 개입하면서 당분가 유가가 오르지는 않는다는 관측에 투자자들이 서둘러 이익확정 매물을 출회하면서 국제유가가 10월7일 이래 최저가로 떨어졌다. 미국 기준유 서부 텍사스유(WTI)...
3072,2021.11.26.,기준금리 인상했지만 다른쪽선 ‘소비진작책’… 물가 잡기 ‘난항’,"특히, 물가에 결정적 영향을 미치는 국제유가나 원자재 가격은 국내에서 조정이 어려운 외생변수여서 한은의 통화정책만으로는 물가를 잡기 어려울 것이라는 분석이 나온다. 일각에서는 물가를 잡기 위해서는 최소..."
3073,2021.11.22.,울산 1030만배럴 규모 석유비축기지 준공,"박기영 산업부 차관은 이날 치사를 통해 ""최근 3년만에 국제유가가 최고치를 기록하는 등 에너지수급 불안정성이 증가하는 시기에 에너지 자원을 직접 비축할 수 있는 석유저장시설은 무엇보다 중요한 역할을 수행할..."
3074,2021.11.11.,"""물가상승 일시적"" vs ""당분간 지속 우려""...엇갈린 해석",물가에 가장 큰 영향을 미치는 국제유가가 내년 연평균 배럴당 70달러 안팎으로 올해와 비슷한 수준이 될 것으로 전망했습니다. KDI는 최근의 물가상승률을 일시적 현상으로 분석한 겁니다. 이 같은 전망은 물가 당국인...
3075,2021.11.11.,"[인플레 한파 몰려온다] ""당분간 고물가"" 25일 금리인상 예고한 한은","이주열 총재는 11일 오전 서울 중구 플라자호텔에서 열린 경제동향간담회 모두 발언을 통해 ""글로벌 공급 병목의 영향과 함께 국제 유가가 상승하고 수요측 물가 압력이 높아지면서 예상보다 높은 소비자물가 상승률이..."
3076,2021.11.24.,[증시전략] 금리 인상 우려에 美 기술주 ‘출렁’…투자의견 엇갈려,"가능성에 국제유가 상승 - 美 연준 의장 연임한 파월 ""인플레 잡는데 전력"" - 앞으로 4년 더 美통화정책 관장…물가·고용 관리 - 매파 전환·긴축 가속도 조짐…국채금리 급등·달러 강세 - 금리 빨리 올리면 경제 위축…두..."
3077,2021.11.25.,"뉴욕증시, FOMC 의사록 대기 속에 하락 출발",국제유가도 약세를 보였다. 1월물 서부텍사스산원유(WTI) 가격은 전장보다 0.27% 하락한 배럴당 78.29달러에 거래됐다. 1월물 브렌트유 가격은 0.34% 밀린 배럴당 82.03달러를 나타냈다. 뉴욕증시는 다음날인 25일...
3078,2021.11.22.,"일본 정부, 미국 요청에 비축유 방출 검토","일본 정부가 고공행진을 이어가는 국제 유가를 안정시키려는 미국의 요청에 따라 비축유 방출을 검토하고 있는 것으로 전해졌습니다. 일본 마이니치신문은 총리실 관계자의 말을 인용해, 일본 정부는 비축유 방출과 관련해..."
3079,2021.11.24.,<뉴욕마켓워치> 파월 재지명 소화…채권↓주식·달러 혼조,"바이든 행정부가 치솟는 유가를 억제하기 위해 전략비축유(SPR) 5천만 배럴을 방출하기로 했지만 국제유가는 2.3%나 되레 올랐다. 미국은 비축유 5천만 배럴을 방출하기로 했으며, 그 외 한국, 중국, 인도, 일본, 영국도..."
3080,2021.11.11.,"한국은행·KDI, 성장률·물가전망 닮은꼴…금리인상 놓고선 충돌",이 총재는 “글로벌 공급 병목 영향과 함께 국제유가가 상승하고 수요측 물가 압력이 높아지면서 우리나라 역시 예상보다 높은 물가 상승률이 당분간 지속될 것”이라고 밝혔다. 반면 KDI는 경기 회복세가 견고하지...
