,날짜,제목,요약
1955,2020.05.28.,"""2차 유행 피할수도"" 말 한마디에 뉴욕증시가 반응했다",그러나 미중간 충돌에 대한 우려로 국제유가는 급락했다. 이날 뉴욕상업거래소(NYMEX)에서 WTI(서부 텍사스산 원유) 7월 인도분은 전 거래일보다 배럴당 1.54달러(4.5%) 떨어진 32.81달러로 거래를 마쳤다. 런던 ICE...
1956,2020.06.02.,코로나19 충격 영향 강원지역 물가 하락세…신선식품 물가는 상승,국제유가 하락으로 공업 제품(-2.4%) 물가가 하락했고 코로나19 타격으로 수요가 줄면서 서비스 물가도 0.5% 오르는데 그쳤다.무상교육 확대로 공공부문 물가가 하락한 점도 영향이 컸다. 이를 두고 일각에서는 국제유가...
1957,2020.06.08.,해외건설 수주액 3월이후 고작 55억달러…코로나로 1월 한달 수주액도 안돼,해외 코로나 장기화 조짐과 국제유가 급등락이 맞물리면서 하반기에도 저조할 것이란 우려섞인 목소리가 나온다. 8일 해외건설협회 종합정보서비스에 따르면 올들어 지난 5월까지 누적 해외수주액은 148억2928만달러...
1958,2020.05.30.,휘발윳값 18주만에 반등…ℓ당 1258.6원,6원을 기록해 지난주보다 8.6원 올랐다. 업계 관계자는 국제 휘발윳값 상승으로 국내 기름 값도 상승할 것으로 내다봤다. 국제 유가는 국내 주유소 기름값에 약 2∼3주의 시차를 두고 반영된다.
1959,2020.06.02.,"김용범 ""미·중 갈등 심화···시장안정 철저히 대응""","5월 소비자물가 상승률이 8개월만에 마이너스로 전환한 것과 관련해서는 ""코로나19 확산에 따른 국제유가 급락이 휘발유 등 석유류 가격을 크게 하락시킨 데 주로 기인한다""며 ""여기에 무상교육·무상급식 확대 기조 아래..."
1960,2020.06.02.,"김용범 ""미·중 갈등 심화···시장안정 철저히 대응""","5월 소비자물가 상승률이 8개월만에 마이너스로 전환한 것과 관련해서는 ""코로나19 확산에 따른 국제유가 급락이 휘발유 등 석유류 가격을 크게 하락시킨 데 주로 기인한다""며 ""여기에 무상교육·무상급식 확대 기조 아래..."
1961,2020.05.31.,"휘발유 가격 18주 만에 반등…""당분간 오를 듯""",국제 유가가 2~3주 시차를 두고 국내 주유소 가격에 반영되는 만큼 당분간 휘발유 가격 상승세는 계속될 전망이다. 국제 유가가 4월 넷째 주에 저점을 찍은 뒤 상승세를 이어가고 있기 때문이다. 두바이유 가격은...
1962,2020.06.05.,[뉴욕증시 마감] ECB 부양책에도 고용불안 속 혼조...다우 0.05%↑,국제유가는 감산 합의 연장 기대감 속에 오름세를 나타냈다. 시장은 OPEC+가 현재 이행 중인 하루 970만 배럴의 감산을 연장할 가능성을 주목하고 있다. 핵심 산유국인 사우디아라비아와 러시아는 하루 970만...
1963,2020.06.02.,코로나 영향 5월 물가 8개월만에 마이너스…디플레 판단은 아직 일러,"안형준 통계청 경제동향통계심의관은 ""마이너스 물가의 가장 큰 원인은 국제유가 인하로 인한 석유류 가격 둔화다""면서 ""교육 분야 정책지원에 따라 고교 납입금, 유치원 납입금이 낮아지는 등 공공서비스 가격..."
1964,2020.06.01.,"OPEC+, 원유 감산 연장 회의 개최 서두루는 이유는?",원유 감산 및 주요 국가의 경제 활동 재개로 국제유가는 지난 5월 한 달간 90% 가까이 상승했다. 미국 서부텍사스산원유(WTI)는 4월 평균 배럴당 16.70달러에서 5월 평균 28.53로 급등했다. 해당 기간 유럽거래소...
1965,2020.06.04.,中 원유 수요 코로나 이전 90%까지 회복…'원유 수요 회복세',원유 수요가 회복세를 보임에 따라 국제 유가는 상승세를 이었다. 산유국 감산과 함께 각국이 속속 경제 봉쇄정책을 해제하고 있어 유가 상승 속도는 빨라질 수 있다는 관측도 나온다. 3일(현지시간) 시장조사업체...
1966,2020.06.02.,정제마진 11주째 마이너스…하반기부터 반등할 듯,"미레에셋증권도 ""서부텍사스산원유(WTI) 가격은 배럴당 40달러 수준으로 전망된다""며 ""국제유가가 상승세를 이어가기 위해서는 수요 회복이 중요하고, 하반기 중 공급과 수요의 균형을 회복할 것""이라고 예상했다. 다만..."
1967,2020.06.02.,[위대한 생각]①석유는 어떻게 세상을 움직였는가,"그는 “당시 세계는 처음으로 일상에서 매일 같이 접하던 석유가 어느 순간 사라질 수 있다는 두려움을 느꼈다”라면서 “이후 유가는 이란 미국 대사관 인질 사건, 이라크 전쟁 등 국제 정치 역학 관계에 따라 폭등과..."
1968,2020.06.02.,코로나19로 지갑 닫혔다… 소비자물가 상승률 '마이너스',코로나19에 따른 소비 둔화와 국제유가 하락이 겹치며 소비자물가가 하락 전환했다. 2일 통계청이 발표한 소비자물가 동향에 따르면 지난 5월 소비자물가지수는 지난해 같은 달 대비 0.3% 하락했다. 사진은 이날...
1969,2020.06.01.,"수출, 2개월 연속 20%대 급감","국제유가가 크게 떨어지면서 석유제품(-69.9.%)과 석유화학(-34.3%)이 높은 감소율을 기록했다. 반면, 코로나19로 비대면 산업 수요가 급증하면서 반도체(7.1%)와 컴퓨터(82.7%) 수출이 늘었다. 또 진단키트와 손소독제..."
1970,2020.06.02.,"기재부차관 “미·중 갈등, 금융시장 변동성 확대 가능성...상황 주시할 것”",그는 “소비자물가가 마이너스로 전환된 것은 코로나19 확산에 따른 국제유가 급락이 휘발유 등 석유류 가격을 크게 하락시키면서 소비자물가를 0.8%p 하락시킨데 주로 기인했다”라며 “봉쇄조치에 따른 경제활동 위축과...
1971,2020.06.05.,"GS칼텍스, 탄탄한 재무 기반 정유업계 신용 조정 '칼바람' 피했다","뉴데일리 성재용 기자 = 지난해 말부터 이어진 정제마진 하락에다 올 들어 신종 코로나바이러스 감염증(코로나19), 국제유가 급락 등 여파로 정유업계가 가라앉았다. 신용평가사들도 정유사들의 신용등급 전망을..."
1972,2020.05.21.,예상 깬 美 원유재고 감소…WTI 4.8% 급등,사진=AFP[뉴욕=이데일리 이준기 특파원] 국제유가는 20일(현지시간) 급등했다. 이날 뉴욕상업거래소(NYMEX)에서 7월 인도분 서부 텍사스산 원유(WTI)는 배럴당 4.8%(1.53달러) 뛴 33.49달러에 장을 마감했다. 런던 ICE...
1973,2020.06.05.,"LG화학 목표주가 높아져, 전지와 석유화학 실적 2분기 모두 좋아","황 연구원은 ""최근 국제유가의 급락과 원재료 나프타의 가격 하락 영향으로 LG화학 석유화학제품의 원가가 절감됐다""며 ""LG화학의 주력제품인 ABS(가전, 휴대폰용 플라스틱)의 업황도 중국의 이륜차 안전 강화정책..."
1974,2020.06.02.,“카타르 대규모 LNG선 수주에 조선株 주가 뛸 것”,그러면서 “최근 국제 유가 급등과 카타르 LNG 물량 확보 소식을 통해 조선 업종 주가가 코로나 이전 수준까지 회복 추세를 이어갈 전망”이라고 내다봤다. 전날 현대중공업지주 주가는 전 거래일 종가 대비 3.88...
1975,2020.05.23.,하락세 멈춘 기름값…서울 등 일부 지역 조금 올라,국제유가 폭락 영향으로 하락했던 국내 기름값이 국제유가가 회복하면서 하락세가 꺾였습니다. 다시 상승세를 탈 것으로 보입니다. 한국석유공사 유가정보서비스 오피넷에 따르면 이달 셋째 주 전국 주유소 주간...
1976,2020.06.08.,"[더벨][정유업 리포트]'장수 재무통' 집결한 에쓰오일, 위기관리 능력은",국제 유가가 급락하면서 기존 비싸게 샀던 원유 가치가 떨어져 재고평가손실을 대규모로 떠안았다. 에쓰오일도 영업손실 1조1899억원 가운데 재고평가손실 규모만 7200억원에 달했다. 1분기 실적 발표 IR에서...
1977,2020.06.02.,‘물가 너마저’…커지는 D의 공포,"안형준 통계청 경제동향통계심의관은 ""(국제유가는)통상 4주 정도 시차를 두고 우리나라에 반영된다고 보고 있다""며 ""다음 달 반등할 것""이라고 예상했다. 정부 정책도 소비자물가지수 감소를 부추기는데 한몫했다...."
1978,2020.06.04.,조선 빅3 주가 연일 상승세,"이어 그는 ""최근 국제 유가 급등과 카타르 LNG 물량 확보 소식을 통해 조선 업종 주가가 코로나 이전 수준까지 회복 추세를 이어갈 전망""이라고 밝혔다. 이번 협약의 규모와 상징성에 비해 단기 주가와 실적에 미치는..."
1979,2020.06.02.,"5월 소비자물가 8개월만에 '마이너스'…""디플레이션은 아니다""","특히 코로나19 사태로 인한 국제유가 하락으로 국내 석유류 가격이 18.7%나 급락했고, 고교무상교육 시행 등으로 인한 공공서비스 물가 하락(-1.9%)도 영향을 미친 것으로 보인다. 반면 일반 가정의 외부활동 감소로 농·축..."
1980,2020.06.02.,"뉴욕증시, 美시위 격화에도 경제 재개 기대에 혼조 출발","유럽 주요국 증시는 강세다. 범유럽지수인 Stoxx 600지수는 1.41% 올랐다. 국제유가는 상승했다. 7월물 서부텍사스산 원유(WTI) 가격은 전 거래일보다 1.55% 오른 35.99달러에, 브렌트유는 1.88% 상승한 39.04달러에 움직였다."
1981,2020.06.05.,"울산항, 4월 컨테이너 물동량 4만TEU…6%↓",국제유가 하락에 액체화물 증가 울산항만공사(UPA)는 울산항 4월 컨테이너 물동량이 전년 동기 대비 5.9% 감소한 4만1800TEU를 기록했다고 3일 밝혔다. 부문별로 수입은 2만300TEU(-0.9%) 수출은 2만900TEU(-10.8...
1982,2020.05.27.,"""소고기 사먹었지""…재난지원금이 5월 내수 살렸다",국제유가 하락으로 유류비가 줄어든 것도 영향을 줬다. 도소매업은 재난지원금 지급 영향을 받았다. 다음달 비제조업 업황전망BSI는 전월대비 6포인트 올랐다. 반면 제조업 업황BSI는 전월대비 3포인트 하락한 49을...
1983,2020.06.04.,"미 증시, 고용 등 지표 호조에 급등…다우 2.05%↑",국제유가는 이틀째 상승했다. 뉴욕상업거래소(NYMEX)에서 7월 인도분 서부 텍사스산 원유(WTI)는 배럴당 1.3%(0.48달러) 상승한 37.29달러에 거래를 마쳤다. 런던 ICE 선물거래소의 8월물 브렌트유도 오후 3시30분 현재...
1984,2020.06.01.,6월 LPG 공급가격 kg당 55원 인상,국제유가가 한달만에 47% 급등한 탓이다. E1은 국제 LPG가격 상승 및 가격 미인상분 누적 등에 따라 6월 국내 LPG 공급 가격을 kg당 55원 인상한다고 1일밝혔다. 이에 따라 E1의 가정·상업용 프로판 가격은 5월 692....
1985,2020.06.08.,"한화토탈, 7월 인도분 납사 프리미엄 2배 껑충…LG·롯데 수요 증가",석유화학사들은 국제유가 하락으로 납사 가격이 폭락하자 구매를 늘린 것으로 보인다. 가격이 저점일 때 납사를 확보해 원료비를 절감하겠다는 전략이다. 석유화학 공정의 가장 기초 원료인 납사는 원유에서...
1986,2020.06.06.,"[글로벌-Biz 24]국제유가, 美 고용 호조·감산 연장 기대에 5%대 급등",WTI 5.7%↑ 브렌트유 5.8%↑...OPEC 주말 감산 연장 합의할 듯 국제유가가 5일(현지시각) 5%대의 상승률을 보였다. 미국 고용지표가 호조를 보이면서 미국 경제의 'V'자 회복에 따른 원유수요 증가에 대한 기대감을 키웠고...
1987,2020.06.05.,"브라질 증시·헤알화 '반등'...전문가들 ""정치·경제 불확실성 여전""",이 같은 변화는 선진국을 중심으로 한 경제활동 재개 움직임과 국제유가 반등 등이 호재로 작용한 것으로 풀이된다. 선진국을 중심으로 경제 재개에 대간 기대감이 높아지는 가운데 유가 반등으로 자국 내 경제 및...
1988,2020.06.05.,5일 1284 휘발윳값 상승세 기록,"국내 휘발유 가격이 국제 유가와 유류세 효과 등으로 가격 상승세를 보였다. 한국석유공사 유가 정보 서비스인 '오피넷' 에 따르면, 이달 5일 보통 휘발윳값은 +2.50원 리터당 1284.73원으로 집계됐다. 지역별로는..."
1989,2020.05.26.,"채권시장 전문가 79% ""5월 금통위서 기준금리 동결 예상""",국제유가 급락의 여파로 물가 하방압력이 지속되고 있지만 코로나19 확산으로 인한 소비자 체감물가가 여전히 높은 것으로 나타났다. 응답자의 26.0%가 물가 하락에 응답해 전월(40.0%) 대비 14%포인트 줄었고 물가...
1990,2020.05.28.,"[전문] 이주열 한은 총재, 기자간담회 모두발언·일문일답","금년중 소비자물가 상승률은 국제유가 하락, 수요측 압력 둔화로 2월 전망치 상당폭 밑도는 0.3%로 예상하고 있다. 오늘 금통위는 코로나 19전세계적 확산으로 그 영향이 보다 장기화될것으로 예상됨에 따라 물가상승률이..."
1991,2020.06.02.,"울산, 5월 소비자물가 0.4% ↓… 디플레이션 우려","국제유가 하락으로 석유류 가격이 큰 폭으로 떨어진 영향이 가장 컸으며, 공공서비스 물가가 내린 점도 일부 영향을 미쳤다. 지난달 공업제품은 1년 전보다 2.0% 하락했다. 특히 석유류 가격이 국제유가 하락의..."
1992,2020.06.02.,코로나발 '스태그디플레이션'오나…물가하락·경기침체 동시에,"김용범 기획재정부 1차관도 이날 ""5월 소비자물가가 마이너스로 전환된 것은 코로나19 확산에 따른 국제유가 급락이 휘발유 등 석유류 가격을 크게 하락시킨데 주로 기인했다""며 ""봉쇄조치에 따른 경제활동 위축과..."
1993,2020.05.23.,"4개월간 추락한 휘발유값 바닥 찍었다…""이제는 상승뿐""",보통 국제유가의 변동이 국내 소비자가격에 반영되기까지 2~3주의 시차가 있다는 점을 고려하면 이제부턴 휘발유값이 오를 수밖에 없다는 관측이다. 지역별로 보면 최고가 지역인 서울의 휘발유 가격은 전주 대비...
1994,2020.06.04.,"[오늘의 글로벌마켓] 뉴욕증시, 예상보다 양호한 美 경제지표에 힘입어 크게 ...",국제유가가 이틀째 상승했다. 뉴욕상업거래소(NYMEX)에서 7월 인도분 서부 텍사스산 원유(WTI)는 배럴당 0.48 달러(1.3%) 상승한 37.29달러에 거래를 마쳤다. 국제금값은 하락했다. 뉴욕상품거래소에서 8월 인도분 금은...
1995,2020.06.04.,美 증시 상승…고용 호조에 경기 회복 기대 [글로벌 마감시황],"[국제유가] WTI는 사우디아라비아와 러시아가 하루 970만 배럴의 감산을 7월말까지 한달 더 연장하기로 합의했다는 소식에 상승했습니다. WTI는 1.3% 상승한 37.29달러에, 브렌트유는 0.2% 떨어진 39.50달러에..."
1996,2020.06.04.,제주 배춧값 ‘고공행진’…작년 생산량 감소 원인,"특히 국제유가의 하락으로 휘발유, 경유 등 공업제품의 가격이 내려가면서 제주지역 전체 소비자물가 하락세가 2개월째 이어지고 있는 반면 배춧값 상승세는 꾸준히 유지되고 있다. 이 같은 가격 상승세는 지난해..."
1997,2020.05.21.,생산자물가 석달연속 내리막…이달 소비자물가도 마이너스?,국제유가 폭락과 신종 코로나바이러스 감염증(코로나19) 충격으로 수요가 위축된 결과다. 한국은행이 21일 발표한 4월 생산자물가지수는 102.08(2015년 100 기준)로 전월 대비 0.7% 하락했다. 전년 동월과 비교해서는 1.5...
1998,2020.06.02.,"사우디-러시아, 석유 감산 9월까지 연장 의견 접근",지난 4월 한때 마이너스까지 추락한 국제유가는 감산합의 이행 등으로 5월에만 90% 급등해 30달러 선을 유지하고 있다. 1일(현지시간) 뉴욕상업거래소(NYMEX)의 미국 서부텍사스산원유(WTI)는 전일 대비 배럴당 0.05달러...
1999,2020.06.02.,"5월 소비자물가 0.3% 하락···""유가 하락 영향""","통계청은 ""소비자물가 하락의 가장 큰 원인은 국제유가 하락에 따른 석유류 가격 급락이었고 교육분야 정책 지원으로 공공서비스 가격이 하락한 점도 영향을 미쳤다""고 설명했습니다."
2000,2020.06.03.,"지금 '플랜 B'가 필요한 이유…""수출 무너지면 기댈 곳 없다""",또한 국제유가 급락까지 겹쳐 석유제품은 무려 –63.0%나 감소했고 석유화학도 –34.0%의 감소세를 나타냈다. 다만 최대 수출 대상국인 중국에서 코로나19 사태가 조기에 종식되고 경제활동이 재개되면서 대중 수출은...
2001,2020.05.26.,4월 수출물량 금융위기 이후 최대폭 감소,"수입금액지수는 국제유가 하락 영향으로 광산품, 석탄및석유제품 등이 감소해 15.5% 하락했다. 지난달 무역수지는 99개월만에 적자로 전환됐다. 한 단위 수출대금으로 수입할 수 있는 상품의 양을 뜻하는..."
2002,2020.05.26.,코로나19에 지난달 수출물량 12.6% 감소…11년만 최대폭,다만 국제유가가 급락한 영향으로 수입금액이 수출금액보다 더 크게 줄면서 교역조건은 29개월만에 개선됐다. 한국은행이 26일 발표한 ‘2020년 4월 무역지수 및 교역조건’에 따르면 지난달 수출물량지수는 99....
2003,2020.06.02.,'코로나19' 충격에 1분기 성장률 -1.3%…1인당 국민소득 10년만에 최대 감소,"우리나라 GDP 디플레이터 상승률에 영향을 미치는 주요 요인은 국제유가, 반도체 가격, 환율, 총수요 압력 등이다. 2분기 실질 GDP 성장률(전분기 대비)은 -2%대 초반 정도로 예상됐다. 박양수 한은 경제통계국장은..."
2004,2020.05.29.,"[생생경제] 주식, 곡소리나는 조정은 없을 것, 홍춘욱, 황세운의 주식 시장 전...",소비가 주니까 수입이 줄어서 요새 국제 유가 폭락해가지고 수입이 준 게 크고요. 그 다음으로 우리가 봐도 되는 게 정부 쪽에서 지출이 3차 추경에 대한 기대들도 있고 그러면서 여기서 마중물을 해가지고 경제를...
2005,2020.05.21.,[유럽증시] 미국 등 주요국 경기회복 기대감에 상승,파월 미국 연방준비제도(Fed·연준) 의장과 스티븐 므누신 미국 재무장관은 전날 상원에서 적극적인 부양 방침을 밝혔다. 실제 경제 재개 이후 수요가 회복될 것으로 기대되면서 국제유가 역시 강세를 보이고 있다.
2006,2020.05.28.,"[전문] 한은 금통위 통화정책방향...""마이너스 성장""","소비자물가 상승률은 국제유가 하락 영향, 수요측면에서의 상승압력 약화 등으로 금년중 0%대 초반을, 근원인플레이션율은 0%대 중반을 나타낼 것으로 예상된다. □금융시장에서는 국제금융시장 안정, 적극적인..."
2007,2020.05.23.,다우지수 0.04% 하락…미·중 악재 덮은 '백신 소식',"한편, 국제유가는 하락 반전했다. 이날 뉴욕상업거래소(NYMEX)에서 7월 인도분 서부 텍사스산 원유(WTI)는 전날보다 배럴당 1.98%, 0.67달러 떨어진 33.25달러에 거래를 마쳤다. 런던 ICE 선물거래소의 7월물 브렌트유도..."
2008,2020.05.31.,"'승승장구' LG하우시스, 무슨 일 있길래?","전문가들은 국제 유가가 폭락한 덕분에 원가 경쟁력이 높아진 데다, 골칫덩이 자동차소재 사업 매각을 추진하고 있어 매수세가 몰리고 있다고 보고 있다. 견고한 실적을 바탕으로 여전히 추가 상승 여력이 충분하다는..."
2009,2020.06.02.,5월 소비자물가 0.3% 하락…8개월 만에 마이너스 전환,이는 국제유가 하락에 따른 석유류 가격 급락과 더불어 공공서비스 물가가 떨어진데 주로 기인한다. 통계청이 2일 발표한 '2020년 5월 소비자물가 동향'에 따르면 5월 소비자물가지수는 104.71(2015년=100)으로 1년...
2010,2020.06.08.,"수은, 하반기 6년 만에 감사…'회수 불능' 美셰일가스 대출 발목",하지만 신종 코로나바이러스 감염증(코로나19) 확산과 국제유가 하락 등에 따라 광권 가치가 추락해 매각도 쉽지 않은 상태다. 미국 셰일가스 프로젝트 대출 건이 수습되지 않은 채 수은의 발목을 잡고 있어 수은에게...
2011,2020.05.28.,[모닝브리핑] 다우 또 2.21% ↑…중국 홍콩보안법 표결 강행,"◇ 국제유가, 미·중 갈등에 급락…WTI 4.5%↓ 급등세를 이어간 뉴욕증시와는 달리 간밤 국제유가는 4% 넘게 하락했습니다. 뉴욕상업거래소(NYMEX)에서 7월 인도분 서부 텍사스산 원유(WTI)는 전날보다 배럴당 4.5% 급락한 32...."
2012,2020.06.02.,소비자물가 상승률 결국 마이너스…8개월만에 -0.3%,물가 상승률 마이너스 전환은 코로나19 확산으로 수요측 물가압력이 약화된 가운데 국제유가 급락이 큰 폭의 물가하락요인으로 작용하고 복지정책 확대 등으로 정부정책 측면의 물가하방압력이 증대된 데 주로...
2013,2020.06.03.,'코로나19' 여파로 5월 소비자물가 0.3%↓...8개월 만에 다시 '마이너스',"국제유가 하락에 따라 석유 가격이 큰 폭으로 하락한 영향이 가장 큰 것으로 풀이되며, 고교 무상교육 실시 등으로 인해 공공서비스의 물가가 내린 점도 영향을 미친 것으로 보인다. 특히 최근에는 코로나19의 여파가..."
2014,2020.06.04.,[이슈 후벼파기] 경기는 바닥이라는데...주식은 '지붕 뚫고 하이킥' 어디까지...,"미·중 무역 갈등, 미국 내 인종 차별 격화, 국제 유가 향배 등에 따라 증시 변동성이 확대될 수 있다는 겁니다. 그런데 이런 분석은 '밥 먹으면 배부르다'는 말에 비견될 만큼 변별력이 없는 분석이지요. 그럼, 어떻게..."
2015,2020.06.01.,5월 수출 24% 하락…두 달째 20% 감소,국제유가 하락 등 여파로 수입도 크게 줄면서 무역수지는 한 달 만에 흑자로 돌아섰다. 산업통상자원부는 5월 수출이 지난해 5월보다 23.7% 급감한 348억6천만달러를 기록했다고 1일 발표했다. 4월의 수출 감소폭(25.1...
2016,2020.05.30.,"정부, 오는 1일 하반기 경제정책방향·3차 추경안 공개","외출을 자제하다 보니 외식수요가 줄어서 외식물가 상승률이 낮았고, 국제유가 하락으로 석유류 가격이 크게 하락한 점과 고교 무상교육으로 공공서비스 물가가 하락한 점이 낮은 물가상승률의 주요 원인이라고..."
2017,2020.06.02.,팬데믹 충격에 5월 소비자물가 –0.3%...8개월만에 하락,특히 국제유가 급락에 따른 석유류가격이 소비자물가를 –0.82%포인트(P) 하락시켰다. 소비자 물가지수 하락은 코로나19 팬데믹 이후 저유가와 사회적 거리두기 등의 영향으로 분석된다. 국제 유가가 지난해 배럴당 50...
2018,2020.06.02.,5월 소비자물가 상승률 '-0.3%'...코로나19 유가급락에 '8개월만에 마이너스 ...,"특히 석유류 가격은 국제유가 하락의 영향으로 전년 동월 대비 18.7% 급락했다. 휘발유가 17.2%, 경유가 23.0%, 자동차용 LPG가 14.4%, 등유가 16.3% 각각 하락했다. 전기·수도·가스는 1.3% 올랐다. 도시가스가 3.6..."
2019,2020.06.03.,"코스피 2,150선 육박…거래대금 사상 최고","7% 하락했다. 한편, 원화는 하루 만에 강세를 보였다. -8.6원, -0.7% 내린 1,216.8원으로 장을 마쳤다. 국제유가(WTI)는 OPEC+ 감산 연장합의 기대에 하루 만에 상승했다. +3.9% 상승한 36.81달러를 보였다."
2020,2020.05.30.,하반기 경제정책방향·3차 추경 베일 벗는다…소비자물가도 주목,"외출을 자제하다 보니 외식수요가 줄어서 외식물가 상승률이 낮았고, 국제유가 하락으로 석유류 가격이 크게 하락한 점과 고교 무상교육으로 공공서비스 물가가 하락한 점이 낮은 물가상승률의 주요 원인이라고..."
2021,2020.06.02.,저금리에 눈길끄는 하이일드채…펀드에도 자금유입,"위기 회복 구간에 높은 수익을 달성하는 하이일드채권 특성상 향후 주요 선진국 경제활동 재개, 국제유가 회복 기대 등으로 인해 수익률이 더 상승할 가능성이 있다. 하이일드펀드는 BBB 등급 이하 채권에 투자하는..."
2022,2020.06.02.,"올해 1분기 성장률 -1.3%, 속보치보다 0.1%P 상승","수입물가 디플레이터는 작년동기대비 2.4% 올랐고, 내수 디플레이터도 1.7% 상승했습니다. 우리나라 GDP 디플레이터 상승률에 영향을 미치는 주요 요인은 국제유가, 반도체 가격, 환율, 총수요압력 등입니다."
2023,2020.06.05.,"대한항공, 신용등급 'BBB+' 지켰다...등급전망은 '부정적' 부여","다만 코로나19가 여전히 활개 치는 상황에서 국제유가 상승세, 한진인터내셔널의 7300억원 규모의 차입금 관련 우발채무부담 등을 감안해 등급전망은 부정적으로 결정했다고 밝혔다. 대한항공이 안심할 단계는 아니다...."
