,날짜,제목,요약
1748,2019.07.15.,"7월2주 유연탄·우라늄·니켈 ↑, 철광석 등 ↓",국제유가 상승 및 탄소 배출 저감을 위한 메이저 BHP Billiton사의 사업 매각계획 시사로 공급 이슈에 따른 상승압력이 발생했다. 우라늄은 파운드당 24.85달러로 전주대비 1.3% 상승하면서 20달러 중반대 박스권...
1749,2019.07.24.,미국·중국 대화재개... 원화환율·엔화환율 소폭 하락,"국제유가는 미국 석유비축량 감소 등의 영향으로 아시아시장에서 상승세를 이어갔다. 브렌트유는 배럴당 64.07 달러로 0.38% 올랐고, 미국산원유는 57.11 달러로 0.60% 상승했다. 로이터에 따르면, 미국석유협회(API)..."
1750,2019.07.24.,미국·중국 대화재개... 원화환율·엔화환율 소폭 하락,"국제유가는 미국 석유비축량 감소 등의 영향으로 아시아시장에서 상승세를 이어갔다. 브렌트유는 배럴당 64.07 달러로 0.38% 올랐고, 미국산원유는 57.11 달러로 0.60% 상승했다. 로이터에 따르면, 미국석유협회(API)..."
1751,2019.07.11.,"미 뉴욕증시, 금리인하 기대감으로 상승",국제유가는 급등했다. 허리케인의 북상으로 멕시코만 유전들의 생산이 중단됐다는 소식 때문이다. 이날 뉴욕상업거래소(NYMEX)에서 8월 인도분 서부텍사스산원유(WTI)는 전 거래일 대비 배럴당 2.60달러(4.5%) 뛴 60....
1752,2019.07.25.,[증시브리핑] 나스닥·S&P500 최고치 경신…호실적 기업따라 순풍,"◇ 국제유가 국제유가는 오늘 오랜만에 하락세를 기록했습니다. 글로벌 경제 부진에 따른 원유 수요 하락 전망도 영향을 미쳤지만, 사우디아라비아와 쿠웨이트가 공동 운영 중인 유전지대에서 원유 생산을 재개하는..."
1753,2019.07.14.,"기준금리 인하 카드 만지작... 이르면 7월, 한은 결단 코앞",국제유가 약세 등을 감안해 한은이 소비자물가상승률 전망치를 0%대로 낮출 것으로 보는 시각이 많다. 무엇보다 미국의 금리 인하가 제기 되면서 빠르면 7월에 이뤄질 수 있다는 게 전문가들의 공동된 의견이다....
1754,2019.07.14.,전국 휘발유 값 6주 연속 하락…가장 저렴한 곳은?,"6원에 휘발유를 판매했다. 가장 저렴한 알뜰주유소 휘발유 판매가격은 ℓ당 1466.1원이었다. 한국석유공사 관계자는 ""석유수출국기구(OPEC)의 6월 원유생산 감소 등으로 국제유가가 상승했다""고 설명했다."
1755,2019.07.16.,‘공장이 떠난 도시’ 울산 동구 ②개꿈,국제 유가가 오르면서 석유업체들의 해양플랜트(해저에 매장된 석유 등을 탐사·시추·생산하는 장비) 발주량이 늘자 2010년대 중반 해양(플랜트)사업부에서 일하던 정규직 대 하청 노동자 비율은 3 대 7을 넘나들었다....
1756,2019.07.18.,[자료] 한은 경제전망 요약,3%로 전망 ㅇ 금년중에는 수요측 물가 상승압력이 약화된 가운데 국제유가및 농축수산물 가격 등 공급측 요인과 정부정책 측면에서물가 하방압력이 증대됨에 따라 오름세가 크게 둔화될 전망 ㅇ 내년에는 공급측...
1757,2019.07.25.,"[뉴스워커_국회] 윤한홍 의원, ""에너지 가격이 올랐어도 탈원전 정책이 없었다...","한전 적자의 원인은 국제 유가 상승으로 인한 전력구입비 증가라는 정부와 한전의 주장과 달리, 원전 발전량을 문재인 정부 이전 수준으로 유지했다면, 국제유가 상승을 반영해도 한전은 흑자를 유지할 수..."
1758,2019.07.12.,내년 원유수요 감소 예측에…WTI 0.4%↓,국제유가는 11일(현지시간) 소폭 내렸다. 이날 뉴욕상업거래소(NYMEX)에서 8월 인도분 서부 텍사스산 원유(WTI)는 전날보다 배럴당 0.4%(0.23달러) 떨어진 60.20달러에 장을 마감했다. 런던 ICE 선물거래소의 9월물...
1759,2019.07.25.,"뉴욕증시, 실적 부진·IT 기업 조사 부담 하락 출발","국제유가는 소폭 올랐다. 9월물 서부텍사스산 원유(WTI) 가격은 전 거래일보다 0.26% 오른 56.92달러에, 브렌트유는 0.08% 상승한 63.88달러에 움직였다. 시카고상품거래소(CME) 페드워치에 따르면 연방기금(FF) 금리선물..."
1760,2019.07.19.,[글로벌스톡] 금융시장에서 경기침체 일으킬 위험요소는?,"국제유가의 흐름은? - 블룸버그, 셰일오일 생산량 주춤 - WTI, API 재고 보다 EIA 재고에 따른 움직임 - 美 경기 조정에 따른 원유재고↑ 가능성 - 원유 55~60달러 박스권 유지 전망 - 미국-이란 갈등 및 중동 변수 영향 생방송..."
1761,2019.07.16.,수출 부진에 기업 펀더멘털 약화…'日변수' 가장 큰 불확실성,"반도체 등 IT제품의 수요부진 및 가격하락, 중국 경제의 부진, 국제유가 하락 등이 수출 부진의 원인으로 꼽힌다. 수출이 감소하면서 코스피 상장사들의 2분기 영업이익 컨센서스는 34조1000억원으로 전년에 비해 38%나..."
1762,2019.07.11.,"[뉴욕증시] 금리 인하 신호 포착...나스닥, 사상 최고치 경신","금리 인하 신호...나스닥, 사상 최고치 경신 금리 인하 기대...S&P500 지수, 장중 3,000p 돌파 파월 ""6월 고용 전망 바꾸지 않아...물가 2% 유지"" [국제유가] 美 원유재고 급감·멕시코 태풍에 상승 골드만 ""미디어 업계..."
1763,2019.07.18.,"뉴욕증시, 실적 부진·무역 우려 하락 출발","국제유가는 혼재됐다. 8월물 서부텍사스산 원유(WTI) 가격은 전 거래일보다 0.09% 하락한 56.73달러에, 브렌트유는 0.03% 오른 63.68달러에 움직였다. 시카고상품거래소(CME) 페드워치에 따르면 연방기금(FF) 금리선물 시장은..."
1764,2019.07.14.,전국 휘발윳값 6주 연속 하락…서울·강원·제주 1천500원대,"한편 한국이 주로 수입하는 제품의 기준이 되는 두바이유는 배럴당 1.5달러 오른 64.0달러로 집계됐다. 한국석유공사는 ""석유수출국기구(OPEC)의 6월 원유생산 감소 등으로 국제유가가상승했다""고 설명했다."
1765,2019.07.23.,"""보리스 존슨 우려""... 원화환율·엔화환율 상승",2430 달러로 0.37% 하락했다. 국제유가는 중동지역 긴장지속으로 아시아시장에서 상승세를 이어갔다. 브렌트유는 배럴당 63.31 달러로 0.08% 올랐고 파운드가치는 56.32 달러로 0.18% 상승했다.
1766,2019.07.20.,7월 셋째주 전국 휘발유 가격 ℓ당 1천490.4원… 0.7원 내리며 하락세 주춤,"한국석유공사 관계자는 ""미국 석유제품 재고 증가와 미국 원유생산 감소 등의 상승·하락 요인이 겹쳐 국제 유가가 안정세를 보였다""고 설명했다. 한국이 주로 수입하는 제품의 기준이 되는 두바이유는 배럴당..."
1767,2019.07.20.,서민지갑 열릴까…생산자물가 5개월만에 뚝,6월 생산자물가지수 103.49 소비자물가지수와 시차 1개월 공산품·농산품 전월대비 하락 수산물 3개월 만에 상승 전환 6월 생산자물가가 국제유가 하락과 농산물 출하량 증가 등의 영향으로 5개월 만에 하락했다....
1768,2019.07.30.,[주요 광물가격 동향] 구리(동)·니켈 ‘상승’…유연탄·우라늄 등 4대 광종...,유연탄은 7월 4주차 국제 유가가 전주대비 1% 상승했음에도 불구하고 중국 Hebei 지역 주요항의 수입 제한 조치로 톤당 72.04달러로 전주 대비 2.3% 하락세를 보였다. 우라늄도 메이저인 리오틴토(Rio Tinto)...
1769,2019.07.19.,"코스피,美 연준 금리인하 기대 2090선 회복…환율 4.3원 하락",국제유가는 멕시코만 석유업체들이 허리케인 배리 여파로 일시 중단했던 원유생산을 다시 정상화함에 따라 급락했다. 이날 뉴욕상업거래소(NYMEX)에서 8월 인도분 서부 텍사스산 원유(WTI)는 전날보다 배럴당 2.6...
1770,2019.07.16.,"세계증시, 미국 지표와 어닝 기다리며 보합",상품시장에서 국제유가는 미국 멕시코만을 강타한 열대성 폭풍 ‘배리’에 따른 생산차질 여파가 단기에 그칠 것이라는 신호가 나와 보합을 유지하고 있다. 런던선물시장의 북해산 브렌트유 가격 16일 추이 [자료...
1771,2019.07.12.,6월 수출입물가 '모두 마이너스'…원/달러 환율 하락 영향,"국제유가는 6월 중순 후 반등하긴 했으나, 전달과 비교해서는 낮은 수준에 머무르며 수입물가 하락에 영향을 줬다. 6월 두바이유 평균가는 배럴당 61.78달러로 5월 평균가인 69.38달러에 비해 11.0% 하락했다. 원재료는..."
1772,2019.07.25.,"""S-Oil, 3분기 흑자전환...목표주가↑""-유안타증권","황 연구원은 ""3분기 매출액은 7조원, 영업이익 1893억원을 기록할 것""이라며 ""정제마진이 기존 배럴당 1달러에서 2.5달러로 오르고, 정기보수 비용 소멸에 따른 이익 개선 800억원, 국제유가 상승에 따른 재고효과..."
1773,2019.07.19.,"중소기업 수출, 중화권 시장에서 부진","3%) 등 아세안 수출 감소   * 월별 국제유가 (두바이유, $): (’19.1) 59.1 (2)64.6 (3)66.9 (4)70.9 (5)69.4 (6)61.8●계측제어분석기(6.5억달러, △8.7%): 對베트남(46.0%), 일본(45.7%) 수출의 급증에도 불구하고 중화권..."
1774,2019.07.25.,EIA 원유재고 1천84만 배럴 감소…WTI 상승폭 확대,원유 재고가 시장 예상보다 큰 폭 줄어들면서 국제유가는 상승 폭을 확대했다. 마켓워치에 따르면 서부텍사스원유(WTI)는 지표 발표 직후 배럴당 57.45달러에 거래됐다. 지표 발표 전에는 57.20달러에 거래됐다. jwoh...
1775,2019.07.12.,"뉴욕증시, 연준 완화 기대 지속 상승 출발","국제유가는 상승했다. 8월물 서부텍사스산 원유(WTI) 가격은 전 거래일보다 0.51% 상승한 60.74달러에, 브렌트유는 0.22% 오른 67.16달러에 움직였다. 시카고상품거래소(CME) 페드워치에 따르면 연방기금(FF) 금리선물..."
1776,2019.07.14.,"한국은행, 결단만 남은 금리인하… 이르면 7월 늦어도 8월 `시점 문제`","국제유가 약세 등을 감안해 한은이 소비자물가상승률 전망치를 0%대로 낮출 것으로 보는 시각이 많다. 신얼 SK증권 연구원은 ""10월 추가 수정경제전망 발표를 고려하면 이번에 한은이 성장률 전망치를 0.1~0.2%p 하향 조정할..."
1777,2019.07.26.,"[사설] 뻔한 비용조차 감추기 급급한 脫원전, 비겁하지 않은가",이는 국제유가 상승분까지 반영한 결과다. 이 경우 1조원대 순손실이 아니라 4751억원의 순이익이 가능했다는 분석이다. 그런데도 정부는 “적자는 연료비 상승이 주된 원인으로 ‘탈원전’과는 무관하다”는...
1778,2019.07.18.,"한은, 올해 성장률 전망 2.5→2.2%로 하향…""수출·투자 부진 반영""","국제유가 하락세 등에 영향을 받을 것이라는 분석에서다. 한은의 물가안정목표는 2%다. 이 총재는 ""수요 압력이 예상보다 미약하고 공급 요인과 정부정책 영향이 커진 점을 고려했다""고 물가 전망 하향 배경을..."
1779,2019.07.23.,[오늘의 인천 뉴스] 2019년 7월 23일(화),생산중단에 국제유가 상승 <알림> ▲50+ 액티브시니어 축제 ○접수마감:8월 2일(금) ○참가자격:전국 만 50~69세 공연동아리 ○응모방식:전자우편(lem222@naver.com) 접수 https://bit.ly/2YSReHn <인사...
1780,2019.07.23.,[오늘의 경기 뉴스] 2019년 7월 23일(화),생산중단에 국제유가 상승 <알림> ▲50+ 액티브시니어 축제 ○접수마감:8월 2일(금) ○참가자격:전국 만 50~69세 공연동아리 ○응모방식:전자우편(lem222@naver.com) 접수 https://bit.ly/2YSReHn...
1781,2019.07.22.,[뉴욕증시] ECB 통화정책 변수…美 금리인하 호재될까,국제유가는 이란과 서방과의 기대감으로 반등됐습니다. 마지막으로 이번주 주목하셔야할 주요 일정 알려드리겠습니다. ◇ 美 적극적 금리 인하 기대감 '주춤' 지난주 윌리엄스 뉴욕 연은 총재는 적극적인 금리 인하...
1782,2019.07.23.,"코스피, 외국인 매수 반도체주 탄력 장중 2100선 탈환…환율 하락세",국제유가는 이란을 둘러싼 지정학적 위기감이 커지면서 1% 이상 올랐다. 이날 뉴욕상업거래소(NYMEX)에서 8월 인도분 서부 텍사스산 원유(WTI)는 전 거래일보다 배럴당 1.1%(0.59달러) 상승한 56.22달러에 거래를...
1783,2019.07.25.,"[해외시황] 뉴욕, 반도체주 깜짝 실적에 S&P·나스닥 '사상 최고치'…유럽 '혼...",이런 가운데 국제유가는 최근 오름세를 이어온 탓에 조정 압력이 작용하면서 나흘 만에 하락했다. 이날 뉴욕상업거래소(NYMEX)에서 9월 인도분 서부텍사스산원유(WTI)는 전장보다 배럴당 1.56%(0.89달러) 내린 55....
1784,2019.07.23.,[뉴욕증시] 페이스북 등 실적발표 앞둔 대형 IT주 ‘강세’,"◇ 국제유가, 이란 정세 불안 주시하며 상승 국제유가는 오늘 상승세입니다. WIT 56달러 선에 마감됐습니다. 이란과 서방 간의 갈등으로 인한 지정학적 리스크는 여전합니다. 여기에 리비아 국영석유회사가 리비아의..."
1785,2019.07.17.,"트럼프, 미중 무역협상 부정적 발언 국내 증시 영향 미미-키움","이어 ""무역분쟁 이슈는 중국 정부에 이어 트럼프의 부정적인 발언을 감안할 때 장기화 우려가 높아질 수 있다""며 ""관련 이슈로 미 증시에서 마이크론을 비롯한 반도체 업종과 국제유가가 하락했기 때문""이라고 지적했다...."
1786,2019.07.14.,내우외환에… 정유업 2분기 실적 잔뜩 흐림,백영찬 KB증권 연구원은 “휘발유 가격 약세로 인한 정제마진의 하락과 5~6월 국제유가 하락에 따른 부정적 영향으로 2분기 실적이 하회할 것”이라고 전망했다. 다만 정제마진의 하락세는 올해 3분기부터 4분기까지 점차...
1787,2019.07.13.,전국 휘발유·경유 가격 6주연속 하락…서울·강원·제주 휘발윳값은 1500원대,"석유공사 관계자는 ""석유수출국기구(OPEC)의 월 원유생산 감소 및 미국 원유재고 감소 등의 영향으로 국제유가는 상승했지만, 세계 석유수요 감소 전망 등으로 상승폭을 제한됐다""고 밝혔다. 한편 우리나라가..."
1788,2019.07.18.,"한은, 올 경제성장률 2.2%로 하향 조정…""투자·수출 부진""","한은은 ""올해는 수요측 물가 상승압력이 약화된 가운데 국제유가 및 농축수산물 가격 등 공급측 요인과 정부정책 측면에서 물가 하방압력이 증대됨에 따라 오름세가 크게 둔화될 전망""이라고 설명했다. 이어..."
1789,2019.07.17.,LPG차 증가 위해 국내LPG가격 8월에도 인하(?),앞으로 국제유가의 움직임이 어떻게 등락되느냐도 주목 대상이 되고 있다. 열량 등을 고려한 국제유가에 대비 국제LPG가격이 80% 수준을 보이면서 예년에 비해 LPG가격이 낮은 상태이지만 반등하지 않는다면...
1790,2019.07.21.,21일 휘발유값 하락세... 평균 1490 원 대 형성,"국내 휘발유 가격이 국제 유가와 유류세 효과 등으로 가격 하락세를 보였다. 한국석유공사 유가 정보 서비스인 '오피넷' 에 따르면, 이달 21일 보통 휘발윳값은 -0.16원 떨어진 리터당 1490.33원으로 집계됐다...."
1791,2019.07.22.,"""연준, 0.5%p는 안 내려""... 원화환율·엔화환율 상승",2479 달러로 0.18% 하락했다. 국제유가는 이란의 영국유조선 억류 영향으로 아시아시장에서 큰 폭으로 올랐다. 브렌트유는 배럴당 63.86 달러로 2.23% 올랐고 미국산원유는 56.67 달러로 1.87% 상승했다.
1792,2019.07.29.,[주간전망대] 美 금리인하 기정사실화…파월 연준의장 발언 주목,"국제 유가의 경우, 2거래일 연속 강세를 이어가면서 지난 한 주 동안 0.8% 상승률을 기록했다. 이란과 미국의 대립은 격화되는 양상이지만, 유가 흐름이 예전처럼 즉각적으로 반영되지는 않는 모습이다. 이는..."
1793,2019.07.15.,7월 국제 유연탄가격 4.6%↑...철광석 0.9%↓,유연탄은 국제유가 상승과 탄소 배출 저감을 위한 메이저 BHP Billiton사의 사업 매각 계획 시사 등의 공급 이슈에 따른 상승압력이 발생한 것으로 분석되고 있다. 우라늄 가격은 파운드당 20달러 중반대인 24....
1794,2019.07.19.,"코스피, 外人·기관 '사자'에 2080선 터치","그는 다만 ""미군이 이란의 무인항공기를 '방어 조치'를 이유로 격추시키며 지정학적 리스크가 확대됐다는 점은 부담""이라며 ""이 영향이 국제유가의 변동성을 확대시킬 수 있기 때문""이라고 지적했다...."
1795,2019.07.18.,해외건설 수주 대폭 감소…2006년 이후 최저치,"한국건설산업연구원 손태홍 연구위원은 ""기대 이하의 실적에 반응하기보다는 향후 수주전략의 고도화와 경쟁력 강화에 집중해야 한다""며 ""정치 및 경제적 불확실성 확대, 국제 유가와 발주 규모 간 상관관계 약화 등..."
1796,2019.07.11.,‘보릿고개’ 해외 건설...사우디發 ‘잭팟’에 수주 기대감 반등,"중동 국가의 석유 기업들이 그간 국제유가 하락으로 약화된 원가 경쟁력을 강화하기 위해 석유화학 제품 생산을 확대하고 있다는 점도 실적 전망치를 높이는 이유다. 아랍에미리트(UAE)의 ADNOC, 쿠웨이트의 KPC..."
1797,2019.07.17.,"뉴욕증시, 기업 실적도 방향성 부재 약보합 출발","국제유가는 반등했다. 8월물 서부텍사스산 원유(WTI) 가격은 전 거래일보다 1.16% 오른 58.29달러에, 브렌트유는 1.40% 오른 65.25달러에 움직였다. 시카고상품거래소(CME) 페드워치에 따르면 연방기금(FF) 금리선물 시장은..."
1798,2019.07.13.,휘발유값 6월 이후 6주 연속 내려,반면 국제유가는 올랐다. 7월 둘째 주 두바이유 현물 가격은 배럴당 64.0불로 전 주 대비 1.5불 인상됐다. 이에 대해 석유공사는 OPEC의 6월 원유생산 감소 및 미국 원유재고 감소 영향 등으로 국제유가가 상승했는데...
1799,2019.07.15.,"S&P, 실적 둔화 경고...3대 지수 최고치 랠리 이어지나 [이번 주 뉴욕증시]","헬스케어↑o제약↓ 임페리얼 캐피탈 ""델타항공 목표주가 66달러로 상향"" [국제유가] 美 태풍 불안에도 수요 둔화 우려에 상승 <유럽증시> 전일 파월효과로 상승출발한 유럽 증시였는데요, 이날 발표된 유로존의 강한..."
1800,2019.07.16.,"[속보]뉴욕증시, 주요기업 실적발표 기대에 소폭 상승…다우 0.10%↑",업종별로는 국제유가 하락 영향으로 에너지가 0.93% 내렸다. 금융주는 0.53% 하락했다. 기술주는 0.30% 올랐다. 이날 발표된 경제지표는 양호했다. 뉴욕연방준비은행은 7월 엠파이어스테이트 지수가 전월의 마이너스...
1801,2019.07.19.,"코스피, 연준 기준금리 인하 기대 장중 2080선 회복… 환율 1170원대 등락",국제유가는 멕시코만 석유업체들이 허리케인 배리 여파로 일시 중단했던 원유생산을 다시 정상화함에 따라 급락했다. 이날 뉴욕상업거래소(NYMEX)에서 8월 인도분 서부 텍사스산 원유(WTI)는 전날보다 배럴당 2.6...
1802,2019.07.17.,'삼성의 또 다른 아픈 손' 삼성중공업의 미래 바라보는 엇갈린 시선,유승우 SK증권 연구원은 “엔스코와의 소송 건으로 1억 8000만 달러의 충당금 설정이 불가피해 당기순손실이 대폭 증가할 전망이며 국제유가 하락으로 드릴십 매각도 부진한 모습을 보이고 있다”며 “올해도...
1803,2019.07.18.,"미 뉴욕증시, 미중 무역전쟁 재개 우려로 하락 마감",국제유가는 미국의 휘발유 재고가 크게 늘었다는 소식에 크게 떨어졌다. 이날 뉴욕상업거래소(NYMEX)에서 8월 인도분 서부텍사스산원유(WTI)는 전 거래일 대비 배럴당 84센트(1.5%) 하락한 56.78달러에 거래를 마쳤다....
1804,2019.07.22.,"8월 국내 LPG가격, 하향 안정세 전망",한편 산유국과 수입사 간 페이서상으로 거래되는 8월 LPG수입가격은 톤당 10달러 가량 인상된 선에서 거래되고 있으나 최근 국제유가가 다소 인하되면서 수입가격도 하락세로 돌아설지 관심이...
1805,2019.07.12.,"세계증시, 경제지표 소화하며 보합",상품시장에서는 국제유가가 6주 만에 최고치 수준에 호가되며 주간 오름폭을 기록할 전망이다. 열대성 폭풍 ‘배리’가 북상하면서 멕시코만에서 주요 정유사들이 철수한 데다 이란을 둘러싼 중동 위기가 고조된...
1806,2019.07.13.,"뉴욕증시, 연준 부양책 기대 지속 상승 출발","국제유가는 혼재됐다. 8월물 서부텍사스산 원유(WTI) 가격은 전 거래일보다 0.18% 하락한 60.09달러에, 브렌트유는 0.3% 상승한 66.77달러에 움직였다. 시카고상품거래소(CME) 페드워치에 따르면 연방기금(FF) 금리선물..."
1807,2019.07.15.,"뉴욕증시, 2분기 실적 시즌 돌입 혼조 출발","국제유가는 상승했다. 8월물 서부텍사스산 원유(WTI) 가격은 전 거래일보다 0.68% 오른 60.62달러에, 브렌트유는 0.73% 상승한 67.21달러에 움직였다. 시카고상품거래소(CME) 페드워치에 따르면 연방기금(FF) 금리선물 시장은..."
1808,2019.07.12.,정제마진 배럴당 6달러로 반등… 정유사들 모처럼 ‘반색’,"석유수출국기구(OPEC)가 감산에 나서면서 국제유가가 연초 대비 40% 가까이 올라간 점은 재고평가 이익 등에 긍정적이었지만 정제마진 하락이 실적에 발목을 잡아왔다. 다만, IMO 2020 규제 효과가 2·4분기부터 선제적으로..."
1809,2019.07.20.,20일 휘발유값 하락세... 평균 1490 원 대 형성,"국내 휘발유 가격이 국제 유가와 유류세 효과 등으로 가격 하락세를 보였다. 한국석유공사 유가 정보 서비스인 '오피넷' 에 따르면, 이달 20일 보통 휘발윳값은 -0.20원 떨어진 리터당 1490.28원으로 집계됐다...."
1810,2019.07.12.,정제마진 배럴당 6달러로 반등… 정유사들 모처럼 ‘반색’,"석유수출국기구(OPEC)가 감산에 나서면서 국제유가가 연초 대비 40% 가까이 올라간 점은 재고평가 이익 등에 긍정적이었지만 정제마진 하락이 실적에 발목을 잡아왔다. 다만, IMO 2020 규제 효과가 2·4분기부터 선제적으로..."
1811,2019.07.20.,20일 휘발유값 하락세... 평균 1490 원 대 형성,"국내 휘발유 가격이 국제 유가와 유류세 효과 등으로 가격 하락세를 보였다. 한국석유공사 유가 정보 서비스인 '오피넷' 에 따르면, 이달 20일 보통 휘발윳값은 -0.20원 떨어진 리터당 1490.28원으로 집계됐다...."
1812,2019.07.22.,"S-OIL, 2분기 ‘적자경영’ 성적표…정유·석화 부진",국제유가 하락과 정제마진 약세 등으로 정유 부문이 영업손실을 낼 것으로 예상되기 때문이다. 석유화학부문도 정기보수 및 중국 내 공급량 증가 등으로 전년대비 수익이 급감할 것으로 예측된다. 반면 3분기부터는...
1813,2019.07.11.,"EU, 내년 유로존 성장률 전망 1.4%…3개월만에 또 낮춰","아울러 미국과 이란간 갈등 등 중동을 둘러싼 긴장이 고조되며 향후 국제유가가 상승할 수 있을 것으로 내다봤다. 피에르 모스코비치 경제담당 집행위원은 ""성장률이 전망대로 될 지는 '리스크'에 달렸다""고..."
1814,2019.07.12.,6월 수출입물가 5개월만에 동반하락…환율·유가하락 영향,"1%, 수입물가는 3.5% 하락해 지난 1월 이후 5개월 만에 하락세를 보였습니다. 한은은 ""반도체 가격 회복이 지연되는 가운데 국제유가가 약세를 보이면서 지난달 수출입 물가가 모두 하락한 것으로 보인다""고 설명했습니다."
1815,2019.07.19.,"삼성중공업, 해양설비와 쇄빙LNG운반선 수주해 목표달성 기대 품어",국제유가가 해양프로젝트의 채산성을 담보하는 60달러선을 안정적으로 넘어서지 못하고 있었기 때문이다. 그러나 최근 정제마진이 오름세를 보이고 있어 프로젝트 추진에 다시 속도가 붙은 것으로 파악된다. 7월...
1816,2019.07.18.,EIA 원유재고 312만 배럴 감소…WTI 상승폭 축소,"원유 재고가 시장 예상보다 다소 덜 줄어든 데다, 석유제품 재고는 큰 폭 증가하면서 국제유가는 상승폭을 줄였다. 마켓워치에 따르면 서부텍사스원유(WTI)는 지표 발표 직후 배럴당 57.74달러에 거래됐다. 지표..."
1817,2019.07.12.,[뉴욕마감]순풍에 돛 단 美 증시…다우 사상 첫 2만7000대 돌파,국제유가는 내년 원유 수요가 감소한다는 예상에 따라 소폭 내렸다. 이날 뉴욕상업거래소(NYMEX)에서 8월 인도분 서부 텍사스산 원유(WTI)는 전날보다 배럴당 0.4%(0.23달러) 떨어진 60.20달러에 거래를 마쳤다. 런던 ICE...
