,날짜,제목,요약
621,2021.08.10.,[뉴스새벽배송] 델타 변에 美증시 혼조세…크래프톤 상장,"국제유가, 코로나 봉쇄 강화에 2% 이상 하락 -9일(현지시간) 뉴욕상업거래소에서 9월물 서부텍사스산원유(WTI) 가격은 전거래일보다 1.80달러(2.64%) 하락한 배럴당 66.48달러에 거래를 마쳐. WTI 가격은 이날 장중 4.5%가량..."
622,2021.07.14.,"항공업계, 코로나 재확산·유가급등에 다시 '시계 제로'...LCC 자본잠식 우려...","신종 코로나바이러스 감염증(코로나19) 재확산으로 수도권 사회적 거리두기가 4단계로 강화됐고, 국제유가 상승으로 항공 연료 유류비 비중이 커졌기 때문이다. 대한항공이나 아시아나항공은 대형상공사는 화물 운임..."
623,2021.07.14.,"[또다시 인플레 논쟁] ②바이든플레이션, 길어야 1년...유가·임대료는 '장기...","다만 장기 변수로서 주택 임대료와 국제 유가가 흐름을 바꿀 수도 있다는 지적도 나온다. 13일(현지시간) 미국 노동부 산하 노동통계국(BLS)에 따르면, 6월 소비자물가지수(CPI)와 근원 CPI(가격 변동성이 큰 식료품과..."
624,2021.07.20.,"유럽증시 급락, 미국증시 장중 급락, 국제 유가 대폭락, 미국증시 에너지주 장...","국제 유가가 장중 대 폭락하고 뉴욕증시 에너지주들도 장중 곤두박질 치며 증시에 직격탄을 날렸다. 유럽 주요국 증권거래소에 따르면 이날 유럽금융중심지 영국 런던의 FTSE100 지수는 2.34%, 독일 DAX 지수는 2.62..."
625,2021.07.15.,[뉴욕-채권]10년금리 1.35%대로 급락…비둘기 파월 + 유가 3% 하락,"국제유가가 3% 가까이 급락한 점도 수익률 하락을 더 자극했다. 오후 4시 기준, 10년물 수익률은 전장 대비 6.4bp(1bp=0.01%p) 낮아진 1.352%를 기록했다. 금리정책 전망을 반영하는 2년물 수익률은 2.7bp 내린 0.225%에..."
626,2021.07.24.,"[1보] 국제유가, 상승...WTI 0.2%↑",이투데이=김나은 기자 | 국제유가는 23일(현지시간) 상승했다. 뉴욕상업거래소(NYMEX)에서 9월물 서부 텍사스산 원유(WTI)는 전 거래일 대비 0.16달러(0.2%) 오른 배럴당 72.07달러에 마감했다.
627,2021.08.10.,[유럽증시] 델타 변이 확산 경제 타격 우려에 하락,"이날 국제유가는 2% 이상 하락했다. 9월물 서부텍사스산원유(WTI) 가격은 전장보다 2.68% 하락한 배럴당 66.42달러에, 10월물 브렌트유 가격은 2.69% 떨어진 배럴당 68.80달러에 거래됐다. 크레이그 얼람 오안다 유럽..."
628,2021.08.10.,"‘인플레民國’에서 살아남기…수요·공급 복합 충격, 치솟는 밥상 물가",지난 7월 5일 석유수출국기구(OPEC)와 러시아 등 산유국 협의체인 ‘OPEC+’의 증산 합의 불발 소식에 국제유가는 큰 폭 뛰었다. 북해 브렌트유는 배럴당 77달러를 넘어 2018년 10월 이후 최고치다. 서부텍사스산원유(WTI)도 3년...
629,2021.08.09.,냉면 김밥 등 외식비도 껑충… 돼지열병 겹쳐 추석 물가 비상,국제 유가 상승 여파로 국내 기름값도 14주 연속 올랐다. 8월 첫째 주 전국 주유소의 휘발유 평균 판매가격은 전주보다 4.1원 오른 L당 1645.1원이었다. 서울 시내 곳곳에선 L당 2000원을 넘긴 주유소도 많다. 이 같은...
630,2021.07.14.,"[상보] 국제유가, 미국 재고 감소 기대감에 상승",러빙턴/AP뉴시스국제유가는 미국 원유 재고 감소 기대감이 변이 신종 코로나바이러스 감염증(코로나19) 불안감을 억누르면서 상승했다. 13일(현지시간) 뉴욕상업거래소(NYMEX)에서 8월물 서부 텍사스산 원유(WTI)는 전...
631,2021.07.13.,[국제유가]WTI 0.6% 하락…델타 변이 우려 + 달러화 강세,신종 코로나바이러스 감염증(코로나19) 델타 변이 확산에 따른 수요부진 우려가 유가를 압박했다. 달러화 강세도 유가 하락을 좀 더 부추겼다. 뉴욕상업거래소(NYMEX)에서 WTI 선물은 46센트(0.62%) 낮아진 배럴당 74....
632,2021.08.10.,"뉴욕증시, 델타 변이 확산 우려에 혼조세…모더나 17%↑ [출근전 꼭 글로벌브...",[국제유가] ■ 中 코로나 봉쇄 강화에 2.6% ↓ 뉴욕유가는 중국에서 코로나19가 확산하면서 봉쇄 조치가 강화되고 있다는 소식에 하락 압력을 받았다. 현지시간 9일 미 뉴욕상업거래소에서 9월물 서부텍사스산원유(WTI)...
633,2021.08.09.,"""가스값도 안 나와요""…LPG 급등에 식당·택시 '이중고'","LPG 값이 오른 건 일단 국제유가 때문입니다. LPG는 원유 정제 과정에서 만들어지는데, 1년 전 배럴당 40달러 선이던 중동산 두바이유가 최근 70달러 선까지 올랐습니다. 이러자 아시아 LPG 시장을 사실상 독점하고 있는..."
634,2021.07.14.,국제 유가 뛰었지만...미국증시 에너지 섹터는 하락,13일(미국시간) 국제 유가가 전일의 하락세를 뒤로하고 급반등했다. 블룸버그 집계에 따르면 이날 미국 동부시각 오후 4시 14분 기준 뉴욕상업거래소에서 8월물 미국서부텍사스산원유(WTI) 가격은 배럴당 75.35...
635,2021.08.09.,"""이젠 金겹살인가"" 서민물가 비상인데…돼지열병 '설상가상'","한 위원은 ""글로벌 농축수산물 가격, 국제유가 등의 흐름을 볼 때 소비자물가 상승세가 완만해질 수 있는 여지가 많지 않아 보인다""고 밝혔으며, 한은도 ""소비자물가지수를 구성하는 품목 중 가격이 오르는 품목이 점점..."
636,2021.08.10.,LPG 가격 7년 만에 최고치…택시업계·식당 등 '이중고',"LPG 값이 오른 건 일단 국제유가 때문입니다. LPG는 원유 정제 과정에서 만들어지는데, 1년 전 배럴당 40달러 선이던 중동산 두바이유가 최근 70달러 선까지 올랐습니다. 이러자 아시아 LPG 시장을 사실상 독점하고 있는..."
637,2021.08.10.,[뉴욕마감] 델타 변이 확산 우려 속 혼조 마감…다우 0.3%↓(종합),국제유가는 델타 변이가 경기회복의 발목을 잡아 세계 경제의 침체가 장기간 지속될 것이란 우려로 2% 이상 급락했다. 미국 서부텍사스유(WTI)는 전거래일보다 2.6% 급락한 배럴당 66.48달러를 기록했다. WTI는 장중 4.6...
638,2021.07.17.,장중 국제 유가 '강보합'...미국증시 에너지 섹터는 '장중 급락',16일(미국시간) 장중 국제 유가가 강보합 흐름을 보였지만 뉴욕증시 장중 에너지 섹터는 급락했다. 블룸버그 집계에 따르면 이날 미국 동부시각 오후 2시 33분 기준 뉴욕상업거래소에서 8월물...
639,2021.07.16.,"[오늘의 글로벌마켓] 뉴욕증시, 파월 '시장 달래기'에도 혼조...유가 2%↓",국제유가는 2% 하락했다. 이날 뉴욕상업거래소(NYMEX)에서 8월물 서부 텍사스산 원유(WTI) 가격은 전일대비 1.48달러(2%) 내린 배럴당 71.65달러에 거래를 마감했다. 갈등을 빚어오던 사우디아라비아와 아랍에미리트(UAE)가...
640,2021.08.07.,전국 휘발유 가격 14주 연속 올라…상승폭은 둔화,ℓ당 전국 평균 1천645원…국제유가는 하락 전국 주유소 휘발유 가격이 이번 주에도 상승세를 이어갔다. 5월 첫째 주부터 오르기 시작해 13주 연속 상승세다. 7일 한국석유공사 유가정보서비스 오피넷에 따르면...
641,2021.08.09.,석유 수요 회복에 아람코 2분기 순익 29조… 전년比 288% 급증,"작년 배럴당 10달러대까지 떨어졌던 국제유가는 최근 70달러 수준에서 거래되고 있다. 나세르는 “회복세는 계속될 것”이라며 “점점 더 많은 국가 경제가 문을 열면서, 연말에는 석유 수요가 9900만배럴로..."
642,2021.07.23.,"[1보] 국제유가, 상승…WTI 2.3%↑",이투데이= | 국제유가는 22일(현지시간) 상승했다. 뉴욕상업거래소(NYMEX)에서 9월물 서부 텍사스산 원유(WTI)는 전 거래일 대비 1.61달러(2.3%) 상승한 배럴당 71.91달러에 마감했다. 런던 ICE선물거래소의...
643,2021.07.20.,[채권-장전] 코로나 역습과 10bp 급락한 美금리..다우 2% 넘게 급락하고 유가...,"뉴욕 주식시장에선 경제 재개방 수혜주인 크루즈와 항공주 부진이 두드러졌으며, 국제유가는 8% 가까이 급추락했다. 미국과 중국 간 갈등 격화 우려도 위험자산으로부터의 도피 심리를 거들었다. 미국과 영국..."
644,2021.08.10.,델타변이·성장둔화 우려에 다우 0.3%↓ [데일리 국제금융시장],국제유가도 성장 둔화 우려에 하락했다. 이날 뉴욕상업거래소의 9월물 서부텍사스산원유(WTI) 가격은 전 거래일보다 1.80달러(2.64%) 하락한 배럴당 66.48달러에 거래를 마쳤다. #기자페이지를 구독하시면 미국...
645,2021.08.10.,"강원 휘발유 가격 1,653원…올해 최고가","올해 들어 휘발유 가격이 1,653원을 넘어선 것은 이번이 처음입니다. 석유공사는 코로나19 변이 바이러스 확산 등으로 국제유가가 하락세를 보이고 있어 국내 휘발유 가격이 조정을 받을 수 있다고 전망했습니다."
646,2021.08.10.,미국에서 7개월 동안에만 578조원이 몰린 투자처의 정체,◇ 델타 변이 충격 유가부터 국제 유가가 급락세를 보이고 있습니다. 9일 서부텍사스유는 한 때 4% 이상 떨어져 배럴당 65.15달러에 거래됐습니다. 5월 이후 최저치입니다. 유가는 지난주에 7% 이상 떨어지면서 작년 10월...
647,2021.08.10.,해외건설 종합안내서 ‘해외건설 완전정복’ 발간,해외건설 완전정복은 해외건설을 한눈에 볼 수 있는 역사를 포함하고 국제유가와 해외건설 수주와의 상관관계 등 해외건설의 특징을 초반에 다루면서 해외건설에 대한 이해를 높였다. 해외건설 완전정복은 11일부터...
648,2021.08.09.,"SK케미칼, 코폴리에스터-백신 사업 호조… 분기 최고 실적 또 갱신","하지만 국제유가 상승으로 인한 원료 가격 및 해상 수출 운임 상승으로 영업이익은 같은 기간 223억원에서 190억원으로 15% 줄어들었다. 라이프 사이언스 부문의 제약(Pharma) 사업 2분기 매출은 780억원, 영업이익은..."
649,2021.08.09.,코로나 악몽 떨친 정유업계...'빅4' 상반기 영업익 4조,"국제유가 변동성 확대로 정제마진이 뚜렷한 개선을 보이지 않은 상황에서 윤활유, 석유화학 등 비정유 부문을 중심으로 이익을 확대한 전략이 주효했다는 분석이다. 9일 관련 업계에 따르면 SK이노베이션, GS칼텍스..."
650,2021.07.20.,"국제 유가, 위험 회피·OPEC+ 증산에 5% 이상 하락",본 기사는 인포맥스 금융정보 단말기에서 2시간 더 빠른 23시 14분에 서비스된 기사입니다.
651,2021.07.12.,"[증시전략] 산유국 ‘눈치보기’ 지속…유가, 고공행진 이어지나","OPEC 플러스 합의 무산 이후 오락가락하던 국제유가 향방에도 관심이 집중됩니다. 여전히 OPEC+ 회의는 여전히 안갯속으로 불확실성을 키우고 있는데요? - 국제유가, 美 재고 감소·OPEC+ 불확실성에 급등 - UAE, 증산 할당량..."
652,2021.08.10.,이번 주 전력수요 마지막 고비…4분기 전기요금 인상 촉각,"올해부터 정부는 전기료에 연료비 연동제를 도입해 국제유가 등 연료비가 오르면 전기료도 따라 오르도록 했다. 지난해부터 연료 가격이 급등했지만, 산업부는 ‘신종 코로나바이러스 감염증(코로나19) 장기화와 높은..."
653,2021.08.08.,"폭염보다 무서운 LPG값 폭등…택시들 ""대기할 땐 에어컨 끈다""",통상 아람코는 국제유가와 연동해 LPG 가격을 책정한다. 1년 전 배럴당 40달러 선이던 중동산 두바이유는 이달 초 70달러 선까지 올랐다. 아람코는 지난해 8월 각각 t당 365달러와 345달러였던 프로판과 부탄 CP를...
654,2021.07.13.,"WSJ “국제유가-물가 상관관계, 선진국보다 신흥국에서 극명”",모건스탠리에 따르면 베럴당 75달러를 기준으로 하는 국제유가가 올해 세계 국내총생산(GDP)에서 차지하는 비중은 장기 평균치인 3.2%를 하회해 2.8%를 기록할 전망이다. 2005년 장기 평균치를 상회하는 수준으로 유가가...
655,2021.08.10.,델타 확산에 中수요 둔화···유가 2%대 하락,세계 2위 석유 소비국인 중국이 델타 변이 바이러스 확산으로 몸살을 앓으며 국제 유가가 3% 가까이 하락했다. 9일(현지 시간) 뉴욕상업거래소에서 9월물 서부텍사스산원유(WTI) 가격은 직전 거래일보다 2.64% 떨어진...
656,2021.07.22.,"[1보] 국제유가, 상승...WTI 4.6%↑",이투데이=김나은 기자 | 국제유가는 21일(현지시간) 상승했다. 이날 뉴욕상업거래소에서 9월물 서부텍사스산원유(WTI) 가격은 전 거래일 대비 3.10달러(4.6%) 오른 배럴당 70.30달러에 마감했다.
657,2021.07.15.,"파월 효과 · 국제 유가 폭락 속...미국증시 혼조, 에너지섹터 주가 곤두박질",국제 유가가 곤두박질 친 것은 악재로 작용했다. 뉴욕증권거래소에 따르면 이날 뉴욕증시 4대 지수 중 우량주 중심의 다우존스 지수는 3만4933.23으로 44.44포인트(0.13%) 상승했다. 대형주 중심의 S&P500 지수는 4374....
658,2021.07.20.,"델타변이 쇼크 · 유가 대폭락 속...미국증시 급락, 전 섹터 주가 하락, 에너...",게다가 주요 산유국이 8월 원유 증산에 합의하면서 국제 유가가 대폭락하고 이로 인해 에너지 섹터의 주가가 곤두박질 친 것도 증시에 타격을 가했다. 뉴욕증권거래소에 따르면 이날 뉴욕증시 4대 지수 중 우량주...
659,2021.08.10.,입문에서 활용까지 '해외건설 완전정복' 발간,"특히, 「해외건설 완전정복」은 해외건설을 한눈에 볼 수 있는 역사를 포함하고 국제유가와 해외건설 수주와의 상관관계 등 해외건설의 특징을 초반에 다루면서 해외건설에 대한 이해를 높였다. 무엇보다도 기획, 사업화..."
660,2021.08.10.,2021년 사우디아라비아 전력산업 정보,"계획 국제유가 고유가 시, 정부 재정수입 증가에 따른 발전소 투자 확대 국제유가 변동에 따라 국가 경제가 크게 영향을 받아 프로젝트 중단/정부재정 악화 지속 가능 현재 부가세 인상, 관세 인상 등으로..."
661,2021.08.10.,"뉴욕증시, 코로나19 우려에 하락 출발","국제 유가는 하락했다. 9월물 서부텍사스산원유(WTI) 가격은 전장보다 2.68% 하락한 배럴당 66.42달러에, 10월물 브렌트유 가격은 2.69% 떨어진 배럴당 68.80달러에 거래됐다. ysyoon@yna.co.kr 본 기사는 인포맥스 금융정보..."
662,2021.08.10.,"유가 하락, WTI 66.48달러…中 경제지표 둔화","국제유가는 중국의 경제 지표 둔화와 주요 기관의 중국 경제성장률 전망치 하향조정, 미 달러화 강세 등으로 하락했다. 10일 한국석유공사에 따르면 지난 9일(현지시간) 뉴욕상업거래소(NYMEX)의 미국..."
663,2021.07.21.,"미국증시 급등 속...국제 금값 '강보합', 국제 유가 '상승', 비트코인 '장중 ...",블룸버그 집계에 따르면 이날 미국 동부시각 오후 4시 48분 기준 뉴욕상품거래소에서 8월물 국제 금값은 온스당 1810.40 달러로 0.07% 상승했다. CNBC는 이날(한국시각 21일 새벽 6시 1분 기준) 10년물 미국...
664,2021.08.10.,中 물가 오르고 수출 ‘주춤’…하반기 성장 우려 [장가희 기자의 뉴스픽],"국제유가나 철광석 가격 등 원자재 가격 상승 때문인데요. 세계의 공장 역할을 하는 중국은 주요 원자재의 대부분을 수입하고 있기 때문에 제조기업이 타격을 입을 수 있습니다. 하지만, 정작 소비자 물가지수는 오히려..."
665,2021.08.10.,LPG값 오르자 지역 자영업자 한숨 겹겹,LPG 값이 오른 건 국제유가 상승의 영향이 크다. LPG는 원유 정제 과정에서 만들어진다. 1년 전 배럴당 40달러 선이던 두바이유가 최근 70달러 선까지 오르기도 했다. 이에 따라 LPG 아시아 시장을 사실상 독점하고...
666,2021.08.09.,"GS, 2Q 영업익 4855억원…전년비 200% 이상 증가","매출은 국제유가 상승으로 전분기 대비 20.5% 향상됐으나, 영업이익은 재고평가이익 감소가 제품마진 개선 보다 크게 작용하면서 40.1% 하락했다. 다만 전년 동기 대비로는 흑자전환했다. 특히 윤활유부문이..."
667,2021.08.10.,"뉴욕증시, 코로나19 우려·인프라 법안 기대 속 상승 출발","범유럽지수인 STOXX600지수는 0.41%가량 오르고 있다. 국제 유가는 상승했다. 9월물 서부텍사스산원유(WTI) 가격은 전장보다 1.61% 오른 배럴당 67.55달러에, 10월물 브렌트유 가격은 1.27% 오른 배럴당 69.92달러에 거래됐다."
668,2021.07.16.,"국제 유가 이틀연속 급락...미국증시 혼조, 에너지 섹터 주가 이틀연속 급락",전일에도 국제 유가가 급락하며 미국증시 에너지 섹터 주가가 곤두박질 쳤는데 이날에도 그런 흐름이 이어졌다. 주요 산유국이 다시 원유 생산 수준에 대해 합의한 것이 이틀 연속 유가와 미국증시 에너지...
669,2021.08.09.,"강원 휘발유 가격 1,653원…올해 최고가","올해 들어 휘발유 가격이 1,653원을 넘어선 것은 이번이 처음입니다. 석유공사는 코로나19 변이 바이러스 확산 등으로 국제유가가 하락세를 보이고 있어 국내 휘발유 가격이 조정을 받을 수 있다고 전망했습니다."
670,2021.08.09.,"강원 휘발유 가격 1,653원…올해 최고가","올해 들어 휘발유 가격이 1,653원을 넘어선 것은 이번이 처음입니다. 석유공사는 코로나19 변이 바이러스 확산 등으로 국제유가가 하락세를 보이고 있어 국내 휘발유 가격이 조정을 받을 수 있다고 전망했습니다."
671,2021.08.10.,"국토부, 해외건설 수주 종합안내서 '해외건설 완전정복' 발간","해외건설을 한눈에 볼 수 있는 역사를 포함하고 국제유가와 해외건설 수주와의 상관관계 등 해외건설의 특징을 초반에 다루면서 해외건설에 대한 이해를 높였다. 무엇보다도 기획, 사업화 지원, 수행 등 해외건설 진출..."
672,2021.08.09.,"뉴욕증시, 물가지표·연준 위원 발언 수위 촉각 [출근전 꼭 글로벌브리핑]",[국제유가] ■ 코로나 우려·달러 강세에 하락 뉴욕유가는 코로나19 델타 변이에 대한 우려와 달러 강세에 약세를 보였다. 현지시간 6일 미 뉴욕상업거래소에서 9월물 서부텍사스산원유(WTI) 가격은 1.2% 하락한 배럴당...
673,2021.07.15.,美 원유재고 격감에도 국제 유가 · 미국증시 에너지주 '급락'...OPEC서 무슨...,14일(미국시간) 국제 유가가 급락했다. 미국의 주간 원유재고가 크게 감소했는데도 불구하고 주요 산유국이 산유량 기준 상향에 잠정 합의했다는 소식이 유가를 짓눌렀다. 블룸버그 집계에 따르면 이날 미국...
674,2021.07.16.,유가 하락 속...삼성중공업 · 한국조선해양 · 대우조선 · 현대미포조선 '장...,신조선 가격은 상승하고 있지만 원재료인 후판가격이 급등하는 데다 조선주들의 주가에 변수로 작용하는 국제유가 하락 등도 변수로 작용하는 것으로 풀이된다. 한국거래소에 따르면 삼성중공업은 오전 10시 2분...
675,2021.08.10.,“역대급 호황이었는데” 내리막 못 면하는 화학株…왜?,"멈췄던 설비의 재가동이 늘어나 공급이 증가하는 반면, 국제유가 상승으로 원재료비 부담은 확대된 영향이다. 황규원 유안타증권 연구원은 “이달 1주차 납사분해설비(NCC) 업체의 톤당 스프레드는 385달러로..."
676,2021.08.07.,휘발유 가격 14주 연속 상승…리터 당 1645원,"1원, 3.9원, 4.1원씩 오르며 다소 둔화하고 있다. 한국석유공사는 ""코로나19 확산과 미국 원유 재고 증가, 제조업 지표 둔화 등 영향으로 국제유가는 하락세를 기록 중""이라고 밝혔다."
677,2021.08.09.,"충북 2분기 서비스업 생산 늘고, 소매판매 줄었다",국제유가 상승으로 인한 휘발유 가격 상승이 영향을 미친 것으로 보인다. 판매가 감소한 업태는 기여도 순으로 △슈퍼·잡화·편의점 -6.7% △전문소매점 -2.8% 등이다. 대형마트는 4.0% 감소했다. 오는 3분기에는 코로나19...
678,2021.07.17.,"[상보] 국제유가, 공급 증가 우려에도 수요 회복 기대에 상승...WTI 0.54%↑",러빙턴/AP뉴시스국제유가가 16일(현지시간) 공급 증가 우려에도 소폭 상승했다. 뉴욕상업거래소(NYMEX)에서 8월 인도분 서부 텍사스산 중질유(WTI)는 전일 대비 0.39달러(0.54%) 상승한 배럴당 72.01달러에 마감했다. 런던...
679,2021.08.10.,"""코로나로 손님 없는데 LPG 가격까지 올라""… 자영업자들 '이중고'",지난 2014년 11월 이후 6년 10개월 만에 가장 큰 인상폭이다.LPG는 원유를 정제하는 과정에서 만들어지는데 최근 국제유가가 배럴당 40달러에서 70달러로 크게 오르며 LPG 가격 역시 덩달아 오른 것이다.해외에서 LPG를...
680,2021.08.10.,"국토부, 해외 수주 종합안내서 '해외건설 완전정복' 발간","특히, 해외건설 완전정복은 해외건설을 한눈에 볼 수 있는 역사를 포함하고 국제유가와 해외건설 수주와의 상관관계 등 해외건설의 특징을 초반에 다루면서 해외건설에 대한 이해를 높였다고 국토부는 전했습니다...."
681,2021.07.17.,"[상보] 국제유가, 공급 증가 우려에도 수요 회복 기대에 상승...WTI 0.54%↑",러빙턴/AP뉴시스국제유가가 16일(현지시간) 공급 증가 우려에도 소폭 상승했다. 뉴욕상업거래소(NYMEX)에서 8월 인도분 서부 텍사스산 중질유(WTI)는 전일 대비 0.39달러(0.54%) 상승한 배럴당 72.01달러에 마감했다. 런던...
682,2021.08.10.,"""코로나로 손님 없는데 LPG 가격까지 올라""… 자영업자들 '이중고'",지난 2014년 11월 이후 6년 10개월 만에 가장 큰 인상폭이다.LPG는 원유를 정제하는 과정에서 만들어지는데 최근 국제유가가 배럴당 40달러에서 70달러로 크게 오르며 LPG 가격 역시 덩달아 오른 것이다.해외에서 LPG를...
683,2021.08.08.,"한은 ""올해 소비자물가 1.8% 넘어""...전망치 상향할듯","최근 국제유가가 배럴당 70달러대를 유지하고 있고, 임금도 상승하고 있어 소비자물가 상승률 전망치도 상향 조정할 가능성이 커졌다. 특히 한은 물가 관리 목표치인 2%를 넘어설 가능성도 거론되고 있다. 금통위 의사록을..."
684,2021.08.10.,‘미니 스태그플레이션’ 우려되는 3분기 글로벌 경제,국제 유가가 예상보다 높은 수준에 머무르면서 중국의 생산자 물가(PPI)와 미국의 소비자 물가(CPI) 상승률의 정점이 2분기에서 3분기로 한 분기 늦춰지고 내려오는 속도도 더딜 가능성이 높아졌다. 4분기 초까지 중국의...
685,2021.07.21.,"[1보] 국제유가, 상승 마감...WTI 1.5%↑",이투데이=김나은 기자 | 국제유가는 20일(현지시간) 상승했다. 이날 뉴욕상업거래소에서 8월물 서부텍사스산원유(WTI) 가격은 전 거래일 대비 1달러(1.5%) 오른 배럴당 67.42달러에 마감했다.
686,2021.08.10.,"""코로나 심상찮다"" 둔화 우려에 여행·에너지株↓[뉴욕마감]",런던 ICE 선물거래소에서 오후 10시38분 기준 국제유가의 기준물인 10월분 북해산 브렌트유는 배럴당 1.47달러(2.08%) 내린 69.23달러를 기록 중이다. 브렌트유는 장중 67.60달러까지 하락했다. 금 가격은 내렸다. 이날...
687,2021.08.10.,"정유4사, 상반기 호실적 업고 '미래먹거리 찾기' 나서다",글로벌경기 활성화와 국제유가의 고공 행진에 힘입어 총 4조원 가량의 영업이익을 낸 것. 정유사들은 이 같은 실적에 기뻐하기 보다 향후 탄소중립 등으로 인한 수요 감소와 국제유가 하락 등에 대비하는 모습이다....
688,2021.08.08.,8월 인상 가능성 高高…美 테이퍼링 시사,국제유가와 농축수산물 가격 상승 등으로 하반기 물가가 더 가파르게 오를 것으로 예상되는 가운데 정부 전망치인 연간 물가상승률 1.8%도 지키기 어려울 수 있다는 우려가 나온다. 인플레이션 우려와 가파른 집값...
689,2021.07.20.,"[1보] 국제유가, 급락...WTI 7.5%↓",이투데이=김나은 기자 | 국제유가는 19일(현지시간) 급락했다. 뉴욕상업거래소(NYMEX)에서 8월물 서부 텍사스산 원유(WTI)는 전 거래일 대비 5.39달러(7.5%) 하락한 배럴당 66.42달러에 마감했다.
