,날짜,제목,요약
963,2021.12.08.,오미크론 우려 진정에 기술주 중심 상승,한편 오미크론으로 인한 경기 둔화 가능성이 높지 않다는 기대가 커지면서 국제 유가도 큰 폭으로 올랐습니다. WTI유가는 전일 대비 3.6%의 상승세로 거래를 마쳤습니다. ◀ 앵커 ▶ 오미크론으로 인한 충격은 빠르게...
964,2021.12.09.,"지난달 외국인, 국내 주식 시장서 6조 사들여...한 달 만에 순유입 전환","원·달러 환율은 미 연준의 통화정책 조기 정상화 기대 강화, 코로나19 재확산 우려 등으로 지난달 26일 1193.3원으로 상승했다가 이후 국제유가의 큰 폭 하락, 우리나라 수출 호조 등의 영향으로 상승폭을 좁혔다...."
965,2021.12.08.,치솟았던 美 휘발유·천연가스값 하락세…안정화 접어드나,국제유가는 오미크론 코로나19 변이 바이러스 출현으로 폭락한 후 증상이 경미할 수 있다는 전망이 나옴에 따라 다소 반등하고 있다. 이날 유가는 배럴당 72.80달러로 5% 가까이 올랐다. 천연가스는 지난 1년 동안...
966,2021.12.05.,유류세 인하분 뛰어넘은 LPG 가격 상승세…2014년 이후 최고,"국제유가 인상에다 동절기 진입 영향…""내달에는 동결·인하 예상"" '서민 연료'로 불리는 국내 액화석유가스(LPG) 가격이 정부의 유류세 인하 조치에도 가격 상승세를 이어가고 있다. 국제유가 상승과 난방 연료..."
967,2021.12.02.,홍남기 “다주택자 양도세 완화 추진 계획 없다”,"이날 통계청이 11월 소비자물가지수가 지난달보다 3.7% 상승했다고 발표한 데 대해 홍 부총리는 “전 세계적인 물가 오름세 속에 우리는 주요국 대비 낮은 수준”이라고 평가하며 “12월에는 국제유가 상승세 진정, 유류세..."
968,2021.12.06.,오미크론에도 재이륙하는 항공주…화물운임 상승에 날개다나,국제 유가가 상승하면서 주가를 억누르다가 오미크론 변이가 등장하자 주가가 무너지는 모습이었다. 하지만 지난달 29일 단기 저점 이후 5거래일 만에 대한항공 주가는 13.1% 반등했다. 다른 항공사들의 주가 흐름도...
969,2021.12.08.,오미크론 우려 완화에 기술주 랠리...애플 3.5%↑ [출근전 꼭 글로벌 브리핑],[국제유가] 국제유가는 상승했다. 이날 뉴욕상업거래소(NYMEX)에서 12월물 서부텍사스산원유(WTI) 가격은 전장 대비 3.23달러(4.87%) 오른 69.49달러에 거래를 마쳤다. [금] 국제금값은 뉴욕상품거래소에서 12월물 금...
970,2021.12.02.,물가상승률 3.7%…10년 만에 처음 본 '물가 공포',국제유가 강세에 국내 주요 식료품·서비스 물가까지 덩달아 뛰면서 민생경제 고통이 가중될 전망이다. 2일 통계청이 발표한 ‘11월 소비자물가동향’에 따르면 지난달 소비자물가지수는 109.41(2015년=100 기준)로...
971,2021.12.03.,"알뜰주유소 늘리고 농축수산물 쿠폰 590억 푼다…정부, 물가 대책",이 차관은 “국제유가 등 에너지가격 강세와 공급망 차질이 지속되는 가운데 오미크론 바이러스 확산 우려 등으로 물가 불확실성이 더욱 커졌다”며 “서민 장바구니 물가를 안정적으로 관리할 수 있도록 가용한 모든...
972,2021.12.08.,"효성화학, 베트남 수직 계열화…""수익성 개선""",사우디 프로판 가격은 국제 유가 강세 등으로 전기대비 29% 증가하며 원가 부담은 심화될 것으로 보인다. 효성화학 주가는 원가 부담 및 일회성 이슈에 따른 실적 부진과 시황 우려 등으로 고점 대비 44% 하락한 이후...
973,2021.12.01.,월간 수출 첫 600억 달러 돌파...무역수지 19개월 연속 흑자,"국제유가와 원자잿값 상승 등에 따라, 수입 액수가 많이 늘어난 것도 한몫했는데요. 11월 수입액은 573억 6천만 달러로 지난해보다 43.6% 증가했습니다. 다만, 수출에서 큰 선전을 거두며 무역수지는 30억 9천만 달러..."
974,2021.12.02.,11월 소비자물가 3.7% 올라···10년 여만에 최대 상승,어운선 경제동향통계심의관은 “국제 유가나 원자재 가격 등을 고려하면 석유류 등 공업제품 가격 둔화는 크지 않을 것이고 개인서비스도 방역체계 전환·소비심리 회복 등으로 인해 다음 달에도 상당한 오름세를...
975,2021.12.08.,"[올댓차이나] 홍콩 증시, 상승 개장 후 이익매물에 혼조 마감...항셍 0.06%↑","홍콩 증시는 8일 전날 뉴욕 증시가 오르고 국제유가가 상승하면서 투자심리를 유지, 상승 개장했다가 이익확정 매물이 출회해 보합 혼조로 마감했다. 항셍지수는 이날 전일 대비 13.21 포인트, 0.06% 올라간..."
976,2021.12.08.,"제주시, '전년비 4.5% 상승' 물가안정대책 추진","제주시는 최근 국제유가, 원자재 가격 상승, 인플레이션 우려 등으로 치솟고 있는 도내 물가를 안정화하기 위해 소비자물가 안정 시까지 물가안정대책을 추진한다고 8일 밝혔다. 올해 11월 제주지역 소비자물가는 지난..."
977,2021.12.03.,"정부, 원자재 비축물량 중기 우선 판매…옥수수·설탕 등 할당관세 지원","이억원 차관은 모두발언을 통해 ""이번달 물가상승폭이 지난달에 비해 확대된 것은 국제유가 상승 등 글로벌 에너지 가격발 물가상승압력이 지속되고 한파 등 기상요인이 중첩되면서 석유류 및 농축수산물을 중심으로..."
978,2021.12.02.,오미크론 충격에 올해 4% 성장 ‘빨간불’…“12월 확산세 지켜봐야”,"부진, 국제유가 등 원자재 가격 변동성 확대 등이 두드러졌기 때문에 오미크론이 얼마나 빨리 확산되고 치명률이 얼마나 심한지 등에 따라 향후 물가나 성장 등 실물경제에도 영향을 미칠 것”이라고 말했다...."
979,2021.12.10.,[뉴스워커_산업] 한국 무역규모 '코시국' 영향권 벗어난다,석유화학 분야는 국제유가가 상승하고 주요국의 경기회복에 따른 전방산업의 수요증가로 물량과 단가가 동시에 증가하여 11월 월간 수출액이 48.4억 달러를 기록했다.2021년 1월부터 11월까지 석유화학 분야의...
980,2021.12.06.,[월급 빼고 다 오른다③]다급해진 정부…관세 인하·소비쿠폰 '긴급 대책',"기재부는 ""국제 유가 등 에너지 가격 강세와 공급망 차질이 지속되는 가운데 변이 바이러스 '오미크론' 확산 우려 등으로 물가 불확실성이 더 커지고 있다""면서 ""서민 생활 물가 안정이 정부의 최우선 정책 과제라는 인식..."
981,2021.12.02.,'의·식·주' 모두 올랐다···물가 3.7% 치솟아 '10년만에 최대',"한은은 소비자물가 상승률은 최근의 국제 유가 흐름, 유류세 인하 효과 등을 감안할 때 점차 둔화되겠지만 수요 측 물가 상승 압력 확대, 공급 병목 영향 등으로 상당 기간 목표 수준을 상회할 것으로 봤다. 최근 국제..."
982,2021.12.02.,오이·상추·계란…찬거리도 안 오른게 없다,국제유가 상승세가 이어져 석유제품 가격이 진정되지 않을 경우 인플레이션 압력이 커질 것으로 보인다. 또 단계적 일상회복(위드 코로나)에 따른 소비심리 활성화로 개인서비스 영역의 물가도 오를 수 있다....
983,2021.12.10.,미국 물가 7% 시대 열리나?...11월 CPI 발표 앞두고 긴장감 고조,"국제유가와 천연가스 가격 등 에너지 가격이 높아진 여파다. 특히 11월 초·중반까지 국제유가가 높은 수준을 유지해왔기에, CPI의 11월 상승세는 더 가팔라졌을 것이라는 우려의 목소리가 커지고 있다. 지난 11월 9일을..."
984,2021.12.07.,10월 국제수지 69.5억 달러…18개월 연속 흑자,"천연가스, 국제유가 등 원자재 가격 상승으로 전반적인 수입가격이 올라 11개월 연속 증가했다. 품목별로 보면 원자재가 70.7%가 늘었고 이 중에서 석유제품이 266.5%, 가스가 136.7% 증가했다. 자본재와 소비재..."
985,2021.12.07.,원자재 가격 고공행진에 경상수지 흑자 40% 급감,국제 유가와 원자재 가격이 고공행진을 이어가면서 수입액이 크게 불어난 결과다. 한국은행이 7일 발표한 10월 경상수지는 69억4550만달러(약 8조2170억원) 흑자로 집계됐다. 작년 10월(115억5510만달러)과...
986,2021.12.06.,"韓 석유 쥔 아람코, 오미크론 공포에도 수출 가격 인상",한국 석유시장의 약 3분의 1을 책임지는 세계 최대 석유기업 아람코가 국제적인 유가 하락에도 불구하고 석유 판매 출고가를 약 2년 만에 최고 수준으로 올릴 계획이다. 아람코는 최근 코로나19 오미크론 변이와 그에...
987,2021.12.09.,[WTI] 배럴당 72.36달러...+0.43%,"36달러로 전일 대비 0.43% 상승했다. 최근 5년 국제유가(WTI) 가격 일별 추이 (자료: 아이투자 인더스트리워치 서비스) [관련 기업] SK이노베이션, S-Oil, GS, 롯데케미칼, 금호석유, 대한유화, LG화학"
988,2021.12.08.,"뉴욕증시, 오미크론 우려 진정에 상승 출발",09% 오르고 있다. 국제유가는 상승했다. 1월물 서부텍사스산원유(WTI) 가격은 전장보다 3.21% 오른 배럴당 71.70달러에 거래됐다. 2월물 브렌트유 가격은 2.64% 상승한 배럴당 75.01달러를 나타냈다.
989,2021.12.07.,'생각보다 약한 오미크론'에 뉴욕증시 반등…다우 1.9%↑,경제재개·여행 관련주 급반등…유럽증시·국제유가도 상승 강건택 특파원 = 신종 코로나바이러스 감염증(코로나19)의 새로운 변이 오미크론 소식에 미국 뉴욕증시가 또 출렁였다. 이번엔 생각보다 경미할...
990,2021.12.03.,"OPEC+, 오미크론 확산 속 증산 방침 유지","치솟는 국제유가를 잡기 위해 지난주 조 바이든 미국 대통령은 우리나라를 포함해 중국과 일본, 영국, 호주, 인도 등 주요 석유 소비국들과 비축유를 방출하는 초강수를 발표했는데요. 발표 직후 OPEC+가 맞대응을..."
991,2021.12.07.,"[뉴스새벽배송]美증시, 오미크론 공포 완화에 급반등","이에 암호화폐를 비롯한 국제유가도 상승했다. 다만 미국 증권거래위원회(SEC)가 전직 테슬라 직원의 내부 고발에 따라 조사를 시작하면서 테슬라는 하락했고, 루시드 또한 기업인수목적회사(SPAC)를 통해 상장하는..."
992,2021.12.02.,"3분기 경제성장률 0.3%…실질 국민총소득, 5개분기 만에 감소(상보)","수출이 호조를 보였음에도 국제유가 상승 등 교역조건이 악화되면서 실질 국외순수취요소소득이 8조8000억원에서 4조원으로 반토막 이상 감소했기 때문이다. 모든 재화, 서비스의 물가 지수를 보여주는..."
993,2021.12.02.,"한은, 연간 소비자물가 상승률 2.3% 상회 가능성↑","한은은 이어 ""소비자물가 상승률은 최근 국제유가 흐름, 유류세 인하 효과 등을 감안할 때 점차 둔화될 것""이라면서도 ""수요 측 물가 상승 압력 확대, 공급 병목의 영향 등으로 상당 기간 목표 수준을 상회할 것으로..."
994,2021.12.02.,11월 소비자물가 3.7% 상승… 9년 11개월 만에 최고,"홍남기 부총리 겸 기획재정부 장관은 비상경제중앙대책본부 회의에서 “전세계적 물가 오름세 속에 우리는 주요국 대비 낮은 수준”이라며 “12월에는 국제유가 상승세 진정, 유류세 인하 효과, 김장 조기 종료..."
995,2021.12.07.,지지율 바닥 치자 中 때리는 바이든… 미중 냉전으로 돌아서나,미국은 잘못된 행위에 대한 대가를 지불하게 될 것이다. 다들 지켜보라”고 말했다. 당장 국제 유가 안정을 위한 비축유 방출 등 양국 간 협력 흐름이 꺾일 것이라는 우려가 나온다.
996,2021.12.07.,'역대 최대 무역액' 성적표 받나…단가 하락시 성장세는 물음표,다만 올해 수출 호조는 국제 유가와 원자재 가격이 상승하며 수출 단가가 늘어난 측면을 부인할 수 없다. 국내 기업이 상품을 만드는 데 비용이 오르며 수출 상품의 판매 가격도 비싸진 것이다. 이 때문에 수출 규모는...
997,2021.12.07.,"""오미크론 때문에""…정유업계 또 `경고등`",정유사들의 수익성 지표인 정제마진이 최근 들어 큰 폭으로 떨어졌습니다. 오미크론이 출현하면서 정유 수요가 줄어들 것이라는 우려가 커졌기 때문인데요. 코로나 직격탄을 맞았던 정유 업계에 또 다시 경고등이...
998,2021.12.03.,올해 물가 상승률 '2%' 넘긴다…2011년 이후 최고치 유력,"기사내용 요약통계청 11월 소비자 물가 동향 분석 전년 대비 3.7% 급등 9년 11개월 만 '국제 유가 상승, 이른 김장철' 여파 2012~2020년 1%대 저물가 현상 끝 정부 ""안정 수준(2%)서 관리하겠다"" [세종=뉴시스] 김진욱 기자..."
999,2021.11.13.,[1보] 국제유가 하락…WTI 0.98%↓,이투데이=변효선 기자 | 국제유가가 12일(현지시간) 하락했다. 이날 뉴욕상업거래소에서 12월 인도분 서부텍사스산원유(WTI) 가격은 전장보다 0.80달러(0.98%) 내린 배럴당 80.79달러에 장을 마감했다.
1000,2021.12.04.,3주 연속 유류세 인하…휘발유 가격 9.8원 내린 리터당 1677원,국내 유가의 선행 지표라고 할 수 있는 국제 유가는 코로나19 새로운 변이 바이러스인 오미크론의 유행으로 이번 주 크게 내렸습니다. 국내로 수입되는 원유의 기준인 두바이유 평균 가격은 한 주 전보다 7달러...
1001,2021.12.02.,11월 소비자물가 전년比 3.7% 상승...10년만에 가장 높아(종합),국제유가의 고공행진과 농축수산물 가격 상승에 더해 전기·수도·가스와 서비스 등의 물가가 모두 올랐다. 정부의 유류세 인하 조치에도 불구하고 국제유가 상승으로 석유류 가격이 35.5% 올랐다. 2일 통계청이...
1002,2021.12.08.,"효성화학, 원가부담 점차 완화 예상 -신한","이 연구원은 ""사우디 프로판 가격은 국제 유가 강세 등으로 전기대비 29% 증가하며, 원가 부담은 심화되겠다""며 ""베트남 PP(폴리프로필렌), DH(탈수소화)는 DH설비 정기보수로 적자가 지속될 전망이다""라고 말했다. 또 ""LPG..."
1003,2021.12.02.,기름값·채솟값·집세 다 올랐다…물가 10년 만에 최대 상승(종합),"석유류는 국제유가 상승의 영향, 가공식품은 곡물가격 상승의 영향을 받았고, 내구재는 원자재가격 상승에 따라 가격이 올랐다. 특히 석유류 물가는 35.5% 올라 2008년 7월(35.5%) 이후 13년4개월만에 가장 높은..."
1004,2021.12.09.,"한은 ""글로벌경제 가격지표 등락…국내 외환부문은 안정적""","한국은행은 ""원·달러 환율은 미 연준의 통화정책 조기 정상화 기대 강화, 코로나19 재확산 우려 등으로 1193.3원(11월 26일)까지 상승했으나 이후 국제유가의 급락과 국내 수출 호조 등에 힘입어 상승폭을 축소했다""고..."
1005,2021.12.02.,"한은 ""올해 물가 상승률, 전망치 2.3% 웃돌 가능성""","한은은 ""앞으로 소비자물가 상승률은 최근의 국제유가 흐름, 유류세 인하 효과 등을 감안할 때 점차 둔화하겠으나 수요측 물가상승 압력 확대, 공급 병목의 영향 등으로 상당 기간 목표 수준을 상회할 것""이라고..."
1006,2021.12.07.,강원도 물가상승률 9년여 만에 최고…“장 보기 겁나요”,"[박석철/강원지방통계지청 경제사회조사과 과장 : ""11월 중순 유류세 인하 전까지 국제유가 상승이 지속 되고, 재료비 반영에 따른 외식물가, 가공식품 가격 상승으로….""] 이 같은 물가 상승세는 내년에도 이어질 수..."
1007,2021.12.09.,"[기자수첩] 정유사, 신규사업 앞서 근간부터 살펴라","현대오일뱅크는 2012년과 2017년에도 예비심사를 신청한 바 있으나 국제유가 하락과 아람코의 지분투자로 중단됐다. 내부적으로는 ""세 번째 무산은 없다""며 호기롭게 상장을 추진하는 모양새지만 예기치 않은 사건이 어떤..."
1008,2021.12.10.,"뉴욕증시, 테이퍼링 가속 우려에 '나스닥 1.71%↓'… WTI 70.94달러",국제유가는 하락했다. 이날 뉴욕상업거래소(NYMEX)에서 1월물 서부텍사스산원유(WTI) 가격은 전거래일 대비 1.42달러(2%) 내린 배럴당 70.94달러에 장을 마쳤다. 오미크론 확산을 막는 정책 제한이 유가에 부담을 준...
1009,2021.12.02.,석유류 가격 13년4개월·생활물가 10여년 만에 최대 상승,앞선 국제유가 급등의 영향이 이어진 가운데 유류세 인하 효과도 아직 뚜렷이 나타나지 않은 탓이다. 서민 생활에 직결되는 외식비와 채소값 등 찬거리 가격도 급등하며 생활물가 역시 10년 만에 가장 크게 올랐다....
1010,2021.12.02.,석유류 가격 13년4개월·생활물가 10여년 만에 최대 상승,앞선 국제유가 급등의 영향이 이어진 가운데 유류세 인하 효과도 아직 뚜렷이 나타나지 않은 탓이다. 서민 생활에 직결되는 외식비와 채소값 등 찬거리 가격도 급등하며 생활물가 역시 10년 만에 가장 크게 올랐다....
1011,2021.12.06.,"[뉴스새벽배송]헝다, 채무 상환 실패 가능성…美증시 하락","국제유가, 오미크론 확산 지속에 하락 -코로나19 변이 바이러스인 오미크론 확산에 석유 수요가 부진할 수 있다는 우려가 나오면서 원유시장은 하락. 3일(미 동부시간) 뉴욕상업거래소에서 1월물 서부텍사스산원유(WTI)..."
1012,2021.12.06.,"사우디 아람코, 오미크론 확산에도 석유 판매가 인상",오미크론 확산으로 70달러 아래까지 뚝 떨어졌던 국제 유가도 조금씩 오르고 있다. 5일(이하 현지 시간) 블룸버그통신에 따르면 아람코는 내년 1월 아시아·미국 인도분 아랍경질유의 공식 판매 가격을 전월 대비 배럴당...
1013,2021.12.05.,유류세 인하에도 오르는 LPG 가격…2014년 이후 최고,"국제 LPG 계약 가격은 국제유가 상승세와 함께 지난해 4월부터 꾸준히 올랐습니다. 국제 LPG 제품 가격은 지난해 4월 1t(톤)당 프로판 230달러, 부탄 240달러에서 지난달 기준 프로판 870달러, 부탄 830달러까지..."
1014,2021.12.02.,"홍남기 ""다주택자 양도세 완화 계획 없어…물가관리 총력 대응""(종합)","홍 부총리는 ""전 세계적 물가 오름세 속에 우리는 주요국 대비 낮은 수준으로 12월에는 국제유가 상승세 진정, 유류세 인하 효과, 김장 조기종료 등으로 상승 폭이 둔화될 전망""이라며 ""10월 말까지 누적 물가상승률은 2.2..."
1015,2021.12.07.,강원도 물가상승률 9년여 만에 최고…“장 보기 겁나요”,"[박석철/강원지방통계지청 경제사회조사과 과장 : ""11월 중순 유류세 인하 전까지 국제유가 상승이 지속 되고, 재료비 반영에 따른 외식물가, 가공식품 가격 상승으로….""] 이 같은 물가 상승세는 내년에도 이어질 수..."
1016,2021.12.10.,"코스피, 하락 출발 3000대 약세… 원/달러 환율 3.9원↑·금 선물 0.49%↓",국제유가는 하락했다. 이날 뉴욕상업거래소(NYMEX)에서 12월물 서부텍사스산원유(WTI) 가격은 전장 대비 1.42달러(1.96%) 내린 70.94달러에 거래를 마쳤다. 런던 국제선물거래소(ICE)에서 북해산 기준 브렌트유...
1017,2021.12.03.,[뉴스새벽배송] 美증시 급반등…유럽 뒤덮은 오미크론,국제 유가는 석유수출국기구(OPEC) 플러스(+)의 증산 규모 유지 소식에 상승했다. 미국 주간 실업보험 청구자 수는 예상치를 밑돌긴 했으나 전주보다 증가했다. 올해 말 퇴임 예정인 랜들 퀄스 연방준비제도(fed)...
1018,2021.12.08.,'공포는 매수기회' 기술주 반등...반도체주↑[뉴욕마감](종합),런던 ICE 선물거래소에서 국제유가의 기준물인 2월분 북해산 브렌트유는 오후 11시13분 기준 배럴당 2.10달러(2.87%) 오른 75.18달러를 기록 중이다. 금 가격은 올랐다. 이날 뉴욕상품거래소에서 2월 인도분 금 가격은 전...
1019,2021.12.03.,"물가대책 약발 안 받네…오이 2270원→4000원, 10년래 물가 최고치","정부는 올해 하반기 국제유가가 급등하자 유류세 20%를 한시 인하하고, 겨울 김장철 수요에 대비해 정부 비축분을 시중에 푸는 등 물가안정을 위한 총력 대응에 나섰다. 그러나 지난달 소비자물가는 4% 가까이..."
1020,2021.11.12.,"[1보] 국제유가, 상승...WTI 0.3%↑",이투데이=김나은 기자 | 국제유가는 11일(현지시간) 상승했다. 뉴욕상업거래소(NYMEX)에서 12월물 서부 텍사스산 원유(WTI)는 전 거래일 대비 0.25달러(0.3%) 오른 배럴당 81.59달러에 마감했다.
1021,2021.12.02.,"물가, 10년 만에 최대 폭 상승...석유류·채소·집세↑","국제유가의 상승세 속에 석유류 가격이 크게 오른 데다 외식·가공식품과 채소류까지 강세가 이어졌습니다. 휘발유와 경유, LPG, 등유 가격은 30% 넘게 뛰었습니다. 지난달 12일부터 유류세가 20% 내렸지만, 가격 반영에는..."
1022,2021.12.09.,"[오늘Who] 삼성물산 해외수주 선방, 오세철 내년에도 중동을 텃밭으로",최근 국제유가 상승세 등에 힘입어 중동 산유국들의 대형 프로젝트 발주를 놓고 긍정적 전망이 나오는 등 대외 상황도 나쁘지 않다. 코로나19 변이 바이러스인 오미크론 확산세에 따른 불확실성이 있지만 오미크론이...
1023,2021.12.08.,[오늘의 경제지표] 美 증시 훈풍에 장중 '삼천피·천스닥' 회복,마지막으로 국제유가입니다. 오미크론 우려 완화에 상승세를 이어갔습니다. 이란산 원유가 당장 시장에 공급되지 않을 것이란 전망도 유가를 지탱했습니다. 지금까지 오늘의 경제지표였습니다.
1024,2021.12.02.,11월 경기도 소비자물가 3.9%↑...10년만에 상승폭 최대,"국제유가 상승세 지속으로 휘발유(33.4%), 경유(39.8%), 자동차용 LPG(38.5%) 등 가격이 올랐기 때문이다. 서비스 물가는 1년 전보다 2.3% 상승했다. 고등학교납입금(-100.0%)과 부동산중개수수료(-8.2%) 등이 하락하며..."
1025,2021.12.10.,"[오늘의 글로벌마켓] 뉴욕증시, 인플레이션 지표 경계...일제히 하락","유럽증시 일제히 하락...국제유가도 내려 유럽증시는 일제히 하락세를 기록했다. 이날 영국 런던의 FTSE 100 지수는 전일대비 0.22% 내린 7321.26으로 거래를 마감했고, 프랑스 파리 증시의 CAC 40 지수는 전일대비 0.09..."
1026,2021.12.06.,"오미크론에도 원유 수요 유지하나…사우디, 판매가 인상",원유 가격의 변화를 주도하는 세계 최대 석유 생산회사 아람코가 판매 가격을 인상함에 따라 국제 유가의 이후 변동에도 관심이 쏠린다. 최근 원유 시장에서는 오미크론 변이의 등장으로 수요가 위축될 수 있다는...
1027,2021.12.08.,"급상승 서민물가, 제주시 안정대책 추진","최근 국제유가, 원자재 가격 상승, 인플레이션 우려, 축산물 수요 증가 등 요인이 겹치며 지난달 기준 제주지역소비자 물가지수는 111.22로 지난해 106.48 대비 4.5% 급상승했다. 여기에 김장철을 앞두고 김장채소 생육기에..."
1028,2021.12.04.,유류세 인하 3주째…이번주 휘발유 가격 9.8원 내린 L당 1천677원,시행 후 현재까지 129원 내려…오미크론 유행에 국제유가 하락 전국 주유소의 기름값이 유류세 인하 효과로 3주 연속 하락한 가운데 하락폭은 이전에 비해 다소 작아졌다. 4일 한국석유공사 유가정보사이트...
1029,2021.12.09.,건설업 올해도 내년도 사상 최대 실적 전망 '함박웃음',해외수주에 영향을 미치는 국제유가는 최근 배럴 당 80달러선을 넘어서 내년에 120달러까지 오를 수 있다는 전망이 나오는 중이다. 미국 투자은행 뱅크오브아메리카(BoA)는 최근 보고서에서 내년 6월 국제유가(WTI 기준)...
1030,2021.12.02.,"소비자물가 3.7% 급등에…""농수산 쿠폰확대 등 총력 대응""(종합)","다만 홍 부총리는 ""전 세계적 물가 오름세 속 우리는 주요국 대비 낮은 수준""이라며 ""12월엔 국제유가 상승세 진정, 유류세 인하 효과, 김장 조기 종료 등으로 상승 폭이 둔화할 전망""이라고 말했다. 이어 ""10월말까지 누적..."
1031,2021.12.07.,"'충돌 방지' 공감했던 미·중, '외교적 보이콧'으로 '격랑' 불가피",또 미국이 인플레이션 압박에 국제유가를 잡기 위해 중국과 손잡고 전략적 비축유(SPR) 방출 공조에 나선 것 역시 무산 혹은 축소될 될 가능성이 있다는 분석이다. 백악관은 지난 23일 바이든 대통령의 공조 요청에 따라...
