,날짜,제목,요약
2846,2019.04.22.,"WTI, 6개월여 만에 최고치…""美, 이란산 수입금지 예외 연장 불허""",국제 유가가 6개월여 만에 가장 높은 수준으로 뛰었다. 뉴욕상업거래소에서 5월물 서부 텍사스산 원유(WTI) 가격은 22일 오전 10시32분 현재 배럴당 0.80달러(1.25%) 상승한 64.80달러에 거래됐다. 이는 지난해 11월1일 이후...
2847,2019.04.23.,쏟아지는 악재에 휘발윳값 불안…‘잔인한 5월’ 되나?,"국제유가 상승 조짐도 심상치 않습니다. 미국의 이란산 원유수입 금지 조치에, 이란이 호르무즈 해협 봉쇄 가능성을 시사하면서, 국제유가 천정부지로 치솟을 가능성이 높기 때문입니다. [석유업계 관계자 : 국내..."
2848,2019.04.19.,3월 생산자물가 0.3% 상승…돼지고기 16.6% ↑,국제 유가 상승의 영향으로 생산자물가 상승세가 두 달 째 이어졌습니다. 한국은행이 발표한 '2019년 3월 생산자물가지수'를 보면 지난달 생산자물가지수는 104.14로 전월보다 0.3% 올랐습니다. 석유제품과 축산물...
2849,2019.04.26.,"SK이노베이션, 난관 극복 위해 '딥 체인지' 지속","이는 국제유가 상승에 따른 재고관련 이익이 늘어난 데 따른 것으로, 석유·석유화학 등 주요 제품의 마진은 하락했다. SK이노베이션은 비우호적인 시황을 돌파하기 위해 미래 먹거리 경쟁력 강화를 골자로 하는..."
2850,2019.04.12.,"정부, 유류세 한시적 인하 4개월 연장","첫 번째 질문은 '왜 단계적으로 인하를 결정했느냐?' 하는 것일 텐데, 그러니까 유류세 인하를 결정하게 될 당시, 그러니까 작년 10월 말 정도에 국제유가가 한 80불, 배럴당 80불 정도로 높은 상황이었습니다. 그 배경이..."
2851,2019.04.29.,"[뉴욕증시] 美 기업 실적발표…아마존 웃고, 애플 잃은 인텔 울고",국제유가 하락세 국제 유가는 하락세가 이어지고 있습니다. 원유 공급 문제가 불거질 당시 68달러 선까지도 올라갈 수 있다는 분석도 있었는데요. 유가는 3거래일 연속 하락세 이어가고 있습니다. 전장에서도 2.9%가량...
2852,2019.04.17.,"전경련, 미 국무부에 '이란 제재 예외조치' 연장 촉구","이란산 원유는 사우디아라비아 등 타국산 원유 가격보다 상대적으로 저렴하며, 최근 리비아 사태 등 국제유가가 불안한 가운데 저렴한 원유 공급처의 중요성이 높아지고 있다. SK에너지, 현대오일뱅크, 한화토탈 등 국내..."
2853,2019.04.22.,"""2분기 세계경제 선진국 중심 회복..美 추세성장 복귀 `관심`""","이 연구원은 “세계경제와 경기순행 관계에 있는 국제유가와 산업재가격이 상승세를 보이고 있다는 점도 긍정적”이라며 “4월 하순 국제유가(WTI유 기준)는 전년 12월 저점대비 49.9% 상승했고, CRB 산업재가격은..."
2854,2019.04.28.,[이번주 추천주]中 경기회복·관광객 확대 기대···호텔신라·신세계·이마...,KB증권 관계자는 “국제 유가 상승에 따른 래깅 마진 상승과 계절적 수요확대에 따른 가솔린 수익성 강세가 예상된다”며 “2·4분기에도 실적 호전이 지속될 것”이라고 설명했다. 휠라코리아 역시 자회사 신제품 출시...
2855,2019.04.23.,"스리랑카 폭발 사망자 300명 육박...미국, 이란산 원유 제재 예외 중단","22일 미국 정부 조치 발표 전후, 국제유가는 6개월 만에 최고 수준으로 올랐는데요. 이날 미국 뉴욕상업거래소에서 5월 인도분 서부 텍사스산 원유 값은 장중 3% 가까이 상승했고요. 영국 런던 ICE 선물거래소에서 브렌트유..."
2856,2019.04.25.,"뉴욕증시, 엇갈린 기업 실적 혼조 출발","국제유가는 혼재됐다. 6월물 서부텍사스산 원유(WTI) 가격은 전 거래일보다 0.14% 하락한 65.80달러에, 브렌트유는 0.54% 오른 74.97달러에 움직였다. 시카고상품거래소(CME) 페드워치에 따르면 연방기금(FF) 금리선물..."
2857,2019.04.19.,"[원유마감] WTI, 7주 연속 ↑…5년 만에 최장 주간 상승",국제유가가 18일(현지시간) 상승했다. WTI 선물은 7주 연속 상승세를 나타냈다. 5년 만에 최장 주간 상승 기록이다. WTI 선물은 배럴당 24센트(0.4%) 상승한 64.00달러를 기록했다. 브렌트유는 배럴당 35센트(0.5...
2858,2019.04.22.,"이란산 원유 수입 금지되나…""韓 예외조치 연장 안할 것""",이같은 소식이 전해지자 국제유가도 급등세를 나타냈다. 영국 런던 ICE 선물거래소에서 브렌트유 6월물은 한국시간으로 22일 정오께 배럴당 74.31달러로 전 거래일보다 3.3% 급등했다. 미국 뉴욕상업거래소(NYMEX)에서 5월...
2859,2019.04.22.,"""반도체 메모리산업 하강기조, 올 3분기 저점 찍을 것""","이에 대해 한국은행은 국제유가 상승 등으로 기업 수익성이 저하된 점을 순자금 조달 확대의 주요 요인으로 꼽았지만, SG는 기업부문 저축 감소, 재고투자 증가 등으로 자금조달이 확대되었을 것으로 추정했다. SG는..."
2860,2019.04.29.,홍남기 “경제성장률 목표치 수정계획 없다”,또 국제유가가 오름세를 나타내는 상황에서 유류세 인하 폭이 축소되는 것을 두고는 “앞으로의 유가 전망까지 포함해 결정한 만큼 계획대로 진행될 것이라고 본다”고 밝혔습니다.
2861,2019.04.24.,"뉴욕증시, 기업 好실적에 사상 최고치 근접···다우, 0.55%↑",국제유가 움직임도 시장이 촉각을 곤두세우는 요인이다. 미국이 이란 제재 예외를 연장하지 않겠다는 방침을 밝힌 이후 유가가 급등세를 타는 중이다. 서부텍사스원유(WTI)는 이날도 1% 이상 오르며 배럴당 66달러...
2862,2019.04.23.,"트럼프 ""이란산 원유 제재, 사우디와 OPEC 회원국이 공백 메울것""","한편, 트럼프 행정부의 '이란산 원유 봉쇄' 조치로 이날 국제유가는 급등했다. 뉴욕상업거래소(NYMEX)에서 5월 인도분 서부 텍사스산 원유(WTI)는 전 거래일보다 배럴당 2.7%(1.70달러) 오른 65.70달러에 거래를 마쳤다. 이는..."
2863,2019.04.27.,"휘발유·경유 가격, 10주째 상승…알뜰주유소 휘발유 1400원대 진입","석유공사 관계자는 ""국제유가는 미국의 이란 원유수입 예외적 허용조치 재연장 불허, 이란의 호르무즈 해협 봉쇄 위협 등으로 상승했다""며 ""국내 제품가격도 오름세를 유지할 것""이라고 전망했다. 한편, 이호승..."
2864,2019.04.15.,"[더벨]현대중공업지주, 오일뱅크 매각 구조 바꿨다","4분기 국제유가가 급락하면서 영업이익은 반토막났다. 지난해 영업이익은 6610억원, 당기순이익은 4038억원을 기록했다. 문제는 4조5779억원에 달하는 유동부채다. 지난해 순차입금은 3조2671억원으로 1년 동안..."
2865,2019.04.24.,[인베스팅의 눈] 금주 시장에서 주목할 만한 신호는?,"- 미국의 이란산 원유 제재 유가 급등…정유업계 긴장 - 이란발 쇼크 국제유가 향방, 사우디에 달렸다 * 원·달러 환율 전망은? - 원·달러 환율 상승 모멘텀 소진 분위기 - 수급 부담 완화 국면 속 수출 지표 확인 - 외국인..."
2866,2019.04.23.,4월 23일 굿모닝MBN 주요뉴스,"국제유가 변동성에 따른 물가 상승으로 국내 경제 부담은 물론, 국내 석유화학업계에도 비상이 걸렸습니다. ▶ 필리핀 '6.1' 강진…8명 사망·50여 명 부상 필리핀에서 규모 6.1의 강진이 발생해 8명이 숨지고 50여 명이..."
2867,2019.04.26.,"[증시라인 - 환율 쇼크 대응전략] 원/달러 25개월래 최고치 경신, 충격 속 대...",- 안전자산 선호심리에 달러 인덱스 강세 - 미 연준 완화적 기조에 달러 선호도 강화 - 국제유가 상승세 여파 - WTI 5개월 사이 45% 수준 급등 - 석유 의존도 높아 유가 상승에 민감 - 투자매력 감소로 외국인 자금 이탈...
2868,2019.04.23.,"[이승조의 TMI] ""2020년 미국 대통령 선거 주목""",성공 투자의 정수 ▶출연: 이승조 대표 / 무극선생 - 2020년 미국 대통령 선거 주목 - 이란 원유 봉쇄에 국제 유가 급등 - 공포지수 체크 필수 는 월요일부터 금요일까지 오후 3시 00분 ~ 3시 50분까지 시청하실 수...
2869,2019.04.30.,제조업 체감경기 3개월 연속 상승…계절적 요인 영향,"국제유가가 오르고 건설장비, 농기계의 계절적 수요가 증가한 영향이다. 기업 규모별로는 대기업(81)과 중소기업(69)이 각각 4포인트, 1포인트 상승했다. 수출기업(81)과 내수기업(72)도 1포인트, 3포인트씩 올랐다. 5월..."
2870,2019.04.23.,"美 '이란산 원유 수입금지 예외조치' 중단, 한국 등 8개국 불똥…또 다른 우려...","국제유가 급등으로 더욱 경제 환경은 불안해지는 상황이다. AP통신 등 외신에 따르면 폼페이오 미국 국무장관은 22일(현지시간) 국무부 청사에서 기자회견을 열고 ""미국은 이란 원유 수입국들에 대한 감축 예외조치(SREs)를..."
2871,2019.04.24.,"아시아나항공, 24일 장중 이틀째 급락...무슨 일?","게다가 미국의 이란에 대한 제재 강화 속에 국제 유가가 전날부터 급등세를 보인 것도 항공주엔 부담 요인이라고 시장 관계자들은 설명하고 있다. 초이스경제는 그러나 ""이 기사는 단순한 참고용 자료로만 활용되길..."
2872,2019.04.19.,휘발유 가격 9주 연속 상승…14.8원 오른 L당 1423.1원,"한국석유공사는 ""국제유가는 미국 원유재고 감소, 리비아 정정불안 지속 등의 영향으로 상승했다""며 ""국내제품가격은 최근 국제유가 상승의 영향으로 오름세를 유지할 것""이라고 했다. [ ]"
2873,2019.04.23.,[글로벌 주요 이슈] 3월 기존주택 판매 4.9%↓…월가 예상 하회,"1.뉴욕증시, 1분기 실적 발표 관망심리 혼조 2.국제유가, 이란산 원유 수입 금지...6개월 래 최고 3.3월 기존주택 판매 4.9%↓…월가 예상 하회 4.삼성, 갤럭시폴드 美출시 연기..시점 향후 공지 뉴욕증시, 1분기 실적 발표..."
2874,2019.04.30.,"엔화환율 소폭 하락, 원엔환율 큰 폭 상승","국제유가, 아시아시장에서 상승 국제 외환시장에서 엔화환율이 30일 소폭 하락했다. 블룸버그 집계에 따르면, 미국달러 대비 엔화환율은 오후 5시4분(한국시간) 현재 111.34 엔으로 전날 뉴욕시장 마감..."
2875,2019.04.15.,"김재규, 박정희를 죽이다","또 농민들의 저곡가, 노동자들의 저임금 등의 희생과 국제유가가 60년대 내내 1배럴에 1달러의 헐값이 유지되었다. 경제성장은 이같은 요인에 의한 종합적인 성과였다. 얼마 전 김재규 재판을 담당했던 양병호 전 대법원..."
2876,2019.04.24.,[뉴욕증시] 기업 실적 '굿' S&P500-나스닥 최고치,S&P500 지수 일간 추이 [출처=인베스팅닷컴] 이란에 대한 원유 수출 제재의 면제를 연장하지 않기로 한 트럼프 행정부의 결정에 국제 유가가 연일 상승하며 신흥국을 포함한 자산시장에 파장을 일으켰지만 뉴욕증시의...
2877,2019.04.23.,"""반갑다! 해양플랜트""…대형 프로젝트 줄줄이 '대기중'","조선업계 관계자는 ""국제 유가 호조세 등에 힘입어 해양플랜트 발주가 드디어 나오기 시작했다""며 ""이번 삼성중공업의 수주가 그동안 해양플랜트 부문 부진으로 고심했던 조선사들에게 활력을 불어넣을 수 있을 것..."
2878,2019.04.12.,3월 수출물가 상승률 8개월만에 '최고',원·달러 환율과 국제유가 동반 상승의 영향으로 풀이된다. 자료=한국은행 한국은행이 12일 발표한 '2019년 3월 수출입물가지수'를 보면 지난달 수출물가지수(2010년=100·원화 기준)는 83.36으로 한 달 전보다 0.5...
2879,2019.04.26.,동남아항로/ 운임인상 반쪽에 그쳐…화주반응 ‘싸늘’,하지만 최근 국제유가가 급상승해 선사들이 향후 유류비를 별도 요구할 가능성도 제기된다. 올들어 국제유가는 50달러대까지 곤두박질쳤지만 최근 70달러선에 거래되고 있다. 3분기 플로팅 FAF는 전 분기 국제유가를...
2880,2019.04.19.,3월 생산자물가 0.3% 올라,국제유가 상승 영향 생산자물가 상승세가 두 달째 이어졌다. 한국은행이 19일 발표한 '2019년 3월 생산자물가지수'에 따르면 지난달 생산자물가지수는 104.14로 2월에 비해 0.3% 올랐다. 국제유가가 반등하면서...
2881,2019.04.23.,11시 생활경제뉴스,"- 이란산 원유의 수출길이 막히면서 국제유가가 3% 안팎으로 급등했습니다. 현지시간 22일 뉴욕상업거래소에서 5월 인도분 서부 텍사스산 원유는 전 거래일보다 배럴당 2.7%, 1.7달러 오른 65.70달러에 거래를 마쳤습니다...."
2882,2019.04.23.,"삼성重, 5년여 만에 1조 넘는 초대형 FPSO 수주",추가 FPSO 수주도 기대된다. 국제유가가 오름세를 보이고 있으며 기업들의 원유 생산 원가가 낮아졌기 때문이다. 삼성중공업은 현재 바로사 FPSO 등 다수의 해양 프로젝트에 참여하고 있다./ 이비앤
2883,2019.04.29.,[손바닥경제] 삼겹살에 ‘소주 한 잔’도 무섭다…이젠 휘발유값도 꿈틀,두 번째는 국제유가 상승입니다. 일일 기준 지난해 12월 배럴당 50달러 아래(49.52달러)로 떨어졌던 두바이유 가격은 이달 들어 70달러 수준까지 올라와 있습니다. 현재 석유수출국기구(OPEC )6월 말까지 하루평균 산유량...
2884,2019.04.29.,"미국 GDP, 아시아에서는 분위기 돌변... 원화환율 하락, 엔화환율 상승","국제유가, 트럼프 증산 요구 영향으로 하락 미국 연방준비제도(Fed) 이사회의 30~5월1일 연방공개시장위원회(FOMC) 회의를 앞둔 가운데 일본 금융시장은 일주일동안 휴장에 들어갔다. 미국의 3% 넘는 경제성장률이..."
2885,2019.04.18.,2019년 1분기(1월~3월) 중소기업 수출동향,"‘19.1분기 품목별 주요 수출 동향 □ 상위 10대 품목 중 반도체, 합성수지 등 4개 품목은 수출이 감소하였으나, 플라스틱 제품, 화장품 등 6개 품목이 수출 증가 ㅇ 합성수지(9.2억달러, △12.0%): 국제유가..."
2886,2019.05.03.,"FOMC 후폭풍, 미국증시 연일 강타...MS · 캐터필라 · 디즈니 · FAANG 마저...",미국 원유재고부담 가중 속에 이날 미국산 국제 유가가 3% 이상 곤두박질 치면서 S&P500 지수군 내 에너지 섹터의 주가가 1.71%나 추락한 것도 미국증시 하락 요인이었다.
2887,2019.04.17.,[원유마감] 유가 상승…원유 재고 관망 속 저가 매입,국제유가가 16일(현지시간) 상승했다. 투자자들이 주간 원유재고 소식을 기다리는 가운데 전날 일주일여 만의 최저치를 기록한 후 반등했다. WTI 선물은 배럴당 65센트(1.0%) 상승한 64.05달러를 기록했다. 브렌트유는...
2888,2019.04.20.,휘발윳값 9주 연속 상승…전국 평균 1천423.1원 '14.8원↑',"석유공사는 ""국제유가는 미국 원유재고 감소, 리비아 정정불안 지속 등의 영향으로 상승했지만, 러시아의 하반기 증산 가능성 등이 상승 폭을 제한했다""면서 ""국내 제품가격은 최근 국제유가 상승의 영향으로..."
2889,2019.04.30.,中 경기회복 의구심 계속되는 이유…계절성ㆍ일회성 회복 탓,작년 말 국제유가 역시 하락하면서 수입 가격도 낮아졌다. 결국 일회성 요인들이 합쳐서 수출 지표가 매우 긍정적으로 나온 것으로 이런 상황이 다시 반복되기는 어렵다고 WSJ은 말했다. 투자와 소비는 계속 활력을 잃고...
2890,2019.05.02.,[Biz 브리프] 애플 분기 실적 '선방' 외,유가 재고증가에 약세 국제유가는 약세를 보였다. 1일 뉴욕상업거래소에서 6월 인도분 서부 텍사스산 원유(WTI)는 배럴당 0.5%(0.31달러) 내린 63.60달러에 거래를 마쳤다. 미국의 원유 재고가 큰 폭 증가하면서...
2891,2019.04.13.,"전국 휘발유 가격 8주 연속 상승...서울, 1500원 돌파",정부의 유류세 인하와 국제유가 하락으로 지난해 10월 다섯째 주부터 15주 연속 하락했던 전국 보통 휘발유 값은 2월 셋째 주부터 상승으로 전환해 8주째 상승세를 이어오고 있다. 전국 평균 경유 가격도 휘발유와...
2892,2019.04.22.,"""미국, 한국 등 8개국 이란산 원유 제재 예외 연장 안할 것""","국제유가는 지난해 하반기 공급과잉 논란 속에 급락했다가, 올해 들어 석유수출국기구(OPEC)·비OPEC 주요 산유국 감산과 일부 산유국의 정정 불안 등으로 30∼40% 급등하는 등 롤러코스터를 탔습니다. ▶샛별들의 전쟁..."
2893,2019.04.15.,"""중앙아시아 중심 카자흐스탄, 기계, 인프라, 서비스 경제 협력 유망""","무역협회 국제무역연구원 김현수 수석연구원은 ""11만 고려인이 거주하는 카자흐스탄은 문화, 경제 등 다방면에서 우리와 협력할 여지가 많다""면서 ""다만 국제 유가 등락에 따른 경기 변동성이 크고 중국과 러시아에 대한..."
2894,2019.04.14.,OPEC 3월 감산 이행률 135%…국내 기름값도 한동안 오른다,휘발유·경유 등 제품 가격 8주 연속 상승 3월 국제유가 지속 상승해 국내에 영향 5월 유류세 완화 폭 줄면 기름값↑ 불가피 이행률 228% 사우디 “연말까지 감산 희망” 주유소에서 판매하는 휘발유·경유 가격이 8주...
2895,2019.04.12.,"기재차관 ""경유세 인상 검토하고 있지 않다""",▶지난해 10월말에 국제유가가 높았으나 이후 유가가 예상외로 빨리 떨어졌다. 지금은 두바이유 기준 배럴당 70달러 수준이다. 국내 휘발유 가격은 평균 1410원 정도 수준이다. 최근 유가 흐름 감안해서 한꺼번에 환원했을...
2896,2019.04.17.,"다가오는 이란 원유제재 예외만료…""연장없인 석유화학업계 타격""","아울러 국내 석유화학 산업에 쓰이는 원유는 전량 수입에 의존하기 때문에 유가는 해당 산업의 가격경쟁력과 직결된다며, 최근 리비아 사태 등 국제유가가 불안한 가운데 저렴한 원유 공급처의 중요성이 높아지고 있다고..."
2897,2019.04.25.,(돈되는 스몰캡 돋보기)대형항공사 난기류 맞닥뜨린 사이 제주항공 비상 준비,국제유가 상승에도 끄떡없는 제주항공 최근 항공업계는 국제유가 움직임에 예의주시하고 있다. 미국이 이란산 원유 수출을 전면 봉쇄하겠다고 발표한 뒤 유가가 이틀째 크게 상승하고 있어서다. 국내 LCC 업체들의...
2898,2019.04.23.,"코스닥, 보합권 출발후 하락…외국인 매도",미국의 이란산 원유 수입 금지 조처에 따른 국제유가 상승 등으로 투자 심리가 관망세를 보이는 영향으로 풀이된다. 마켓포인트에 따르면 이날 오전 9시15분 현재 코스닥 지수는 전 거래일보다 0.01%(0.08포인트)...
2899,2019.04.18.,"경제성장률 0.1%p 하향 조정…""수출‧투자 예상보다 부진""","최저임금 인상 등의 영향이 있지만, 국제유가가 지난해보다 낮고 수요 압력이 높지 않다는 점에서다. 다만 정부의 유류세 인하조치 종료 등으로 물가 상승률은 상반기 0.7%에서 하반기 1.4%로 높아지고..."
2900,2019.04.25.,"홍남기 ""올해 2.6% 성장 위해 총력…환율 적기 대응할 것""","국제유가 전망에 대해서는 ""시장의 우려만큼 유가가 급등하지는 않을 것""이라며""사우디와 미국 셰일가스 등이 증산할 것이라는 전망과 함께 세계 성장세가 둔화하면서 원유에 대한 수요도 예상보다 줄어드는 측면이..."
2901,2019.04.16.,"""2조 원 이상 필요""…'아시아나' 어디로?",항공 산업은 국제 유가와 환율 변동에 따른 위험성이 큰 사업이라 부담도 큽니다. 그래서 현재 지분 약 12%를 갖고 있는 '형제 기업' 금호석유화학도 3천억원 정도를 투자하면 일단 경영권 확보가 가능하다는 점에서 후보로...
2902,2019.04.24.,트럼프 이란 압박 ‘나비효과’ 대선 제발등 찍는다,"핵 협정 파기와 함께 이란 제재에 나선 트럼프 행정부는 국제 유가 급등을 우려, 지난해 11월 한국과 중국을 포함한 8개 국가에 대해 이란 원유 수입을 한시적으로 허용했지만 내달 2일부터 이를 종료하기로 결정한 데 따른..."
2903,2019.04.25.,"에쓰오일 ""장사는 잘 했는데 순이익이 그만...""",영업이익 2704억…석유화학부문 호조로 전년比 6.2% ↑ 강 달러로 환차손 3000억원 타격 에쓰오일이 지난 1분기 국제 유가 회복으로 양호한 실적을 냈다. 다만 급격한 환율 상승으로 순이익은 전년동기 대비 40...
2904,2019.04.13.,살아 생전 화해 못한 한진家 형제...그룹 경영권 위기에 나설까,널뛰는 국제유가 속에서도 다양한 경영쇄신 작업을 통해 지난해에는 사상 최대 매출을 기록했다. 하지만 조양호 회장 일가의 잇따른 일탈 행위로 국민의 신뢰를 크게 잃게 됐으며 이는 토종 행동주의 사모펀드인 KCGI에...
2905,2019.04.13.,"전국 휘발유-경유 가격, 8주째 상승 곡선...LPG는 소폭하락",그동안 휘발유와 경유가격은 지난 해 11월 정부의 유류세 인하 정책과 함께 국제유가 하락이 맞물리며 줄곧 하락곡선을 이어가다가 국제 유가가 서서히 오르고 있음에 따라 8주째 상승세다. 상승폭도 지난 주 9....
2906,2019.04.26.,[해외시황] 3M 어닝쇼크에 혼조세유럽↓,이런 가운데 국제유가는 이틀 연속으로 하락했다. 이날 뉴욕상업거래소(NYMEX)에서 6월 인도분 서부텍사스산원유(WTI)는 배럴당 1.03%(0.68달러) 내린 65.21달러에 거래를 마쳤다. WTI는 전날에도 0.6%(0.41달러) 하락한 바...
2907,2019.04.12.,"하이투자證 ""SK이노베이션, 실적부진보다 방향성 바라봐야""","이어 ""지난해 4분기 대비 국제유가 상승 및 정제마진 개선은 긍정적이지만 총평균법으로 인해 4분기 국제유가 하락에 따른 원유재고평가손실이 1분기에 인식됨에 따라 실적 개선폭이 제한될 것""이라고 분석했다...."
2908,2019.04.22.,주요 광물價 전주비 0.8% ↑,"유연탄은 국제유가 회복 및 인도의 수입수요 증가에 따른 상승세를 보이고 있다. 연료탄은 전주대비 5.1% 상승한 톤당 83.91달러를 기록했고, 원료탄은 전주대비 1.2% 상승한 톤당 205.95달러를 기록했다. 연료탄은..."
2909,2019.04.15.,"""신북방 진출, '케이스 바이 케이스'로 접근해야""",무역협회는 카자흐스탄이 △의료 서비스 △헬스케어 △에너지 인프라 △첨단기술 등에도 관심이 높지만 진출시 국제 유가 등락에 따른 경기 변동성 및 중국·러시아에 대한 경제 의존도가 높은 점은 경계할 필요가...
2910,2019.04.26.,"기재부 “韓 경제, 매우 엄중…6월 추가 대책 발표”",이 차관은 “최근 국제유가가 70불대로 상승하면서 기업 및 서민의 부담 증가가 우려된다”며 “미국의 대(對)이란 제재 예외 인정 불가 발표가 우리 경제에 미치는 영향을 최소화하기 위해 원유 수입선 다변화...
2911,2019.04.12.,3월 수출물가 두달째 상승…전월비 0.5% 올라,"국제유가 상승 영향으로 석탄 및 석유제품 가격 상승에 따른 영향으로 보인다. 한국은행이 12일 발표한 '2019년 3월 수출입물가지수' 자료를 보면 3월 수출물가는 석탄 및 석유제품, 화학제품 상승 영향으로 전월보다 0...."
2912,2019.04.16.,이집트 가세… 더 꼬이는 리비아 사태,아프리카 최대 산유국인 리비아 내전 사태로 불이 붙은 국제 유가 상승세도 이어지고 있다. 리비아 내 무력충돌이 발생한 후 올해 처음으로 70달러를 돌파한 영국 런던 ICE 선물거래소의 브렌트유 가격은 15일 71달러 선을...
2913,2019.04.24.,"에쓰오일, 1분기 영업익 2704억…흑자전환",영업이익은 작년 연말부터 지속된 국제유가 상승에 따른 재고 관련 이익(2000억원)과 파라자일렌 등 고부가가치 석유화학 제품의 견조한 스프레드에 힘입어 흑자 전환했다. 정유 부문은 글로벌 정유사들의 높은...
2914,2019.04.12.,"유류세인하 4개월 연장, 인하폭은 축소",최근 다시 국제유가가 상승흐름을 보이면서 가계부담은 한층 높아질 전망이다. 내일신문은 이미 지난 2월 19일자에서 '정부가 유류세 인하 연장을 검토하고 있다'고 보도한 바 있다. ◆국제유가·가계부담 종합고려...
