,날짜,제목,요약
982,2020.05.18.,"세계증시와 유가, 미국·유럽 경제활동 재개에 상승", 코로나19(COVID-19) 팬데믹(세계적 대유행)이 아직 진행 중임에도 불구하고 미국과 유럽에서 봉쇄조치가 부분적으로 완화되면서 18일 세계증시와 국제유가가 상승하고 있다. 미국과 유럽의 코로나19 확산 기점이 된...
983,2020.05.15.,"한국전력 영업이익 4306억...3년만의 1분기 흑자, ""국제유가 하락 영향""","국제유가 하락이 실적에 영향을 미친 것으로 분석된다. 한국전력은 ""재무개선을 계속 추진하고 지속가능한 전기요금 체제를 마련하겠다""고 밝혔다. 이날 한국전력은 ""국제 연료가 하락에 따라 연료비·구입비는 1조 6..."
984,2020.05.12.,아마존 넷플릭스 상승에 나스닥 강세…유가는 하락,국제유가는 하락세로 돌아섰다. 이날 뉴욕상업거래소에서 6월 인도분 서부 텍사스산 원유(WTI)는 배럴당 2.4%(0.60달러) 하락한 24.14달러에 거래를 마쳤다. 런던 ICE 선물거래소의 7월물 브렌트유는 오후 4시 기준...
985,2020.05.15.,"뉴욕증시,경제재개 기대 다우지수 1.62%↑...국제유가 WTI 9% 급등","뉴욕증시,경제재개 기대 다우지수 1.62% 상승...국제유가 WTI 9% 급등  미국 뉴욕증시는 신종 코로나바이러스 감염증(코로나19) 재확산 우려에도 경제 활동 재개 기대감에 다우등 3대 주요지수가 상승 마감했다...."
986,2020.05.27.,국제 유가 오르고 & 미국증시 장중 에너지 섹터 급등...호재는?,26일(미국시간) 국제 유가가 장중 상승세를 나타냈다. 장중 미국증시 에너지 섹터의 주가는 급등했다. 블룸버그 집계에 따르면 이날 뉴욕상업거래소에서 미국 동부시각 오후 2시 01분 기준 7월물...
987,2020.05.19.,국제유가 일제히 급등 … 코로나19 백신 기대감 고조,신종 코로나바이러스 감염증(코로나19) 백신 기대감에 국제유가가 일제히 급등했다. 18일(현지시간) 미국 서부 텍사스원유(WTI) 6월 인도분 선물은 전장 대비 2.39달러(8.1%) 오른 배럴당 31.82달러를 기록했다. 3월 11일...
988,2020.05.21.,20일 국제유가 상승,"95달러에 마감됐다. 한국석유공사는 20일 국제유가는 미 원유재고 감소, 미 연준 경기부양 의지 등으로 상승했고, 코로나19 2차 확산 가능성에 따른 경기침체 장기화 우려 등은 상승폭을 제한했다고 전했다."
989,2020.05.29.,美 원유재고 폭증에도 국제 유가는 왜 급등?...미국증시 장중 양대 정유주는 ...,28일(미국시간) 국제 유가가 장중 껑충 뛰었다. 이날 발표된 미국의 원유재고가 크게 늘었는데도 유가가 치솟아 눈길을 끌었다. 다만 장중 주요 정유주들은 하락했다. 블룸버그 집계에 따르면 이날 미국 동부시각...
990,2020.05.28.,美-中 갈등 속...국제 유가 '폭락' vs 미국증시 에너지 섹터 '장중 상승',"국제유가는 미국-중국 갈등과 석유 수요 회복 여부에 대한 우려로 아시아시장에서 하락했다. 그런데 이날 런던, 뉴욕시장에 이르러 유가 하락폭이 더욱 커졌다. CNBC에 따르면 FED(미국 연방준비제도, 연준)는 에너지..."
991,2020.05.29.,"트럼프, 中관련 회견 예고...국제 유가 '상승폭 축소' & 미국증시 에너지주 '...",28일(미국시간) 국제 유가가 장중 급등세를 보이다가 미국증시 마감 무렵에는 유가 상승폭도 작아졌다. 트럼프 미국 대통령이 중국관련 기자회견을 예고한 가운데 미-중 긴장이 다시 고조되면서 유가가 상승폭을...
992,2020.05.18.,"5월 2주차 국제 유가, 산유국 감산 ↑",5월7일부터 5월14일까지의 국제유가가 주요 산유국들의 추가 감산 계획에 상승했다. 한국석유공사 석유동향팀은 15일 ‘유가정보서비스 오피넷’을 통해 ‘2020년 5월 2주 주간 국제유가동향’을 발표했다....
993,2020.05.14.,"한국가스공사, 저유가로 2분기 적자전환 전망…목표가↓-유진",황성현 유진투자증권 연구원은 “주요 프로젝트의 생산량 증가에도 국제유가 하락으로 손익이 악화됐다”며 “주바이르와 미얀마에서의 사업은 전년 대비 이익을 기록했지만 이라크 바드라의 유전개발과 호주...
994,2020.05.15.,국제유가 반등 WTI 9% 급등… 6주만에 최고,국제유가가 6~9%대로 급반등했다. 미국 원유재고가 4개월 만에 처음으로 감소한 데 이어 국제에너지기구(IEA)가 하반기 공급 감소를 전망한 덕분이다. 14일(현지시간) 미국 서부텍사스원유(WTI) 6월 인도분 선물은...
995,2020.05.20.,최악의 저유가 대란…드러난 '정유 실력차',지난 4월 일부 상품이 마이너스(-)까지 떨어지는 기현상을 보인 국제유가는 1~3월 하루가 다르게 급락했다. 우리나라 정유업계가 주로 들여오는 두바이유의 경우 배럴당 65.4달러로 올해를 시작했지만 3월말 23....
996,2020.05.21.,"4월 생산자물가, 석 달 연속 하락세…유가 급락 영향",신종 코로나바이러스 감염증(코로나19) 확산으로 국제유가가 폭락한 영향이다. 한국은행이 21일 발표한 '2020년 4월 생산자물가지수'에 따르면 지난달 생산자물가는 102.08(2015년=100)로 전월 대비 0.7% 하락했다. 지난...
997,2020.05.15.,유가 9% 급등에 정유주 일제히 강세,"국제 유가 급등에 정유주가 일제히 강세를 보이고 있다. 15일 오전 9시 51분 S-Oil은 전 거래일 대비 1600원(2.5%) 오른 6만5700원에 거래되고 있다. SK이노베이션과 GS는 각각 0.75%, 0.68% 강보합세를 보이고 있다...."
998,2020.05.13.,[국제유가] 산유국 자발적 추가 감산 계획에 12일 유가 상승,"원유 및 가스의 연간, 월간 가격 변동 현황 12일 국제유가는 OPEC+ 감산규모 유지 가능성, 주요 산유국 자발적 추가 감산 계획 발표 등으로 상승했지만 미국 에너지정보청인 EIA의 세계석유수요 전망 하향 등은..."
999,2020.05.17.,[국제유가] 석유수요 회복 전망에 15일 유가 상승,"국제유가의 일일 변동 현황. 15일 국제유가는 석유수요 회복 전망, 중국 원유소비 증가 등으로 상승했다. 한국석유공사(사장 양수영)는 서부 텍사스산 원유인 WTI가 전일대비 배럴당 1.87달러 상승한 29.43달러에..."
1000,2020.05.20.,석화·정유 희비 갈리나…유가급등 속 제품가 상반,각국 경제활동 재개로 수요 확대에 대한 기대감이 불거지면서 국제유가 상승세가 이어지고 있다. 20일 한국석유공사 유가정보서비스 오피넷에 따르면 지난 19일 기준 미 서부텍사스산원유(WTI)는 배럴당 32.50달러로...
1001,2020.05.14.,국제유가 하락 …미국 예상외 재고 감소에도 비관론 득세,국제유가가 내렸다. 13일(현지시간) 미국 서부텍사스원유(WTI) 6월 인도 선물은 전장 대비 0.49달러(1.9%) 내린 배럴당 25.29달러를 기록했다. 영국 북해 브렌트유 7월물은 0.79달러(2.6%) 하락한 배럴당 29.19달러로...
1002,2020.05.14.,"한전, 저유가에 1분기 흑자전환 기대감 ‘솔솔’",한국전력이 올해 1분기 실적 발표를 앞둔 가운데 국제유가 급락으로 흑자전환을 할 것이라는 전망이 나온다. 14일 금융감독원 전자공시를 보면 한전은 오는 15일 연결 재무제표 기준 1분기 실적을 공시할 계획이다....
1003,2020.05.20.,[국제유가]WTI 2% 상승…감산 움직임 + 수요회복 기대,"주요 산유국들의 감산 움직임과 각국 경제 재개에 따른 수요회복 기대가 유가를 끌어올린 덕분이다.... 덕분에 유가가 반등세를 나타내고 있다""고 평가했다. 씨티그룹은 ""2분기에 원유시장을 압박하던 공급과잉이..."
1004,2020.05.19.,"에쓰오일 SK이노베이션 GS 주가 초반 상승, 국제유가 30달러 회복",국제유가가 6월물 만기를 앞두고 30달러선을 회복하면서 매수세가 몰리고 있다. 에쓰오일 로고. 19일 오전 10시5분 기준 에쓰오일 주가는 전날보다 7.93%(5300원) 높아진 7만2100원에 거래되고 있다. SK이노베이션...
1005,2020.05.17.,유가 폭락에 두번 운 항공업계…유가헤지 했다가 되레 손실,대한·제주항공 손실 이중고 대한항공과 제주항공이 국제유가 폭락에 올 1분기 적잖은 손실을 본 것으로 드러났다. 항공사는 유가 하락 시 대표 수혜 업종이지만 대한항공과 제주항공의 경우 '유가 헤지(위험 회피)...
1006,2020.05.14.,"""한국가스공사, 국제유가 반등 절실...목표주가↓""-하이투자",하이투자증권은 14일 한국가스공사에 대해 국제유가 반등이 이뤄져야 투자 센티멘트도 개선될 것으로 보인다며 투자의견 매수를 유지하고 목표주가는 4만원에서 3만3000원으로 하향 조정했다. 원민석 하이투자증권...
1007,2020.06.08.,"산유국 감산에 국제유가 상승, 언제까지 이어질까?",OPEC+ 소속 23개 산유국이 6일(현지시간) 기존의 감산 정책을 연기하기로 결정하면서 국제유가 상승세가 이어지고 있다. 실제로 뉴욕상업거래소(NYMEX)에 따르면 서부텍사스산원유(WTI)는 전날 대비 5.7% 급등한 39달러...
1008,2020.05.15.,"한전, 1분기 영업익 4306억…저유가 속 3년 만에 반짝 흑자",정부의 신재생에너지 확대 정책에 따라 지난해까지 1조2765억원의 영업 적자를 냈던 한전은 국제유가 폭락에 따른 수혜로 '반짝 흑자'에 성공했다. 올 1분기 전기판매수익은 겨울철 난방수요 감소와 신종...
1009,2020.05.20.,"국제유가 30달러대 벗어날까?…""탱크톱 아닌 셰일이 문제""",윤은숙 국제경제팀 팀장 kaxin@ajunews.com 국제유가가 30달러 대로 다시 접어들었다. 경제 재개로 수요 회복이 예상되어서다. 다만 추가 상승에 대해서는 비관적인 시선이 더 많다. 미국 내 운행 중인 원유시추기 수는 9주...
1010,2020.05.15.,"[특징주] 원유주, 국제유가 급등에 강세","원유주가 국제유가 급등 소식에 장 초반 강세다. 15일 오전 9시 6분 현재 S-Oil은 전 거래일 대비 2,200원(3.43%) 오른 6만6,300원에 거래 중이다. 같은 시각 흥구석유(4.28%)와 SK이노베이션(1.82%) 등도 상승..."
1011,2020.05.13.,"뉴욕증시,미·중 갈등 다우1.89%↓나스닥지수 2.06%↓...국제유가 WTI 6.8%↑","뉴욕증시,미·중 갈등 다우 1.89%↓나스닥지수 2.06%↓...국제유가 WTI 6.8%↑  뉴욕증시는  신종 코로나바이러스 감염증(코로나19) 책임을 둘러싼 미국과 중국의 갈등 고조 여파로 다우등 3대 주요지수가..."
1012,2020.05.29.,[주식] SH에너지화학(+3.94%) 장중 깜짝 매수세에 주가 급등... 국제유가 안정...,국제유가 안정세에 상승세 계속될까? 연합뉴스 제공 SH에너지화학이 장중 갑작스런 매수세에 주가가 급등중이다. SH에너지화학은 이후 하락폭을 키우며 29일 오후 13:13분 기준 전일대비 +3.82%(34원) 상승한 923원에...
1013,2020.05.12.,"[국제유가] 추가 감산에도 이어지는 하락세… WTI, -2.4%","11일(현지시간) 국제유가는 사우디아라비아를 비롯한 주요 산유국의 추가 감산 계획, 카자흐스탄의 감산합의 이행 가능성 고조 등 호조에도 신종 코로나바이러스 감염증(코로나19) 2차 확산 우려로 하락했다. 이날..."
1014,2020.05.21.,21일 1249 유가 전일비 +0.35원 상승세,"국내 휘발유 가격이 국제 유가와 유류세 효과 등으로 가격 상승세를 보였다. 한국석유공사 유가 정보 서비스인 '오피넷' 에 따르면, 이달 21일 보통 휘발윳값은 +0.35원 리터당 1249.64원으로 집계됐다...."
1015,2020.05.12.,[국제유가]사우디 추가 감산에도 WTI 2.4%↓,사진=연합뉴스 [세계비즈=주형연 기자] 11일(현지시간) 뉴욕상업거래소(NYMEX)에서 6월 인도분 서부 텍사스산 원유(WTI)는 배럴당 2.4%(0.60달러) 하락한 24.14달러에 거래를 마쳤다. 런던 ICE 선물거래소의 7월물...
1016,2020.05.14.,"국제 유가, 사우디와 러시아의 유가 안정 합의에도 이틀 연속 하락","WTI, 1.9% 하락, 브렌트유는 0.27% 올라 국제유가가 이틀 연속 내림세로 돌아섰다. 사우디와 러시아가 유가 안정 의지를 다짐했지만 상승시키기에는 역부족이었다. 13일(현지시간) 뉴욕상업거래소(NYMEX)에서 WTI(서부..."
1017,2020.05.15.,국제유가 출렁출렁…이번엔 감산 먹혔다,국제유가가 14일(현지시간) 급등세로 돌아섰다. 전날 미국 원유재고가 16주 만에 처음으로 감소한 것으로 나타난 데 이어 주요 산유국의 하반기 감산규모도 커질 것이란 전망이 나왔다. 이날 미국...
1018,2020.05.14.,전세계 원유 수요 '뚝' 마이너스 유가 경고,영국 파이낸셜타임스(FT)에 따르면 미 상품선물거래위원회(CFTC)는 원유 업계 브로커와 선물 옵션 결제소 및 트레이더들에게 지난달에 이어 국제 유가가 재차 마이너스 영역으로 떨어질 가능성에 대비해야 한다고...
1019,2020.05.13.,12일 국제유가 상승,"93달러에 마감됐다. 한국석유공사는 12일 국제유가는 OPEC 감산규모 유지 가능성, 주요 산유국 자발적 추가 감산 계획 발표 등으로 상승했고, EIA의 세계석유수요 전망 하향 등은 상승폭을 제한했다고 전했다."
1020,2020.05.15.,"IEA ""원유수요 회복 중"" 의견에 국제유가 일제상승",국제유가는 국제에너지기구(IEA)가 원유수요가 회복 중이라는 의견을 밝히면서 일제히 상승했다. 특히 북해산 브렌트유는 30달러를 넘어섰으며 두바이유는 30달러에 육박했다. 한국석유공사에 따르면 14일 북해산...
1021,2020.05.15.,"低유가 덕 본 한전, 판매수익 감소에도 흑전 성공","이런 악재에도 한전은 지난해 말 이후 국제유가 급락 덕에 흑자전환이 가능했던 것으로 분석된다. 연료 단가 하락으로 연료비가 9000억원 감소했고, 전력비 구입량도 8.4%가 늘었다. 구입단가는 예년보다 떨어져..."
1022,2020.05.19.,"국제유가 급등해 배럴당 30달러선 회복, 코로나19 백신 개발 기대감",국제유가가 급등하며 배럴당 30달러 선을 회복했다. 18일 뉴욕상업거래소(NYMEX)에서 6월 인도분 서부텍사스산 원유(WTI)는 전날보다 배럴당 8.12%(2.39달러) 오른 31.82달러로 거래를 마쳤다. 국제유가가 급등했다....
1023,2020.05.15.,안전운임제 연착륙 … 유가보조금 폐지해야 하나?,이 같은 움직임은 최근 국제유가의 급격한 하락으로 육상운송 물류시장에선 운송사와 일선 화물 차주들에게 애초 의도했던 유가보조금의 실익 감소 때문이다. 물론 유가보조금이 운송업 종사자들의 경영수지를 개선하고...
1024,2020.05.21.,국제유가 급등... 원화환율·엔화환율·위안화환율 상승,2229 달러로 0.13% 절하됐다. 국제유가는 공급과잉 완화 전망으로 아시아시장에서 급등했다. 북해산 브렌트유 7월물은 배럴당 36.56 달러로 2.27% 올랐고 미국산원유 7월물은 34.34 달러로 2.54% 상승했다.
1025,2020.05.19.,"모든 항공권 유류 할증료, 저유가 영향 내달도 ‘0원’","18일 항공업계에 따르면 국제유가 하락으로 국제선과 국내선 모두 다음 달 유류 할증료는 ‘0원’이 적용된다. 국제선은 3개월, 국내선은 2개월 연속 유류 할증료가 항공료에 붙지 않는 것이다.유류 할증료는 싱가포르..."
1026,2020.05.30.,"[상보] 국제유가, 급등…WTI, 5월 88% 폭등·역대 최대 상승",이투데이=배준호 기자 | 국제유가는 29일(현지시간) 급등했다. 뉴욕상업거래소(NYMEX)에서 7월 인도분 서부 텍사스산 중질유(WTI)는 전일 대비 1.78달러(5.3%) 급등한 배럴당 35.49달러에 마감했다. 런던 ICE선물거래소에서...
1027,2020.05.19.,18일 국제유가 상승,"96러 상승한 배럴당 32.90달러에 마감됐다. 한국석유공사는 18일 국제유가는 코로나19 백신 조기개발 가능성, 경제활동 재개 낙관, 석유 생산량 감소 기대 등으로 상승했다고 전했다."
1028,2020.05.21.,"미국 등 경기회복 기대...국제 유가 '뛰고' & 유럽증시 '급등', 미국증시 '장...","경기회복 기대 속에 국제 유가가 껑충 뛴 것도 증시에 긍정 영향을 미쳤다. 유럽 주요국 증권거래소와 미국 경제방송 CNBC에 따르면 이날 유럽 금융중심지 영국 런던의 FTSE100 지수는 6067.16으로 1.08%, 독일 DAX..."
1029,2020.06.10.,"[글로벌-Biz 24] 브리티시 페트롤리엄, 유가 하락으로 일자리 1만개 삭감","국제 유가 기준인 브렌트유 선물은 4월 들어 배럴당 20달러 아래로 떨어지는 등 수십 년 만에 최저치를 기록했다. 감산을 통해 재기를 시도, 배럴당 42달러를 상회하는 회복세를 보였지만 여전히 낮은 수준이다. 올해 초..."
1030,2020.05.12.,"'디플레' 먹구름 끼나…KDI ""국제유가 하락폭 확대로 하방 압력""",다만 국제유가 하락이 앞으로 인플레이션에 추가적인 하방 압력으로 작용할 수 있다고 경계했다. 우리 경제와 관련해선 석달 연속으로 경기 위축이 심화하고 있다고 진단했다. 아직 '부진'이란 표현을 쓰진 않았다....
1031,2020.05.11.,"GS칼텍스, 1분기 영업손실 1조318억원…코로나·유가 급락 '직격탄'","GS칼텍스가 코로나와 국제유가 폭락 여파로 올해 1분기 영업손실 1조원대를 기록했다. GS는 자회사인 GS칼텍스의 연결 기준 1분기 영업손실이 1조318억원, 매출은 7조715억원, 당기순손실은 1조153억원이라고 11일..."
1032,2020.05.11.,한은 “저유가 장기화 시 미국 셰일 업계 줄도산 우려”,한은은 국제유가가 셰일 업체 손익분기 수준을 크게 밑돌고 있다고 설명했다. 지난 8일 기준 서부텍사스유(WTI)는 배럴당 24.74달러에 그쳤다. 셰일 업체가 마진을 남길 수 있는 유가 마지노선은 배럴당 50달러 내외다.지난...
1033,2020.05.13.,"코로나 불똥 튄 석유화학주, 2분기에도 저유가 수혜 힘 받나","국제유가 하락은 원유 부산물인 나프타 가격 하락으로 이어진다. 이로 인해 원재료인 납사와 제품인 폴리에틸렌(PE)·폴리프로필렌(PP) 가격 차, 즉 스프레드가 벌어지면서 마진율이 개선되고 있는 것이다. 여기서..."
1034,2020.05.15.,[국제유가] IEA 수요회복 전망에 14일 유가 상승,14일 국제유가는 국제에너지기구인  IEA의 수요 회복 전망 및 미국 재고 감소 등의 영향으로 인해 상승세를 나타냈다. 한국석유공사(사장 양수영)는 서부 텍사스산 원유인 WTI가 전일대비 배럴당 2.27달러 상승한 27....
1035,2020.05.25.,"[더벨][정유업 리포트]유가전쟁·코로나19, 미증유의 위기…생존전략은",이는 국제유가 급락으로 정유 3사가 동시에 영업적자를 냈던 2014년 말 충격을 뛰어넘는 최악의 실적이다. 2014년 말 정유 4사는 현대오일뱅크(영업이익 136억원)를 제외하고 모두 적자를 기록했다. 빅3는 2014년 4분기...
1036,2020.05.21.,"[상보] 국제유가, 미 원유 재고 감소에 급등...WTI 4.8%↑",이투데이=김서영 기자 | 국제유가가 20일(현지시간) 미국 원유 재고 감소와 글로벌 수요 회복 기대감에 급등했다. 뉴욕상업거래소(NYMEX)에서 7월 인도분 서부 텍사스산 원유(WTI)는 전날보다 4.8%(1.53달러) 급등한 배럴당...
1037,2020.05.25.,[국제유가]WTI 2% 반락…미중 갈등격화 속 수요위축 우려,"22일(현지시간) 미국 서부텍사스원유(WTI) 선물 가격이 2% 하락, 배럴당 33달러에 머물렀다. 7거래일 만에 반락했다. 미국이 반대해온 홍콩 국가보안법 제정을 중국이 본격 추진함에 따라 미중 갈등 악화 우려가..."
1038,2020.05.14.,[국제유가]美 원유재고 감소에도 WTI 1.9%↓,사진=연합뉴스 [세계비즈=주형연 기자] 13일(현지시간) 뉴욕상업거래소(NYMEX)에서 6월 인도분 서부 텍사스산 원유(WTI)는 배럴당 1.9%(0.49달러) 하락한 25.29달러에 거래를 마쳤다. 런던 ICE 선물거래소의 7월물...
1039,2020.05.20.,20일 1248 유가 전일비 +0.01원 상승세,"국내 휘발유 가격이 국제 유가와 유류세 효과 등으로 가격 상승세를 보였다. 한국석유공사 유가 정보 서비스인 '오피넷' 에 따르면, 이달 20일 보통 휘발윳값은 +0.01원 리터당 1248.67원으로 집계됐다...."
1040,2020.05.15.,"유가 급등, WTI 27.56달러…원유 수요 회복 전망",국제유가는 원유 수요 회복 전망에 큰 폭으로 올랐다. 15일 한국석유공사에 따르면 14일(현지시간) 뉴욕상업거래소(NYMEX)의 미국 서부텍사스산원유(WTI) 가격은 전일 대비 배럴당 2.27달러 급등한 27.56달러로...
1041,2020.05.12.,"사우디, 6월엔 추가 감산...그럼에도 국제 유가는 하락",11일(미국시간) 국제 유가가 장중 하락했다. 블룸버그 집계에 따르면 이날 미국 동부시각 오후 2시50분 기준 뉴욕상업거래소에서 미국서부텍사스산원유(WTI) 6월물 가격은 배럴당 24.43 달러로 1.25% 하락했다. 같은 시각...
1042,2020.05.16.,국제유가 '수요회복 기대' 이틀째 급등…WTI 6.8%↑, 국제유가는 이틀째 급등세를 이어갔다. 15일(현지시간) 뉴욕상업거래소(NYMEX)에서 6월 인도분 서부 텍사스산 원유(WTI)는 배럴당 6.8%(1.87달러) 오른 29.43달러에 거래를 마쳤다. 전날에도 9.0%(2.27달러) 급등한 바...
1043,2020.05.12.,사우디 “OPEC+ 합의에 100만 배럴 추가 감산”…국제유가는 하락,사우디의 추가 감산 발표에도 이날 국제유가는 하락세를 기록했다.뉴욕상업거래소(NYMEX)에서 6월 인도분 서부텍사스산원유(WTI)는 배럴당 2.4%(0.60달러) 떨어진 24.14달러에 거래를 마쳤다. 런던 ICE 선물거래소의...
1044,2020.06.10.,"美 뉴욕 증시, FOMC 결과 주시 혼조 출발","범유럽지수인 스톡스(Stoxx)600 지수는 0.08% 올랐다. 국제유가는 하락했다. 7월물 서부텍사스산 원유(WTI) 가격은 전 거래일보다 1.69% 하락한 38.28달러에, 브렌트유는 1.60% 내린 40.52달러에 움직였다. [ ]"
1045,2020.05.11.,"GS, 코로나·유가파동 쇼크에 1분기 영업익 98.2%↓",GS가 핵심계열사인 GS칼텍스의 국제유가 폭락과 코로나19로 인한 수요부진이 겹쳐 대규모 재고평가손실이 발생함에 따라 1분기 실적 폭락이라는 직격탄을 맞았다. 일각에서는 작년 12월 취임한 허태수 회장의 성과를...
1046,2020.05.14.,"한전, ‘저유가시대’ 3년만에 흑자 전환 예고…전기요금 유가연동제 도입 적...",국제유가 급락으로 연료비용 부담이 대폭 줄었기 때문으로 분석된다. 통상 국제유가가 배럴당 1달러 하락할 때 한전의 연간 영업이익은 약 1000억원 이상 증가하는 것으로 알려졌다. 따라서 전문가들은 저유가시기에...
1047,2020.05.15.,'혼돈의 뉴욕증시' 다우지수 나흘만에 1.62%↑…국제유가 급등,국제유가는 큰 폭으로 올랐습니다. 이날 뉴욕상업거래소(NYMEX)에서 6월 인도분 서부 텍사스산 원유(WTI)는 배럴당 9.0%(2.27달러) 급등한 27.56달러에 거래를 마쳤습니다. 런던 ICE 선물거래소의 7월물 브렌트유는...
1048,2020.05.14.,"""한국가스공사, 결국 문제는 국제유가 하락…목표가↓""",원민석 하이투자증권 연구원은 “한국가스공사 주가 반등을 가장 크게 억누르고 있는 요인은 최근의 국제유가 하락”이라며 “국제유가 하락으로 2분기 해외자산 실적 악화와 연말 추가적인 손상차손 인식에 대한...
1049,2020.05.15.,[이항영의 오늘장 Key Point] 롤러코스터 타던 국제 유가 안정세 접어들까?,"타던 국제 유가 안정세 접어들까? - 생산 감축 일간 1,200만 배럴 수준으로 확대 - ""국제 유가 최악은 끝… 코너를 돌아섰다"" * 美 상승에 코스피도 훈풍 불까… 대응 전략은? - 불확실성에 대한 판단 기준은 각자 다를..."
1050,2020.05.15.,한전 “올해 원전비중 상승할 것…유가하락과 함께 실적에 긍정 영향”,국제유가 하락에 따른 원료비와 전력구입비 감소가 가장 큰 역할을 했다. 증권사는 한전이 올해 연간으로도 3조원 전후의 영업이익을 기록하며 3년 만에 흑자전환할 것으로 보고 있다. 한전은 특히 전기요금 현실화를...
1051,2020.05.13.,"피치, 올해 국가 디폴트 '사상 최대' 전망…""코로나·유가 하락 영향""",신종 코로나바이러스감염증(코로나19) 사태와 국제 유가 급락으로 인해 올해 채무불이행(디폴트) 상태에 빠지는 국가가 사상 최대 규모가 될 것으로 보인다고 12일(현지시간) 신용평가사 피치가 전망했다. 피치는 이날...
