,날짜,제목,요약
1943,2019.04.25.,"홍남기 ""성장률 2.6% 달성 총력…추가 추경 논의 적절치 않아""","국제유가 상승이 우리 경기에 미치는 영향에 대해서는 ""유가가 상승할 거라는 시장 시각도 있지만 한편으로는 사우디 등 증산 및 셰일 가스 증산 방침을 고려했을 때 시장 우려만큼 급등하지 않을 것으로 보인다""고..."
1944,2019.05.04.,"한국석유공사, 도내 기름값 가파른 '상승세'","국제 유가 상승의 영향으로, 도내 기름값이 가파른 오름세를 보이고 있는 것으로 나타났습니다. 한국석유공사에 따르면, 오늘 도내 리터당 휘발유 평균 가격은 전주보다 18원 오른 천472.66원으로, 서울과 제주, 인천..."
1945,2019.05.05.,"롯데케미칼, 석화 '왕좌의 게임' 1쿼터 승리…향후 전망은?","국제유가도 변수로 작용할 전망이다. 미국이 이란산 원유 수입 전면 중단 결정을 내리고 이란이 호르무즈해협 봉쇄 카드를 꺼내드는 등 갈등 심화로 국제유가가 상승세를 그렸으나, 사우디가 증산을 시사하면서 돌연..."
1946,2019.04.30.,기업 체감경기 좋아졌다…정유ㆍ화학 힘입어 2달 연속 개선,세부업종으로는 국제유가 상승 및 드라이빙 시즌을 맞아 계절적 수요가 증가한 영향으로 석유정제·코크스(83)가 24포인트 뛰었다. 원재료와 제품 판매 가격 격차가 커진 화학물질ㆍ제품(92)도 10포인트 올랐다....
1947,2019.05.02.,[뉴스텔링] 아시아나항공 인수전…기업들 입다문 속내,더구나 국제유가 상승과 원화 약세 등 글로벌 사업 환경이 갈수록 악화되고 있는 점도 문제다. 지난달 30일 기준 원달러 환율(미국 달러에 대한 원화 환율)은 1163원으로 지난해 4월 2일 1057원에 비해 1년여 만에 100원 넘게...
1948,2019.05.02.,"알뜰주유소, 유류세 환원 후 물가안정 선도 자처","이번 조치는 최근 국제유가 상승세가 지속되고 있어 환원 초기에 판매가격을 급속히 올릴 경우 국민의 유가상승 체감도가 훨씬 클 것으로 예상되기 때문이라는 설명이다. 알뜰주유소협회 관계자는 ""지난해 유류세..."
1949,2019.05.06.,LNG가 국내 조선업 ‘들었다 놨다’…고사 직면 이후 반등 부활,국제유가가 급락하면서 해양플랜트 수주를 주문량이 함께 내려갔다. 조선업의 침체로 경남 거제시는 직격탄을 맞았다. 대우조선해양과 삼성중공업 등이 입주해 지역 경제를 이끌었으나 조선업 구조조정이...
1950,2019.05.01.,[뉴욕마감]알파벳 저조한 실적에 발목 …혼조세,국제유가는 베네수엘라 정정 불안 등에 따라 상승했다. 이날 뉴욕상업거래소(NYMEX)에서 6월 인도분 서부 텍사스산 원유(WTI)는 전날보다 배럴당 0.41달러(0.7%) 오른 63.91달러에 거래를 마쳤다. 런던 ICE 선물거래소의...
1951,2019.04.25.,SK이노 영업이익 3311억원 기록 '흑자전환',지난 1분기는 OPEC 감산 및 미국의 대(對)이란 제재 등 불안정한 국제 정세로 인해 국제유가는 소폭 상승세를 보였다. 하지만 글로벌 경기 둔화에 대한 우려가 커지면서 디젤 등 석유제품 마진과 올레핀 등 화학제품...
1952,2019.04.27.,"이란산 봉쇄속 국내 휘발유 가격 10주째↑...서울 1,537원",석유공사는 미국의 이란 원유 수입 예외적 허용 조치 재연장 불허와 이란의 호르무즈 해협 봉쇄 위협 등으로 국제유가가 상승하면서 국내 제품 가격도 오름세를 이어갈 것이라고 전망했습니다. 신윤정
1953,2019.04.14.,"""유류세 뿐만이 아니다""…기름값 '잔인한 5월' 상승요인 집중",이미 기름값은 현재도 국제유가 상승 탓에 8주째 가파르게 오르는 형국이다. 한국석유공사 유가 정보 서비스 오피넷에 따르면 4월 둘째 주 전국 주유소의 보통 휘발유 판매가격은 전주보다 ℓ당 10.3원 오른 1천408....
1954,2019.04.30.,"현대일렉트릭, 1분기 320억원 영업손실… ESS·발전 감소로 적자 폭 늘어","아울러 최근 국제 유가 회복으로 중동지역 발주의 점진적 회복도 예상되고 있다. 신재생에너지분야에 대한 각국 관심이 증가해 관련 시장에서도 성장이 예상된다는 설명이다. 강 상무는 ""최근 유가가 단기적으로..."
1955,2019.04.30.,LPG가격 석달만에 인상…6월은 동결? 인상?,국제유가 상향세가 심상치 않은데다 환율 또한 상승세인 상황에서 누적된 인상요인을 그대로 안고 가기에는 무리가 따른다는 판단에서 취해진 조치로 해석된다. SK가스는 주요 거래처에 공급하는 5월 LPG가격을...
1956,2019.04.23.,"""막으면 기름값 3배 폭등""…이란 호르무즈 해협, 뭐길래","만약 실제로 호르무즈 해협이 폐쇄된다면 현재 배럴당 70달러 안팎의 국제유가가 약 200달러까지 폭등할 수 있다는 게 시장의 전망이다. '오일쇼크'의 위기감이 높아지고 있다. ◇한국 등, 5월3일 이후 이란산 석유..."
1957,2019.04.24.,美주요기업 호실적에 나스닥·S&P500 지수 '역대 최고치',국제유가 움직임은 시장이 촉각을 곤두세우는 요인. 미국이 이란 제재 예외를 연장하지 않겠다고 방침을 밝힌 후 유가는 급등세를 탔다. 서부텍사스원유(WTI)는 이날도 1% 이상 오르며 배럴당 66달러 선을 넘어섰다....
1958,2019.04.25.,원-달러 환율 2년3개월만에 최고치…9.6원 올라 1160.5원,여기에 최근 국제유가가 2018년 10월 이후 최고치로 상승한 것도 무역흑자폭 급감 가능성을 높이고 있다. 원유는 우리나라 최대 수입품목이다. 경기 부진이 지속될 경우 한국은행이 기준금리 인하에 나설 가능성이...
1959,2019.05.10.,유류세 인하 폭 축소 후 전국 90% 주유소 기름값 올렸다,"환율, 국제 유가 등이 영향을 미치기 때문에 환원분이 100% 반영되는 시기는 예측하기 힘들지만, 작년과 비교했을 때 재고 소진 속도가 빠르기 때문에 기간이 지난해(2~3주)보다는 단축될 가능성이 높다는 설명이다."
1960,2019.04.25.,"SK이노베이션 1분기 영업이익 전년비 53.5% 감소한 3,311억원","SK이노베이션은 1분기 실적과 관련해 ""석유수출국기구(OPEC)의 감산, 미국의 대 이란 제재 등 국제 정세가 불안해 국제유가가 상승세를 보였다""며 ""세계 경기 둔화에 대한 우려로 석유제품 마진, 올레핀 등 화학제품..."
1961,2019.04.20.,주유소 기름값 9주째 상승…서울 휘발유 ℓ당 1520.1원,"석유공사 관계자는 ""국제유가는 미국 원유재고 감소, 리비아 정정불안 지속 등의 영향으로 상승했으나 러시아 하반기 증산 가능성 시사 등은 상승폭을 제한했다""며 ""국내제품가격은 최근 국제유가 상승의..."
1962,2019.05.03.,韓 ‘이란 석유 수입금지 예외’ 거듭 요청…美 거절,수출을 막아 핵무기와 미사일 개발을 중단시킬 계획”이라고 설명했다. 이 와중에 국제유가는 하락했다. 2일(현지시간) 미 텍사스산 중질유(WTI) 가격은 전일대비 3.5% 떨어진 배럴당 61.38달러에 거래됐다. 뉴데일리 전경웅
1963,2019.05.01.,[데스크의눈] 지구촌 흔드는 ‘트럼프 포비아’,미국과 이란의 갈등이 고조되면서 국제원유시장에 공급 부족 사태가 우려된 탓에 국제유가가 급상승했다. 이는 세계경제의 큰 불안 요인이 되고 있다. 트럼프 정부는 명확한 이유도 없이 협정을 파기해 객관성과 합리성이...
1964,2019.04.23.,내달 2일부터 ‘이란 원유’ 수입금지…석유화학업계 빨간불,이처럼 긴장감이 높아지면서 국제유가는 급등했습니다. 우리 업계에 타격이 있을 것으로 보이는데요? 맞습니다. 이번 미국의 조치는 어느 정도 예고돼 왔기 때문에 국내 정유회사들은 그동안 이란산 원유 수입을...
1965,2019.04.14.,"잔인한 5월, 기름값 더 오른다","정부, 유류세 인하 폭 '15%→7%' 축소 국제유가 상승…두바이유, 지난해 배럴당 50달러→70달러 미국, 대이란 추가 제재 가능성까지 [ 김소연 기자 ] 기름값이 5월엔 더 오를 전망이다. 14일 업계에 따르면 국내 전국..."
1966,2019.04.24.,수출물량·금액지수 2달째 동반 하락…교역조건 16개월째 악화,"최근 국제유가가 다시 상승세를 보이면서 교역조건이 더 악화할 수 있다는 우려도 나온다. 최근 배럴당 두바이유 가격은 1월 59.09달러, 2월 64.59달러, 3월 66.94달러로 올랐다. 이달 들어서는 70달러를 넘기도 했다...."
1967,2019.05.02.,4월 소비자물가 상승률 0.6%… 4개월 연속 0%대,국제유가 하락과 정부의 유류세 인하로 석유류 내림세가 지속된 덕분이다. 2일 통계청이 발표한 '2019년 4월 소비자물가 동향'에 따르면 이달 소비자물가지수는 104.87(2015년=100)로 1년 전보다 0.6% 상승했다. 지난해...
1968,2019.04.12.,유류세 인하 4개월 더 연장,"다만 유류세가 휘발유 가격의 절반가량을 차지하긴 해도 최종 가격은 국제 유가·정제 마진 등의 영향을 받기 때문에 오름 폭은 이보다 작아질 수도, 커질 수도 있다. 현재로서는 올해 서부텍사스산원유(WTI)..."
1969,2019.04.24.,"정유업계, 1분기 석유제품 수출물량 역대 최고치 경신",있지만 정유업계는 수출 다변화와 수출물량 증대로 어려움을 극복해 나갈 것”이라며 “2분기에는 국제유가 강세와 정제마진 개선으로 수출체질도 개선될 것”이라고 전망했다. 정현정 배터리/부품 전문기자
1970,2019.04.24.,1분기 석유제품 수출 1억1964배럴…역대 1분기 중 최고,산업 위주로 수출부진이 이어지고 있지만 정유업계는 수출국 다변화와 수출물량 증대로 어려움을 극복해 나갈 것”이라며 “2분기에는 국제유가 강세와 정제마진 개선으로 수출체질도 개선될 것”이라고 내다봤다.
1971,2019.04.27.,[뉴욕마감]美 1분기 GDP 깜짝 성장에 주요지수 또 '사상 최고',국제유가는 도널드 트럼프 미 대통령이 석유수출국기구(OPEC)에 대해 증산 압박에 3% 가까이 급락했다. 이날 뉴욕상업거래소(NYMEX)에서 6월 인도분 서부 텍사스산 원유(WTI)는 배럴당 2.9%(1.91달러) 하락한 63.30달러에...
1972,2019.04.25.,"SK이노, 정유사업 부진에 영업익 50%↓…화학이 살렸다",다만 국제유가 상승에 따라 정유부문이 재고평가이익을 얻었음에도 적자를 완전히 벗어나지 못해 아쉬움을 남겼다. 그나마 화학사업이 3000억원 이상의 이익을 거둬 전사 실적을 이끈 것으로 나타났다....
1973,2019.04.29.,"[올댓차이나] 홍콩 증시, 미중 경제지표 호조에 상승 마감...H주 1.11%↑","국제 유가 약세에 연료비 감소 기대에 중국국제항공, 난팡항공, 둥팡항공은 2~3% 올랐다. 반면 스마트폰 관련주는 떨어졌다. 음향부품주 루이성 과기가 2% 내렸고 광학부품주 순위광학은 0.1% 밀렸다. 중국 통신주..."
1974,2019.05.08.,[사설] 유류세 인하 조치로 기름값 사실상 오른 셈,유류세 인하와 국제유가 하락이 맞물려 지난 2월 국내 휘발유 가격은 1L에 1440원대까지 떨어졌다. 정부는 당초 5월 6일 유류세 인하 조치를 끝내려다 8월 31일까지 기간을 연장하고 대신 인하 폭을 15%에서 7%로...
1975,2019.04.28.,기름값 ‘고공행진’…트럼프 “증산합의” 주장에 멈춰설까?,"국제유가도 비슷한 흐름입니다. 특히 미국이 지난 22일 이란산 원유 수입 금지 예외 조치를 더이상 연장하지 않겠다고 밝히면서, 국제유가는 6개월 만에 최고치를 찍었습니다. 그러자 트럼프 미국 대통령이 진화에..."
1976,2019.04.22.,"정부, 이란산 원유수입 연장 불가에 '당혹'…막판 반전에 기대",국제 유가가 오르락내리락을 반복하고 있는 상황에서 유가 불안정 심화 가능성을 감수하면서까지 미국이 대 이란 제재를 더욱 조인 터다. 따라서 미국이 같은 핵 문제가 걸린 대북 제재와 관련해 유연성을 보일 것으로...
1977,2019.05.06.,주유하려면 오늘!'…유류세 인하율 7일부터 축소,또한 이란산 원유 수입 금지 등으로 국제유가가 더 오르면 국내 유류가격 상승폭은 더 커질 것으로 에상된다. 정부는 지난해 11월부터 6개월 간 한시적으로 유류세의 15%를 인하했다. 하지만 국내 경기 침체 등의...
1978,2019.04.25.,"SK이노, 1분기 영업익 54%↓…4분기 적자 충격에선 탈피(종합2)",지난 1분기는 석유수출국기구(OPEC) 감산 및 미국의 대(對)이란 제재 등 불안정한 국제 정세로 인해 국제유가는 소폭 상승세를 보였다. 하지만 글로벌 경기 둔화에 대한 우려가 커지면서 디젤 등 석유제품 마진과...
1979,2019.04.29.,"중국의 일대일로, 콩고공화국 IMF 구제구융 신청에 제동 걸리나",중국은 2014년 국제유가 급락으로 콩고공화국이 재정난을 겪자 도움을 줬습니다. 콩고공화국은 중국의 금융지원에도 불구하고 재정 사정이 좋아지지 않자 IMF에 구제금융을 신청해 현재 협상을 벌이고 있습니다....
1980,2019.04.29.,"중국의 일대일로, 콩고공화국 IMF 구제구융 신청에 제동 걸리나",중국은 2014년 국제유가 급락으로 콩고공화국이 재정난을 겪자 도움을 줬습니다. 콩고공화국은 중국의 금융지원에도 불구하고 재정 사정이 좋아지지 않자 IMF에 구제금융을 신청해 현재 협상을 벌이고 있습니다....
1981,2019.04.22.,"이란 원유 수입 막히나…정유·유화업계 ""가격 상승 우려""",미국이 이란산 원유의 수입을 전면 금지할 것이라는 소식이 전해지자 국제유가는 일제히 급등했습니다. 블룸버그에 따르면 22일 오전 미국 뉴욕상업거래소(NYMEX)에서 5월 인도분 서부 텍사스산 원유(WTI)와 브렌트유 가격은...
1982,2019.04.24.,"정유 4사, 1분기 석유제품 수출물량 역대 최대…수출액은 소폭 하락",협회 관계자는 “올해 성장률 전망이 잇달아 하향조정되고 주요 산업 위주로 수출부진이 이어지고 있지만 정유업계는 수출국 다변화와 수출물량 증대로 어려움을 극복해 나갈 것”이라며 “2분기에는 국제유가...
1983,2019.04.21.,휘발유 가격 9주 연속 상승,전국 휘발유 가격이 국제 유가 상승 영향으로 9주 연속 오른 21일 서울시내 한 주유소에 휘발유 가격이 리터당 1423원을 기록하고 있다. 한국석유공사 유가정보서비스 오피넷에 따르면 4월 셋째 주 기준 전국...
1984,2019.05.02.,"하나금투, 미 연준 금리인하 시의적절","나중혁 연구원은 ""사실상 금리 인하 기대를 차단한 것""이라며 ""최근 경기와 금융시장의 높은 변동성과 여름 성수기를 앞둔 국제유가의 가파른 오름세를 감안하면 시의적절했다""고 분석했다. 나 연구원은 ""기자회견 이후..."
1985,2019.04.25.,"SK이노, 1분기 영업익 54%↓…4분기 적자 충격에선 탈피(종합)",지난 1분기는 석유수출국기구(OPEC) 감산 및 미국의 대(對)이란 제재 등 불안정한 국제 정세로 인해 국제유가는 소폭 상승세를 보였다. 하지만 글로벌 경기 둔화에 대한 우려가 커지면서 디젤 등 석유제품 마진과...
1986,2019.04.30.,기업 체감경기 두 달 연속 개선…정유·화학 업황 올라,국제유가 상승 및 드라이빙 시즌을 맞아 계절적 수요가 증가한 영향이다. 화학물질ㆍ제품(92)도 10포인트 올랐다. 원재료와 제품 판매 가격 차이인 스프레드가 커졌기 때문이다. 반면 반도체 가격 하락 및 재고...
1987,2019.05.05.,"유류세, 7일부터 유류세 인하폭 축소...기름값 인상",유류세 인하 정책 시행 이후에는 국제유가 하락세와 맞물려 지난 2월 중순에는 1342.7원까지 떨어지기도 했다. 그러나 주요 산유국의 원유 감산과 지정학적 리스크 등으로 인한 국제유가 상승으로 국내유가도...
1988,2019.05.02.,"美연준, 기준금리 동결… 이주열 총재 ""예상에 부합""","주된 목표인 '안정적인 성장 경로 확보'를 위해 노련하게 완급을 조절한 것""이라며 ""최근 경기와 금융시장의 높은 변동성과 여름 성수기를 앞둔 국제유가의 가파른 오름세를 감안하면 시의적절했다""고 평가했다."
1989,2019.05.03.,[문예공론] 베네수엘라 참상이 주는 교훈,"국제 유가가 배럴당 100달러에 이르는 고유가 시절이라 가능한 일이었다. 이것도 모자라 ""미주 대륙에 반미(反美) 좌파 전선을 구축하겠다.""며 쿠바·니카라과 등 좌파 정권에 헐값으로 석유를 퍼줬다. 하지만 2014년..."
1990,2019.04.25.,[뉴욕마감]다우 0.22%↓…일부 대기업 실적 저조,국제 유가는 미국의 대(對) 이란 원유 수출 전면 금지 제재의 충격에서 벗어나 다소 소폭 하락했다. 이날 뉴욕상업거래소(NYMEX)에서 6월 인도분 서부텍사스산 원유(WTI)는 배럴당 0.41달러(0.6%) 하락한 65.89달러에...
1991,2019.05.06.,[2018년 업종별 '법인세' 분석]석유화학 등 잘 나가는 석유화학업체들 법인세...,"지난해 국제유가 급락으로 어려움을 겪기도 했던 국내 4대 정유사(SK이노베이션, GS칼텍스, S-OIL, 현대오일뱅크)들이 사업보고서(2018년 회계사업연도 기준)에 반영한 법인세액은 7340억원 규모였던 것으로..."
1992,2019.04.27.,"이란 제재 속 휘발유 값, 10주 연속 상승…서울 리터당 1537.8원",최근 미국의 이란 제재 등으로 국제유가가 연일 상승 국면인만큼 이같은 오름세는 당분간 지속될 전망이다. 27일 한국석유공사 유가정보서비스 오피넷에 따르면 4월 넷째주 주유소 휘발유 판매가격은 전주 대비...
1993,2019.04.23.,이란 원유 수출 봉쇄에 유가 급등세,서부 텍사스산 원유(WTI) 선물이 약 6개월 만에 최고치를 기록했다. 이는 석유수출국기구(OPEC) 국가들이 자발적 감산조치를 취하는 상황에서 국제유가 상승세가 지속될 것이라고 전문가들은 전망했다. 2019.4.23/뉴스1
1994,2019.05.02.,[뉴욕마감]Fed 금리 동결에 3대지수 동반하락…다우 0.61%↓,국제유가는 혼조세를 보였다. 이날 뉴욕상업거래소(NYMEX)에서 거래된 6월 인도분 서부텍사스산 원유(WTI) 가격은 전날보다 배럴당 0.31달러(0.5%) 내린 63.60달러에 마감됐다. 지난 주 미국의 원유 제고가 990만 배럴...
1995,2019.04.29.,"홍남기 부총리 ""민간투자 업종별대책 5~6월 마련""","그는 ""단기적 국제유가 상승 가능성에 대비해 알뜰주유소 활성화 및 전자상거래 확대를 통한 석유시장 경쟁을 촉진할 것""이라며 ""유화학업계의 원활한 원유수급을 위해 수입선 다변화, 대체원료 활용방안 등을 지원하겠다..."
1996,2019.05.04.,<뉴욕마켓워치> 美고용 깜짝 호조…주가·국채↑·달러↓,전일 급락세를 나타냈던 국제유가가 이날은 소폭 반등한 점도 투자 심리에 도움을 줬다. 이날 종목별로는 워런 버핏의 버크셔 헤서웨이가 주식을 매수했다고 밝힌 아마존 주가가 3.2% 이상 오르며 장을 주도했다....
1997,2019.05.03.,"뉴욕증시, 미 연준 금리인하 일축 여파에 이틀째 하락 마감…다우 0.46%↓","시장은 전일 종료된 FOMC 영향과 미국 경제지표, 국제유가 움직임 등을 주시했다. FOMC 이후 향후 연준 정책 방향에 대한 시장의 기대 조정이 이어졌다. 롬 파월 연방준비제도(Fed·연준) 의장이 물가 약세는..."
1998,2019.04.22.,"삼성重, 1조1000억원 규모 FPSO 건조계약…올해 첫 해양플랜트(종합)",10억 달러 규모의 릴라이언스 프로젝트는 지난해 입찰 결과가 나올 것으로 예상됐지만 하반기 국제유가 하락 등에 따라 발주가 연기됐다.삼성중공업은 지난해부터 가장 유력한 후보로 거론됐다. 삼성중공업은 이...
1999,2019.04.22.,이란산 초경질유 수입금지… 유화업계 직격탄,글로벌 경제에 미치는 파장이 커지면 국제유가가 치솟고 국내 휘발유 가격도 동반 상승할 가능성이 있다. 도널드 트럼프 미국 대통령은 한국과 중국 일본 인도 이탈리아 터키 그리스 대만 8개국에 한시적으로 부여했던...
2000,2019.04.22.,이란산 초경질유 수입금지… 유화업계 직격탄,글로벌 경제에 미치는 파장이 커지면 국제유가가 치솟고 국내 휘발유 가격도 동반 상승할 가능성이 있다. 도널드 트럼프 미국 대통령은 한국과 중국 일본 인도 이탈리아 터키 그리스 대만 8개국에 한시적으로 부여했던...
2001,2019.04.25.,"SK이노베이션, 1Q 영업익 3311억 '흑자' 전환… 전년比 53.5% 줄어","작년 4분기 국제유가 급락에 따른 대규모 적자를 탈출하는 모습이지만 전년 동기 대비 영업이익 규모는 반토막에 그쳤다. 휘발유를 중심으로 한 석유사업부문 실적 개선이 이뤄지지 못했고, 지난해 실적을 견인해..."
2002,2019.04.15.,6조 부채 감당할 기업은 … SK·한화·애경 거론,"업계 관계자는 “아시아나가 매력적인 매물이긴 하지만, 막대한 부채와 국제유가, 경기 등의 흐름에 민감한 항공업의 특성을 충분히 고려하지 않고 M&A에 뛰어들면 자칫 ‘승자의 저주’에 걸릴 수 있다”고 말했다."
2003,2019.05.02.,"현대오일뱅크, 1분기 영업익 1천8억…전년비 64.3%↓(상보)",매출은 평균 국제유가 하락 등으로 전분기와 비교해 9천763억원 감소했다. 종속기업인 현대케미칼은 1년 전보다 85% 감소한 63억원의 영업이익을 올렸다. 제품 스프레드 하락이 실적에 부정적인 영향을 미쳤다....
2004,2019.05.07.,[재계 핫실적④] 혹독한 겨울 보낸 넥슨·넷마블·엔씨소프트…여름에 반격 나...,"(사진=CNB 포토뱅크) 미국·중국 간 무역분쟁과 신흥국 금융불안, 환율·금리·국제유가의 불확실성 등으로 글로벌 경기 전망이 밝지 않다. 여기에다 실업률 증가, 남북경협 교착상태 장기화, 건설·서비스업 침체로..."
2005,2019.04.21.,전국 휘발유가 9주 연속 오름세,전국 휘발유 가격이 국제 유가 상승 영향으로 9주 연속 오른 21일 서울시내 한 주유소에 휘발유 가격이 리터당 1423원을 기록하고 있다. 한국석유공사 유가정보서비스 오피넷에 따르면 4월 셋째 주 기준 전국...
2006,2019.04.26.,"이호승 기재차관 ""美 이란 제재 예외 불인정…국내 영향 최소화 노력""","이 차관은 이날 정부서울청사에서 열린 ""제4차 물가관계차관회의 겸 제7차 혁신성장 전략점검회의'에 참석해 ""최근 국제유가가 70달러대로 상승하면서 기업 및 서민의 부담 증가가 우려된다""며 이같이 밝혔다. 이 차관은..."
2007,2019.04.20.,휘발유 가격 9주째 올라…서울 ℓ당 17.4원 급등,국내 제품가격은 최근 국제유가 상승의 영향으로 오름세가 유지될 것으로 전망된다. 한국이 주로 수입하는 원유의 기준이 되는 두바이유는 전주보다 배럴당 0.4달러 상승해 70.7달러였다. LPG 차량의 연료인...
2008,2019.04.24.,"韓 정유업계, 1분기 석유제품 수출 최고기록 경신","주요 산업 위주로 수출부진이 이어지고 있지만, 정유업계는 수출국 다변화와 수출물량 증대로 어려움을 극복해 나갈 것""이라며 ""2분기에는 국제유가 강세와 정제마진 개선으로 수출체질도 개선될 것""이고 전망했다."
2009,2019.05.02.,"해양플랜트 발주 기대감 '솔솔'…조선 빅3, 美서 수주 경쟁","국제유가 상승으로 해양플랜트 발주가 기지개를 켜는 가운데, 신규 수주를 따낼 수 있을지 관심이 쏠린다. 2일 조선업계에 따르면 현대중공업과 대우조선해양, 삼성중공업 CEO는 오는 6~9일 미국..."
2010,2019.05.02.,"해양플랜트 발주 기대감 '솔솔'…조선 빅3, 美서 수주 경쟁","국제유가 상승으로 해양플랜트 발주가 기지개를 켜는 가운데, 신규 수주를 따낼 수 있을지 관심이 쏠린다. 2일 조선업계에 따르면 현대중공업과 대우조선해양, 삼성중공업 CEO는 오는 6~9일 미국..."
2011,2019.04.22.,나프타 뽑는 초경질원유 가장 타격,국제유가 인상에 영향을 미칠 수 있다는 점도 업계가 장기적으로 걱정하는 부분이다. 이날 블룸버그에 따르면 미국 뉴욕상업거래소(NYMEX)에서 5월 인도분 서부 텍사스산 원유(WTI)와 브렌트유 가격은 6개월 만에 최고치를...
