,날짜,제목,요약
1121,2019.08.05.,"롯데케미칼, 2분기 영업익 3461억...전년비 51% 감소","롯데케미칼은 ""올해 상반기는 미-중 무역분쟁, 국제유가 변화 등 대외적인 변동성이 증대되고 주요 제품의 수요 회복 증가세가 둔화되며 작년 대비 수익성이 감소했다""며 ""하반기에는 역내 신규설비..."
1122,2019.08.01.,반도체 부진 등 악재로 7월 수출 전년 比 11%↓,산업부는 수출액 감소의 주요 원인으로 ▲미·중 무역분쟁 장기화 및 일본 수출 규제 등 대외 여건 악화 ▲반도체 업황 부진 및 단가 하락 ▲국제유가 회복 지연에 따른 석유화학·석유제품 부진을 꼽았다....
1123,2019.07.27.,해외 20％ vs 국내 1％...주식형 펀드 수익 '극과 극',이 가운데 러시아는 국제 유가 강세와 러시아 중앙은행의 기준금리 인하에 힘입어 증시가 강세를 보이면서 펀드 수익률도 고공 행진했습니다. 반대로 국내 주식형 펀드의 연초 이후 수익률은 평균 1.20％에...
1124,2019.07.24.,"정유업계, 상반기 석유제품 수출량 역대 두번째 기록","국제유가가 약세를 보이면서 수출단가가 하락한 탓이다. 국가별로 살펴보면, 중국(19%) 일본(12%) 싱가포르·대만(10%) 미국(8%) 등 순이었다. 중국이 차지한 비중은 1년 간 5% 포인트 감소했지만, 수출 대상국이 같은 기간..."
1125,2019.08.01.,"7월 수출·수입 모두 감소···""미중 무역전쟁 등 대외여건 악화 탓""",정부는 이같은 수출과 수입 부진에 대해 △미중 무역분쟁 장기화 및 일본 수출 규제 등 대외여건 악화 △반도체 업황부진 및 단가 하락 △국제유가 회복 지연에 따른 석유화학･석유제품 부진 등이...
1126,2019.08.07.,"롯데케미칼, 전년 대비 2분기 영업실적 큰 폭 하락...대외적 변동성 증대 원인","롯데케미칼이 미-중 무역분쟁, 국제유가 변화 등 대외적 변동성의 여파로 올 2분기에 전년 동기 대비 크게 하락한 경영실적을 기록했다. 하지만 직전 분기보다는 증가세를 시현해 하반기 실적 개선 기대를 높였다...."
1127,2019.07.27.,"국내 휘발유 가격, 8주 만 반등…당분간 혼조세 전망",최근 국제유가가 등락을 반복하는 혼조세를 보이고 있는만큼 국내 휘발유 가격 역시 현재 수준에서 오르내리는 상황이 이어질 전망이다. 27일 한국석유공사 유가정보서비스 오피넷에 따르면 7월 넷째주 주유소...
1128,2019.07.30.,"하나금융투자, 리자ELS 등 파생결합상품 3종 모집",국제유가를 기초자산으로 하는 '하나금융투자 DLS 3576회'도 모집한다. 이 상품은 두 가지 원유(WTI·BRENT)와 홍콩지수(HSCEI)를 기초자산으로 연 7.50%의 예상수익률을 얻을 수 있다. 만기는 3년이며 총 여섯 차례...
1129,2019.08.01.,[뉴욕증시] 추가 금리 인하 기대 감소에 하락,"전환 [국제유가] 美 원유 재고량 감소에 상승 달러, 금리 인하 불구 파월 '매파적 발언'에 상승 다우 : -1.23% 26,864p / 나스닥 : -1.19% 8,175p / S&P500 : -1.09% 2,980p < 뉴욕증시 > 연준이 예상대로 금리를 인하했는데요. FOMC 결과..."
1130,2019.08.01.,[뉴욕증시] 추가 금리 인하 기대 감소에 하락,"전환 [국제유가] 美 원유 재고량 감소에 상승 달러, 금리 인하 불구 파월 '매파적 발언'에 상승 다우 : -1.23% 26,864p / 나스닥 : -1.19% 8,175p / S&P500 : -1.09% 2,980p < 뉴욕증시 > 연준이 예상대로 금리를 인하했는데요. FOMC 결과..."
1131,2019.08.01.,"[오늘의 글로벌마켓]뉴욕증시, ""장기 사이클의 금리인하 아냐"" 실망감에 하락",국제유가는 5거래일 연속 상승세를 이어갔다. 이날 뉴욕상업거래소(NYMEX)에서 9월 인도분 서부 텍사스산 원유(WTI)는 전거래일보다 배럴당 0.53달러(0.9%) 오른 58.58달러에 장을 마쳤다. 국제 금값은 소폭 하락했다....
1132,2019.08.07.,"한화케미칼, 2Q 영업이익 47%↓…""미중분쟁으로 수요 부진""","기초소재 부문에서는 국제유가 강세로 원가가 상승했으나 미중 무역분쟁 속에서 수요가 부진함에 따라 폴리에틸렌(PE), 폴리염화비닐(PVC) 등 주요 제품 가격이 약세를 보이면서 스프레드(원료와 최종제품의 가격 차이)..."
1133,2019.08.06.,미·중 환율전쟁에 주식시장 불안 지속,국제유가는 비교적 큰 폭으로 내렸다. 9월 인도분 서부 텍사스산 원유(WTI)는 전 거래일보다 배럴당 1.7%(0.97달러) 내린 54.69달러에 거래를 마쳤다. 다른 아시아 주식시장도 약세를 보였다. 일본 닛케이지수 0.65...
1134,2019.07.26.,"SK이노베이션, 2분기 영업이익 4,975억…예상치 대비 '선방'","상반기 전체 영업이익은 8,286억 원, 매출은 25조 9,522억 원이다.당초 증권가에서는 국제유가와 정제마진의 하락, 미·중 무역분쟁 등의 영향으로 SK이노베이션이 부진한 실적을 기록할 것으로 예상했다...."
1135,2019.07.18.,"오늘 한은 금통위…성장전망 낮추고, 금리도 내릴까","국제유가 약세 등이 주요 요인으로 꼽힌다. 한은은 최근 '물가안정목표 운영상황 점검' 발표에서 올해 소비자물가상승률이 지난 4월 전망치를 밑돌 것이라며 하향 조정을 시사하기도 했다. 신얼 SK증권 연구원은 ""10월..."
1136,2019.08.02.,美中 관세전쟁 확전·日 백색국가 배제···원·달러 환율 7.5원↑,"전승지 삼성선물 연구원은 ""불확실성 증폭에 미 국채 10년물 금리는 14bp(1bp=0.01%p) 하락했고, 미 다우지수는 1.05%, 국제 유가는 7.9% 각각 내렸다""고 말했다. 이번 조치로 미국 투자와 제조업 부진이 심화될 것으로..."
1137,2019.07.27.,전국 휘발윳값 두달만에 상승전환…전국 평균 ℓ당 1490.6원,"8원을 기록했다. 석유공사는 ""국제유가는 사우디와 쿠웨이트의 국경지대 원유생산 재개 가능성 등의 하락요인과 중동지역 긴장감 지속 등 상승요인으로 혼조세를 보이고 있다""고 설명했다."
1138,2019.07.26.,"휘발유 가격, 8주 만에 상승…L당 0.2원 오른 1490.6원","한국석유공사는 ""국제유가는 사우디, 쿠웨이트 국경지대의 원유생산 재개 가능성 등의 하락요인과 중동지역 긴장감 지속 등의 상승요인으로 혼조세를 보였다""고 했다. [ ]"
1139,2019.07.24.,韓정유업계 선방했다… 수출량 사상 두 번째로 많아,"다만 석유제품 수출액은 국제유가 약세 등 수출단가 하락의 영향으로 감소했다. 상반기 석유제품 수출액은 지난해 같은 기간보다 8% 하락한 172억 8,000만 달러로 집계됐다. 올해 상반기 석유제품 수출단가는 배럴당 73.6..."
1140,2019.08.07.,미-중 무역분쟁 격화에 브렌트유 급락,"국제유가는 중국의 위안화 평가절하 이후 미-중 무역분쟁 격화에 따른 세계 경기둔화 우려 증폭, 하루 316만배럴을 기록한 미국의 6월 원유수출 증가발표로 하락했다. 특히 한국으로의 수출량은 60만5000배럴..."
1141,2019.07.27.,휘발유 값 7주 만에 하락세 멈춰…최고가 서울 1586원,7월 넷째 주 휘발유 값 ℓ당 2.0원 오른 1490.6원…경유 1351.2원 “중동지역 긴장감 등 상승요인 및 하락요인 등으로 국제유가 혼조세” 전국 휘발유 주간 평균가격이 7주 연속 이어온 하락세를 멈추고 소폭...
1142,2019.07.31.,국내 휘발유·LPG 가격 안정세…9월 인상은 불가피,28일 서울 시내 한 주유소에 차량이 들어서고 있다.(사진=연합뉴스)[이데일리 남궁민관 기자] 최근 국제유가가 배럴당 60달러선에서 보합세를 보이면서 국내 휘발유 가격 역시 안정화 국면에 접어들었다. 올 하반기...
1143,2019.08.01.,울산 주요 상장사 2분기도 '실적쇼크',국제유가 하락에 따른 정제마진 악화와 미중간 무역전쟁으로 인한 수요감소가 실적에 악영향을 미쳤다. 국내 정유업계 1위 SK이노베이션의 2분기 연결 영업이익은 4976억원으로 작년 동기대비 41.6% 감소했다....
1144,2019.07.19.,6월 생산자물가 5개월 만에 하락…D램 11개월째 내림세,"공산품은 국제유가 하락의 영향으로 석탄 및 석유제품과 화학제품 등을 중심으로 내려 전월 대비 0.6% 하락했다. 공산품 중 주요 수출품인 D램(-5.3%)은 11개월 연속 내림세를 이어갔다. 전력, 가스 및 수도는 전월 대비..."
1145,2019.08.01.,7월 수출액 1년 전보다 11%줄어 8개월째 감소세 이어져,"산업부는 미국과 중국의 무역분쟁 장기화와 일본 수출규제 등 대외 여건 악화, 반도체업황 부진과 단가 하락, 국제유가 회복 지연에 따른 석유화학⋅석유제품 부진 등을 수출액 감소의 원인으로 꼽았다. 7월 수출액..."
1146,2019.07.31.,[원유마감]상승세…미중 무역회담·연준 금리인하 주시,국제유가가 30일(현지시간) 상승했다. 미국과 중국 사이의 무역회담이 재개된 가운데 미연방준비제도(연준)가 이날 시작된 통화정책회의에서 금리를 인하할 것이라는 기대감이 유가를 끌어올렸다. 미국 서부...
1147,2019.08.05.,"8월 LPG수입가격, 5달러씩 등락",한편 국제유가의 경우 미국 트럼프 대통령의 대중 추가 관세 부과 소식에 크게 하락하면서 국제유가의 경우 50달러 중반에 머무르고 있으나 저가성 매수세가 유입되면서 다시 상승하는 등...
1148,2019.08.01.,"(종합)소비자물가 0%대 7개월…정부 ""디플레이션 아냐""",기획재정부도 현재 상황이 양호한 기상 여건과 국제유가 안정과 같은 공급자 측 하방 요인과 건강보험 적용 확대 등 정책적 요인 등으로 0% 소비자물가 상승률이 이어지고 있다고 분석했다. 기재부 관계자는...
1149,2019.08.07.,2019년 8월 7일(수) 전국 주요 신문 톱뉴스,"확산…국제유가 반토막 날수도 ▲ 이데일리 = G2, 결국 환율전쟁까지…韓경제 퍼펙트스톰 맞나 ▲ 이투데이 = '무소불위' 족벌경영…37년간 지역농협 사유화 ▲ 일간리더스경제 = 부울경 시총상위 14개사 '동반추락..."
1150,2019.08.02.,코스피 2000선 붕괴 ··· '악재 쓰나미'에 7개월 만에 ,"뉴욕증시에서는 다우존스30 산업평균지수(1.05%), 스탠더드앤드푸어스(S&P) 500지수(0.90%), 나스닥(0.79%)이 모두 하락했고 국제유가는 9월 인도분 서부 텍사스산 원유(WTI)가 7.9% 폭락했다. 여기에 일본 정부는 한국을..."
1151,2019.08.03.,[뉴욕마감]무역전쟁 공포 확산에 연일 하락…올해 들어 주가 하락폭 최대,국제 유가는 반등했다. 이날 뉴욕상업거래소(NYMEX)에서 9월 인도분 서부 텍사스산 원유(WTI)는 배럴당 3.2%(1.71달러) 상승한 55.66달러에 거래를 마쳤다. 런던 ICE 선물거래소의 10월물 브렌트유도 오후 3시30분 현재...
1152,2019.08.07.,[증시브리핑] 잦아든 ‘환율전쟁’…위안화 안정세에 美증시 상승 마감,"◇ 국제유가 국제유가는 하락세가 이어졌습니다. 원유는 흔히 위험자산으로 분류되는데요. 불확실성이 부각되는 장에서는 약세를 보입니다. 오늘 새벽 WTI는 1.9% 하락하면서 53달러 선에서 마감, 브렌트유도..."
1153,2019.08.01.,소비자물가 0%대 7개월…정부 '디스인플레이션' 평가,기획재정부도 현재 상황이 양호한 기상 여건과 국제유가 안정과 같은 공급자 측 하방 요인과 건강보험 적용 확대 등 정책적 요인 등으로 0% 소비자물가 상승률이 이어지고 있다고 분석했다. 기재부 관계자는...
1154,2019.07.31.,[뉴욕마감]미·중 무역협상 '먹구름'에 소폭 하락,국제유가는 Fed의 금리 인하 및 경기 활성화에 따른 수요 증가 기대로 상승세를 이어갔다. 이날 뉴욕상업거래소(NYMEX)에서 9월 인도분 서부 텍사스산 원유(WTI)는 전날보다 배럴당 2.1%(1.18달러) 오른 58.05달러에 거래를...
1155,2019.07.30.,"울산 올 상반기 수출, 전국 최대 증가율","석유제품 수출은 국제유가 하락 및 중국, 대만 등의 정제설비 증설에 따른 수출단가의 하락 등의 영향으로 전년 동기 대비 3.6% 감소한 94억3300만 달러를 기록했다. 석유화학제품도 중국의 수요 부진 등에 따른..."
1156,2019.08.02.,트럼프 '對중 관세 폭탄' 예고에 美 금융시장 휘청(종합),"국제유가가 급락하고 미 금융시장도 흔들림이 컸다. 트럼프 대통령은 이날 트위터에 글을 올려 중국의 농산물 수입 확대ㆍ펜타닐(마약성 진통제) 수출 중단 약속 미이행을 거론하며 ""9월1일부터 남은 3000억달러(약..."
1157,2019.07.27.,휘발유 가격 두달 만에 상승 전환…경유는 하락세 지속,한국석유공사는 국제 유가가 사우디아라비아-쿠웨이트 국경지대 원유생산 재개 가능성 등의 하락 요인과 중동지역 긴장감 지속 등 상승요인의 영향을 받았다고 설명했습니다.■
1158,2019.07.31.,8월 1주 주요 제조업 전망,"1) 주요 실적 및 사건 □ 국제 유가 동향(30일 기준) - WTI(서부텍사스유) $58.05/bbl (전일 대비 $1.18, 2.07% 상승) - Dubai(두바이유) $63.22/bbl (전일 대비 $0.06, 0.09% 상승) - Brent(브렌트유) $64.72/bbl (전일 대비 $1.01, 1.59% 상승)..."
1159,2019.08.02.,"[모닝브리핑]北, 이틀만에 또 발사체 발사…정부, 日 화이트리스트 배제 대비...","◆국제유가, 트럼프 대중 관세 위협에 폭락…WTI 7.9%↓ 국제유가도 도널드 트럼프 미국 대통령의 중국산 제품 추가 관세 부과 예고에 폭락했습니다. 현지시간 1일 뉴욕상업거래소(NYMEX)에서 9월 인도분 서부 텍사스산..."
1160,2019.08.06.,[증시브리핑] 美 관세 반격한 中 위안화…뉴욕증시 최고 하락률 기록,"◇ 국제유가 국제유가는 미·중 무역전쟁 격화에 하락했습니다. WTI 1% 넘게 하락했고요. 브렌트유는 더 큰 하락률 보였습니다. ◇ 원·달러 환율 어제 원·달러환율이 1,220원까지도 올라갈 수 있다는 분석 전해드렸는데요...."
1161,2019.08.01.,수출 8개월째 '내리막'… 日 수출규제 앞두고 막막,"수출부진은 미중 무역분쟁 장기화 및 일본 수출 규제 등 대외 여건 악화, 반도체 업황부진 및 단가 하락, 국제유가 회복 지연에 따른 석유화학?석유제품 부진 등이 복합적으로 작용하고 있다. 단가 하락으로 반도체 28.1..."
1162,2019.07.22.,수출 하반기에도 여전히 `마이너스`,"이 가운데 중동을 상대로 한 수입액이 32.3% 줄었는데, 하락한 국제유가 영향이었다. 수출이 수입보다 더 크게 감소하면서 무역수지는 3억7000만달러 적자를 기록했다. 지난달(7억6000만달러 적자)에 비해 적자폭은..."
1163,2019.08.01.,수출 8개월 연속 감소…반도체 28.1%↓(종합),"산업부는 미중 무역분쟁 장기화, 일본 수출 규제 등 대외 여건이 나빠졌고 반도체 업황이 부진한 데다 국제유가 회복이 늦어지면서 석유화학 및 석유제품 수출이 부진했다고 설명했다. 반도체 수출은 전년..."
1164,2019.08.06.,"[오늘의 글로벌마켓] 뉴욕증시, 무역전쟁 확전 공포에 '블랙먼데이'",국제유가는 하락했다. 무역전쟁이 장기화하면 경기 침체로 원유 수요가 둔화할 것이라는 우려가 작용했다. 이날 뉴욕상업거래소(NYMEX)에서 9월 인도분 서부 텍사스산 원유(WTI)는 전거래일보다 배럴당 0.97달러(1.7...
1165,2019.07.13.,전국 휘발윳값 6주 연속 하락…서울·강원·제주 1천500원대,"한편 한국이 주로 수입하는 제품의 기준이 되는 두바이유는 배럴당 1.5달러 오른 64.0달러로 집계됐다. 한국석유공사는 ""석유수출국기구(OPEC)의 6월 원유생산 감소 등으로 국제유가가 상승했다""고 설명했다."
1166,2019.08.02.,INF파기 미중관세전 겹치자 한일무역전,"오전에 상승하던 뉴욕증시는 트럼프 트위터 발표 후 1% 넘게 급락하고, 국제유가도 급락했다. 이날 다우존스는 1.05% 하락, S&P500지수는 0.90% 하락, 나스닥종합지수는 0.79% 하락, 국제유가도 무역전쟁 재개로 경기둔화와..."
1167,2019.08.02.,"뉴욕증시, 무역전쟁 우려 지속 하락 출발","국제유가는 반등했다. 9월물 서부텍사스산 원유(WTI) 가격은 전 거래일보다 3.43% 급등한 55.79달러에, 브렌트유는 3.70% 오른 62.74달러에 움직였다. 시카고상품거래소(CME) 페드워치에 따르면 연방기금(FF) 금리선물..."
1168,2019.07.31.,美금리인하 기대 지속…WTI 2.1%↑,국제유가는 30일(현지시간) 상승세를 이어갔다. 이날 뉴욕상업거래소(NYMEX)에서 9월 인도분 서부 텍사스산 원유(WTI)는 전날보다 배럴당 2.1%(1.18달러) 오른 58.05달러에 장을 마감했다. 런던 ICE 선물거래소의 9월물...
1169,2019.07.24.,"IMF, 올해 세계 성장전망 또 낮췄다…미 '나홀로' 순항",지난 4월 이후 미국과 중국 간 무역 긴장이 이어진 데다 브렉시트의 불확실성이 지속되고 국제유가 변동이 심한 점을 이유로 꼽았습니다. 반면 미국의 경제성장률은 0.3%p 높은 2.6%로 제시했습니다....
1170,2019.07.19.,지난달 생산자물가 5개월만에 하락,"휘발유 10.8%, 수박 17.1% 내려 국제유가와 농산물 가격 하락 영향으로 생산자물가가 5개월만에 내렸다. 19일 한국은행이 발표한 ‘6월 생산자물가지수’는 103.49(2015년=100)로 한달 전보다 0.3% 내렸다...."
1171,2019.07.28.,"한은 ""日 고용여건 좋지만 임금 하락세…저임금근로 증가 영향""",덕에 급격한 둔화가 나타날 가능성은 낮은 것으로 전망됐습니다. 국제유가는 미중 무역 분쟁과 주요국의 경기부진 우려로 수요가 줄어들면서 약세 기조를 이어갈 것으로 한국은행은 예상했습니다. 김수진 기자 (sj@mbc.co.kr)
1172,2019.08.01.,7월 수출 11% 감소한 461억달러 기록…8개월 연속 마이너스,"산업부 관계자는 수출 부진 요인으로 ""미중 무역분쟁 장기화 및 일본 수출 규제 등 대외 여건 악화, 반도체 업황부진 및 단가 하락, 국제유가 회복 지연에 따른 석유화학·석유제품 부진 등이 복합적으로 작용했다""고..."
1173,2019.07.14.,"한은, 2.5% 성장전망 낮출듯…결단만 남은 '금리인하'","국제유가 약세 등을 감안해 한은이 소비자물가상승률 전망치를 0%대로 낮출 것으로 보는 시각이 많다. 신얼 SK증권 연구원은 ""10월 추가 수정경제전망 발표를 고려하면 이번에 한은이 성장률 전망치를 0.1~0.2%p 하향 조정할..."
1174,2019.07.12.,6월 수출입물가 동반↓…원·달러 환율 하락 영향,지난달 수입물가 지수는 109.58로 국제유가 하락의 영향으로 전월에 견줘 3.5% 내려 5개월 만에 오름세가 꺾였다. 전년 동월과 비교하면 0.4% 내려 17개월 만에 하락 반전했다. 두바이유 평균 가격은 지난달 배럴당 61....
1175,2019.08.01.,유가·채소 가격 '뚝'…소비자물가 7개월 연속 0%대,올해들어 소비자물가 상승률이 0%대로 뚝 떨어진 것은 국제유가와 채소류 가격 하락 탓이다. 채소류 가격이 6.4% 크게 하락했다. 최근 생산량이 크게 증가한 양파(-14.6%)와 마늘(-15.3%) 등의 하락 폭이 컸다. 이밖에 무...
1176,2019.08.07.,[국제유가] 美-中 힘싸움 지속에 유가 하락 지속…WTI 53.63달러,美-中 힘싸움 지속에 유가 하락 지속…WTI 53.63달러 미중 무역갈등이 심화되는 양상을 보이며 국제유가가 하락세를 지속했다. 7일 한국석유공사에 따르면 지난 6일(현지시간) 뉴욕상업거래소(NYMEX)에서 거래된 미국...
1177,2019.08.01.,수출 8개월 연속 부진…“일본 수출규제 영향은 ‘제한적’”,"정부는 수출부진과 관련해 미·중 무역분쟁 장기화와 일본 수출규제 등 대외 여건 악화, 반도체 업황부진 및 단가 하락, 국제유가 회복 지연에 따른 석유화학·석유제품 부진 등이 복합적으로 작용한 결과라고..."
1178,2019.07.31.,"[뉴욕증시] 트럼프, 中 비판…무역협상 우려에 하락","상승 [국제유가] 연준 금리 인하 기대감에 상승 다우 : -0.09% 27,198p / 나스닥 : -0.24% 8,273p / S&P500 : -0.26% 3,013p < 뉴욕증시 > 오늘 뉴욕증시 3대 지수는 일제히 하락했습니다. 간밤에 트럼프 대통령이 중국에 대해 비판을..."
1179,2019.07.26.,[뉴욕마감] 금리인하 기대 뚝…3대지수 일제히 뚝,국제유가는 소폭 올랐다. 이날 뉴욕상업거래소(NYMEX)에서 9월 인도분 서부 텍사스산 원유(WTI)는 전날보다 배럴당 14센트(0.3%) 상승한 56.02달러에 거래를 마쳤다. 국제유가의 기준물인 9월물 북해산 브렌트유는 영국...
1180,2019.07.31.,"뉴욕증시, 미·중 무역협상 우려 하락 출발","국제유가는 상승했다. 9월물 서부텍사스산 원유(WTI) 가격은 전 거래일보다 0.6% 오른 57.21달러에, 브렌트유는 0.74% 상승한 64.18달러에 움직였다. 시카고상품거래소(CME) 페드워치에 따르면 연방기금(FF) 금리선물 시장은..."
1181,2019.08.02.,[글로벌스톡] 금주 눈여겨 볼 상품은? 마른 돼지(Lean Hog),"국제유가의 흐름은? - 국제유가 55~60불 박스권 유지 전망 - 중동발 악재, 브렌트유 · 두바이유에 영향 - 중동발 악재, WTI 영향… 미미할 전망 생방송 [굿모닝530글로벌 2부]는 매일 오전 06시 20분 ~ 07시 20분에 여러분과..."
1182,2019.07.24.,"국내 정유사, 올 상반기 석유제품 수출량 역대 두 번째","국제유가 하락으로 수출단가가 내린 영향이다. 실제 올해 상반기 석유제품 수출단가는 배럴당 73.6 달러로 전년 동기 대비 5.8% 감소했다. 대한석유협회 관계자는 “미중 무역분쟁 심화, 정제마진 악화 등 경영환경이..."
1183,2019.08.05.,[주간광물] 종합지수 3.1% 하락… 유연탄은 9.1% 하락,7월5주차 국제유가의 전주대비 1% 하락과 중국 주요항의 수입제한 조치 등으로 하방압력 발생한데 따른 것으로 분석된다. 우라늄은 파운드당 20달러 중반선에서 박스권 횡보를 계속 유지하고 있다. 7월...
1184,2019.08.05.,“美 원유재고 7주 연속 감소” 기름값 다시 오르나 촉각,한국석유공사 관계자는 “국제유가는 미국 원유재고의 7주 연속 감소와 중동지역 긴장 지속 등 상승요인과 미국의 중국산 수입품에 대한 관세 부과 예고 등 하락요인이 혼재해 강보합세를 보였다”고 말했다.
1185,2019.07.31.,"[모닝브리핑]北, 엿새만에 발사체 발사…트럼프, 中 무역합의 '압박'","◆ 국제유가, 금리인하 기대에 상승지속…WTI 2.1%↑ 국제유가는 올랐습니다. 뉴욕상업거래소(NYMEX)에서 9월 인도분 서부 텍사스산 원유(WTI)는 배럴당 2.1%(1.18달러) 오른 58.05달러를 기록했습니다. 유가는 미국 중앙은행..."
1186,2019.08.02.,트럼프 '對中 관세폭탄' 위협에 WTI 7%대 폭락…4년만 최대폭,국제유가가 1일(현지시간) 도널드 트럼프 미국 대통령의 중국 추가관세 예고에 폭락했다. 이날 뉴욕상업거래소(NYMEX)에서 9월 인도분 서부 텍사스산 원유(WTI)는 전 거래일보다 배럴당 7.9%(4.63달러) 미끄러진 53....
1187,2019.08.07.,유가 하락세 지속,국제유가는 하락세를 이어갔다. 6일 뉴욕상업거래소에서 9월물 서부 텍사스산 원유(WTI)는 전날보다 배럴당 1.9%(1.06달러) 하락한 53.63달러에 거래를 마쳤다. 환율 부문까지 확전 양상을 보이는 '미·중 무역전쟁'이...
1188,2019.08.06.,6월 경상수지 63억8천만달러...8개월 만 최대 흑자,국제유가의 약세가 이어지고 있는 가운데 반도체 수출 부진으로 인해 기계류의 수입 감소세가 이어졌다. 6월 수입은 전년동월 대비 11.8% 줄어든 377억 2000만달러를 나타냈다. 수출과 수입 모두 지난 2월 이후...
1189,2019.08.08.,"[속보] 뉴욕증시 다우지수 와르르, 중국 위안화 공시환율 7선 붕괴 …코스피 ...",코스피 코스닥 원달러환율 그리고 국제유가와 국제금값 등은 은 중국 인민은행의 공시환율이 7선을 넘어설 것인가에 귀추를 주목하고 있다. 미국 뉴욕증시 다우지수 나스닥지수 S&P 500 지수...
1190,2019.08.08.,"[속보] 뉴욕증시 다우지수 와르르, 중국 위안화 공시환율 7선 붕괴 …코스피 ...",코스피 코스닥 원달러환율 그리고 국제유가와 국제금값 등은 은 중국 인민은행의 공시환율이 7선을 넘어설 것인가에 귀추를 주목하고 있다. 미국 뉴욕증시 다우지수 나스닥지수 S&P 500 지수...
