,날짜,제목,요약
0,2019.03.09.,"국제유가, 美고용악화 속 약세…WTI 1.0%↓",이준서 특파원 = 국제유가는 8일(현지시간) 1% 안팎 하락했다. 이날 뉴욕상업거래소(NYMEX)에서 4월 인도분 서부 텍사스산 원유(WTI)는 배럴당 0.59달러(1.0%) 하락한 56.07달러에 거래를 마쳤다. 이번주 주간으로는 0.5...
1,2019.03.10.,유가하락에 떠는 원유 DLS 투자자,지난해 10월을 기점으로 국제유가가 하락하면서 관련 DLS 투자자들의 불안감도 커지고 있다. 10일 금융투자업계에 따르면 서부텍사스산원유(WTI)를 기초로 삼은 DLS의 미상환 잔액은 올해 2월 말 기준 7364억원에...
2,2019.03.09.,유가 3주째 상승…기름값 공포 시작되나,국제유가의 급락과 정부의 유류세 인하 조치로 수혜를 누렸던 소비자들이 다시 기름값 상승 공포감에 휩쌓일 것으로 우려된다. 9일 한국석유공사 유가정보서비스 오피넷에 따르면 3월 첫째 주 전국 주유소의 보통...
3,2019.03.08.,"[국제유가] WTI, 베네수엘라 공급 차질우려에 상승",국제유가가 베네수엘라 공급 차질 우려가 부각되며 상승했다. 7일(현지시간) 뉴욕상업거래소(NYMEX)에서 4월 인도분 서부 텍사스산 원유(WTI)는 전 거래일 대비 배럴당 0.44달러(0.8%) 오른 56.66달러에 거래를 마쳤다....
4,2019.03.09.,"국제유가, 세계 성장 둔화 우려 부각되며 하락","김민정 특파원 = 국제유가가 8일(현지시간) 상승했다. 중국과 유로존(유로화 사용 19개국), 미국의 성장 둔화 우려가 다시 부각되면서 유가는 하락 흐름을 보였다. 원유 채굴장비[사진=로이터 뉴스핌] 뉴욕상업거래소..."
5,2019.03.05.,2월 소비자물가 전년비 0.5%↑…유가·채솟값 안정세,국제유가 안정과 유류세 인하 효과 덕에 전체 소비자물가 상승폭이 2년6개월만에 최저를 기록했다. 지난해 2월 한반도를 덥친 한파에 치솟았던 채소류 가격이 올해는 안정세를 보인 것도 전체 물가를 낮추는데...
6,2019.03.05.,유가ㆍ채솟값 하락에 2월 물가 0.5%↑ 30개월 만에 최저,통계청 ‘2월 소비자 물가동향’ 발표 국제유가 하락으로 국내 석유류 가격이 크게 떨어지고 채소값도 줄줄이 하락하며 지난달 소비자 물가 상승률이 2년 6개월 만에 가장 낮은 수준을 기록했다. 통계청이 3일...
7,2019.03.07.,"국제 유가, 美 원유재고 증가에 혼조 마감...WTI 0.6%↓ 브렌트 0.2%↑","국제 유가는 6일(현지시간) 미국 원유 재고량 증가 여파로 혼조세를 보이며 마감했다. 뉴욕상업거래소(NYMEX)에서 이날 서부 텍사스산 원유(WTI) 4월 인도분은 전일대비 0.34달러, 0.6% 하락한 배럴당 56.22달러로..."
8,2019.03.08.,[국제유가] 베네수엘라 수송 차질 영향 상승… 'WTI 56.66달러',국제유가가 베네수엘라 국영 PDVSA사의 원유 수송 차질 영향으로 상승했다. 8일 한국석유공사에 따르면 7일(현지 시간) 뉴욕상업거래소(NYMEX)에서 거래된 서부텍사스산원유(WTI)는 배럴당 56.66달러로 전날보다 0....
9,2019.03.08.,"유가 반등, 유류세 인하 종료…올해 국내 기름값 폭등설 솔솔","[이데일리 남궁민관 기자] 국제유가가 지난해 말 저점을 찍고 최근 빠르게 오르고 있는 가운데, 국내 기름 가격 역시 뚜렷한 반등 기미를 보이고 있다. 이 같은 흐름에 더해 오는 5월 정부의 유류세 인하 조치가..."
10,2019.03.05.,유가하락 영향 2월 물가 0.5% 상승… 2년 6개월만에 최저(종합),국제유가가 하락하면서 공업제품이 안정세를 보이고 채소가격도 전년 대비 하락했기 때문이다. 외식 등 개인 서비스 등의 경우 최저임금 인상 여파로 가격 상승률이 상대적으로 높았다. 한국은행의 통화정책...
11,2019.03.06.,"국제유가, 보합권서 '혼조'…WTI↓·브렌트유↑",국제유가가 5일(현지시간) 보합권에 머물렀다. 내일(6일) 발표되는 미국의 원유재고 지표를 주목하는 분위기다. 이날 뉴욕상업거래소(NYMEX)에서 4월 인도분 서부 텍사스산 원유(WTI)는 전 거래일보다 배럴당 0.03달러...
12,2019.03.09.,"[GAM] 국제유가·금속, 상승 여건있으나 뒷심 부족",◆ 유가 약세 기조…상승세 지속 여부 불투명 2월 국제유가는 투자심리 개선으로 2개월 연속 상승했다. 미 서부텍사스산원유(WTI) 가격은 전월말 대비 6.4% 상승했다. 사우디아라비아의 적극적 감산 의지 표명과 미·중...
13,2019.03.08.,"유가 반등, 유류세 인하 종료…올해 국내 기름값 폭등설 솔솔","[이데일리 남궁민관 기자] 국제유가가 지난해 말 저점을 찍고 최근 빠르게 오르고 있는 가운데, 국내 기름 가격 역시 뚜렷한 반등 기미를 보이고 있다. 이 같은 흐름에 더해 오는 5월 정부의 유류세 인하 조치가..."
14,2019.03.09.,"국제유가 하락, 서부텍사스산 원유 배럴당 56.07달러",미국 고용부진 소식에 국제유가가 1% 가량 하락 마감됐다. 연합뉴스에 따르면 뉴욕상업거래소(NYMEX)에서 8일(현지시간) 거래된 4월 인도분 서부텍사스산 원유(WTI)는 전일 보다 배럴당 0.59달러(1.0%) 내려선 56....
15,2019.03.05.,"국제유가, 미중 협상타결 전망 속 강세…WTI 1.4%↑",이준서 특파원 = 국제유가는 4일(현지시간) 상승했다. 이날 뉴욕상업거래소(NYMEX)에서 4월 인도분 서부 텍사스산 원유(WTI)는 전 거래일보다 배럴당 0.79달러(1.4%) 오른 56.59달러에 거래를 마쳤다. 런던 ICE...
16,2019.03.08.,"국제유가, 베네수엘라 석유 수출 차질에 반등","['美 제재' 베네수엘라 국영석유회사, 요금 미납으로 유조선 해외 억류 ] 국제유가가 사흘만에 반등했다. 정권 교체 문제로 미국의 제재를 받고 있는 베네수엘라가 석유 수출에 차질을 빚고 있다는 소식이 주효했다...."
17,2019.03.08.,[국제유가] 베네수엘라 수송 차질 영향 상승… 'WTI 56.66달러',국제유가가 베네수엘라 국영 PDVSA사의 원유 수송 차질 영향으로 상승했다. 8일 한국석유공사에 따르면 7일(현지 시간) 뉴욕상업거래소(NYMEX)에서 거래된 서부텍사스산원유(WTI)는 배럴당 56.66달러로 전날보다 0....
18,2019.03.08.,[국제유가] WTI 0.8% 상승...베네수엘라 원유 수출 차질 우려,뉴욕 유가는 베네수엘라의 원유 수출 차질 우려 등으로 상승했다. 7일 뉴욕상업거래소에서 4월물 서부... PDVSA가 해상 비상사태(maritime emergency)를 선포했다는 소식이 전해지면서 유가가 상승 압력을 받았다. PDVSA...
19,2019.03.05.,"2월 소비자물가 상승률 2년 6개월만에 최저…""유가·채솟값 하락 반영""",국제유가 하락세가 이어진 가운데 농축산물 가격이 떨어진 영향으로 풀이된다. 통계청이 5일 발표한 '2019년 2월 소비자물가동향'에 따르면 지난달 소비자물가지수는 104.69(2015년=100)로 전년 동월 대비 0.5...
20,2019.03.09.,"유가 하락, WTI 56.07달러…美 2월 고용지표 악화",국제유가가 소폭 하락했다. 9일 한국석유공사에 따르면 8일(현지시간) 뉴욕상업거래소(NYMEX)의 WTI(서부텍사스산원유)는 전일대비 배럴당 0.59달러 하락한 56.07달러로 장을 마감했다. 런던거래소(ICE)의 브렌트...
21,2019.03.08.,"뉴욕증시,ECB 직격탄 다우지수 0.78%↓…국제유가 WTI 0.8%↑",국제유가는 주요 산유국인 베네수엘라의 정정 불안으로 상승했다. 이날 뉴욕상업거래소(NYMEX)에서 4월 인도분 서부 텍사스산 원유(WTI)는 전날보다 배럴당 0.44달러(0.8%) 오른 56.66달러에 거래를 마쳤다. 이날...
22,2019.03.09.,[국제유가] 美고용지표 부진에 투자심리 위축...WTI 1.2%↓,이영노 기자 ynlee@ajunews.com 8일(현지시간) 국제유가가 하락했다. 이날 발표된 미국 고용지표가 예상 외로 부진하게 나오면서 시장은 충격을 받은 모습이다. 이날 뉴욕상업거래소(NYMEX) 4월 인도분...
23,2019.03.06.,[국제유가] 中 성장률 목표 하향 WTI 0.1% 하락,뉴욕 유가는 중국의 올해 성장률 목표치 하향 조정과 리비아 최대 유전의 생산재개 소식 등으로 소폭... 제기되면서유가 상승 기대가 유지됐다. 이날은 중국이 성장률 전망치를 낮춘 점이 유가에 부정적으로 작용했다....
24,2019.03.07.,[국제유가] 美 원유재고 증가 부담에 WTI 0.6% 하락,뉴욕 유가는 미국 원유재고가 예상보다 큰 폭 증가한 데 따라 하락했다. 6일 뉴욕상업거래소에서 4월물... 미국 재고가 예상보다 큰 폭 늘어난 점이 유가 하락을 촉발했다. 미국석유협회(API)는 전일 장 마감 이후 지난주...
25,2019.03.05.,"국제유가, 'OPEC 감산 연장' 소식에 반등","[OPEC, 6월 감산 합의 연장 추진…미중 정상 무역분쟁 합의 기대] 국제유가가 반등했다. 사우디아라비아 주도의 OPEC(석유수출국기구)이 감산을 연장할 것이란 보도가 기름값을 밀어올렸다. 미중 양국이 오는 27일쯤..."
26,2019.03.02.,"국제유가, 美지표 부진에 급락…WTI 2.5%↓",이귀원 특파원 = 국제유가는 1일(현지시간) 나흘 만에 하락세로 돌아섰다. 이날 뉴욕상업거래소(NYMEX)에서 4월 인도분 서부 텍사스산 원유(WTI)는 전날보다 배럴당 2.5%(1.42달러) 하락한 55.80달러에 장을 마쳤다....
27,2019.03.08.,"국제유가, 달러 강세·성장 둔화 우려에도 상승",김민정 특파원 = 국제유가가 7일(현지시간) 상승했다. 석유수출국기구(OPEC)와 러시아 등 주요 산유국의 감산 정책이 이날 유가를 지지했다. 다만 유가 상승은 유로존(유로화 사용 19개국)의 경제 성장 둔화 우려와 달러...
28,2019.02.27.,"국제유가 반등…OPEC ""트럼프 무시하고 계속 감산""","[트럼프 ""유가 너무 오른다…OPEC 진정하라"" 경고에 OPEC 무시 전략] 국제유가가 26일(현지시간) 반등했다. 전날 OPEC(석유수출국기구)의 감산을 비판한 도널드 트럼프 미국 대통령의 트윗에도 불구하고 OPEC이 감산을..."
29,2019.03.05.,[국제유가] OPEC+ 감산 지속 기대에 WTI 1.4% 상승,뉴욕 유가는 석유수출국기구(OPEC)와 주요 산유국의 감산이 이어질 것이란 기대로 상승했다. 4일... 미·중 무역협상이 조만간 타결될 것이란 전망이 점차 강화되는 점도 유가에 긍정적으로 작용했다. 월스트리트저널은...
30,2019.02.28.,"국제유가, 美원유재고 감소에 급등…WTI 2.6%↑",이귀원 특파원 = 국제유가는 27일(현지시간) 큰 폭의 상승을 기록했다. 이날 뉴욕상업거래소(NYMEX)에서 4월 인도분 서부 텍사스산 원유(WTI)는 전날보다 배럴당 2.6%(1.44달러) 오른 56.94달러에 장을 마쳤다. 런던 ICE...
31,2019.03.07.,[국제유가] 美 재고 증가 영향 하락… 'WTI 56.22달러',국제유가가 예상치를 상회한 미국의 원유 재고 증가 영향으로 하락했다. 7일 한국석유공사에 따르면 6일(현지 시간) 뉴욕상업거래소(NYMEX)에서 거래된 서부텍사스산원유(WTI)는 배럴당 56.22달러로 전날보다 0....
32,2019.03.06.,"[국제유가] WTI, 보합권 혼조세… 리비아 생산 재개 부각",국제유가가 보합권 내 혼조세를 나타냈다. 5일(현지시간) 뉴욕상업거래소(NYMEX)에서 4월 인도분 서부 텍사스산 원유(WTI)는 전 거래일 대비 배럴당 0.03달러(-0.1%) 하락한 56.56달러에 거래를 마쳤다. 국제유가는 중국의...
33,2019.02.22.,유가 반등 영향 '아직'…생산자물가 4개월째 하락,인건비 등 상승에 건축물 청소·음식점 물가 상승 국제유가가 반등했음에도 생산자물가가 4개월 연속 내렸다. 원유 도입 시차 때문에 작년 말 유가 하락 여파가 이어진 것으로 분석된다. 한국은행이 22일 발표한...
34,2019.03.08.,[국제유가]원유 수급 불안에 상승세,주요 산유국인 베네수엘라의 정정 불안으로 인한 원유 수급 불안이 퍼지면서 유가에 상승 압력을 가했다. 특히 베네수엘라의 국영 석유회사 'PDVSA'가 비상사태를 선포했다는 소식이 유가를 지지했다. 이날...
35,2019.03.06.,[국제유가] '감산추진 Vs 재고증가' 영향 보합… 'WTI 56.56달러',국제유가가 OPEC 및 주요 산유국들의 감산 추진과 미국 원유재고 증가 전망 영향 등으로 보합세를 나타냈다. 6일 한국석유공사에 따르면 5일(현지 시간) 뉴욕상업거래소(NYMEX)에서 거래된 서부텍사스산원유(WTI)는...
36,2019.02.27.,국제유가 소폭 반등…WTI 0.05%↑,이준서 특파원 = 국제유가는 26일(현지시간) 강보합세를 보였다. 이날 뉴욕상업거래소(NYMEX)에서 4월 인도분 서부 텍사스산 원유(WTI)는 전날보다 배럴당 0.02달러(0.05%) 상승한 55.50달러에 거래를 마쳤다. 런던 ICE...
37,2019.03.08.,[국제유가] 소폭 반등...상승폭 여전히 제한적 WTI 0.8%↑,이영노 기자 ynlee@ajunews.com 7일(현지시간) 국제유가가 상승했다. 이날 뉴욕상업거래소(NYMEX) 4월 인도분 서부텍사스산원유(WTI)는 전장 대비 0.44달러(0.8%) 오른 배럴당 56.66달러를 기록했다. 영국 런던 ICE선물거래소...
38,2019.02.26.,"""기름값 너무 오른다""…트럼프 한마디에 국제유가 3% 급락",도널드 트럼프 미국 대통령의 짤막한 경고에 국제 유가가 3%대 급락세를 보이며 상승세에 제동이 걸렸다. 25일(현지시간) 뉴욕상업거래소(NYMEX)에서 4월 인도분 서부텍사스산원유(WTI)는 전 거래일보다 배럴당 1.78달러...
39,2019.03.02.,"국제유가, 글로벌 제조업지표 부진에 큰 폭 하락",국제유가가 미국과 중국의 제조업 지표 부진에 큰 폭으로 하락했다. 1일(현지시간) 마켓워치에 따르면 이날 뉴욕상업거래소(NYMEX)에서 4월 인도분 미 서부텍사스산원유(WTI) 가격은 전일 대비 2.5%(1.42달러) 하락한...
40,2019.03.08.,7일 국제유가 상승,"한국석유공사는 7일 국제유가는 베네수엘라 국영 PDVSA사의 원유수송 차질, 자발적 및 비자발적 공급감소 등의 영향으로 상승했고, OECD의 세계 경제성장률 하향 전망, 미 달러화 강세 등은 상승폭을..."
41,2019.03.05.,유가 상승ㆍ정제마진 반등 조짐…정유사업 회복하나,추락하던 국제유가가 안정세에 이어 오름세로 돌아서면서 ‘어닝 쇼크’에 빠졌전 정유업계 실적 회복 기대감이 싹트고 있다. 유가 흐름에 촉각을 곤두세울 수밖에 없는 정유업계는 추이를 지켜보며 실적에 미칠...
42,2019.03.06.,유가·채소값 하락에 물가 주춤,"석유류는 국제유가 하락과 유류세 인하 영향으로 지난해 대비 11.3% 떨어지면서 전체 물가를 0.51%p 끌어내렸다. 품목별로 휘발유가 -14.2%로 가장 큰폭으로 떨어졌으며, , 경유 -8.9%·자동차용LPG -9.9%를 기록했다...."
43,2019.03.04.,“트럼프 우려에도 국제유가 연내 배럴당 60달러 간다”,도널드 트럼프 미국 대통령이 유가 강세에 대해 우려를 제기한 이후 국제유가 단기 변동성이 확대되고 있다. 사우디아라비아는 석유시장 안정화 의지를 재천명한 상태여서 유가 하방경직성도 강화되는 분위기다....
44,2019.03.05.,[국제유가] OPEC 감산 전망에 보합세…’WTI 56.59달러’,"국제유가가 미·중 무역협상 타결 임박, OPEC 2월 원유생산량 감소 예상 속에서 소폭 상승했다. 5일 한국석유공사에 따르면 4일(현지 시간) 뉴욕상업거래소(NYMEX)에서 거래된 서부텍사스산원유(WTI)는 배럴당 56...."
45,2019.03.07.,트럼프 vs OPEC '2라운드'…국제 유가 향방은?,"업계는 이런 흐름에 국제유가가 더 이상 오르기 어렵다고 보고 있다. 업계 관계자는 ""미국이 내년에 에너지 순수출국 전환을 앞두고 있어 셰일 증산과 수출을 줄이지 않을 것""이라고 말했다. 그러면서 ""OPEC도 감산을..."
46,2019.03.08.,"ECB 성장률 대폭하향, 뉴욕증시 하락 다우지수 0.78%↓…국제유가 WTI 0.8%↑",국제유가는 상승마감했다. 이날 뉴욕증권거래소(NYSE)에서 다우존스산업평균지수는 0.78% 하락한 2만5473.23으로 거래를 마쳤다. 스탠다드앤푸어스(S&P)500지수는 0.81% 내린 2748.93을 나타냈다. 기술주 중심의...
47,2019.03.07.,"뉴욕증시, 美 경기지표 부진…다우지수 0.52%↓…국제유가 WTI 0.6%↓",국제유가는 미국 원유 재고가 큰 폭 증가 여파로 약세를 나타냈다. 이날 뉴욕상업거래소(NYMEX)에서 4월 인도분 서부 텍사스산 원유(WTI)는 전날보다 배럴당 0.34달러(0.6%) 하락한 56.22달러에 거래를 마쳤다....
48,2019.03.05.,"[국제유가] WTI, 감산 지속 기대감에 상승",국제유가가 감산 지속 기대감에 상승했다. 이날 뉴욕상업거래소(NYMEX)에서 4월 인도분 서부 텍사스산 원유(WTI)는 전 거래일 대비 배럴당 0.79달러(1.4%) 오른 56.59달러에 거래를 마쳤다. 국제유가는 석유수출국기구...
49,2019.03.10.,다시 상승하는 유가…유류세 인하 종료후 기름값 공포 '솔솔',"한국석유공사 측은 ""국제유가는 2월 석유수출국기구(OPEC) 원유생산량 감소 전망과 러시아 감산 목표 달성 가능성 등 상승요인과 미국 원유재고 증가 및 리비아 유전 생산 재개라는 하락요인이 혼재해 보합세를 보였다..."
50,2019.02.26.,"국제유가, 트럼프 압박 속 급락…WTI 3.1%↓",이준서 특파원 = 국제유가는 25일(현지시간) 3%대 급락했다. 이날 뉴욕상업거래소(NYMEX)에서 4월 인도분 서부 텍사스산 원유(WTI)는 전 거래일보다 배럴당 1.78달러(3.1%) 하락한 55.48달러에 거래를 마쳤다. 런던 ICE...
51,2019.02.28.,"국제유가, 美 원유 재고 감소에 큰 폭 상승",국제유가가 미국 원유 재고 감소 소식에 큰 폭으로 상승했다. 27일(현지시간) 마켓워치에 따르면 이날 뉴욕상업거래소(NYMEX)에서 4월 인도분 미 서부텍사스산원유(WTI) 가격은 전일 대비 2.6%(1.44달러) 상승한...
52,2019.03.08.,[주간유가] 휘발유·경유 판매가격 3주 연속 상승,"국제유가는 2월 OPEC 원유생산량 감소 전망과 러시아 감산목표 달성 가능 시사 등의 상승요인과 미 원유재고 증가, 리비아 유전 생산 재개 등의 하락요인이 혼재하면서 보합을 이뤘다. 국내제품가격은 기존..."
53,2019.03.06.,"국제유가, 美 재고 지표 기다리며 보합권",김민정 특파원 = 국제유가가 5일(현지시간) 보합권에서 마감했다. 내일(6일) 미 에너지정보청(EIA)이 발표하는 지난주 원유 재고 지표와 미국과 중국의 무역 합의 세부사항을 기다리면서 시장은 잠시 쉬어가는 모습을...
54,2019.03.09.,中 수출쇼크 & 美 고용쇼크...미국증시 & 국제 유가 '동반 하락',"8일(미국시각) 국제 유가가 전날의 상승세를 뒤로하고 하락했다. 중국의 2월 수출 격감, 미국의 2월 고용지표 악화 속에 위험자산 선호 현상이 약화되고 글로벌 원유수요 둔화 우려감이 부각됐다. 미국 경제방송 CNBC에..."
55,2019.03.06.,뉴욕증시·국제유가 보합,국제유가도 보합세를 보였다. 이날 뉴욕상업거래소(NYMEX)에서 4월 인도분 서부 텍사스산 원유(WTI)는 전날보다 배럴당 0.03달러(0.1%) 하락한 56.56달러에 거래를 마쳤다. 국제금값은 7거래일 연속 떨어졌다....
56,2019.03.06.,국제유가 서부텍사스산 원유 배럴당 56.56달러…소폭하락,국제유가는 서부텍사스산 원유(WTI)를 기준으로 소폭 하락했다. 연합뉴스에 따르면 5일(현지시간) 뉴욕상업거래소(NYMEX)에서 4월 인도되는 서부텍사스산 원유가 전일보다 배럴당 0.03달러(0.1%) 하락한 56.56달러에...
57,2019.03.01.,국제유가 사흘째 오름세…WTI 0.5%↑,이준서 특파원 = 국제유가는 28일(현지시간) 3거래일 연속으로 올랐다. 이날 뉴욕상업거래소(NYMEX)에서 4월 인도분 서부 텍사스산 원유(WTI)는 전날보다 배럴당 0.28달러(0.5%) 상승한 57.22달러에 거래를 마쳤다....
58,2019.02.26.,"국제유가, 트럼프 압박에 3%대 급락",국제유가가 도널드 트럼프 미국 대통령의 압박에 3% 넘게 하락했다. 25일(현지시간) 마켓워치에 따르면 이날 뉴욕상업거래소(NYMEX)에서 4월 인도분 미 서부텍사스산원유(WTI) 가격은 전일 대비 3.1%(1.78달러) 하락한...
59,2019.02.19.,다시 오른 국제유가...전달 수입물가 반등,자료 : 한국은행 국제유가가 소폭 오르면서 수입물가가 반등세를 보였다. 반대로 반도체 가격 하락세에 영향을 받은 수출물가는 3개월 연속 하락했다. 한국은행이 19일 발표한 '2019년 1월 수출입물가지수'를 보면...
60,2019.03.07.,"[국제유가] 6일 Dubai․Brent유 ↑, WTI ↓",6일 국제유가는 중동산 두바이유를 비롯해 북해산 브렌트유가 상승한 가운데 서부 텍사스산 원유는 하락했다. 한국석유공사(사장 양수영)는 6일 서부 텍사스산 원유인 WTI가 전일대비 배럴당 0.34달러 하락한 56....
61,2019.03.06.,"미중 무역협상 관망, 뉴욕증시 다우 0.05%↓…국제유가 WTI 0.05%↓",국제유가도 이날 소폭 하락했다. 이날 뉴욕증권거래소(NYSE)에서 다우존스산업평균지수는 0.05% 하락한 2만5806.63을 기록했다. 스탠더드앤드푸어스(S&P500)지수는 0.11% 내린 2789.65를 나타냈다. 기술주 중심의...
62,2019.03.02.,[국제유가] 美 경제지표 부진 여파 WTI 2.5% 급락,"뉴욕 유가는 미국 경제지표 부진으로 수요 둔화 우려가 부상하면서 큰 폭 하락했다. 1일... 유가는 장초반 소폭 올랐지만, 지표가 발표된 이후 가파르게 반락했다. 프라이스 퓨처 그룹의 필 플라얀 연구원은 ""시장이..."
63,2019.02.23.,휘발유·경유 넉 달 만에 하락세 중단...국제유가 상승 영향,"최근 국제유가가 오르면서 국내 휘발유와 경유 가격이 꿈틀거리고 있습니다. 지난해 11월, 정부가 유류세를 내린 이후 줄곧 하락세를 유지하던 유가가 넉 달 만에 상승 전환했습니다. 김현우 기자가 보도합니다. [기자]..."
64,2019.02.23.,"[원자재시황] 국제유가, 미중 무역협상 기대감에 상승..WTI 0.5%↑",국제유가는 22일(현지시간) 미중 무역협상 기대감에 상승 마감했다. 이날 뉴욕상업거래소(NYMEX)에서 4월 인도분 서부 텍사스산 원유(WTI)는 전날보다 배럴당 0.30달러(0.5%) 오른 57.26달러에 거래를 마쳤다. 이는 지난해...
65,2019.03.02.,"'美 소비 쇼크', 국제유가 2%대 급락","[美 PMI, 시장예상치 하회…개인소비도 10년만에 최대 감소] 국제유가가 급락했다. 부진한 미국의 생산·소비 지표가 석유 수요 둔화에 대한 우려를 자극했다. 1일(현지시간) 오후 3시20분 현재..."
66,2019.03.01.,[국제유가] 사우디 감산 기대에 WTI 0.5% 상승,뉴욕 유가는 사우디아라비아 등 주요 산유국의 감산 지속 기대로 소폭 상승했다. 28일 뉴욕상업거래소에서... 사우디가 전일 도널드 트럼프 미국 대통령의 견제에도 감산을 지속하겠다는 방침을 천명하면서 유가 상승...
67,2019.03.08.,[국제유가]WTI 0.8% 반등…OPEC감산효과 지속 + 美 베네수 제재,석유수출국기구(OPEC) 감산효과와 베네수엘라 및 이란에 대한 미 제재가 유가를 끌어올렸다. 다만 뉴욕주가 하락과 미 원유재고 급증 악재가 유가의 추가 상승을 제한했다. 뉴욕상업거래소(NYMEX)에서 WTI 선물은...
68,2019.03.06.,[국제유가] 뚜렷한 방향성 없이 혼조세 마감...WTI 0.05%↓,이영노 기자 ynlee@ajunews.com 5일(현지시간) 국제유가가 혼조세를 보였다. 이날 뉴욕상업거래소(NYMEX) 4월 인도분 서부텍사스산원유(WTI)는 전장 대비 0.03달러(0.05%) 빠진 배럴당 56.56달러를 기록했다. 영국 런던...
69,2019.03.05.,1일 국제유가 하락,"한국석유공사는 1일 국제유가는 미국 등 부진한 제조업 지표 발표로 세계 경제성장 둔화 우려 재부각, 미 달러 강세 등의 영향으로 하락했고, 2월 OPEC 원유 생산 및 베네수엘라 수출 감소, 미 원유 시추기 수..."
70,2019.02.24.,"한은 ""국제유가 완만한 상승, 변동폭 제한적일 듯""","최근 반등한 국제유가가 지속 상승하더라도 변동폭은 제한적일 것이라는 전망이 나왔다. 한국은행은 24일 해외경제포커스에서 ""국제유가는 연초 60달러 수준까지 빠르게 상승했으나 이후 소폭 등락을 보이며 완만하게..."
