,날짜,제목,요약
1404,2018.01.31.,"기업 경기회복 전망, 21개월 연속 ‘흐림’","국제 유가는 최근 2년 반 만에 배럴당 60달러(약 6만4400원)를 넘어섰다. 산업부문별 전망치도 수출, 투자, 고용 등 전 부문이 ‘부정 전망’을 벗어나지 못했다. 송 부원장은 “경영 불확실성을 줄이고 변화에 대응하기..."
1405,2018.01.24.,"무역협회 ""올해 광주 153억 달러 수출 전망""","특히 국제유가 상승, IT 호황 지속으로 석유 관련 산업 및 반도체가 수출을 이끌 것으로 내다봤다. 다만 선박은 수주량 감소, 철강 및 가전은 경쟁 심화, 보호무역주의 등의 영향으로 수출 물량이 감소할 것으로..."
1406,2018.01.30.,[新3高시대-임금] 최저임금 인상…'연착륙' or '부작용',국제유가는 작년 5월 배럴당 50달러를 넘어선 이후 최근 70달러까지 지속 상승세다. 또한 작년보다 16.4% 인상된 최저임금 7530원이 적용된 첫 해다. 특히 미국의 보호무역주의에 더해 원화 강세 기조는 수출기업들의...
1407,2018.02.06.,[2018년 전기산업 동향 및 전망] 국내 전기산업…2017년 수출기저 효과 및 설...,"자료: 한국전기산업진흥회 세계 경기의 회복세에 의한 글로벌 수입 수요 확대와 국제 유가 상승으로 신흥국을 중심으로 중동 및 남미 자원부국의 인프라 투자가 확대될 것으로 예상된다. 반면 미국, 유럽 등 선진국의..."
1408,2018.02.05.,[주식해서 여행가자 시즌2] 현대차·금호석유 투자해서 팔라완·칭다오 여행가...,"최근 국제유가가 계속해서 상승하면서 석유화학 업종들이 반사이익을 얻고 있는데, 그중에서도 금호석유화학의 주가는 4분기 실적이 시장 기대치를 웃돌 것으로 전망되면서 최근 주가가 상승하고 있다. 특히..."
1409,2018.01.26.,"현대건설, 지난해 영업익 1조119억원…전년比 12.7% 감소","국제유가 상승에 따른 해외발주 증가 기대감으로 중동·아시아 지역 중심의 해외 시장에서 선택과 집중, 시장다변화 전략을 통해 수주를 확대할 계획이다. 매출은 쿠웨이트 알주르 LNG 터미널 공사 등 해외..."
1410,2018.01.26.,"현대건설, 지난해 영업익 1조119억원…전년比 12.7% 감소","국제유가 상승에 따른 해외발주 증가 기대감으로 중동·아시아 지역 중심의 해외 시장에서 선택과 집중, 시장다변화 전략을 통해 수주를 확대할 계획이다. 매출은 쿠웨이트 알주르 LNG 터미널 공사 등 해외..."
1411,2018.01.16.,"남준우 삼성중공업 사장 ""내년 흑자, 유상증자 성공 확신""","남 사장은 ""수주목표액 비중은 조선 60%, 해양 40%가 될 것""이라며 ""국제유가가 배럴당 70달러에 달하며 오일 메이저 기업들의 손익분기점인 50달러 이상 수준에서 안정화되고 있다""고 했다. 삼성중공업은 현대중공업..."
1412,2018.01.24.,"[특징주] LG하우시스, 작년 4분기 실적 부진에 약세","김 연구원은 ""주요 원자재 가격이 올라 건자재·고기능부문 모두 원가율이 크게 상승하면서 부진한 실적을 냈다""며 ""이달 들어서도 국제유가 등 주요 원자재 가격이 높게 유지되고 있어 수익성 하락이 불가피할..."
1413,2018.02.01.,"기재부, 최저임금 인상으로 외식물가 상승 0.1%p에 그쳐","이어 ""석유류는 국제유가 오름세가 지속되나 환율 절상 등의 영향으로 가격 상승폭이 지난해 대비 둔화됐다""며 ""개인서비스 물가도 보험서비스료 동결 등으로 상승폭이 전달보다 둔화됐다""고 설명했다. 특히 ""외식물가..."
1414,2018.01.30.,"[특징주] 삼성중공업, 계약파기 시추설비 매각 소식에 상승세",최근 국제 유가 상승에 해양플랜트 수요가 살아나고 있어 삼성중공업은 나머지 인도하지 못한 시추선(드릴십) 6척 처리에 대한 불확실성도 해소하게 됐다. 박효선 기자 rahs1351@mt.co.kr <저작권자 ⓒ '성공을 꿈꾸는...
1415,2018.01.30.,울산수출 2년째 600억달러대 제자리 걸음,"석유제품 수출은 국제유가 상승에 따른 수출단가 상승으로 전년 대비 33.4% 급증한 166억 달러를 기록했다. 중국의 환경규제 강화에 따른 고품질 경유 수요 증가로 대중국 수출이 45.4% 급증, 2010년 이후 7년 만에..."
1416,2018.01.23.,신흥국주식펀드 '훨훨'…올 들어 수익률 1위 브라질펀드,특히 국제유가 강세의 영향으로 신흥국 중에서도 브라질과 러시아 등 자원 부국의 성과가 우수했다. 23일 펀드평가사 KG제로인이 운용 순자산 10억원·운용 기간 2주 이상인 해외 주식형 펀드(공모)의 연초 이후...
1417,2018.02.07.,"[사설] 설 대목, 재래시장·서민 체감경기는 싸늘하다",최저임금 인상과 국제 고유가의 영향으로 원재료 값이 오르자 대형유통업체와는 달리 그 인상폭을 고스란히 판매가에 얹을 수밖에 없는 한계가 있기 때문이라고 했다. 정부는 그동안 1월중 소비자 물가가 지난해 같은...
1418,2018.01.24.,광주·전남 올해 '수출 성장세 지속'…98억 달러 흑자 전망,"올해 광주·전남 지역 수출은 국제유가 상승과 정보통신(IT) 분야 호황 지속으로 석유 관련 산업과 반도체가 수출을 주도할 것으로 전망됐다. 반면 선박은 수주물량 감소, 철강·가전은 경쟁 심화, 보호무역주의 강화..."
1419,2018.01.22.,생산자물가 2개월만에 상승세로 돌아서,"국제 유가 상승 여파로 석탄 및 석유제품 물가가 1.2% 올랐지만 제1차금속제품(-0.4%), 전기 및 전자기기(-0.7%)가 하락해 영향이 상쇄됐다. 서비스는 0.1% 상승했다. 겨울 관광 성수기를 맞아 음식점 및 숙박에서 0.4..."
1420,2018.01.30.,기업 경기 전망 21개월 연속 ‘부정적’,또 원·달러 환율이 지난해 11.7% 하락한 데다 국제유가가 60달러를 넘긴 것도 불확실성을 증대시켰다. 체감경기 악화는 한국은행의 1월 BSI 조사에서도 나타났다. 한국은행이 이날 발표한 1월 BSI 조사 결과 전체...
1421,2018.01.26.,"'달러' 엇박자, 트럼프가 밀리네…""므누신 발언 달러 약세 신호""","다음날 트럼프 대통령이 CNBC와 인터뷰에서 ""궁극적으로 강달러를 보길 원한다""며 강달러 선호 견해를 내놓자 달러화가 급반등하고, 국제 유가와 금속 가격을 비롯한 원자재 시장이 요동쳤다. 하지만 유로/달러 환율은 장중..."
1422,2018.02.01.,"유통업계 ""2월특수 잡아라""…올림픽, 발렌타인데이, 설명절까지","업계 관계자는 ""올해 들어 시작된 최저임금 인상과 지속적인 국제유가 상승으로 제품 가격 상승이 이어지며 소비가 위축되고 있다""며 ""그러나 다양한 행사가 몰려 있는 2월을 맞아 각종 할인과 이벤트로 소비자들의..."
1423,2018.01.26.,"현대건설, 3년 연속 '1조 클럽'…지난해 영업익 1조119억원","국제유가 상승에 따른 해외발주 증가 기대감으로 중동·아시아 지역 중심의 해외 시장에서 선택과 집중, 시장다변화 전략을 통해 수주를 확대할 예정이다. 매출은 쿠웨이트 알주르 LNG 터미널 공사 등 해외..."
1424,2018.02.02.,"2월 중고차시장, 거래 회복세 접어들어","김흥곤 카마트 대표는 “중고차도 유가 영향을 크게 받는 편”이라며 “국제유가 상승과 맞물려 가솔린차보다 디젤차, 특히 소형 SUV의 거래가 증가할 전망”이라고 말했다.    다음은 중고차시세..."
1425,2018.01.23.,“최저임금 인상 영향 농업임금 13.0% 증가”,"농업임금 증가에 함께 국제유가 상승에 따른 투입재 가격 상승(2.1%↑) 악재가 겹쳤기 때문이다. 이 대신 농외소득이 11.5%, 이전소득 1.2%, 비경상소득이 0.2% 늘었다. 최저임금 인상에 따라 농외소득이 늘어난 게 전체..."
1426,2018.01.31.,"2월 LPG수입가격, 평균 65달러/톤 내려",더욱이 국제유가는 최근 다소 올라 배럴 당 65달러 안팎을 기록하고 있어 LPG수입가격은 상대적으로 경쟁력이 회복됐다. 더욱이 동절기가 끝나가면서 수요가 감소가 본격적으로 시작되면...
1427,2018.01.29.,[공시] 유진테크 · 동아에스텍 공급계약 소식,"예상보다 가파른 달러 약세가 지속되면서 투자심리가 강화되고 있고, 국제유가가 상승하고 있는 점도 정유주에 호재로 작용하면고 있습니다. 이에 정유주가 동반 강세 기록하고 있습니다. 평화산업 수소차 기대감..."
1428,2018.01.31.,"뉴욕증시, 사상 최고 부담 지속…이틀째 하락 출발","국제유가는 미국의 원유재고 결과를 기다리는 가운데 하락했다. 3월물 서부텍사스산 원유(WTI) 가격은 전 거래일보다 1.53% 하락한 64.51달러에, 브렌트유는 0.65% 낮은 69.01달러에 움직였다. esshin@yna.co.kr (끝)"
1429,2018.01.13.,새해에도 기름값 무섭게 오른다…24주 연속 상승,"한국석유공사는 ""미국의 대(對) 이란 신규 제재 부과 가능성, 미국 달러화 약세 등으로 국제유가가 상승함에 따라 국내 유가는 오름세를 이어갈 것으로 전망된다""고 밝혔다. 서울의 한 주유소 유가 판매가격...."
1430,2018.02.02.,"유창근, 채권단 재신임 얻어 현대상선 흑자전환 달성할까","유 사장은 지난해 11월 서울 연지동의 현대상선 사옥에서 열린 기자간담회에서 ""국제유가 상승과 선사들의 대형선박 투입 등으로 흑자 전환 시기를 단언하기는 어렵다""면서도 ""하지만 운임이 받쳐줄 경우 2018년 3분기..."
1431,2018.01.15.,"수출입물가, 두달째 동반 하락…'원화 강세' 영향",국제유가가 올랐음에도 원화 강세의 영향이 큰 탓에 수입물가도 함께 떨어졌다. 품목별로 보면 수출물가는 수송장비(-2.1%)와 전기 및 전자기기(-2.2%) 등이 전월대비 큰 폭의 하락세를 보였다. 특히 소형승용차는...
1432,2018.01.28.,"현대重, 5억달러 규모 바다위 LNG 기지 기본설계 계약","현대중공업 관계자는 “세계 최초로 시도되는 연안형 LNG생산설비인 만큼 발주처와 긴밀하게 협력해 좋은 결과가 있도록 최선을 다할 것”이라며, “최근 국제유가 반등으로 해양플랜트 시황이 회복세를..."
1433,2018.01.26.,"[어닝 2017]현대건설, 3년 연속 영업이익 1조 지켰다","국제유가 상승에 따른 해외발주 증가 기대감으로 중동·아시아 지역 중심의 해외시장에서 선택과 집중, 시장다변화 전략을 통해 수주를 확대할 계획이다.   매출은 쿠웨이트 알주르 LNG 터미널 공사 등 해외..."
1434,2018.01.26.,"현대건설, 지난해 영업이익 1조119억원..12.7% 감소","국제유가 상승에 따른 해외발주 증가 기대감으로 중동·아시아 지역 중심으로 선택과 집중, 시장다변화 전략을 통해 수주를 확대할 계획이다. 매출은 쿠웨이트 알주르 LNG 터미널 공사 등 해외 대형공사 매출..."
1435,2018.02.02.,2022년 농업소득 1000만원 아래로 추락 전망,농업소득의 이런 수준의 하락은 농자재값 인상 등 농업경영비 증가에 따른 것으로 국제유가 인상도 겹쳐 농업경영비가 3.5% 증가할 전망에 따른 것이다. 또한 올해 농업생산액은 지난해대비 0.8% 증가한...
1436,2018.02.07.,"현대건설, 작년 신규 수주 13조…업계 1위 수성","현대건설 관계자는 ""국제유가 상승에 따른 해외발주 증가 기대감으로 중동·아시아 지역 중심의 해외 시장에서 선택과 집중, 시장다변화 전략을 통해 수주를 확대할 계획""이라고 말했다. 신규 수주 2위는..."
1437,2018.01.29.,"현대重, 5억 달러 규모 해양플랜트 기본설계·EPC 계약","이 관계자는 또 ""최근 국제유가 반등으로 해양플랜트 시황이 회복세를 보이고 있는 만큼 앞으로 추가 수주를 위해 총력을 기울일 계획""이라고 밝혔다. 한편 현대중공업은 올해 해양플랜트부문..."
1438,2018.01.29.,"[코스피 2600 돌파]조용준 ""'주식의 시대' 도래…IT 여전히 주도주""","그는 ""다른 업종 역시 실적이 함께 좋아지고 있다""며 ""국제유가 상승과 함께 석유화학 기업 실적이 개선되고 있고, 증시 상승과 함께 증권사의 이익도 좋아지고 있는 만큼 전반적인 주가 상승세가 연중 확산될 것..."
1439,2018.01.20.,기름값 거침없이 오른다…25주 연속 상승,한국석유공사는 국제유가가 강세를 보임에 따라 국내 유가는 상승세를 이어갈 것으로 전망했습니다. 연합뉴스TV : 02-398-4441(기사문의ㆍ제보) 카톡/라인 jebo23    ▶ 생방송 시청
1440,2018.01.29.,"[코스피 2600 돌파]조용준 ""'주식의 시대' 도래…IT 여전히 주도주""","그는 ""다른 업종 역시 실적이 함께 좋아지고 있다""며 ""국제유가 상승과 함께 석유화학 기업 실적이 개선되고 있고, 증시 상승과 함께 증권사의 이익도 좋아지고 있는 만큼 전반적인 주가 상승세가 연중 확산될 것..."
1441,2018.01.20.,기름값 거침없이 오른다…25주 연속 상승,한국석유공사는 국제유가가 강세를 보임에 따라 국내 유가는 상승세를 이어갈 것으로 전망했습니다. 연합뉴스TV : 02-398-4441(기사문의ㆍ제보) 카톡/라인 jebo23    ▶ 생방송 시청
1442,2018.01.29.,"삼성중공업, 유럽 선사에 반잠수식 시추설비 5억 달러에 매각",삼성중공업 관계자는 “글로벌 경기가 살아나고 있고 국제유가도 배럴당 70달러를 바라보고 있는 등 해양 시추 및 생산 설비 수요 증가 조짐이 두드러지고 있다”면서 “삼성중공업이 건조한 드릴십은...
1443,2018.02.01.,"정유·화학 맏형들의 미래 먹거리, `사상 최대 실적` 뒷받침",반면 회사의 주력 사업인 정유 부문은 국제유가 상승과 판매량 증가에 힘입어 지난해 33조3368억원의 매출을 올렸다. 1년 전보다 17.5% 늘어난 수치다. 같은 기간 영업이익은 7.6% 감소한 1조5021억원을 남겼다....
1444,2018.02.01.,"[유통가, 뜨거운 2월 ④] 관건은 결국 요우커…최저임금 인상 부담도 여전",업계 관계자는 “최저임금 인상으로 인한 가계소득 증대의 선순환 조짐은 아직 나타나지 않고 있는 반면 최저임금 인상과 국제유가 상승으로 제품 가격 상승이 이어지고 있어 오히려 소비가 위축되는 경향이...
1445,2018.01.26.,"[에경|건설] 현대건설, 해외 건설경기 부진에도 영업익 1조원 돌파","국제유가 상승에 따른 해외발주 증가 기대감으로 중동/아시아 지역 중심의 해외 시장에서 선택과 집중, 시장다변화 전략을 통해 수주를 확대할 계획이다. 매출은 쿠웨이트 알주르 LNG 터미널 공사 등 해외 대형공사..."
1446,2018.01.25.,"'뻔뻔한'(?) 마두로, 유세 개시…""겸손한 대통령 되겠다""","베네수엘라는 국제 유가 하락으로 전례없는 경제난을 겪고 있으며, 고(故) 우고 차베스의 뒤를 이어 2013년 취임한 마두로 대통령은 권력 강화 작업을 계속해 왔다. 미국은 지난해 마두로 대통령을 '독재자'로 규정하고..."
1447,2018.01.22.,[친절한 경제] 휘발윳값 25주 연속 '고공행진'…올해 내내 오를 듯,"그런데 그나마 그사이에 우리나라 환율이 1달러에 1천110원, 20원 하던 게 지금 1천60원 정도로 떨어져서 기름값 오른 걸 많이 상쇄를 해줘서 주유소 휘발윳값이 국제유가 수준까지는 안 오른 상태입니다. 반대로 말하면..."
1448,2018.01.26.,박대영 前 삼성중공업 사장 “삼성ENG 합병·대우조선 인수 없다”,그는 “국제유가가 오르는 바람에 해양(플랜트) 프로젝트가 나와 현재 30여개 프로젝트를 검토하고 있다”며 “과거와 같은 초호황은 오지 않을 것이지만 점차적으로 (경영환경은)좋아질 것”이라고 말했다. 이날...
1449,2018.02.05.,<영상><주간전망대>미국 금리인상 기조와 변수,달러 약세 영향으로 최근 강세를 보였던 국제유가는 WTI 기준 70~80달러 선을 '임계점'으로 2월 이후 변동성이 확대될 것이라고 예상했다. 출연자들은 올해 연준이 3차례 금리를 올릴 것이라는 분위기에 동의하며...
1450,2018.01.24.,"정유업계, 지난해 석유제품 수출량 역대 최고치 경신",대한석유협회 관계자는 “올해는 글로벌 석유수요 증가와 국제유가 강세로 수출량 및 수출액 모두 지난해보다 확대될 것으로 전망된다”며 “정유업계는 글로벌 연료 환경규제에 대응해 시설투자 확대와...
1451,2018.02.01.,"[글로벌 시황] 뉴욕증시, 서프라이즈 없는 연준에 완만한 상승","상품시장, 국제유가 美 증산 소식에도 상승 - 아시아증시, 中 제조업 PMI 기대치 하회하며 하락 - 국내증시, 코스피 사상 최고치 마감·IT반등 - 코스피수급, 외국인 29개월만에 6000억 이상 순매도 - 특징주, 삼성전자..."
1452,2018.02.01.,"뉴욕증시, 연준 통화정책 발표 앞두고 상승 출발","국제유가는 미국의 주간 원유재고 발표를 기다리는 가운데 소폭 내렸다. 3월물 서부텍사스산 원유(WTI) 가격은 전 거래일보다 0.29% 하락한 64.31달러에, 브렌트유는 0.36% 내린 68.77달러에 움직였다. esshin@yna.co.kr..."
1453,2018.01.30.,삼성중 '인도 지연' 시추설비 5억 달러에 매각,삼성중공업은 최근 국제 유가 상승에 힘입어 선주사들이 최신형 시추선에 많은 관심을 보이고 있어 남아 있는 시추선 인도 지연에 따른 불확실성도 해소될 것으로 기대하고 있다.
1454,2018.01.30.,美 뉴욕증시 주요 지수 일제히 하락 마감...연일 최고치 경신 피로감 반영,국제유가는 이날 미국의 원유 채굴장비 증가 소식에 하락했다. 뉴욕상업거래소(NYMEX)에서 3월 인도분 서부텍사스산원유(WTI)는 전날보다 배럴 당 62센트 (-0.94%) 하락한 65.52달러로 거래를 마쳤다. 키움증권 제공...
1455,2018.01.29.,"서울경제TV 해외선물의 신, 해외선물 팀셰르파 쎈(SEN) 시황","Crude Oil 3월물 : 전고점 돌파 재시도 구간 국제유가는 달러화의 약세와 원유수요에 대한 증가 기대감, 그리고 기술적 매수세가 지속적으로 유입되며 추가 상승에 성공했습니다. 전일 국제유가는 미 상무부가 지난해..."
1456,2018.01.26.,"뉴욕증시, 기업실적 호조에 다우 사상 최고 출발","국제유가는 미국 원유채굴장비수 공개를 기다리는 가운데 내렸다. 3월물 서부텍사스산 원유(WTI) 가격은 전 거래일보다 0.05% 하락한 65.48달러에, 브렌트유는 0.45% 낮은 70.10달러에 움직였다. 시카고상품거래소..."
1457,2018.01.31.,조선주에 비치는 서광…유가 오르며 수주 낭보,"국제유가가 크게 오르면서 관련 선박의 발주가 늘어나는 추세다. 현대중공업은 지난 24일 쿠웨이트 국영 선사 KOTC와 초대형 LPG운반선 3척, 2억2000만달러 규모의 선박 건조 계약을 체결했다. 현대삼호중공업은 초대형..."
1458,2018.02.01.,"삼성중공업, 未인도 시추설비 5억弗에 매각",삼성중공업 관계자는 “글로벌 경기가 살아나고 있고 국제유가도 배럴당 70달러를 바라보고 있는 등 해양 시추 및 생산설비 수요 증가 조짐이 두드러지고 있다”면서 “삼성중공업이 건조한 드릴십은 최신형에...
1459,2018.01.18.,'금리인상 숨고르기' 한은 기준금리 연 1.50%로 동결,이는 원화 강세가 국제유가 상승효과를 넘어선 결과입니다. 원재료 수입물가는 약 1개월 뒤에 소비자·생산자 물가(서비스 물가 제외)에 반영되는 것으로 분석됩니다. 한은이 연거푸 금리를 올린 적이 거의 없다는...
1460,2018.01.18.,'금리인상 숨고르기' 한은 기준금리 연 1.50%로 동결,이는 원화 강세가 국제유가 상승효과를 넘어선 결과입니다. 원재료 수입물가는 약 1개월 뒤에 소비자·생산자 물가(서비스 물가 제외)에 반영되는 것으로 분석됩니다. 한은이 연거푸 금리를 올린 적이 거의 없다는...
1461,2018.02.07.,"[국제유가] ""미국 원유 전망에 WTI 봅슬레이 탔나""","[국제유가] ""미국 원유 전망에 WTI 봅슬레이 탔나"" 국제유가가 최근 미국 내 원유 생산 증가 전망 등으로 내림세가 이어지고 있다. 7일 한국석유공사에 따르면 6일(현지시간) 뉴욕상업거래소(NYMEX)의 미국..."
1462,2018.01.30.,"정부 경기낙관하지만 ··· 반도체 이어 車·철강·화학까지 ""온통 악재뿐""",계속된 국제유가 상승으로 석유제품의 정제마진이 줄면서 이번 달 석유정제업종 BSI(55)는 전달보다 24포인트 급락했다. 기업 현장에서는 정부에 ‘인기 없는’ 산업 구조조정과 과감한 규제개혁을 호소한다. 한...
1463,2018.01.18.,"한은 ""경제성장률 작년 3.1% 추정…올해 3.0% 전망""",최저임금 인상에 따른 서비스요금 오름세 확대가 물가 상방 요인이고 국제유가 약세와 원화 강세가 하방 요인이다. 밝은 표정의 이주열 한은 총재(서울=연합뉴스) 한종찬 기자 = 이주열 한국은행 총재가 18일 서울...
1464,2018.01.30.,"삼성중공업, '계약파기' 반잠수식 시추설비 5억 달러에 매각","삼성중공업 관계자는 ""글로벌 경기가 살아나고 있고 국제유가도 배럴당 70달러를 바라보고 있는 등 해양 시추 및 생산설비 수요 증가 조짐이 두드러지고 있다""면서 ""삼성중공업이 건조한 드릴십은 최신형에 최고의..."
1465,2018.01.25.,달러 약세에 기름 부은 므누신…말 한마디에 달러 '뚝',국제유가는 65달러를 돌파했다. 3월 인도분 서부 텍사스산 원유(WTI)가 배럴당 1.8%(1.14달러) 오른 65.61달러에 거래를 마쳐 2014년 12월 이후 3년여 만에 최고 수준을 나타냈다. ▶ 양낙규의 '군사이야기' ▶ #아시아경제...
1466,2018.01.26.,"백운규, 석유업계 CEO 만나 "" 탈석유시대 대비해 사업다각화 추진""","백 장관은 ""주요 산유국의 감산, 북반구 이상한파 등으로 국제유가가 지속적으로 상승하면서 국내 유가도 계속 오르고 있다""며 ""휘발유 가격과 관련한 소비자들의 관심이 높아지고 있어 정부도 유가흐름을 예의주시하고..."
1467,2018.02.01.,"""1970년대 이후 최대"" 美셰일원유 생산량에 떨고 있는 국제 원유시장",미국 셰일 원유 산업이 활기를 띠는 것은 일단 국제유가가 최근 1~2년 사이에 반등한 데 따라 채굴 생산 단가를 맞추기에 용이해졌기 때문인 것으로 풀이된다.  셰일 원유는 퇴적암 안에 갇혀 있는 원유다. 퇴적암에서...
1468,2018.01.27.,"기름값 26주 연속 상승, ℓ당 1555.3원… ""당분간 상승세 지속 전망""","한국석유공사는 ""IMF의 세계경제성장률 전망 상향 조정, 사우디아라비아의 감산 기간 추가 연장 참여 의사 피력, 미국 달러화 약세 등으로 국제유가가 올라감에 따라 국내 유가 상승세는 지속될 것으로 전망된다..."
1469,2018.02.06.,"미국증시, 무차별 투매...'붕괴 본격화 vs 곧 진정' 전망 엇갈려",게다가 이날 달러 강세 및 미국 원유증산 우려로 국제 유가가 급락하고 엑손모빌의 실적 악화까지 겹치면서 엑손모빌(-5.70%) 쉐브론(-5.54%) 등 미국의 정유주들이 곤두박질 친 것도 미국증시 패닉을 거들었다. 뿐만...
1470,2018.01.23.,"농촌경제硏 ""최저임금 여파 농업소득 8.7% 줄듯""",이는 최저임금 인상에 농업임금이 13.0% 오르고 국제유가 상승에 따른 투입재 가격이 2.1% 상승하면서 농업경영비가 늘 것이란 분석에 기인한다. 올해 농업경영비는 2256만원으로 1년 전(2181만원)보다 3.5% 증가할...
1471,2018.02.02.,[1일 요약] 1월 ISM 제조업 지수 견조한 흐름 지속...추가 상승 기대 <신한금...,-국제유가는 원유 수급이 균형에 도달했다는 진단 가운데 오름세를 보였다. 전일 골드만삭스는 원유 공급과 수요가 균형 잡히고 있다며 브렌트유가 올해 80달러까지 상승할 것이란 전망을 내놓기도 했다. 로이터...
1472,2018.01.26.,"현대건설, 지난해 영업이익 1조118억…전년비 12.7% 감소","국제유가 상승에 따른 해외발주 증가 기대감으로 중동·아시아 지역 중심의 해외 시장에서 선택과 집중, 시장다변화 전략을 통해 수주를 확대할 계획이다. 매출은 쿠웨이트 알주르 LNG 터미널 공사 등 해외..."
