,날짜,제목,요약
2093,2019.06.21.,"주유소 휘발유 가격 3주째 내려, 리터당 평균 1512.5원","한국석유공사는 ""미국 원유 재고 감소와 미국과 이란의 군사적 충돌 등의 상승요인과 세계 석유 수요 증가세 둔화 전망 등 하락요인이 혼재하면서 국제유가가 강보합세를 보였다""고 파악했다. [비즈니스포스트..."
2094,2019.06.21.,"롤러코스터 수익 탈출법, '비정유'에서 찾는다",실적에 영향을 미치는 국제유가가 미중 무역분쟁을 비롯한 외부 환경변화로 요동치는데다 정유부문 수익성의 바로미터인 정제마진이 손익분기점(BEP) 밑을 맴돌며 상승의 기미를 보이지 않고 있어서다. 이에...
2095,2019.06.16.,전국 휘발윳값 하락세… 대전 8주 만에 처음으로 평균보다 낮아,"하지만 국제유가가 국내에 반영되기까지 통상 2∼3주 걸리는 데다, 최근 유조선 피격사태에 따른 중동발 위기는 휘발윳값에 별다른 영향을 미치지 못한 것으로 보인다는 게 관계자의 설명이다. 앞서 지난 13일..."
2096,2019.06.15.,휘발유 가격 2주 연속 하락…하락폭 ℓ당 1.2원→7.4원,국제유가가 국내에 반영되기까지 통상 2∼3주 걸린다. 15일 한국석유공사 유가 정보 서비스 '오피넷'에 따르면 이달 둘째 주 전국 주유소의 보통 휘발유 판매가격은 전주 대비 ℓ당 7.4 내린 1527.7원이었다. 지난주...
2097,2019.06.20.,"이란, ""美 드론 격추"" 발표…중동 군사충돌 위기 고조",직접 충돌한 것인만큼 중동에서 군사 충돌 위기도 한층 고조되는 양상이다.  미국 드론 격추 소식에 이날 국제 유가도 3% 이상 급등했다. 호르무즈 해협 부근의 오만해에서 발생한 유조선 피격사건. [사진=AP·연합뉴스]
2098,2019.06.11.,美中무역분쟁에도…金보다 빛난 농산물펀드,여기에 운송비용인 국제유가가 불안정한 상황에서 브라질산 대두 역시 값싼 가격으로 중국에 공급되기 어려운 구조다. 실제 중국 세관당국인 해관총서에 따르면 중국의 올해 5월 대두 수입량은 지난해 같은 달보다 24...
2099,2019.06.14.,"5월 수출입물가, 넉 달 연속 동반↑…원·달러 환율 상승 영향","국제유가가 하락한 영향으로 전월(3.6%)보다는 증가폭이 축소됐다. 농림수산품은 전월 0.8% 오른데 이어 지난달 4.2% 상승해 오름폭을 키웠다. 컴퓨터, 전자 및 광학기기는 2.7% 올라 전월 0.5% 마이너스에서 상승..."
2100,2019.06.18.,세계증시 FOMC 관망...드라기 발언에 유럽증시 상승,한편 각국 중앙은행의 수용적 기조 선회의 이유가 되는 세계경제 성장 악화로 인해 중동 위기에도 불구하고 국제유가가 0.2% 내리고 있다. 애틀랜틱마켓츠의 존 울핏 전략가는 “유가가 하락하고 금이 상승하는 것은...
2101,2019.06.11.,美中무역분쟁에도...金보다 빛난 농산물 펀드,여기에 운송비용인 국제유가가 불안정한 상황에서 브라질산 대두 역시 값싼 가격으로 중국에 공급되기 어려운 구조다. 실제 중국 세관당국인 해관총서에 따르면 중국의 올해 5월 대두 수입량은 지난해 같은 달보다 24...
2102,2019.06.20.,[Biz 브리프] '유튜브 키즈' 강화 추진 외,국제유가 소폭 하락 국제유가가 소폭 내렸다. 19일 뉴욕상업거래소에서 7월 인도분 서부 텍사스산 원유(WTI)는 전날보다 배럴당 0.3%(0.14달러) 내린 53.76달러에 장을 마쳤다. 이날 국제유가는 연방준비제도가 기준금리를...
2103,2019.06.14.,"""G20 전까지 증시 불확실성 지속…6월 FOMC에 관심 쏠려""",예상치를 밑도는는 물가와 국제유가의 하락도 연준의 금리 인하 시나리오를 뒷받침하는 요인이다. 김 연구원은 “이런 경제 환경에 덧붙여 G20 회담에서 전향적인 협상이 없다면 금리 인하를 단행할 수 있다는...
2104,2019.06.13.,[유럽마감] 무역전쟁 격화에 주춤…스톡스 0.3%↓,"국제유가 하락에 유럽 석유주들의 약세가 두드러졌다. 프랑스의 토탈과 영국의 BP 모두 2% 이상 하락했다. 전날 윌버 로스 미국 상무장관은 경제방송 CNBC와의 인터뷰에서 ""이달말 미중 정상회담에서 무역협상..."
2105,2019.07.02.,"[GET투자리포트] 제주항공, 투자의견 보유(유지) - KB증권","또한, 국제유가와 환율 변동에 다른 전년동기대비 비용증가효과가 76억원으로 추정되는데, 운임인하 경쟁의 결과로 국제여객 yield는 오히려 3.9%하락(원화기준)해 매출액이 78억원 줄어드는 효과 또한 나타났을 것으로..."
2106,2019.06.18.,내달 국제선 항공권 유류할증료 인하,"이는 국제유가 하락에 따른 것으로, 국제선 탑승객의 비용부담이 다소 줄어들게 됐다. 국제선 항공권에 이동 거리에 따라 추가로 붙는 유류할증료는 다음달 발권기준으로 편도 최고 6만1천200원에서 4만9천200원으로..."
2107,2019.06.26.,[ET투자뉴스]코스닥 4일째 마이너스권 지속,"74%) ◈ 국제유가 반등기조 등 영향, 항공주 하락세 대한항공(-1.34%),아시아나항공(-6.00%),제주항공(-0.46%),진에어(-2.78%) ◈ 미 마이크론 감산 등 영향, 반도체주 상승세 SK하이닉스(+3.30%),삼성전자(+0.22%) 증시분석..."
2108,2019.06.11.,석유화학 간판 에틸렌값 급락… 4년 반만에 최저가,국제유가 하락 등 대내외적인 영향으로 화학제품 가격 변동성이 심화되고 있다. 석유화학산업에서 가장 중요한 제품으로 손꼽히는 에틸렌 가격이 4년만에 최저치를 기록하고 있다. 반면 국내 주요 석유화학기업의...
2109,2019.06.22.,22일 휘발유값 하락세... 평균 1506 원 대 형성,"국내 휘발유 가격이 국제 유가와 유류세 효과 등으로 가격 하락세를 보였다. 한국석유공사 유가 정보 서비스인 '오피넷' 에 따르면, 이달 22일 보통 휘발윳값은 -1.33원 떨어진 리터당 1506.41원으로 집계됐다...."
2110,2019.06.14.,"이란 유조선 공격에 美, “이란책임” vs 이란 “미 CIA 용의자”…갈등심화",한편 이번 유조선 공격으로 중동위기가 부각되 국제유가 더욱 오를것이란 전망도 함께 나오고 있다. 로이터통신 등에 따르면 마이크 폼페이오 미 국무장관은 이날 오후 워싱턴 국무부에서 브리핑을 열고 “이란이...
2111,2019.06.25.,"하반기 석유 및 석화제품 수출, 전년대비 감소할 듯","연구원은 지정학적 리스크로 인해 하반기 국제유가가 상승하지만 미·중 무역갈등과 세계경기 둔화로 원유수요가 억제됨에 따라 상승폭 자체는 크게 억제될 것으로 내다보고, 전년평균 대비 4.7% 하락한 배럴당 66달러..."
2112,2019.06.19.,"뉴욕증시, FOMC 결과 주시 강보합 출발","국제유가는 하락했다. 7월물 서부텍사스산 원유(WTI) 가격은 전 거래일보다 0.5% 하락한 53.63달러에, 브렌트유는 0.87% 내린 61.60달러에 움직였다. 시카고상품거래소(CME) 페드워치에 따르면 연방기금(FF) 금리선물..."
2113,2019.06.15.,휘발유 가격 2주 연속 하락… 제주 기름값 서울 제쳐,"국내 휘발유 가격은 국제유가 보합세에 따라 당분간 현재 수준에서 등락을 반복할 전망이다. 석유공사 관계자는 “국제유가는 호르무즈 해협 인근 유조선 피격발생 등 중동 위기 재점화, OPEC 5월 원유생산 감소..."
2114,2019.06.13.,[뉴욕증시] 금리 인하 기대에도 무역 갈등 지속 하락,"여기에 오늘 국채금리와 국제유가가 하락했고, 기술주 낙폭도 지속되면서 시장 압박 요인이 됐습니다. 오늘 5월 소비자물가지수가 발표됐는데요, 시장 예상치에 부합했습니다. 그러나, 연준의 목표치인 2%를 여전히..."
2115,2019.06.17.,5월 수출 9.5% 감소…가전제품·선박 수출 ↑ 반도체 ↓,"5%)은 증가했고 원유(-10.8%), 기계류(-2.8%), 승용차(-24.2%)는 감소했다. 원유 수입단가는 국제유가 상승으로 전년 동월 대비 0.3% 증가했다. 무역수지는 22억 달러 흑자로 2012년 2월부터 88개월 연속 흑자를 달성했다."
2116,2019.06.18.,7월 국제선 유류할증료 인하···최고 6만1천원→4만9천원,국제유가 하락 영향에 따라 7월 국제선 항공권 유류할증료가 3개월 만에 한 단계 내려갔다. 이로써 휴가철 해외로 떠나는 탑승객의 부담이 다소 줄어들 것으로 보인다. 18일 항공업계에 따르면 대한항공과...
2117,2019.06.14.,유조선 피격에 국제석유시장 긴장…가격급등·공급차질 우려,13일(현지시간) 주요 외신들에 따르면 이번 사태는 일단 국제유가의 상승요인이다. 유조선 공격의 재발 우려 때문에 운항 감소로 공급량이 줄어들 수 있다는 예상이 나오고 있고 실제로 국제시장에서 최근 내림세를...
2118,2019.06.11.,[굿모닝 증시]'달러당 7위안' 돌파하나,"다만, 국제유가가 하락 한 점, 여전히 미중 무역협상 타결에 대한 불확실성은 남아 있다는 점, 미 증시가 최근 상승에 따른 차익매물이 장 후반 출회된 점 등은 상승을 제한할 것으로 전망한다."
2119,2019.06.17.,중국산 제품에 대한 고율 관세와 미국 경제 영향,"유조선 피격에 따른 국제유가 흐름은? 중국산 제품에 대한 고율 관세, 美 경제 영향은? 미국의 기준 금리 인하에 대한 전망은? 외환 시장에 대한 전망은? 금주 주목할 글로벌 이벤트 및 증시 전망은? > 6/18 미국 FOMC..."
2120,2019.06.17.,중국산 제품에 대한 고율 관세와 미국 경제 영향,"유조선 피격에 따른 국제유가 흐름은? 중국산 제품에 대한 고율 관세, 美 경제 영향은? 미국의 기준 금리 인하에 대한 전망은? 외환 시장에 대한 전망은? 금주 주목할 글로벌 이벤트 및 증시 전망은? > 6/18 미국 FOMC..."
2121,2019.06.21.,"[해외시황] 뉴욕, 금리인하 기대감 지속에 상승…유럽↑","국제유가 급등에 에너지주들이 지수 상승을 주도했다. 스탠더드앤드푸어스(S&P) 500지수는 27.72p(0.95%) 오른 2954.18을 기록했다. 이날 S&P 500지수는 한때 2958.06까지 오르며, 장중 사상 최고치를 경신했다. 기술주 중심의..."
2122,2019.06.15.,"휘발유·경유 가격 2주째 하락세…기름값 제주·서울 1·2위, 광주 가장 낮아",정부의 유류세 인하와 국제유가 하락으로 지난해 10월 다섯째 주부터 15주 연속 하락했던 전국 보통 휘발유 가격은 지난 2월 넷째 주부터 반등한 후 15주 연속 오름세를 나타냈다가 6월 들어 2주 연속 하락세를...
2123,2019.06.20.,"이란, 호르무즈 부근서 美드론 격추…첫 군사 충돌","국제유가 급등하는 등 국제사회 긴장 이란 혁명수비대는 20일(현지시간) 새벽 이란 영공에서 미군의 정찰용 무인기(드론)를 격추했다고 밝혀, 국제유가가 급등하는 등 세계를 긴장케 하고 있다. 혁명수비대는 이날..."
2124,2019.06.18.,"[분석] ""올해 원자력 비중이 다시 가스발전 넘어선다""",석유는 국제유가 상승으로 수송용과 건물용 소비가 감소했고 산업용도 석유화학 납사크랙커 설비 유지 보수 증가 및 사고로 인한 석유화학 설비의 비계획 정지 등으로 납사를 중심으로 줄었다. 석탄은 전년도에 비해...
2125,2019.06.13.,지속하는 美中갈등 부담…뉴욕증시 이틀째 '미끄럼',국제유가의 급락세도 증시를 압박했다. 이날 뉴욕상업거래소(NYMEX)에서 7월 인도분 서부 텍사스산 원유(WTI)는 전날보다 배럴당 4.0%(2.13달러) 미끄러진 51.14달러에 거래를 마쳤다. 미 에너지정보청(EIA)은 지난주 미...
2126,2019.06.25.,"[해외시황] 뉴욕, 미중 정상회담·이란 제재 주시 속 관망세…유럽 '혼조'",이런 가운데 국제유가도 이란 변수로 상승 압력을 받았다. 이날 뉴욕상업거래소(NYMEX)에서 8월 인도분 서부텍사스산원유(WTI)는 배럴당 0.81%(0.47달러) 오른 57.90달러에 거래를 마감했다. 이란에 대한 미국의 추가제재로...
2127,2019.06.19.,[인베스팅의 눈] 트럼프-시진핑 G20 담판… 무역전쟁 분수령되나?,"2% 상승 전망 - 6/21 미국 제조업 및 서비스업 PMI 지수 * 국제유가에 대한 전망은? - 유조선 피격 사건 이후 힘겨워진 원유 반등 폭 - 오만 해상 유조선 피격 이후 유조선 보험료 상승 - 유류화물 보험료, 화물 가격의 0...."
2128,2019.06.19.,코스피 미중 무역협상 기대 장중 2120선 회복ㆍ 코스닥 720 돌파,미중 정삼회담 소식에 국제유가도 하루 만에 급등세로 돌아섰다. 18일(이하 미국시간) 뉴욕증권거래소(NYSE)에서 다우존스 30 산업평균지수는 전장보다 353.01포인트(1.35%) 급등한 2만6465.54에 거래를 마쳤다....
2129,2019.06.18.,"1분기 기업 매출 -2.4%, 2년반만에 감소","매출액 감소는 국제유가 하락으로 2016년 3분기의 -4.8% 이후 처음이다. 업종별로 반도체가 포함된 기계·전기·전자가 -9.0%로 전체 하락을 이끌었다. 가구 및 기타(-4.2%), 금속제품(-4.1%), 목재·종이(-3.8%) 등도..."
2130,2019.06.11.,[오늘의 글로벌마켓]멕시코 관세 위협 해소로 5거래일 연속 상승,국제유가는 하락했다. 석유수출국기구(OPEC)를 포함한 주요 산유국들이 6월말까지 계획된 감산정책을 연말까지 연장하는 방안을 논의중인데 러시아가 이에 동의하지 않을 가능성이 제기됐다. 다른 산유국들은...
2131,2019.06.25.,[뉴욕-주식]대부분 소폭 하락…미중 무역협상 대기,국제유가 벤치마크인 브렌트유는 하락했다. 뉴욕상업거래소(NYMEX)에서 WTI 선물은 전장보다 배럴당 47센트(0.8%) 상승한 57.90달러에 장을 마쳤다. ICE 선물거래소의 브렌트유는 배럴당 34센트(0.5%) 내린 64.86달러에...
2132,2019.06.12.,"[CEO&주가] '젊은' 이석주, 제주항공 '규모의 경제'로 주가 지탱하다",2018년 2분기 평균 국제 유가는 배럴 당 84.7달러였다. 2017년 2분기보다 무려 36.4% 상승한 것이다. 국제 유가 상승은 제주항공을 비롯한 항공사들의 급격한 유류비 상승을 불러왔다. 유가 상승에 더해 주요 관광지를...
2133,2019.06.16.,“양수발전소 年 1600억씩 적잔데”…속타는 에너지 공기업,또 △전원별 공급 안정성 불안정 △국제 유가상승 △저렴한 원전·석탄 비중 축소 △상대적으로 비싼 액화천연가스(LNG)·재생에너지 비중 확대 등 요인으로 한전 전력 도매가는 상승하고 있다는 점을 감안해달라는...
2134,2019.06.11.,[뉴욕마감]'멕시코 관세' 우려 해소 5일 연속 상승…5월 하락폭 만회,국제 유가는 다소 하락했다. 이날 뉴욕상업거래소(NYMEX)에서 7월 인도분 서부 텍사스산 원유(WTI)는 전 거래일보다 배럴당 1.4%(0.73달러) 떨어진 53.26달러에 거래를 마쳤다. 런던 ICE 선물거래소의 8월물 브렌트유도 오후...
2135,2019.06.21.,"미 증시, 금리인하 기대감에 사흘 째 상승 랠리",국제유가 급등에 에너지주들이 지수 상승을 주도했다. 대형주 위주의 S&P500지수는 27.72포인트(0.95%) 상승한 2954.18을 기록했다. 이날 S&P500 지수는 한때 2958.06까지 오르며 장중 사상 최고치를 경신했다. 기술주...
2136,2019.06.14.,<호르무즈 해협 ‘戰雲’>폼페이오 “美·동맹국 향한 공격”… ‘이란 소행’...,"당초 이란은 지난해 11월 미국의 2차 제재로 이란산 원유 수출길이 막히자 기름값이 급등할 것이라고 경고했으나 무역전쟁에 따른 경기침체, 미국의 셰일가스 증산 등으로 국제유가는 오히려 하락세를 이어가고 있다. 이..."
2137,2019.06.18.,"""정유·석유화학, 하반기도 반등 가능성 낮아""","이 연구원은 ""보통 5, 6월이 국제유가가 높은 편이지만 현재 WTI(미국 서부텍사스산원유) 기준 배럴당 50댤러 초반대""라며 ""OPEC(석유수출국기구)이 올해 연말까지 감산을 연장할 가능성이 높게 점쳐지고 있는 상황에서도..."
2138,2019.06.23.,"여행업계, 국내선도 발권대행 수수료 부과…수익성 악화 '고육지책'",최근 국제유가가 한풀 꺾이긴 했으나 유류할증료는 4단계를 적용받으며 편도당 5500원을 부과하고 있다. 유류할증료와 발권대행 수수료를 합치면 왕복 기준으로 총 1만3000원을 부담해야 하는 셈이다. 지난해 8월 서울...
2139,2019.06.14.,[단독]경제개혁 이끄는 ‘미스터 에브리싱’ 한국 IT-신재생에너지에 관심 커,"국제 유가가 비교적 정체돼 있고, 셰일가스 등 새로운 에너지 개발로 원유 수출을 통한 재정 확보가 어려워졌다는 점도 사우디를 강도 높은 경제 체질 개선으로 내몰고 있다. 사우디는 세계 최대 산유국이지만 원유에..."
2140,2019.06.13.,"우리금융연구소 ""2분기 경제성장률 1분기보다 높은 2.5%""","이에 더해 IT제품의 수요 부진, 국제유가 안정 등으로 △반도체 △석유화학 △석유제품의 단가 하락이 지속되고 있어 당분간 해당 제품군의 수출액이 감소할 전망이지만, 미국 등에 대한 자동차 수출 회복세, 수주..."
2141,2019.06.24.,"KAIST, 지방산, 바이오디젤 생산 가능한 미생물 개발",특히 우리나라의 경우 석유를 전량 수입에 의존하기 때문에 국제 유가 변동에 매우 취약해 환경문제를 해결과 원유를 대체할 수 있는 지속 가능한 바이오 기반 재생에너지의 생산이 필수다. 따라서 재생 가능한...
2142,2019.06.20.,"코스피,미 연준 금리인하 기대 2130선 회복 코스닥 1.34%↑…환율 14원 급락",국제유가는 금리동결 여파로 소폭 내렸다. 이날 뉴욕상업거래소(NYMEX)에서 7월 인도분 서부 텍사스산 원유(WTI)는 전날보다 배럴당 0.3%(0.14달러) 내린 53.76달러에 장을 마쳤다. 국제 금값도 소폭 내려...
2143,2019.06.21.,"트럼프 ""이란 매우 큰 실수 했다""…WTI 5.6% 폭등(종합)",한편 트럼프 대통령의 트윗 이후 국제유가는 폭등세를 나타내고 있다. 다우존스에 따르면 서부텍사스원유(WTI)는 트럼프 대통령 트윗 직후 전장보다 5.6% 오른 56.79달러에 거래됐다. WTI는 장중 한때 6% 이상 치솟기도 했다....
2144,2019.06.13.,“美 반도체업종 하락…韓 관련종목 투자심리 부담”-키움,"화웨이가 버라이존에게 특허료 지급을 요구하는 등 무역분쟁 이슈가 이어지고 있으며, 국제유가가 4% 넘게 급락하는 등 상품시장 하락도 투자심리 위축 요인이다. 그는 “트럼프가 중국과의 정상회담을 통해 협상 합의..."
2145,2019.06.21.,"진에어, 국토교통부 제재 하반기 중 해소 전망…목표가↑ - 신한금융투자",박 연구원은 “신규 노선 허가 및 신규 항공기 등록을 제한하는 제재 지속과 2분기 국제여객 비수기 영향으로 인해 국제선 RPK(수요)가 5.3% 상승에 그칠 것”이라며 “국제유가와 원달러 환율 상승으로 인해 기재...
2146,2019.06.29.,"한 달째 하락째 하락세, 전국 평균 휘발윳값 ℓ당 1501.2원","한국석유공사는 ""미국 원유재고 및 원유생산 감소와 석유수출국기구(OPEC) 감산 연장에 대한 기대감으로 국제 유가가 오르고 있다""고 설명했다. 국제 유가는 통상 2∼3주의 시차를 두고 국내 주유소 가격에..."
2147,2019.06.14.,"뉴욕증시, 엇갈린 미·중 지표 하락 출발","국제유가는 혼재됐다. 7월물 서부텍사스산 원유(WTI) 가격은 전 거래일보다 0.1% 하락한 52.23달러에, 브렌트유는 0.31% 오른 61.50달러에 움직였다. 시카고상품거래소(CME) 페드워치에 따르면 연방기금(FF) 금리선물 시장은..."
2148,2019.06.21.,21일 휘발유값 하락세... 평균 1508 원 대 형성,"국내 휘발유 가격이 국제 유가와 유류세 효과 등으로 가격 하락세를 보였다. 한국석유공사 유가 정보 서비스인 '오피넷' 에 따르면, 이달 21일 보통 휘발윳값은 -1.43원 떨어진 리터당 1508.53원으로 집계됐다...."
2149,2019.06.21.,"美 국채금리, 급락 후 막판엔 낙폭 축소...미국증시 금융주는 반등","국채금리만 하락 했을 뿐 이날 G20 기대감, 국제 유가 폭등 등이 미국증시 여건을 호전시킨 것도 금융주를 반등케 했다. 이날 미국증시 내 주요 금융주 중에선 모건스탠리(+0.74%) T로웨(+1.62%) 버크셔헤서웨이A(+0.62..."
2150,2019.06.23.,"진에어, 날아 오를 일만 남았다…국토부 제재 해소 가능성↑","박광래 신한금융투자 연구원은 ""신규 노선 허가 및 신규 항공기 등록을 제한하는 제재 지속과 2분기 국제 여객 비수기 영향으로 인해 국제선 국제선 여객 수송량(RPK)이 5.3% 상승에 그치겠다""며 ""국제유가와 원달러..."
2151,2019.06.18.,"대형건설사, 해외수주 ′보릿고개′ 지속..전년비 44% 뚝",올해 상반기에는 국제유가가 상승했음에도 해외 발주가 대부분 지연됐다. 중동지역 발주는 지난 4월 누적 기준 전년 동기대비 25% 감소했다. 한국 건설업체의 중동 지역 수주는 지난 5월까지 전년 동기대비 70...
2152,2019.06.27.,"뉴욕증시, 미·중 정상회담 주시…다우, 0.04% 하락","국제유가 급등으로 에너지주도 1.54% 상승했다. 유틸리티는 2.15% 내렸다. 시카고상품거래소(CME) 페드워치에 따르면 FF 금리선물 시장은 올해 7월 25bp 기준금리 인하 가능성을 73.9%, 50bp 인하 가능성을 26.1% 반영했다...."
2153,2019.06.19.,"[해외시황] 뉴욕, 미중 정상회담 소식에 상승…유럽↑",이런 가운데 국제유가도 미국과 중국이 G20(주요 20개국)정상회의에서 회담을 열기로 했다는 소식에 급등했다. 이날 뉴욕상업거래소(NYMEX)에서 7월 인도분 서부텍사스산원유(WTI)는 전날보다 배럴당 3.79%(1.79달러)...
2154,2019.06.11.,[뉴욕증시] 미·중 정상회담 개최 기대감에 상승,"상장 후 600% 성장 [국제유가] 감산 연장 전망 불투명...WTI 하락 전환 오늘 뉴욕증시, 멕시코와의 합의에 힘입어 상승 출발했지만, 중국과의 줄다리기는 아직 지속하는 모습입니다. 오늘 트럼프 대통령은 시 주석이 G20..."
2155,2019.06.14.,6월 14일 굿모닝 MBN 주요뉴스,▶ 중동서 유조선 2척 피격…국제유가 급등 일본 아베 총리가 미국과 이란의 갈등 중재를 위해 이란을 방문 중이 었던 어제(현지시각) 인근 호르무즈 해협에서 유조선 2척이 공격당했습니다. 중동지역 긴장이 고조되면서...
2156,2019.06.21.,"뉴욕증시, 금리인하 기대에 상승…S&P, 사상 최고치","업종별로는 국제유가가 폭등하면서 에너지주가 2.21% 급등했다. 산업주도 1.61% 올랐고, 기술주는 1.43% 상승했다. 국채 수익률은 급락했다. 10년물 국채수익률은 2bp(1bp=0.01%p) 하락한 2.02%를 기록했다. 장중..."
2157,2019.06.17.,[한마당-배병우] 중국의 ‘말라카 딜레마’,국제유가의 움직임은 예상과 달랐다. 이날 뉴욕상업거래소(NYMEX)에서 7월 인도분 서부 텍사스산 원유(WTI)는 2.2% 상승하는 데 그쳤다. 14일에도 전날보다 배럴당 0.4% 상승한 52.51달러에 거래를 마쳤다. 중동이 화염에...
2158,2019.06.14.,[개장시황] 중동 유조선피격 여파에 코스피는 하락세,"서상영 키움증권 애널리스트는 ""국제유가 상승에 따른 에너지 업종의 강세도 전날 미국 증시의 상승 요인 중 하나""라면서 ""주요 이벤트를 앞두고 시장 참여자들은 적극적으로 대응을 하기보다는 실적에 초점을..."
2159,2019.06.14.,유조선 피격에 석유시장 '긴장'…가격급등·공급차질 우려,"현지시간으로 13일 미국 월스트리트저널(WSJ), 뉴욕타임스(NYT) 등에 따르면 이번 사태는 일단 국제유가의 상승요인입니다. 유조선 공격의 재발 우려 때문에 운항 감소로 공급량이 줄어들 수 있다는 예상이 나오는..."
2160,2019.06.14.,"[이승조의 TMI] ""G20 정상회담 연결고리 찾기""",시장을 정확히 꿰뚫어 알짜배기 전략만 쏙쏙 뽑아드립니다!성공 투자의 정수 ▶출연: 이승조 대표 / 무극선생 - 중동발 국제 유가 급등 - G20 정상회담 연결고리 찾기- 대북 대표주 흐름 체크 는 월요일부터 금요일까지...
2161,2019.06.16.,"휘발유 1517원, 경유 1379원... 지난주 대비 13원씩 하락",국제유가가 국내에 반영되는 시기는 일반적으로 2∼3주 정도 걸린다. 이를 감안하면 최근 유조선 피격사태에 따른 중동발 위기가 기름값에 별다른 영향을 끼치지 못했다는 분석이 나오고 있다. 16일 한국석유공사...
