,날짜,제목,요약
1986,2021.11.12.,"""기름값 어디가 더 싸지?""…한눈에 보이는 가격비교 앱은 어디",국제유가 급등에 놀란 정부가 12일부터 6개월간 유류세를 20% 깎아주기로 하면서 인하분이 바로 반영되는 정유사 직영주유소와 알뜰주유소에 사람들이 몰려든 것이다. 이곳 주유소에는 직원들이 넣어주는 주유기와...
1987,2021.11.25.,"한은, 기준금리 0.25%p 인상…20개월만에 '1%대' 금리","지난 11일 이주열 한은 총재는 ""글로벌 공급 병목의 영향과 함께 국제유가가 상승하고 수요 측 물가 압력이 높아지면서 예상보다 높은 소비자물가 상승률이 당분간 지속될 것""이라며 ""이번 회복기에는 과거 본 적 없는..."
1988,2021.11.17.,"뉴욕증시, 기업실적·소매판매 호조에 상승 출발",25% 올랐다. 국제유가는 하락했다. 12월물 서부텍사스산원유(WTI) 가격은 전장보다 0.68% 하락한 배럴당 80.33달러를 나타냈다. 1월물 브렌트유 가격은 전장보다 0.24% 하락한 배럴당 81.85달러에 거래됐다.
1989,2021.11.23.,"""바이든, 비축유 방출 발표 예정…한국 동참 가능성""","앞서 미국 정부는 국제 유가 억제를 위해 한국을 비롯한 중국, 인도, 일본 등 주요 석유 소비국에 비축유 방출을 요청했다. 한국 정부는 비축유 방출 여부를 검토 중이며, 다른 국가들의 움직임을 보면서 결정한다는..."
1990,2021.11.11.,"휘발윳값, 내일부터 164원 내려…인하효과 바로 나타날까","정부는 지난달 26일 국제유가 급등으로 휘발유 가격이 치솟자 물가 안정 차원에서 이같이 결정했다. 가격 인하는 내년 4월30일까지 6개월간 지속된다. 국내 정유사들은 12일 당일 직영, 알뜰주유소부터 가격을..."
1991,2021.11.29.,[주간 증시 전망] 증시 덮친 ‘오미크론’ 공포…델타 증시 재현될까?,아무래도 지난주 금요일에 미국증시 상황을 지켜보신 분들은 알겠지만 S&P 500도 2% 넘게 급락하고 유럽증시도 4%대 급락하고 국제유가같은 건 13% 급락하다 보니까 다들 주말에 이게 대체 무슨 일이냐 하면서 혼란스러웠을 것...
1992,2021.12.01.,11월 수출 역대 최초 600억弗 상회…32.1% 증가(종합),"액화천연가스(LNG) 선박, 솔리드 스테이트 드라이브(SSD) 등 고부가 제품 수출이 늘었고 국제유가, 원자재 가격 상승에 따른 석유제품·철강 단가 상승이 복합적으로 작용한 결과다. 수출 물량도 10월에 플러스로..."
1993,2021.12.03.,美 기대 인플레 급감…5년물 BEI 사흘간 0.8%P 추락,"오미크론 변이 바이러스 위협에 따른 제롬 파월 연방준비제도(Fed·연준) 의장의 매파 기조 전환, 국제유가 하락 등의 영향을 받는 것으로 풀이된다. ywkwon@yna.co.kr 본 기사는 인포맥스 금융정보 단말기에서 2시간..."
1994,2021.12.02.,‘드릴십’ 숨통 트이나 했더니...오미크론에 K-조선 떤다,"삼성重·대우조선, 악성 재고로 전락한 드릴십 잇따라 매각 유가 올라야 매각 편해지는데...오미크론 공포에 국제 유가 급락 드릴십으로 영업손실 발생...“원유 수요 결과에 여파 알 수 있을 것” [FETV=김현호 기자]..."
1995,2021.11.12.,커지는 '인플레이션' 공포…수입물가 13년 만에 최고폭 상승,"최진만 한은 경제통계국 물가통계팀장은 수입물가가 뜀박질한 배경에 대해 ""국제유가 상승폭이 큰 것은 물론 원자재 가격도 고공행진했다""고 설명했다. 통상 수입물가는 시차를 두고 소비자물가에 반영된다...."
1996,2021.11.20.,"""일본, 미국 요청에 비축유 방출 검토""",박세진 특파원 = 일본 정부가 고공행진을 이어가는 국제 유가를 안정시키려는 미국 요청에 따라 비축유를 방출할 가능성이 있는 것으로 알려졌다. 20일 마이니치신문에 따르면 일본 정부는 미국과의 협조를 전제로 전략...
1997,2021.12.01.,반도체 등 수출 날개… 月 600억 달러 돌파,석유화학도 국제유가 상승과 주요국 경기 회복에 따른 전방산업 수요 증가 등으로 63%나 늘어난 48억 4000만 달러로 최고치를 기록했다. 자동차 수출액은 3.3% 증가한 41억 2000만 달러였다. 농수산식품과 화장품 역시...
1998,2021.12.02.,"대구경북TBC)지역 소비자물가 상승률, 10년 만에 최고","그리고 단계적 일상 회복 시행으로 소비가 늘어나면서 개인 서비스 가격도 올랐습니다"" 정부는 이달부터 유류세 인하 효과가 본격화되고 국제유가 상승세도 진정 국면을 보여 물가 상승폭이 둔화할 것으로 보고..."
1999,2021.11.25.,"한은, 올해 성장률 4.0%…""내년에도 경제활동 제한 완화""","이 보고서는 ""금년중 소비자물가 상승률은 수요측 물가상승압력이 점차 높아지는 가운데 국제유가 상승세가 당초 예상보다 크게 확대되고 가공식품가격도 오름폭이 확대되면서 8월 전망수준(2.1%)을 상회할 전망..."
2000,2021.11.15.,"尹 “문재인 정부, 돈 뿌리기 그만하고 물가 대책에 주력해야”","국제유가 상승으로 석유류 가격이 크게 오르고, 달걀과 돼지고기 등 축산물 가격 상승세가 이어진 여파로 분석된다. 이에 윤 후보는 “서민이 민감하게 여기는 품목들의 가격 급등 현상과 관련하여 정부의 책임을 묻지..."
2001,2021.11.11.,12일부터 유류세 20% 인하…휘발유 리터당 164원 싸진다,이번 유류세 인하 조치는 당정이 최근 국제 유가 급등으로 기름값이 치솟자 내년 4월 30일까지 20% 유류세 인하가 결정한 데 따른 것이다. 한국석유공사 유가 정보서비스 오피넷에 따르면 지난 10일 오후 7시 기준...
2002,2021.11.23.,"""바이든, 비축유 방출 발표 임박...한국 동참 가능성""","앞서 미국 정부는 국제 유가 억제를 위해 한국과 중국, 인도, 일본 등 주요 석유 소비국에 비축유 방출을 요청했습니다. 한국 정부는 비축유 방출 여부를 검토 중이며, 미국의 요청을 받은 다른 국가들의 움직임을 보면서..."
2003,2021.12.03.,"주유소 휘발유 가격 3주째 내려, 리터당 전국 평균 1677.7원","12월 첫째 주 평균 국제유가(두바이유 기준) 직전 주보다 배럴당 7.7달러 하락한 71.8달러로 집계됐다. 한국석유공사 ""국제유가는 코로나19 오미크론 변이 발생으로 인한 국경봉쇄와 석유수출국기구(OPEC)와 기타..."
2004,2021.11.25.,"이주열 총재 “기준금리1%, 여전히 완화적...물가 상승 우려”(종합)","이 총재는 “국제 유가나 원자재 가격에서 시작된 물가 상승압력이 광범위하게 퍼져나가는 중”이라며 “2% 이상 상승한 소비자물가 품목의 개수가 연초에 비해 크게 늘어났고, 수요측 물가 압력을 나타내는 근원품목의..."
2005,2021.11.25.,"""사우디·러시아, 증산 중단 검토""…美 전략비축유 방출에 반발(종합)",비축유 방출 발표로 국제 유가는 소폭 하락했다. 뉴욕상업거래소에서 1월물 서부텍사스산원유(WTI) 가격은 전거래일 대비 0.14% 하락한 배럴당 78.39달러에 거래를 마감했다．
2006,2021.11.25.,"[문답] 올해 성장률 4.0% 전망한 한은 ""방역 수준 완화되는 추세""","내년 물가에 영향을 미칠 주요 변수로 국제유가가 꼽혔다. 원유도입 단가는 2021년 배럴당 71달러에서 2022년 76달러로 높아졌다가 2023년 71달러로 낮아질 것으로 예상됐다. 김웅 한은 조사국장은 ""국제유가는 올해..."
2007,2021.11.24.,"수출물량, 두 달만에 상승 전환...교역조건 7개월째 악화","최진만 팀장은 “최근 국제유가나 천연가스 원자재 가격이 올라서 수입금액지수가 상승했는데, 물가 상승 압력으로 작용할 수 있을 것”이라고 전망했다. 순상품교역조건지수(91.26)는 1년 전보다 6.7% 하락하며..."
2008,2021.12.03.,"오미크론보다 무서운 인플레, 금리인상 고삐 죈다",10월 상승률이 3%를 넘어선 것에 대해 한국은행은 국제유가 상승세 확대로 석유류 가격이 높은 오름세를 이어간 이유도 있으나 지난해 10월 이동통신요금 지원에 따른 기저효과가 큰 영향을 미친 만큼 기저효과가...
2009,2021.11.19.,"울산 석유비축기지 준공, 외부조달 없이도 106일 유지","박기영 산업부 차관은 ""최근 3년만에 국제유가가 최고치를 기록하는 등 에너지수급 불안정성이 증가하는 시기에 에너지 자원을 직접 비축할 수 있는 석유저장시설은 무엇보다 중요한 역할을 수행할 것""이라고..."
2010,2021.11.19.,"울산 석유비축기지 준공, 외부조달 없이도 106일 유지","박기영 산업부 차관은 ""최근 3년만에 국제유가가 최고치를 기록하는 등 에너지수급 불안정성이 증가하는 시기에 에너지 자원을 직접 비축할 수 있는 석유저장시설은 무엇보다 중요한 역할을 수행할 것""이라고..."
2011,2021.11.23.,파월 연임한 날 뉴욕증시 주춤…나스닥 1.3%↓·S&P 0.3%↓(종합),국제유가와 금값은 희비가 엇갈렸다. 석유수출국기구(OPEC)가 원유 증산을 재고할 수 있다는 보도에 뉴욕상업거래소(NYMEX)에서 내년 1월 인도분 서부 텍사스산 원유(WTI)는 1.1%(0.81달러) 오른 배럴당 76.75달러에 거래를...
2012,2021.12.03.,"뉴욕증시, 오미크론 주시 속 반발 매수세로 상승 출발",국제유가는 석유수출국기구(OPEC) 플러스(+) 산유국들이 기존 증산 규모를 유지하기로했다는 소식에 하락했다. 1월물 서부텍사스산원유(WTI) 가격은 전장보다 1.30% 하락한 배럴당 64.72달러에 거래됐다. 2월물 브렌트유...
2013,2021.11.11.,휘발유 가격 내일부터 L당 164원 싸진다…유류세 20% 인하,"기름 가격은 주유소가 별도로 정하고 국제유가에 따라 가격이 더 변동될 수 있기 때문이다. 전국 주유소에 유류세 인하가 반영되기까지도 1, 2주가량이 걸릴 것으로 보인다. 주유소들이 유류세 인하 전 재고를 모두..."
2014,2021.11.12.,유류세 20%↓ 시작…“직영점·알뜰주유소부터 가보세요”,정부와 더불어민주당은 국제유가가 급등하자 지난달 26일 물가 안정과 서민경제 부담 완화를 위해 내년 4월 30일까지 유류세를 20% 인하하기로 했다. 이날부터 액화천연가스(LNG)에 부과되는 할당관세도 현재 2%에서...
2015,2021.11.24.,10월 수입금액지수 39% 급등…수출물량지수 '다시 증가',국제유가 등 원자재 가격 상승 영향 국제유가와 원자재 가격 상승이 계속되면서 10월 수입금액지수는 39% 급등했다. 특히 석탄 및 석유제품 수입금액은 약 31년만에 최대폭으로 올랐다. 반도체 수출호조와 석유제품...
2016,2021.12.06.,[CEO칼럼] 금년보다 나은 내년 증시를 기대하면서,"어쩌면 우리는 ‘미친 변동성’을 보이는 주가와 금리, 환율, 국제유가 등을 몇 주 내지 몇 달 더 목격해야 할지도 모른다. ‘팬데믹’은 분명 세계 경제에 타격을 가하고 여기저기에서 병목현상을 야기하였지만 넘치는..."
2017,2021.11.19.,생산자물가지수 1년만에 8.9%↑…13년 만에 최고수준,최진만 한은 경제통계국 물가통계팀장은 “국제유가와 원자재 가격 상승 영향으로 석탄·석유제품 가격이 큰 폭으로 올랐다”며 “수요가 전년보다 살아난 것도 영향을 미쳤다”고 설명했다. 전월 대비 기준으로...
2018,2021.11.29.,싱가포르 2021년 3분기 경제지표 살펴보기,이러한 각 부문별 물가 상승 전반에는 국제 유가 상승으로 인한 전기 및 가스 비용 인상이 근원적인 원인이다. 전년동기비 소비자물가지수 인상률의 부문별 구성 자료: 싱가포르 통화청 및 산업통상부 싱가포르...
2019,2021.11.24.,"정부, 美 비축유 공동방출 제안에 동참…규모·시기·방식, 추후 결정","억제하기 위해 최근 우리나라를 비롯한 중국, 인도, 일본 등 주요 석유 소비국에 비축유 방출을 요청했다. 국제유가(두바이유)는 올해 1월 5일 기준 배럴당 50.5달러에서 이달 22일 기준 배럴당 78.42달러로 55% 이상 상승했다."
2020,2021.11.24.,"中관영매체, 美 비축유 방출 요청 조건부 참여해야","또 국제 유가를 낮추기 위해 중국과 한국, 인도, 일본이 동참하기로 했다고 미국 백악관이 밝혔다고 전했다. 이와 관련 중국 정부가 비축유를 방출할 지 여부에 대해 공식적인 발표를 하지 않았다고 글로벌 타임스는 전했다...."
2021,2021.12.07.,[김석환의 인사이트] 시장 악재가 불러온 ‘반도체의 봄’…지금 담아도 괜찮...,- 골드만·IMF “美 경제성장률 하향조정” - 씨티 경기서프라이즈 지수 반등…제조업지수 개선 - 온라인 판매와 외식 서비스 수요 증가세 ◇ 인플레이션 기대 높이는 국제유가…전망은? - 기대인플레이션 0.3%p...
2022,2021.12.06.,천연가스 쇼티지 오나…토탈에너지스 영국 파트너 노조 파업,원유 재고 부족이 우려되며 국제유가는 9월부터 빠르게 상승하고 있다. 뉴욕상업거래소에서 11월물 서부텍사스산원유(WTI) 가격은 80달러대까지 올랐다. 런던 선물거래소의 1월물 브렌트유 가격도 80달러를...
2023,2021.11.24.,"인플레 전쟁 바이든, 비축유 5천만배럴 푼다",코로나19 대유행 과정에서 가파른 국제유가 상승은 인플레이션을 촉발하며 경제 회복을 지연시키는 핵심 원인이다. 바이든 행정부는 총 전략 비축유 가운데 8% 수준인 석유 5000만 배럴을 시장에 내놓기로 했다....
2024,2021.11.24.,"美 비축유 5000만 배럴 방출… ""한·일·인도 동참""","한국 정부 역시 고공행진을 이어가는 국제 유가 우려에 비축유 방출에 동의했다. 정부는 “최근 급격하게 상승한 국제 유가에 대한 국제 공조 필요성과 한미 동맹의 중요성, 주요 국가들의 참여 여부 등을 종합적으로..."
2025,2021.12.06.,"코로나 사태 2년, 미·중 간 新화폐 전쟁…제2차 원유 전쟁으로 비화되나? [국...",당시 트럼프 전 대통령이 요구하는 국제유가 수준은 배럴당 16달러 내외였다. 바이든 대통령도 마찬가지다. 지지도가 추락한 상황에서 본격적인 겨울철을 맞아 하루 100만 배럴 이상 증산을 요구했으나 이 요구를...
2026,2021.11.29.,"금리 인상에 오미크론 확산 우려까지…코스피 닷새째 하락, 천스닥 붕괴","또 주 후반 오미크론 이슈가 대두되며 국제유가가 13% 넘게 하락하며 에너지, 소재 등 약세장을 주도하는 모습""이라고 설명했다. 업종별로는 은행이 1%대 강세를 보였고, 운송장비와 유통업, 전기가스업, 건설업 등이..."
2027,2021.12.04.,"천정부지 치솟는 금값, 안전·수익 두 마리 토끼 금테크 각광",국제유가를 포함한 원자재 가격마저 떨어졌다. 회복세로 접어든 글로벌 경제가 다시 뒷걸음질 칠 수 있다는 우려가 나온다. 이런 가운데 안전자산인 금(Gold)이 투자자들 사이에서 다시 주목받고 있다. 금은 다른...
2028,2021.11.12.,전국 2000개 주유소 유류세 인하 동참…휘발유 1600원대(종합),최근 국제유가 급등으로 국내 기름값 부담이 크게 늘어나자 물가 안정과 서민경제 부담을 낮추기 위한 한시적인 조치다. 유류세 인하는 내년 4월 말까지 계속된다. 이번 조치로 최근 휘발유 가격 기준 리터당...
2029,2021.11.27.,[오미크론변이 충격] 뉴욕증시 '피의 블랙프라이데이'...다우지수 900포인트 ...,"경기회복세에 찬물을 끼얹어 수요가 줄 것이란 전망이 유가 폭락세를 불렀다. 국제유가 기준물인 브렌트유는 11% 폭락한 73.45달러, 미국 유가 기준물인 서부텍사스산원유(WTI)는 12% 폭락한 68.80달러에 거래됐다."
2030,2021.11.25.,"기준금리 또…이주열 ""내년 초 인상 배제 안해""","이주열 총재는 ""국제유가 상승폭이 예상보다 컸고 수요측 물가상승 압력도 높아졌다""며 ""무엇보다 공급병목 현상이 생각보다 상당기간 지속될 것으로 예상돼 정책결정문에서도 그렇게 표현됐다""고 말했다. 이어 ""2% 이상..."
2031,2021.11.27.,"유류세 인하 여파...휘발유·경유 가격, 2주 연속 '하락세'","이런 가운데 한국으로 수입되는 두바이유의 경우에도 평균 가격이 지난주보다 0.6달러 내린 배럴당 80.1달러를 기록했고, 반면 국제유가는 3.7달러 하락한 88.7달러로 집계됐다."
2032,2021.12.02.,"뉴욕증시, 오미크론 주시 속 반발 매수세로 상승 출발",국제유가는 석유수출국기구(OPEC) 플러스(+) 산유국들이 기존 증산 규모를 유지하기로했다는 소식에 하락했다. 1월물 서부텍사스산원유(WTI) 가격은 전장보다 1.30% 하락한 배럴당 64.72달러에 거래됐다. 2월물 브렌트유...
2033,2021.11.19.,"10월 생산자물가지수, 또 '사상 최고'…12개월 연속 상승",국제유가 및 원자재 가격 상승에 따른 영향으로 풀이된다. 한국은행이 19일 발표한 10월 생산자물가지수는 112.21(2015년 100 기준)로 전월대비 0.8% 올랐다. 이는 1965년 통계 작성 이래 지수 기준 최고치다. 지난 4월부터...
2034,2021.11.30.,[사설] 코로나 다시 일촉즉발 위기 연말 방역 고삐 조여야,회생 기미를 보였던 세계 경제도 오미크론 소식에 주가와 국제유가가 하락하는 충격파가 닥쳤다. 이달부터 재택근무 비율을 낮추고 해외 출장을 재개한 기업들은 방역 수준 강화를 고심하고 있다고 한다. 우물쭈물할...
2035,2021.11.24.,10월 수입금액지수 150.27 '사상 최고',"한국은행 관계자는 ""국제유가와 천연가스 등 원자재 가격이 올라 수입금액지수 상승 압력으로 작용했다""고 설명했다. 10월 순상품교역조건지수는 전년 동월 대비 6.7% 하락한 91.26을 기록했다. 수입가격(29.9..."
2036,2021.11.23.,"""바이든, 이르면 23일 비축유 방출 발표...韓 동참 가능성""","이에 따라 국제유가도 지난주 약 6% 하락했습니다 블룸버그통신은 바이든 대통령이 이르면 현지시각 23일 전략 비축유 방출 방침을 밝힐 예정이라고 보도했습니다. 또 이번 비축유 방출 발표는 한국과 인도, 일본과 함께..."
2037,2021.12.01.,"뉴욕증시, 파월 의장 청문회 발언에 하락 마감…다우 1.86%↓",국제 유가도 오미크론 변이에 대한 우려에 급락했다. 뉴욕상업거래소(NYMEX)의 1월 인도분 서부 텍사스산 원유(WTI)는 전장보다 3.77달러(5.38%) 내린 66.18달러에 거래를 마쳤다. 금값은 하락했다. 뉴욕상품거래소(COMEX)...
2038,2021.11.19.,'원유와 원자재값 급등' 생산자물가 최대폭 상승,국제유가와 원자재 가격이 고공행진을 이어가면서 생산자물가가 7개월 연속으로 사상 최고치를 경신했다. 19일 한국은행이 발표한 '2021년 10월 생산자물가지수'에 따르면 지난달 생산자물가지수(잠정)는...
2039,2021.11.27.,"[원유마감]WTI 13% 대폭락, 70달러 붕괴…200일 이평선 하회",국제유가가 10% 넘게 추락하며 2개월 넘게 만에 최저로 주저 앉았다. 26일(현지시간) 미국 서부텍사스원유(WTI) 1월 인도분 선물은 전장 대비 10.24달러(13.06%) 폭락해 배럴당 68.15달러를 기록했다. 2020년 4월 이후 최대...
2040,2021.11.27.,"[원유마감]WTI 13% 대폭락, 70달러 붕괴…200일 이평선 하회",국제유가가 10% 넘게 추락하며 2개월 넘게 만에 최저로 주저 앉았다. 26일(현지시간) 미국 서부텍사스원유(WTI) 1월 인도분 선물은 전장 대비 10.24달러(13.06%) 폭락해 배럴당 68.15달러를 기록했다. 2020년 4월 이후 최대...
2041,2021.11.12.,"[Q&A]""유류세 인하라더니, 동네 주유소는 왜 가격이 그대로?""","휘발윳값은 국제유가 영향을 크게 받기 때문이다. 최근 휘발윳값이 꾸준히 오른 것도 국제유가의 상승 때문이다. 국내 수입되는 원유 가격이 오른다면, 휘발윳값 역시 오를 수밖에 없다. △휘발유 가격이 유류세 인하..."
2042,2021.11.30.,"바이든 ""오미크론 따른 추가 봉쇄 조치 없을 예정"" [글로벌 이슈]",이어서 국제유가를 진정시키기 위해 미국이 모든 수단을 동원할 예정이라며 동맹국들의 참여도 더욱 중요해졌다고 밝혔습니다. 앞서 지난 23일 바이든 대통령은 국제유가 상승세를 억제하기 위해 동맹국들과 전략...
2043,2021.11.19.,울산 석유비축기지 준공식… 41년 만에 비축기지 계획 마무리,박 차관은 “3년 만에 국제유가가 최고치를 기록하는 등 에너지 수급이 불안정한 시기에 에너지 자원을 직접 비축할 수 있는 석유저장시설은 중요한 역할을 수행할 것”이라고 말했다. 이어 “최근 요소수 등 원자재에...
2044,2021.11.22.,"무협 ""올해 수출 사상 최고치 전망…내년에도 성장세 지속""","보고서는 국내 경기 회복과 올해 하반기 수준의 국제유가 흐름, 견조하게 유지되는 원자재 가격 등으로 수입은 소폭 늘어날 것으로 예견했다. 보고서는 ""내년에도 선진국 경제가 주도하는 글로벌 경기 회복 흐름 속에..."
2045,2021.11.25.,美 10월 근원 개인소비지출 31년 만에 최고,"개인소비지출이 이처럼 크게 늘어난 것은 국제유가와 천연가스 가격 급등세가 주요 원인인데요. 미국의 10월 에너지 가격은 1년 전보다 30% 넘게 폭등했고, 식료품 가격 역시 4.8% 뛰었습니다. 여기에 글로벌 공급망..."
2046,2021.11.24.,"불안 불안 테크 주가, 도대체 왜","바이든 대통령의 백악관은 한국, 중국, 일본, 인도, 영국 등 주요 석유 소비국들과 손잡고 국제 유가 안정을 위해 비축유를 공동 방출하기로 했다고 밝혔습니다. RBC 캐피털 마켓츠는 여섯 나라가 비축유를 푸는 규모는..."
2047,2021.12.03.,[이상준의 오늘장 Key Point] 오미크론에도…반도체가 살려낸 희망의 불씨,"- 美 증시 반등 속 '위드코로나' 관련주 강세 - 달러인덱스 '강보합'… 96.14 - 국제유가, 2%대 상승… $70선 근접 - 美 10년물 국채금리, 나흘 만에 반등… 1.449% - 마이크론· 램리서치, 반도체지수 숨 고르기에 낙폭↑ Q...."
2048,2021.11.12.,수입물가 13년來 최대 상승…물가 또 '초비상'(종합),"최진만 한은 경제통계국 물가통계팀장은 ""국제유가와 원자재 가격 상승이 수입물가 상승에 영향을 미쳤다""며 ""10월 두바이유 가격은 전월 대비 12.4% 상승했고, 원자재 가격지수(CRB)도 6.5% 올랐다""고 밝혔다. 지난달..."
2049,2021.12.08.,오미크론 델타보다 덜 심각하다…나스닥 3.03% 급등,국제 유가는 오미크론 우려가 완화되며 상승했다. 뉴욕상업거래소(NYMEX)에서 1월물 서부텍사스산원유(WTI) 가격은 전 거래일대비 2.56달러(3.7%) 상승한 배럴당 72.05달러에 거래를 마쳤다.
2050,2021.11.25.,"Fed ""인플레이션 심화될 경우 조기 금리인상 가능"" [글로벌 이슈]",동맹국들이 국제유가를 떨어트리기 위해 비축유를 방출하겠다고 밝힌 가운데 사우디아라비아와 러시아는 석유 증산 방침을 중단하는 방안을 검토하고 있습니다. 구체적으로 월스트리트 저널은 두 나라가 OPEC+를...
2051,2021.11.24.,"롯데리아, 가격 평균 200원 인상… 오르는 식품 물가에 서민 한숨",아울러 미국이 유가 상승세를 꺾기 위해 역대 최대 규모의 전략비축유 방출을 결정했지만 국제유가는 진정되지 않고 있다. 이날 뉴욕상업거래소(NYMEX)에서 거래되는 서부텍사스산원유(WTI) 선물 가격은 전날보다 2.28...
2052,2021.12.02.,한은 “올해 물가상승률 2.3% 넘을 듯…상당기간 지속”,"한은 관계자는 “최근 국제유가 변동성이 확대되면서 향후 물가흐름 불확실성이 높아졌다”며 “글로벌 공급병목이 심화.장기화될 경우, 국내에서도 물가상승압력이 광범위하게 확산될 수 있어 인플레이션 추이를..."
2053,2021.11.25.,"[일문일답] 이주열 ""기준금리 결정, 정치상황보다 경제상황이 중요""","높은 오름세가 지속되는 기간이 장기화되는 이유는 국제유가 상승세가 예상보다 확대되는 동시에 오름폭도 컸고, 수요측 물가상승 압력도 점점 높아지고 있기 때문이다. 당초 봤던 것보다 공급병목 현상도 길어지고 있어..."
