,날짜,제목,요약
701,2021.01.12.,11일 국제유가 WTI 상승·Brent 하락,"33달러에 거래를 마쳤다. 한국석유공사는 11일 국제유가(Brent 기준)는 코로나19 확산에 따른 봉쇄조치, 달러지수 반등 등으로 하락했으나, 사우디 감산 등은 하락폭을 제한했다고 전했다."
702,2021.01.15.,국제 유가 '장중 상승'...美-中서 무슨 일?,"국제유가는 중국의 지난해 12월 수출이 전년 대비 18.1%나 늘어 예상보다 큰 증가를 보인 가운데 아시아 시장에서 상승 움직임을 보였는데 이날 런던, 뉴욕시장에 이르러서도 상승세를 이어갔다. 또한 CNBC는 ""바이든..."
703,2021.01.14.,국제유가 오름세에 발전사 ‘和色’…바닥 찍은 SMP 올 반등 기대감,SMP는 국제유가의 영향을 받아 4∼6개월 정도의 시차를 두고 등락한다. 업계는 지난해 코로나19로 인한 국제유가 하락과 전력수요 감소까지 맞물리면서 기록적인 하락세가 지속된 것으로 분석했다. 기나긴...
704,2021.01.13.,"[석유시장 동향] 국제유가, 코로나19 이전 수준 회복···공급과잉 우려 해소...",윤동 기자 dong01@ajunews.com 국제유가가 공급과잉 우려가 해소되면서 배럴당 50달러를 돌파했다. 거의 11개월 만에 코로나19 확산 이전 가격을 회복하는데 성공한 것이다. 11일(현지 시간) 뉴욕상업거래소(NYMEX)에서 2월...
705,2021.01.21.,"국제유가-금값, 바이든 취임에 동반 강세...WTI, 0.6%↑",국제유가는 혼조세를 보였다. 뉴욕상업거래소(NYMEX)에서 3월 인도분 서부 텍사스산 원유(WTI)는 배럴당 0.6%(0.33달러) 오른 53.31달러에 거래를 마쳤다. 2월 인도분 금은 온스당 1.4%(26.30달러) 오른 1866....
706,2021.02.09.,"정유4사, 작년 적자 5兆 ‘최악’","업계 관계자는 ""최근 국제유가가 상승곡선을 그리고 정제마진도 소폭 개선되면서 정유업계의 실적 개선에 대한 기대감도 높아지고 있다""고 설명했다. 한편, 이날 발표된 GS칼텍스의 부진한 실적은 그룹 전체..."
707,2021.02.10.,"큰 폭으로 오른 증시, 숨 돌릴때 됐다…다우 0.03% ↓[뉴욕마감]","고개 드는 유가, 달러는 약세 국제유가는 연일 상승세를 이어갔다. 런던 ICE 선물거래소에서 밤 11시4분 현재 국제유가의 기준물인 4월분 북해산 브렌트유는 0.67달러(1.11%) 오른 배럴당 61.23달러를 기록 중이다...."
708,2021.02.08.,"국제유가 상승세, 수요회복 기대 영향",국제유가의 상승세는 주요 산유국들이 2월 들어 감산 약속을 이행하는 가운데 백신 보급에 힘입어 원유 수요가 늘어날 것이라는 기대감이 유가를 밀어 올렸다는 분석이다. 급락했던 국제 금값은 미국의 대규모...
709,2021.02.10.,"코스피, 장 초반 3,080대 보합권 등락(종합)","서상영 키움증권 연구원은 ""달러화가 약세를 보이고 국제유가가 상승세를 유지한 점 등은 외국인 수급에 긍정적""이라며 ""다만 오늘 옵션 만기일이어서 외국인 선물 동향에 따라 시장 변화 폭이 커질 수 있다..."
710,2021.02.10.,[뉴욕증시]'역사상 최고치' 레벨 부담 컸나…3대 지수 숨고르기,"유가를 비롯한 원자재 가격이 급등하고 있는 건 경기 회복 긍정론이 작용하는 결과이지만, 동시에 장기시장금리를 끌어올릴 수 있는 재료이기도 하다. 연방준비제도(Fed)의 정책 지향점과 무관하게..."
711,2021.01.11.,"미국금리 상승, 원화환율·엔화환율도 올라... 국제유가 하락",3487 달러로 0.60% 절하됐다. 국제유가는 지난주 상승에 대한 조정으로 하락했다. 북해산 브렌트유 3월물은 배럴당 55.17 달러로 1.46% 내려갔고 미국산원유 2월물은 51.72 달러로 1.00% 하락했다.
712,2021.01.12.,숨고르기?...국제 유가 '장중 하락',11일(미국시간) 장중 국제 유가가 하락했다. 블룸버그 집계에 따르면 이날 미국 동부시각 오후 3시 23분 기준 뉴욕상업거래소에서 2월물 미국서부텍사스산원유(WTI) 가격은 배럴당 51.98 달러로 0.50% 떨어졌다....
713,2021.02.10.,"[뉴스새벽배송]美 '숨 고르기' 가운데, 국내 옵션 만기일 맞이","국제유가, 2년래 최장기간 상승 -국제 유가는 9일(현지시간) 수요 회복 기대감에 힘입어 상승 랠리를 이어가. -이날 뉴욕상업거래소(NYMEX)에서 3월 인도분 서부 텍사스산 원유(WTI)는 전날보다 배럴당 0.7%(0.39달러) 오른 58...."
714,2021.01.13.,"조선업계, 유가 상승세에 화색…선박 발주 기대감↑",국제유가가 코로나19 팬데믹 이전인 지난해 2월 수준을 회복하는 등 상승세를 보이면서 우리 조선업계의 표정이 밝아지고 있다. 독보적인 LNG선 건조 경쟁력을 바탕으로 새해부터 '싹쓸이 수주'행진을 벌이면서...
715,2021.02.10.,어디든 돈 묻어두면 다 오른다…점차 고개드는 '인플레 공포'(종합),"(사진=AFP 제공) 국제유가가 폭등세를 이어가면서 인플레이션 공포가 점차 고개를 들고 있다. 지금은 어느 자산시장이든 돈을 묻어두기만 하면 오르는 리플레이션 상황이지만, 인플레이션 국면으로 넘어가는 건..."
716,2021.02.10.,"원유 등 수입 원자재값 '요동'.. 정부, 1억배럴 비축유 푼다",요동치는 국제유가와 곡물가격을 안정시키기 위해 정부가 서둘러 수급 대책을 마련하고 있다. 우선 민간 원유재고 감소 등에 국내 원유수급 차질이 발생할 경우 약 1억배럴의 정부 비축유를 방출하기로 했다. 또 쌀을...
717,2021.01.14.,바이든 경제정책 발표 앞두고 원화환율·엔화환율 상승...국제유가 소폭 올라,07% 절상됐다. 국제유가는 중국의 지난해 12월 수출이 예상보다 큰 증가를 보인 가운데 소폭 상승했다. 북해산 브렌트유 3월물은 배럴당 56.11 달러로 0.09% 올랐고 미국산원유 2월물은 53.02 달러로 0.21% 상승했다.
718,2021.01.13.,[국제유가]WTI 2% 상승…달러 약세에 상승 압력,"12일(현지시간) 미국 서부텍사스원유(WTI) 선물 가격이 2% 가까이 상승, 배럴당 53달러대로 올라섰다. 엿새 연속 올라 11개월 만에 최고치를 기록했다. 미 달러화가 약세를 나타내 상승 압력을 받았다...."
719,2021.02.09.,GS칼텍스 작년 9천억 적자…정유4사 모두 창사 이래 '최악 실적',"GS칼텍스는 코로나19 사태가 터진 지난해 1분기 1조318억원의 대규모 적자를 내고, 2분기 1천333억원의 적자를 기록했지만, 국제유가 회복에 따른 재고이익에 힘입어 3분기 2천971억원의 영업이익을 내며 흑자 전환에..."
720,2021.01.13.,뉴욕 장중...국제 유가 & 미국증시 에너지주 '껑충',12일(미국시간) 장중 국제 유가가 껑충 올랐다. 블룸버그 집계에 따르면 이날 미국 동부시각 오후 1시 38분 기준 뉴욕상업거래소에서 2월물 미국서부텍사스산원유(WTI) 가격은 배럴당 52.98 달러로 1.40% 상승했다....
721,2021.01.15.,[국제유가]WTI 1.3% 반등…中수출 호조 + 달러화 약세,"14일(현지시간) 미국 서부텍사스원유(WTI) 선물 가격이 1.3% 상승, 배럴당 53달러대로 올라섰다. 하루 만에 반등, 11개월 만에 최고치를 회복했다. 중국 지난달 수출 호조와 달러화 약세, 미 대규모 부양책 기대 등이..."
722,2021.02.10.,코스피 3100.58…사흘만에 상승 마감,"달러화가 약세를 보인 데다 국제유가가 상승세를 유지하면서 투자심리가 개선돼 외국인 매수세를 키운 것으로 분석됩니다. 코스닥지수는 어제보다 6.46포인트, 0.67% 오른 964.31로 마감했습니다. 서울..."
723,2021.01.23.,"[1보] 국제유가, 하락…WTI 1.6%↓",이투데이= | 국제유가는 22일(현지시간) 하락했다. 이날 뉴욕상업거래소(NYMEX)에서 3월 인도분 서부 텍사스산 원유(WTI)는 전일 대비 배럴당 0.86달러(1.6%) 하락한 52.27달러에 마감했다. 런던 ICE선물거래소의...
724,2021.01.12.,"미국정치 불확실성 확대, 원화환율 상승·엔화환율 하락... 국제유가 상승",3561 달러로 0.32% 절상됐다. 국제유가는 미국의 석유비축량이 5주 연속 감소했을 것이란 전망으로 상승했다. 북해산 브렌트유 3월물은 배럴당 56.10 달러로 0.79% 올랐고 미국산원유 2월물은 52.75 달러로 0.96% 상승했다.
725,2021.01.11.,[국제유가]WTI 3% 상승…부양책 기대 + 사우디 감산,미 대규모 추가 재정부양책 기대가 유가 상승을 지지했다. 사우디아라비아가 자발적으로 대규모 추가 감산에 나서겠다고 발표한 영향도 지속했다. 뉴욕상업거래소(NYMEX)에서 WTI 선물은 전장보다 1.41달러(2.8...
726,2021.02.10.,"커지는 인플레 기대 뭐 투자할까..""금보다 산업용 금속·에너지·배당株가 낫...","미국 조 바이든 행정부의 대규모 부양책, 완화적인 통화정책, 국제유가 등 원자재 가격 상승 등.. 이 모든 것들이 인플레이션(물가상승) 기대감을 자극하고 있다. 이에 따라 인플레이션을 헷지하는 투자에도 관심이..."
727,2021.01.11.,"주식투자자들, 유가 반등 수혜와 배당 매력 갖춘 종목 주목할 필요 - 신금투","신금투 강송철 연구원은 ""국제유가가 50달러를 상회해 작년 2월말 수준을 회복했다""면서 이같이 밝혔다. 강 연구원은 ""백신 보급과 경기 회복 기대, ‘블루웨이브’ 현실화에 따른 미국 재정지출 확대로 상품..."
728,2021.02.09.,"뉴욕증시, 美 경기 부양책 기대에 사상 최고치 경신 출발","범유럽지수인 Stoxx 600지수는 0.58% 올랐다. 국제유가도 상승했다. 3월물 서부텍사스산 원유(WTI) 가격은 전 거래일보다 1.13% 상승한 57.48달러에, 브렌트유는 1.06% 오른 59.97달러에 거래되고 있다. [ ]"
729,2021.02.09.,[자이앤트레터] 테슬라의 비트코인 투자에 뜨는 종목은?,"부양책 기대감에 항공주 급등…국제유가 1년 만에 최고 4. 美 국채 30년물 '장중 2%돌파' 월가 ""경제 좋아진다는 뜻…경기순환주 사라“ ◆ 테슬라의 비트코인 투자…마이크로스트레티지 등 관련주 폭등 간 밤 화제는..."
730,2021.01.14.,[국제유가]WTI 0.6% 하락…탄핵표결 앞두고 달러화 강세에 압박,미 하원의 도널드 트럼프 대통령 탄핵 표결을 앞두고 달러화가 강세를 나타내 유가가 하방 압력을 받았다. 뉴욕상업거래소(NYMEX)에서 WTI 선물은 전장보다 30센트(0.6%) 낮아진 배럴당 52.91달러를 기록했다. ICE...
731,2021.02.09.,"뉴욕증시, 美부양책 기대에 사상 최고치 경신 출발","국제유가도 상승했다. 3월물 서부텍사스산 원유(WTI) 가격은 전 거래일보다 1.13% 상승한 57.48달러에, 브렌트유는 1.06% 오른 59.97달러에 움직였다. jwoh@yna.co.kr ▶[팩트체크]은마아파트 2천300t 생활폐기물 누구 책임?"
732,2021.01.12.,[국제유가]WTI 강보합…달러강세·주가하락에 상승분 반납,다만 달러화 강세와 뉴욕주가 하락으로 유가는 초반 상승폭을 대부분 반납했다. 뉴욕상업거래소(NYMEX)에서 WTI 선물은 전장보다 1센트(0.02%) 높아진 배럴당 52.25달러를 기록했다. ICE 선물거래소의 브렌트유 선물은...
733,2021.02.04.,"국제유가, 미 재고 감소에 1년래 최고치…WTI 1.7%↑",연합뉴스에 따르면 국제 유가는 3일(현지시간) 미국의 원유 재고 감소에 큰 폭으로 상승했다. 이날 뉴욕상업거래소(NYMEX)에서 3월 인도분 서부 텍사스산 원유(WTI)는 전날보다 배럴당 1.7%(0.93달러) 오른 55.69달러에...
734,2021.01.15.,"뉴욕증시 '에너지주 붐' 지속...국제 유가 뛰고, 빅 오일주 급등",14일(미국시간) 뉴욕증권거래소와 CNBC에 따르면 이날 미국산 국제 유가와 뉴욕증시 에너지 관련주들의 상승이 돋보였다. 이날 S&P 에너지 섹터는 336.14로 무려 3.01%나 치솟았다. 빅 오일주에 해당하는 엑손모빌(+3.90...
735,2021.02.09.,'코로나 직격탄' GS칼텍스 작년 정유 사업서 1.2조 적자,"국제 유가 하락과 석유 제품 수요 감소로 정유와 석유화학 사업 실적이 부진했다. 정유 사업에서만 1조1,829억원의 영업적자를 냈다. 그나마 윤활유 사업이 2,623억원 흑자를 내며 전체 실적 악화를 조금이나마..."
736,2021.02.10.,"비트코인, 4만8천달러 돌파…미국 증시, 나스닥 또 최고치 [출근전 꼭 글로벌...","■ 유가 및 금값 상승 국제유가는 산유국들의 감산 이행과 경기 회복 기대감에 7거래일 연속 상승했다. 코로나19 사태가 터진 이후 52주 신고가를 기록했다. WTI는 0.6% 올라 58달러 선에 안착했고, 브렌트유도 1% 가량..."
737,2021.02.10.,최고치 기록 美 증시 보합세···잠시 쉬어가나 [데일리 국제금융시장],국제유가는 수요 회복 기대감에 상승세를 이어갔다. 이날 뉴욕상업거래소(NYMEX)의 3월 인도분 서부 텍사스산 원유(WTI)는 전날보다 배럴당 0.7%(0.39달러) 오른 58.36달러에 거래를 마감했다. 런던 ICE선물거래소의...
738,2021.02.09.,최고치 또 경신 미국증시 일제 상승…비트코인 사상 최고가 [출근전 꼭 글로벌...,"국제유가가 연일 오르고 있는데다 민주당이 항공업계에 140억달러 규모의 급여지원을 준비 중이라는 소식에 정유업체와 항공사들의 주가가 급등했다. 엑손모빌은 4.3%, 델타항공은 5.1%, 아메리칸항공은 3.4% 각각..."
739,2021.02.09.,"美 증시, 경기회복 기대감에 사상최고치 행진 [뉴욕마감]",브렌트유 1년만에 60달러 돌파 국제유가는 1년 만에 처음으로 배럴당 60달러를 돌파했다. 런던 ICE 선물거래소에서 밤 11시10분 현재 국제유가의 기준물인 4월분 북해산 브렌트유는 1.33달러(2.24%) 상승한 60.67달러를...
740,2021.02.09.,"GS, 작년 영업익 9206억원…전년比 54.7% 뚝",GS관계자는 “2020년 4분기에는 전반적으로 전년 동기 및 직전 분기 대비 부진했다”면서 “GS칼텍스와 발전 자회사들의 경우 국제 유가와 전력 수요 및 전력도매가격(SMP) 하락 등 영향으로 실적이 둔화됐다”...
741,2021.02.09.,"코스피 3100선 회복 실패…""연기금 올해 30조 더 판다""","국제 유가가 상승하면서 SK이노베이션, S-Oil 등 정유주는 1~2% 상승했다. 이날 연기금은 2236억원 순매도하며 31거래일 연속 순매도 행진을 이어갔다. 총 매도 금액은 10조4905억원에 달한다. 증권업계에서는 올 상반기까지..."
742,2021.02.09.,"GS칼텍스, 정유사업 적자 1兆에… GS그룹 영업익 '반토막'",국제 유가 하락과 석유 제품 수요 감소로 정유와 석유화학 사업 실적이 부진했던 탓이다. 정유 사업에서만 1조1829억원의 영업적자를 기록했다. 그나마 윤활유 사업은 2623억원 흑자를 기록했다. GS칼텍스...
743,2021.02.10.,2월 2주 주요 제조업 전망,LG디스플레이가 디스플레이 주사율 높이기 위해 생산 방식을 바꾸면 아이폰14 시리즈의 디스플레이부터 적용될 것이라는 게 업계 전망 □ 국제 유가 동향(8일 기준) - WTI(서부텍사스유) $57.97/bbl (전일 대비 $1.12 상승)...
744,2021.01.22.,[1보] 국제유가 하락...WTI 0.3%↓,이투데이=김나은 기자 | 국제 유가가 21일(현지시간) 하락했다. 뉴욕상업거래소(NYMEX)에서 3월 인도분 서부 텍사스산 중질유(WTI)는 전일 대비 0.18달러(0.3%) 내린 배럴당 53.13달러에 마감했다.
745,2021.02.09.,"[인더머니] “현금살포, 재정으로 재개”…뉴욕 3대 지수 사상 최고치","국제 유가는 코로나19 이전 가격 수준을 회복했고, 금값도 반등세다. 이날 뉴욕증시의 다우존스30 산업평균지수는 전장보다 237.52포인트(0.76%) 오른 31,385.76에 거래를 마감했다. 스탠더드앤드푸어스(S&P) 500 지수는..."
746,2021.02.09.,무섭게 뛰는 원자재값…다시 시작된 물가 ‘걱정’,"국제유가는 1년 만에 코로나19 이전 수준을 회복했고, 금속과 곡물 가격은 오히려 코로나19를 거치며 더 오르는 양상입니다. 김정연 기자, 연초부터 원자재 가격이 상당히 많이 올랐네요? [기자] 저유가 걱정하던 게..."
747,2021.02.09.,치솟는 美경기회복 기대감…'인플레' 변수 될까,일부에서는 국제유가가 올해 배럴당 80달러까지 오를 것이라는 전망도 나오고 있다. 물가 상승은 경기 회복의 기대감을 반영하고 있기도 하지만 자칫 경제에 역풍을 불러올 수 있어 시장은 예의 주시하고 있다....
748,2021.01.22.,미국산 국제 유가 '장중 하락' & 쉐브론 주가 '장중 급락',21일(미국시간) 장중 국제 유가가 하락했다. 장중 대형 에너지주인 쉐브론의 주가도 급락했다. 블룸버그 집계에 따르면 이날 미국 동부시각 오후 3시 20분 기준 뉴욕상업거래소에서 3월물 미국서부텍사스산원유...
749,2021.02.09.,"미국 증시, 경기 회복 기대로 3대 지수 사상 최고 마감",국제 유가는 1년 전 가격 수준을 회복했다. 이날 뉴욕상업거래소(NYMEX)에서 3월 인도분 서부 텍사스산 원유(WTI)는 전 거래일보다 배럴당 2%(1.12달러) 오른 57.97달러에 거래를 마쳤다. 런던 ICE선물거래소의 4월물...
750,2021.02.09.,[모닝브리핑] 제동 걸린 원전 수사…美증시 사상 최고 마감,"◆ 국제유가, 경기회복 기대감 속 급등 국제 유가는 8일(현지시간) 미국 등 글로벌 경제 회복 기대감에 1년 전 가격 수준을 회복했습니다. 이날 뉴욕상업거래소(NYMEX)에서 3월 인도분 서부 텍사스산 원유(WTI)는 전..."
751,2021.02.09.,"비트코인에 1.7조 쏜 테슬라...""끔찍해 vs 또다른 혁신"" 누가 맞을까",국제유가는 1년 만에 처음으로 배럴당 60달러를 돌파했다. 런던 ICE 선물거래소에서 밤 11시10분 현재 국제유가의 기준물인 4월분 북해산 브렌트유는 1.33달러(2.24%) 상승한 60.67달러를 기록하며 60달러의 벽을 넘었다....
752,2021.02.09.,추경發 국고채금리 급등세… 물가쇼크·수급우려 채권시장 '뒤숭숭',여기에 국제유가와 곡물가격이 급등하면서 물가상승에 대한 기대감도 반영됐다. 9일 금융투자협회에 따르면 전날 우리나라 국고채 10년물 금리는 1.822%로 전거래일대비 0.031%포인트(p) 상승했다. 국고채 10년물은...
753,2021.02.09.,성적표 받은 정유4사...지난해 도합 3조 원 손실 기록,일각에서는 코로나19 백신 확산이 예정대로 진행될 경우 국제유가가 지난해 1월 수준인 배럴당 60달러 수준으로 회복할 것이라는 장밋빛 전망도 제시하는 중이다. ◆ 국제유가·정제마진 등은 개선세…올해 실적...
754,2021.02.05.,작년 불황형 흑자…경상흑자 753억달러로 전년보다 26%↑(종합),"수입은 국제유가 등 원자재 가격 하락이 크게 작용하는 등 가격 요인에 따른 감소였기 때문에 불황형 흑자라고 보기는 어렵다""고 말했다. 서비스수지는 여전히 161억9천만달러 적자를 기록했다. 하지만 여행..."
755,2021.02.10.,"""옵션 만기일 도래…韓 증시 변동폭 확대 수급에 주목""","서상연 연구원은 “특히 달러화가 여타 환율에 대해 약세를 보인 점, 국제유가가 상승세를 유지한 점, 러셀 2000지수 상승세 지속 등이 외국인 수급에 긍정적인 영향을 줄 것”이라고 예측했다. 결국 이날 증시는 상승..."
756,2021.02.10.,"[오늘의 글로벌마켓] 뉴욕증시, 숨고르기...나스닥은 1만4000선 돌파",유럽 혼조...국제유가 상승세 지속 유럽증시는 혼조양상을 보였다. 미국의 부양책에 대한 기대감이 확산됐지만 독일 정부가 봉쇄조치를 연장하겠다고 밝힌 점 등은 부담이 됐다. 이날 영국 런던 증시의 FTSE 100...
757,2021.01.21.,[1보] 국제유가 상승...WTI 0.57%↑,이투데이=김나은 기자 | 국제 유가가 20일(현지시간) 상승했다. 뉴욕상업거래소(NYMEX)에서 2월 인도분 서부 텍사스산 중질유(WTI)는 전일 대비 0.30달러(0.57%) 오른 배럴당 53.28달러에 마감했다.
758,2021.01.16.,"정유株, 유가 반등에 기지개 켠다",이투데이=유혜림 기자 | 그간 코스피 활황에 소외됐던 정유주가 국제 유가 회복에 힘입어 회복세를 보인다. 정유사의 주 수익인 정제마진 개선 기대감이 반영된 것으로 풀이된다. 다만 신종 코로나바이러스 감염증...
759,2021.01.18.,[스페셜 리포트] 경차의 예고된 종말…저유가ㆍ소득수준 향상에 떠밀려,"2010년대 중반 1배럴당 150달러 수준에 달했던 국제유가는 이후 50달러를 밑돌기 시작했다. 원자력 활용도가 높아졌고, 셰일가스가 등장하면서 대체 에너지원도 급증했다. 나아가 친환경 엔진 기술이 발달하면서 자동차의..."
760,2021.01.18.,[스페셜 리포트] 경차의 예고된 종말…저유가ㆍ소득수준 향상에 떠밀려,"2010년대 중반 1배럴당 150달러 수준에 달했던 국제유가는 이후 50달러를 밑돌기 시작했다. 원자력 활용도가 높아졌고, 셰일가스가 등장하면서 대체 에너지원도 급증했다. 나아가 친환경 엔진 기술이 발달하면서 자동차의..."
761,2021.02.10.,"[최정희의 이게머니]美 장단기 금리차, 4년 만에 최대…경기회복 Vs 인플레 공...","전 세계 물가에 가장 큰 영향을 미치는 국제유가는 이달에만 11% 오르는 등 넉달 연속 상승세를 보였다. (출처: 세인트루이스 연방준비은행)◇ 장단기 금리차 커졌다, 무슨 의미? 세인트루이스연방준비은행에 따르면..."
762,2021.02.06.,주유소 휘발유 가격 11주 연속 상승…L당 평균 1452원,지난주 보합세를 기록하던 국제유가는 이번주 상승세로 돌아섰다. 한국으로 수입하는 원유의 기준이 되는 두바이유의 2월 첫째 주 평균 가격은 전주보다 배럴당 1.8달러 오른 56.9달러를 기록했다. 국제 휘발유...
763,2021.02.10.,정유 4사 윤활유사업이 효자,코로나19 대유행으로 석유제품 수요 급감에 따른 정제마진 악화와 국제유가 하락에 따른 재고평가 손실 영향으로 조단위 영업손실과 대비된다. 10일 업계 실적을 종합하면 SK이노베이션 GS칼텍스 에쓰오일...
764,2021.02.09.,"GS, 에너지 부문 실적 저조 영업익 54.7% 감소",작년 상반기 국제 유가하락에 따른 원유 재고 평가 손실이 크게 작용한 것으로 분석됐다. GS에너지 작년 영업이익은 3416억 원을 기록했는데 지난 2019년보다는 74.5% 하락한 것으로 나타났다. 유통계열사는...
765,2021.02.09.,"美 30년물 국채 금리, 코로나19 이후 첫 2% 달성",조 바이든 행정부의 1조9000억달러 규모의 경기 부양책이 의회를 통과할 가능성이 높아지면서 경기 회복 기대감이 커지고 국제유가 상승에 인플레이션 기대감까지 올라가면서 장기 채권 금리가 상승하고 있다. 출처...
766,2021.02.09.,원자재 슈퍼 사이클…앞으로 10년은 간다,국제 유가는 코로나19 이전 가격을 회복해 1년 만에 최고치를 기록했다. 5일 미국 뉴욕상업거래소(NYMEX)에서 서부텍사스원유(WTI) 3월물은 배럴당 56.85달러에 거래됐다. 작년 1월 말 이후 최고치다. 영국 런던...
767,2021.01.12.,"'국제유가 상승'에도 웃지 못하는 韓 정유업계, 왜?","-사우디 일일 100만 배럴 감산…국제유가 50달러↑ -정유사들은 여전히 '경영난'…""수요가 회복돼야"" 현대오일뱅크 VLSFO(초저유황선박유) 공정. 국내 정유업계가 국제유가 상승에도 불구하고 수익성 회복에 속도를 내지..."
768,2021.02.10.,"[뉴욕증시 마감] '조정이냐, 숨고르기냐?'...다우·S&P 6일간 상승 기록 종료",나스닥 4일 연속 오르며 사상 첫 1만4000선 돌파 美부양책에 낙관주의 복귀...5~10% 조정세 우려도 국제유가 급등세 계속...WTI·브렌트 모두 60달러 선 최지현 기자 tiipo@ajunews.com 9일(현지시간) 뉴욕증시는 지난 6거래일...
769,2021.02.10.,세계증시 사상최고...어닝+파월 연설 주시,"상품시장에서 국제유가는 기록적 상승 흐름을 이어가고 있다. 북해산 브렌트유 선물은 8일 연속 오르며 지난해 1월 이후 최장기, 미국 서부텍사스산원유(WTI) 선물은 7일 연속 오르며 지난해 2월 이후 최장기..."
770,2021.02.10.,"코스피, 옵션만기일 3100선 탈환…0.52% 올라",달러화가 약세를 보이는 가운데 국제유가가 상승세를 유지한 점도 외국인 수급에 긍정적으로 작용한 것으로 풀이된다. 시가총액 상위 10개 종목 중에는 카카오(6.18%) 현대차(3.59%) NAVER(2.23%) 삼성SDI(1.42...
