,날짜,제목,요약
1269,2019.03.05.,2월 소비자물가 0.5%↑… 2년 6개월만에 최저 상승률,여기엔 유류세 인하와 국제유가 하락이 영향을 미쳤다는 것이 통계청 설명이다. 공업제품은 0.8% 내려 전체 물가를 0.25%p 내리는 효과를 나타냈다. 농축수산물은 1.4% 하락해 전체 물가를 0.11%p 낮췄다. 특히...
1270,2019.03.05.,2월 소비자물가 0.5%↑… 2년 6개월만에 최저 상승률,여기엔 유류세 인하와 국제유가 하락이 영향을 미쳤다는 것이 통계청 설명이다. 공업제품은 0.8% 내려 전체 물가를 0.25%p 내리는 효과를 나타냈다. 농축수산물은 1.4% 하락해 전체 물가를 0.11%p 낮췄다. 특히...
1271,2019.02.27.,"울산항, 1월 1,811만 톤 처리…전년比4.3% 증가","전월 기저효과와 국제유가 하락으로 인한 정제마진 감소가 주요원인으로 나타났다. 일반화물은 342만 톤을 처리해 전년 동월 대비 34.2%(87만 톤)증가했고, 전월(313만 톤) 대비 9.4%(29만 톤) 증가했다. Ro..."
1272,2019.03.01.,'반도체 수출 4분의 3토막'에 2월 수출 11.7%↓ 석달 연속 마이너스,국제유가 상승에도 불구하고 미국발 공급물량 증가 등으로 수출단가가 계속 하락한 탓이 컸다. 선박(-46.5%)은 2016년 세계 선박 발주량 급감에 따른 수주 하락 여파가 아직 남아있던 탓에 감소 폭이 컸으나 올...
1273,2019.03.04.,[국가공인 경제이해력 검증시험 맛보기] 실업,( ㉠ ) 리더로서 원유 생산량 조절을 이끌면서 국제 유가를 관리하기까지 했다. 하지만 미국이 2000년대 들어 ( ㉡ )을(를) 앞세우며 상황은 바뀌었다. 2008년 하루 470만 배럴 정도였던 미국의 원유 생산량은 2015년 4월 960만...
1274,2019.02.26.,[원유마감] 일주일여 만에 최저치…트럼프 OPEC 비난,국제유가가 25일(현지시간) 하락했다. 도널드 트럼프 미국 대통령이 최근 유가 상승에 대해 석유수출국기구(OPEC)가 원인이라고 비난한 직후 유가가 약 일주일 만에 최저치로 마무리됐다. 미국의 서부텍사스원유...
1275,2019.02.23.,기름값 16주만에 상승 전환…휘발유 0.2원↑,그러나 체감 가능한 유류세 인하 정책 효과가 소멸하고 최근 국제유가도 오름세를 보이면서 휘발유경유 가격이 다시 고개를 들게 됐다.이 가운데 서울의 휘발유 가격은 전주보다 2.5원 하락한 ℓ당 평균 1445....
1276,2019.02.20.,그 많은 수소를 어디서 만드나?…문제는 비용,"물 분해 방식은 돈이 많이 들고, 수입을 하려면 국제 유가에 주유소 기름값이 변하듯 수소 가격이 출렁일 수 있습니다. 지금은 수소값이 kg당 8천 원 정도인데 정부 지원금을 빼면 5만 원까지도 올라갈 수 있어, 돈을 들여..."
1277,2019.02.14.,"금호아시아나, '유동성 위기설' 진화… ""안정적 이익 실현""","매출은 전년 대비 10% 증가한 것이며, 국제유가 상승과 불안정한 대내외 경제변수 영향에도 안정적인 이익을 시현한 것이라고 자평했다. 금호아시아나가 그룹 차원에서 실적을 공개한 것은 이례적이다. 이날..."
1278,2019.02.15.,"지난해 경상수지 764억달러, 21년 연속 흑자…수출 '사상 최대'",수입은 국제유가 상승의 영향으로 1년 새 10.0% 증가한 5135억7000만달러였다. 다만 지난해 12월에는 수출이 495억7000만달러에 그쳤다. 전년동월대비 1.4% 감소한 규모다. 수출이 1년 전보다 감소한 건 장기연휴로...
1279,2019.02.19.,유류세 인하후 전국평균 휘발유價 첫 상승전환…3일 연속↑,"국제유가는 지난달부터 계속 오르고 있다. 한국석유공사에 따르면 지난 15일 현재 두바이유는 배럴당 65.12달러, 브렌트유는 66.25달러, 서부텍사스산원유(WTI)는 55.59달러다. 지난해 12월 최저점에서 모두 30% 이상..."
1280,2019.02.24.,적자권 정제마진 탈출은 언제…엇갈리는 전망,"이미 국내 정유4사는 정제마진 하락에다가 40% 가까이 떨어진 국제유가에 따른 대규모 재고평가손실로 지난해 4분기 1조136억원의 영업손실을 기록했다. SK이노베이션 2789억원, GS칼텍스 2670억원, 에쓰오일 2924억원..."
1281,2019.02.19.,하락세 멈춘 전국주유소 기름값… 평균판매가 석달만에 상승 전환,국제유가 상승 등의 여파로 전국 주요소 기름값 하락세가 멈췄다. 정부의 유류세 인하 정책 실행 이후 약 3개월여 만에 처음으로 전국 보통휘발유 평균 판매가격이 상승 전환한 것으로 나타났다. 19일 업계와...
1282,2019.02.23.,기름값 15주 연속 하락세 '마감'...오름세 전환 조짐,"석유공사 관계자는 ""국제유가는 사우디와 러시아 두 정상 간의 에너지시장 지속 공조 합의, 리비아 생산차질 지속 등으로 상승했다""면서 국내제품가격도 최근 국제유가 상승세 반영에 따른 추세 전환으로..."
1283,2019.03.04.,2월 4주 휘발유·경유 가격↑…2주 연속 상승,"미국 원유 재고 감소, 사우디 감산 연장 가능성 발언 등의 상승요인이 혼재하면서 약보합세를 보였다""며 ""국내 제품가격은 최근 국제유가 상승분이 시차를 두고 반영됨에 따라 오름세를 유지할 것""이라고 전망했다."
1284,2019.03.05.,"롯데케미칼의 위기와 기회, 미국공장서 돌파구 찾는다","함형도 IBK투자증권 연구원은 ""석유화학 산업은 다양한 전방산업을 가진 특성으로 세계 경기와 동행하는 흐름을 보인다""며 ""국제 유가 변동성이 확대된 상황에서 에탄을 원재료로 사용하는 ECC설비 매력은 더욱 부각될..."
1285,2019.02.27.,울산 1월수출 57억달러…작년보다 8.1% 신장,품목별로는 울산의 최대 수출품목인 석유제품의 수출은 국제유가 하락에 따른 수출단가 하락(-15.3%)에도 불구하고 수출물량이 큰 폭으로 증가(25.7%)함에 따라 전년 동월 대비 6.4% 증가한 16억 8600만달러를...
1286,2019.03.03.,3일 휘발유값 상승세... 평균 1349 원 대 형성,"국내 휘발유 가격이 국제 유가와 유류세 효과 등으로 가격 상승세를 보였다. 한국석유공사 유가 정보 서비스인 '오피넷' 에 따르면, 이달 3일 보통 휘발윳값은 +0.05원 떨어진 리터당 1349.06원으로 집계됐다...."
1287,2019.02.21.,[데일리 국제금융시장] 연준 긴축 완화에 '상승',국제유가는 6거래일 연속 오름세를 이어갔다. 뉴욕상업거래소(NYMEX)에서 3월 인도분 서부 텍사스산 원유(WTI)는 배럴당 0.83달러(1.5%) 상승한 56.92달러에 거래를 마쳤다. 런던 ICE선물거래소의 4월물 브렌트유는...
1288,2019.02.19.,3월 국제선 유류할증료 최고 ‘3만4800원’,- 국제유가 영향…국내선 할증료는 ‘동결’ 국제유가가 하락세를 멈추고 상승세로 돌아서면서 다음달 국제선 항공권 유류할증료가 1단계 오른다. 이에 국제선 항공권에 이동 거리에 따라 추가로 붙는...
1289,2019.02.28.,울산항 1월 ‘컨’ 물동량 3만9000TEU…1.5%↓,전월 기저효과와 국제유가 하락으로 인한 정제마진 감소가 이번 실적의 배경이라고 UPA는 밝혔다. UPA 관계자는 “주요 화주사들의 명절 전 물량 확보가 이어지며 전년 동월 대비 물동량이 4.3% 증가했다”며...
1290,2019.02.23.,휘발유 값 유류세 인하 이후 첫 반등…평균 1342.9원,국제유가가 상승세로 전환하면서 국내유가도 오를 가능성이 높아졌다. 23일 한국석유공사 유가정보서비스 오피넷에 따르면 2월 셋째주 기준 전국 주유소 휘발유 평균 가격은 전주보다 0.2원 상승한 리터당 1342....
1291,2019.02.19.,3월 국제선 유류할증료 최고 ‘3만4800원’,- 국제유가 영향…국내선 할증료는 ‘동결’ 국제유가가 하락세를 멈추고 상승세로 돌아서면서 다음달 국제선 항공권 유류할증료가 1단계 오른다. 이에 국제선 항공권에 이동 거리에 따라 추가로 붙는...
1292,2019.02.28.,울산항 1월 ‘컨’ 물동량 3만9000TEU…1.5%↓,전월 기저효과와 국제유가 하락으로 인한 정제마진 감소가 이번 실적의 배경이라고 UPA는 밝혔다. UPA 관계자는 “주요 화주사들의 명절 전 물량 확보가 이어지며 전년 동월 대비 물동량이 4.3% 증가했다”며...
1293,2019.02.25.,"[ET투자뉴스]한국전력, ""원전도 늘고, 비용…"" BUY-현대차증권","또한 현대차증권에서 ""연료비 및 SMP 하락 효과는 2Q19부터 극대화 될 전망인데, 1) 발전용 LNG 가격이 국제 유가에 3~4개월 시차를 두고 하락할 전망인데, 2Q19 중 가장 크게 반영될 전망이며, 2) 지난 10월부터..."
1294,2019.02.19.,수출 물가 석 달 연속 하락...D램은 '급락',"무려 15% 가까이 하락해, 7년 5개월 만에 최대 낙폭을 기록했습니다. 반면 수입 물가는 석 달 만에 소폭 올랐습니다. 국제유가가 오르면서 광산품 물가가 상승해 전체 수입 물가를 끌어올렸습니다. YTN 조태현[]입니다."
1295,2019.03.01.,반도체 '너마저'...2월 수출 11.1% 감소 '문재인 효과',국제유가 상승에도 불구하고 미국발 공급물량 증가 등으로 수출단가가 계속 하락한 탓이 컸다. 선박(-46.5%)은 2016년 세계 선박 발주량 급감에 따른 수주 하락 여파가 아직 남아있던 탓에 감소 폭이 컸으나 올...
1296,2019.03.05.,뚝뚝 떨어진 GDP 디플레이터·물가도 낮아…여전한 경기 우려,올해 국제유가는 지난해 같은 달보다 여전히 낮은 수준이다. 작년 1~2월 국제유가 66달러에서 올해 62달러로 하락했다. 농·축·수산물 가격 상승률도 0.7%에 그치면서 2017~2018년 6.3%를 크게 밑돌았다. 석유류와 농·축...
1297,2019.02.23.,"""기름값 다시 오른다"" 휘발유값 4개월 만에 반등",국제유가가 상승세를 보이면서 당분간 국내 휘발유 및 경유 값 역시 빠르게 오를 전망이다. 23일 한국석유공사 유가정보서비스 오피넷에 따르면 2월 셋째주 주유소 휘발유 판매가격은 전주 대비 0.2원 상승한 리터당...
1298,2019.03.06.,"국제금융센터 ""기준금리 올해 금리 동결 가능성 우세""","소비자물가 상승률이 국제유가 하락, 정부 복지정책 강화 영향 등으로 지난 1월의 전망경로를 하회해 당분간 1%를 밑도는 수준에서 등락할 것으로 한은은 예상했다. 다만, 이주열 한은 총재는 시장에서 금리 인하의..."
1299,2019.02.21.,"2월 수출도 '쇼크'…'발등에 불' 정부, 대책 마련 분주","최근 미‧중 통상분쟁, 노딜 브렉시트 가능성 등으로 통상환경의 불확실성이 높아진 데다 세계무역 성장세 둔화, 반도체 시황 악화, 국제 유가 하락 등 글로벌 시장의 변동성도 커지며 대외 수출여건이 악화한..."
1300,2019.02.14.,"뉴욕증시, 무역협상 낙관 지속…다우 0.46% 상승 마감",여기에 사우디아라비아의 추가 감산 방침 등으로 국제유가가 오름세를 이어가는 점도 에너지주 중심으로 증시에 활력을 더했다. 서부텍사스원유(WTI)는 전일 1.3% 오른 데 이어 이날도 1.5% 상승했다. 이날 종목별로는...
1301,2019.02.25.,"[ET투자뉴스]한국전력, ""지나간 적자보다는 …"" BUY-하나금융투자","다만 2018년 4분기에 하락한 국제유가는 시차를 두고 올해1분기 실적부터 원가 하락요인으로 반영될 전망이다""라고 밝혔다. 한편 ""규제 측면에서 이번 정부의남은 임기동안의 주가흐름을 결정할 요소는 하반기..."
1302,2019.02.21.,"IMF, 에콰도르에 4조7천억원 규모 금융지원","석유수출국기구(OPEC) 회원국인 에콰도르는 수년째 국제유가 하락과 심각한 재정적자 속에 경제성장 둔화를 겪고 있다. 중도좌파 성향의 모레노 정부는 페트로아마조나스, 페트로데콰도르를 포함한 국영기업의..."
1303,2019.02.28.,"""세계 위험요인 1위는 경제… 6위는 한반도 전쟁""","9위는 국제유가 급락과 석유수출국기구(OPEC)의 생산 차질, 10위는 (브렉시트에 이은) 여러 나라의 유로존 이탈을 꼽았다. <이코노미스트> 산하 EIU는 세계 180여 개국을 대상으로 정치·경제 환경 분석, 중장기 전망, 국가..."
1304,2019.02.16.,휘발윳값 15주째 떨어져…3주 연속 1원 안팎 하락,"석유공사는 ""국제유가는 석유수출국기구(OPEC)의 1월 생산량 감소, 베네수엘라 정정 불안 지속 등의 영향으로 상승했으나 미국 원유재고 증가 등으로 상승폭이 제한됐다""면서 ""국내 제품 가격은 국제유가의..."
1305,2019.03.05.,"[CEO칼럼]해외건설, 수주보다 수익성 우선해야","마침 국제유가가 배럴당 100달러를 상회하면서 중동국가의 플랜트 발주도 급격하게 늘었다. 그 와중에 우리 건설업체들 간의 과당경쟁은 저가수주를 초래했고, 수행역량을 넘어선 급격한 수주물량의 확대는 사업..."
1306,2019.03.04.,경제 빅이벤트 많은 3월 ‘투자전략’ 어떻게 세울까,"2…2년3개월만에 최저 - '美 소비 쇼크' 여파, 국제유가 2%대 급락 연출 - 美 생산·소비 지표 부진…석유 수요 둔화 우려 - 고용지표 등 경기 상황 가늠 경제지표 촉각 Q. 2월 마지막 거래일 코스피 지수는 북미 정상회담..."
1307,2019.02.28.,"[질의응답] 이주열 총재 ""금리인하 검토할 단계 아니다""","낮은 물가 흐름은 통화정책으로 대응하기 어려운 공급측이 요인, 대표적으로 국제유가 등이 상당히 작용한다. 이런 요인을 제외한 기조적 물가는 1%대 중후반 수준을 유지하고 있는 것으로 보고 있다. 물가안정목표제는..."
1308,2019.03.07.,<뉴욕마켓워치> 美 경기평가 하향·지표 부진…주가↓국채↑,"업종별로는 국제유가 하락 탓에 에너지가 1.28% 내렸고, 건강관리 업종도 1.47% 하락했다. 재료 분야는 0.2% 올랐다. 뉴욕증시 전문가들은 증시가 당분간 소강상태를 보일 수 있다고 진단했다. GW&K 인베스트먼트..."
1309,2019.02.26.,"금투협, 채권 전문가 금통위 2월 기준금리 동결 '전망'",국제 유가 하락 등의 영향으로 소비자물가 상승률은 낮아졌지만 체감물가가 여전히 높다는 인식에 물가 관련 채권시장 심리는 소폭 악화된 것으로 읽힌다. 데일리안 최이레 기자
1310,2019.02.26.,"금투협, 채권 전문가 금통위 2월 기준금리 동결 '전망'",국제 유가 하락 등의 영향으로 소비자물가 상승률은 낮아졌지만 체감물가가 여전히 높다는 인식에 물가 관련 채권시장 심리는 소폭 악화된 것으로 읽힌다. 데일리안 최이레 기자
1311,2019.02.19.,반도체 주춤에…수출물가 3개월 연속 하락,3%) 이후 7년 5개월 만에 최대를 기록했다. 1월 수입물가지수는 84.98로 전월 대비 0.1% 상승했다. 수입물가는 국제유가가 오르면서 석 달만에 상승했다. 1년 전과 비교했을 땐 2.5% 상승했다.
1312,2019.02.28.,[뉴욕마감]미·중 무역협상 불확실성에 이틀 연속 하락,"국제 유가는 소폭 상승했다. 이날 뉴욕 상업거래소(NYMEX)에서 4월 인도분 서부텍사스산원유(WTI)는 전일 대비 배럴당 1.47달러(2.65%) 올라 56.97달러에 거래됐고, 런던 ICE 선물거래소의 4월 인도분 브렌트유도 배럴당 1...."
1313,2019.03.07.,[Biz 브리프] '디젤USA 파산보호 신청' 외,재고증가에 유가 약세 국제유가는 6일 약세를 나타냈다. 이날 뉴욕상업거래소에서 4월 인도분 서부 텍사스산 원유(WTI)는 전날보다 배럴당 0.34달러(0.6%) 하락한 56.22달러에 거래를 마쳤다. 미국의 원유 재고가 큰 폭으로...
1314,2019.02.19.,국제선 유류할증료 3월엔 '점프'...얼마나 오르나,올해 들어 하락세를 보이던 국제유가가 최근 상승세로 돌아서면서 다음달 국제선 항공권 유류할증료가 1단계 오른다. 이에 따라 국제선 항공권에 이동 거리에 따라 추가로 붙는 유류할증료는 다음달 발권 기준...
1315,2019.02.16.,휘발유값 3주간 2.8원 내려…향후 가격 변동 적을 듯,국제유가가 안정흐름을 보이고 있어 향후 국내유가 역시 큰 변동을 보이지 않을 전망이다. 16일 한국석유공사 유가정보서비스 오피넷에 따르면 2월 둘째주 기준 전국 주유소 휘발유 평균 가격은 전주보다 1.3원...
1316,2019.03.03.,‘반도체·중국 부진’에 2월 수출 11.1%↓…석 달 연속 감소,국제유가 상승에도 불구하고 미국발 공급물량 증가 등으로 수출단가가 계속 하락한 탓이 컸다. 선박(-46.5%)은 2016년 세계 선박 발주량 급감에 따른 수주 하락 여파가 아직 남아있던 탓에 감소 폭이 컸으나 올...
1317,2019.02.25.,"[ET투자뉴스]한국전력, ""이제는 제도개편 기…"" BUY(유지)-유진투자증권","4분기 원전 가동률 회복(+8%p yoy)에도 3분기 급등했던 국제유가의 영향으로 원가부담이 불가피했다""라고 분석했다. 또한 유진투자증권에서 ""매출액은 16.4조원(+4.3%yoy), 영업이익 5,355억원(흑전yoy), 순이익 2..."
1318,2019.02.28.,"[해외시황] 뉴욕, 인도·파키스탄 무력충돌에 혼조…유럽↓",이런 가운데 국제유가는 미국의 원유 재고가 예상보다 크게 줄었다는 소식에 큰 폭으로 상승했다. 이날 뉴욕상업거래소에서 4월 인도분 서부텍사스산원유(WTI)는 전날보다 배럴당 2.59%(1.44달러) 오른 56.94달러에...
1319,2019.02.18.,물가상승률 제자리인데 체감은 2%대… 소비위축 경고등,"하락세에는 국제유가 흐름이 큰 영향을 미쳤다. 우리가 주로 수입하는 중동산 두바이유를 기준으로 보면 지난해 배럴당 80달러를 넘었지만 연말 연초에 배럴당 50달러대로 떨어졌고, 최근에는 배럴당 60달러대 초반을..."
1320,2019.02.18.,물가상승률 제자리인데 체감은 2%대… 소비위축 경고등,"하락세에는 국제유가 흐름이 큰 영향을 미쳤다. 우리가 주로 수입하는 중동산 두바이유를 기준으로 보면 지난해 배럴당 80달러를 넘었지만 연말 연초에 배럴당 50달러대로 떨어졌고, 최근에는 배럴당 60달러대 초반을..."
1321,2019.02.19.,휘발유 가격 상승전환… 유류세 인하 석달만에,"이는 유류세 인하에 대한 효과가 사실상 소진됐고, 석유수출국기구(OPEC)의 원유 감산정책으로 국제유가가 지난달부터 오르고 있기 때문으로 풀이된다.국제휘발유 가격은 지난해 12월 넷째 주 배럴당 53.09달러에서..."
1322,2019.02.23.,"기름값, 넉달 만에 하락세 중단","7원을 기록, 지난 2016년 3월 둘째 주(1340.4원) 이후 35개월 만에 가장 낮은 가격까지 내려오기도 했다. 그러나 체감 가능한 유류세 인하 정책 효과 소멸과 최근 국제유가 오름세에 따라 기름값이 상승전환했다. jay@"
1323,2019.02.26.,[월가브리핑] 부활하는 '신흥국'...향후 10년 지배할 10개국 어디?,"트럼프 대통령이 국제유가가 너무 높다며 석유수출국기구, OPEC에 대해 진정하라는 트윗을 올렸습니다. 그는 “세계는 유가 급등을 받아들일 수 없다. 취약하다”고 강조했는데요, 이 같은 트럼프 대통령의 경고에 유가가..."
1324,2019.02.20.,"바닥 다진 한화케미칼, ""올해는 빛 볼 것""","주력 사업인 기초소재부문에선 지난해 국제 유가가 급상승하면서 원재료 부담이 커진데다, 전 제품에 걸친 공급량 증가, 수요 약세 등이 겹치며 스프레드(원료와 최종제품의 가격차이)가 축소됐다.특히 전통적인..."
1325,2019.02.21.,반도체發 '수출 쇼크' 현실로…수출 의존 기업 '비상등',우리 경제 버팀목인 반도체 수출이 단가 하락의 직격탄을 맞은 데다 국제유가 약세로 석유제품마저 두 자릿수 감소율을 보이며 전반적 수출 부진을 이끄는 모양새다. 여기에 미ㆍ중 무역 분쟁에 따른 중국 경기 둔화...
1326,2019.03.04.,"LNG, 2019년 수요 전년보다 감소…장기적 수익 전망은 ‘양호 유지’","이렇듯 2019년은 전반적인 LNG 수요 위축이 예상되지만, 국제유가 약세기조, 에너지 세제개편 등으로 LNG 가격경쟁력이 상승할 것으로 예상돼 가스업계에 대한 긍정적인 시각은 유효하다. 특히 유가에 주로 연동되는..."
1327,2019.02.28.,(경제브리핑) 울산 1월 수출 8.1% 증가,◀ＡＮＣ▶ 국제 유가 하락 속에서도 울산의 1월 수출이 4개월 연속 증가세를 이어갔습니다. 석유제품과 자동차 수출이 두자릿수 증가하며 수출을 견인했습니다. 조창래 기자입니다. ◀ＥＮＤ▶ ◀ＶＣＲ▶ 울산의...
1328,2019.02.19.,수출물가 석달 연속↓…반도체 7년 5개월만에 최대 폭 하락,"지난달 국제유가가 상승세로 방향을 틀며 수입물가를 소폭 밀어 올렸습니다. 중동산 원유 가격의 기준이 되는 두바이유는 지난달 기준 배럴당 59.09달러로 전월 대비 3.1% 올랐습니다. 한은 관계자는 ""유가 상승이..."
1329,2019.02.27.,[뉴욕증시] 무역협상 관망·경제지표 부진에 하락,"<상품시장> 오늘 국제유가 어제의 낙폭을 딛고 상승했습니다. 오펙이 베네수엘라와 이란 등 동맹국들과 다시 한번 감산 추진을 한다고 밝히며 상승했는데요, WTI 0.05% 상승한 55.50 달러에 거래 됐구요, 브렌트유는 0.49..."
1330,2019.02.27.,[뉴욕증시] 무역협상 관망·경제지표 부진에 하락,"<상품시장> 오늘 국제유가 어제의 낙폭을 딛고 상승했습니다. 오펙이 베네수엘라와 이란 등 동맹국들과 다시 한번 감산 추진을 한다고 밝히며 상승했는데요, WTI 0.05% 상승한 55.50 달러에 거래 됐구요, 브렌트유는 0.49..."
1331,2019.02.27.,[모닝브리핑] 오늘 베트남서 '북미 핵담판' 돌입…美금리 당분간 동결될 듯,"◆ 국제유가 소폭반등…'트럼프 트윗發 급락' 벗어나 전날 급락했던 국제유가가 소폭 반등했습니다. 뉴욕상업거래소에서 4월 인도분 서부 텍사스산 원유(WTI)는 전일 대비 배럴당 0.05% 상승한 55.50달러, 런던 ICE..."
1332,2019.02.26.,"채권 전문가 ""한은 2월 기준금리 동결할 것, 채권시장 전망은 보합""","국제 유가 하락의 영향으로 소비자물가 상승률은 낮아졌지만 체감물가가 여전히 높다는 인식이 있었다. 환율 BMSI는 원화 강세에 102로로 전월(100)보다 2p 소폭 상승했다. 이에 대해 금투협 관계자는 ""미ㆍ중 간..."
1333,2019.03.06.,"기재차관 ""추경 편성 여부 관계부처 협의 통해 결정""","올해 5월로 끝나는 유류세 한시 인하 조치의 연장 여부에 대해서도 ""그동안 두바이유 기준으로 국제유가가 꽤 떨어졌다가 최근 65달러 수준에 머물고 있는데 원칙적으로 한시적 인하였기 때문에 그때(5월) 가서 판단할..."
1334,2019.02.14.,"아시아나, 지난해 4Q 적자전환…연간 매출은 사상 최대(종합)",회사 측에 따르면 국제유가 상승으로 인해 전년 대비 유류비가 4327억원 증가했다. 당기순손실은 외화환산차손실로 인해 104억원을 기록했다. 아시아나항공의 여객부문은 2018년 국제선 여객수요 호조로 전년 대비 7...
1335,2019.02.27.,바닥친 정제마진 ‘요지부동’…정유사 볕들 날 언제?,국제유가가 상승세로 전환한 점은 긍정적인 요소다. 지난해 미국 정부의 저유가 정책으로 유가는 급락했고 정유사들의 재고평가 손실은 크게 늘었다. 통상 원유는 2~3개월 전에 구입하고 가공을 거쳐 판매한다. 원유를...
1336,2019.02.19.,수출물가 3개월째 하락…반도체 7년5개월만에 최대 폭 감소,"올해 1월 국제유가가 상승세로 반등하며 수입물가를 소폭 끌어올린 것으로 분석된다. 특히, 중동산 원유 가격의 기준이 되는 두바이유는 지난 1월 기준 배럴당 59.09달러로 전달 대비 3.1% 올랐다. 2018년 12월엔 12.6..."
1337,2019.02.22.,"[뉴욕마감]美경제지표 부진, 무역협상 주목하며 하락마감",국제유가는 미국의 산유량이 증가하면서 하락했다. 이날 뉴욕상업거래소(NYMEX)에서 4월 인도분 서부 텍사스산 원유(WTI)는 배럴당 0.20달러(0.4%) 하락한 56.96달러에 거래를 마쳤다. 런던 ICE 선물거래소의 4월물...
1338,2019.02.18.,단순하고 즉흥적인 트럼프式 말투 왜?,지난달 초 김정은 북한 국무위원장으로부터 친서를 받았을 때도 썼고 지난해 11월 국제 유가가 하락했을 때도 “유가가 낮아지고 있다. 멋지다”고 트위터에 썼다. 그의 이런 단순하고 즉흥적인 말버릇은 종종 비판의...
